time,rank,song_id,title,singers,album,date,genre,creator,lyric
2008.05.18~05.24,1,1851229,"서커스 (Feat. 임유경 - 달래 음악단 , ＄howgun)",MC몽,Show`s Just Begun,2008.04.17,Rap / Hip-hop,MC몽,찬바람 불 때 내게 와 줄래 세상이 모질게 그댈 괴롭힐 때 신나게 놀자 웃자 한바탕 하 하 하 하 하 하 이 밤이 다 할 때까지 일명 악바리  나 돈벌이에 충실했던 예능계의 별이요  까불대던 몽이요 빛 따라 흔들흔들  따라갔던 딴따라 초심을 잃지 말고  음악하란 벌이다 관객들은 제페토  몽이는 피노키오 가끔은 대중을  속고 속이는 피노키오 거짓과 진실 그대들의 답이요 길고 짧은 건 눈대중으로 대충 키 높이요 Ready get set go  대포로 발사 온 몸을 날려 버리고 Ready get set go  대포로 발사 눈물을 날려 버리고 아무리 뻔뻔한 시츄에이션 엇갈리더라도 Just have some fun Show's Just begun 4번째 앨범 몽이와 함께  서커스에 모두 Welcome 찬바람 불 때 내게 와 줄래 세상이 모질게 그댈 괴롭힐 때 신나게 놀자 웃자 한바탕 하 하 하 하 하 하 이 밤이 다 할 때까지 전 국민 좌절금지  프로젝트 서커스 음악에 오직 그대만을  비춘 포커스 일등과 꼴찌 승자와 패자 칼이라도 뽑았으면  무라도 베자 눈물조차 아까워서  메마른 사람들 방 한 칸에 허덕여서  가난한 사람들 시련에 쓰린 상처  통곡한 사람들 전국민 좌절금지  프로젝트 서커스 Ready get set go  대포로 발사 온 몸을 날려 버리고 Ready get set go  대포로 발사 눈물을 날려 버리고 어차피 인생은  시트콤 누가 뭐라건 자기 밥그릇은  정해져 있는 법 Show's Just begun 4번째 앨범 몽이와 함께  서커스에 모두 Welcome 찬바람 불 때 내게 와 줄래 세상이 모질게  그댈 괴롭힐 때 신나게 놀자 웃자 한바탕 하 하 하 하 하 하 이 밤이 다 할 때까지 더 이상 울지 말아요 기가 막힌 세상 아픔은 잊어요 시간 맞춰 꼭 늦지 마세요 어서 모이세요  신나는 몽이 유랑단 찬바람 불 때 내게 와 줄래 세상이 모질게  그댈 괴롭힐 때 신나게 놀자 웃자 한바탕 하 하 하 하 하 하 신나는 몽이 유랑단
2008.05.18~05.24,2,1850242,One (Feat. 지선),에픽하이(EPIKHIGH),"Pieces, Part One",2008.04.17,Rap / Hip-hop,"Tablo,미쓰라진",ONE   Time is tickin′ T Time is   tickin′ tickin′   Time is tickin′ T Time is   tickin′ away   그대 눈물이 볼에 쏟아지는걸   이유 없이 쏟아지는걸   아무도 모르죠 심장 속에   유리조각 폭풍이 몰아치는걸   상처가 병이 돼서 모든 문이   벽이 돼서   거울속의 내가 적이 돼서 아프죠   아무도 그댈 모르게 가두고   숨을 조르게 놔두고   끝을 고르게 만들죠 참 나쁘죠   이 세상 속에 설 이유 없앴죠   돌아 갈 길을 선택도 없이   마냥 걷겠죠   네 마음보다 그대 숨이   먼저 멎겠죠   상처 흉터 눈물이 흐르고   죽음 속을 헤매던 널 내가   구해줄게   You are the one   어둠속을 걷고 있을 때   어둠속에 니가 사로잡힐때   내 숨이 같이해   넌 나의 구원   내게 손을 건네준 그대   세상속에 문이 네게 닫힐때   내손을 바칠게   you are the one 넌 나의 구원   you are the one 넌 나의 구원   you are the one 넌 나의 구원   나의 구원   Time is tickin′ T   세상에 불을 지른 그대 손이죠   사람들의 눈가림은 그대 몫이죠   그대 눈에 비추던 고통이란   별이 그대 도시죠   아직도 꿈을 베나요 숨을   세나요 쏟아버린 눈물   깊이를 재나요   희망은 가라앉는 종이   배인가요 슬프죠   혹시 밤에 땀에 흠뻑 젖어   깨나요 양심이 땅에 기며   버벅 되나요   끝이라고 생각되나요 괜찮아요   ′cause I understand   내가 고장난 그 몸의 흉터   산산조각난 그 혼의 숨겨버린   눈물도 지워줄게요   그대 손을 내 손에 움켜쥐고   믿어줄게요   상처 흉터 눈물이 흐르고   죽음 속을 헤매던 널 내가   구해줄게   You are the one   어둠속을 걷고 있을 때   어둠속에 니가 사로잡힐때   내 숨이 같이해   넌 나의 구원   내게 손을 건네준 그대   세상속에 문이 네게 닫힐때   내손을 바칠게   you are the one 넌 나의 구원   you are the one 넌 나의 구원   you are the one 넌 나의 구원   나의 구원   상처가 있나요 흉터가   있나요 어둠속에서 헤매고   있나요   상처가 있나요 흉터가 있나요   Faith Destiny Love   you′re still beautiful to me   You are the one   어둠속을 걷고 있을 때   어둠속에 니가 사로잡힐때   내 숨이 같이해   넌 나의 구원   내게 손을 건네준 그대   세상속에 문이 네게 닫힐때   내손을 바칠게   Time is tickin′ T Time is   tickin′ tickin′   Time is tickin′ T Time is   tickin′ tickin′   Time is tickin′ T Time is  tickin′ away 나의 구원 ONE
2008.05.18~05.24,3,1861639,화분 (알렉스 Ver.) (우리결혼했어요 삽입곡),알렉스,화분,2008.05.06,Ballad,강현민,멀리서 멀리서 멀리서 그대가 오네요  이 떨리는 마음을 어떻게 말해야 하나요 그댄 처음부터 나의 마음을 빼앗고 나을 수 없는 병을 내게 주었죠 화분이 될래요 나는 늘 기도하죠 난 그대 작은 창가에 화분이 될게요 아무 말 못해도 바랄 수 없어도 가끔 그대의 미소와 손길을 받으며 잠든 그대 얼굴 한 없이 볼 수 있겠죠 멀리도 멀리도 멀리도 그대가 가네요  떨어지는 눈물을 어떻게 달래야 하나요 그댄 처음부터 나의 마음을 가졌고 나을 수 없는 병을 앓게 한거죠 화분이 되고픈 나는 늘 기도하죠 난 그대 작은 창가에 화분이 될게요 아무 말 못해도 바랄 수 없어도 가끔 그대의 미소와 손길을 받으며 잠든 그대 얼굴 한 없이 볼 수 있겠죠  난 그대 작은 창가에 화분이 될게요 아무 말 못해도 바랄 수 없어도 가끔 그대의 미소와 손길을 받으며 잠든 그대 얼굴 한 없이 볼 수 있겠죠 난 그대 작은 창가에 화분이 될게요 아무 말 못해도 바랄 수 없어도 가끔 그대의 미소와 손길을 받으며 잠든 그대 얼굴 한 없이 볼 수 있겠죠
2008.05.18~05.24,4,1850253,우산 (Feat. 윤하),에픽하이(EPIKHIGH),"Pieces, Part One",2008.04.17,Rap / Hip-hop,"Tablo,미쓰라진",어느새 빗물이 내 발목에 고이고 참았던 눈물이 내 눈가에 고이고 I cry 텅빈 방엔 시계소리 지붕과 입 맞추는 비의 소리 오랜만에 입은 코트 주머니속에 반지 손틈새 스며드는 memory 며칠만에 나서보는 밤의 서울 고인 빗물은 작은 거울 그 속에 난 비틀거리며 아프니까 그대 없이 난 한쪽 다리가 짧은 의자 둘이서 쓰긴 작았던 우산 차가운 세상에 섬 같았던 우산 이젠 너무 크고 어색해 그대 곁에 늘 젖어있던 왼쪽어깨 기억의 무게에 고개 숙여보니 버려진듯 풀어진 내 신발끈 허나 곁엔 오직 비와 바람 없다 잠시라도 우산을 들어 줄 사람 and I cry 어느새 빗물이 내 발목에 고이고 참았던 눈물이 내 눈가에 고이고 I cry 그대는 내 머리위에 우산 어깨위에 차가운 비 내리는 밤 내 곁에 그대가 습관이 되어버린 나 난 그대없이는 안돼요 alone in the rain 하늘의 눈물이 고인 땅 별을 감춘 구름에 보인 달 골목길 홀로 외로운 구두 소리 메아리에 돌아보며 가슴 졸인 맘 나를 꼭 닮은 그림자 서로가 서로를 볼 수 없었던 우리가 이제야 둘인가 대답을 그리다 머리 속 그림과 대답을 흐린다 내 눈엔 너무 컸던 우산 날 울린 세상을 향해 접던 우산 영원의 약속에 활짝 폈던 우산 이제는 찢겨진 우산 아래 두 맘 돌아봐도 이제는 없겠죠 두 손은 주머니 속 깊게 넣겠죠 이리저리 자유롭게 걸어도 두 볼은 가랑비도 쉽게 젖겠죠 어느새 빗물이 내 발목에 고이고 참았던 눈물이 내 눈가에 고이고 I cry 그대는 내 머리위에 우산 어깨위에 차가운 비 내리는 밤 내 곁에 그대가 습관이 되어버린 나 난 그대없이는 안돼요 alone in the rain 난 열어놨어 내 맘의 문을 그댄 내 머리 위에 우산 그대의 그림자는 나의 그늘 그댄 내 머리 위에 우산 난 열어놨어 내 맘의 문을 그댄 내 머리 위에 우산 그대의 그림자는 나의 그늘 그댄 내 머리 위에 우산 나의 곁에 그대가 없기에 내 창밖에 우산을 들고 기다리던 그대 I cry 그대는 내 머리위에 우산 어깨위에 차가운 비 내리는 밤 내 곁에 그대가 습관이 되어버린 나 난 그대없이는 안돼요 그대는 내 머리위에 우산 어깨위에 차가운 비 내리는 밤 내 곁에 그대가 없는 반쪽의 세상 그댄 나 없이는 안돼요 forever in the rain
2008.05.18~05.24,5,1854856,라라라,SG워너비,My Friend,2008.04.24,Ballad,안영민,그대는 참 아름다워요  밤 하늘의 별빛보다 빛나요  지친 나의 마음을 따뜻하게 감싸줄  그대 품이 나의 집이죠  세찬 바람 앞에서  꺼질듯한 내 사랑도  잘 참고서 이겨내줬어요  정말 눈물나도록 고마운 맘 아나요  그대 내곁에 살아줘서  사랑해요 사랑해요  내가 그대에게 부족한걸 알지만  세월에 걷다보면 지칠때도 있지만  그대의 쉴곳이 되리라  사랑해요 고마운 내 사랑  평생 그대만을 위해 부를 이노래  사랑 노래 함께 불러요  둘이서 라라라    그대 쳐진 어깨가 내맘을 아프게해요  잘 해준것도 없는 나라서  그대의 고운 손이 세월에 변했어요  못지켜줘서 미안해요  사랑해요 사랑해요  내가 그대에게 부족한걸 알지만  세월을 걷다보면 지칠때도 있지만  그대의 쉴곳이 되리라  사랑해요 고마운 내 사랑  평생 그대만을 위해 부를 이노래  사랑노래 함께 불러요  둘이서 라라라  고마워요 고마워요  그대 자신보다 나를 아껴준 사랑  세상이 등 돌려도 누가 뭐라고 해도  내가 그대 지켜줄게요  사랑해요 소중한 내사랑  평생 그대만을 위해 부를 이노래  사랑노래 함께 불러요  둘이서 라라라  그대 품이 나의 집이죠 영원히 라라라
2008.05.18~05.24,6,1841034,가슴으로 외쳐 (Rap Feat. Rhymer),먼데이키즈(MondayKiz),Inside Story,2008.03.31,Ballad,김도훈(RBW),니가 그리워 나를 버린 니가 너무나 미워 내 아픔 슬픔에 비해 쓰디쓴 술 한잔은 부드러워 이제는 짙은 어둠만이 나를 드리워 니가 그리워 나를 버린 니가 미워 내 아픔 슬픔에 흐르는 눈물이 안쓰러워 이제는 짙은 어둠만이 나를 드리워 사랑도 이별도 아린 상처까지도 모두 다 안겨준 고마운 사람 날 보던 미소도 아름다운 기억도 내게서 다 가져간 그대란 사람 Too far away 멀어진 사랑아 날 떠난 사랑아 왜 내게 아픔들만 Don't go away 오늘도 그대만 찾아 찾아 날 떠나지 말아 제발  눈물에 미움에 그댈 원망 해봐도 여전히 그대만 사랑할 사람 추억에 향기에 미칠것만 같아도 한숨에 다 보내고 죽어갈 사람 못 잊을 사람 Too far away 멀어진 사랑아 날 떠난 사랑아 왜 내게 아픔들만 Don't go away 오늘도 그대만 찾아 찾아 날 떠나지 말아 제발 여전히 너는 나의 darling 허나 이제는 갈린 그런 사이 내 모든 것들을 가지고 떠나가 슬픔 too far away 슬픔은 day by day 흐르는 눈물은 절대로 멈출수가 없어 can't stop 가슴은 널 원해 아직까지도 그러나 두 눈은 널 보내 정말 바보같이도 눈물로 덧칠해 미소는 겉치레 슬픔이 걷히게 오늘도 미쳐 소리쳐 가슴으로 외쳐 아직도 바래 원해 잊으려고 애를 써도 난 이제 안돼 버리지 못해 널 Too far away 멀어진 사랑아 날 떠난 사랑아 왜 내게 아픔들만 Don't go away 오늘도 그대만 찾아 찾아 날 떠나지 말아 제발 Too far away 이러지 말아줘 날 놓지 말아줘 이대론 살수없어 Good bye away 그 말만 말아줘 안돼 안돼 날 버리지 말아 제발 니가 그리워 나를 버린 니가 미워
2008.05.18~05.24,7,1836107,추억속의 그대,이승기,남자가 여자를 사랑할 때 Vol.2,2008.03.24,Ballad,윤상,희미해지는  지난 추억 속의 그 길을 이젠 다시 걸어볼 순 없다 하여도 이내 가슴에 지워버릴 수 없는 그때 그 모든 기억들 그대의 사랑이 지나가는 자리엔 홀로된 나의 슬픔 고독 뿐 그때가 다시 올 순 없어도 지나간 추억만은 영원히 다시 돌아올 수 없는 사랑에 홀로 돌이켜본 추억은 다만 아름답던 사랑 뿐 다시 돌아올 수 없는 사랑에 홀로 돌이켜본 추억은 다만 아름답던 기억 뿐 희미해지는  지난 추억 속의 그 길을 이젠 다시 걸어볼 순 없다 하여도 이내 가슴에 지워버릴 수 없는 그때 그 모든 기억들 그대의 사랑이 지나가는 자리엔 홀로된 나의 슬픔 고독 뿐 그때가 다시 올 순 없어도 지나간 추억만은 영원히 다시 돌아올 수 없는 사랑에 홀로 돌이켜본 추억은 다만 아름답던 사랑 뿐 다시 돌아올 수 없는 사랑에 홀로 돌이켜본 추억은 다만 아름답던 기억 뿐 다시 돌아올 수 없는 사랑에 홀로 돌이켜본 추억은 다만 아름답던 사랑 뿐 다시 돌아올 수 없는 사랑에 홀로 돌이켜본 추억은 다만 아름답던 기억 뿐 다시 돌아올 수 없는 사랑에 홀로 돌이켜본 추억은 다만 아름답던 사랑 뿐 다시 돌아올 수 없는 사랑에 홀로 돌이켜본 추억은 다만 아름답던 기억 뿐
2008.05.18~05.24,8,1857967,모두 다 쉿!,쥬얼리,Kitchi Island 2,2008.04.29,Dance,최갑원,여기 저기 날 보는 눈빛  이젠 그만 내게 뭘  더 바라니 내게 뭘 난 니 마음이 다 어떤지 알지 이젠 그만 내게 뭘  더 바라니 내게 뭘 볼 수는 있는 나지만 You like boy baby  You looking for something that 만질순 없는 나니까 Hey what you want boy 너는 내 눈에 그저 baby  Hey what you want boy 아직 멀었잖니  Hey what you want boy 새 하얀 우유나 더 마시고 오지 아무말도 하지 말고  빨리 사라져 boy L O V E 사랑 따윈 안할래 M O R E 내맘까진 안줄래 L O V E 사랑 따윈 안할래 M O R E 자유롭게 즐길래 살금 살금 다가오지 마 이젠 그만 내게 뭘 더 바라니  내게 뭘 나만 혼자만 내버려 둬 제발 이젠 그만 내게 뭘 더 바리니  내게 뭘 쉽게 날 생각하지마 You like boy baby  You looking for something that 더 이상 관심 갖지마 Hey what you want boy 나를 정말로 사랑하니  Hey what you want boy 오직 나뿐이니  Hey what you want boy 새까만 거짓말 늘어놓지 말지 남자들은 다 똑같아  Hey what you want boy 너는 내 눈에 그저 baby  Hey what you want boy 아직 멀었잖니  Hey what you want boy 새 하얀 우유나 더 마시고 오지 아무말도 하지말고 빨리사라져 boy Shake ya I get sexy ladies  all over the floor Walk it walk it walk it out  sexy sexy sexy girl Walk that body baby  now break it down I just want to touch me  Let me talk to you Bring it on 날 아는 척은 하지마 You like boy baby  You looking for something that 널위한 내가 아니야 Hey what you want boy 나를 정말로 사랑하니  Hey what you want boy 오직 나뿐이니  Hey what you want boy 새까만 거짓말 늘어놓지 말지 남자들은 다 똑같아  Hey what you want boy 너는 내 눈에 그저 baby  Hey what you want boy 아직 멀었잖니  Hey what you want boy 새하얀 우유나 더 마시고 오지 아무말도 하지말고 빨리사라져 boy L O V E 사랑 따윈 안할래 M O R E 내맘까진 안줄래 L O V E 사랑 따윈 안할래 M O R E 자유롭게 즐길래 자 모두다 쉿
2008.05.18~05.24,9,1841036,발자국,먼데이키즈(MondayKiz),Inside Story,2008.03.31,Ballad,"한상원,이지은",한 발자국을 못 가 멈춘 다시 한 발자국 못가 멈춘 몇 걸음 다시 떼다 멈춘 가슴이 울다 떠나간 니 발자국 따라 몇 번 울다 또 다시 멈춘 채로 몇 번 울다 도대체 나는 몇 번이나 울다 눈에는 또 눈에는 눈물이 가득차서 흐르다가 한걸음을 내밀고 두 걸음에도 마지막 발걸음에도 떨어지지 않는 이 발보다 그대를 못 잊어서 또 다시 한마디를 내뱉고 두 마디에 난 그대를 보내네 새하얗게 새하얗게 너를 보내  토라져버린 맘을 돌려 너를 보다 또 다시 고갤 돌려 너를 보다 이렇게 너를 몇 번이나 보다 끝내도 또 끝내도 내 발이 내 마음이 그댈 찾아 한걸음을 내밀고 두 걸음에도 마지막 발걸음에도 떨어지지 않는 이 발보다 그대를 못 잊어서 또 다시 한마디를 내뱉고 두 마디에 난 그대를 보내네 새하얗게 새하얗게 너를 보내 아니라고 잊었다고 아픔을 참고 보내도 그리운 맘에 발길이 돌아서도 못가고 애타게 그 이름을 불러도 모르잖아  한사람은 외로워 두사람으로 영원히 함께 하자고 손가락이 했던 그 약속도 여전히 못 잊어서 또 다시 한글자를 내뱉고 두글자에 난 사랑을 말하네 너를 두고 너를 두고 내가 간다 한걸음을 내밀고 두 걸음에도 마지막 발걸음에도 떨어지지 않는 이 발보다 그대를 못 잊어서 또 다시 한마디를 내뱉고 두 마디에 난 그대를 보내네 새하얗게 새하얗게 너를 보내
2008.05.18~05.24,10,1797709,아이처럼,김동률,Monologue,2008.01.24,Ballad,김동률,사랑한다 말하고 날 받아줄 때엔 더 이상 나는 바랄게 없다고 자신 있게 말해놓고 자라나는 욕심에 무안해지지만 또 하루 종일 그대의 생각에 난 맘 졸여요 샘이 많아서 아이처럼 겁이 많아서 바보처럼 이렇게 나의 곁에서 웃는 게 믿어지지가 않아서 너무 좋아서 너무 벅차서 눈을 뜨면 다 사라질까봐 잠 못 들어요  주고 싶은데 내 모든 걸 받고 싶은데 그대 맘을 남들처럼 할 수 있는 건 다 함께 나누고 싶은데 맘이 급해서 속이 좁아서 괜시리 모두 망치게 될까봐 불안해하죠  웃게 해줘서 아이처럼 울게 해줘서 바보처럼 이런 설렘을 평생에 또 한번 느낄 수 있게 해줘서 믿게 해줘서 힘이 돼줘서 눈을 뜨면 처음으로 하는 말 참 고마워요 내게 와줘서 꿈꾸게 해줘서 우리라는 선물을 준 그대 나 사랑해요
2008.05.18~05.24,11,1826467,미안해요 (Feat. T.O.P),거미,Comfort,2008.03.12,R&B / Soul,KUSH,아침이 밝아오면 난 그댈 다시 볼 수 있나요 첫만남 그 순간처럼 그댈 다시 사랑할게요 얼마나 많은 시간이 우리를 지나가고 지나가던 사람들 모두 우릴 축복했죠 어쩐지 오늘은 왠지 그대의 빈자리가 너무도 커 하루종일 눈물만 흘렸죠 미안해요 그대를 아프게해서 미안해요 해준게 너무 없어서 미안해요 그대를 잊지 못해서 미안해요 하지만 오늘은 꼭 한번 그댈 보고싶어요 많은 여자 중 내눈에서 들어온 넌 마치 영화 속의 주인공 그녀의 아름다움은 절대 뿌리칠 수 없었네 그런 너에게 상처를 주다니 미친듯이 후회해도 늦었지 니 눈물을 모두다 거둬줄게 날 용서해 부탁해 무릎꿇게 제발 내게 기횔줘 미안해서 끄적이던 편지들을 다 찢어 버렸어 그냥 할말이 있어 잠시 내게 시간을 줘 아직 그대 가슴 속에 날 원하고 있다면 행복했던 그날처럼 다시 꼭 안아줄게요 지나간 많은 날들이 그대를 힘들게해 아프게해 아무도 손내밀지 않아도 언제나 빌어줄게요 그대를 더이상 힘들게 하지 않을게 미안해요 그대를 아프게해서 미안해요 해준게 너무 없어서 미안해요 그대를 잊지 못해서 미안해요 하지만 오늘은 꼭 한번 그댈 보고싶어요 얼마나 많은 아픔과 얼마나 많은 고통과 얼마나 많은 눈물이 그대를 견뎌냈을까 얼마나 많은 아픔과 얼마나 많은 고통과 얼마나 많은 미움이 그대를 아파하려 들려 했을까 미안해요 그대를 아프게해서 미안해요 해준게 너무 없어서 내가 미안해요 그대를 잊지 못해서 정말 미안해요 사랑해요
2008.05.18~05.24,12,1833966,기억을 걷는 시간,넬(NELL),Separation Anxiety,2008.03.21,Rock,,아직도 너의 소리를 듣고  아직도 너의 손길을 느껴  오늘도 난 너의 흔적 안에 살았죠 아직도 너의 모습이 보여  아직도 너의 온기를 느껴  오늘도 난 너의 시간 안에 살았죠 길을 지나는  어떤 낯선이의 모습속에도  바람을 타고 쓸쓸히  춤추는 저 낙엽위에도  뺨을 스치는 어느 저녁의  그 공기속에도  내가 보고 듣고 느끼는  모든 곳에 니가 있어  그래 어떤가요  그대 어떤가요 그댄  당신도 나와 같나요  어떤가요 그대 지금도  난 너를 느끼죠 이렇게  너를 부르는 지금 이순간도  난 그대가 보여 내일도 난 너를 보겠죠 내일도  난 너를 듣겠죠 내일도  모든게 오늘 하루와 같겠죠 길을 지나는  어떤 낯선이의 모습속에도  바람을 타고 쓸쓸히  춤추는 저 낙엽위에도  뺨을 스치는 어느 저녁의  그 공기속에도  내가 보고 듣고 느끼는  모든 곳에 니가 있어  그래 어떤가요  그대 어떤가요 그댄  당신도 나와 같나요  어떤가요 그대  길가에 덩그라니 놓여진  저 의자위에도  물을 마시려 무심코  집어든 유리잔 안에도  나를 바라보기위해  마주한 그 거울속에도  귓가에 살며시  내려앉은 음악속에도  니가있어  어떡하죠 이젠 어떡하죠 이젠  그대는 지웠을텐데  어떡하죠 이젠 우린  랄라라 라랄라랄라  랄라라 라랄라랄라  랄라라 라랄라랄라  어떡하죠 이젠  랄라라 라랄라랄라  랄라라 라랄라랄라  랄라라 라랄라랄라라  어떡하죠 이젠  그리움의 문을 열고  너의 기억이 날 찾아와  자꾸 눈시울이 붉어져  어떡하죠 이젠  그리움의 문을 열고  너의 기억이 날 찾아와  자꾸만 가슴이 미어져  어떡하죠 이젠  그리움의 문을 열고  너의 기억이 날 찾아와  자꾸 눈시울이 붉어져  어떡하죠 이젠  그리움의 문을 열고  너의 기억이 날 찾아와  자꾸만 가슴이 미어져  어떡하죠 이젠  랄라라 라랄라랄라  랄라라 라랄라랄라  랄라라 라랄라랄라  랄라라 라랄라랄라 랄라라 라랄라랄라 랄라라 라랄라랄라 랄라라 라랄라랄라 랄라라 라랄라랄라 랄라라 라랄라랄라 랄라라 라랄라랄라 랄라라 라랄라랄라 랄라라 라랄라랄라
2008.05.18~05.24,13,1815605,그대만이 (MBC `우리 결혼했어요` 알렉스&신애 테마곡),김종욱,For A Long Time..,2008.02.28,Ballad,안영민,그대만이 날 웃게하고 그대만이 날 감싸줘요  그대만이 그대만이 보석보다 빛나는걸  햇살보다 눈이 부시고  바다보다 마음이 넓어요    그대만이 그대만이 나를 살게 하네요  그대를 만나려고 머나먼 별을 지나서  이렇게 멀리 돌아왔나봐요  사랑하는 마음 하나로 뜨거운 저 햇살처럼  식지 않는 그대의 마음을 내게 주세요    가난했던 내 사랑을 줘도 넘치도록 주던 사람  그대만이 그대만이 내게 행복을 줄 한 사람    그대 눈이 반짝이네요 별이 빛나는것 같아요  그대 입술 그대 두손 미운데가 하나없죠  우리서로 닮아가네요 서로에게 행복만 주네요    그대에게 그대에게  해줄말이 있어요. 고맙다는 말 했나요  우리 사랑하는 동안 난 항상 미안한 마음 뿐인데  사랑하는 마음 하나로 뜨거운 저 햇살처럼  식지않는 그대의 마음을 내게 주세요    가난했던 내 사랑을 줘도 넘치도록 주던 사람  그대만이 그대만이 내게 행복을 줄 한사람    내 삶을 전부 다준다해도 아까울것 없는 사람  그대만이 그대만이 내가 살아갈 이유인 걸
