time,rank,song_id,title,singers,album,date,genre,creator,lyric
2009.02.01~02.07,67,2049362,웃으며 안녕,이석훈,SG Wannabe ＆ 숙희,2009.02.05,Ballad,강은경,떠나가는 걸음 막아서라도 널 붙잡고 싶지만 알고있어 너를 보내줘야할 그 순간이 왔나봐 뒤돌아서 눈물 흘리겠지만 니 앞에서 만큼은 울지 않아 사랑했어 내 소중한 사람 행복했어 함께한 모든날 그걸로 난 충분하니까 너만 행복하다면 목이 메어와도 웃으며 안녕  슬픔속에 비틀거리겠지만 조금도 너를 원망하지 않아 사랑했어 내 소중한 사람 행복했어 함께한 모든 날 그걸로 난 충분하니까 너만 행복하다면 목이 메어와도 웃으며 안녕 나의 기억 다른건 다 지운다해도 마지막 모습만은 남겨지게 세상 가장 멋진 미소로 떠나는 그 길에 배웅하고싶어 행복하길 그 어디에서든 아름답길 그 언제까지나 새로 시작될 니 사랑과 지난 추억을 위해 가슴 미어져도 웃으며 안녕 너를 위해서 웃으며 안녕
2009.02.01~02.07,68,2040668,Lovely (Feat. 지은),수호,LoveLy,2009.01.29,Rap / Hip-hop,수호,yeah hey yo ma lovely you ready Say I love you ma baby I need you ma lovely 사랑을 영원히 you you and you you Say I love you ma baby I need you ma lovely 사랑을 영원히 you you and you you 작고 귀여운 넌 나만의 only girl 눈 코 입 몸매 모두 최고의 비쥬얼 마음은 또 여린걸 너무나도 착한걸 날 미치게 만드는 난 너뿐인걸 세상과 바꾸자 그래도 난 상관없다 목숨을 바친다 난 너의 수호천사 언제나 너에게 난 달리고 달린다 사랑을 향해 또 외치고 또 외친다 I 아 아이 나 아무도 모르게 love 럽 럽 난 너만이 들리게 you u u 난 이렇게 외칠께 I love u ma lover loving u Say I love you ma baby I need you ma lovely 사랑을 영원히 you you and you you Say I love you ma baby I need you ma lovely 사랑을 영원히 you you and you you I love you I need you 나의 심장은 두근 거리는 내 힙합 beat 너의 눈빛은 이미 끈적한 알엔비 이 밤을 가득히 채워줄 하모니 우리 둘이 라면 oh 넬리와 켈리 oh bady 그댈 안아줄 뜨거운 body oh laby 그댈 지켜줄 영혼의 반지 입맞춘채 이렇게 난 노래를 또 부르지 사랑해 널 사랑해 미치도록 사랑해 I 아 아이 나 아무도 모르게 love 럽 럽 난 너만이 들리게 you u u 난 이렇게 외칠께 I love u ma lover loving u Say I love you ma baby I need you ma lovely 사랑을 영원히 you you and you you Say I love you ma baby I need you ma lovely 사랑을 영원히 you you and you you 사랑해 아무도 모르게 널 사랑해 너만이 들리게 난 이렇게 외칠께 사랑해 널 사랑해 미치도록 사랑해 사랑해 아무도 모르게 널 사랑해 너만이 들리게 난 이렇게 외칠께 사랑해 널 사랑해 미치도록 사랑해
2009.02.01~02.07,69,2018769,사랑을 해도 외롭다,태인,사랑을 해도 외롭다,2009.01.09,Ballad,"태인,오세욱",날 사랑하지 않아 그 사람 사랑을 해도 해도 난 외롭다 Go go 다 필요없어 네겐 사랑이 없어 나를 바라보겠다던 너의 전혀 느껴지질 않아 나만 혼자 이렇게 남아 널 기다리다 울고만다 가슴 아프게 여잔 외로움이 많아 남잔 그런걸 너무 몰라 꼭 말하고 말해줘야 알수가 있니 외롭다 늘 니가 그립다 날 사랑한다 말해도 내 곁에는 없어 너 이러면 안돼 넌 내 남자인데 너 자꾸 이러면 나 울 것만 같아 정말 내가 사랑했던만큼 니가 점점 멀어지잖아 내가 외로웠던만큼 이젠 버틸 수가 없잖아 이렇게 울고있는 나를 지켜내질 못할거면서 왜 했어 이제 더 이상 필요없어 떠나버려 바람부는 날엔 내가 너를 떠나가 더 이상은 미련없잖아 내게 두손 빌고 무릎 꿇고 꿇고 꿇어 봐도 내가 용서하지 않을거야 절대 그래 내 앞에서 울며불며 잡게 너를 만들거야 후회하며 살게 마지막이야 내가 기횔줄게 이젠 너 없이도 살아 그게 익숙하고 좋아 널 기다리다 지쳐간다 나도 모르게 여잔 눈물이 너무 많아 남잔 그런걸 너무 몰라 왜 뒤늦게 헤어지고 후회하는지 외롭다 늘 니가 그립다 날 사랑한다 말해도 내곁에는 없어 너 이러면 안돼 넌 내 남자인데 너 자꾸 이러면 나 울 것만 같아 정말 내가 사랑했던 만큼 니가 점점 멀어지잖아 내가 외로웠던 만큼 이젠 버틸 수가 없잖아 이렇게 울고있는 나를 지켜내질 못할거면서 왜 했어 이제 더 이상 필요없어 떠나버려 날 사랑했냐고 날 버린거냐고 내가 살 수 없는걸 누구보다 넌 잘 알잖아 나 떠나간다고 날 잡지 말라고 내가 널 잡을지 몰라 내가 사랑했던만큼 니가 점점 멀어지잖아 내가 외로웠던만큼 이젠 버틸 수가 없잖아 이렇게 울고있는 나를 지켜내질 못할거면서 왜 했어 이제 더 이상 필요없어 떠나버려 사랑을 해도 사랑을 해도 나는 외롭다
2009.02.01~02.07,70,2031581,I`m Sorry (Feat. 태사비애),드림걸스,I`m Sorry,2009.01.20,Dance,,baby you are the one for me 세상 모두가 변한데도 tell me 영원한 사랑을 맹세해 tonight oh everynight 그댄 내 길을 밝혀 줄 유일한 별빛처럼 for my love 하루 하루 살아가는 sad my dreams I'm sorry I'm sorry baby I love you 이 세상 모든 것이 변한데도 baby I'm sorry baby I'm crazy 다신 너를 떠나지 않을게 I'm sorry I'm sorry baby you forgive me 너를 사랑해 baby I'm crying I can't live without you 너를 너무 사랑해선가봐 for my love baby you are the love for me 세상 마지막 순간에도 touch me 달콤한 입술이 하나가 되죠 oh forever I'm gonna give you my heart I'm not afraid ya can't you see It's my love will be together 아무것도 두렵지 않아 I'll die for you I'm sorry I'm sorry baby I love you 이 세상 모든 것이 변한데도 baby I'm sorry baby I'm crazy 다신 너를 떠나지 않을게 I'm sorry I'm sorry baby you forgive me 너를 사랑해 baby I'm crying I can't live without you 너를 너무 사랑해선가봐 for my love forgive me coz' I'm missing you baby com'on 한 걸음만 더 love is so cool and love is so hot I'm sorry I'm sorry baby I love you 이 세상 모든 것이 변한데도 baby I'm sorry baby I'm crazy 다신 너를 떠나지 않을게 I'm sorry I'm sorry baby you forgive me 너를 사랑해 baby I'm crying I can't live without you 너를 너무 사랑해선가봐 for my love
2009.02.01~02.07,71,1932604,1분 1초 (Feat. 타루),에픽하이(EPIKHIGH),Lovescream (소품집),2008.09.30,Rap / Hip-hop,"Tablo,미쓰라진",I can't let it go 어딜봐도 네   모습이 보이고  무너지는 내 맘   숨길 수가 없어 baby 단  1분 1초도   I can't let it go 어딜가도 네   목소리 들리고   부서지는 심장   숨 쉴 수가 없어 baby 단  1분 1초도   한 순간도 단 1분 1초도   그 날 넌 머리가 맘에 안 들고  눈이 부었다고 다시 잠들고 난 외투를 벗으며 말없이 삐지고  전화기를 들어 밥을 시키고 커튼을 치고 몇 시간이  지났는지도 모르고  watching DVD‘s just you and me 어깨에  기댄 너의 숨소리 난 나가지 않기를 잘했다고  생각했지 우습게도 이런 기억들이  아직도 날 괴롭힌다 문득 네가 했던 농담들이  기억나고 무너진다 아무것도 아닌 순간들이  오늘도 날 뒤엎는다 문득 네가 짓던 표정들이  기억나고 부서진다 I can`t let go go go  어딜 봐도 네 모습이 보이고 무너지는 내 마음 숨길  수가 없어 baby 단 1분 1초도 시간이 멈추고 심장이 멈춰도 I can`t let go go go  어딜 가도 네 목소리 들리고 부서지는 심장 숨 쉴 수가 없어 baby 단 1분 1초도 한 순간도 단 1분 1초도 그 어딜 가도 창가 옆  모퉁이 구석 자리에 앉을 때 손을 포개놓지  왼쪽 다리에 피곤해 하품할 때는  닦은 눈물을 보곤 해 그리곤 바보처럼 웃어  양 볼에 보조개 물을 마실 때는 항상  세워둔 새끼손가락 눈이 부셨어 윤기 나던  검은 머리카락 서툰 젓가락질조차  매력이라 말했어 부르튼 입술도 난  영원하길 바랬어 this is lov to the e  그 사소했던  기억이 마음을 뒤섞고  나를 뒤엎고  눈물은 끝이 없지  see 사랑은 폭풍도  흔들지 못하는 마음을  몰아치는 빗물 한 방울 the little memories  술잔처럼  비워진 투명해진 우리의  작은 추억들 돌이키려 돌아봐도 다신 만들 수 없는  그대와의 기억 어젯밤 꿈처럼 선명한데  날 떠났네 I can`t let go 어딜 봐도 네 모습이 보이고 무너지는 내 마음 숨길  수가 없어 baby 단 1분 1초도 시간이 멈추고 심장이 멈춰도 I can`t let go 어딜 가도 네 목소리 들리고 부서지는 심장 숨 쉴  수가 없어 baby 단 1분 1초도 한 순간도 단 1분 1초도 한 순간도 단 1분 1초도 한 순간도 단 1분 1초도 한 순간도 단 1분 1초도 I can`t let go I can`t let go  숨죽인 작은 속삭임도 한 순간도 달콤한  둘만의 비밀도 아름다웠던 만큼 슬펐던  그대와 나 내 눈물이 그대에게도  기억될 수 있을까 I can`t let go 둘만의  버릇과 습관도 한 순간도 그  아름다웠던 순간도 아직 한 순간도 단 1분 1초도 되돌릴 수가 없어 단 1분 1초도
2009.02.01~02.07,72,1993750,슈퍼맨 (Feat. 2AM 창민),마리오,슈퍼맨,2008.12.12,Rap / Hip-hop,"황성진,마리오",슈퍼 슈퍼 슈퍼맨 비가 오나 눈이 오나 내 곁에 있는 건 언제나 친구이기에 마지막까지 웃어주는 사람이기에 세상에 지쳐 넘어질 때도 사랑에 미쳐서 쓰러질 때도 웃으면서 손 내밀어 나를 일으켜 세우는 너는 나만의 슈퍼맨 짧은 전화 한 통화에 언제나 바람처럼 달려와 말없이 채워주는 소주잔에 채워지는 텅 빈 내 맘 고맙다는 그 말 하지 않아도 굳이 또 미안하단 그 말 하지 않아도 항상 내 손 잡아주는 너는 나만의 슈퍼맨 너와 나의 꿈으로 하나의 힘으로 세상 바꿔 보자던 어린 날의 친구야 소중한 친구야 우리 영원히 함께해 슈퍼 슈퍼 슈퍼맨 everybody call your name 이름 또한 훌륭해 영원한 나의 슈퍼맨 슈퍼 슈퍼 슈퍼맨 everybody love your name 모습 또한 늠름해 내 친구는 슈퍼맨 슈퍼 슈퍼 슈퍼맨 때론 가족보다 때로는 연인보다 더욱더 보고 싶을 때가 또 있어 나 곁에 있다는 그 사실 하나만으로도 힘이 돼 소중해 넌 나에겐 어떤 일이 있어도 영원토록 함께해 나의 눈물 닦아주고 나를 웃게 만드는 너는 나만의 슈퍼맨 한 두 번 주먹다짐에 싸우고 뒤돌아서 욕해도 어느새 어깨동무 하고 있어 너와 난 어쩔 수 없어 아무 말도 필요 없어 너와 나 서로의 눈빛 하나만 으로도 다 알아 항상 곁에 있어주는 너는 나만의 슈퍼맨 너와 나의 꿈으로 하나의 힘으로 세상 바꿔 보자던 어린 날의 친구야 소중한 친구야 우리 영원히 함께해 슈퍼 슈퍼 슈퍼맨 everybody call your name 이름 또한 훌륭해 영원한 나의 슈퍼맨 슈퍼 슈퍼 슈퍼맨 everybody love your name 모습 또한 늠름해 내친구는 슈퍼맨 누구보다 소중한 친구 무엇과도 못 바꿀 친구 어떤 일에도 웃어줄 친구 마지막까지 나와 함께 해줄 거라는 걸 고맙다는 그 말 하지 않아도 굳이 또 미안하단 그 말 하지 않아도 항상 내 손 잡아주는 너는 나만의 슈퍼맨 너와 나의 꿈으로 하나의 힘으로 세상 바꿔 보자던 어린 날의 친구야 소중한 친구야 우리 영원히 함께해 슈퍼 슈퍼 슈퍼맨 everybody call your name 이름 또한 훌륭해 영원한 나의 슈퍼맨 슈퍼 슈퍼 슈퍼맨 everybody love your name 모습 또한 늠름해 내 친구는 슈퍼맨
2009.02.01~02.07,73,1972517,Happy Together,"박지헌,강민경(다비치)",Happy Together,2008.11.27,Dance,,온 세상이 하얗게 아름답게 쌓이네요 지금 그대에게 전화해 고백할 거에요 그대 내게 와요 흰 눈처럼 내게 와요 하늘이 내게 내려준 선물 바로 그대인가봐 거리엔 익숙한 노래 라라라라 주위엔 온통 수많은 연인들 벨이 울리고 문이 열렸을 때 그대 서 있었죠 내겐 기적이었어요 사랑에 빠졌나봐 사랑인가봐요 심장소리 들리나요 내겐 매일이 행복이죠 그대 고마워요 우리 함께 해요 난 뭐든지 괜찮아요 아름다운 예쁜 추억들을 함께 만들어가요  콧노래가 나오네요 라라라라라라 다시 태어난 것 같죠 오늘은 지난해처럼 양말을 걸어둘 필요가 없어요 이미 내겐 그대라는 선물을 줬잖아요 사랑인가 봐요 심장소리 들리나요 내겐 매일이 행복이죠 그대 고마워요 우리 함께 해요 난 뭐든지 괜찮아요 아름다운 예쁜 추억들을 함께 만들어가요 오늘밤 난 그대의 따스한 품에 안겨서 어디든 가고 싶어 그대와 함께라면 온 세상이 하얗게 아름답게 쌓이네요 지금 그대에게 전화해 고백할 거에요 그대 내게 와요 흰 눈처럼 내게 와요 하늘이 내게 내려준 선물 바로 그대인가봐
2009.02.01~02.07,74,1926582,You,브라운아이드걸스,My style,2008.09.16,Dance,"김이나,미료",yeah yeah yeah yeah  그대는 내게 바람과 같네  돌아와 babe  Feeling me now  Feeling me now Baby  Feeling me now  Feeling me now  모르겠니 모르겠니 Baby  Ah Ah Ah Ah Ah  Ah Ah Ah Ah Ah  Ah Ah Ah Ah Ah  Ah Ah Ah Ah Ah  그에게 기대하는  습관은 버려두자  허황된 꿈들 가득 품은들  시간이 지나갈수록  너의 손해 뭔들  못하겠어  만약 그게 니게 된다면  애타겠어  지금 내가 이 상황 너라면  너도 사실 알지  그가 원한건 나이지  아까운 시간 체력 낭비  이젠 굿바이지  바로 나야 나  니가 아닌 나야 나  깜찍한 두 눈 도톰한 입술  그가 바란 나야  아냐 나야 나  너도 아닌 나야 나  매력 있는 눈 날씬한 다리  날 바라보잖아  Feeling me now  Feeling me now Baby  Feeling me now  Feeling me now You You  모르겠니 모르겠니 Baby  Ah Ah Ah Ah Ah  Ah Ah Ah Ah Ah  나를 보며 나만 보며  묘한 미소 짓는 저 얼굴을  아직도 넌 모르겠니 Baby  Ah Ah Ah Ah Ah  Ah Ah Ah Ah Ah  하하하하하 니가 날 모르지만  나는 널 알겠고  그의 맘도 알겠어  현실을 알게 꼭  말해줄게 난 계속  안타까워  그를 보는 너를 보면  like a fire  이글거려 너의 눈에  너의 눈에 맘에 몸에  너의 몸에 눈에 맘에  하지만 그의 팔에 안겨  미소 짓는 건 나네  미안하지만 내가 정리해줄게  맘이 아파도 속이 쓰려도  너는 내 남자야  미안하지만 다 말을 하자면  어젯밤에도 오늘 밤에도  함께 한건 나야  Feeling me now  Feeling me now Baby  Feeling me now  Feeling me now You You  모르겠니 모르겠니 Baby  Ah Ah Ah Ah Ah  Ah Ah Ah Ah Ah  나를 보며 나만 보며  묘한 미소 짓는 저 얼굴을  아직도 넌 모르겠니 Baby  Ah Ah Ah Ah Ah  Ah Ah Ah Ah Ah    You 어딜 보니 내가 여깄는데  You 나를 사랑한다고 말해줘  You 오늘밤도 니 옆은 내꺼야  Feeling me now  Feeling me now Baby  Feeling me now  Feeling me now Baby  Feeling me now  Feeling me now You You  모르겠니 모르겠니 Baby  Ah Ah Ah Ah Ah  Ah Ah Ah Ah Ah  나를 보며 나만 보며  묘한 미소 짓는 저 얼굴을  아직도 넌 모르겠니 Baby  Ah Ah Ah Ah Ah  Ah Ah Ah Ah Ah  Feeling me now  Feeling me now Baby
2009.02.01~02.07,75,2036053,니가 더 좋아,쥬얼리S,Sweet Song (Single),2009.01.28,Dance,,난 니가 좋아 I love you 난 니가 좋아 난 정말 멋져 난 니가 좋아 넌 정말 멋져 너도 아니라고 하지마 넌 너무 매력 있는 girl this something what you boy 코 높고 눈만 큰 남자보단 너의 반달 눈이 좋아 feel like an apple pie 느끼한 표정보단 따뜻한 그 손으로 날 꼭 안아줘 이런게 나에겐 소중해 잘생긴 것 보다 그 누가 뭐래도 누가 뭐라해도 나 니가 더 좋아 넌 정말 멋져 너무 매력이 넘쳐 그 누가 뭐래도 나 니가 더 좋아 넌 정말 멋져 행동 하나하나가 난 너만 보면 I think I'm in love 이대로 영원히 내곁에 있어줘 이 세상의 모든 멋진 남자들이 달콤하게 유혹해도 난 니가 더 좋아 I LOVE YOU 보면 볼수록 so fine 나도 모르게 니가 좋아 누가 뭐라고 하던 너는 나만의 only one 넌 딱 내 style 그 누구보다 니가 더 좋아 모두 아니라고 하지만 넌 너무 매력 있는 girl just wanna what you know 영화 속 주인공 몸짱 보다 편한 니 어깨가 좋아 don't way you hold me down 유행만 아는 매력없는 남자들 보다 넌 나만의 style 이런게 나에겐 소중해 그 어떤것 보다 누가 뭐라해도 나 니가 더 좋아 넌 정말 멋져 너무 매력이 넘처 그 누가 뭐래도 나 니가 더 좋아 넌 정말 멋져 행동 하나하나가 난 너만 보면 I think I'm in love 이대로 영원히 내곁에 있어줘 이 세상의 모든 멋진 남자들이 달콤하게 유혹해도 난 니가 더 좋아 I LOVE YOU this something what you boy and I just go let you go 내 곁에 있어줘 절대 변하지 말고 이대로 너와 나 let's right right day by day I think I falling in love 난 니가 좋아 넌 정말 멋져 너와 함께면 마음이 설레 니만큼 난 너를 간절히 원해 난 니가 좋아 넌 정말 멋져 모두 변해도 너 하나만은 아니길 바래 니가 더 좋아 넌 정말 멋져 너무 매력이 넘처 그 누가 뭐래도 나 니가 더 좋아 넌 정말 멋져 행동 하나 하나가 난 너만 보면 I think I'm in love 이대로 영원히 내곁에 있어줘 이 세상의 모든 멋진 남자들이 달콤하게 유혹해도 난 니가 더 좋아
2009.02.01~02.07,76,2021391,"미로 (Feat. 엄지원, TBNY)",진주,Pearlfect,2009.01.13,Ballad,"진주,김성현,얀키(Yankie),최석용",어디야 바쁜가보네 이거 들으면 연락좀 줘 알았지 달콤했던 너의 속삭임 사랑으로 착각했지 독사과 같던 위험한 너의 유혹이 나의 사랑은 시작됐지 두려워 하지 말라던 멋진 배려도 편지 눈물도 A ha 나만 몰랐었어 A ha 믿고 싶지 않아 너에게 생긴 새로운 존재를 이제 난 어떡해 가지말아요 나를 떠나가나요 나는 견딜 수가 없어요 가지말아요 나를 돌아봐줘요 그대 사랑이었던 나를 지금 몇번짼지 알아 왜 전화 안받아 왜 뭐하느라 전화 안받아 어디야 이거 들으면 빨리 연락 줘  도대체 뭐 때문에 그래 그날 밤 맞췄었던 Puzzle 헝클어진 조각을 벗겨 맞췄잖아 Castle in the sky 밤하늘 똑같잖아 변한 건 없어 달이 뜨고 지고 뜨거워진 술잔 속 바늘 삼켰어 한입에 널 녹였어 단 한숨에 근데 넌 너무 꽉 조여 숨도 못 쉬게 해 니 맘껏 욕해 나는 사랑 놀음에 타짜 자기야 나 피곤해 그냥 방 잡고 얘기하자 아무 말 말아줄래 우리관계에 얘기 어떤 친구에게 말해도 네게 신경 안 쓸 테니 I said 너를 사랑해 기다려 금방 와 걱정 마 너도 딴 남잘 이제 만나봐 지겹잖니 그 대신 깊이 들어가진 마 다시 돌아와야 해 그 땐 너만을 바라 볼 테니깐 you trust me 날 믿지 그녀는 신경 쓰지 마 I love you boo UH I love you too what A ha 나만 몰랐었어 A ha 믿고 싶지 않아 너에게 생긴 새로운 존재를 이제 난 어떡해 가지말아요 나를 떠나가나요 나는 견딜 수가 없어요 가지말아요 나를 돌아봐줘요 그대 사랑이었던 나를 어떻게 내 사랑을 이렇게 무참히 짓밟는거야 가지말아요 나를 떠나가나요 나는 견딜 수가 없어요 가지말아요 나를 돌아봐줘요 그대 사랑이었던 나를 가지말아요 나를 제발 가지말아요 제발 떠나지 마요
2009.02.01~02.07,77,1961948,"Anybody (Feat. Dynamic Duo, SAN E, J.Y. Park)",원더걸스,Anybody,2008.11.18,Ballad,,이별이 아니면은 안됐어 너 울었어 내 강제성 때문에 넌 나만 아니면 돼 Let's go I want nobody nobody but you Anybody Anybody but me I want nobody nobody but you Anybody Anybody but me 난 다른 사람은 싫어 니가 아니면 싫어 I want nobody nobody nobody nobody 나잇값 못하고 저렴하게 구는 내가 모험같은 사랑에 대범하지 못한 내가 너무 미워 매몰차게 아주 일방적으로 너를 쫓아낸 후에 내 맘은 인적 없는 폐가 나 홀로 그리움이란 벗과 술을 짜냈어 자꾸 초라해진 나란 존재 앞에서 널 사랑할 자격없는 놈이라며 울었어 이 비참하고 나약한 내 자격지심 앞에서 나 이를 꽉 물어 잘 나가겠다며 당당하게 니 앞에 꼭 나타나겠다며 궁상을 떨면서 힘 없이 뻣뻣하게 웃어 근데 현실은 안그래 난 또 눈썹 사이를 구겨 심장이 뻥 뚫려서 넘쳐나는 외로움들이 질질 새 근데 얇은 내 지갑은 거꾸로 서도 동전하나 새질 않아 난 또 빌빌대 I want nobody nobody but you Anybody Anybody but me I want nobody nobody but you Anybody Anybody but me 난 다른 사람은 싫어 니가 아니면 싫어 I want nobody nobody nobody nobody 뒤도 돌아보지말고 제발 나를 떠나 그리고 당분간은 전화기를 꺼놔 아니 차라리 전화번호를 바꿔놔 그래 그게 낫겠다 절대 나를 찾거나 하지 말아줘 현실에 눈을 떠 더 늦기전에 우리 사랑이란 불을 꺼 우리 좋은 추억마저 다 태워버릴까봐 겁이 나 그만해 아쉽지만 너 울먹이며 말해 너 없인 난 안돼 착각하지마 내가 없어야 넌 잘 돼 너 똑똑하잖아 한 번 더 생각해봐 너 꼼꼼하잖아 한 번 더 계산해봐 너무 불리해 사랑이란 도박은 불 보듯 뻔해 그 때 피눈물만 흘리게 너무 분해 네게 줄게 이별 뿐이라는게 곁에 있어봤자 내게 시련 뿐이라는게 I want nobody nobody but you Anybody Anybody but me I want nobody nobody but you Anybody Anybody but me 난 다른 사람은 싫어 니가 아니면 싫어 I want nobody nobody nobody nobody 내 말 잘들어 nobody 난 아니 라는게 너무나도 뻔한데 왜 이러고 있니 nobody 머하니 돌아서 떠나라는데 왜 계속 거기 서 있니 nobody 내 말이 맞는 말이잖아 너도 알고있잖아 Nobody Anybody but me 갖고 싶었어 널 처음 봤을 때 얼른 안고 싶었어 생각도 않은 채 용서해 나 왜 이렇게 못났나 싶어 너 울던 순간 심장을 꺼내 태우고 싶어 잘 가 가지마 GOD 거짓말 싫어 싫어 겉은 가라지만 속은 날 떠나지마 몇 번이나 목까지 올라왔지만 마른 침과 힘겹게 삼켜가며 독하게 나 다짐해 추억이면 충분타며 여기까지가 끝 우리 사랑의 달력 니 이름이 습관처럼 몸에 베 술 취해 미안하다며 혹시 부르게 돼 또 그냥 가면 돼 Anybody but me 선택하면 돼 이것만 알면 돼 너만이 날 완전케 했던 걸 아니 왜냐면 난 빼기 넌 equal nobody I want nobody nobody but you Anybody Anybody but me I want nobody nobody but you Anybody Anybody but me 난 다른 사람은 싫어 니가 아니면 싫어 I want nobody nobody nobody nobody
