time,rank,song_id,title,singers,album,date,genre,creator,lyric
2008.06.01~06.07,55,1756969,Kissing You,소녀시대(GIRLS`GENERATION),소녀시대,2007.11.01,Dance,"LeeOn,권윤정",뚜뚜루 뚜뚜뚜 Kissing you baby 뚜뚜루 뚜뚜뚜 Loving you baby 장난스런 너의 키스에 기분이 좋아 귀엽게 새침한 표정 지어도 어느 샌가 나는 숙녀처럼 내 입술은 사근사근 그대 이름 부르죠 그대와 발을 맞추며 걷고 너의 두 손을 잡고 니 어깨에 기대어 말하고 싶어 고마워 사랑해 행복만 줄게요 Kissing you oh my love 내일은 따스한 햇살 속에 너는 내 옆에 누워 사랑의 노랠 불러주며 웃어줘 달콤한 사랑해 기분 좋은 한마디 뚜뚜루 뚜뚜뚜 Kissing you baby 뚜뚜루 뚜뚜뚜 Loving you baby 눈을 감고 너의 입술에 키스를 하면 내 볼은 핑크빛 물이 들어도 내 마음은 이미 넘어가고 내 가슴엔 두근두근 심장소리 들리죠 그대와 발을 맞추며 걷고 너의 두 손을 잡고 니 어깨에 기대어 말하고 싶어 고마워 사랑해 행복만 줄게요 Kissing you oh my love 내일은 따스한 햇살 속에 너는 내 옆에 누워 사랑의 노랠 불러주며 웃어줘 달콤한 사랑해 기분 좋은 한마디 사랑해 사랑해 너만을 사랑해 하늘만큼 언제나 행복하게 환한 웃음 줄게 너만의 소중한 여자친굴 약속해 너는 내 옆에 있고 나의 두 눈에 있고 너의 품안엔 항상 내가 있을게 그대와 발을 맞추며 걷고 너의 두 손을 잡고 니 어깨에 기대어 말하고 싶어 고마워 사랑해 행복만 줄게요 Kissing you oh my love 내일은 따스한 햇살 속에 너는 내 옆에 누워 사랑의 노랠 불러주며 웃어줘 달콤한 사랑해 기분 좋은 한마디 달콤한 사랑해 기분 좋은 사랑해 한마디
2008.06.01~06.07,56,1870571,여행을 떠나요,이승기,여행을 떠나요 (1박2일),2008.05.19,Rock,하지영,푸른 언덕에 베낭을 메고 황금빛 태양 축제를 여는 광야를 향해서 계곡을 향해서 먼 동이 트는 이른 아침에 도시에 소음 수 많은 사람 빌딩 숲 속을 벗어 나봐요 메아리 소리가 들려오는 계곡 속에 흐르는 물 찾아 그 곳으로 여행을 떠나요 메아리 소리가 들려오는 계곡 속에 흐르는 물 찾아 그 곳으로 여행을 떠나요 굽이 또 굽이 깊은 산중에 시원한 바람 나를 반기네 하늘을 보며 노래 부르세 메아리 소리가 들려오는 계곡 속에 흐르는 물찾아 그 곳으로 여행을 떠나요 메아리 소리가 들려오는 계곡 속에 흐르는 물찾아 그 곳으로 여행을 떠나요  굽이 또 굽이 깊은 산중에 시원한 바람 나를 반기네 하늘을 보며 노래 부르세 메아리 소리가 들려오는 계곡 속에 흐르는 물 찾아 그 곳으로 여행을 떠나요 메아리 소리가 들려오는 계곡 속에 흐르는 물 찾아 그 곳으로 여행을 떠나요 여행을 떠나요 즐거운 마음으로 모두 함께 떠나요 여행을 떠나요 즐거운 마음으로 모두 함께 떠나요 메아리 소리가 들려오는 계곡 속에 흐르는 물 찾아 그 곳으로 여행을 떠나요 메아리 소리가 들려오는 계곡 속에 흐르는 물 찾아 그 곳으로 여행을 떠나요 메아리 소리가 들려오는 계곡 속에 흐르는 물 찾아 그곳으로 여행을 떠나요
2008.06.01~06.07,57,1876510,사랑은 안녕 (Feat. 나몰라패밀리),태인,사랑은 안녕,2008.05.27,Ballad,,잘 가 한마디를 못하고 사랑 한다는 맘을 감추고 이제는 보내줄게 가지마 잘해줄게 자꾸만 잡고 싶어 니 앞에선 그게 안돼 정말 난 니가 너무 좋았어 그래서 하루 종일 울었어 이러다가 숨이 막혀 내가 죽을 것만 같았어 입에 대지도 못하던 술을 마시고 너를 사랑했던 만큼 내가 휘청거리고 무심코 핸드폰의 너를 누르고 못된 버릇같아 내가 다시 취솔 누르고 미친듯이 길을 걸어 새벽 두시 어느새 나도 모르게 다시 이러면 안되는데 너의 집앞에서 바보처럼 내가 또 하는 말 사랑해 사랑해 사랑해 내가 참 바본가봐 내가 사랑하면 정말 안돼요 그대 하나만 내가 그저 바라보고만 살아도 내가 행복하다구요 그댈 사랑하고 사랑하다 지치길 바라죠 그댄 너무해요 내가 그댈 정말 사랑했었는데 그댈 니가 즐겨듣던 그 노랫 말들이 마치 내 얘기같아 너무 내 얘기같아 어떡해 유행 가사처럼 우리 사랑도 지나고 어쩌다가 불러보는 우리 추억속의 노래가 되고 아픈 가슴 끓어 안고 울다지쳐 혼자 멍하니 널 그리다 이러면 안되는데 너무나 아파 바보처럼 내가 또 하는 말 사랑해 사랑해 사랑해 내가 참 바본가봐 내가 사랑하면 정말 안돼요 그대 하나만 내가 그저 바라보고만 살아도 내가 행복하다구요 그댈 사랑하고 사랑하다 지치길 바라죠 그댄 너무해요 내가 그댈 정말 사랑했었는데 그댈 잘가 한마디를 못하고 사랑 한다는 맘을 감추고 이제는 보내줄게 가지마 잘해줄게 자꾸만 잡고 싶어 니 앞에선 그게 안돼 미안해 미안해 미안해 사랑해서 사랑해 사랑해 사랑해 널 만나서 제발 가지마 가지마 가지마 날 두고서 돌아와 돌아와 돌아와 나 여기있어 가지마 내가 사랑하면 정말 안돼요 그대 하나만 내가 그저 바라보고만 살아도 내가 행복하다구요 그댈 사랑하고 사랑하다 지치길 바라죠 그댄 너무해요 내가 그댈 정말 사랑했었는데 그댈 사랑한 사람과 이젠 안녕 잘가 미안해 사랑해
2008.06.01~06.07,58,1698598,거짓말,BIGBANG,Always,2007.08.16,Rap / Hip-hop,G-DRAGON,ye love is pain  to all my brokenhearted people  one's old a flame  scream my name  and i'm so sick of love songs  ye i hate damn love song  memento of ours  거짓말  늦은 밤 비가 내려와  널 데려와  젖은 기억 끝에 뒤척여 나  너 없이 잘 살 수 있다고  다짐 해봐도 어쩔 수 없다고  못하는 술도 마시고  속타는 맘 밤새 채워봐도  싫어 너 없는 하루는 길어 빌어  제발 잊게 해달라고  너 없는 내겐 웃음이 보이지 않아  눈물조차 고이지 않아  더는 살고 싶지 않아  엿같애 열받게  니 생각에 돌아버릴것 같애  보고 싶은데 볼 수가 없대   모두 끝났대   I'll be right there  i'm so sorry but i love you  다 거짓말 이야 몰랐어  이제야 알았어  네가 필요해  i'm so sorry but i love you  날카로운 말  홧김에 나도 모르게  널 떠나보냈지만  i'm so sorry but i love you  다 거짓말  i'm so sorry  but i love you  i'm so sorry but i love you  나를 떠나  천천히 잊어줄래  내가 아파할 수 있게  그댈 위해서 불러왔던  내 모든 걸 다 바친 노래  사람들은 모르겠죠  난 혼자 그 아무도 아무도 몰래  그래 내가 했던 말은 거짓말  홀로 남겨진 외톨이  그 속에 헤매는 내 꼴이   주머니 속에 꼬깃꼬깃  접어둔 이별을 향한 쪽지  넌 어딨나요 널 부르는 습관도  난 달라질래  이젠 다 웃어넘길게  i'm so sorry but i love you  다 거짓말 이야 몰랐어  이제야 알았어  네가 필요해  i'm so sorry but i love you  날카로운 말  홧김에 나도 모르게  널 떠나보냈지만  i'm so sorry but i love you  다 거짓말  i'm so sorry  but i love you  i'm so sorry but i love you  나를 떠나  천천히 잊어줄래  내가 아파할 수 있게  모든게 꿈이길  이것밖에 안되는 나라서  아직도 너를 못 잊어  아니 평생을 가도 죽어서까지도  내가 준 상처 아물었는지  미안해  아무것도 해준게 없는 나라서  i'm so sorry but i love you  다 거짓말 이야 몰랐어  이제야 알았어 네가 필요해  i'm so sorry but i love you  날카로운 말  홧김에 나도 모르게  널 떠나보냈지만  i'm so sorry but i love you  다 거짓말  i'm so sorry  but i love you  i'm so sorry but i love you  나를 떠나  천천히 잊어줄래  내가 아파할 수 있게
2008.06.01~06.07,59,1847631,여우가 (Feat. 은지원),문지은,Vivid,2008.04.10,Dance,,Crazy 꼬리 없는 여우들의 Party 이빨 빠진 늑대는 가 빨리  U make me crazy just move Your body so tight 네 바지 넌 오늘밤 내 차지 left to the right now do that thang girl yeah that's my baby tell me what u want it 남잔 여자를 몰라 꼭 틈만 나면 Lie 다 속는 줄 알아 난 그게 웃겨 난 그걸 즐겨 One Two 하나같이 Down 내 매력이란 마법과 같아 자꾸 날 사랑 해 나는 사랑 안 해 Crazy 줄듯 말듯 애태우는 Play Skill 덫에 걸린 남자들은 Shaking  Crazy 꼬리 없는 여우들의 Party 이빨 빠진 늑대는 가 빨리  줄듯 말듯 해 내 맘을 애타게 해 네 눈 빛이 내 숨을 멎게 그 손길이 나를 미치게 만들어 기다리게 하지마 난 참을성이 모자라 Bottom to the top 다 내 스타일 이잖아 nice and slow 움직여봐 be that C R A Z Y 여잔 남자를 알아 그 순진함이란 참 재미가 많아 난 그게 웃겨 난 그걸 즐겨 One Two 나만 보면 Down 힘이 빠져가 참고 싶지만 자꾸 날 사랑해 나는 사랑 안 해 Crazy 줄듯 말듯 애태우는 Play Skill 덫에 걸린 남자들은 Shaking  Crazy 꼬리 없는 여우들의 Party 이빨 빠진 늑대는 가 빨리  I wanna do it do it to do it Left the right now Do that a thang You make me hot hot Yeah that's my baby You make me crazy  불이 붙은 네 욕심을 난 식힐 수 없어 If you wanna get it boy right now 좀더 노력해봐  Crazy 줄듯 말듯 애태우는 Play Skill 덫에 걸린 남자들은 Shaking  Crazy 꼬리 없는 여우들의 Party 이빨 빠진 늑대는 가 빨리
2008.06.01~06.07,60,1804274,나비야,하동균,Another Corner,2008.02.12,Ballad,최갑원,한 밤 널 그리워하다 두 밤 널 기다리다가 세 밤 널 찾아 나서다 그만 눈물이 나서 울었어 우리 헤어진 걸 알아 다신 만날 수가 없는 걸 알아 다만 한 번쯤 네가 보고 싶은데 어떻게 사는지 궁금해 지는데 나비야 나비야 너를 부르던 그 말 날 보며 웃어주던 행복했던 그 날 그리워 그리워 네 얼굴이 그리워 하루만 더 자고 나면 내 눈에 보일까  우리 사랑한 게 맞아 그러다가 그만 끝난 게 맞아 항상 사랑한 기억 떠오를 때면 괜스레 웃다가 결국엔 울잖아 나비야 나비야 너를 부르던 그 말 날 보며 웃어주던 행복했던 그 날 그리워 그리워 네 얼굴이 그리워 하루만 더 자고 나면 내 눈에 내 눈에 보일까 나비야 나비야 너를 부르던 그 말 날 보며 웃어주던 행복했던 그 날 그리워 그리워 네 얼굴이 그리워 하루만 더 자고 나면 내 눈에 보일까
2008.06.01~06.07,61,1876875,Hi-Five,고유진(플라워),Equi-Vocal,2008.05.27,Ballad,심현보,Never cry Ever smile 세상이 너를 속여도 당당하게 부딪쳐 봐 Show your dreams Show your stars 고개를 들어봐 널 기다리는 내일이 있어 주저 앉고 싶을 때면 주위를 둘러봐 지금도 여전히 널 믿는 사람들 그래 거친 세상은 언제나 널 시험하지만 괜찮아 할 수 있잖아 힘내자 친구야 니가 걷는 그 길에 주인공은 바로 너야 멋지게 Try again 크게 한번 웃고 다 잘 될 거라고 믿는 거야  그저 그런 하루 속에 점점 지쳐 갈 땐 가슴속 깊숙이 심호흡을 해봐 그래 머릿속 가득 채워진 어려운 고민들 이렇게 털어버리고 달리자 친구야 갖고 싶은 모든 걸 다 가질 수 있을 거야 힘차게 Jump up sky 원하는 모든 것을 다 할 수 있다고 소리쳐봐  넘어지는 것쯤 괜찮아 상처 받는 것쯤 괜찮아 너의 꿈 너의 별 그걸 위해 일어서는 거야 Never stop Ever green 저 푸른 나무처럼 넌 지치지 않을 거야 한 번 더 Try again 자신을 믿어봐 너의 내일을 응원 할꺼야 힘내자 친구야 니가 걷는 그 길에 주인공은 바로 너야 멋지게 Try again 크게 한번 웃고 다 잘 될 거라고 믿는 거야
2008.06.01~06.07,62,1845031,보고 싶어 (SG 워너비 Ver.),SG워너비,2008 연가 SG 워너비 (Digital Single),2008.04.03,Ballad,안영민,바람같은 사랑은 날 울리고 떠나버리고 슬피우는 가슴도 눈물로 여울져 돌아오네 아름다운 사랑이었죠 내게 무엇보다 소중했던 사람 기나긴 이별 앞에서 눈물로 삽니다 오 내 사랑하는 사람아 제발 내게 돌아와줘요 보고 싶어 보고 싶어 보고 싶어 두 눈이 멀어도 사는 동안 볼수만 있다면 그걸로 행복합니다  나는 외롭지가 않아요 내게 무엇보다 추억이 있으니 기나긴 이별 앞에서 견딜수 있어요 오 내 사랑하는 사람아 나를 위해 행복해줘요 보고 싶어 보고 싶어 보고 싶어 두 눈이 멀어도 사는 동안 볼수만 있다면 그걸로 행복합니다 사랑했어 사랑했어 사랑했어 내 목숨 다 바쳐 행복했던 추억이 서러워 서러워 눈물이 나요 꿈같던 사랑아 안녕
2008.06.01~06.07,63,1853690,소나기,김장훈,김장훈의 소나기,2008.04.29,Ballad,싸이(PSY),잠시 뿐일꺼야 곧 끝날꺼야 또 해가 뜰꺼야 갑자기 왔다 적시고 간다 소나기 소나기 날이 참 좋았는데 화창했는데 말 없이 내리네 갑자기 왔다 적시고 간다  우산없이 살다가 아주 흠뻑 젖었네 정신없이 살다가 울다가 웃다가 울다가 웃어야지 소나기 내가 눈을 떠야 세상이 있어 눈 감으면 되잖아 잠시꿈을 꾸며 그리고 눈을 뜨면 괜찮아 내가 찾아가야 인생이 있어 또 내일이 있잖아 오늘 하루만 소나기 무지개가 피고 기지개를 피고 다 잊어버리고 갑자기 왔다 적시고 간다  우산없이 살다가 아주 흠뻑 젖었네 정신 없이 살다가 울다가 웃다가 울다가 웃어야지 소나기 내가 눈을 떠야 세상이 있어 눈감으면 되잖아 잠시꿈을 꾸며 그리고 눈을 뜨면 괜찮아 내가 찾아가야 인생이 있어 또 내일이 있잖아 오늘 하루만 소나기  내가 눈을 떠야 세상이 있어 눈감으면 되잖아 잠시꿈을 꾸며 그리고 눈을 뜨면 괜찮아 내가 찾아가야 인생이 있어 또 내일이 있잖아 오늘 하루만 소나기
2008.06.01~06.07,64,1880740,이별공식,서연,The Love Part.3,2008.05.30,Dance,,이별 장면에선 항상 비가 오지 열대 우림 기후 속에 살고 있나 긴 밤 외로움과 가을 또 추억을 왜 늘 붙어다녀 무슨 공식이야 떠난 그 사람을 계속 그리면서 눈물 흐르지만 행복 빌어준대 그런 천사표가 요즘 어디있어 설마 옛날에도 말만 그랬겠지 나는 잘 이해가 안돼 그런 방법조차 불만이라고 생각해 사랑을 하고 멀어지는 그런 느낌까지 틀에 박혀있는거야 모두가 다 공감 할 수 있는 얘기를 할 필요는 없는거라 생각을해 저마다 감정은 다 다른거니까 각자 나름대로 사는거야 햇빛 눈이 부신 날에 이별 해봤니 비오는 날 보다 더 심해 작은 표정까지 숨길 수가 없잖아 흔한 이별 노래들론 표현이 안돼 너를 잃어버린 내 느낌은 그런데 들으면 왜 눈물이 날까  나는 잘 이해가 안돼 그런 방법조차 불만이라고 생각해 사랑을 하고 또 멀어지는 그런 느낌까지 틀에 박혀있는거야 모두가 다 공감 할 수 있는 얘기를 할 필요는 없는거라 생각을해 저마다 감정은 다 다른거니까 각자 나름대로 사는거야 햇빛 눈이 부신 날에 이별 해봤니 비오는 날 보다 더 심해 작은 표정까지 숨길 수가 없잖아 흔한 이별 노래들론 표현이 안돼 너를 잃어버린 내 느낌은 그런데 들으면 왜 눈물이 날까 흔한 이별 노래들론 표현이 안돼 너를 잃어버린 내 느낌은 그런데 들으면 왜 눈물이 날까
2008.06.01~06.07,65,1871549,태양의 나라,길건,Light Of The World,2008.05.20,Dance,휘성(Realslow),백모금의 데킬라 허나 취해도 아깝지 않아 내가 원한 나라가 지금 눈 앞에 펼쳐졌어 차례대로 켜져간 조명 이라는 저 태양아래 시간들은 멈추고 나는 춤추는 Clubbin' tonight Do it and do it again Oh Baby Do it and do it again 더 거친 Music Oh 부디 더 멋진 남자들을 바래 Do it and do it again Go Shaking Do it and do it again 날카롭게 오른 소름을 더 길게 느끼고만 싶어  천 방울쯤 빠져간 땀에 내 몸이 무겁지 않아 내가 원한 Paradise 지금 충분히 즐거운 걸 조금만 더 밝혀라 남은 조명은 또 다른 태양 뜨거워진 열기는 여름밤처럼 Clubbin' tonight Do it and do it again Oh Baby Do it and do it again 더 거친 Music Oh 부디 더 멋진 남자들을 바래 Do it and do it again Go Shaking Do it and do it again 날카롭게 오른 소름을 더 길게 느끼고만 싶어  몇 시간이 아닌 며칠 밤을 이 순간 속에 더 머무르고 싶은 걸 어둠이 사라진 꿈의 나라 이 곳에서 난 영원히 춤을 추고 싶은 걸 Do it and do it again Oh Baby Do it and do it again 더 거친 Music Oh 부디 더 멋진 남자들을 바래 Do it and do it again Go Shaking Do it and do it again 날카롭게 오른 소름을 더 길게 느끼고만 싶어 Do it and do it again Do it and do it again 더 거친 Oh Music 더 멋진 남자들을 바래 Do it and do it again Go Shaking Do it and do it again 날카롭게 오른 소름을 더 길게 느끼고만 싶어 Do it and do it again Do it and do it again  Do it and do it again Do it and do it again
2008.06.01~06.07,66,1778667,보고싶은 날엔..,박지헌,단추 (Single),2007.12.12,Ballad,,너를 보고싶은 날엔  멋지게 그대를 놓았죠 이렇게 아무렇지 않게 수백번 지우고 다짐을 해도 애써 남는건 아쉬움뿐 그렇게 그대를 떠나갔죠 정말 난 바보처럼 그대를 몰라 처음봤던 그 모습처럼 가슴이 떨리다가 너를 보고싶은 날엔 눈물나는 날엔 가슴뛰는 날엔 그리운 날엔 너의 전화번호 다시 또 누르게 되면 니가 너무나 그리워 어쩌다 니 소식 듣게되고 혹시나 너도 가끔 그리워할까 너무나 변했어 지금의 우리 추억도 별이되고 너를 보고싶은 날엔 눈물나는 날엔 가슴뛰는 날엔 그리운 날엔 너의 전화번호 다시 또 누르게 되면 니가 너무나 그리워 고마웠단 말에 미안했단 말에 사랑했단 말에 서툴던 맘에 돌아갈 수 없는 시간이 널 부를 때면 정말 너무나 그리워 눈을 떠봐도 보이는게 너 하나 뿐인데 무심코 거울을 보다 우리 처음 만났던 그 시간이 자꾸 스쳐 지나가고 다시 널 볼수있을까 너를 보고싶은 날엔 많이 생각나는 날엔 반쪽같은 날엔 울고싶은 날엔 아프던 날엔 너의 전화번호 다시 또 누르게 되면 니가 너무나 그리워 고마웠단 말에 미안했단 말에 사랑했단 말에 서툴던 맘에 돌아갈 수 없는 시간이 널 부를 때면 정말 너무나 그리워
2008.06.01~06.07,67,1874995,기도 (Feat. Teddy),태양,Hot,2008.05.22,R&B / Soul,"DavidHolliday,TEDDY",Let me say Uh Oh  널 향해 외치는 맘  사랑이란 두 글자론 너무 부족한  Let me say Uh Oh  나 아닌 네가 내 안에  살아 숨 쉬고 있어  Let me say Uh Oh  널 향해 외치는 맘  사랑이란 두 글자론 너무 부족한  Let me say Uh Oh  너 만이 이런 날 가질 수 있어  네 숨을 맡을 때  너를 안을 때  그 속에 영원함을 느껴  너는 나의 마지막이란 걸  죽는 날까지 You're my girl  내게 후회란 건 없어  I know i'm crazy in love  네 미소가 날 다시 살게 해  그 무엇도 두려워 마  널 위한 내 기도가  하늘에 닿을 테니까  Let me say Uh Oh  널 향해 외치는 맘  사랑이란 두 글자론 너무 부족한  Let me say Uh Oh  나 아닌 네가  내 안에 살아 숨쉬고 있어  Let me say Uh Oh  널 향해 외치는 맘  사랑이란 두 글자론 너무 부족한  Let me say Uh Oh  너 만이 이런 날 가질 수 있어  가끔은 세상이  우리 둘 사이를 갈라놓으려 해도  나는 절대 흔들리지 않아  쉽게 포기하지 않아  내 두 손을 놓지는 마  Cuz you're my lady  이 벅찬 가슴이 날 지금 살게 해  그 무엇도 겁내지마  간절한 내 기도가  우릴 지켜줄 테니까  Let me say Uh Oh  널 향해 외치는 맘  사랑이란 두 글자론 너무 부족한  Let me say Uh Oh  나 아닌 네가  내 안에 살아 숨쉬고 있어  Let me say Uh Oh  널 향해 외치는 맘  사랑이란 두 글자론 너무 부족한  Let me say Uh Oh  너 만이 이런 날 가질 수 있어  널 잡을 때면 느껴지는  온 몸 속 그 전율이  쓰디쓴 내 아픔들을  새 하얗게 날려 버리지  네 운명에 입맞춘 난 Soldier  Baby I got you  우린 세상과의 다툼에 맞서 함께  Ride thru  똑같은 만남에 지쳤지만 넌 달라  아직도 못다해준 사랑이 내겐 더 많아  너는 Sky 나는 땅  나는 태양 너는 달  You and I we so fly  그댄 Bonnie 나는 Clyde  그토록 원해왔던  매일 밤 꿈꿔왔던  그런 사랑이 너야  이젠 영원히 멈출 순 없어 Baby  You can count on me  Let me say Uh Oh  널 향해 외치는 맘  사랑이란 두 글자론 너무 부족한  Let me say Uh Oh  나 아닌 네가  내 안에 살아 숨쉬고 있어  Let me say Uh Oh  널 향해 외치는 맘  사랑이란 두 글자론 너무 부족한  Let me say Uh Oh  너 만이 이런 날 가질 수 있어  Let me say Uh Oh
2008.06.01~06.07,68,1846595,오빠나빠,"Jessica(제시카),티파니(TIFFANY),서현(SEOHYUN)",RoomMate 1st `오빠나빠`,2008.04.07,Ballad,,다 아는데 난 아닌데 그래도 놓치기 싫은데 딱 한번만 내 말을 들어요 오빠 앞에선 여자란말이야 나랑 밥 한번 먹는게 그렇게 힘든가요 잊었다면서 혼자라면서 그 언닌 왜 만나나요 아직 나는 안되나요 많이 부족한가요 한번만 날 믿어봐요 내가 잘 할 수 있는데 왜 자꾸만 웃기만해요 내가 그렇게 애기 같나요 딱 한번만 내 진심 들어요 오빠 앞에선 여자란말이야 나랑 밥 한번 먹는게 그렇게 힘든가요 잊었다면서 혼자라면서 그 언닌 왜 만나나요 아직 나는 안되나요 많이 부족한가요 한번만 날 믿어봐요 내가 잘 할 수 있는데 하루에 만번 생각이 나요 눈물이나도 나 이렇게 참아 그댈 사랑하면 안될 이유라도 있나요 잊었다면서 혼자라면서 그 언닌 왜 만나나요 오빤 정말 나쁜사람 정말 내 맘을 몰라 날 믿어봐요 나도 잘 할 수 있는데
2008.06.01~06.07,69,1851231,아홉번째 구름 (Feat. 양파),MC몽,Show`s Just Begun,2008.04.17,Rap / Hip-hop,"MC몽,메이비(Maybee)",저 하늘에 날 비추는 태양이 하나듯 너 하나만 너 만이 내 전부인 걸 아직도 사랑은 목마른 내 나이 벌써 서른 훨훨 타오르는 내사랑 불을 붙이기 전 기름 아홉번째 구름에 하늘을 떠다니는 기분 24 for 7 If feels like heaven 인생을 혼자 살기엔 철이 없던 삶의 공식 바람 불던 내 인생에 찾아온 당신 니가 있기에 난 더욱 강해져 난 변함없이 사랑해 틀림 없이 지키겠어 난 You're the only one who is in my life you're the only one who can be my wife You're the only one who is in my life you're the only one who can be my wife 자존심 따위는 아 아깝지 않아 그깟 명예도 아 아깝지 않아 모든걸 다 줘도 아 아깝지 않아 우리는 하나 you're the only one 사랑 밖엔 난 몰라 이 사랑 내게 준 너밖에 몰라 저 하늘에 날 비추는 태양이 하나 듯 너 하나만 너 만이 내 전부인 걸 24 for 7 If feels like heaven 365일 그대가 있다면 천국 향기로운 입맞춤에 숨을 쉴 수 없는걸 날아갈 듯 터질듯한 기분 너 역시 같을걸 하늘이 우릴 맺은 destiny 알고 있니 you bring out the best of me 너는 종교야 하나 밖에 없는 천사야 너와 나 숨 쉬는 이 공간 바로 모두 다 천국이야 You're the only one who is in my life you're the only one who can be my wife You're the only one who is in my life you're the only one who can be my wife 그대 가는 길이 힘들어도 같이 걸어줘 때론 지쳐 어두울 때 빛을 밝혀줘 let'get away just for one day 바라볼수록 행복해 아름다운 밤인데 다시는 우리 서로를 아프게 말자 내 마음 가득 사랑해 사랑밖에 난 몰라 네 사랑 내게 준거 밖에 몰라 저 하늘에 날 비추는 태양이 하나듯 너 하나만 너 만이 내 전부인 걸 사랑밖에 난 몰라 네 사랑 내게 준거 밖에 몰라 저 하늘에 날 비추는 태양이 하나듯 너 하나만 너 만이 내 전부인 걸 사랑 밖엔 몰라요 너 아닌 누구도 보이지 않아 어디라도 빛이 없는 어둠 속 이라도 니 두 손이 내 두 눈이 돼 주는 걸  24 for 7 If feels like heaven
