time,rank,song_id,title,singers,album,date,genre,creator,lyric
2001.01.07~01.13,40,88416,그래도 될까?,샵,The Four Letter Word Love,2000.08.11,Dance,유유진,A wella fella baby just the type you make me high 나 지금까지 느껴온 또 다른 너의 사랑 and every little thing I do it makes me think of you cuz girl you make me crazy I know I'm getting twisted through all the 4 seasons I know you here to stay from the summer time to the fall winter to the spring you bring a whole new level of the word meaning love 아름다운 그대의 따스함을 느껴 힘들 땐 니 어깨에 기대랬지 내가 헤어진 그 사람 잊을 때까지 왜니 왜 내게 이렇게 잘해줘 딴사람 못 잊는 날 말야 친구인 날 걱정해서라지만 아냐 나는 알아 나를 사랑하는 걸 그렇게도 오랫동안 나를 지켜준 너를 난 모른 척 했을 뿐 니가 필요했어 널 사랑하진 않지만 내가 맘껏 기대 울어도 되는 니가 그래 너에게는 미안한 일이지만 나를 위해 널 만난 것 뿐야 그런 내가 변해가 자꾸 변해가 나도 몰래 니 전활 기다리지 난 너 라면은 이별 없이 사랑할 것 같은 그런 기대도 생겨 널 사랑해도 될까 그래도 될까 아직 두려움이 난 앞서지만 지금처럼만 날 니가 아낀다면 너에게 줄꺼야 내가 가진 사랑 모두를  Cause I know in my heart you &amp; I from the start You're my dream Can't you see Come to me We can be 끝내 사랑한 그가 널 떠나갔어 너뿐이란 말 다 잊었어 그랬어 하루하루가 너무 힘들었어 그를 잊기 위해 넌 취해야만 했어 그렇지만 넌 언제라도 넌 너에게 달려가는 내가 있어 지금도 네게 전화를 했어 니가 필요해 내 곁에 있어 니가 필요했어 널 사랑하진 않지만 내가 맘껏 기대 울어도 되는 니가 그래 너에게는 미안한 일이지만 나를 위해 널 만난 것 뿐야 그런 내가 변해가 자꾸 변해가 나도 몰래 니 전활 기다리지 난 너 라면은 이별 없이 사랑할 것 같은 그런 기대도 생겨 널 사랑해도 될까 그래도 될까 아직 두려움이 난 앞서지만 지금처럼만 날 니가 아낀다면 너에게 줄꺼야 내가 가진 사랑 모두를  Cause I know in my heart you &amp; I from the start You're my dream Can't you see Come to me We can be
2001.01.07~01.13,41,1576735,다 줄거야 (Acoustic Ver.),조규만,I Will Give You All,2000.01.01,Ballad,조규만,그대 내게 다가오는 그 모습 자꾸 다시 볼수 없을 것만 같아서 감은 두눈 뜨지 못한거야 너를 내게 보내준 걸 감사할뿐야 고마울 뿐야 많이 외로웠던거니 그동안 야워가는 너를 보며 느낄 수 있어 너무 힘이 들땐 실컷 울어 눈물속에 아픈기억 떠나보내게 내품에서 서글픈 우리의 지난 날들을 서로가 조금씩 감싸줘야해 난 네게 너무나도 부족하겠지만 다 줄꺼야 내 남은 모든 사랑을 많이 지쳐있던거야 그동안 자꾸 야워가는  너를 보며 느낄 수 있어 너무 힘이 들땐 실컷 울어 눈물속에 아픈기억 떠나보내게 내품에서 서글픈 우리의 지난 날들을 서로가 조금씩 감싸줘야 해 난 네게 너무나도 부족하지만 다 줄꺼야 내 남은 모든 사랑을 난 네게 너무나도 부족하지만 다 줄거야 내 남은 모든 사랑을
2001.01.07~01.13,42,84375,꿈꾸는 소녀,YB,가리지 좀 마,1997.03.01,Rock,윤도현,나의 마음속에 언제나 꿈을 꾸는 소녀 살고 있지 별을 좋아하던 푸른 하늘 같은 너 너의 꿈을 찾아 떠나간 그대를 생각하네 꿈꾸는 소녀야 별들아 그대들은 멀리있지만 꿈꾸는 소녀야 별들아 언젠가는 같은 하늘에 뜰거야 오래전 그 노래 다시 부를거야 너의 가슴속에 나의 노래 하나를  꿈꾸는 소녀야 별들아 그대들은 멀리있지만 꿈꾸는 소녀야 별들아 언젠가는 같은 하늘에 뜰거야 꿈꾸는 소녀야 별들아 그대들은 멀리있지만 꿈꾸는 소녀야 별들아 언젠가는 같은 하늘에 뜰거야 나의 마음 속에 꿈 꾸는 소녀가 소녀 마음속에 꿈을 꾸는 별들이 꿈을 꾸는 이 세상 모든것들 꿈을 꾸는 이 세상 모든것들
2001.01.07~01.13,43,27833,Lie (Radio Ver.),화요비,My All,2000.06.14,R&B / Soul,이상호,말해줄래 나를 위해라면 이러진 말아 아직 그댈 놓아주기에는 너무 난 두려워 이미 지나간 일이 아니라면 숨기지 말아 다시 예전처럼 내게 돌아온다 말해주겠니 미안해져 니 모습 못보는 맘 알겠니 왜 넌 먼곳에서 숨기고 있니 이젠 지워지지가 않아 내 눈물같은 바래진 기억들이 긴 하루 온종일 널 대신하고 있어 기다린단 말하려다 난 잘 지내 해버렸지 떠난 그대 돌아갈 곳 있을것 같아 Oh lie I for you that lie Do do do that lie 미안해져 니 모습 못보는 맘 알겠니 왜 넌 먼곳에서 숨기고 있니 이미 그댈 향한 사랑은 내 마음을 넌 읽었는지도 몰라 다만 말 안해도 알거라 믿은거야 기다린단 말하려다 난 잘 지내 해버렸지 떠난 그대 돌아갈 곳 있을것 같아 말해줄래 니가 이러는게 우스워보여 아직 나에게는 갈 곳이 없어 음 마지막이라 믿었었지 니가 떠난후에 시간이 지날수록 날 위한 욕심이었다는 걸 난 알고 있었기에 그대 잠이 깬 후에도 난 울면서 헤맸던 건 혹시 그대 내게 돌아오는 길 모를까봐 Oh lie I for you that oh lie Do do do that lie
2001.01.07~01.13,44,75266,그래! 그렇게! (We Can Do It),H.O.T.,Outside Castle,2000.10.02,Dance,강타(KANGTA),그대로 거기 멈춰선 당신의  힘겨운 발걸음을 보았죠  세상 앞에 홀로 서기가 너무나 힘이 들죠  그토록 힘겹던 시간  그대는 수많은 시련을 이겼어요  이제 시작이란 마음 하나로 다시 일어서요  작아진 목소리로 아무런 것도  할수 없어 지쳐버린 그대  그대 앞에 펼쳐질  세상을 향해 소리쳐 봐요 그대 이젠  그대 그렇게 한번 웃어봐요  당신 앞에 열린 세상을 바라봐  그대 안에 있는 모든 것들을  이제 활짝 펼쳐 다시 깨어나  새롭게 태어나 모든 것은  그대 안에 간직해줘 오늘을 기억해  새롭게 펼친 세상 앞에 이제는 다시 시작해  이제까지 내게 숨을 쉬고  숨을 쉬고 살아가는 법을  내게 가르친 너에게 나는 무엇일까  생각 나게 하게  그렇게 하게 내가 가만이 있지 않게  나를 잡아주고  지탱하던 수많은 사람들이 나를 감싸주던  결국 이겨낸건 어느 순간 나의 안에 있는  이름도 모를 무엇인가 나를 지켰어 그렇게  다시 또 일어서야죠  이렇게 힘없이 무너질순 없어요  이젠 두팔 벌려 하늘을 향해 크게 웃어봐요  수많은 좌절 앞에  또다시 한번 쓰러지게 될지 몰라  그대 그대안에 숨겨진  자신을 믿고 일어서 봐요 그대 이젠  그대 그렇게 한번 웃어봐요  당신 앞에 열린 세상을 바라봐  그대 안에 있는 모든 것들을  이제 활짝 펼쳐 다시 깨어나  새롭게 태어나 모든 것은  그대 안에 간직해줘 오늘을 기억해  새롭게 펼친 세상 앞에  랩 그대 그렇게 다시 일어서요  아름다운 세상속에 그대가 있어요  이젠 그렇게 웃어봐요  자신을 믿잖아요 이젠 무엇도 두렵지 않아요  그대 안에 있는 믿음을 사랑해  오늘도 기억해 새롭게 열린  세상 앞에 이제는 다시 시작해
2001.01.07~01.13,45,37100,"힘을 내요, 미스터 김",롤러코스터,일상다반사(日常茶飯事),2000.08.01,Rock,조원선,오늘도 많이 바쁜가요  또 자꾸 짜증이 나나 봐요  벌써 몇 번째 한숨 쉬고  끊었던 담배 다시 피우나요  거울을 봐요 충혈된 두 눈에  언제나 용모단정 이게 아닌데 하면서도  등만 대면 잠이 와요  이름을 말해봐요 미스터 김  당신이 꿈꾸던 삶은 어디에  하고 싶었던 일 뭔가요  아직도 늦지 않았어  당신이 바라는 대로 하세요  멋있게 행복하게 사는 거죠  잘 다려진 와이셔츠에  빤짝이는 검은 구두  무표정한 얼굴 뒤에는 무슨 생각하나요  이름을 말해봐요 미스터 김  당신이 꿈꾸던 삶은 어디에  기죽지 말아요 어깨를 쫙 펴고  당당히 맞서요  이제부터라도 신나게  맘대로 멋지게 사는 거죠  하고 싶었던 일 뭔가요  아직도 늦지 않았어  당신이 바라는 대로 하세요  멋있게 힘을 내요 미스터 김  하고 싶었던 일 뭔가요  아직도 늦지 않았어  당신이 바라는 대로 하세요  멋있게 힘을 내요 미스터 김  기죽지 말아요 어깨를 쫙 펴고  당당히 맞서요  이제부터라도 신나게  맘대로 멋지게 사는 거죠  하고 싶었던 일 뭔가요  아직도 늦지 않았어  당신이 바라는 대로 하세요  멋있게 힘을 내요 미스터 김
2001.01.07~01.13,46,89325,Bad,Y2K,Try Again,2000.10.27,Rock,,나 지금 너무 안좋아   무조건 내편에   서서 내 얘길 들어주던 널  얼마나 찾고 있는데 내 앞에   보이질 않아 나 지금   미칠것 같아  너만 나 오직 너만 바라보며   살아왔던 거야 이젠   어떡해야 하나  지금쯤 누군가 만나는 생각에   잠이 오질 않아  아무말이 없는 네 사진   바라보지만   일분이분 그리고 하루이틀  끝나버린 거라고 이제는   잊을거라   해도 그 다짐은 잠시뿐  얼마나 소중한 넌데   이렇게 잊을수   있니 모든걸 버릴수 있니  너만 나 오직 너만 바라보며   살아왔던거야 이젠   어떡해야 하나  지금쯤 누군가 만나는 생각에   잠이 오질 않아  아무 말이 없는 니 사진   바라보지만   일분 이분 그리고 하루 이틀  끝나버린거라고 이제는   잊을거라   해도 그 다짐은 잠시뿐  널 잊을수가 없어 너로인해   내 또다른 사랑 올수 없다고 해도  말이 없는 니 사진 바라보지만   일분 이분 그리고 하루 이틀  끝나버린거라고 이제는  잊을거라 해도  그 다짐은 잠시뿐
2001.01.07~01.13,47,1786609,Episode Ⅱ,조pd(ZoPD),ChoPD.Net / Best In East,2000.12.28,Rap / Hip-hop,조pd(ZoPD),타오르는 태양도 날아가는 저새도
2001.01.07~01.13,48,3822,831 8,제이,In Love,2000.04.21,R&B / Soul,윤사라,그래도 하루를 살고 가끔  웃기도 하죠 이렇게 살다보면 잊는걸까요 그대 얼굴마저 잊을까 난 자꾸 두려워 져요 이 사진 한장 조차도 버릴 수  없어 망설이고 있죠 난 어떡해야 좋은걸까요 내게 말했던 대로 모두 지우면  그대 서운하지 않은가요 아무말도 못하겠지만 아주 잠시라 해도 그댈 꼭 한번만 볼수 있다면  It's all l ask 오늘은 이런 생각도 왠지  어색해져요 이렇게 변하는게 맞는건가요 그댈 마주치는 어느날  어쩌면 스쳐가겠죠 조금 닮은 뒷모습에도  한참동안을 숨쉴수 없는데 난 어떡해야 좋은걸까요 내게 말했던 대로 모두 지우면  그대 서운하지 않은가요 아무말도 못하겠지만 아주 잠시라 해도 그댈 꼭 한번만  볼수 있다면 It's all l ask 아직 모르겠어요 믿을수 없죠 다신 날 찾아 오지 않을꺼라면 제발 가르쳐 줘요 그대 없이도  나 살아가야 하잖아요 더 이상은 울지 않도록 이런 나의 바램도 오늘이 마지막이면 It's all l ask It's all l ask
2001.01.07~01.13,49,445159,그대가 그대를,이승환,His Ballad Ⅱ,2003.03.12,Ballad,"이승환,이지은",참 많이 모질었었죠 나 당신께  나같지 않은 말땜에 놀랬겠죠  편할날이 없었죠 틀렸던 걸까봐  말없이 놓아준 그대가  정말로 내사랑 같아서  왜 그랬나요 울거면서  잘 가라는 듯 왜  그게 되나요 못보는게 그대가  그대를 음  참많이 오래 견디죠 나 당신을  조금만 멀리 보여도 보고싶죠  갚을게 많아서 못준게 많아서 혹시 날 못있고 산다면  꼭 한번 만나고 싶어서  잘지내나요 혼잔가요  나아닌 누군가와 사랑하나요 우릴 지운  그대가 나아닌 그대를  우리가 사랑했던게 간직 할 만한  슬픔이었음 해요 왜 그랬나요 울거면서  잘 가라는 듯 왜 그게 되나요 못보는게  그대가 그대를 음 우리 오래 오래 살아요  꼭 한번이라도 보게 못한 얘기들도 하구요  맛나는 것도 먹어요 우리 정말로 오래오래  살아요 천년만년  어쩌면 인연이 다하여  뜻하지 않은 어느 곳  그리 우리 다시 만나면  이제 편히 쉬게요
2001.01.07~01.13,50,9271,뱀,자우림,"Jaurim, The Wonder Land",2000.07.04,Rock,김윤아,그래 그래 너는 그렇게 말을 하지  이제 다시 그런 일은 없을 거라고  왜 내 눈을 보면서 얘기 못 해  너는 질리지도 않았니 뻔한 핑계  언제까지나 그런 식으로  도망갈 줄 알았니  언제까지나 그런 식으로  무사할 줄 알았니  난 그저 매번 이렇게 화만 내지  화만 내지  이제 다시 그런 일은 하지 말라고  왜 너를 이대로 버리지 못 해  나는 질리지도 않는 걸까  이런 일들  언제까지나 이런 식으로  살아야만 하는 걸까  언제까지나 이런 관계를  계속해야 하는 걸까 너는 한마리 뱀이지  슬슬 스르르륵  네 몸만 빠져나가면  아무 상관없이  뻔뻔스런 얼굴로  만족스런 미소를 짓지 너의 한마디 말에도  아무렇지 않게  지껄여대는 궤변과  내뱉어대는 욕설이 있지 나나나 나나나나나  나나나 나나나나나  내 인생을 망쳐놓고 웃고 있는 넌  나나나 나나나나나  나나나 나나나나나  이 모든 걸 망쳐놓고 즐거워하는 넌 나나나 나나나나나 나나나 나나나나나 나나나나 한 마리 뱀이지 나나나나 나나나나 나나나나 그래 보자 보자 하니까 심하잖아 나를 만만하게 보지마 더 이상은 이제 각오해 두는게 좋을 거야 각오해 너도 뜨거운 맛을 보게 될 테니 언제까지나 그런 식으로 도망갈 순 없으니까 언제까지나 그런 식으로 참아주진 않으니까
