time,rank,song_id,title,singers,album,date,genre,creator,lyric
2000.05.28~06.03,36,86168,Fly To The Sky,플라이투더스카이,Fly To The Sky,1999.12.14,R&B / Soul,유영진,세상 모두를 가질 수가 없다고  단념하며 살아왔던 내게 아무 것도 가진 것은 없겠지만  또 잃을 것도 없다고 말해줘 수천만의 사람 중에 단 하나의  너를 찾던 그 순간 난 느껴버렸지 난 해낼 수 도 있어 그대와 함께라면 It's alright baby I fly to  the world 나를 지켜줘 Can you makin'  me high It's alright Baby We fly to  the sky 나를 위해서 사랑이란 말도 빛이 바랬어 너무  흔한 말이 돼버렸지 말로 표현할 수 없는 감정들을  다 네게 보여주고 싶었어 수많은 거짓말과 욕심들로  채워버린 세상에 난 빛이 되겠어 난 해낼 수가 있어 그대와 함께라면 Girl I know what your thinkin'  when your sleepin' at night your thinkin' I'm stressin'  but baby I'm alright you are like an angel watchin'  over me I once was blind but now I see your lovin'  brings me acstasy can't you see your my girl of eva my lady 바로 앞에 미래마저 알 수 없겠지 그런 이유로 우린 또  되는대로 산거야 알고싶었어 모두에게 가진 꿈을  나눠줄 순 없는지 왜 I'm a lyrical lyricist on the  mic get contagious I be tighter tightest I be the  badest fly high way up to the sky  let me see yo 'hand's you  know how we ride It's alright baby I fly to  the world 나를 지켜줘 Can you makin'  me high It's alright Baby we fly to  the sky 나를 위해서
2000.05.28~06.03,37,1564058,Good Bye My Love,이수영,I Believe,1999.11.17,Ballad,김선민,문득 말하고 싶었죠 우리 다시 시작 할 수는 없는지 잠시 울리다 끊어진 전화에도 나는 혹시나 그댄걸 느껴요 잊으려고 친구를 만났죠 아무 소용 없다는걸 난 알아요 그 언젠가 그대 아파할 때 하얗게 밤새던 그 추억도 이젠 나의 몫이 아니겠죠 사랑해요 떠나지 말아요 혼자 있다 그대 보고 싶을 땐 난 어쩌면 좋아요 내가 먼저 보내야 할까요 새로운 연인이 기다리나요 나보다 더 행복하게 해줄 것 같다면 Goodbye my love  잊으려고 친구를 만났죠 아무 소용 없다는걸 난 알아요 그 언젠가 그대 아파할 때 하얗게 밤새던 그 추억도 이젠 나의 몫이 아니겠죠 사랑해요 떠나지 말아요 혼자 있다 그대 보고 싶을 땐 난 어쩌면 좋아요 내가 먼저 보내야 할까요 새로운 연인이 기다리나요 나보다 더 행복하게 해줄 것 같다면 Goodbye my love
2000.05.28~06.03,38,86336,나예요...,이소은,신비,2000.01.14,Ballad,,좋은 사람들이 많았더군요 힘든 나를 모두 걱정해 주었어요  얼굴이 말라서 예뻐졌데요 이제야 젖살이 빠져 그런거래요  난 사실 이 이별이 슬프지 않아요  그대 원하는 사랑을 찾아 가는 그 길이 행복하길  사랑하나요 날 버릴 만큼 나를 무척 아껴 줬는데  따뜻한 그대 맘 이젠 갔나요  날 사랑하지 않을 리는 없을 걸 알아요 그대도 많이 힘들겠죠  얼마나 많은게 달라졌는지 그대 없는 내 생활이 당황스러워  익숙해 질 때면 또 다시 내게 찾아올 사랑에 적응해야 겠지요  결국은 내 마음도 떠나려나 봐요  헤어졌다는 사실이 슬프지만은 않은 건 왜 일까요  사랑해줘요 내게 준 만큼 나처럼은 만들지 마요  그녀도 불안해 할지 몰라요 언젠가 또 싫증이 나면  아프게 하진 마요 그리고 다른 사랑 찾아  사랑하나요 날 버릴만큼 나를 무척 아껴 줬는데  웃으며 그댈 보내야 했어요 힘들지 않게 헤어지곤  힘들게 살아요 매달릴걸 그랬나봐요  돌아와 그대 돌아와 우우우 돌아와 내게 돌아와 내게 우우우 지금이라도  돌아와 내게 돌아와 내게 우우우 돌아와 내게 돌아와 내게 우우우 지금이라도
2000.05.28~06.03,39,86857,노을의 연가,주영훈,Nostalgia,2000.03.21,Ballad,김태희,끝없이 나를 버려야 했고 끝없이 감싸 안아야 했지 항상 멀리 있는 그대를 사랑해야 했던 나는 수 없이 나는 울어야 했고 더 많이 애원 해야만 했지 다시 어떻게든 그대를 곁에 둘 수만 있다면 그만 잊어주길 바라는 그대 둘 곳없는 시선에 난 고갠 끄덕였지만 쉽게 보내긴 싫어 하지만 나 그댈 위해 떠나 보낼 수 밖에 오직 내게 바라는 전불테니까 처음부터 내게 허락된 적 없었던 사랑 그댈 향한 모습인걸  무너져 가는 나를 보면서 오늘도 원망할 뿐이였지 그렇게 사랑한 그대를 끝내 잡지 못했던 나 다시 돌릴 수가 없다면 어떤 말이라도 해주렴 다 지난 사랑 이래도 내겐 소중 했으니 살아볼께 헛된 기다림에 지쳐 울어도 나를 버린 그대로 기억된다면 처음부터 내게 허락된적 없었던 사랑 그댈 향한 모습인걸 하지만 나 그댈위해 떠나보낼수 밖에 오직 내게 바라는 전불테니까 처음부터 내게 허락된적 없었던 사랑 그댈 향한 모습인걸
2000.05.28~06.03,40,75203,"Party! (Feat. 타샤니,진원)",이현도,완전(完全) Hiphop,2000.01.21,Rap / Hip-hop,"이현도,MASTAWU",우 every day every night 우 every day every night 내가 가는 길이 바로 내길이지 무더운 사막에서도 I'll take it easy 서로를 믿고 따라야만 꽃은 피지 Cheesy 하게 생각하면 그건 지지 see me 모든걸 잠시 접어두고 생각않고 쉬고 이런 사람 저런 사람 불러 술마시고 우리에게 쌓이고 쌓이는 모든 피로 나 풀어나가지 I roll with ace Deux D O 망설임을 가지고 있을지 혹은 조금 어색할지도 모르지만 걱정하지 않아도 되지 그럴 필요없지 맴돌지 말지 아무라도 와도 누구라도 상관없지 누구나 또 와도 처음이라도 괜찮지 마치 나와 친구같이 노는 N R G 동생들처럼 말이지 우리 모두 여기 모여 모두 함께 하나의 그림 그려요 누구나 모두 함께 우 우 서로 다른 빛깔들로 하나의 아름다운 무지개가 되듯이 그렇게 함께해요 우 누가 누가 와도 괜찮아 아무나 즐겨도 뭐한 세상 왜 싸우나 웃어도 모자른데 왜 우나 모두 나와 놀아 기쁘나 슬프나 기분이 나쁘나 우리 함께면 이렇게 모두 좋아 왠지 모르게 하늘은 푸르구나 나와 그대 왜 어째서 벽이 높아야만 해 안돼 이제 달리 생각해봐야 해 서로가 다르다는 이유 하나에 어긋나지 않았으면 해 나만 이렇다 말하지 마라 다 함께 못할 이유는 아니다 내게 힙합이란 자유다 느낌이란 하나다 여기 모두 우린 전부로서 하나다 우리 모두 여기 모여 모두 함께 하나의 그림 그려요 누구나 모두 함께 우 우 서로 다른 빛깔들로 하나의 아름다운 무지개가 되듯이 그렇게 함께 해요 Every day and every night 에 매일 얼굴 찡그리기엔 하늘이 너무 맑아 높아 때론 우리들 먹구름과 빗줄기에 그렇게 가끔 이 슬픔과 만나기에 우리네 삶은 더욱 충실해 간다네 행복의 소중함을 더욱 느낄 수 있다네 모두가 함께라면 더 좋겠네 우리같은 이 자리에 Hey hey hey hey hey 그래 그렇게 서로 다른 빛깔들로 하나의 아름다운 무지개가 되듯이 그렇게 함께 해요 I broke all limits in guiness been this since elements admit it's so obvious but to me it's all irrelevant and yo I'm serious some be devious wit them slick politics tryna screw me like I'm new to this who be most desired like the coming of messiah don't you get tired while I'm reachin higher and higher my flow go surpassing those plateaus that how it goes while tse's featuring for DO 우 every day every night
2000.05.28~06.03,41,32497,학교를 안갔어!,량현량하,쌍둥이 파워,2000.01.18,Dance,,학학학교를 안갔어   학학학교를 안갔어   학학학교를 안갔어   학학학교를 안갔어   어쩌면 좋겠어 학교를 안갔어   아니아니야 안간게 아니야   실수로 못갔어 정말이야   믿어줘 제발좀 들어줘   일부러 그런게 아니야   내 얘길 들어봐줘   학교를 가는 길에 시계를   들여다보니   이게 웬일이니 시간이   남는게 아니겠니   그래서 딱 한판만 정말 딱   한판만 하고 가려고   오락실로 들어가게 됐어 그만   그런데 오늘따라 왠일인지   내게 뭐가 씌였는지 한판을   깨고 두판을 깨도   왜 죽지를 않는건지 결국   난 모든 기록을 깨고   내 이름을 새기고 멋있게   걸어 나오는데   아 버스를 놓쳤어   학학학교를 안갔어   학학학교를 안갔어   학학학교를 안갔어   학학학교를 안갔어   떠나는 스쿨버스 야속한   스쿨버스   돌아와줘 플리스   날 구해줘 SOS   소리쳐도 버스는   멀어졌기에 나는   할수 없이 달려가서 지하철을   탔거든 그런데 이게 웬일   믿을수 없는일 작년에 전학간   내가 사랑하던 지윤일   만난거야 갑자기 하늘의   축복이 내 가슴은   콩당 콩당 콩당   내눈에 눈물이 어떻게   살았는지 어디에 사는지   끝없이 얘기는 오가고   웃음꽃을 피웠지   그리고 나서 용기를 내서   연락처를 물어봤지   그러자 그녀가 말했지   그런데 너 내릴때 지나지   않았니   학학학교를 안갔어  학학학교를 안갔어  학학학교를 안갔어  학학학교를 안갔어  결국 오후가 돼서야 학교에  도착한거야 교문앞에선  내 마음은 엄마야 화난  선생님 얼굴 무서운 엄마의  얼굴 회초리 내 종아리  그냥 도망갈까 멀리 멀리  그래도 용기를 내서  교실문을 열었는데  와  혼나긴 커녕 매맞긴 커녕  박수를 받았어
2000.05.28~06.03,42,1576735,다 줄거야 (Acoustic Ver.),조규만,I Will Give You All,2000.01.01,Ballad,조규만,그대 내게 다가오는 그 모습 자꾸 다시 볼수 없을 것만 같아서 감은 두눈 뜨지 못한거야 너를 내게 보내준 걸 감사할뿐야 고마울 뿐야 많이 외로웠던거니 그동안 야워가는 너를 보며 느낄 수 있어 너무 힘이 들땐 실컷 울어 눈물속에 아픈기억 떠나보내게 내품에서 서글픈 우리의 지난 날들을 서로가 조금씩 감싸줘야해 난 네게 너무나도 부족하겠지만 다 줄꺼야 내 남은 모든 사랑을 많이 지쳐있던거야 그동안 자꾸 야워가는  너를 보며 느낄 수 있어 너무 힘이 들땐 실컷 울어 눈물속에 아픈기억 떠나보내게 내품에서 서글픈 우리의 지난 날들을 서로가 조금씩 감싸줘야 해 난 네게 너무나도 부족하지만 다 줄꺼야 내 남은 모든 사랑을 난 네게 너무나도 부족하지만 다 줄거야 내 남은 모든 사랑을
2000.05.28~06.03,43,91322,너를 보내고,YB,한국 Rock 다시 부르기,1999.12.01,Rock,이승희,구름낀 하늘은 왠지 네가 살고 있는 나라일 것 같아서 창문들마저도 닫지 못하고 하루종일 서성이며 있었지 삶의 작은 문턱조차 쉽사리 넘지 못했던 너에게 나는 무슨말이 하고 파서 였을까 먼산 언저리마다 너를 남기고 돌아서는 내게 시간은 그만 놓아주라는데 난 왜 너 닮은 목소리마저 가슴에 품고도 같이가자 하지 못했나  길잃은 작은 새 한마리가 하늘 향해 그리움 외칠때 같이 놀던 어린나무 한그루 혼자 남게 되는게 싫었지 해 저가는 넓은 들판 위에서 차가운 바람불어도 들려오던 노래 내곁에 없었지 먼산 언저리마다 너를 남기고 돌아서는 내게 시간은 그만 놓아주라는데 난 왜 너 닮은 목소리마저 가슴에 품고도 같이가자 하지 못했나 먼산 언저리마다 너를 남기고 돌아서는 내게 시간은 그만 놓아주라는데 난 왜 너 닮은 목소리마저 가슴에 품고도 같이가자 하지 못했나
2000.05.28~06.03,44,8472,Champ,긱스,Gigs,1999.11.24,Rock,이적,그대여 지쳤나요 하루하루를 뒤쫓다가 그래요 이상한 일이에요 우린 되는 일이 없나요 꼭 두들겨 맞은 듯이 상처 뿐 이어도 차마 쓰러질 수 없는 이유를 알기에 다시 일어나 주먹을 쥔다면 그것으로 충분해요 이 거친 세상에 자유를 꿈꾸는 그대가 바로 승자예요 어제는 소중했던 그대 마음 속의 자신이 단숨에 내팽개 쳐 지나요 그리 쉽게 질 순 없어요 꼭 두들겨 맞은 듯이 상처 뿐 이어도 차마 쓰러질 수 없는 이유를 알기에 다시 일어나 주먹을 쥔다면 그것으로 충분해요 이 거친 세상에 자유를 꿈꾸는 그대가 바로 승자예요 그대의 마음에 그대가 있다면 그것으로 충분해요 이 거친 세상에 자유를 원하는 그대가 바로 승자예요  가끔씩은 정신을 잃어 다리가 풀리기도 하죠 그럴 때면 환상을 봐요 언젠가 우리 승리의 잔을 들 그 날을  다시 일어나 주먹을 쥔다면 그것으로 충분해요 이 거친 세상에 자유를 꿈꾸는 그대가 바로 승자예요 그대의 마음에 그대가 있다면 그것으로 충분해요 이 거친 세상에 자유를 원하는 그대가 바로 승자예요
2000.05.28~06.03,45,4050182,Cross,엄정화,코리안 댄스 탑 40 Vol.1,2000.07.06,Dance,,
2000.05.28~06.03,46,2962362,Vision,유승준,Ivy Mega Mix 2,2000.04,Dance,,
2000.05.28~06.03,47,37756,그대도...내게도...,에코,Voice Of Angel,2000.01.01,Ballad,유유진,내게 올까요 만나질까요  그댈 잊게 해줄사람 말예요  그럴 리 없죠 있을 리 없죠  아직도 내 안에 그대가 있으니  나는 겁이 나요 이게 우리 끝일까봐  매일 난 기다려요 그대 목소리 들려오길  이건 아니에요 정말 아니에요  왜 우리가 이래야 해요  난 믿어요 그대에게  사랑은 아직 나뿐이라고 그래요  우리는 다시 만나야만 해요  내가 갈게요 다시 예전처럼  그대 날 안아줘요 (날 안아줘요)    그대 없이 난 안되나봐요  늘 해왔던 일도 손에 잡히질 않죠  소용없어요 누굴 만나도 그대의  얘기만 꺼내게 되네요  나는 겁이 나요 이게 우리 끝일까봐  그대는 어떤가요 지금 나처럼 힘들겠죠  이건 아니에요 정말 아니에요  왜 우리가 이래야 해요  난 믿어요 그대에게  사랑은 아직 나뿐이라고 그래요  우리는 다시 만나야만 해요  내가 갈게요 다시 예전처럼  그대 날 안아줘요 (날 안아줘요)  날 위해서 가요 그대가 떠난 이유가  왜 아직도 나를 몰라요 그대가 없다면  내게 뭐가 소용 있어요 우~  나를 믿어줘요 나를 지켜줘요  그게 나를 위한 거에요  이대로 우리 헤어진다면  다신 이런 사랑 못해요  그대도 내게도 또 다른 사랑은 없어요  늦지 않아요 다시 예전 그때처럼 그대 날 안아 줘요
2000.05.28~06.03,48,88501,Farewell,이주노,Bionic Jono,2000.03.18,Rap / Hip-hop,이승호,조금씩 말이 없어지는 너를 느꼈고 함께하는 시간도 많이 줄어 들었지 언제나 내 모습 가득 니 눈빛 속에 담아 두었는데 너무나 싸늘히 식어버린 것도 느꼈어 혹시나 했지만 한마디 물어볼 순 없었고 가슴은 얼음처럼 얼어가고 있었지 이별만은 아닐거란 혼자만의 위로 이제는 헤어지잔 말 Tell me Why  사랑이 끝났다는 말 I don't know  어떻게 그렇게 쉽게 그 말 할 수 있는지  나보다 더 나를 사랑했던 너인데  이렇게 돌아서 가버리면 끝나는건지  꿈에도 이별은 생각한 적 없었어  힘만 더 들거라는 말 Tell me Why  각자의 길을 가잔 말 I don't know 말해봐 너 떠나면 날 잊을 수 있어 말해봐 너 나 없이 행복할 수 있는지 모르겠어 모르겠어 모르겠어 모르겠어 모르겠어 모르겠어 모르겠어 모르겠어 정말 난 널 모르겠어 이제는 헤어지잔 말 Tell me Why  사랑이 끝났다는 말 I don't know  꼭 나를 떠나야 할 또 다른 이유있다면 보내줄게 사랑으로 힘만 더 들거라는 말 Tell me Why  각자의 길을 가잔 말 I don't know 난 어디서부터 너를 잊어야할지 또 난 무얼 기억해야 할지도 모른채 멀어져 가는 너를 바라만 봤어 사라진 후에도 한참을 그렇게 파노라마처럼 내 눈앞에 펼쳐지는 너와의 가슴시린 지난 추억들이 조금씩 눈물로 흐려질 때쯤 또 한번 내 가슴은 무너져 이제는 헤어지잔 말 Tell me Why  사랑이 끝났다는 말 I don't know  힘만 더 들거라는 말 Tell me Why  각자의 길을 가잔 말 I don't know
2000.05.28~06.03,49,39017,쇼크,구피,Techno,2000.01.21,Dance,조진광,지금 이 시간  순간순간 함께하는  이 시간 속에 안에  내 가슴속에 날 잡고 자릴잡고  보고있는 내 하나뿐인 너  사랑스러 그런 니가 부담스러  그런 나를 이해하는  니 눈빛도 부담스러  난 믿어 널 믿어 우리 사랑 믿어  믿음들과 사랑으로 바라보는 널  Forever love you  I love you I love you  영원히 널 기억할꺼야  이젠 내 꿈속에 항상  니가 있을테니까  알 수 없는 너의 눈빛들  요즘 너무 불안했었어  내 품안에 숨결까지  이젠 낯설은 걸 알고있어  너의 일기속에 몰래 숨겨진 말들  네 맘에 나는 없었던거야  보았어 예전 네 생일 우연히 소개했던 친구와 너를 환하게 웃는 네 입술 그 미소 그가 너의 사랑이었니 Forever love you I love you I love you 영원히 널 기억할꺼야 이젠 내 꿈속에 항상 니가 있을테니까 니 눈빛속에 비춰지는 내 친구 모습이 마치 비우고 다시 채워지는 술잔처럼 연인처럼 별빛처럼 비춰지는지 이건 아냐 넌 아냐 그건 니가 아냐 이건 정말 현실이 아냐 뭐든 쉽게 쓰는대로 변해버리는 마치 넌 물감처럼 변해버리지 그래 우린 연인 아닌 낯선 셋일때가 많았지 미안해 나만 몰랐던거야 보았어 예전 네 생일 우연히 소개했던 친구와 너를 환하게 웃는 네 입술 그 미소 그가 너의 사랑이었니 Forever love you I love you I love you 영원히 널 기억할꺼야 이젠 내 꿈속에 항상 니가 있을테니까 너의 눈을 볼 수 없어 미안할뿐야 오랫동안 아파할 너를 난 기억할 테니까 Forever love you I love you I love you 영원히 널 기억할꺼야 혹시 그 사람이 너를 버릴지도 모르니
2000.05.28~06.03,50,91309,어머님께,god,Chapter 1,1999.01,Ballad,박진영,어머니 보고싶어요  어려서부터 우리집은 가난했었고 남들 다하는 외식 몇번 한적이 없었고 일터에 나가신 어머니 집에 없으면 언제나 혼자서 끓여 먹었던 라면 그러다 라면이 너무 지겨웠어 맛있는것 좀 먹자고 대들었었어 그러자 어머님은 마지못해 꺼내신 숨겨두신 비상금으로 시켜주신 자장면 하나에 너무나 행복했었어 하지만 어머님은 왠지 드시질 않았어 어머님은 자장면이 싫다고 하셨어 어머님은 자장면이 싫다고 하셨어 야이야아아 그렇게 살아가고 그렇게 후회하고 눈물도 흘리고 야이야아아 그렇게 살아가고 너무나 아프고 하지만 다시 웃고 중학교 일학년때 도시락 까먹을 때 다 같이 함께 모여 도시락 뚜껑을 열었는데 부잣집 아들 녀석이 나에게 화를 냈어 반찬이 그게 뭐냐며 나에게 뭐라고 했어 창피해서 그만 눈물이 났어 그러자 그녀석은 내가 운다며 놀려댔어 참을 수 없어서 얼굴로 날아간 내 주먹에 일터에 계시던 어머님은 또 다시 학교에 불려오셨어 아니 또 끌려오셨어 다시는 이런 일이 없을거라며 비셨어 그 녀석 어머님께 고개를 숙여 비셨어 우리 어머니가 비셨어 야이야아아 그렇게 살아가고 그렇게 후회하고 눈물도 흘리고 야이야아아 그렇게 살아가고 너무나 아프고 하지만 다시 웃고 아버지 없이 마침내 우리는 해냈어 마침내 조그만 식당을 하나 갖게 됐어 그리 크진 않았지만 행복했어 주름진 어머님 눈가에 눈물이 고였어 어머니와 내 이름에 앞 글자를 따서 식당 이름을 짓고 고사를 지내고 밤이 깊어가도 아무도 떠날줄 모르고 사람들의 축하는 계속되었고 자정이 다 돼서야 돌아갔어 피곤하셨는지 어머님은 어느새 깊이 잠이 들어 버리시고는 깨지 않으셨어 다시는 난 당신을 사랑했어요 한번도 말을 못했지만 사랑해요 이젠 편히 쉬어요 내가 없는 세상에서 영원토록 야이야아아 그렇게 살아가고 그렇게 후회하고 눈물도 흘리고 야이야아아 그렇게 살아가고 너무나 아프고 하지만 다시 웃고 야이야아아 그렇게 살아가고 그렇게 후회하고 눈물도 흘리고 야이야아아 그렇게 살아가고 너무나 아프고 하지만 다시 웃고
