time,rank,song_id,title,singers,album,date,genre,creator,lyric
2009.02.01~02.07,1,2012282,Gee,소녀시대(GIRLS`GENERATION),The First Mini Album `Gee`,2009.01.05,Dance,이트라이브,Uh Huh Listen Boy  My First Love Story  My Angel and My Girl My Sunshine Uh Uh Let's go 너무 너무 멋져 눈이 눈이 부셔 숨을 못 쉬겠어 떨리는 Girl Gee Gee Gee Gee Baby Baby Baby Gee Gee Gee Gee Baby Baby Baby 너무 부끄러워 쳐다 볼 수 없어 사랑에 빠져서 수줍은 Girl Gee Gee Gee Gee Baby Baby Baby Gee Gee Gee Gee Be Be Be Be Be Be 어떻게 하죠 어떡 어떡하죠 떨리는 나는 떨리는 나는요 두근 두근 두근 두근 두근 두근거려 밤엔 잠도 못 이루죠 나는 나는 바본가봐요 그대 그대밖에 모르는 바보 그래요 그댈 보는 난 너무 반짝 반짝 눈이 부셔 No No No No No 너무 깜짝 깜짝 놀란 나는 Oh Oh Oh Oh Oh 너무 짜릿 짜릿 몸이 떨려 Gee Gee Gee Gee Gee Oh 젖은 눈빛 Oh Yeah 좋은 향기 Oh Yeah Yeah Yeah 너무 너무 예뻐 맘이 너무 예뻐 첫 눈에 반했어 꼭 짚은 Girl Gee Gee Gee Gee Baby Baby Baby Gee Gee Gee Gee Baby Baby Baby 너무나 뜨거워 만질 수가 없어 사랑에 타버려 후끈한 Girl Gee Gee Gee Gee Baby Baby Baby Gee Gee Gee Gee Be Be Be Be Be Be 어쩌면 좋아 어쩌면 좋아요 수줍은 나는 수줍은 나는요 몰라 몰라 몰라 몰라 몰라 몰라 하며 매일 그대만 그리죠 친한 친구들은 말하죠 정말 너는 정말 못 말려 바보 하지만 그댈 보는 난 너무 반짝 반짝 눈이 부셔 No No No No No 너무 깜짝 깜짝 놀란 나는 Oh Oh Oh Oh Oh 너무 짜릿 짜릿 몸이 떨려 Gee Gee Gee Gee Gee Oh 젖은 눈빛 Oh Yeah 좋은 향기 Oh Yeah Yeah Yeah 말도 못했는 걸 너무 부끄러워 하는 난 용기가 없는 걸까 어떡해야 좋은걸까 두근 두근 맘 졸이며 바라보고 있는 난 너무 반짝 반짝 눈이 부셔 No No No No No 너무 깜짝 깜짝 놀란 나는 Oh Oh Oh Oh Oh 너무 짜릿 짜릿 몸이 떨려 Gee Gee Gee Gee Gee Oh 젖은 눈빛 Oh Yeah 좋은 향기 Oh Yeah 너무 반짝 반짝 눈이 부셔 No No No No No 너무 깜짝 깜짝 놀란 나는 Oh Oh Oh Oh Oh 너무 짜릿 짜릿 몸이 떨려 Gee Gee Gee Gee Gee Oh 젖은 눈빛 Oh Yeah 좋은 향기 Oh Yeah Yeah Yeah
2009.02.01~02.07,2,1951552,Strong Baby,승리,Remember,2008.11.05,Dance,"배진렬(JRGroove),G-DRAGON",Hey sexy Crack crack crack crack Tonight you know Crack crack crack crack I'm a strong baby Crack crack crack crack Put on my jacket and than Let's go Let's make love tonight 오늘 밤 내 눈을 가려줘 여기까지란 소린마 날 놓지 말아줘 터지는 네온싸인 깨지는 미러볼 이 곳엔 너와 나 단 둘이서 Rock and Roll 헤이 거기 Baby tell me What you want it say yeh 아직도 넌 누굴 기다리고 있는지 헤이 거기 Baby take me 어서 빨리 Come to me 거칠게 다가와 Don't stop 이제 시작이야  하나가 될 시간이야 내 발등에 너의 발이 내 몸 속에 너의 팔이 같이 춤을 추고  같이 불을 피죠 We're so hottest in the world like d d d d d this yo You like it Crack crack crack crack We all grown up Crack crack crack crack 새빨간 거짓말 내가 싫다 말하지마 왜 이제와 딴소리 네 볼에 남은 키스자국 절대로 잊지 못할 어젯밤 뜨거웠던 밤은 나이는 묻지마 I'll guess you know you love me 헤이 거기 Baby tell me What you want it say yeh 떨리는 눈 뭘 망설이고 있는지 헤이 거기 Baby take me 어서 빨리 Come to me 너무 겁내지마 Relex your mind I'm so so cool 이제 시작이야  하나가 될 시간이야 내 발등에 너의 발이 내 몸 속에 너의 팔이 같이 춤을 추고  같이 불을 피죠 We're so hottest in the world like d d d d d this yo Let's party baby  Shake it baby All night long Just one night one shot V I C T O R Y  Feel me my baby Hot like the fire 넌 아니라 말하지만  네 눈은 말하잖아 음악 속에 널 던져 C'mon girl with me Yo Let's dance 이제 시작이야  하나가 될 시간이야 내 발등에 너의 발이 내 몸 속에 너의 팔이 같이 춤을 추고  같이 불을 피죠 We're so hottest in the world like d d d d d this yo Come a little closer Crack crack crack crack Ye just like that Crack crack crack crack You know how it is Crack crack crack crack V I like this bye ladies
2009.02.01~02.07,3,1996934,이젠 남이야 (Feat. Baby-J Of Jewelry),김경록(V.O.S),People & People,2008.12.16,Ballad,조영수,차라리 만나지 말 걸 그랬나봐 이게 뭐야 결국 이렇게 될거면서 우리 그만 헤어지자 우리 사랑 하지 말았어야 돼 우리 우리 사랑 하지 말았어야 돼 우리 그만 여기서 끝내자  우리 사랑해선 안 됐어야 돼 우리 우리 사랑해선 안 됐어야 돼 우리 서로 반대로만 살자 우린 이젠 남이야 남보다 더 못한 사이야 서로가 상처만 주고 눈물만 흘리고 미움만 커지고 끝나 사랑같은 거 안 해 그까짓 사랑 이제 싫어 다시는 마주치지 마 내 얘기 하지 마 우린 남이니까 술에 취한 너를 내가 기다릴 필요 없고 피곤해 하는 너를 받아줄 일 없고 생일때마다 너에게 서운해 할 일 없고 아무것도 너에게 난 바랄 일이 없어 근데 참 이상하지 네가 왜 걱정되지 나 없인 아무 것도 못하는데 정말로 괜찮은지 나 없이 괜찮은지 우린 이제 남이야 남보다 더 못한 사이야 서로가 상처만 주고 눈물만 흘리고 미움만 커지고 끝나 사랑같은 거 안 해 그까짓 사랑 이제 싫어 다시는 마주치지 마 내 얘기 하지 마 우린 남이니까 이럴 걸 왜 사랑해 이럴 걸 왜 잘해준거니 잊기만 힘들어 지게 자꾸 생각나게 네 품이 그리워지게 다신 사랑하지 마 나같은 사람 만들지 마 똑같은 상처 주지 마 잘해주지도 마 결국 남이니까  우리 사랑 하지 말았어야 돼 우리 우리 사랑 해선 안됐어야 돼 우리 이젠 우리도 남이야
2009.02.01~02.07,4,2030248,떠나지마...,윤미래,떠나지마... (Digital Single),2009.01.19,R&B / Soul,,시계만 보고 있는 너 보면서 심장이 터져 버릴 것만 같았어 나는 너 정말 너 하나뿐이야 제발 떠나지마 1분 2분 5분 10분 흐를 때마다 자꾸 내 가슴은 불안해져 가 차갑게 식어진 커피향 속에 내 눈물이 흘러내려 Oh 니가 떠나고 또 내가 떠나고 불빛 속 음악도 떠나고 모두 부서져 버린 다 부서져 버린 사랑만 남아 그대여 떠나지마 너를 사랑했던 날 널 사랑했던 날 니 가슴속에 가져가 그대여 떠나지마 다시 돌아온다고 너 돌아온다고 거짓말이라도 해봐 마지막 부탁이야  하루 이틀 일년 십년 지나면 뭐해 자꾸 니 모습이 생각날텐데 마치 영화 속의 그 장면처럼 내 눈물이 흘러내려 Oh 니가 떠나고 또 내가 떠나고 불빛 속 음악도 떠나고 모두 부서져 버린 다 부서져 버린 사랑만 남아 그대여 떠나지마 너를 사랑했던 날 널 사랑했던 날 니 가슴속에 가져가 그대여 떠나지마 다시 돌아온다고 너 돌아온다고 거짓말이라도 해봐 그대여 떠나지마 너를 사랑했던 날 널 사랑했던 날 니 가슴속에 가져가 그대여 떠나지마 다시 돌아온다고 너 돌아온다고 거짓말이라도 해봐 마지막 부탁이야 부탁이야 부탁이야
2009.02.01~02.07,5,2020854,사랑..다 거짓말,린,"Let Go, Let In, It`s A New Day",2009.01.13,Ballad,린,우리가 함께 걷던 길에 너무도 다정했던 그대가 아직 그대로 미소 지으며 서 있을 것만 같아요 둘이 발맞춰 걷던 길 위엔 어느 새 내 쓸쓸한 걸음만 혼자 비처럼 내리는 눈물을 맞고 있죠 이제 우린 끝인가요 사랑 도대체 그게 뭔데 이렇게 죽을 것처럼 맘이 아픈데 왜 날 울리는데 행복했었는데 그랬는데 나를 참 사랑해줬었는데 우리가 왜 헤어져야해 다 거짓말 다 거짓말 영원하단 말은 모두 거짓말  아직은 다른 사람 만나 우리가 사랑했던 것처럼 웃고 떠들고 안아주고 또 입맞춤 하지 말아요 내 모든 걸 다 예뻐해주고 사람들에게 내 자랑을 해주던 이제부터 그대 내 사람 아니라고 벌써 그러면 안돼요 사람 사는 일이 다 그런거라고 이별 할 때마다 수백 번도 더 했던 말버릇 이제는 위로도 되질 않죠 오 나를 참 사랑해줬었는데 우리가 왜 헤어져야해 다 거짓말 다 거짓말 영원하단말은 모두 거짓말 바보같은 나는 또 이렇게 매번 아파하면서 그래도 또 사랑을 슬픈 이별을 반복 하게 되겠죠 아프지 않게 사랑 믿지 않을래요 다시는 혼자가 두렵지 않게 그대 왜 날 사랑 도대체 그게 뭔데 이렇게 죽을 것처럼 맘이 아픈데 왜 날 울리는데 행복했었는데 그랬는데 우리 사랑했던 그 때 부터 그대 떠나던 순간까지 다 잊을래 다 잊을래 처음부터 그냥 없던 것처럼
2009.02.01~02.07,6,1977448,러브119 (Feat. MC몽),케이윌,Love119,2008.12.02,Ballad,"MC몽,박장근",내 심장이 내 사랑이   멈출 것 같아도  나 지금 아파 열이나   숨도 못 쉬어  멍든 가슴은 니 이름만 외쳐  I Can't Believe That It's Over  너라는 여자 남에게는 못 줘  내 사랑은 단 하루도 못 쉬어  내 가슴은 너 없이는 못 뛰어  너 없이는 뭘 할 수 있겠어  I Can't Believe that it's over  I can't never let you go  That you why you   got to know  지쳐 쓰러질 때까지 나   사랑을 원하고  이젠 제발 날 사랑해줘  하나뿐인 Girl Friend   Let's begin  다시 시작해 Till the end 사랑해 세월이 지나도  널 사랑해 세상이 변한대도  다른 누구도 널 대신 할 수 없어  너도 알고 있잖아  내 사랑은 단 하루도 못 쉬어  너 없이 난 한 순간도 못살아  니가 있어야만 난 숨을 쉬어  영원히 언제까지나 사랑해  Please 내 사랑은 Emergency  돌아와 Give me one more   chance to me  우린 떼어낼 수 없는 Man to be  Please 내 사랑은 Emergency  돌아와 Give me one more   chance to me  우린 떼어낼 수 없는 Man to be  제발 나만 선택해 Make it Hot  우리 사랑이 불타 버리게  너를 못 보는 것보다  차라리 담배를 끊는 게 편해  이젠 제발 날 사랑해줘  하나뿐인 Girl Friend   Let's begin  다시 시작해 Till the end 널 사랑해 세월이 지나도  널 사랑해 세상이 변한대도  다른 누구도 널 대신 할 수 없어  너도 알고 있잖아  내 사랑은 단 하루도 못 쉬어  너 없이 난 한 순간도 못살아  니가 있어야만 난 숨을 쉬어  영원히 언제까지나 사랑해  심장이 멈출 것 같아도  심장이 멈출 것 같아도  내 사랑 너와 나 이대로  내 사랑 너와 나 이대로  고마워 날 사랑해 줘서  고마워 날 웃게 해줘서 내 심장이 내 사랑이   멈출 것 같아도  나의 눈이 아닌 내   가슴으로 하는 말  언제까지나 널 사랑해  십 년이 지나도  그대 밤을 비추는 저 별처럼  다시 한번 태어나더라도  그렇게 난 그대만을 사랑해  Back Back I want it back  힘이 될 사랑을 지켜줘  You you you got to know  너만을 위해 I need your Love  Back Back I want it back  힘이 될 사랑을 지켜줘  You you you got to know  너만을 위해 I need your Love  사랑해
2009.02.01~02.07,7,2012251,연애소설,가비엔제이,연애소설,2009.01.05,Ballad,민명기,자꾸 너만 바라보게 되잖아 너의 곁에 다른 사람있는데 언제나 두 눈 속에 너만 내 맘 속에 너만 또 가득찬걸 가끔 스치듯이 웃어줄 때면 하루종일 그 미소만 생각나 알겠니 너의 그녀가 나였으면 내사랑이 꼭 너였으면 사랑하고 싶어 너를 갖고 싶어 밤새 준비했던 말 한마디 못했지만 내겐 너뿐이야 날 울리는 사람 나를 설레게한 단 한사람 아파도 좋은걸 가질순 없어도 너의 뒤에서 난 너만 간직하며 살게 그래도 괜찮아 널 사랑해서 널 볼수만 있다면  너의 그녀 어디가 그리 좋아 그녈 보고 늘 웃고 있는건지 나 역시 어쩔수 없는 여잔가봐 그녀가 너무 부럽잖아 사랑하고 싶어 너를 갖고 싶어 밤새 준비했던 말 한마디 못했지만 내겐 너뿐이야 날 울리는 사람 나를 설레게한 단 한사람 아파도 좋은걸 가질순 없어도 너의 뒤에서 난 너만 간직하며 살게 그래도 괜찮아 널 사랑해서 널 볼수만 있다면 다짐해도 내눈은 너만 향하는데 내 맘이 미쳤나봐 너만을 찾나봐 정말 사랑해선 안되는데 너란 말야 오직 너란 말야 바라고 또 바래 아무 소용 없겠지만 이젠 돌아갈래 너를 놓아줄게 너무 사랑스런 그녀잖아 아파도 좋은걸 가질순 없어도 너의 뒤에서 난 너만 간직하며 살게 고마워 내 사랑은 아니라도 널 볼수가 있어서
2009.02.01~02.07,8,1984049,Pretty Girl,카라,Pretty Girl (2nd Mini Album),2008.12.04,Dance,"한재호,김승수,송수윤",one two three yeah If you wanna pretty every wanna pretty 안된다는 맘은 no no no no If you wanna pretty every wanna pretty 어디서나 당당하게 걷기 나와 맞는 옷에 또 받쳐주는 말투 센스있는 포즈 그냥 되지는 않죠 생활 상식은 기본 시사 상식은 선택 다 끊임없는 노력이죠 Girl Pretty Girl Pretty Girl 조금도 망설일 것 없죠 난 Beautiful Girl Beautiful Girl Beautiful yeah yeah yeah yeah Girl Pretty Girl Pretty Girl 그냥 되진 않는거죠 난 Beautiful Girl Beautiful yeah yeah yeah yeah Come on Beautiful Girl If you wanna pretty every wanna pretty 안된다는 맘은 no no no no If you wanna pretty every wanna pretty 어디서나 당당하게 걷기 Girl Pretty Girl Pretty Girl 조금도 망설일 것 없죠 난 Beautiful Girl Beautiful Girl Beautiful yeah yeah yeah yeah Girl Pretty Girl Pretty Girl 그냥 되진 않는거죠 난 Beautiful Girl Beautiful yeah yeah yeah yeah Come on Beautiful Girl 마음은 예쁘게 표정은 산뜻하게 하루를 시작하면서 잊지 말아야 하죠 두 눈을 깜박이며 살짝 미소 지으면 이젠 모든게 완벽하죠 Girl Pretty Girl Pretty Girl 누구라도 될 수 있죠 난 Beautiful Girl Beautiful yeah yeah yeah yeah yeah yeah yeah yeah Girl Pretty Girl Pretty Girl 그냥 되진 않는거죠 난 Beautiful Girl Beautiful Girl If you wanna pretty every wanna pretty 안된다는 맘은 no no no no If you wanna pretty every wanna pretty 어디서나 당당하게 걷기
2009.02.01~02.07,9,2024974,AH,애프터스쿨,New Schoolgirl,2009.01.15,Dance,용감한형제,이렇게 둘이 너와 단 둘이 언제나 우린 달콤한 이야길 하고파 둘이 둘이 오늘밤 둘이 사랑해 우리 둘이 둘이 baby 잘빠진 다리와 외모 너는 내게 반하지 그대를 향한 윙크 한번 내게 빠지지 니 높은 콧대 내 몸맨 어때 내 앞에선 니 모든게 무너지고 말껄 사랑한다 말만 말고 보여 주겠니 나도 니가 맘에 들어 춤을 추겠니 너와 난 왠지 자꾸만 왠지 통할 것만 같아 너를 사랑 할것 같아 이렇게 둘이 너와 단 둘이 언제나 우린 달콤한 이야길 하고파 둘이 둘이 오늘밤 둘이 사랑해 우리 둘이 둘이 baby 짧은 시간 가까워진 우리 둘 사이 그대와 난 이제 하늘이 맺어준 사이 두말 할 필요 없어 다가와 내게 어서 조명이 나를 번쩍 비추면 그댈 유혹하는 내 눈빛이 뜨거워지지 다른 남자들은 니가 너무 부러워지지 말은 안해도 난 알잖아 표현 안해도 다 알아 빨개진 니 얼굴이 다 말을 해주잖아 이렇게 둘이 너와 단 둘이 언제나 우린 달콤한 이야길 하고파 둘이 둘이 오늘밤 둘이 사랑해 우리 둘이 둘이 baby  after school in the house 모두 같이 make it bounce 들어봐 지금 내 말 오늘밤 tonight 다가와 말 못했던 얘기 우리 둘만의 작고 작은 속삭임 그래 넌 지금 날 너무 원하지 가벼운건 싫어 내 모습이 다른 장소 after party 걱정마 이런 내 스타일에 오늘밤은 후회 안해 내 맘을 뺏어봐 baby boy 이렇게 둘이 너와 단 둘이 언제나 우린 달콤한 이야길 하고파 둘이 둘이 오늘밤 둘이 사랑해 우리 둘이 둘이 baby
2009.02.01~02.07,10,1958819,총맞은것처럼,백지영,Sensibility,2008.11.13,Ballad,방시혁,총 맞은 것처럼 정신이 너무 없어 웃음만 나와서 그냥 웃었어 그냥 웃었어 그냥 허탈하게 웃으며 하나만 묻자 했어 우리 왜 헤어져 어떻게 헤어져 어떻게 헤어져 어떻게 구멍난 가슴에 우리 추억이 흘러 넘쳐 잡아보려 해도 가슴을 막아도 손가락 사이로 빠져나가 심장이 멈춰도 이렇게 아플 것 같진 않아 어떻게 좀 해줘 날 좀 치료해줘 이러다 내 가슴 다 망가져 구멍난 가슴이 어느새 눈물이 나도 모르게 흘러 이러기 싫은데 정말 싫은데 정말 싫은데 정말 일어서는 널 따라 무작정 쫓아 갔어 도망치듯 걷는 너의 뒤에서 너의 뒤에서 소리쳤어 구멍난 가슴에 우리 추억이 흘러 넘쳐 잡아보려 해도 가슴을 막아도 손가락 사이로 빠져나가 심장이 멈춰도 이렇게 아플 것 같진 않아 어떻게 좀 해줘 날 좀 치료해줘 이러다 내 가슴 다 망가져 총 맞은 것처럼 정말 가슴이 너무 아파 이렇게 아픈데 이렇게 아픈데 살 수가 있다는 게 이상해 어떻게 너를 잊어 내가 그런 건 나는 몰라 몰라 가슴이 뻥뚫려 채울 수 없어서 죽을 만큼 아프기만 해 총 맞은 것처럼
2009.02.01~02.07,11,2040667,가버려 너,플라이투더스카이,Decennium,2009.01.29,Ballad,정엽,혼자 울면 너무 서러워 안아주던 너 없어서 왜 그랬어 내게 참 따뜻하게 한번만 못나지 내게 그럼 쉽게 지웠잖아 가버려 너 가버려 너 온종일 그리워 우는 내 맘에서 가버려 너 한번만 더 한번만 더 니가 오는 꿈만 꾸는 내가 너무 미워 가버려 부탁할게  왜 그랬어 내게 참 모질게도 한번도 미워도 나는 너만 사랑했었는데 가버려 너 가버려 너 온종일 그리워 우는 내 맘에서 가버려 너 한번만 더 한번만 더 니가 오는 꿈만 꾸는 내가 너무 미워 가버려 부탁할게 후회해도 널 사랑한 기억 습관처럼 늘 떠올린 추억 니가 전부였던 나만 이런가 봐 정말 난 바본가 봐 가버려 너 가버려 너 온종일 그리워 우는 내 맘에서 가버려 너 한번만 더 한번만 더 니가 오는 꿈만 꾸는 내가 너무 미워 가버려 부탁할게
2009.02.01~02.07,12,1951550,붉은 노을,BIGBANG,Remember,2008.11.05,Rap / Hip-hop,"이영훈,G-DRAGON",난 너를 사랑해 Let's go Yes sir We're back again with 이문세 That's right Fresh celebration 2008 It's bigbang ye ye bust it 그댄 아시나요 있잖아요 지금 그대가 너무 그리워요 고개 숙여 눈물 훔쳐요 당신의 이름을 불러요 꼭 이렇게 날 남겨두고 떠나가야만 했는지 너만 생각하면 머리 아퍼 독하디 독한 술 같어 술 뿐이겠어 병이지 매일 앓아누워 몇 번인지 내일이면 또 잠깐 잊었다가 또 모레쯤이면 생각나겠지만 그래도 어떡해 아직 내 사랑 유효한데 돌아올 거라고 믿는데 난 너만 기다리는데 난 너를 사랑해 Oh I love you girl 이 세상은 너 뿐이야 소리쳐 부르지만 저 대답 없는 노을만 붉게 타는데 혹시 그대가 미안해한다면 내 얼굴 보기 두렵다면 Girl 그런 걱정 하덜덜덜 마 너라면 힘이 펄펄펄 나 보고 싶은 그대 얼굴 저 붉은 노을을 닮아 더 슬퍼지는 걸 Oh baby baby 다 지나간 시간 우리가 함께한 추억 잊진 말아줘요 눈을 감아 소리 없이 날 불러준다면 언제라도 달려 갈께요 Everyday everynight I need you 난 너를 사랑해 Oh I love you girl 이 세상은 너 뿐이야 소리쳐 부르지만 저 대답 없는 노을만 붉게 타는데 아름다웠던 그대 모습을 이젠 볼 순 없겠지만 후횐 없어 그저 바라볼 수 있게 붉게 타주오 Ah Ah Ah Ah Ah Ah Ah Ah Let's go Ah Ah Ah Ah Ah Ah Ah Ah 해가 뜨고 해가 지네 노을 빛에 슬퍼지네 달이 뜨고 달이 지네 세월 속에 나 또한 무뎌지네 해가 뜨고 해가 지네 노을 빛에 슬퍼지네 달이 뜨고 달이 지네 그대 기억 또한 무뎌지네 난 너를 사랑해 Oh I love you girl 이 세상은 너 뿐이야 소리쳐 부르지만 저 대답 없는 노을만 붉게 타는데 난 너를 사랑해 I love you girl 이 세상은 너 뿐이야 소리쳐 부르지만 저 대답 없는 노을만 붉게 타는데 Once again Ah Ah Ah Ah Ah Ah Ah Ah Let's go Ah Ah Ah Ah Ah Ah Ah Ah big bang
2009.02.01~02.07,13,1964754,비와 당신 (영화 `라디오스타` 삽입곡),럼블피쉬,Memory For You,2008.11.20,Rock,방준석,이젠 당신이 그립지 않죠 보고 싶은 마음도 없죠 사랑한 것도 잊혀가네요 조용하게 알 수 없는 건 그런 내 맘이 비가 오면 눈물이 나요 아주 오래전 당신 떠나던 그날 처럼 이젠 괜찮은데 사랑따윈 저버렸는데 바보같은 난 눈물이 날까 아련해지는 빛바랜 추억 그 얼마나 사무친건지 미운 당신을 아직도 나는 그리워하네 이젠 괜찮은데 사랑 따윈 저버렸는데 바보같은 난 눈물이 날까 다신 안올텐데 잊지 못한 내가 싫은데 언제까지 내 맘은 아플까 이젠 괜찮은데 사랑따윈 저버렸는데 바보같은 나 눈물이 날까
2009.02.01~02.07,14,1967001,U R Man,SS501,SS501 스페셜 앨범,2008.11.21,Dance,"한상원,임영",전화길 다시 내려놓고  꽃다발 가슴에 묻어두고  밤새워서 써둔 편지도  비에 적셔 내리네  창문을 또 열어보고  그대 이름을 불러도  대답 없는 벨소리만  귓가에 들리네  아까아까워 나 모든 것이 그리워  아까워 나 모든 것이 괴로워  아까아까아까워  나 너 말고는 다른 여자 몰라  I'm your man I'm your man 그대여  da la da da 오늘도  나는 오늘도 그대만 생각해  I'm your man  I'm your man 그대여  da la da da 오늘도  그대가 떠나지 않아  I'm your man  I'm your man  거리를 또 헤매죠  어딘지도 몰라요  혹시라도 또 그대가 나타날까  I'm your man 꿈에라도 모르죠  웃으며 반겨줄까  다시 찾아올 지 몰라  I'm your man  눈 감으면 그대 선명해도  귓가에 목소리 들려와도  그대 향기 맴돌아도  이미 그댄 떠나고  더 많이 더 생각나고  가고 나서야 알았죠  이게 바로 사랑일까  떠나간 그대여  아까아까워 나 모든 것이 그리워  아까워 나 모든 것이 괴로워  아까아까아까워  나 떠나 버린 네 생각에 돌아  I'm your man  I'm your man 그대여  da la da  da 오늘도  나는 오늘도 그대만 생각해  I'm your man  I'm your man 그대여  da la da da 오늘도  그대가 떠나지않아  I'm your man  I'm your man  거리를 또 헤매죠  어딘지도 몰라요  혹시라도 또 그대가 나타날까  I'm your man  꿈에라도 모르죠  웃으며 반겨줄까  다시 찾아올 지 몰라  I'm your man  떠나간 네가 울던 걸 알아  그리고 이제 지운 걸 알아  이젠 나란 남잔  이젠 괜찮아 비참하잖아  왜 나는 안 되니  내가 네 사람이잖아  I'm your man  I'm your man 그대여  da la da da 오늘도  나는 오늘도 그대만 생각해  I'm your man  I'm your man 그대여  da la da da 오늘도  그대가 떠나지 않아  I'm your man  I'm your man  거리를 또 헤매죠  어딘지도 몰라요  혹시라도 또 그대가 나타날까  I'm your man  꿈에라도 모르죠  웃으며 반겨줄까  다시 찾아올 지 몰라  I'm your man  I'm your man
