time,rank,song_id,title,singers,album,date,genre,creator,lyric
2006.10.30~11.05,66,1368237,We Belong Together,BIGBANG,BigBang First Single,2006.08.29,Rap / Hip-hop,G.DRAGON&amp;TOP,내 눈을 봐요 oh  그대만을 믿어볼래요  매일 혼자서 울기만 하네요  너무나 고마운걸요  oh baby baby  날 안아줘요  이대로 영원히 함께해요  지친 그대 내게 기대도 되요  언제나 그댈 사랑할래요 baby  uh uh hey baby girl  what's up  오늘도 눈부신 나의 그녀가  내게로 다가와  uh 저기보여 say hi  my sweet lover  난 아직도 부끄러워  널 보면 너무나도 떨려  이런 날 안아줘  cuz i'm fla fla ye  fly to the sky  우리 만나지 못했더라면  uh 나 어땠을까  넌 내가 사는 이유  너 없인 안돼  i need you feel you  내 눈을 바라봐요 ma luv  oh baby baby  내게만 속삭여줘  달콤한 네 그 입술로  내 곁에서만 살아줘  같이 흘렸던 그 눈물로  하늘 보며 맹세했잖아  우리 영원하기로 맨날 기도해  날 믿어 ye 널 사랑해  내 눈을 봐요  oh 그대만을 믿어볼래요  매일 혼자서 울기만 하네요  너무나 고마운걸요  oh baby baby  날 안아줘요  이대로 영원히 함께해요  지친 그대 내게 기대도 되요  언제나 그댈 사랑할래요  hey hey hey hey  잠깐 stop plz  그대는 내게는 하나뿐인  눈부신 영혼을 나눈  나만의 신부님  누가 뭐라 해도 너와 내 사인  못 끌 큰 불씨  이 세상 가장  most in credible  매일 홀로 되묻지  단 둘이 외로이  삶을 살아간대도  나 지치고 지쳐서  너와 나 떨어진대도  세상에 미로에 갇혀버린  날 위로해준 그댄 내 hero  너를 만난뒤  내 삶은 like drama  uh 널 향한 내 맘은  산과 나무들 보단 더 넓고  더 푸른 like 바다 같다오  파도는 바다도 너와 날 질투해  치는 바람과의 다툼  영원히 me &amp; you  우리 사랑은 현재진행중  내 눈을 봐요  oh 그대만을 믿어볼래요  매일 혼자서 울기만 하네요  너무나 고마운걸요  oh baby baby  날 안아줘요 이대로  영원히 함께해요  지친 그대 내게 기대도 되요  언제나 그댈 사랑할래요  그대여 내 손을 잡아요  나를 믿어요  우리 함께니  걱정할것 전혀 없어요  그대여 날 바라봐요  주저말고 내게 기대요  나 그대 생각에  오늘도 항상 설레요  부푼 가슴을 안고  그대 찾아갈래요  그대여 우리 영원히    oh baby baby  날 떠나지 마요  그대없인 나도 없는걸  넌 알잖아요  oh baby baby  내 손 놓지마요  날 울리지마  이대로 영원히 내 사랑아  oh baby baby  시간이 지나도  우리 예전 같지않아  u know 날 알잖아요  oh baby baby  여기 있잖아요  내게 안겨 기대줘  날 믿어줘 내 사랑아
2006.10.30~11.05,67,1371363,Yeah,박정아,Yeah,2006.08.25,Rock,,가슴을 펴 잘할 때도 못할 때도 있잖아 웅크린 채 계속 겁쟁이로 살 순 없잖아 산다는 건 모두에게 내린 숙제 같은 것 어렵다고 포기하는 바본 나답지 않아 힘을 내 용길 내 나를 난 사랑해 yeah yeah 크게 소리쳐봐 내일은 내일의 또 해가 뜰 거야 yeah yeah 두려움도 떨쳐 더 멋지게 일어나 yeah 잊어버려 툭툭 먼질 털듯 미련까지도 마음에서 그를 놓아버려 아주 쿨하게 이별이란 더 잘 사랑할 수 있는 기회야 수고롭던 가슴 자유롭게 이젠 울지마 외로워 하지마 나를 난 사랑해 yeah yeah 다시 웃는 거야 내 삶에 남겨진 또 사랑 할 거야 yeah yeah 기다리지 말고 그 행복을 찾아가 yeah 참 마음먹은 뜻대로 살 수 없는 세상에도 날 지켜왔던건 이런 내 믿음 하나 먼훗날 눈부신 미래 내 모습도 뜨거운 심장이 만들어 가는 것 yeah yeah 크게 소리쳐봐 내일은 내일의 또 해가 뜰 거야 yeah yeah 두려움도 떨쳐 더 멋지게 일어나 yeah yeah yeah 다시 웃는 거야 내 삶에 남겨진 또 사랑 할 거야 yeah yeah 기다리지 말고 그 행복을 찾아가 yeah
2006.10.30~11.05,68,1484170,닮은 사랑,세븐,Se7olution,2006.11.01,Ballad,장연정,너를 꼭 닮았어 지금 내 옆에 그녀 마치 널 보는 듯 가슴이 아파와 웃는걸 볼 때면 사랑을 속삭여 줄 때면 아직도 니가 곁에 있는 듯 해 세상 가장 미운 너라는 걸 누구보다 잘 알면서도 잠시라도 단 한 순간도 너를 잊고 난 살 수 없나봐 아닌 걸 알지만 나쁜 일인 걸 알지만 난 이렇게라도 널 보고 싶어 견디기 힘드니까 미안한 마음이지만 작은 목소리로 널 불러보고 한참을 떠올리다 눈물이 흘러도 괜찮아  참 많이 미안해 아무것도 모르는 그녀 그럴 때마다 꼭 안아보지만 나도 알아 틀린 사랑인 걸 누구보다 잘 알면서도 왜 그런지 또 너를 닮은 그녈 보면 내 맘이 움직여 아닌 걸 알지만 나쁜 일인 걸 알지만 난 이렇게라도 널 보고 싶어 아직 사랑하니까 미안한 마음이지만 작은 목소리로 널 불러보고 한참을 떠올리다 눈물이 흘러도 괜찮아 뒤늦은 일 모두 지키고 싶은 나 못해준 약속도 다짐들도 그럼 내가 덜 미안해질까 나를 원한다고 말해주세요  그럴 수 있다면 Oh no 기다려볼게 내게로 돌아와 못된 말이라도 해봐 이런 내 모습이 미워서라도 돌아올 수 있잖아 그녈 내 곁에 두고서 마음속으로 널 그려보면서 이렇게 널 기다려 오늘도 그녀가 모르게
2006.10.30~11.05,69,1484168,Again,세븐,Se7olution,2006.11.01,Dance,TEDDY,말론 표현한 적 없는 이 내 맘을 오늘 네게 꺼내보려 해 그래 혹시나 남자답지 못해 보일까봐 난 걱정이 앞서 오직 나만을 향한 너의 사랑을 맑고 수줍던 날들 속의 고백을 잊은 채로 매일 널 외면했지 baby 변해버린 내 모습조차 감싸던 네 두 손을 잡고 난 이제 다시 널 안을게 나 세상이 끝나도 널 놓진 않아 Again 처음 만났던 그때 그 날처럼 어제의 못다한 내 사랑은 이제부터 Again 설렘으로 눈부시던 그 날처럼 I'm in love with you again 네 앞에만 서면 어리석은 내 자존심 땜에 약한 네 맘에 난 상철 주곤 했어 그리고 가끔 니가 날 떠나가주길 바란 적도 있어 오직 나만을 향한 너의 정성을 가끔 흘리던 네 뜨거운 눈물을 당연하단 듯이 받아들였지 No No No 이기적인 내 모습조차 사랑한 네 두 손을 잡고 난 이제 다시 널 안을께 나 세상이 끝나도 널 놓지 않아 Again 처음 만났던 그때 그 날처럼 어제의 못다한 내 사랑은 이제부터 Again 설렘으로 눈부시던 그날처럼 I'm in love with you again 날 사랑하는 게 이리 힘들지는 몰랐다는 너의 그 말에 난 미안하단 어색한 말 밖엔 웃음을 잃은 니 조심스런 말투마저 나 때문인 걸 Baby let me love you again Again 처음 만났던 그때 그 날처럼 어제의 못다한 내 사랑은 이제부터 Again 설렘으로 눈부시던 그 날처럼 I'm in love with you again  let me love you again Baby  I'm in love with you again
2006.10.30~11.05,70,1488073,눈감아 줄게요(Duet Ver.),에버투&amp;투앤비,눈감아 줄게요,2006.11.10,R&B / Soul,,"바보처럼 내가 나를 못이기죠..  세상없이 착한 사람 떠나니..  모진 시간은 농담처럼 흘러..  무거운 맘 짓누르는데..   칭찬밖에 몰랐었던 고운 입술..  좋은것만 골라주던 그 손길..  그대 가슴안에 둥지를 틀고..  염치도 없이 난.. 혼자 행복했어요..   멀리 앞서가줘요.. 나, 따라못가게..  놓아준단 슬픈약속 어길지 몰라..  부디 용기낼게요.. 붙잡는대신 두 눈 감아줄게요.. 혹시 돌아본대도 덜아프게..    혼자 울며 엄한 발만 또 구르죠..  비좁았던 내 가슴이 참 미워..  그대 쉴 수 있는 자리가 못돼..  기울던 이 사랑.. 끝내 잃고마네요..   멀리 앞서가줘요.. 나, 따라못가게..  놓아준단 슬픈약속 어길지 몰라..  부디 용기낼게요.. 붙잡는대신 두 눈 감아줄게요.. 혹시 돌아본대도 덜아프게..   미안해요.. 지워야할 여자되서.. 후회만 줘서..   못난 사랑했지만.. 늘 짐만 됐지만..  이별하난 잘한 일로 묻어둘게요..  다만 헤아려줘요.. 졌던 그 자리  다시 피는 꽃처럼..  다시 사랑한다고.. 영원히 오해하며 사는 나를.."
2006.10.30~11.05,71,1414428,다섯걸음,파란,Beyond The Blue Sky,2006.09.04,Dance,"박기현,임채현,GaryHaase,MATTZARLEY","you always want what you ain't got  and what I got just ain't enough  what make babe what they say is true   cause want I ain't got what I want and all I want is you     RYAN) 천사 같았어 날개만 없었지   널 첨 본 순간 푹 빠져 버렸지     ACE) 나를 보는 너의 눈 난 그대로 얼어서  말은 하고픈데 방법을 몰라     P.O,NEO) 너무 많은 나의 바램이 네 귀를 막아  사랑한다는 나의 고백이 넌 들리지 않는 거니    PARAN) 내 뒤엔 강물이 흘러 지금 내 맘엔 눈물이 흘러  자 원 투 쓰리 포 다섯 걸음   이게 마지막 the last countdown 잡아줘 지금    RYAN) 왜 너만 몰라 이 내~ 사랑을 하늘도 다 알아       왜 너만 날 몰라줘    P.O,NEO) 그 누구의 입맞춤이 가슴에 남아  사랑한다던 너의 고백은 기억에도 없는 거니    PARAN) 내 뒤엔 강물이 흘러 지금 내 맘엔 눈물이 흘러  자 원 투 쓰리 포 다섯 걸음  정말 여기까지 와야겠니 왜 그러니 제발     ACE) please tell me 나를 봐줘 마지막을 거둬줘      지친 내 욕심 까지도    A.J)(Rap) what did I do wrong I'm just giving you a song  I can't live without you girl I'm really sure  wish you were there when I open the door  I just wish my prayer's answered almighty, lord  think how beautiful it will be don't worry we can live for   eternity I can be what you want me to be that's me J    P.O,NEO) let me relax 더 이상 니가 보이지 않아   곁에 있어도 이미 너는 니가 아닌 것 같아    you always want what you ain't got  and what I got just ain't enough  what make babe what they say is true  cause want I ain't got what I want and all I want is you     PARAN) 내 뒤엔 강물이 흘러 지금 내 맘엔 눈물이 흘러  자 원 투 쓰리 포 다섯 걸음  정말 여기까지 와야겠니 왜 그러니 제발     you always want what you ain't got   and what I got just ain't enough  what make babe what they say is true   cause want I ain't got what I want and all I want is you"
2006.10.30~11.05,72,1488184,행복의 조건,드렁큰타이거,희망승일:행복의 조건,2006.11.03,Rap / Hip-hop,박승일,"박승일 Yo! Victory 너의 용기에,  박승일 Yo! Victory 너의 승리에, 눈빛에    우리는 남과 항상 비교하며  행복과 나는 별개인 것처럼 살며  불만은 늘 꼬리처럼 따라다녀  뭐 하나 제대로 된 만족 없는 삶이란 틀 어찌하겠나  이 것이 다 살아가는 모든 이의 인생인 것을 Yeah    사람마다 가지고 있는 행복의 조건  운전자에겐 탁 트인 도로가 행복  백수에겐 백수탈출이 행복의 조건  직장인은 승진이 상인은 대박이  엄마에겐 자식 잘 됨이 행복의 조건  싱글은 사랑과 밍글하는 가슴 속 팅글거리는(hahaha..)    난 행복의 뒤를 절대 쫓지 않아, No!  행복은 나를 찾아 감싸 안아  행복의 뒤를 절대 쫓지 않아, No!  행복은 나를 찾아 감싸 안아, Yeah!  행복의 뒤를 절대 쫓지 않아, No!  행복은 나를 찾아 감싸 안아  행복의 뒤를 절대 쫓지 않아, No!  행복은 나를 찾아 감싸 안아, Yeah!    말하고 싶으나 절대 말할 수 없고  먹고 싶은 음식 먹을 수 없고  걷고 싶으나 절대 걸을 수 없어 뛰고 싶으나  난 뛰어갈 수 없어  말하고 싶으나 난 말할 수 없고 먹고 싶은 음식  난 먹을 수 없어  걷고 싶으나 난 걸을 수 없어 뛰고 싶으나  난 뛰어갈 수 없어, Yeah!  날아갈 수 있어, Yeah! (Hoo~)  내 맘 속에 아주 자유로이    움직일 수 없지만은 볼 수 있음에  만날 수 없지만 들을 수 있음에  만질 수 없지만은 느낄 수 있음에  말할 수 없지만은 생각할 수 있음에  움직일 수 없지만 볼 수 있음에  만날 수 없지만 들을 수 있음에  만질 수 없지만 느낄 수 있음에  말할 수 없지만은 생각할 수 있음에    내가 잃은 이 모든 것을 가지고 있는  당신은 행복한 사람, 행복한 사람  내가 잃은 이 모든 것을 가지고 있는  당신은 행복한 사람, 행복한 사람 (Yeah~)  행복은 날 찾아 감싸안아 Yeah~"
2006.10.30~11.05,73,1472027,하루도 (Not A Single Day),비,Rain`s World,2006.10.13,Dance,박진영,아직 난 하루도 니 생각 안 한 적이 없어 아무리 안 하려고 해도 술에 취해 잠들어봐도 결국엔 또 다시 난 니 생각을 하고 있어 일부러 다른 사람 품에 내 몸을 자꾸 기대봐도 그래봐도 아침에 눈을 떠 너무 놀라 전화를 보지 기억이 나지 않는 어젯밤 행여 술에 취해 너에게 전화를 걸었을까봐 너무 나 두려워져 너를 잊으려고 마시는 술인데 취하면 더 생각이나 너를 잊으려고 만난 여자들이 너를 더 생각나게 해 아직 난 하루도 니 생각 안 한 적이 없어 아무리 안 하려고 해도 술에 취해 잠들어봐도 결국엔 또 다시 난 니 생각을 하고 있어 일부러 다른 사람 품에 내 몸을 자꾸 기대봐도 그래봐도 오늘도 하루종일 바쁘게 짜 놓은 일과들에 정신없이 몸을 맏기고 니 생각할까봐 끝없이 계속일을 만들었지 하지만 그럴수록 너를 잊으려고 바쁘게 사는데 살아가는 이율 몰라 너를 잊으려고 애써도 잠깐이라도 시간이나면 또 니 생각이야 아직 난 하루도 니 생각 안 한 적이 없어 아무리 안 하려고 해도 술에 취해 잠들어봐도 결국엔 또 다시 난 니 생각을 하고 있어 일부러 다른 사람 품에 내 몸을 자꾸 기대봐도 아직 난 하루도 니 생각 안 한 적이 없어 아무리 안 하려고 해도 술에 취해 잠들어봐도 결국엔 또 다시 난 니 생각을 하고 있어 일부러 다른 사람 품에 내 몸을 자꾸 기대봐도 그래봐도 너도 내 생각을 하는지 너도 내가 그리운지 아니면 벌써 나를 잊고 다른 사랑에 빠져있는지 아직 난 하루도 니 생각 안 한 적이 없어 아무리 안 하려고 해도 술에 취해 잠들어봐도 결국엔 또 다시 난 니 생각을 하고 있어 일부러 다른 사람 품에 내 몸을 자꾸 기대봐도 아직 난 하루도 니 생각 안 한 적이 없어 아무리 안 하려고 해도 술에 취해 잠들어봐도 결국엔 또 다시 난 니 생각을 하고 있어 일부러 다른 사람 품에 내 몸을 자꾸 기대봐도 그래봐도
2006.10.30~11.05,74,1477086,사랑 따위 Part 1 (Clean Ver.),김진표,사랑 따위,2006.10.23,Rap / Hip-hop,김진표,괜찮지 잘 지내지    잘 살고 있는거지    잠시 잠시 새벽한시  자다가 눈을 떠보니  난 진땀을 흘리고 난 뒤  난 매일 밤마다 oh 내 꿈속마다  자려고 할때마다  갑자기 나타나 왈콱 화가 나지  이런 나쁜 년 혼자 욕을 해도  계속해 생각이 나는  마지막 니 태도  누구의 죄도 그건 아닌데도  그 무엇도 나를 달래주진 않아  이 노래도 우연히 들었지  잘 산다고 하더라  웃고 또 난리도 아니라더라  넌 그러겠지 또 그렇겠지  우리 그렇게  앞으로 될꺼라 말을 했지  깨물어서 아픈 손가락이  두손 열개 그 중 한 개  잘라내버려 미련조차도 없게  꿈속에서 만날 일도 없게  이제 쳐진 내 어깨  난 피고 다닐래 좀 어때  괜찮지 잘 지내지  잘 살고 있는거지  아무도 모르게 앉아  울고 있진 않은건지  사랑부터 슬픈 이별까지  너무 쉽게 사라졌고  미안해 너를 지울게  나는 이제 괜찮아  구석구석 채워진 추억  지워도 지워도 떠오르는 기억  참았던 눈물이 터져  주루룩 흘러내려  속 애려 목 매여  내 가슴을 마구 때려  그래 사랑했었지  날아가버린 반지  금새 사라진 반지 자국이  너무나 무심했었지  가슴속 상처와 이유를  아무리 생각해도  도대체 알 수가 없는 화만 남아  우리 주위에 생기는  모든 문제가 그렇듯이  대체 어디서부터  잘못이 되어 버린건지  이렇게 끝난건지  아님 그게 아닌건지  문제가 넌지 난지  아니면 신의 장난인지  하늘향해 소리를 크게 질러보고  좆같은 세상 씨발  내가 뭐 그리 크게  잘못 살았다고  씨발 알았다고  언제나 이랬다고  내가 한 일이 이렇다고  괜찮지 잘 지내지  잘 살고 있는거지  아무도 모르게 앉아  울고 있진 않은건지  사랑부터 슬픈 이별까지  너무 쉽게 사라졌고  미안해 너를 지울게  나는 이제 괜찮아  괜찮아 난 uh  비록 지금 모든게  끝난 것 같아도  괜찮아 난  지금은 이렇게 아파도  괜찮아 난 uh  밤이 되고 너무 나도  괴롭다고 해도  괜찮아 난  내게 또 사랑 온다해도  사랑따윈 안해  괜찮지 잘 지내지  잘 살고 있는거지  아무도 모르게 앉아  울고 있진 않은건지  사랑부터 슬픈 이별까지  너무 쉽게 사라졌고  미안해 너를 지울게  나는 이제 괜찮아  시간이 더 흘러도  마주치지 말았으면  그저 아무 소식없이  아무것도 몰랐으면  우린 울고 또 웃기도 하며  추억 남겼지만  누구나 모두 똑같애  내 가슴속에 묻을래  만나고 고백하고  가슴 떨리고 설레이고  웃고 사랑하고 키스하고 함께하고  화내고 의심하고  소리 지르고 분노하고  울고 미워하고 미치고 포기하고  또 만나고 고백하고  가슴 떨리고 설레이고  웃고 사랑하고  키스하고 함께하고
2006.10.30~11.05,75,1177471,My Love (And),버즈,Perfect,2006.04.24,Rock,이도연,안돼요 더는 못해요 그대없이 사는 일 나 때문에 그대 망가진다며  이별을 원한건 나인데   매일 가슴이 갈라져요 숨이 다 끊어질 만큼 울어요 수천번 잊었다 외쳐 봐도 내 삶은 어느새 벼랑 끝에 서있네요  My love 다시 사랑해요 세상 반대쪽 끝에 살아도 찾을게요 다시 그댈 놓지 않아요 멈춘 내 심장을 뛰게 할 사람  우리 헤어지길 잘했죠 얼마나 슬픈 일인지 알았죠 하늘은 모자란 내 사랑을  눈뜨게 하려고 잠시 갈라 논 거였죠  My love 다시 사랑해요 세상 반대쪽 끝에 살아도 찾을게요  다시 그댈 놓지 않아요  멈춘 내 심장을 뛰게 할 사람  나 때문에 망가진 게 맞네요 내가 그대 가슴 안에 못이었네요 사랑하고 책임 없이 도망친 나를 성급한 이별을 용서받고 싶어요  My love 혼자 있어줘요 그대 있는 곳으로 지금 달려 갈게요 조금만 더 기다려줘요  우리 다시 사랑해야만 해요 -
2006.10.30~11.05,76,1484171,I`m Sorry (Interlude),세븐,Se7olution,2006.11.01,Dance,세븐,I'm sorry 이제는 나를 떠나줘 이제껏 속이고 널 보니 내 모습을 더 미치도록 아픈걸 전부 감추고 I'm sorry I say I'm sorry girl 그녀를 위해 떠나줘 말없이 떠나줘 더 편히 그녀가 쉴 수 있도록
2006.10.30~11.05,77,1177475,남자를 몰라,버즈,Perfect,2006.04.24,Rock,김진아,매번 늦어도 이해 할게 누굴 만났니 먼저 묻지 않을게 고집스런 내 사랑 너의 말은 변명이라도 믿고 싶을테니 눈 비비는척 눈물 닦아내고 다음 약속도 잡을 이유 만들지 니 맘보다 한숨과 친해져도 널 보기위해 난 사니까 수없이 어긋난대도 기다릴게 아무리 가슴아파도 웃어볼게 떠나선 안돼 서둘러 저버리지 마 날 밀어내도 깊어지는 이 사랑을 봐 내 입을 막아도 세상이 다 아는데 왜 너만 몰라 왜 널 지킬 남자를 몰라 잊어보려고 해도 소용없어 하루도 못 가 너만 또 찾는 나인걸 혼자가 더 좋다는 슬픈 니 말 눈물이 자꾸 지워버려 수없이 어긋난대도 기다릴게 아무리 가슴아파도 웃어볼게 떠나선 안돼 서둘러 저버리지 마 날 밀어내도 깊어지는 이 사랑을 봐 내 입을 막아도 세상이 다 아는데 왜 너만 몰라 왜 널 지킬 남자를 몰라 니 맘에 누가 있든 괜찮아 한번쯤 못 이긴 척 돌아봐 보여줄게 더 많아 쉽게 보낼 수 없어 가지마 널 원해야만 견뎌내는 내 가슴이야 날마다 울어도 볼 때마다 행복해 왜 너만 몰라 왜 강한 내 사랑을 몰라
2006.10.30~11.05,78,1484174,허락해줘 (Feat. 태양),세븐,Se7olution,2006.11.01,Dance,세븐,조금 삐뚤어진 성격에 화는 잘 내도 너무 예쁜 얼굴이 모든 게 용서됐어 조금 높은 하이힐 짧은 치마 길이도 몸매가 받쳐 주니 너무 섹시 섹시하게 보여 난 모르겠어 자꾸 내 기분이 울렁댔지 어쩌면 좋겠니 널 바라고 있는 내 마음을 허락해줘 come on be my lady 니 손을 잡으면 니 몸이 닿으면 난 이렇게 참기 힘든데 아무리 잘해도 아무리 달래도 넌 차갑게 또 고개를 돌려  내 맘을 울려  비싼 생일 선물이 너를 만족시켜도 나는 밀린 카드 빚 돌려 막기 바빴어 너와 격을 맞추기 위해 차를 빌려도 친한 친구 녀석은 자꾸 눈치없이 전활 걸어 난 모르겠어 그냥 내 기분이 들떠 있지 어쩌면 좋겠니 널 바라고 있는 내 마음을 허락해줘 come on be my lady 니 손을 잡으면 니 몸이 닿으면 난 이렇게 참기 힘든데 아무리 잘해도 아무리 달래도 넌 차갑게 또 고개를 돌려  내가 공들여 온 건 장난 삼아 한번 너를 갖기 위함은 아니요 영화 속에 에로 배우보다 예쁜 엉덩이에 내 맘도 흔들 니 얼굴을 하나도 고치지 않았다면 그 성격을 고치길 애가 타는 내 심장에 불길이 이 밤을 따라 너를 감싸 불태우리 Come on be my lady 두 눈을 감으면 니 몸을 감으며 난 이렇게 널 가졌는데 두 눈을 떠보면 니 마음 떠보면 난 비참해져 고개를 돌려  내 맘을 울려
2006.10.30~11.05,79,1415456,가로수 그늘 아래 서면,임재범,The Story Of Musicians - 옛사랑,2006.09.14,Ballad,,라일락 꽃 향기 맡으면  잊을 수 없는 기억에  햇살 가득 눈부신 슬픔 안고  버스 창가에 기대 우네  가로수 그늘 아래서면  떠가는 듯 그대 모습  어느 찬비 흩날린 가을 오면  아침 찬 바람에 지우지  이렇게도 아름다운 세상  잊지 않으리  내가 사랑한 얘기  우 우우우 우  저 별이 지는 가로수  하늘 밑 그 향기 더 하는데    가로수 그늘 아래서면  떠가는 듯
2006.10.30~11.05,80,1484172,Oh~ Ma Girl,세븐,Se7olution,2006.11.01,Dance,세븐,Don't Go 서둘러 집에 가지마요 둘이 나와 둘이 이 음악속에 go go 이 밤을 적셔봐요 우리끼리 no diggity oh ma girl 하얗게 뽀얀 얼굴 입술 사이로 보인 하얀 덧니 오오 한참을 난 멍하니 넋을 놓았지 나의 걸음을 멈추고 난 괜히 괜히 말을 걸지 넌 왠지 왠지 나를 막지 한번쯤 받아줘요 oh honey honey make something oh ladi dadi shake a body 서서히 너를 녹이리 Don't Go 서둘러 집에 가지마요 둘이 나와 둘이 해뜰 때까지 go go 이 밤을 적셔봐요 우리끼리 no diggity oh ma girl 내 사랑은 안 헤퍼 든든한 너의 헬퍼 oh my girl I know you won't you stop 못 가 oh no 그댄 이 멋진 밤의 신데렐라 같은 걸 난 괜히 괜히 말을 걸지 넌 왠지 왠지 나를 막지 내 손을 잡아 줘요 oh honey honey make something oh ladi dadi shake a body 서서히 너를 녹이리 Don't Go 서둘러 집에 가지마요 둘이 나와 둘이 해 뜰 때까지 go go 이 밤을 적셔봐요 우리끼리 no diggity oh ma girl oh on 아무런 고민 없이 홀로 살아갈 수 있어 high up in solo 역시 난 오늘밤도 so so 그저 그런 여자들 사이에 섹시한 넌 오오 오늘밤엔 널 꼭 갖겠어 one night stand 바라지 않아 잠시 밖에서 십분만 따끈따끈 카페 모카 한 잔하며 오늘 밤은 나와 함께 loca loca 난 비린 비린 사랑 안 해 넌 미리 미리 나를 막네 두려워하지 마요 내 시린 시린 가슴 안에 넌 길이 길이 남길 바래 내 마음 알아주겠니 Don't Go 서투른 내 사랑을 오해 말길 너의 발길 돌리지 말고 go go 내 품에 들어와요 가슴 깊이 no diggity  oh ma girl
