time,rank,song_id,title,singers,album,date,genre,creator,lyric
2008.12.07~12.13,69,1943048,완벽한 남자,휘성(Realslow),With All My Heart And Soul,2008.10.29,R&B / Soul,휘성(Realslow),I'm gonna please U don't wanna tease U Baby I need U I'll never leave U  널 보기 위해 널 듣기 위해 내 눈과 귀가 있어 yes 널 안기 위해 널 업기 위해 내 팔과 다리가 있어 내게 돈을 원해 좋은 차를 원해 날 선택한 거라도 상관없는 너의 영원한 노예 그게 바로 내 존재야 그저 내 곁에 있어 주면 돼 숨만 쉬어 주면 돼 그것으로 만족해 뭐든 준다고 약속하지만 이별을 달란 아픈 말만 꼭 하지 말아 봄 여름 가을 겨울 똑같을 변하지 않을 한 계절 내 마음 그 믿음 저 버리지마 날 버리지마 떠나지마 언제까지나 Baby you're my everythin my heart Cause you're my dream shining like a star Oh yeh 네 향길 맡고 사랑한다고 말을 하기 위해서 yes 내 코가 있어 내 입이 있어 널 느끼기 위해서 넌 여자가 아닌 애인도 아닌 또 다른 내 심장 너를 지키는 일 아껴주는 일 그게 날 위한 일이야 그저 내 곁에 있어 주면 돼 숨만 쉬어 주면 돼 그것으로 만족해 뭐든 준다고 약속하지만 이별을 달란 아픈 말만 꼭 하지 말아 봄 여름 가을 겨울 똑같을 변하지 않을 한 계절 내 마음 그 믿음 저 버리지마 날 버리지마 떠나지마 언제까지나  I'm gonna please U don't wanna tease U Baby I need U I'll never leave U 내 삶의 이유 일상의 고통을 치유하는 널 내 피부 깊숙이 느껴 오늘도 널 위해 무릎을 굽혀 그저 내 손만 잡아주면 돼 따라와 주면 돼 그것으로 행복해 절대 눈물이 흐르지 않게 온 힘을 다해 노력할게 날 다 던질게 I'm gonna please U don't wanna tease U Baby I need U I'll never leave U 소원은 오직 단 하나 날 버리지마 떠나지마 언제까지나 완벽한 남자가 되면 돼 yeh 반드시 그렇게 되야 해 yeh 네 사랑 흔들릴 걱정 없게 철저하게 철저하게 완벽한 남자가 되면 돼 yeh 반드시 그렇게 되야 해 yeh 네 사랑 흔들릴 걱정 없게 철저하게 철저하게
2008.12.07~12.13,70,1903050,U-Go-Girl (With 낯선),이효리,It`s Hyorish,2008.07.14,Dance,이트라이브,Hey girl  It's the princess LEE HYO REE  She's Back Yeah  2008 You ready  Hey girl  Girl girl Hey u go girl  De le De le  that that that girl  Girl girl Hey u go girl  Baby baby baby baby girl  Say what  오늘은 또 어떤 옷을 입어야할지  머리는 또 어떻게 만져야 좋을지  이건 어떠니 또 저건 어떠니  고민 고민하지마 Girl  오늘은 또 어떤 말을 해야하는지  어떻게 내 마음을 전해야 좋을지  이건 어떠니 또 저건 어떠니  고민 고민하지마 Girl  Girl hey U go girl  De le De le  that that that girl  Girl hey U go girl  Baby baby baby baby girl  이제부터 솔직하게  이제부터 당당하게  너의 맘을 보여줘  바로 이 순간  지금 이 순간 tonight  가끔씩은 달콤하게  가끔씩은 강렬하게  너의 맘을 보여줘  바로 이 순간  지금 이 순간 tonight  Girl girl Hey u go girl  De le De le  that that that girl  Girl girl Hey u go girl  Baby baby baby baby girl  오늘은 또 어쩐 일로  나를 부르지  혹시나 또 무슨 일이 생긴건지  이걸 어쩌지 또 저걸 어쩌지  고민 고민하지마 Girl  그 사람도 좋아할까 마음 졸이며  주머니 속 작은 동전 하나 꺼내서  앞면이 나올지 뒷면이 나올지  고민 고민하지마 Girl  Girl hey U go girl  De le De le  that that that girl  Girl hey U go girl  Baby baby baby baby girl  이제부터 솔직하게  이제부터 당당하게  너의 맘을 보여줘  바로 이 순간  지금 이 순간 tonight  가끔씩은 달콤하게  가끔씩은 강렬하게  너의 맘을 보여줘  바로 이 순간  지금 이 순간 tonight  Crazy night  Dance All Night  Let Me Take U Home Tonight  It's allright  Hey girl party tonight  Crazy night  Dance All Night  Let Me Take U Home Tonight  It's allright  Hey girl party tonight  Girl girl Hey u go girl  De le De le  that that that girl  Girl girl Hey u go girl  Baby baby baby baby girl  Girl girl Hey u go girl  De le De le  that that that girl  Girl girl Hey u go girl  Baby baby baby baby girl  I like that that that girl  and Let Me SeeYa bring it  back back back girl  OK I like that that that girl  and Let Me SeeYa bring it  back back back girl  One more time baby  I like that that that girl  and Let Me SeeYa bring it  back back back girl  OK I like that that that girl  and Let Me SeeYa bring it  back back back girl  Girl
2008.12.07~12.13,71,1964790,슈퍼맨,노라조,Three GO,2008.11.20,Dance,이영준,아들아 지구를 부탁하노라 아버지 걱정은 하지마세요 바지위에 팬티입고 오늘도 난 길을 나서네 아들아 망토는 하고 가야지 아뿔싸 어쩐지 허전하더라 파란타이즈에 빨간 팬티는 내 차밍 포인트 오늘도 달리고 달리고 달리고 달리고 살리고 살리고 살리고 살리고 돌아라 지구 열 두 바퀴 올백머리 근육 빵빵 난 슈퍼맨 지구인의 친구 난 슈퍼맨 멋지구나 잘생겼다 대인배의 카리스마 사이즈가 장난 아니지 어쨌거나 근육 빵빵 난 슈퍼맨 지구인의 친구 난 슈퍼맨 유사품에 주의해요 오각형에 S 자야 위 아래로 스판 100%  아들아 아침은 먹고 가야지 아버지 빈속이 날기 편해요 서울 대전 대구 부산 찍고 나서 독도 한 바퀴 오늘도 달리고 달리고 달리고 달리고 살리고 살리고 살리고 살리고 돌아라 지구 열 두 바퀴 올백머리 근육 빵빵 난 슈퍼맨 지구인의 친구 난 슈퍼맨 멋지구나 잘생겼다 대인배의 카리스마 사이즈가 장난 아니지 어쨌거나 근육 빵빵 난 슈퍼맨 지구인의 친구 난 슈퍼맨 유사품에 주의해요 오각형에 S 자야 위 아래로 스판 100%  오늘도 달리고 달리고 달리고 달리고 살리고 살리고 살리고 살리고 돌아라 지구 열 두 바퀴 올백머리 근육 빵빵 난 슈퍼맨 지구인의 친구 난 슈퍼맨 위기 때면 나타난다 밤하늘에 박쥐모양 아 참 그건 배트맨이지 어쨌거나 근육 빵빵 난 슈퍼맨 지구인의 친구 난 슈퍼맨 위험할 땐 불러줘요 언제든지 달려갈게 나는야 정의에 슈퍼맨
2008.12.07~12.13,72,1986981,사랑하는 사람이 생겼습니다. (Sweet Ver.) (MBC 스친소 삽입곡),블랙,사랑하는 사람이 생겼습니다 (Sweet Ver.),2008.12.05,Ballad,"이혁,블랙",나 허락없이 그댈 사랑 하려 합니다 조심스럽게 다가갑니다 해맑은 미소와작은 손짓까지도 향기가 되어나를 웃게 합니다 비오는 날엔 우산은 있을지 걱정됩니다 감기는 걸리진 않을지 너무나 예뻐서 너무 아름다워서 내삶의 전부가 된 그대를 죽도록 사랑합니다 간절히 원했습니다 그대의 향기가 심장을 뛰게 하는 사랑하는 사람이 생겼습니다 장미 한 다발 손에 쥐고 그대에게 가는길 새로 산 구두가 어색합니다 그댈 볼때마다 가슴이 두근거려 어떻게 고백을 해야댈지 죽도록 사랑합니다 간절히 원했습니다 그대의 향기가 심장을 뛰게 하는 사랑하는 사람이 생겼습니다 너무나 보고 싶어요 내 맘을 받아줄 순 없나요 늘 그대곁에서 꼭 함께 하고 싶은데 우산이 되고 싶은데 영원히 당신을 사랑합니다 영원히 사랑합니다 그대의 향기가 심장을 뛰게 하는 사랑하는 사람이 생겼습니다 나를 보며 웃고 있네요 내맘을 받아준 그대
2008.12.07~12.13,73,1959670,내일 할 일,윤종신,동네 한 바퀴,2008.11.25,Ballad,윤종신,이른 아침 일어나야해 내일 우리들의 이별하는 날 평소보다 훨씬 좋은 모습으로 널 만나야겠어 조금도 고민 없던 것처럼 태연한 표정이 아무래도 서로 잊기 좋겠지 이별직후 검색해보면 혼자 볼만한 영화들이 뜨네 가슴 먹먹해지는 것부터 눈물 쏙 빼는 것까지 내일은 빠듯한 하루가 되겠어 우리 만나 널 보내랴 무덤덤한 척하랴 안녕 오랜 나의 사람아 하루 종일 이별 준비야 너 떠난 뒤가 막연했기에 아무리 떠올려 봐도 그려지지 않는 너의 이별표정도 이 밤 지나면 보게 되겠지 안녕 오랜 나의 사람아 내일 슬프지 않기로 해 마지막은 기억에 남기에 눈물은 미련이란 것 쯤 서로의 가슴은 알기에 우리 편하게 내일 이별해 내일은 괜찮아도 바로 다가오는 다음 날부턴 단 하나의 준비조차 없는데 그 날부터 난 뭘 해야 하는 건지 안녕 오랜 나의 사람아 하루 종일 이별 준비야 너 떠난 뒤가 막연했기에 아무리 떠올려 봐도 그려지지 않는 너의 이별표정도 이 밤 지나면 보게 되겠지 안녕 오랜 나의 사람아 내일 슬프지 않기로 해 마지막은 기억에 남기에 눈물은 미련이란 것 쯤 서로의 가슴은 알기에 우리 편하게 내일 이별해 우리 편하게 내일 이별해  이제 그만 잠을 자려해 아마 나는 잘 할 수 있을 거야 수많았던 우리 만남들 중에서 그 마지막을
2008.12.07~12.13,74,1961461,너만이,KYT(코요태),너만이,2008.11.18,Dance,"박성진,서정진",ye so many time for you come back to me my love come back to me 내 가슴 속에 널 난 잡지 못하고 나 하지 못한 말 차마 난 못하고 너의 눈에 비춰지는 초라한 마지막 나의 모습이 떠나지 말라고 난 너 뿐이라고 차가워진 너의 손을 꼭 잡고 헤어짐에 선앞에서 떨리는 가슴으로 last &amp; for you 처음부터 사랑을 원한 건 내가 아닌 바로 너였잖아 바보처럼 그 말을 믿었는데 왜 먼저 떠나가니 yo 사랑한다 고백했던 너의 말이 이제와 떠나간다니 믿을 수가 없어 너가 나의 사랑이라 믿어왔었는데 우리 서로 얼굴 보며 너무 행복했었는데 아무리 니가 다른 사람 찾아가도 맘 속 깊은 곳에 너와 내가 있기에 우리 헤어짐을 인정할 수가 없어 다시 시작할 수 있는 너를 위해서 왜 하필 날 사랑해 울리니 내 모든 사랑 다 갖고서 이제서 잊으라 떠나라면 혼자 남은 난 어떡해  기억해봐 우리 함께 나눈 많은 시간 서로에게 주었던 그 많고 많은 사랑 하나 둘 기념하는 날이 늘어가며 깊어지는 사랑 속에 with forever 하지만 이제와 떠나가 너와 나 서로에 가슴에 상처는 주지마 제발 나를 떠나가지마 내게 오직 너 뿐인 걸 알잖아 매일 내게 말하던 그 약속 슬픈 사랑이 아니었잖아 이제와서 사랑을 잊으란 말 어떻게 할 수 있니 왜 하필 날 사랑해 울리니 내 모든 사랑 다 갖고서 이제서 잊으라 떠나라면 혼자 남은 난 어떡해  누군가를 만나 다시 새로운 사랑을 하고 그렇게 사랑하다 또 다른 이별을 하고 반복되는 만남에 지치는 내 가슴에 너만이 사랑 때문에 또 아플까봐 사랑에 또 울게 될까봐 다른 누군가를 만난대도 다신 사랑할 수 없어 사랑은 그런 거라고 영원할 수는 없다고 이별은 그런 거라고 또 다른 사랑이라고 사랑 때문에 또 아플까봐 사랑에 또 울게 될까봐 다른 누군가를 만난대도 다신 사랑할 수 없어
2008.12.07~12.13,75,1897011,사랑과 전쟁 (Narr. 하하),다비치,Vivid Summer Edition (1st Amaranth Repackage Album),2008.07.03,Dance,안영민,나 있잖아  너 없으면 죽을꺼 같애  내 눈은 두개인데  왜 너 하나 밖에 안보이는걸까  시끄럽고 너 어제 누구랑있었어  나 좋다고 매달릴 땐 언제고  매달린 정돈 아니고  누구랑 있었냐고  야 아니거든요  나 집에 있었거든요  엄마가 밥해줬거든요  두 번 다시 바람 피지마  니가 매달려 만난거잖아  어떻게 날 두고  다른 여자를 만날 수 있니  내게 더 정말 멋진남자들  가끔은 내게 다가와  흔들릴 때도 있어  넌 몰라  이젠 제발 정신 좀 차려  어제 너 누구랑 있었어  친구에게 전화가왔어  니가 다른여자와 있었다고  솔직히 너 한 번 말해봐  나보다 더 매력있니  아니면 이젠  내가 너는 지겨운거니  두 번 다시 바람 피지마  니가 매달려 만난거잖아  어떻게 날 두고  다른 여자를 만날 수 있니  내게 더 정말 멋진남자들  가끔은 내게 다가와  흔들릴 때도 있어  넌 몰라  이젠 제발 정신 좀 차려  Oh my lover Oh my you baby  Oh my lover Oh my you baby  Oh my lover Oh my you baby  Oh my lover Oh my you baby  거짓말 오 이런 얘기 재미 없어  오늘부로 우린 망했어  화내지 마 아주 잠깐  우린 너무 완소커플 킹왕짱  도끼는 들지마 후덜덜  우리사랑 we belong together  넌 나의 태양 넌 나의 바다  요즘따라 정말 이상해  평소에는 안그랬는데  내게 장미꽃을 선물했던 너  다른 여자와 있었던게  그게 너무 미안해서  그래서 내게 더  잘해준 걸 몰랐어  두 번 다시 바람 피지마  니가 매달려 만난거잖아  어떻게 날 두고  다른 여자를 만날 수 있니  내게 더 정말 멋진남자들  가끔은 내게 다가와  흔들릴 때도 있어  넌 몰라  이젠 제발 정신 좀 차려  두 번 다시 보기 싫지만  널 차버려도 할 말 없지만  그래도 아직은  내가 너를 너무 사랑해  거짓말한거 정말 싫지만  이번 한 번만 용서해  다시 이런 일 없게 해줄래  이젠 나만 사랑해줄래  Oh my lover Oh my you baby  Oh my lover Oh my you baby  Oh my lover Oh my you baby  Oh my lover Oh my you baby
2008.12.07~12.13,76,1975587,화성에서 온 남자 금성에서 온 여자 (Narr. 소유진),타우,화성에서 온 남자 금성에서 온 여자,2008.12.01,Rap / Hip-hop,,언젠가부터 니 말투가 달라졌다 나쁜 놈 나쁜 놈 흠씬 두들겨 패주고 싶었지만 그저 난 울기만 했다  술 취해 친구들에게 했던 말을 또 하고 한참을 지껄였던 그 말을 또 하고 세상에 니가 제일 나쁜 사람이었다고 너같이 못나 보이고 못된 사람은 없다고 한숨을 또 쉬고 한잔을 마시고 사람들 보는 앞에 전화번호를 지우고 속이다 후련하다고 큰소리로 웃어도 결국엔 똑같은걸 가슴이 아파서 눈물이 흘러서 미칠 듯 보고 싶은 마음에 또 전활 걸었어 보내기가 싫다고 헤어지기 싫다고 바보 같은 말만 되풀이했어 후회할거면서 I love you oh I need you I'll be missing you I'll be there for you 밤 잠을 뒤척이며 잠 못들일 없고 조그만 인기척에 일어날일 없고 혼자 먹는 아침 따위는 아무렇지 않고 현관문을 열고 나설 때 돌아볼 일 없어 사람들 나를 보고 많이 야위었다고 예전보다 몰라 보이게 지쳐 보인다고 걱정해주는 말을 애써 웃어넘겨봐도 결국엔 똑같은걸 가슴이 아파서 눈물이 흘러서 미칠 듯 보고 싶은 마음에 또 전활 걸었어 보내기가 싫다고 헤어지기 싫다고 바보 같은 말만 되풀이했어 후회할거면서 내 지갑 속에 넣은 니 사진도 이젠 버려야만 하는 거겠지 겨울이 올 때면 코끝이 시리면 이렇게 니 생각에 가슴 아파 울고 말 텐데 여린 여자라는걸 너 없인 못 산 단걸 니가 더 잘 알면서 왜 날 떠나 너도 잘 알면서 I love you oh I need you I'll be missing you I'll be there for you 사랑해 널 사랑해 너만 있으면 돼 난 너 하나면 돼
2008.12.07~12.13,77,1984370,몰랐었다 (Narration Mix Ver.) (Narr.김명민),홍경민,몰랐었다,2008.12.04,Ballad,김종세,지난 겨울이 따뜻할 수 있었던 건 그 사람 때문이였다는 걸 이제야 알았다 몰랐었다 몰랐었다 너의 마음 그리 아팠는지 이제야 알았어 너를 아껴주는 것이 이렇게도 좋은건지 가지마라 가지마라 니가 어디에 있는지 이렇게 불러도 본다 보고싶다 보고싶다 정말 널 애태우며 기다려 차갑게 내리던 눈과 모진 바람에도 추위에 떨지 않을 수 있었던 건 항상 내 옆에서 손 잡아주던 그 사람 때문이였단 걸 이제야 알았다 가지마라 가지마라 니가 어디에 있는지 이렇게 불러도 본다 보고싶다 보고싶다 정말 널 애태우며 기다려 수줍게 건내던 한마디 한마디가 나에겐 성장할 수 있는 따스히 어루만져주던 손길이 한줄기 바람이였고 포근히 안아주던 가슴이 어머니의 품과 같다는 걸 그 때는 알지 못했다 보고싶다 보고싶다 좋은날도 우린 많았잖니 어리석은 나를 바보같은 나를 위해 돌아와주면 안되겠니 몰랐었다 몰랐었다 너의 마음 그리 아팠는지 이제야 알았어 너를 아껴주는것이 이렇게도 좋은건지 나는 몰랐었다 단 한 번만이라도 그 사람을 만나 정말 미안했었다고 한마디 말이라도 할 수 있다면
2008.12.07~12.13,78,1964849,The Castle Of Zoltar,"박효신,황프로젝트",Hwang Project Vol.1 (Welcome To The Fantastic World),2008.11.20,Dance,박효신,회색 빛깔 도시 위로 붉은 빛이 떠오르고 로봇같은 사람들은 빠르게 가고 어느 날부터 멈춰있던 내 심장에 박힌 태엽도 알 수 없는 힘에 끌려 돌아가고 있어 먼지로 자욱한 내 속에 기억에 조각을 찾고 부러졌던 날개를 고쳐 날아봐  I will make it 하늘보다 더 높이 날아가고 싶어 자유를 느껴봐 내 안에 shining light 힘이 들땐 구름 위에 올라 발 아래 세상을 봐 내가 바라본 이 곳보다 아름다운 건 없을 걸  Shining star 하얗게 물든 꿈결 속에 zolta의 상자를 보았지 어릴 적 내 소원들 중 어떤 걸 원해 시간이 흘러서 어른이 된 지금 난 날 지켜줄 널 찾겠어 I will make it 바람보다 더 빨리 달려가고싶어 세상을 가져봐 날 위해 shining light 힘이 들 땐 언덕 위를 올라 달려와 세상을 봐 내가 서 있는 이 곳만큼 아름다운 건 없을까  Shining star I will make it 하늘보다 더 높이 날아가고 싶어 자유를 느껴봐 내 안에 shining light 힘이 들 땐 구름 위에 올라 발 아래 세상을 봐 내가 바라본 이 곳보다 아름다운 건 없을까  Shining star
2008.12.07~12.13,79,1951554,멍청한 사랑,BIGBANG,Remember,2008.11.05,Rap / Hip-hop,G-DRAGON,못된 버릇처럼 또 생각이나 고된 삶에 지쳐 널 몇 번이나 떠올리다 웃고 그리움에 울고 난 지쳐버려 잠이 들었지 너의 사랑 너무 힘이 든다고 거친 바람처럼 등을 돌려 버리고 모자랐던 이해 불투명한 미래 더 이상 참을 수가 없었지 촉촉히 젖은 눈가에 눈물을 닦아주고 싶었지만 그대의 눈동자의 비친 모습은 내가 아닌 걸 다른 사람인걸 baby 안돼 거짓말은 baby 아니라고 내게 말해줘 고개를 떨군 체 아무 말 못한 채 왜 날 비참하게 하는 거야 왜 내게 미안해 이제는 그만해 널 미워할 수 있게 만들고 떠나가줘 상처투성이로 남겨진 멍청한 사랑 bye bye everything's gonna be alright right 사랑은 철새처럼 왔다가 또 갔구나 내 맘이 더 아프다 허구한 날 말해줘도 넌 매일 고집 피웠잖아 담배만 피더라 뻐끔 그만 좀 잊어라 거뜬하게 보란 듯이 딴 여잘 만나 잘살아라 어 친구야 내가 뭐랬어 그 사람 모르겠다고 한 번 깨진 유리잔은 다시 붙기 힘들다고 Yo 끝이 보이던 게임 nothin never ever change 옆에서 지켜보는 내가 더 불안하더라고 그 앤 다른 남자의 품에 안겨 잠들 걸 1 2년 지난 후에야 나타나 널 찾을 걸 let him go girl 안돼 거짓말은 baby 아니라고 내게 말해줘 고개를 떨군 체 아무 말 못한 채 왜 날 비참하게 하는 거야 왜 내게 미안해 이제는 그만해 널 미워할 수 있게 만들고 떠나가줘 상처투성이로 남겨진 멍청한 사랑 bye bye 날 조금만 더 붙잡아주기를 바랬던 내 마음은 아무 소용 없는 미련인데 홀로 남겨진 이 어둠 속에 길을 헤메는 멍청한 내 그림자 난 아직 너를 기다리고 있는 듯해 안쓰러워 네가 뭐 꿀린다고 안쓰러워 그런 여자만 왜 꼬이냐고 안쓰러워 그녀가 준 건 악몽이라고 안쓰러워 네가 아니 너의 그녀가 안돼 거짓말은 baby 아니라고 내게 말해줘 고개를 떨군 체 아무 말 못한 채 왜 날 비참하게 하는 거야 왜 내게 미안해 이제는 그만해 널 미워할 수 있게 만들고 떠나가줘 상처투성이로 남겨진 멍청한 사랑 bye bye everything's gonna be alright right  멍청한 사람
2008.12.07~12.13,80,1890408,너 때문에,브라운아이즈,Two Things Needed For The Same Purpose And 5 Objets,2008.06.17,Ballad,개리,아무리 힘들어도 웃었어 내 곁을 지켜주던 널 보며 작은 것 하나하나 날 위해서 살아준 너 땜에 너에게 익숙해져 버려서 너 없는 모든것이 낯설어 언제나 함께하며 내손을 꼭 잡아준 너 땜에 다 너 때문에 너 땜에 행복했는데 널 닮은 사람은 세상을 뒤져도 찾을 수가 없잖아 다 너 때문에 너 땜에 난 울잖아 그리워 오늘도 세상을 다 뒤져도 찾을 수가 없는데 난 어떡해 아무리 많은 말을 해봐도 지루한 시간만이 흘러가 따분한 얘기조차 웃어주며 들어준 너 땜에 다 너 때문에 너 땜에 행복했는데 널 닮은 사람은 세상을 뒤져도 찾을수가 없잖아 다 너 때문에 너 땜에 난 울잖아 그리워 오늘도 세상을 다 뒤져도 찾을수가 없는데 난 어떡해  너 때문에  다 너 때문에 너 땜에 행복했는데 널 닮은 사람은 세상을 뒤져도 찾을수가 없잖아 다 너 때문에 너 땜에 난 울잖아 그리워 오늘도 세상을 다 뒤져도 찾을수가 없는데 난 어떡해
2008.12.07~12.13,81,1951551,반짝반짝,BIGBANG,Remember,2008.11.05,Rap / Hip-hop,KUSH,ye 그댄 반짝이는 별  1 2 1 2 3 let's go 그대 어디에서 무엇을 해도 나 그댈 끝까지 따라 가리 언제든지 어느 곳에서 어제처럼 기다리겠어 전화해 Baby 넌 반짝 반짝 반짝 반짝 미녀들을 살짝 다룰 줄 아는 로맨틱한 남자 괜찮어 부끄러말고 안겨 찰싹 널 위해 준비한 초콜렛과 사탕 난 한입으로 두 말 안해 누가 뭐래도 항상 널 놀래켜 줄껄 짜잔 그 어떤 과거 때론 힘겨운 미래 이리 기대 그대가 있기에 모든게 힘이 돼 내 손을 잡아봐 세상이 변할꺼야 너의 그 향기 손짓 몸짓 눈빛 아름다워 따라와 둘만의 파라다이스 그대 어디에서 무엇을 해도 나 그댈 끝까지 따라 가리 언제든지 어느 곳에서 어제처럼 기다리겠어 전화해 Baby 넌 반짝 반짝 쓸데 없는 집착을 버릴래 니 앞에 선 난 항상 어린애처럼 순순히 널 안을래 묵묵히 니 뒤를 지킬께 우리 함께 라면 1년이 기념일 친구들과의 약속은 다 미뤘지 사랑은 바람을 타고 날 밀었지 너의 곁으로 ooh wee 내 손을 잡아봐 어디든 떠나는 거야 너의 그 미소 피부 말투 모두 사랑스러 따라와 둘만의 파라다이스 그대 어디에서 무엇을 해도 나 그댈 끝까지 따라 가리 언제든지 어느 곳에서 어제처럼 기다리겠어 전화해 Baby 넌 반짝 반짝 반 짝 반 짝 널 나의 세상에 초대할께 반 짝 반 짝 다시 뛰는 심장 소리를 느껴 반 짝 반 짝 빛나는 넌 나만의 여자 잠 깐 앉 어 할 말이 있어 listen up lady 바보같이 널 혼자 둘 순 없어 화를 내도 널 사랑할 수 밖에 없어 say hey 행복하다 말해줘 사랑한다 말해줘 속삭여줘 그대 어디에서 무엇을 해도 나 그댈 끝까지 따라 가리 언제든지 어느 곳에서 어제처럼 기다리겠어 전화해 Baby 넌 반짝 반짝 그대 어디에서 무엇을 해도 나 그댈 끝까지 따라 가리 언제든지 어느 곳에서 어제처럼 기다리겠어 전화해 Baby 넌 반짝 반짝 그대 어디에서 무엇을 해도
