time,rank,song_id,title,singers,album,date,genre,creator,lyric
2008.06.01~06.07,70,1786851,How Gee (하우지),BIGBANG,For The World,2008.01.04,Rap / Hip-hop,"JamesBrown,M.Percali",one for the money  two for the show  we got the party  peolple screamin' out  hey ho hey Yo  let's go  on and on into the breaka dawn  i got a mic and i  just can't leave it alone  i be the t o p aiite  i represent the big bang  big thangs feel me i  bring'em like  down and dirty you heard me  it's straight whoa  people gotta have it they  really won't let go huh  yo i got it full control  indeed i'm ridin' high no  need to lay low  i'm psyked i'm rippin the show  rap tight like kick in the doe  that's right baby zero below  you know the gd got ya  city throwin'em up it's oh so  ficky ficky fresh  i give you nuttin' less  and if you aint known by  now i be the best  ladi dadi we  came to party yes yes  and while ya freakin' ya  shawty let's just  ah big gon raise the roof yall  so you know what to do yall  just keep on rockin'em  ah big gon raise the roof yall  just keep on rockin'em  damn yo'm killin' the flow  got it pack wall to wall  doe to doe that's  quite incredible i know  and everybody in the  place be tipsy amazin' what  this be we blazin' it crispy  ya honey wanna get down  with this i make her bounce  to this every ounce of this i  shit'chu not and it's the  shit'chu not you know  i hits the spot  i wear my sunglasses at night  still 20 20  suckas walkin' around  talkin' all' at balony  damn homie you phony  be on about'cha biz what it is  you aint got nuttin' for me  been an mc since my first sony  rock many and plent they wanna  know mei'm 50 karots you a  cubic zakoni fall back  let my people react  we in the zone yeah  ah big gon raise the roof yall  so you know what to do yall  just keep on rockin'em  ah big gon raise the roof yall  just keep on rockin'em  all yall get'cha hands up  clap now  we gonna shake and tear the  house down  i know you wanna do this  right now  you gotta get up  and move it to the sound  love the way the kick drum  plays now  i feel it in my heart  that's it now  i think i'm gonna  count it off now  fire in the hole it's a  new load'm killin'em slow  make'em learn about the t o p  and how the story go  it's not nice not pretty  ya hear a crack  when i'm full contact i'm  crushin' down many  straight comin' from the back  shootin' henny  people be gettin' wild  just kickin' and rippin'em out  you know it's what it's all  about when you move a crowd  just raise the roof now  ah big gon raise the roof yall  so you know what to do yall  just keep on rockin'em  ah big gon raise the roof yall  just keep on rockin'em  just keep on rockin'em  ah big gon raise the roof yall  so you know what to do yall  just keep on rockin'em  ah big gon raise the roof yall  just keep on rockin'em
2008.06.01~06.07,71,1863957,가슴아 미안하다,이지훈,The Classic,2008.05.13,Ballad,하정호,정말이야 이것만은 믿어줘 너를 위해 보여주고 말해왔던 모두 그게 사랑이란 걸 내게 전부였단 걸 알잖아 모두 알고 있잖아 행복해줘 나랑 있을때 보다 부디 행복하게 살아 그래야 내 가슴이 그래야 내 사랑이 조금 덜 아플 테니까 눈물도 삼킬 테니까 가슴아 미안하다 괜찮다 울지마라 이젠 그녈 놓아주자 그만 보내주자 나보다 좋은 사람 나보다 좋은 사람 그녀곁에 있잖아 눈물이 나도 참아  약속해줘 나를 뒤돌아서도 다신 찾지 않겠다고 그래야 내 가슴이 그래야 내 사랑이 견디기 쉬울 테니까 눈물도 삼킬 테니까 가슴아 미안하다 괜찮다 울지마라 이젠 그녈 놓아주자 그만 보내주자 나보다 좋은 사람 나보다 좋은 사람 그녀곁에 있잖아 눈물이 나도 참아 사랑한다 사랑한다 수천번 수만번을 불러보아도 사무치게 울어도 그녀가 듣지 않게 듣지 못할곳에 남은 기억도 버리자 남은 사랑도 버리자 나보다 좋은 사람 나보다 좋은 사람 그녀곁에 있잖아 눈물이 나도 참아 보고싶어도 참아
2008.06.01~06.07,72,1789551,남자 때문에,JOO,어린 여자,2008.01.10,Ballad,,난 길을 잃었어요 몇 번짼지 몰라요 이별 앞에서 휘청거리는 내가 난 매번 이럴 때 마다 새로운 사람을 찾아서 또 다시 기댔죠 하지만 이번엔 싫어요 더 이상 이렇게 살수는 없죠 더 이상은 남자 때문에 울고 웃지 않게 나 두발로 서 있을래 누구에게도 다신 기대지 않고 살아가 볼래 더 이상은 남자 때문에 흔들리지 않게 혼자 사는걸 배울래 누구의 손을 잡지 않고 있어도 밝은 미소로 웃을 수 있게  난 누가 필요했죠 혼자 있질 못했죠 혼자선 아픔을 감당할 수 없었죠 난 사랑을 할 때 마다 영원 할 거라 믿었기에 모든걸 주었죠 하지만 이제는 싫어요 더 이상 이렇게 살 수는 없죠 더 이상은 남자 때문에 울고 웃지 않게 내 두발로 서 있을래 누구에게도 다신 기대지 않고 살아가 볼래 더 이상은 남자 때문에 흔들리지 않게 혼자 사는걸 배울래 누구의 손을 잡지 않고 있어도 밝은 미소로 웃을 수 있게  웃을 수 있게
2008.06.01~06.07,73,1875220,오빠가 미안하다,엘비스,오빠가 미안하다,2008.05.22,Ballad,,오빠가 미안하다  이제야 미안해합니다 사소한 일들로 자주 다투고 항상 맘에 없는 말로 상처를 주고 한 마디 미안하다는 말도 하지 않고 이제야 그리워합니다 바쁘단 핑계로 늘 멀리해와서 힘들 때만 찾아가서 위로 받기만 하고 한 마디 고맙다는 말 하지 않는 오빠가 미안하다 늘 내 생각만하고 내 사랑만을 채우려 해서 바램들만 늘어서 오빠가 미안하다 나 없으면 못 사는 너의 맘도 모르고 가장 힘든 날에 널 떠나온 나를 용서해줘 이별 노래가 익숙해집니다 모두다 내 얘기 같아 참 많이 울었었는데 비가 내리면 슬퍼 울고 눈이 내리면 추억에 울고 울고 울어도 내 눈물은 끝이 없나 봐 오빠가 미안하다 늘 내 생각만하고 내 사랑만을 채우려 해서 바램들만 늘어서 오빠가 미안하다 나 없으면 못 사는 너의 맘도 모르고 가장 힘든 날에 널 떠나온 나를 용서해줘 너만 괜찮다면 나를 받아줘 예전처럼 예전보다 더 많이 잘할게  많이 힘들게 해서 오빠가 미안하다 나 없으면 못 사는 너의 맘도 모르고 가장 힘든 날에 널 떠나온 나를 용서해줘 널 떠나온 나를 용서해줘
2008.06.01~06.07,74,1872717,종로에서 (Feat. PK헤만),솔지,종로에서,2008.05.22,Ballad,안병호,비마저 주적주적 내려 난 터벅터벅 이 길을 떠나간 사람과 걷던 기억을 되짚고 다시 또 걸어보는데 나 항상 함께 걸었던 불러주던 그 노래 내가 곁에 있어도 항상 외롭다 말하던 그 소식 그렇게 떠나야만 했던 시간 속에서 너를 보내기는 정말 싫었어 돌아서는 너의 슬픈 미소 속에 사무친 그리움을 나는 알았어 회기로 향하던 쓸쓸한 플랫폼에서 서성이던 모습 보이지 않고 허전한 빈 공간 속을 걷고 있는 너의 모습 생각해 봤어 오고 가는 많은 사람들 속에서 너는 무얼 생각하고 있을까 두 눈에 이슬 가득 담고 슬픈 미소 지으며 무얼 그리워 하고 있을까 내가 곁에 있어도 그립다고 말하던 그대여 힘겹던 내 모습이 나를 울리네 내가 곁에 있어도 그립다고 말하던 그대에게 내일은 사랑한다 말해 줄꺼야  소리내 불러보아도 혹시 뒤돌아 보아도 오고가는 수많은 사람들 그속에 너는 없는걸 다주지 못한 나는 그래서 미안한 나는 한없이 가진걸 주어도 줄수록 더욱더 부족한 마음은 하늘에 반짝이는 저 별보다 맑은 맘이죠 이런 내맘도 모른채 그대는 날 또 지나쳐 떠나죠 언제든 기다릴 테니까 언제든 서있을테니까 그대는 한번만 이 길을 힘들때 모른척 걸어줘 오고 가는 많은 사람들 속에서 너는 무얼 생각하고 있을까 두 눈에 이슬 가득 담고 슬픈 미소 지으며 무얼 그리워 하고 있을까 내가 곁에 있어도 그립다고 말하던 그대여 힘겹던 내 모습이 나를 울리네 내가 곁에 있어도 그립다고 말하던 그대에게 내일은 사랑한다 말해 줄꺼야 내가 곁에 있어도 그립다고 말하던 그대여 힘겹던 내 모습이 나를 울리네 내가 곁에 있어도 그립다고 말하던 그대에게 내일은 사랑한다 말해 줄꺼야
2008.06.01~06.07,75,1860177,Lemon Tree,박혜경,여자가 사랑할때 - Lemon Tree,2008.05.02,Folk,송기원,또 아침이 오는 그 소리에 난 놀란 듯이 바빠져야 하겠죠 또 무언갈 위해서 걸어가고 답답한 버스 창에 기대있죠 더 새로울게 없는 하루겠죠 난 쉬고 싶고 자고 싶고 참 오래된 친구도 보고싶죠 그 흔해 빠지던 남자도 나 오늘따라 안보이는거죠 막 울고싶어지면 밤이 오죠 더 새롭게 더 예쁘게 나의 맘을 상큼하게 할거야 내 꿈에 숨겨온 노란 빛깔 Lemon Tree 나 약속할게 언제나 기분좋은 상쾌함에 웃을래 환하게 반기는 노란 빛깔 Lemon Tree  또 아침이 오면 노래를 해 똑같은 거릴 걸어가도 난 즐거움에 빠져 버리는 그 신비함에 놀라 웃었죠 내 웃음소리 퍼져 향기롭죠 웃어봐요 모두 즐겁게 노래해요 싱그러운 나만의 Lemon Tree 사랑이 많아서 힘든가요 웃고 있는 얼굴이 아픈가요 오 환한 미소 내가 줄게요 더 새롭게 더 예쁘게 나의 맘을 상큼하게 할거야 내 꿈에 숨겨온 노란 빛깔 Lemon Tree 나 약속할게 언제나 기분좋은 상쾌함에 웃을래 환하게 반기는 노란 빛깔 Lemon Tree 오 조금만 더욱더 새롭게 더 예쁘게 온 세상을 상큼하게 할거야 가슴에 가득히 내 꿈에 숨겨온 널 위해 가꿔온 노란 빛깔 Lemon Tree
2008.06.01~06.07,76,1831909,울어도 괜찮아 (Feat. Sol` Flower),EVAN에반(유호석),울어도 괜찮아 (Pain Reliever),2008.03.18,Ballad,,나의 소중한 사람아 아직도 힘드니 오래 전 이별 앞에 아직 아파하고 있니 사랑 참 잔인하지 그 맘 나도 잘 알아 이별은 다 그렇더라 하룰 견디기조차 숨 쉬는 것조차 지금은 모든게 힘겨울테니 눈물이 나면 마음껏 울어도 괜찮아 남자란 이유로 억지로 참지마 너 지금 이별 앞에서 후회가 많을테지만 새로운 사랑에 미안하지 않게 다 잊어야해 괜히 이기지도 못할 쓰디쓴 술을 마시고 엉망으로 취하는 모습 마치 날 보는 것 같아 이별 앞에선 다 모두 약해지잖아 예전에 나도 그랬어 남자라고 이별이 쉬운게 아닌데 작은 것 하나도 가슴에 묻고 사는데 눈물이 나면 마음껏 울어도 괜찮아 남자란 이유로 억지로 참지마 너 지금 이별 앞에서 후회가 많을테지만 새로운 사랑에 미안하지 않게 다 잊어야해  미안해 날 미워해 원망하지 않을께 함께 흘릴 눈물도 다음번의 사랑을 위해 I need you 눈물이 나면 마음껏 울어도 괜찮아 가슴에 가득 찬 아픔을 비워내 이별도 별거 아냐 실컷 또 울고나면 돼 사랑했던 만큼 사랑이 올 거야 눈물이 나면 마음껏 울어도 괜찮아 남자란 이유로 억지로 참지마 또 다시 사랑하고 한참을 후회를 해도 시간에 잊은채 또 사랑할테니 다 잊을테니 잠시만 울어도 괜찮아
2008.06.01~06.07,77,1807099,모를까봐서,쥬얼리,5집 Kitchi Island,2008.02.20,Ballad,"한상원,이지은",아무도 모르죠 꿈에도 꿈에도 그대도 모르죠 하나도 하나도 헤어지잔 그 말이 가슴을 백 번도 쳐서 하루도 온종일 잠시도 없죠 모를까봐서 아니 넌 다를까봐서 내 가슴이 시린 머리에 또 다시 미치게 아프고 아리고 아릴까봐서 또 내가 원망을 이렇게 말할 수 없어서 터질 것 같은 내 맘이 가리워진다해도 사랑해 그대만을 말하고 말하죠 사랑이 뭐라고 시간이 모든걸 해결해 줄거라고 헝클어진 마음에 단추를 채우려해도 흩어져 하나도 모을 수 없죠 모를까봐서 아니 넌 다를까봐서 내 가슴이 시린 머리에 또 다시 미치게 아프고 아리고 아릴까봐서 또 내가 원망을 이렇게 말할 수 없어서 터질것 같은 내 맘이 가리워진다해도 사랑해 그대만을 그대가 떠나가던 날 너무 아쉬워 부르고 불러도 이렇게 그대를 보내야 하죠 기다렸는데 하루도 쉬지 않는데 내 마음이 지친 눈가를 또다시 적시게 아파도 그리운 사람이라서 또 내가 차가운 뒷 모습 남기고 떠나도 나를 찾아 오지않아 눈물만 준다해도 사랑해 그대만을 모를까봐서 아니 넌 다를까봐서 내 가슴이 시린 머리에 또 다시 미치게 아프고 아리고 아릴까봐서 또 내가 원망을 이렇게 말할 수 없어서 터질 것 같은 내 맘이 가리워진다해도 사랑해 그대만을
2008.06.01~06.07,78,1851234,미치겠어 (Feat. M.A.C),MC몽,Show`s Just Begun,2008.04.17,Rap / Hip-hop,MC몽,look so sweet  그대 이름은 windy  windy you will always   be my candy  달콤한 사랑은 오늘따라  왠지 살살 녹아 드는  부드러움의 극치  따뜻한 너의 손길로  얼어붙은 하루를 넘기고  마치 꼭 365일 우린 둘만의  화려한 party를 열고  one shot one shot at   love you  only gat one shot at love  내 눈 안에 이미 들어온 널  두근 두근 두근 두근   느껴지는 걸  뭐든 필요하면 부탁해  평생 너를 위한 5분 대기조  숨막히는 일상 이젠   니가 있어  코믹 멜로 리얼 버라이어티쇼  다시 내게 돌아 와 주길 바래  매일 너를 위해 부르는 노래  너 없이 사랑했던   우리 사랑은  나에겐 오직 너뿐이야  정말 미치겠어  정말 미치겠어  정말 미치겠어  숨기지 못한 내 마음  정말 미치겠어  정말 미치겠어  정말 미치겠어  말하지 못한 내 마음 때문에  you make me crazy  너로 인해 난  this love is crazy 미치겠어  요동치는 심장 박동수 너로 인해  나를 빛내준  우리 사랑에 불을 붙힌 다음  사랑을 얻겠어 니 마음   그대만 보면  나는 미치겠어 정말  너 너 너 때문에 미치겠어  정말 심장이 터질 듯 해  미치겠어 정말  you make me crazy  뭐든 필요하면 부탁해  뜨겁게 우리사랑 불타게  그대와 can i have this dance  기회를 줘 give one more   chance  내게 돌아 와 주길 바래  매일 너를 위해 부르는 노래  너 없이 사랑했던 우리 사랑은  나에겐 오직 너뿐이야  정말 미치겠어  정말 미치겠어  정말 미치겠어  숨기지 못한 내 마음  정말 미치겠어  정말 미치겠어  정말 미치겠어  말하지 못한 내 마음 때문에  좋거나 아님 나쁘거나 죽거나  아님 도망치거나  둘중에 한가지만 선택해  잘 들어 그리고 꼭 기억해  난 죽을 때까지 너만 선택해  you make me crazy  this love is crazy  you make me crazy  this love is crazy  우리사랑 지킬 자신은 있어  힘든 세상 이젠 그대가 있어  철없이 부딪혔던   작은 인연이  시작된 더 큰 사랑이야  이젠 미치겠어  정말 미치겠어  정말 미치겠어  숨기지 못한 내 마음  정말 미치겠어  정말 미치겠어  정말 미치겠어  말하지 못한 내 마음  이젠 미치겠어  정말 미치겠어  정말 미치겠어  숨기지 못한 내 마음  정말 미치겠어  정말 미치겠어  정말 미치겠어  말하지 못한 내 마음   이젠 미치겠어  정말 미치겠어  정말 미치겠어  숨기지 못한 내 마음  정말 미치겠어  정말 미치겠어  정말 미치겠어  말하지 못한 내 마음
2008.06.01~06.07,79,1789828,그깟 사랑,"이진성(먼데이키즈),최현준(V.O.S),일락",Friendship,2008.01.15,Ballad,"민명기,미스티",아직 모르겠니 모든게 끝났다고 우리 사랑은 죽었다고 니 눈물도 내 맘 돌릴 순 없을 테니 날 보내줘 부탁이야 기다리면 돌아올지도 모른다고 넌 한걸음도 떼지못해 바보처럼 자꾸 이름만 부르잖아 내 맘도 넌 모르면서 니가 아프잖아 사랑하면 나 할수록 자꾸 커져가는 내 욕심에 오늘 하루라도 눈물은 참아줘 내일이면 잊을테니 제발 가란말야 돌아보지도 말고 가 두 번 다시는 못 볼 사랑 그 추억만 내가 가져갈게 내 사랑아 이젠 안녕 정말 헤어지면 죽을 것만 같아도 나 없인 안될 것 같아도 다른 사랑에 날 잊을 수 있을거야 그리워도 참아야 해 니가 아프잖아 사랑하면 나 할수록 자꾸 커져가는 내 욕심에 오늘 하루라도 눈물은 참아줘 내일이면 잊을 테니 제발 가란말야 돌아보지도 말고 가 두 번 다시는 못 볼 사랑 그 추억만 내가 가져갈게 내 사랑아 이젠 안녕 흔들리는 니 어깨도 이제는 안아 줄 수 없잖아 너를 사랑해도 너를 붙잡고 싶어져도  너를 위한거야 나를 지워버려 너를 울리는 나잖아 그깟 사랑따윈 지워버려 그래 나란 사람 못난 남자라서 이별밖에 줄 게 없어 제발 가란말야 돌아보지도 말고 가 두번 다시는 못 볼 사랑 그 추억만 내가 가져갈게 내 사랑아 이젠 안녕
2008.06.01~06.07,80,1876378,B Love (So Baby),H7美人-Theb,H7美人(미인) Sun&Love Project,2008.05.26,R&B / Soul,정병규,너만을 원하고 너를 원하던 내 사랑은 이제 다 끝이야 간직한 추억에 아픈 상처만이 널 위한 마지막 배려야 날 위해 살아줘 날 위해 행복해 줘 이번엔 다른 너를 위해 살아줘 나에겐 너뿐이야 죽어도 못 잊을 너 사랑했던 그 때로 돌아와 so baby 너만을 원하고 너를 원해 간직한 사랑 모두 네게 다 줄테니 이별의 상처가 너무 싫어 이 쯤에서 끝내줘 다시는 울지 않아  너만을 원하고 너를 원하던 내 사랑은 이제 다 끝이야 간직한 추억에 아픈 상처만이 널 위한 마지막 배려야 날 위해 살아줘 날 위해 행복해 줘 이번엔 다른 너를 위해 살아줘 나에겐 너 뿐이야 죽어도 못 잊을 너 사랑했던 그 때로 돌아와 so baby 너만을 원하고 너를 원해 간직한 사랑 모두 네게 다 줄테니 이별의 상처가 너무 싫어 이 쯤에서 끝내줘 다시는 울지 않아 이렇게 끝내면 나 너 없이 없는 삶을 어떻게 살아가야 해 차라리 날 버려줘 이 쯤에서 끝내 미련조차 없게 해줘 가버려 so baby 너만을 원하고 너를 원해 간직한 사랑 모두 내게 다 줄테니 이별의 상처가 너무 싫어 이 쯤에서 끝내줘 다시는 울지 않아 so baby 너만을 원하고 너를 원해 간직한 사랑 모두 내게 다 줄테니 이별의 상처가 너무 싫어 이 쯤에서 끝내줘 다시는 울지 않아 내가 사랑했던 그대
2008.06.01~06.07,81,1867788,Good Bye (Feat. 한경일),서영은,미니앨범,2008.05.15,Ballad,,잘가요 잘가요 다 내 탓이죠  잘가요 잘가요 안녕 내 사랑  그 귓가에 던진 그 말 Good Bye    안돼요 안돼요 가지마세요  아직은 아직은 자신이 없죠  서로의 불안한 믿음과  철 없던 사랑이 이별을 부른거죠  내가 더 잘할게요    당장 내게 닥친 그리움에 오늘을 어쩌죠    내 눈물 한 방울도 참지 못한 내가  그대 하나 믿고 살던 못난 내가  빌고 빌었었는데 이게 마지막 사랑이길  지겹도록 울어야 했던  우리의 인연도 끝인거죠  들려도 들리지 않는 말  내 귓가에 맺혔던 그 말 Good Bye    서로를 한번 꼭 안고서  대답도 못하던 숨도 못 쉴 만큼  눈물삼킨 내 속을 알까요    내 눈물 한 방울도 참지 못한 내가  그대 하나 믿고 살던 못난 내가  빌고 빌었었는데 이게 마지막 사랑이길  지겹도록 울어야 했던  우리의 인연도 끝인거죠  들려도 들리지 않는 말  내 귓가에 맺혔던 그 말 Good Bye    참 좋았는데 사랑했는데  흘려도 흘려도 넘칠 만큼 사랑했는데  모두 백지가 됐죠 우린 거짓말이죠    세차게 내 맘을 뒤흔든 나쁜 사람  그래도 난 그대의 여자이니까  죽을듯한 이별도 그대가 준 선물이니까  지겹도록 아파야 해도  그대가 하라면 해볼게요  들려도 들리지 않는 말  내 귓가에 맺혔던 그 말 Good Bye    Good Bye...
2008.06.01~06.07,82,1872567,눈물속愛(애),박상민,눈물속愛(애),2008.05.21,Ballad,,한 걸음씩 멀어지는 일 너를 두고 될까 한 조각씩 지워내는 일 널 잊고 살게 될까 이깟 이별쯤은 삭이고 버티면 몹쓸 원망도 잦아들 거라고 하찮은 척 내치고 널 떠밀어도 내 사랑은 변하지도 않아 한 번만 이라도 한 번만 이라도 꿈에서라도 내 앞에 좀 나타나 미친 듯 살아도 죽은 척 살아도 멈추지 않아 눈물 속에 너를 찾는 일  갈 곳이 없어 아무리 걸어도 쉴 곳이 없어 먹먹한 내 가슴 괜찮다 난 괜찮다 애를 써봐도 무너지는 난 어떡해야 해 한 번만 이라도 한 번만 이라도 꿈에서라도 내 앞에 좀 나타나 미친 듯 살아도 죽은 척 살아도 멈추지 않아 눈물 속에 너를 찾는 일  다시 사랑할 수 있다면 네 곁에 내가 다시 살 수 있다면 두 번 헤어지지 않도록 잘할 수 있는데 한 번만 이라도 한 번만 이라도 꿈에서라도 내 앞에 좀 나타나 천 번의 우연을 다시 겪더라도 너만 준다면 얼마든지 기다릴 거야
2008.06.01~06.07,83,1861177,이제서야,김동희,이제서야,2008.05.07,Ballad,,이렇게 그대가 멀쩡히 그대가 떠나가네 멀어지네 작아지네 안녕이라고 말하네 가라하네 가라하네 이제서야 그댈 잡아요 이제서야 내가 그대를 찾아요 이제서야 그대를 불러요 다시 한번 돌이켜봐도 그제서야 나는 울어요 그제서야 나는 그대를 원해요 사랑해요 사랑해요 외쳐보네요  남겨진 미련에 깊어진 사랑에 아파와서 아파와서 못잊어서 자꾸만 왜 이러는지 모르다가 모르다가 이제서야 그댈 잡아요 이제서야 내가 그대를 찾아요 이제서야 그대를 불러요 다시 한번 돌이켜봐도 그제서야 나는 울어요 그제서야 나는 그대를 원해요 사랑해요 사랑해요 외쳐보네요 가지 말라 말하려 해도 가지 말라 말하려 해도 참지 말고 말하려 해도 자꾸만 또 눈물만  어떻게든 잡고 싶어요 어떻게든 내게 돌아와 돌아와 그래야 난 살 수가 있어요 다시 한번 돌이켜봐도 그제서야 나는 울어요 그제서야 나는 그대를 원해요 사랑해요 사랑해요 외쳐보네요
2008.06.01~06.07,84,1851578,Good Bye (1박 2일 백령도편 삽입곡),마리오,1st Single (Mario),2008.04.18,Rap / Hip-hop,,Good bye Good bye 참 즐거웠어요 Good bye Good bye 날 떠나가세요 Good bye 이제는 행복하세요 지난 추억 속에 나를 지워요 영원토록  늦잠을 자는 날 때리면서 깨우던 아침밥 먹으라고 다 타버린 밥 주던 빨리 씻으라고 발수건을 던지던 너였었지 약속에 늦어도 도리어 화를 내며 밥 사라고 요즘 자기 쫓아다니는 사람 많다고 날 만나주는걸 행복해하라고 말했었지 그랬던 너의 속삭이던 입술에 다시 입맞추지 못해요 나를 보던 눈빛이 아직 기억에 선명한데 Good bye Good bye 참 즐거웠어요 Good bye Good bye 날 떠나가세요 Good bye 이제는 행복하세요 지난 추억 속에 나를 지워요 영원토록  눈 내리던 겨울바다 함께 보고 싶었고 배낭 하나 메고 유럽여행도 가고 멋진 차를 타고 몇 날 며칠이고 떠나보고 싶었어 또 친구들한테 널 소개하고 부모님한테 인사시키고 멋진 영화처럼 결혼해줘 말하려 했는데 그대와 내 약속이 이제 사라지고 있네요 다른 사람 만나면 나 같은 사람 잊어 가요 Good bye Good bye 참 즐거웠어요 Good bye Good bye 날 떠나가세요 Good bye 이제는 행복하세요 지난 추억 속에 나를 지워요 속삭이던 입술에 oh oh 입을 맞추고 싶어 나를 보던 눈빛이 oh oh 지워지지가 않아 그대와 내 약속이 oh oh 이제 다 사라지고 다른 사람 만나면 나 같은 사람 잊어 가요 Don't cry Don't cry 참 미안했어요 Don't cry Don't cry 눈물을 닦아요 Don't cry 하나만 약속해줘요 못난 내 사랑에 아프지 마요 나를 잊어요 즐거웠던 추억 행복했던 기억 이제는 지나버린 시간으로 남아 만지지도 못해 느끼지도 못해 그대 없는 나는 너무 괴로운데 Good bye 이제는 행복하세요 지난 추억 속에 나를 지워요 영원토록
