time,rank,song_id,title,singers,album,date,genre,creator,lyric
2006.10.30~11.05,33,1414764,마이동풍,배치기,마이동풍 (馬耳東風),2006.09.04,Rap / Hip-hop,배치기,내 귀를 막고 세상 닫고  내마음 한길로 내 마음을 믿고  세상 딛고 내마음 한길로  감성보다 이성이 날 앞서   낯선 이곳에서나  들춰진 내 치부를 봤어  창의력이 완전 제로  난 곧이곧대로  1은 1인 내 머리에  예술성은 없어  됐어 악써도  너는 재능 없어  애써도 넘지 못할  선이 있다 했으나  팔자가 사나워서  개버릇은 남 못 주니  오 이걸  어쩌라는 말이오  어쩌기는 어쩌겠어  저 벼랑끝에 떠밀어  내도 좀더  휘뚜루마뚜루  나름의 만발의  준비를 해  날 패대기치고  피라미 취급하는 내길에  이치를 무시하는  이들에게 외치리  날 찢고 볶고  네 까짓거 무시한다해도  내게는 씨도  안 먹히니  주저리주저리  지껄여봤자난  난 진짜 알짜배기로 살며  나는 나만의 방식으로 지탱할테요  이 우주의 축이 나요  나 비록 도태된  삶이 버린 헌신짝이라도  내가 굴할깝쇼  이 세상살이 속에서  늘 밑진다하여도  나의 마이동풍  굳게 다문 입술에  품은 배짱 하나로  오늘도 내일도 간다  풍파 속에 삶이  나를 밟고 있어도  난 그저 하하하하  다시 앞으로  운명 속 내 별도  떨어져 날 내쳐도  그 고난속에서도  음하하하하  hey  봄바람에  내 귀를 간지럽힌 자는  모두다 hands up  hey  봄바람에  내 귀를 간지럽힌 자는  모두다 hands up  그래 mommy and daddy 나를 마니엘헤니처럼  낳아주지는 않으셨지만  난 나름의 matic으로  조종하며  세상의 비포장도로  거침없이 덧칠했어  모아니면 도로  살아왔다  때로는 사랑이  날 깨고 무시의 끝에  날 대롱대롱 매달아도  절대 개의치않지  하하 같잖지  나는야 매일이 잔치  내뜻이 갈리고 내꿈이 날려도  난 다시 부푼거리로  마음에 채비를 갖춰 굳게 걸어나가  두 눈을 막는 세상 그리로  악담을 퍼붓고 더 세게 날 밟아  다시는 서지 못할 마음으로  상처를 씹어먹고 난 계속 커 갈거야  세상에 중심에 내 뜻이 설거야  나 비록 도태된  삶이 버린 헌신짝이라도  내가 굴할깝쇼  이 세상살이 속에서  늘 밑진다하여도  나의 마이동풍  굳게 다문 입술에  품은 배짱 하나로  오늘도 내일도 간다
2006.10.30~11.05,34,1454587,우리 이제 어떻게 하나요,"김현철,거미",우리 이제 어떻게 하나요,2006.10.02,Ballad,"김현철,이해준",우리 이제 어떻게 하나요 너무 많이 사랑하는 것을 보고 싶겠죠 미칠 듯 많이 그대도 뭐라고 얘기 좀 해봐요 나도 뭐라 할 말이 없어서 그냥 그댈 바라 볼 뿐이죠 참고 참았던 눈물이 나와 이게 아니었는데 그래도 다시 몇 년이 지나 이런 순간이 오면 그땐 이러지마요 또 다시 미쳐버릴 것 같은 사랑과 그렇게도 보고픈 그대라면  마지막 하나 물어볼게요 내겐 정말 소중한 것을요 자신 있나요 변하지 않을 난 언제까지나 변하지 않아요 차마 내가 어찌 잊을까요 내게 남은 마지막 사랑을 잊을 수 없죠 그대의 얼굴 그대와 나눈 모든 걸 그래도 다시 몇 년이 지나 이런 순간이 오면 그 땐 이러지마요 또 다시 미쳐버릴 것 같은 사랑과 그렇게도 보고픈 그대라면 죽도록 사랑한 기억을 묻은 채 기다려야 할테죠 그래야만 하겠죠 그래도 다시 몇 년이 지나 이런 순간이 오면 그땐 이러지마요 사랑해 그렇게 말할 수 있는 날이 다시는 오지 않는다고 해도  우리 이제 어떻게 하나요
2006.10.30~11.05,35,1478452,인연 (New Mix) (Feat. 바비 킴),리사,인연,2006.10.23,R&B / Soul,,널 처음 만나게 된 그 때가 내겐 새로운 시작이 되었어 모르던 세상을 보게 해준 그댄 나에게 눈부신 사랑 난 널 사랑하나봐 너 없이는 나 다 의미 없어 이제 내게 다가와 내 모든 걸 난 나누고 싶어 I want to give my all 시간이 가도 I want you in my life 그 때 만나지 못 했더라도 우린 어떻게라도 사랑하겠지 난 널 사랑하나봐 너 없이는 나 다 의미 없어 이제 내게 다가와 내 모든 걸 난 나누고 싶어  Won't you be my life  La la la la la 너를 만나게 된건 나의 운명이었나봐 uh Won't you be my life 너는 아름다운 작은 새 color red 내 사랑의 새장에다 넣어둘래 너를 보면 밝은 미소에 눈이 부셔 티 안 나는 웃음으로 yo I kept it in my head 잠시도 나의 사랑고백 I won't stop 너를 위해 노래할게 lala 당신이 있어야 내가 걷는 이 세상은 어둠이 사라진 길이 되네 no problem 사랑은 영원하지 않다고 모두 말하지만 I don't care what they say 너와 난 왠지 다를 것 같아 나 믿고 싶어 우리 지금처럼만  너 없이는 나 다 의미 없어 너와 함께 hey 사랑해 아름다운 너 널 배워가며 오 난 너를 사랑해 너 없이는 나 다 의미 없어 이제 내게 다가와 my life 내 모든 걸 난 나누고 싶어
2006.10.30~11.05,36,1415491,그대 때문에,박기영,Bohemian,2006.09.12,Ballad,박기영,사랑해서 떠난다는 그대
2006.10.30~11.05,37,1356054,사랑을 찾아서,엠씨더맥스,Rainbow Vol. 2,2006.08.18,Ballad,J.Yoon,믿지 못해 돌린 발걸음 뒤로 멈춰버린 나의모습 숨지못할 어둠속에 가둔 내 모습조차 보이지않아 이런 나를 찾아주길 원했지만 너무 멀리 왔나봐 하지만 이곳은 너무나 어두워 길조차 보이지 않아 혼자가 아닌 한 사람 그렇게 나는 존재하며 그 냉정한 잔인한 내 모습에 나조차도 지쳐버린거야 사람을 찾아 사랑을 만나 사랑한 내가 미워 내가원하던 너의 모습도 지나친 기대였을까 혼자를 바래 혼자로 남아 홀로된 내가 있어 이런내모습 보인다해도 모른척 날 스쳐가 우리가 아닌 너와 나 그렇게 나는 외면하며 잔인하게 냉정하게 살아가 나조차도 날 버린거야 잊지못할 돌린 발걸음 뒤에 찾아온 내기억속에 눈을 감아 지금 모든걸 듣는 채 이곳에 난 묻어가  혼자가 아닌 한사람 그렇게 나는 존재하며 그 냉정한 잔인한 내 모습에 나조차도 지쳐버린거야 사람을 찾아 사랑을 만나 사랑한 내가 미워 내가원하던 너의 모습도 지나친 기대였을까 혼자를 바래 혼자로 남아 홀로된 내가 있어 이런 내모습 보인다해도 모른척 날 스쳐가 우리가 아닌 너와 나 그렇게 나는 외면하며 잔인하게 냉정하게 살아가 나조차도 날 버린거야 사랑을 찾아 사랑을 만나 사랑한 내가 미워 니가그려낸 나란 환상도 존재할 수 없나봐 혼자를 바래 혼자로 남아 혼자숨쉬고 있어 이런 내모습 변한다해도 모른척 날지켜봐
2006.10.30~11.05,38,1472028,카시오페아 (Cassiopeia) (Feat. 임정희),비,Rain`s World,2006.10.13,Ballad,박진영,저 어딘가에 수많은 불빛 중에 니가 살고있는 집도 있을텐데 그 사람 곁에서 편안한 미소를 지으며 힘든일 없이 오늘도 지냈겠지 저 어딘가에 수많은 불빛 중에 잠 못 이루는 니가 있을텐데 나를 보내주고 행여나 아직도 내 생각에 아파하면서 힘들진 않은지 I don't wanna let u go I don't wanna let u go 세월이 지나도 변하지 않는 맘 아직도 넌 내 여자 내 사랑이란 걸 버리지 못하는 나를 니가 본다면 얼마나 우스울까 I don't wanna let u go I don't wanna let u go 아직 깊은 곳에 변하지 않는 맘 다른 사람의 여자가 되버린 내가 이런 마음을 갖고 있는 걸 안다면 얼마나 우스울까 MY LOVE  저 하늘 위에 반짝이는 별 중에 니가 찾아준 별자리가 보여 넌 가끔 나를 아름다운 추억으로 떠올려 보겠지 어릴적 동화처럼 저 하늘 위에 반짝이는 별 중에 내가 찾아준 별 자리가 보여 행여 니가 보고 내 생각에 눈물 흘릴까봐 내 손으로 가려주고 싶어 I don't wanna let u go I don't wanna let u go 세월이 지나도 변하지 않는 맘 아직도 넌 내 여자 내 사랑이란 걸 버리지 못하는 나를 니가 본다면 얼마나 우스울까 I don't wanna let u go I don't wanna let u go 아직 깊은 곳에 변하지 않는 맘 다른 사람의 여자가 되버린 내가 이런 마음을 갖고 있는 걸 안다면 얼마나 우스울까 MY LOVE 아직 변함없이 넌 MY LOVE
2006.10.30~11.05,39,1455695,칵테일 사랑,거북이,The Land Of Turtles,2006.09.26,Dance,,마음 울적 한날엔 거리를 걸어보고  향기로운 칵테일에 취해도 보고  한편의 시가 있는 전시회장도 가고  밤새도록 그리움에 편질 쓰고파    모짜르트 피아노 협주곡 21번  그 음악을 내 귓가에 속삭여주며  아침 햇살 눈부심에 나를 깨워줄  그럴 연인이 내게 있으면    나는 아직 순수함을 느끼고 싶어  어느 작은 우체국 앞 계단에 앉아  프리지아 꽃향기를 내게 안겨줄  그런 연인을 만나봤으면    마음 울적한 날엔 거리를 걸어보고  향기로운 칵테일에 취해도 보고  한편의 시가 있는 전시회장도 가고  밤새도록 그리움에 편질 쓰고파    모짜르트 피아노 협주곡 21번  그 음악을 내귓가에 속삭여주며  아침 햇살 눈부심에 나를 깨워줄  그럴 연인이 내게 있으면    나는 아직 순수함을 느끼고 싶어  어느 작은 우체국 앞 계단에 앉아  프리지아 꽃향기를 내게 안겨줄  그럴 연인을 만나봤으면    마음 울적한 날엔 거리를 걸어보고  향기로운 칵테일에 취해도 보고  한편의 시가 있는 전시회장도 가고  밤새도록 그리움에 편질 쓰고파    창밖에는 우울한 비가 내리고 있어  내 마음도 그 비따라 우울해지네  누가 내게 눈부신 사랑을 가져줄까  이 세상을 나로 인해 아름다운데    마음 울적한 날엔 거리를 걸어보고  향기로운 칵테일에 취해도 보고  한편의 시가 있는 전시회장도 가고  밤새도록 그리움에 편질 쓰고파
2006.10.30~11.05,40,1480159,Come 2 Me,엄정화,Prestige,2006.10.26,Dance,방시혁,너만 생각하면 생각하면 아무것도 못 해 정말 못 해 왠지 나도 몰래 나도 몰래 너무 달아올라 달아올라 하루종일 너만 기다려 알잖아 난 준비가 돼 있어 매일 밤 너만 기다리는 걸 너의 손길에 나를 맡긴채 이대로 쓰러지고 싶은 걸  니가 날 만지면 날 만지면 나는 날아올라 날아올라 니가 입 맞추면 입 맞추면 정말 너무 좋아 너무 좋아 어쩜 내가 미친 것 같아 알잖아 난 준비가 돼 있어 매일 밤 너만 기다리는 걸 너의 손길에 나를 맡긴채 이대로 쓰러지고 싶은 걸 ye 그냥 내게로 와 If you ready What you waiting for 망설이지마 any time any place every night everyday 니가 원하는 거 나와 똑같애 사랑인지 아님 욕망인지 참을 수가 없으니 come 2 me just little we come close 가까이 모든 걸 이뤄줄게  알잖아 난 준비가 돼 있어 매일 밤 너만 기다리는 걸 너의 손길에 나를 맡긴채 이대로 쓰러지고 싶은 걸 알잖아 난 준비가 돼 있어 매일 밤 너만 기다리는 걸 너의 손길에 나를 맡긴채 이대로 쓰러지고 싶은 걸
2006.10.30~11.05,41,1476372,시간이 흘러서,씨엘,시간이 흘러서,2006.10.20,Ballad,,웃지도 울지도 못하는 바보같은 나  잡아도 붙잡아도 냉정히 돌아서는 너  잡지말라고 웃어달라고 애원하는 너인데    시간이 흘러서 마음이 변해서  날 잊게 되어도 다시 돌아올 수 있니  눈물이 흘러서 두 눈을 가려서  볼 수가 없어도 내 얼굴은 볼 수 있겠지  예전처럼~    가지마라고 애원해봐도 돌아서는 너인데    시간이 흘러서 마음이 변해서  날 잊게 되어도 다시 돌아올 수 있니  눈물이 흘러서 두 눈을 가려서  볼 수가 없어도 내 얼굴은 볼 수 있겠지  예전처럼~    힘들어했던 모든 시간들 다 잊어버리고  다시 돌아올 그날이 오길 나 기다릴게  우~    시간이 흘러서 마음이 변해서  날 잊게 되어도 다시 돌아올 수 있니  눈물이 흘러서 두 눈을 가려서  볼 수가 없어도 내 얼굴은 볼 수 있겠지  예전처럼~
2006.10.30~11.05,42,1472025,With U,비,Rain`s World,2006.10.13,Dance,박진영,니가 떠나고 남은 난 길을 잃었었어 I lost without you 나 자신을 추스려 보려고 애를 써도 되지가 않았어 떠오르는 니 모습을 떠올리지 않으려 생각하지 않으려 해도 아무렇지 않은 척 살아가고 있었지만 너만 기다렸어 With you I'm not alone 너만 있으면 I'm not alone 뭐든 닥쳐도 두렵지 않아 너만 있으면 With you I'll never fall 너만 있으면 I'll never fall 난 쓰러지지 않아 니가 내 손만 잡아주면 나는 왠지 니가 돌아올 것만 같았어 I knew you would you come back baby 내가 너를 그리워하는 그 만큼 너도 날 그리워 할것 같았어 너무 아름다웠던 우리 사랑이기에 너무 행복했기에 이렇게 끝나진 않을 거란 걸 알았어 난 니가 올 줄알았어 With you I'm not alone 너만 있으면 I'm not alone 뭐든 닥쳐도 두렵지 않아 너만 있으면 With you I'll never fall 너만 있으면 I'll never fall 난 쓰러지지 않아 니가 내 손만 잡아주면 With you I'm not alone 너만 있으면 I'm not alone 뭐든 닥쳐도 두렵지 않아 너만 있으면 With you I'll never fall 너만 있으면 I'll never fall 난 쓰러지지 않아 니가 내 손만 잡아주면 언제나 난 니가 올 걸 알았어 왠진 모르겠지만 서로의 자릴 누구도 메꿀 수가 없기에 With you I'm not alone 너만 있으면 I'm not alone 뭐든 닥쳐도 두렵지 않아 너만 있으면 With you I'll never fall 너만 있으면 I'll never fall 난 쓰러지지 않아 니가 내 손만 잡아주면 With you I'm not alone 너만 있으면 I'm not alone 뭐든 닥쳐도 두렵지 않아 너만 있으면 With you I'll never fall 너만 있으면 I'll never fall 난 쓰러지지 않아 니가 내 손만 잡아주면 baby i'm miss you
2006.10.30~11.05,43,1454597,마음을 잃다,넬(NELL),Healing Process,2006.09.21,Rock,,당신이란 사람 정말 몸서리 처질정도로 끔찍하네요 언제까지 내 안에서 그렇게  살아 숨 쉬고 있을 건가요  언제 죽어 줄 생각 인가요  시간이 흐르고 내 마음이 흘러서 그렇게 당신도 함께 흘러가야 되는데 정말 그게 말처럼 쉽지가 않네요  그리움에 울다 지쳐 잠이 드는 것도 이젠 지겹고 같은 그리움에 사무쳐 눈을 뜨는 것도 이젠 지겨워 시간이 흐르고 내 마음이 흘러서 그렇게 당신도 함께 흘러가야 되는데 정말 그게 말처럼 쉽지가 않네요 내 안에 살고있는 너의 기억 때문에  내 마음 내 시간 다 멈춰버려서 그 흔한 추억조차 만들지 못하고 난 아직도  도대체 언제쯤에나 난 당신에게서 자유로울 수 있을까요 그런 날이 오기는 올까요 그때까지 견딜수 있을까요 시간이 흐르고 내 마음이 흘러서 그렇게 당신도 함께 흘러가야 되는데 정말 그게 말처럼 쉽지가 않네요 내 안에 살고 있는 너의 기억 때문에  내 마음 내 시간 다 멈춰버려서 그 흔한 추억조차 만들지못하고 난 아직도 이렇게 이별 중이죠
2006.10.30~11.05,44,1416753,너무 아픈 이 말 (Feat. 지선),알렉스,각인 (刻人),2006.09.19,Ballad,이재학,You are so beautiful  그대는 나를 멈추게 했죠  조금도 움직일 수 없게  그대는 다가와  어느새 나를 가져 버렸죠  아무런 기척도 없이  한번쯤 고백하고 싶은데  나에겐 너무 어려운 말  사랑해 너를 사랑해  늘 바라 볼 수밖에 없는데  너의 작은 표정 하나까지도  큰 의미로 내게 다가와  자꾸 날 흔들죠    You are so beautiful  그대는 나를 외롭게 하죠  아무도 사랑할 수 없게  그대는 나에게  어느덧 아픈 단어가 됐죠  이렇게 나의 가슴에  조금만 나를 바라봐주면  달려가 네게 하고픈 말  사랑해 너를 사랑해  늘 숨기고 나 감추려 해도  너의 의미 없는 말 한 마디에  웃음짓고 눈물 흘리며  꿈에 그리는 말  그댄 모르죠  나도 그댈 사랑해  아픈 가슴조차 이젠 무뎌질만큼  오랫동안 그리며 간직해온 맘  그댄 알지 못하죠  너무 아픈 이 말  사랑해 너를 사랑해  늘 바라볼 수밖에 없는데  너의 작은 표정 하나까지도  큰 의미로 내게 다가와  웃음짓고 OH 날 울리고  자꾸 날 흔들죠
2006.10.30~11.05,45,1325050,비행기,거북이,거북이 사요!!,2006.07.20,Dance,임성훈,Yes Turtles Forth album New mind New song  철없을 적 내 기억속에 비행기 타고가요  Yeh Let's go  파란 하늘위로 훨훨 날아가겠죠  어려서 꿈꾸었던 비행기 타고  기다리는 동안 아무말도 못해요  내 생각 말할순 없어요  모든 준비 다 끝났어  곱게 차려 입고 나선  바깥 풍경마저 들뜬 기분  때가 왔어 하늘위로 날으는 순간이야  조금은 두려워도  애써 내색 할 순 없어 이번이 처음이지만  전에 자주 비행했었잖아  친구들과 말썽장이 거북이 비행기로 올라타  준비됐나  수많은 사람들 속을 지나쳐 마지막 게이트야  나도 모르게 안절부절하고 있어  이럴 땐 침착해 좀 자연스럽게  파란 하늘위로 훨훨 날아가겠죠  어려서 꿈꾸었던 비행기 타고  기다리는 동안 아무말도 못해요  내 생각 말할순 없어요 Yes Remember 비행기를 타고 가던 너 따라가고 싶어 울었던  철없을 적 내 기억속에 비행기 타고가요  Yes Fly 다들 아무 일도 없는 듯  하늘을 나르는데 아무걱정 없는 듯  왠지 철닥서니 없었나 문득 이런 내 모습 촌스러 입 다문듯  쳐다보지 말아요  다들 처음 탈 때 이러지 않았나요  딴 데 봐요  신경 쓰지 마요  나 혼자 이런게 나 좋아요  어떤 느낌일까 정말 새들처럼 나는 기분  세상 모든 것이 점처럼 보 여 지겠지  개구쟁이 거북이 비행기로 드디어 출발한다  수많은 사람들 속을 지나쳐 마지막 게이트야  나도 모르게 안절부절하고 있어  이럴 땐 침착해 좀 자연스럽게  파란 하늘위로 훨훨 날아가겠죠  어려서 꿈꾸었던 비행기 타고  기다리는 동안 아무말도 못해요  내 생각 말할순 없어요  파란 하늘위로 훨훨 날아가겠죠  어려서 꿈꾸었던 비행기 타고  기다리는 동안 아무말도 못해요  내 생각 말할순 없어요 Yes Remember 비행기를 타고 가던 너 따라가고 싶어 울었던  철없을 적 내 기억속에 비행기 타고가요
2006.10.30~11.05,46,1370824,아프고 아파도,솔플라워(Sol`Flower),Fantastic Story (Special Single),2006.08.24,R&B / Soul,안영민,오늘은 아플것 같아 나 많이 울것만 같아 사랑했던 널 보내야 하니까 함께 울고 웃던 날이 자꾸만 생각이 나서 서운하고 가슴이 아파  너무 미안해 하지마 슬픈 표정도 짓지마 이런 내가 더 미안해지잖아 다만 니가 걱정돼서 내가 없이 살 너라서 꼭 부탁하고 싶은 게 있어 제발 아프지 말고 제발 울지도 말고 속상하다고 술 많이 마시지도 말고 귀찮아도 밥 거르지 말고 혹시라도 내 생각나도 전화하지 말고 말은 하지 않아도 괜찮은 척 웃어도 내가 가슴 아플 줄 니가 더 잘 알면서 사랑했다는 말 한번쯤은 할 수 있잖아 이런 게 이별인가 봐  나 먼저 일어서줄게 나 먼저 돌아서줄게 그래야 니가 맘 편해지잖아 그래도 날 불러주면 달려와 꼭 안아주면 나 후회없이 갈 수 있잖아 제발 아프지 말고 제발 울지도 말고 속상하다고 술 많이 마시지도 말고 귀찮아도 밥 거르지 말고 혹시라도 내 생각나도 전화하지 말고 말은 하지 않아도 괜찮은 척 웃어도 내가 가슴 아플 줄 니가 더 잘 알면서 사랑했다는 말 한번쯤은 할 수 있잖아 이런 게 이별인가 봐  정말 사랑했는데 너무 사랑했는데 눈부신 추억들이 자꾸 날 아프게 해 니가 보고싶으면 어떻게 해야 하는지 사랑이 떠나가나 봐
2006.10.30~11.05,47,1467695,Dream Of My Life,신승훈,The Romanticist,2006.10.10,Ballad,심현보,얼마나 써버린 것일까 모자란 지금을 위해서  손 틈새로 스쳐지나는 바람 같은 시간들  오랜 열병처럼 앓게 하던 사랑과 무릎 휘청이게 하던 세상과 그 안에 춥게 서있던 나는 어디까지 온걸까  매달리는 것들과 나를 믿어주는 사람들  더 큰 바램같은 것 없이 함께 할 수 있다면  손 내밀면 점점 멀어지는 내일과 늘 조금씩 아쉬웠던 어제와 막연한 오늘의 나는 지금 어디쯤에 있을까 삶이란 바다위에  저만치 나를 기다리는 무지개와 같은 꿈을 찾아서 난 믿을께 지치지 않고 나갈께 사랑하는 사람들과  무엇하나 아직은 내 것이라 말할 수 없고  끝을 알 수 없는 시간은 저 먼 바다처럼 펼쳐져  어떤 날엔 두려울만큼 잔잔하고 어떤 날엔 사납게 출렁이지 삶이란 그런 날들과 온몸으로 부딪치는 것 고단한 이야기  내가 사랑하는 사람들 아무 일 없이 행복하길  눈에 보이지 않는 것의 소중함을 깨닫게 되길  어리석지 않는 두 눈을 갖게되고 항상 따듯한 두 손을 가지길 옮음과 그름 앞에서 흔들림 없는 내가 되길 삶이란 바다 위에 어느날 문득 지도에도 없는 나만의 섬 하나를 찾게 되는 평생을 나와 함께한 하나뿐인 내 사람을 만나게 될 수 있기를 만나게 되기를 내가 사랑하는 사람들 아무 일 없이 행복하길  눈에 보이지 않는 것에 소중함을 깨닫게 되길 어리석지 않은 두 눈을 갖게되고 항상 따듯한 두 손을 가지길 옮음과 그름앞에서 흔들림 없는 내가 되길 삶이란 바다위에
2006.10.30~11.05,48,1213524,LOVE ALL,gavynjprojectgroupH7美人(미인),gavy nj project group [H7美人(미인)],2006.06.09,Ballad,,내 어깨를 떠밀어도 소리쳐봐도 소용없어  어떻게 널 잊어 너라면 잊겠니 어떤 사랑인데  내 욕심이 더 자라면 너를 다치게 할지몰라  날 보내준다던 바보같은 이별의 말 되풀이하던 너   날 웃게 한사람 날 지켜준 한사람  바보야 너란걸 모르니  내가 아파도 내가 기뻐도  내겐 한결같은 너였잖아   날 울게 한사람 날 사랑한 한사람  죽어도 잊지 못할 사람  다음 세상의 인연이 너라면 난  그곳에서 널 기다릴게   결국 끝내고 말것을 우린 미친듯 사랑했어  천번을 물어도 내 전분 너 하나뿐야  내게 고백하던   날 웃게 한사람 날 지켜준 한사람  바보야 너란걸 모르니  내가 아파도 내가 기뻐도  내겐 한결같은 너였잖아   날 울게 한사람 날 사랑한 한사람  죽어도 잊지 못할 사람  다음 세상의 인연이 너라면 난  그곳에서 널 기다릴게   울지말라고 잊고살라고  너만 내곁에 있으면 돼  다시 애원해도 너의 뒷모습만  점점 작아져가는데   행복해야돼 다른 사랑 만나서  모질게 날 떠나간만큼  울며 보채고 잡고 싶지만  어차피 버려질 나였잖아   날 울게 한사람 날 사랑한 한사람  죽어도 잊지 못할 사람  다음 세상의 인연이 너라면 난  그곳에서 널 기다릴게
