time,rank,song_id,title,singers,album,date,genre,creator,lyric
2008.05.18~05.24,58,1813593,창문을 열어놓고,"별,나윤권",창문을 열어놓고 (All Star 2집 Vol.2),2008.02.28,Ballad,안영민,늘 그랬듯 내 차 안에서 너와 얘기를 하다 뭔가 이상했어 평소답지 않게 말이 없어서 그래서 물었어 무슨 일이냐고 그때서야 대답을 했어 이윤 묻지말고 헤어지자고 나는 한참동안 말을 못했어 눈물이 두 뺨 위로 흐를 때까지는 창문을 열어놓고 담배만 계속 태웠어 너무 말이 안되서 다시 한 번 물어봤어 정말 이별이냐고 후회 안할 자신 있겠냐고 그렇게 물었어 그리곤 울고 말았어  니가 줬던 반질 빼고서 미안하다며 반질 돌려줬어 너를 정말 사랑했던건 맞아 그래도 우리 둘은 아닌 것 같았어 창문을 열어놓고 한숨만 계속 쉬었어 이해 안되겠지만 다시 한번 대답했어 정말 이별이라고 후회안할 자신이 있다고 나는 대답했어 그리곤 울고 말았어 차 문을 열고 니가 나갔어 그리고 내가 널 따라 나갔어 너 땜에 많이 울었잖아 가슴 아파했었잖아 나를 붙잡을 자격도 없잖아 너를 사랑했지만 지금은 아니야  바보같은 나 땜에 많이 힘들었지 바쁘다는 이유로 왜 날 외롭게 했었니 서로 사랑하는데 서로를 이해하지 못했어 널 사랑하는데 널 사랑했는데 우리
2008.05.18~05.24,59,1863936,Good-Bye Day (외로움은 안녕!) (Feat. J),하울,바람의 노래를 들어라,2008.05.13,Ballad,하울,귀엽게 잔뜩 부은 눈에 잠에 취해있는 목소리 행복해 날 깨우는 그대 입맞춤 창문을 활짝 열어보니 조금은 차가운 아침이 상쾌해 파란 하늘이 하얀 그 미소처럼 good bye my lonely day 달콤한 꿈처럼 다가와 good bye my lonely day 그대 나와 함께 하루하루 시작하는 우리 사랑 영원히 goodbye 내 외로움은 안녕  파자마 차림으로 나를 배웅해주는 너의 모습 그리고 오늘도 힘내 넌 따뜻한 햇살 같아 good bye my lonely day 달콤한 꿈처럼 다가와 good bye my lonely day 그대 나와 함께 하루하루 시작하는 우리 사랑 영원히 goodbye 내 외로움은 안녕 언제나 그대 바라보고 언제나 그대 품에 안길게 지금 이대로 영원히 내 곁에 함께해줘 good bye my lonely day 그렇게 내게만 웃어줘  하루하루 시작하는 우리 사랑 영원히 goodbye 내 외로움은 안녕 I'll be there for you
2008.05.18~05.24,60,1847631,여우가 (Feat. 은지원),문지은,Vivid,2008.04.10,Dance,,Crazy 꼬리 없는 여우들의 Party 이빨 빠진 늑대는 가 빨리  U make me crazy just move Your body so tight 네 바지 넌 오늘밤 내 차지 left to the right now do that thang girl yeah that's my baby tell me what u want it 남잔 여자를 몰라 꼭 틈만 나면 Lie 다 속는 줄 알아 난 그게 웃겨 난 그걸 즐겨 One Two 하나같이 Down 내 매력이란 마법과 같아 자꾸 날 사랑 해 나는 사랑 안 해 Crazy 줄듯 말듯 애태우는 Play Skill 덫에 걸린 남자들은 Shaking  Crazy 꼬리 없는 여우들의 Party 이빨 빠진 늑대는 가 빨리  줄듯 말듯 해 내 맘을 애타게 해 네 눈 빛이 내 숨을 멎게 그 손길이 나를 미치게 만들어 기다리게 하지마 난 참을성이 모자라 Bottom to the top 다 내 스타일 이잖아 nice and slow 움직여봐 be that C R A Z Y 여잔 남자를 알아 그 순진함이란 참 재미가 많아 난 그게 웃겨 난 그걸 즐겨 One Two 나만 보면 Down 힘이 빠져가 참고 싶지만 자꾸 날 사랑해 나는 사랑 안 해 Crazy 줄듯 말듯 애태우는 Play Skill 덫에 걸린 남자들은 Shaking  Crazy 꼬리 없는 여우들의 Party 이빨 빠진 늑대는 가 빨리  I wanna do it do it to do it Left the right now Do that a thang You make me hot hot Yeah that's my baby You make me crazy  불이 붙은 네 욕심을 난 식힐 수 없어 If you wanna get it boy right now 좀더 노력해봐  Crazy 줄듯 말듯 애태우는 Play Skill 덫에 걸린 남자들은 Shaking  Crazy 꼬리 없는 여우들의 Party 이빨 빠진 늑대는 가 빨리
2008.05.18~05.24,61,1870571,여행을 떠나요,이승기,여행을 떠나요 (1박2일),2008.05.19,Rock,하지영,푸른 언덕에 베낭을 메고 황금빛 태양 축제를 여는 광야를 향해서 계곡을 향해서 먼 동이 트는 이른 아침에 도시에 소음 수 많은 사람 빌딩 숲 속을 벗어 나봐요 메아리 소리가 들려오는 계곡 속에 흐르는 물 찾아 그 곳으로 여행을 떠나요 메아리 소리가 들려오는 계곡 속에 흐르는 물 찾아 그 곳으로 여행을 떠나요 굽이 또 굽이 깊은 산중에 시원한 바람 나를 반기네 하늘을 보며 노래 부르세 메아리 소리가 들려오는 계곡 속에 흐르는 물찾아 그 곳으로 여행을 떠나요 메아리 소리가 들려오는 계곡 속에 흐르는 물찾아 그 곳으로 여행을 떠나요  굽이 또 굽이 깊은 산중에 시원한 바람 나를 반기네 하늘을 보며 노래 부르세 메아리 소리가 들려오는 계곡 속에 흐르는 물 찾아 그 곳으로 여행을 떠나요 메아리 소리가 들려오는 계곡 속에 흐르는 물 찾아 그 곳으로 여행을 떠나요 여행을 떠나요 즐거운 마음으로 모두 함께 떠나요 여행을 떠나요 즐거운 마음으로 모두 함께 떠나요 메아리 소리가 들려오는 계곡 속에 흐르는 물 찾아 그 곳으로 여행을 떠나요 메아리 소리가 들려오는 계곡 속에 흐르는 물 찾아 그 곳으로 여행을 떠나요 메아리 소리가 들려오는 계곡 속에 흐르는 물 찾아 그곳으로 여행을 떠나요
2008.05.18~05.24,62,1797713,다시 시작해보자,김동률,Monologue,2008.01.24,Ballad,김동률,헤어지자 요란할 것도 없었지 짧게 굿바이 7년의 세월을 털고 언제 만나도 보란 듯 씩씩하게 혼자 살면 되잖아 잘됐잖아 둘이라 할 수 없던 일 맘껏 뭐든 나를 위해 살아보자 주기만 했던 사랑에 지쳐서 꽤나 많은 걸 목말라 했으니 그럼에도 가끔은 널 생각하게 됐어 좋은 영화를 보고 멋진 노랠 들을 때 보여주고 싶어서 들려주고 싶어 전화기를 들 뻔도 했어 함께 일땐 당연해서 몰랐던 일 하나 둘씩 나를 번거롭게 했지 걸핏하면 툭 매사에 화를 내고 자꾸 웃을 일이 줄어만 갔지 내 친구들의 위로가 듣기 불편해서 집으로 돌아와 문을 열었을 때 휑한 방안보다도 내 맘이 더 시려 좀 울기도 했어 그럴 때면 여전히 널 생각하게 됐어 매일 다툰다 해도 매번 속을 썩여도 그런 게 참 그리워 좋았던 일보다 나를 울고 웃게 했던 날들 아무래도 나는 너여야 하는가봐 같은 반복이어도 나아질게 없대도 그냥 다시 해보자 한번 그래보자 지루했던 연습은 이제 그만하자 우리 다시 시작해보자
2008.05.18~05.24,63,1851231,아홉번째 구름 (Feat. 양파),MC몽,Show`s Just Begun,2008.04.17,Rap / Hip-hop,"MC몽,메이비(Maybee)",저 하늘에 날 비추는 태양이 하나듯 너 하나만 너 만이 내 전부인 걸 아직도 사랑은 목마른 내 나이 벌써 서른 훨훨 타오르는 내사랑 불을 붙이기 전 기름 아홉번째 구름에 하늘을 떠다니는 기분 24 for 7 If feels like heaven 인생을 혼자 살기엔 철이 없던 삶의 공식 바람 불던 내 인생에 찾아온 당신 니가 있기에 난 더욱 강해져 난 변함없이 사랑해 틀림 없이 지키겠어 난 You're the only one who is in my life you're the only one who can be my wife You're the only one who is in my life you're the only one who can be my wife 자존심 따위는 아 아깝지 않아 그깟 명예도 아 아깝지 않아 모든걸 다 줘도 아 아깝지 않아 우리는 하나 you're the only one 사랑 밖엔 난 몰라 이 사랑 내게 준 너밖에 몰라 저 하늘에 날 비추는 태양이 하나 듯 너 하나만 너 만이 내 전부인 걸 24 for 7 If feels like heaven 365일 그대가 있다면 천국 향기로운 입맞춤에 숨을 쉴 수 없는걸 날아갈 듯 터질듯한 기분 너 역시 같을걸 하늘이 우릴 맺은 destiny 알고 있니 you bring out the best of me 너는 종교야 하나 밖에 없는 천사야 너와 나 숨 쉬는 이 공간 바로 모두 다 천국이야 You're the only one who is in my life you're the only one who can be my wife You're the only one who is in my life you're the only one who can be my wife 그대 가는 길이 힘들어도 같이 걸어줘 때론 지쳐 어두울 때 빛을 밝혀줘 let'get away just for one day 바라볼수록 행복해 아름다운 밤인데 다시는 우리 서로를 아프게 말자 내 마음 가득 사랑해 사랑밖에 난 몰라 네 사랑 내게 준거 밖에 몰라 저 하늘에 날 비추는 태양이 하나듯 너 하나만 너 만이 내 전부인 걸 사랑밖에 난 몰라 네 사랑 내게 준거 밖에 몰라 저 하늘에 날 비추는 태양이 하나듯 너 하나만 너 만이 내 전부인 걸 사랑 밖엔 몰라요 너 아닌 누구도 보이지 않아 어디라도 빛이 없는 어둠 속 이라도 니 두 손이 내 두 눈이 돼 주는 걸  24 for 7 If feels like heaven
2008.05.18~05.24,64,1869828,Only You,KCM,로뎀나무 Vol.1,2008.05.20,Ballad,"김화랑,KCM",설레고 애태우던 그 첫 만남 조금 어색했던 우리 둘 가끔씩 놀라워 난 따스한 이 느낌 투명한 눈망울 보며 온종일 정신 없이 수다 떨 때면 특별한 하나 나만의 니가 너무나 사랑스러워 처음 이라서 서툴러 혼자 말해보던 그 말 들어볼래 널 위해 몰래 아껴둔 한마디 사랑해 널 사랑해 널 사랑해 그 사소한 순간까지 하루 하루 꺼내 봐도 늘 새로운 사랑을 채워줄게 사랑해 널 사랑해 널 사랑해 이 세상이 내게 보내준 선물인 걸 그대라는 한사람 비오는 날에 널 위해 준비한 진한 향이 가득한 커피 일부러 작은 우산도 챙겨 널 꼭 안고 싶은 맘에 그댈 만나러 가는 길 바람이 날 반겨주면 행복한 맘에 큰소리로 세상에 소리쳐 사랑해 널 사랑해 널 사랑해 그 사소한 순간까지 하루 하루 꺼내 봐도 늘 새로운 사랑을 채워줄께 사랑해 널 사랑해 널 사랑해 이 세상이 내게 보내준 선물인 걸 그대라는 한 사람 포근하게 감싸 안아줄게 지난 모든 아픈 기억들 그 만큼 강한 빛나는 사랑 보여줄게 사랑해 널 사랑해 널 사랑해 눈을 감고 들어봐요 나의 진실한 마음은 그댈 향해 설레이며 달려요 약속해 널 지킬께 꼭 지킬께 이 세상이 내게 보내준 선물인걸 사랑할께 영원히 너만을
2008.05.18~05.24,65,1842506,"Love Seat (Feat. 타루, 허밍 어반 스테레오)",휘성(Realslow),스마일 프로젝트 Vol. 2 - Love Seat,2008.04.01,Dance,이지린,나와 있을 땐 음악을 꺼 나와 대화를 해줘 darling handle처럼 요리저리 끌고 가지는 말아요 너와 있을 때 음악은 killing mood 키스 하기 전의 appetizer 아무것도 넌 모르면서 그냥 나를 믿고 follow me trunk안에 맥주 대신 나의 사랑을 담아 서로의 옆자린 서로만이 sit only love seat oh love oh love my love love love oh love oh love my love love love  나와 있을 때 시선 고정 나만 바라 보라구요 driving은 나를 위한 u turn smooth하게 cornering 너와 있을 때 미소는 hidden card 사랑한단 말의 dessert라고 백미러의 시선은 널 지키기 위한 눈빛 u believe me 항상 내 곁에 있어줘요 항상 네 곁에 있을게요 항상 내 품에 잠들어요 항상 네 품에 잠들게요 trunk안에 맥주대신 나의 사랑을 담아 서로의 옆자린 서로만이 sit only love seat oh love oh love my love love love oh love oh love my love love love 너를 원해 너를 원해 너를 원해 너를 원해 다음에 또 만나 다음에 또 봐요 다음에 꼭 만나 꽃다발을 준비할게 다음에 또 만나 다음에 또 봐요 다음에 다음에 다음에 꼭 만나
2008.05.18~05.24,66,1858215,Propose,앤디,Andy The First Propose,2008.04.29,Dance,위종수,놀러와 나에게로 와 언제든 놀러 와 너만 괜찮다면 난 항상 좋아 널 위해 비워둔 내 맘은 언제나 활짝 너를 향해 열려 있어 YO 가슴 벅찬 이 그리움 가슴 설레는 기다림 나에게로 와 everyday every night 너만 생각해 매일 매일 YO 어디 쯤 오고 있을까 어디 쯤 오고 있을까 니가 올까봐 설레는 맘으로 항상 널 마중 나와 있어 Oh 놀러 와 나에게로 와 언제든 놀러 와 너만 괜찮다면 난 항상 좋아 널 위해 비워둔 내 맘은 언제나 활짝 널 향해 열려 있어 놀러 와 나에게로 와 언제든 놀러 와 이른 아침이라도 나는 좋아 단잠을 깨워도 너라면 행복해 항상 니 꿈만 꾸는 나니까  YO 나와 단 둘이 걸을까 나와 단 둘이 걸을까 꿈에서처럼 온 종일 걸어도 너와 함께라면 행복해 Oh 놀러 와 나에게로 와 언제든 놀러 와 너만 괜찮다면 난 항상 좋아 널 위해 비워둔 내 맘은 언제나 너를 향해 열려 있어 화려하진 않아도 언제라도 니가 편히 쉴 수 있는 곳 바로 나야 널 향한 내 사랑이야 놀러 와 나에게로 와 언제든 놀러 와 너만 괜찮다면 난 항상 좋아 널 위해 비워둔 내 맘은 언제나 활짝 널 향해 열려 있어 놀러 와 나에게로 와 언제든 놀러 와 이른 아침이라도 나는 좋아 단잠을 깨워도 너라면 행복해 항상 니 꿈만 꾸는 나니까 언제든 괜찮아 너라면 행복해 항상 내가 꿈꾸는 너니까
2008.05.18~05.24,67,1861176,그대 가까이,김동희,이제서야,2008.05.07,Ballad,,두근거려요 반짝거려요 한동안 멈춰있던 가슴이 다시 열려요 활짝 열려요 한동안 닫혀있던 마음이 누구신 가요 누구신 가요 내 맘 두드리는 한 사람 어쩜 그댈 만나려고 오랫동안 외롭게 혼자였나 봐요 한걸음 다가와 줘요 한걸음 다가갈게요 언제든 어디든 그대 가까이 있고 싶어 그대 마음을 가져도 되나요 나에게 허락해줄 수 있나요 그댈 어느새 사랑하게 됐나봐 내겐 보여요 또 내겐 들려요 그대가 전해주는 마음이 아름다워요 향기로워요 그대와 함께 있는 세상이 사랑인가요 사랑인가요 내 마음을 가져가버린 한 사람 그대만을 주기 위해 오랫동안 아끼고 지켜온걸요 한걸음 다가와 줘요 한걸음 다가갈게요 언제든 어디든 그대 가까이 있고 싶어 그대 마음을 가져도 되나요 나에게 허락해줄 수 있나요 그댈 어느새 내가 사랑하게 됐나봐 왠지 그댈 처음 만난 날부터 내 모든 게 달라졌어요 나조차도 내가 낯 설을 만큼 새롭게 태어난 것만 같아요 그대 곁은 내 자리에요 그 누구도 주면 안돼요 그것만 한 가지 약속해요  가까이 좀 더 가까이 기꺼이 난 다 기꺼이 내 모든 사랑을 그대에게만 주고 싶어 혹시 내 곁을 떠나진 말아요 이별로 나를 울리진 말아요 그대 없이는 살 수 없게 됐나봐 한걸음 다가와 줘요 한걸음 다가갈게요 언제든 어디든 그대 가까이 있고 싶어 그대 마음을 가져도 되나요 나에게 허락해줄 수 있나요 그댈 어느새 내가 사랑하게 됐나봐 내게 와줘서 고마워요
2008.05.18~05.24,68,1817939,사랑과 우정사이,박혜경,여자가 사랑할때,2008.03.03,Ballad,오태호,머리를 쓸어 올리는 너의 모습  시간은 조금씩 우리를 갈라놓는데  어디서 부턴지  무엇 때문인지  작은 너의 손을 잡기도  난 두려워  어차피 헤어짐을 아는 나에겐  우리의 만남이 짧아도  미련은 없네  누구도 널 대신 할 순 없지만  아닌 건 아닌 걸 미련일 뿐  멈추고 싶던 순간들 행복한 기억  그 무엇과도  바꿀 수가 없던 너를  이젠 나의 눈물과 바꿔야 하나  숨겨온 너의 진심을 알게 됐으니  사랑보다 먼 우정보다는 가까운  날 보는 너의 그 마음을  이젠 떠나리  내 자신보다 이 세상 그 누구보다  널 아끼던 내가 미워지네    멈추고 싶던 순간들 행복한 기억  그 무엇과도  바꿀 수가 없던 너를  이젠 나의 눈물과 바꿔야 하나  숨겨온 너의 진심을 알게 됐으니  연인도 아닌 그렇게 친구도 아닌  어색한 사이가 싫어져 나는 떠나리  우연보다도 짧았던 우리의 인연  그 안에서 나는 널 떠나네  사랑보다 먼 우정보다는 가까운  날 보는 너의 그 마음을  이젠 떠나리  내 자신보다 이 세상 그 누구보다  널 아끼던 내가 미워지네
2008.05.18~05.24,69,1874996,나만 바라봐,태양,Hot,2008.05.22,R&B / Soul,TEDDY,하루에도 몇 번씩 널  보며 웃어 난 수백번 말했잖아 You're the love of my life 거짓된 세상 속 불안한  내 맘 속 오직 나 믿는 건 너  하나 뿐이라고 가끔 내 맘 변할까봐  불안해 할 때면 웃으며 말했잖아 그럴  일 없다고 끝 없는 방황 속 텅 빈  내 가슴속 내가 기댈 곳은 너  하나뿐 이지만 가끔씩 흔들리는 내  자신이 미워 yeah 오늘도 난 이 세상에 휩쓸려 살며시 널 지워 내가 바람 펴도 너는 절대 피지마 Baby 나는 너를 잊어도 넌 나를 잊지마 Lady 가끔 내가 연락이 없고  술을 마셔도 혹시 내가 다른 어떤 여자와 잠시 눈을 맞춰도 넌 나만 바라봐 오늘밤도 지새며 날  기다렸다고 눈물로 내게 말해  변한 것 같다고 널 향한 내 맘도  처음과 같다고 수 없이 달래며 지내온  많은 밤들 니가 없이는 난 너무  힘들 것 같지만 때론 너로 인해 숨이 막혀 난 끝없는 다툼 속 기나긴 한숨 속 니가 기댈 곳은 나 하나  뿐 이지만 니가 귀찮아지는 내  자신이 미워 오늘도 난 웃으며 나도 몰래 자신을 잃어 내가 바람 펴도 너는 절대 피지마 Baby 나는 너를 잊어도 넌 나를 잊지마 Lady 가끔 내가 연락이 없고  술을 마셔도 혹시 내가 다른 어떤 여자와 잠시 눈을 맞춰도 넌 나만 바라봐 내가 이기적이란 걸 난  너무 잘 알아 난 매일 무의미한 시간 속에 이렇게 더럽혀지지만 BABY 너만은 언제나 순수하게  남길 바래 이게 내 진심인걸 널 향한  믿음인 걸 죽어도 날 떠나지마 내가 바람 펴도 너는 절대 피지마 yeah 나는 너를 잊어도 넌 나를 잊지마 Lady 가끔 내가 연락이 없고  술을 마셔도 혹시 내가 다른 어떤 여자와 잠시 눈을 맞춰도 넌 나만 바라봐 넌 나만 바라봐
2008.05.18~05.24,70,1860177,Lemon Tree,박혜경,여자가 사랑할때 - Lemon Tree,2008.05.02,Folk,송기원,또 아침이 오는 그 소리에 난 놀란 듯이 바빠져야 하겠죠 또 무언갈 위해서 걸어가고 답답한 버스 창에 기대있죠 더 새로울게 없는 하루겠죠 난 쉬고 싶고 자고 싶고 참 오래된 친구도 보고싶죠 그 흔해 빠지던 남자도 나 오늘따라 안보이는거죠 막 울고싶어지면 밤이 오죠 더 새롭게 더 예쁘게 나의 맘을 상큼하게 할거야 내 꿈에 숨겨온 노란 빛깔 Lemon Tree 나 약속할게 언제나 기분좋은 상쾌함에 웃을래 환하게 반기는 노란 빛깔 Lemon Tree  또 아침이 오면 노래를 해 똑같은 거릴 걸어가도 난 즐거움에 빠져 버리는 그 신비함에 놀라 웃었죠 내 웃음소리 퍼져 향기롭죠 웃어봐요 모두 즐겁게 노래해요 싱그러운 나만의 Lemon Tree 사랑이 많아서 힘든가요 웃고 있는 얼굴이 아픈가요 오 환한 미소 내가 줄게요 더 새롭게 더 예쁘게 나의 맘을 상큼하게 할거야 내 꿈에 숨겨온 노란 빛깔 Lemon Tree 나 약속할게 언제나 기분좋은 상쾌함에 웃을래 환하게 반기는 노란 빛깔 Lemon Tree 오 조금만 더욱더 새롭게 더 예쁘게 온 세상을 상큼하게 할거야 가슴에 가득히 내 꿈에 숨겨온 널 위해 가꿔온 노란 빛깔 Lemon Tree
2008.05.18~05.24,71,1846595,오빠나빠,"Jessica(제시카),티파니(TIFFANY),서현(SEOHYUN)",RoomMate 1st `오빠나빠`,2008.04.07,Ballad,,다 아는데 난 아닌데 그래도 놓치기 싫은데 딱 한번만 내 말을 들어요 오빠 앞에선 여자란말이야 나랑 밥 한번 먹는게 그렇게 힘든가요 잊었다면서 혼자라면서 그 언닌 왜 만나나요 아직 나는 안되나요 많이 부족한가요 한번만 날 믿어봐요 내가 잘 할 수 있는데 왜 자꾸만 웃기만해요 내가 그렇게 애기 같나요 딱 한번만 내 진심 들어요 오빠 앞에선 여자란말이야 나랑 밥 한번 먹는게 그렇게 힘든가요 잊었다면서 혼자라면서 그 언닌 왜 만나나요 아직 나는 안되나요 많이 부족한가요 한번만 날 믿어봐요 내가 잘 할 수 있는데 하루에 만번 생각이 나요 눈물이나도 나 이렇게 참아 그댈 사랑하면 안될 이유라도 있나요 잊었다면서 혼자라면서 그 언닌 왜 만나나요 오빤 정말 나쁜사람 정말 내 맘을 몰라 날 믿어봐요 나도 잘 할 수 있는데
2008.05.18~05.24,72,1871549,태양의 나라,길건,Light Of The World,2008.05.20,Dance,휘성(Realslow),백모금의 데킬라 허나 취해도 아깝지 않아 내가 원한 나라가 지금 눈 앞에 펼쳐졌어 차례대로 켜져간 조명 이라는 저 태양아래 시간들은 멈추고 나는 춤추는 Clubbin' tonight Do it and do it again Oh Baby Do it and do it again 더 거친 Music Oh 부디 더 멋진 남자들을 바래 Do it and do it again Go Shaking Do it and do it again 날카롭게 오른 소름을 더 길게 느끼고만 싶어  천 방울쯤 빠져간 땀에 내 몸이 무겁지 않아 내가 원한 Paradise 지금 충분히 즐거운 걸 조금만 더 밝혀라 남은 조명은 또 다른 태양 뜨거워진 열기는 여름밤처럼 Clubbin' tonight Do it and do it again Oh Baby Do it and do it again 더 거친 Music Oh 부디 더 멋진 남자들을 바래 Do it and do it again Go Shaking Do it and do it again 날카롭게 오른 소름을 더 길게 느끼고만 싶어  몇 시간이 아닌 며칠 밤을 이 순간 속에 더 머무르고 싶은 걸 어둠이 사라진 꿈의 나라 이 곳에서 난 영원히 춤을 추고 싶은 걸 Do it and do it again Oh Baby Do it and do it again 더 거친 Music Oh 부디 더 멋진 남자들을 바래 Do it and do it again Go Shaking Do it and do it again 날카롭게 오른 소름을 더 길게 느끼고만 싶어 Do it and do it again Do it and do it again 더 거친 Oh Music 더 멋진 남자들을 바래 Do it and do it again Go Shaking Do it and do it again 날카롭게 오른 소름을 더 길게 느끼고만 싶어 Do it and do it again Do it and do it again  Do it and do it again Do it and do it again
2008.05.18~05.24,73,1853690,소나기,김장훈,김장훈의 소나기,2008.04.29,Ballad,싸이(PSY),잠시 뿐일꺼야 곧 끝날꺼야 또 해가 뜰꺼야 갑자기 왔다 적시고 간다 소나기 소나기 날이 참 좋았는데 화창했는데 말 없이 내리네 갑자기 왔다 적시고 간다  우산없이 살다가 아주 흠뻑 젖었네 정신없이 살다가 울다가 웃다가 울다가 웃어야지 소나기 내가 눈을 떠야 세상이 있어 눈 감으면 되잖아 잠시꿈을 꾸며 그리고 눈을 뜨면 괜찮아 내가 찾아가야 인생이 있어 또 내일이 있잖아 오늘 하루만 소나기 무지개가 피고 기지개를 피고 다 잊어버리고 갑자기 왔다 적시고 간다  우산없이 살다가 아주 흠뻑 젖었네 정신 없이 살다가 울다가 웃다가 울다가 웃어야지 소나기 내가 눈을 떠야 세상이 있어 눈감으면 되잖아 잠시꿈을 꾸며 그리고 눈을 뜨면 괜찮아 내가 찾아가야 인생이 있어 또 내일이 있잖아 오늘 하루만 소나기  내가 눈을 떠야 세상이 있어 눈감으면 되잖아 잠시꿈을 꾸며 그리고 눈을 뜨면 괜찮아 내가 찾아가야 인생이 있어 또 내일이 있잖아 오늘 하루만 소나기
