time,rank,song_id,title,singers,album,date,genre,creator,lyric
2008.05.18~05.24,43,1756969,Kissing You,소녀시대(GIRLS`GENERATION),소녀시대,2007.11.01,Dance,"LeeOn,권윤정",뚜뚜루 뚜뚜뚜 Kissing you baby 뚜뚜루 뚜뚜뚜 Loving you baby 장난스런 너의 키스에 기분이 좋아 귀엽게 새침한 표정 지어도 어느 샌가 나는 숙녀처럼 내 입술은 사근사근 그대 이름 부르죠 그대와 발을 맞추며 걷고 너의 두 손을 잡고 니 어깨에 기대어 말하고 싶어 고마워 사랑해 행복만 줄게요 Kissing you oh my love 내일은 따스한 햇살 속에 너는 내 옆에 누워 사랑의 노랠 불러주며 웃어줘 달콤한 사랑해 기분 좋은 한마디 뚜뚜루 뚜뚜뚜 Kissing you baby 뚜뚜루 뚜뚜뚜 Loving you baby 눈을 감고 너의 입술에 키스를 하면 내 볼은 핑크빛 물이 들어도 내 마음은 이미 넘어가고 내 가슴엔 두근두근 심장소리 들리죠 그대와 발을 맞추며 걷고 너의 두 손을 잡고 니 어깨에 기대어 말하고 싶어 고마워 사랑해 행복만 줄게요 Kissing you oh my love 내일은 따스한 햇살 속에 너는 내 옆에 누워 사랑의 노랠 불러주며 웃어줘 달콤한 사랑해 기분 좋은 한마디 사랑해 사랑해 너만을 사랑해 하늘만큼 언제나 행복하게 환한 웃음 줄게 너만의 소중한 여자친굴 약속해 너는 내 옆에 있고 나의 두 눈에 있고 너의 품안엔 항상 내가 있을게 그대와 발을 맞추며 걷고 너의 두 손을 잡고 니 어깨에 기대어 말하고 싶어 고마워 사랑해 행복만 줄게요 Kissing you oh my love 내일은 따스한 햇살 속에 너는 내 옆에 누워 사랑의 노랠 불러주며 웃어줘 달콤한 사랑해 기분 좋은 한마디 달콤한 사랑해 기분 좋은 사랑해 한마디
2008.05.18~05.24,44,1793650,후회는 없어 (Feat. 베이지),노블레스,Last Romanticist,2008.01.17,Rap / Hip-hop,유성규,사랑이 떠나가네 그 많은 추억들만 남기고 떠나네 멀어져가네 이제야 사랑을 좀 알것 같은데 이제부터가 사랑의 시작같은데 사랑을 가르쳐준 너란 사람이 이별도 배우라며 멀어져만가네 알잖아 난 니가 아니면 단 하루도 살 수 없는 바보라는걸 사랑이 뭔데 언제나 그 사람곁에 있어 주는 거라면서 남녀 간에도 분명 의리란게 있는 거라면서 이렇게 한마디 말도 없이 떠나는게 니가 말한 사랑인거니 우리 정말 사랑한거니 세상에 사랑이란게 존재하기는 하니 아니 제발 아니라고 말해줘 떠나지 말아줘 사랑했던만큼 니가 미워지겠지 후회는 없어 그래도 우리 사랑하긴 했었잖아 한동안 눈몰로 난 살아가겠지 후회는 없어 그래도 우리 사랑할땐 행복했었잖아 후회는 없어 웃기지마 제발 사랑이 변하는게 아니라 니가 변한거야 사람이 변하는거야 원래 사람은 이기적인 동물이거든 아름답던 추억마저 더럽히지는 말자 앞으로 힘들다며 전화하거나 보내지도 못한 편지 매일 쓰거나 잠 못자거나 혼자만의 기념일을 챙긴다거나 그러지는 말자 그럴일 없다면서 그럴거잖아 후회는 없다면서 후회할거잖아 내가 널 몰라 그럴거잖아 하루도 못가 미안해서 힘들거잖아 왜 너만 생각해 나도 그렇잖아 우린 서로를 너무 잘 알잖아 그래서 우리가 헤어진걸까 이것이 우리의 마지막인걸까 여기까진가 사랑했던만큼 니가 미워지겠지 후회는 없어 그래도 우리 사랑하긴 했었잖아 한동안 눈물로 난 살아가겠지 후회는 없어 그래도 우리 사랑할땐 행복했었잖아 사랑받고 싶었다니까 이렇게 내사랑을 확인하고 싶었다니까 넌 끝까지 나를 이해못해 그렇게 여자를 몰라 그리워지는 만큼만 내 사랑이겠지 후회는 없어 내 그리움엔 끝이없이 왜그랬어 할말이 많았는데 가슴이 아파 할수가 없어 그래도 우리 죽을만큼 사랑했었잖아 죽을만큼 사랑했기에 이토록 죽을만큼 아픈거겠지 하지만 이것만은 기억해줘 너란 사람은 내 모든걸 다줘도 아깝지 않았어 죽을만큼 사랑했기에 이토록 죽을만큼 아픈거겠지 하지만 이것만은 기억해줘 너란 사람은 죽는 날까지 내게 후회로 남았어
2008.05.18~05.24,45,1845031,보고 싶어 (SG 워너비 Ver.),SG워너비,2008 연가 SG 워너비 (Digital Single),2008.04.03,Ballad,안영민,바람같은 사랑은 날 울리고 떠나버리고 슬피우는 가슴도 눈물로 여울져 돌아오네 아름다운 사랑이었죠 내게 무엇보다 소중했던 사람 기나긴 이별 앞에서 눈물로 삽니다 오 내 사랑하는 사람아 제발 내게 돌아와줘요 보고 싶어 보고 싶어 보고 싶어 두 눈이 멀어도 사는 동안 볼수만 있다면 그걸로 행복합니다  나는 외롭지가 않아요 내게 무엇보다 추억이 있으니 기나긴 이별 앞에서 견딜수 있어요 오 내 사랑하는 사람아 나를 위해 행복해줘요 보고 싶어 보고 싶어 보고 싶어 두 눈이 멀어도 사는 동안 볼수만 있다면 그걸로 행복합니다 사랑했어 사랑했어 사랑했어 내 목숨 다 바쳐 행복했던 추억이 서러워 서러워 눈물이 나요 꿈같던 사랑아 안녕
2008.05.18~05.24,46,1804274,나비야,하동균,Another Corner,2008.02.12,Ballad,최갑원,한 밤 널 그리워하다 두 밤 널 기다리다가 세 밤 널 찾아 나서다 그만 눈물이 나서 울었어 우리 헤어진 걸 알아 다신 만날 수가 없는 걸 알아 다만 한 번쯤 네가 보고 싶은데 어떻게 사는지 궁금해 지는데 나비야 나비야 너를 부르던 그 말 날 보며 웃어주던 행복했던 그 날 그리워 그리워 네 얼굴이 그리워 하루만 더 자고 나면 내 눈에 보일까  우리 사랑한 게 맞아 그러다가 그만 끝난 게 맞아 항상 사랑한 기억 떠오를 때면 괜스레 웃다가 결국엔 울잖아 나비야 나비야 너를 부르던 그 말 날 보며 웃어주던 행복했던 그 날 그리워 그리워 네 얼굴이 그리워 하루만 더 자고 나면 내 눈에 내 눈에 보일까 나비야 나비야 너를 부르던 그 말 날 보며 웃어주던 행복했던 그 날 그리워 그리워 네 얼굴이 그리워 하루만 더 자고 나면 내 눈에 보일까
2008.05.18~05.24,47,1698598,거짓말,BIGBANG,Always,2007.08.16,Rap / Hip-hop,G-DRAGON,ye love is pain  to all my brokenhearted people  one's old a flame  scream my name  and i'm so sick of love songs  ye i hate damn love song  memento of ours  거짓말  늦은 밤 비가 내려와  널 데려와  젖은 기억 끝에 뒤척여 나  너 없이 잘 살 수 있다고  다짐 해봐도 어쩔 수 없다고  못하는 술도 마시고  속타는 맘 밤새 채워봐도  싫어 너 없는 하루는 길어 빌어  제발 잊게 해달라고  너 없는 내겐 웃음이 보이지 않아  눈물조차 고이지 않아  더는 살고 싶지 않아  엿같애 열받게  니 생각에 돌아버릴것 같애  보고 싶은데 볼 수가 없대   모두 끝났대   I'll be right there  i'm so sorry but i love you  다 거짓말 이야 몰랐어  이제야 알았어  네가 필요해  i'm so sorry but i love you  날카로운 말  홧김에 나도 모르게  널 떠나보냈지만  i'm so sorry but i love you  다 거짓말  i'm so sorry  but i love you  i'm so sorry but i love you  나를 떠나  천천히 잊어줄래  내가 아파할 수 있게  그댈 위해서 불러왔던  내 모든 걸 다 바친 노래  사람들은 모르겠죠  난 혼자 그 아무도 아무도 몰래  그래 내가 했던 말은 거짓말  홀로 남겨진 외톨이  그 속에 헤매는 내 꼴이   주머니 속에 꼬깃꼬깃  접어둔 이별을 향한 쪽지  넌 어딨나요 널 부르는 습관도  난 달라질래  이젠 다 웃어넘길게  i'm so sorry but i love you  다 거짓말 이야 몰랐어  이제야 알았어  네가 필요해  i'm so sorry but i love you  날카로운 말  홧김에 나도 모르게  널 떠나보냈지만  i'm so sorry but i love you  다 거짓말  i'm so sorry  but i love you  i'm so sorry but i love you  나를 떠나  천천히 잊어줄래  내가 아파할 수 있게  모든게 꿈이길  이것밖에 안되는 나라서  아직도 너를 못 잊어  아니 평생을 가도 죽어서까지도  내가 준 상처 아물었는지  미안해  아무것도 해준게 없는 나라서  i'm so sorry but i love you  다 거짓말 이야 몰랐어  이제야 알았어 네가 필요해  i'm so sorry but i love you  날카로운 말  홧김에 나도 모르게  널 떠나보냈지만  i'm so sorry but i love you  다 거짓말  i'm so sorry  but i love you  i'm so sorry but i love you  나를 떠나  천천히 잊어줄래  내가 아파할 수 있게
2008.05.18~05.24,48,1778667,보고싶은 날엔..,박지헌,단추 (Single),2007.12.12,Ballad,,너를 보고싶은 날엔  멋지게 그대를 놓았죠 이렇게 아무렇지 않게 수백번 지우고 다짐을 해도 애써 남는건 아쉬움뿐 그렇게 그대를 떠나갔죠 정말 난 바보처럼 그대를 몰라 처음봤던 그 모습처럼 가슴이 떨리다가 너를 보고싶은 날엔 눈물나는 날엔 가슴뛰는 날엔 그리운 날엔 너의 전화번호 다시 또 누르게 되면 니가 너무나 그리워 어쩌다 니 소식 듣게되고 혹시나 너도 가끔 그리워할까 너무나 변했어 지금의 우리 추억도 별이되고 너를 보고싶은 날엔 눈물나는 날엔 가슴뛰는 날엔 그리운 날엔 너의 전화번호 다시 또 누르게 되면 니가 너무나 그리워 고마웠단 말에 미안했단 말에 사랑했단 말에 서툴던 맘에 돌아갈 수 없는 시간이 널 부를 때면 정말 너무나 그리워 눈을 떠봐도 보이는게 너 하나 뿐인데 무심코 거울을 보다 우리 처음 만났던 그 시간이 자꾸 스쳐 지나가고 다시 널 볼수있을까 너를 보고싶은 날엔 많이 생각나는 날엔 반쪽같은 날엔 울고싶은 날엔 아프던 날엔 너의 전화번호 다시 또 누르게 되면 니가 너무나 그리워 고마웠단 말에 미안했단 말에 사랑했단 말에 서툴던 맘에 돌아갈 수 없는 시간이 널 부를 때면 정말 너무나 그리워
2008.05.18~05.24,49,1789551,남자 때문에,JOO,어린 여자,2008.01.10,Ballad,,난 길을 잃었어요 몇 번짼지 몰라요 이별 앞에서 휘청거리는 내가 난 매번 이럴 때 마다 새로운 사람을 찾아서 또 다시 기댔죠 하지만 이번엔 싫어요 더 이상 이렇게 살수는 없죠 더 이상은 남자 때문에 울고 웃지 않게 나 두발로 서 있을래 누구에게도 다신 기대지 않고 살아가 볼래 더 이상은 남자 때문에 흔들리지 않게 혼자 사는걸 배울래 누구의 손을 잡지 않고 있어도 밝은 미소로 웃을 수 있게  난 누가 필요했죠 혼자 있질 못했죠 혼자선 아픔을 감당할 수 없었죠 난 사랑을 할 때 마다 영원 할 거라 믿었기에 모든걸 주었죠 하지만 이제는 싫어요 더 이상 이렇게 살 수는 없죠 더 이상은 남자 때문에 울고 웃지 않게 내 두발로 서 있을래 누구에게도 다신 기대지 않고 살아가 볼래 더 이상은 남자 때문에 흔들리지 않게 혼자 사는걸 배울래 누구의 손을 잡지 않고 있어도 밝은 미소로 웃을 수 있게  웃을 수 있게
2008.05.18~05.24,50,1786851,How Gee (하우지),BIGBANG,For The World,2008.01.04,Rap / Hip-hop,"JamesBrown,M.Percali",one for the money  two for the show  we got the party  peolple screamin' out  hey ho hey Yo  let's go  on and on into the breaka dawn  i got a mic and i  just can't leave it alone  i be the t o p aiite  i represent the big bang  big thangs feel me i  bring'em like  down and dirty you heard me  it's straight whoa  people gotta have it they  really won't let go huh  yo i got it full control  indeed i'm ridin' high no  need to lay low  i'm psyked i'm rippin the show  rap tight like kick in the doe  that's right baby zero below  you know the gd got ya  city throwin'em up it's oh so  ficky ficky fresh  i give you nuttin' less  and if you aint known by  now i be the best  ladi dadi we  came to party yes yes  and while ya freakin' ya  shawty let's just  ah big gon raise the roof yall  so you know what to do yall  just keep on rockin'em  ah big gon raise the roof yall  just keep on rockin'em  damn yo'm killin' the flow  got it pack wall to wall  doe to doe that's  quite incredible i know  and everybody in the  place be tipsy amazin' what  this be we blazin' it crispy  ya honey wanna get down  with this i make her bounce  to this every ounce of this i  shit'chu not and it's the  shit'chu not you know  i hits the spot  i wear my sunglasses at night  still 20 20  suckas walkin' around  talkin' all' at balony  damn homie you phony  be on about'cha biz what it is  you aint got nuttin' for me  been an mc since my first sony  rock many and plent they wanna  know mei'm 50 karots you a  cubic zakoni fall back  let my people react  we in the zone yeah  ah big gon raise the roof yall  so you know what to do yall  just keep on rockin'em  ah big gon raise the roof yall  just keep on rockin'em  all yall get'cha hands up  clap now  we gonna shake and tear the  house down  i know you wanna do this  right now  you gotta get up  and move it to the sound  love the way the kick drum  plays now  i feel it in my heart  that's it now  i think i'm gonna  count it off now  fire in the hole it's a  new load'm killin'em slow  make'em learn about the t o p  and how the story go  it's not nice not pretty  ya hear a crack  when i'm full contact i'm  crushin' down many  straight comin' from the back  shootin' henny  people be gettin' wild  just kickin' and rippin'em out  you know it's what it's all  about when you move a crowd  just raise the roof now  ah big gon raise the roof yall  so you know what to do yall  just keep on rockin'em  ah big gon raise the roof yall  just keep on rockin'em  just keep on rockin'em  ah big gon raise the roof yall  so you know what to do yall  just keep on rockin'em  ah big gon raise the roof yall  just keep on rockin'em
2008.05.18~05.24,51,1866732,Kiss Me,애즈원,Double Star,2008.05.14,Dance,와와,kiss me over and over and over 잠들 때까지 꼭 안아줘 kiss me over and over 널사랑해  햇살 눈부시게 나를 비추고 향긋한 바람 불어오면 나도 모르게 그대 생각에 웃어버리고 말았죠 어젯밤에 다툰 이후로 화가 난건 아니죠 투정 부려서 미안 미안해요 이해해줘 사랑하니까 내 생각하며 웃어줘요 kiss me over and over and over 잠들 때까지 꼭 안아줘 kiss me over and over 널사랑해 투정부리던 내 miss 니가 선물한 kiss 점점다가와 조그만 입술이 닿을 때 번져 달콤한 립스틱 그래 다투기도 해 한두번쯤 니가 토라져버리면 안되거든 물거품 되기 전에 유혹 중 다가가서 kiss kiss you  정말 변하기도 많이 변했죠 습관들도 그댈따라해요 친구들 말엔 내가 웃을 때 그댈 많이 닮았대요 무관심에 기분 나빠도 내색하지 않아요 나보다 그댈 먼저 생각해요 알아줘요 사랑하지만 혼자 오래두진 말아요 kiss me over and over and over 잠들 때까지 꼭 안아줘 kiss me over and over 널사랑해 영원히 얼어붙을 것 같이 차가왔던 가슴에 온기를 느껴 그대가 처음 다가왔을 때 그느낌 그대로 설렘을 느껴 i know kiss me now 둘만의 조그만 열쇠니까 i know kiss me right now 변하지 않는 지금이 좋아 kiss me my love kiss me over and over and over 잠들 때까지 꼭 안아줘 kiss me over and over 널사랑해 kiss me over and over and over 잠들 때까지 꼭 안아줘 kiss me over and over 널사랑해
2008.05.18~05.24,52,1867788,Good Bye (Feat. 한경일),서영은,미니앨범,2008.05.15,Ballad,,잘가요 잘가요 다 내 탓이죠  잘가요 잘가요 안녕 내 사랑  그 귓가에 던진 그 말 Good Bye    안돼요 안돼요 가지마세요  아직은 아직은 자신이 없죠  서로의 불안한 믿음과  철 없던 사랑이 이별을 부른거죠  내가 더 잘할게요    당장 내게 닥친 그리움에 오늘을 어쩌죠    내 눈물 한 방울도 참지 못한 내가  그대 하나 믿고 살던 못난 내가  빌고 빌었었는데 이게 마지막 사랑이길  지겹도록 울어야 했던  우리의 인연도 끝인거죠  들려도 들리지 않는 말  내 귓가에 맺혔던 그 말 Good Bye    서로를 한번 꼭 안고서  대답도 못하던 숨도 못 쉴 만큼  눈물삼킨 내 속을 알까요    내 눈물 한 방울도 참지 못한 내가  그대 하나 믿고 살던 못난 내가  빌고 빌었었는데 이게 마지막 사랑이길  지겹도록 울어야 했던  우리의 인연도 끝인거죠  들려도 들리지 않는 말  내 귓가에 맺혔던 그 말 Good Bye    참 좋았는데 사랑했는데  흘려도 흘려도 넘칠 만큼 사랑했는데  모두 백지가 됐죠 우린 거짓말이죠    세차게 내 맘을 뒤흔든 나쁜 사람  그래도 난 그대의 여자이니까  죽을듯한 이별도 그대가 준 선물이니까  지겹도록 아파야 해도  그대가 하라면 해볼게요  들려도 들리지 않는 말  내 귓가에 맺혔던 그 말 Good Bye    Good Bye...
2008.05.18~05.24,53,1837070,흉터,장나라,Dream Of Asia,2008.03.25,Ballad,장나라,쓰린 눈물을 삼키며 웃음을 지어 소리 내어 울 수 조차 없는 밤 가슴에 담아 가슴에 담아내 말없는 눈물로 그린다 누구도 알 수 없도록 숨기고 누구도 들을 수 없게 숨죽여 할퀸 자리에 네가 베어낸 곳에 지울 수 없는 흉터 되어 아파서 아파서 소리 내어 불러도 버려진 메아리만 남아 죽을 만큼 아파서 입술을 깨물어 봐도 이렇게 새어 나오는 슬픔만  차디차게 보는 너의 눈빛이 갈 곳 잃은 날 내쳐 쓰러지게 해 이제는 그만 이제는 그만 날 더 이상은 아프지 않게 덜어낼 수 없는 상처를 안고 떨쳐낼 수 없는 흉이 되어서 할퀸 자리에 네가 베어낸 곳에 곪아버린 내 사랑만이 아파서 아파서 소리 내어 불러도 버려진 메아리만 남아 죽을 만큼 아파서 입술을 깨물어 봐도 이렇게 새어 나오는 슬픔만 벗어낼 수도 없는 나였던 너란 사람 잘라내려 떨구려 몸부림 쳐도 하늘을 가릴 넘치는 눈물이 되어 날 뒤덮으려 해 숨도 쉬지 못하게 아파서 아파서 소리 내어 불러도 버려진 메아리만 남아 죽을 만큼 아파서 입술을 깨물어 봐도 이렇게 새어 나오는 슬픔만 아파서 아파서 소리 내어 불러도 버려진 메아리만 남아 죽을 만큼 아파서 입술을 깨물어 봐도 이렇게 새어 나오는 슬픔만
2008.05.18~05.24,54,1871159,Too Much (With 서인영) (우리결혼했어요 화제곡),크라운제이(CROWNJ),Too Much (Digital Single),2008.05.19,Rap / Hip-hop,크라운제이(CROWNJ),I love you 너 하나만 I need you 널 바라보는 눈빛과 내 말투도 조금씩 그댈 닮아가네요 태양처럼 밝은 내 기분 하늘에서 내려 준 선물 그대가 내 마지막 사랑이야 OH I LUV IT 뗄 수 없는 우린 환상의 듀엣 평생 같은 한 팀 Let's do it 싸울 때 모습 마저도 예뻐 보이나봐 baby 그 순간 마저도 내 가슴이 뛰네 난 또 다른 여자는 필요 없어 네 사랑 하나면 만족 너무 부드러워 우리 사랑의 감촉 너 하나만 있다면 눈을 떠도 항상 난 꿈속 널 사랑해 내 가슴 닳아 없어지도록 가끔 너 땜에 내 하룬 천국과 지옥 내 삶은 네 이름 3자로 아름다운 구속 언제나 내 마음속 언제나 내 머리 속 나 말했잖아 난 네게 완전중독 I love you 너 하나만 I need you 널 바라보는 눈빛과 내 말투도 조금씩 그댈 닮아가네요 태양처럼 밝은 내 기분 하늘에서 내려 준 선물 그대가 내 마지막 사랑이야 OH I LUV IT  come on girl do u like it i like it i like it i luv you i luv you what u gonna do about that 이렇게 행복해도 되는건지 you're my fantasy 날 부르는 네 목소리는 건반에도 없는 멜로디 i'm sorry 널 놔두고 매일 난 혼자 바빠 언제나 네 안에서 돌아다녀 can u feel me 혹시라도 내가 불안해 넌 걱정이 된다면 그런 생각은 하지마 baby 내 사랑은 heavy weight everyday 나 떨어져 있을때도 항상 네 생각만 해 내 손가락에 딱 맞는 반지 네 손이 닿을 땐 i'm going crazy 넌 나의 best friend trust me i trust you 하루 종일 나 하고 싶은 한마디 I love you 너 하나만 I need you 널 바라보는 눈빛과 내 말투도 조금씩 그댈 닮아가네요 태양처럼 밝은 내 기분 하늘에서 내려 준 선물 그대가 내 마지막 사랑이야 OH I LUV IT  I love you 너 하나만 I need you 널 바라보는 눈빛과 내 말투도 조금씩 그댈 닮아가네요 I love you make this love to you kevin I'm so in to you I love you  우리 함께 라면 난 기분이 함께 하루 하루라면 매일이 Baby 24 for 7 all day i'm clean so clean
2008.05.18~05.24,55,1863957,가슴아 미안하다,이지훈,The Classic,2008.05.13,Ballad,하정호,정말이야 이것만은 믿어줘 너를 위해 보여주고 말해왔던 모두 그게 사랑이란 걸 내게 전부였단 걸 알잖아 모두 알고 있잖아 행복해줘 나랑 있을때 보다 부디 행복하게 살아 그래야 내 가슴이 그래야 내 사랑이 조금 덜 아플 테니까 눈물도 삼킬 테니까 가슴아 미안하다 괜찮다 울지마라 이젠 그녈 놓아주자 그만 보내주자 나보다 좋은 사람 나보다 좋은 사람 그녀곁에 있잖아 눈물이 나도 참아  약속해줘 나를 뒤돌아서도 다신 찾지 않겠다고 그래야 내 가슴이 그래야 내 사랑이 견디기 쉬울 테니까 눈물도 삼킬 테니까 가슴아 미안하다 괜찮다 울지마라 이젠 그녈 놓아주자 그만 보내주자 나보다 좋은 사람 나보다 좋은 사람 그녀곁에 있잖아 눈물이 나도 참아 사랑한다 사랑한다 수천번 수만번을 불러보아도 사무치게 울어도 그녀가 듣지 않게 듣지 못할곳에 남은 기억도 버리자 남은 사랑도 버리자 나보다 좋은 사람 나보다 좋은 사람 그녀곁에 있잖아 눈물이 나도 참아 보고싶어도 참아
2008.05.18~05.24,56,1789828,그깟 사랑,"이진성(먼데이키즈),최현준(V.O.S),일락",Friendship,2008.01.15,Ballad,"민명기,미스티",아직 모르겠니 모든게 끝났다고 우리 사랑은 죽었다고 니 눈물도 내 맘 돌릴 순 없을 테니 날 보내줘 부탁이야 기다리면 돌아올지도 모른다고 넌 한걸음도 떼지못해 바보처럼 자꾸 이름만 부르잖아 내 맘도 넌 모르면서 니가 아프잖아 사랑하면 나 할수록 자꾸 커져가는 내 욕심에 오늘 하루라도 눈물은 참아줘 내일이면 잊을테니 제발 가란말야 돌아보지도 말고 가 두 번 다시는 못 볼 사랑 그 추억만 내가 가져갈게 내 사랑아 이젠 안녕 정말 헤어지면 죽을 것만 같아도 나 없인 안될 것 같아도 다른 사랑에 날 잊을 수 있을거야 그리워도 참아야 해 니가 아프잖아 사랑하면 나 할수록 자꾸 커져가는 내 욕심에 오늘 하루라도 눈물은 참아줘 내일이면 잊을 테니 제발 가란말야 돌아보지도 말고 가 두 번 다시는 못 볼 사랑 그 추억만 내가 가져갈게 내 사랑아 이젠 안녕 흔들리는 니 어깨도 이제는 안아 줄 수 없잖아 너를 사랑해도 너를 붙잡고 싶어져도  너를 위한거야 나를 지워버려 너를 울리는 나잖아 그깟 사랑따윈 지워버려 그래 나란 사람 못난 남자라서 이별밖에 줄 게 없어 제발 가란말야 돌아보지도 말고 가 두번 다시는 못 볼 사랑 그 추억만 내가 가져갈게 내 사랑아 이젠 안녕
2008.05.18~05.24,57,1861177,이제서야,김동희,이제서야,2008.05.07,Ballad,,이렇게 그대가 멀쩡히 그대가 떠나가네 멀어지네 작아지네 안녕이라고 말하네 가라하네 가라하네 이제서야 그댈 잡아요 이제서야 내가 그대를 찾아요 이제서야 그대를 불러요 다시 한번 돌이켜봐도 그제서야 나는 울어요 그제서야 나는 그대를 원해요 사랑해요 사랑해요 외쳐보네요  남겨진 미련에 깊어진 사랑에 아파와서 아파와서 못잊어서 자꾸만 왜 이러는지 모르다가 모르다가 이제서야 그댈 잡아요 이제서야 내가 그대를 찾아요 이제서야 그대를 불러요 다시 한번 돌이켜봐도 그제서야 나는 울어요 그제서야 나는 그대를 원해요 사랑해요 사랑해요 외쳐보네요 가지 말라 말하려 해도 가지 말라 말하려 해도 참지 말고 말하려 해도 자꾸만 또 눈물만  어떻게든 잡고 싶어요 어떻게든 내게 돌아와 돌아와 그래야 난 살 수가 있어요 다시 한번 돌이켜봐도 그제서야 나는 울어요 그제서야 나는 그대를 원해요 사랑해요 사랑해요 외쳐보네요
