time,rank,song_id,title,singers,album,date,genre,creator,lyric
2007.03.05~03.11,65,1569356,그깟 사랑,리즈,The Land Of Dream,2007.02.09,Ballad,리즈,내가 아니예요 내가 알던 내가 아니죠 하염없이 울고 또 울고 들리지도 않아요 날 가둬두세요 이대로 뛰쳐가지 않게 한시도 쉴틈없게 해줘요 내 머릿속 널 쏟아내릴 수 있게 그래 너 하나 잊어내면 되는데 너만 비워내면 되는데 그깟 사랑 정말 흔한 사랑 모질게 잊어주고 싶은데 이젠 너 하나 잊어갈만도 한데 이젠 자유로울만 한데 또 그리워 또 다시 그리워 원망하죠  불을 켜둬 줘요 눈 감아도 어둡지 않게 이별도 쉽다며 떠나간 널 혹시라도 다시 그려 낼까봐 차라리 말지 휘청이고 아파와 울다 웃죠 난 아니라고 떠난 사람 사랑해 눈물 흘려 보내요 이젠 너 하나 잊어갈만도 한데 이젠 자유로울만 한데 또 그리워 또 다시 그리워 원망하죠  너만 비워내면 되는데 그깟 사랑 정말 흔한 사랑 모질게 잊어주고 싶은데  이젠 자유로울만 한데 또 그리워 또 다시 그리워 원망하죠  날 원망하죠
2007.03.05~03.11,66,1587358,하나마나송 (TV Ver.),무한도전,무한도전 하나마나송,2007.03.07,Dance,"FrankFarian,FredJay",말하나 말하나마나 편집되는 너는 말을 하나마나 머리 맞나 사람머리 맞나 헬멧 같은 이게 정말 머리 맞나 나이 많아 나이 정말 많아 싫어해도 너는 나이 제일 많아 아나만나 아나운서 만나 비디오도 끊고 아나운서 만나 피나 마나 다리 피나마나 너는 피나 마나 핀것 같지 않아 말 많아 진짜 말 많아 어쨌거나 너는 말이 너무 많아 도전하나 도전 하나마나 도전하든 말든 우린 무한도전 도전하나 도전 하나마나 도전하든 말든 우린 무한도전
2007.03.05~03.11,67,1563630,착한 남자,먼데이키즈(MondayKiz),El Condor Pasa,2007.02.01,Ballad,안영민,잊어도 잊으려 해도 매일 너만 생각나서 미칠 것 같아 사랑 따위에 무너지는 내가 더 미운걸 어쩌면 더 잘된 거라고 가진 것 없는 나보다 좋은사람 만난다면 그걸로 난 행복해야만 해 한번도 사랑한단 말 못해줘서 정말 잘해준 것 하나 없어서 울고 싶어도 소리내지 못하고 참는다 차라리 죽었다고 생각해볼게 세상어디에도 없다고 어떡해도 심장에 박혀버린 넌 살아 숨쉬잖아 미련이 미련이 되어서 너를 놓지 못하는게 난 두려워 평생동안 너를 그리워하며 살까봐 한번도 사랑한단 말 못해줘서 정말 잘해준 것 하나 없어서 울고 싶어도 소리내지 못하고 참는다 차라리 죽었다고 생각해볼게 세상어디에도 없다고 어떻해도 심장에 박혀버린 넌 살아 숨쉬잖아 염치없는 내 사랑이 너를 더 힘들게 한다면 이젠 너를 보내주고 싶어  너 없는 내가 어떻게 살아가니  그래도 너를 위한 남자로 살게 니가 행복할 수 있다면 이제 내겐 사랑따윈 필요없어 너만 웃으면 돼 널 사랑하니까
2007.03.05~03.11,68,1574301,끝이란 말이죠...,레디오,Ready`O 1집,2007.02.22,Rock,"이상준,배화영",가슴에 병이 들었죠 이름도 모르는 잊으려 할수록 더 상처만 덧나죠 숨어서 눈물 닦는게 너무 익숙한 일이 됐죠 사랑하는데 아직 사랑하는데 여전히 손 내밀면 닿을듯한 니 맘에 난 널 놓지 못해 내 남은 미련이 내 남은 사랑이 혼자서 이렇게 널 보내지 말라고 너를 붙잡으라고 들리지도 않는 목소리로 내게 소리쳐 봐도 이젠 끝이란 말이죠 그댈 잊으란 말이죠 어떻게 그렇게 쉽게 사랑이 변해요 내게 눈물이 된 그 말 그댈 버리라는 그 말 너무 가슴 아파서 이젠 숨조차도 쉴 수가 없죠 아무렇지도 않나요 내가 없는 하루 난 너무 힘드네요 남자답지 못하게 어디를 가도 그대가 못 견디게 그리워서 눈 둘 곳없죠 그대가 아니면 빈속에 밤새 홀로 한잔 또 한잔에 결국 또 눈물이 그 많은 기억을 그 많은 사연을 혼자서 어떻게 내게 돌아오라고 들리지도 않는 목소리로 네게 소리쳐 봐도 이젠 끝이란 말이죠 그댈 잊으란 말이죠 어떻게 그렇게 쉽게 사랑이 변해요 내게 눈물이 된 그 말 그댈 버리라는 그 말 너무 가슴 아파서 이젠 숨조차도 쉴 수가 없죠 안녕 짧은 순간 두 글자로 이내 심장이 멎는 말 내 기억과 내 사랑이 돌아 뒤돌아 가지만 기억해줘 니가 오길 기다리는 한 사람 내가 여기 있다는 걸 오 말없이 떠나요 내가 알아 챌 수 없게 내겐 목숨보다 소중했던 사람 정말 헤어진 건가요 다신 못 보는 건가요 이별 그 말이 너무 써 삼키질 못해요 온 세상이 다 알도록 우리 사랑했잖아요 이럴 줄 알았다면 너무 사랑하지 말걸 그랬죠
2007.03.05~03.11,69,1583269,눈물이 마를까요 (Feat. 강태우),린,The Pride Of The Morning,2007.03.08,Ballad,전승우,지금 내 앞에 선 그대가 내가 알던 그 사람이 맞는지 싸늘히 식은 그 표정과 날카로운 그 한마디 한마디 되돌릴 수는 없어 대답할 수 없이 냉정한 그 말들 날 그냥 미워해 줘 견딜 수 없이 가슴이 아파 눈물이 마를까요 나 사는 동안 이토록 아픈 맘도 모두 잊혀질까요 그 많은 기억 목숨같던 사랑도 난 알고 있죠 사실은 영원히 할 수 없는 나란 걸 나의 사랑 오 나의 사랑 그댈 지워버리는 일 모질게 굴어 미안해요 이렇게 밖엔 할 수가 없었죠 너무 사랑한 나의 맘도 모두 거짓인 것처럼 믿도록 너만은 행복하길 난 그만 눈물이 쏟아질 뻔 했죠 못난 날 용서하길 피가 나도록 입술을 깨물며 참았죠 눈물이 마를까요 나 사는 동안 이토록 아픈 맘도 모두 잊혀질까요 그 많은 기억 목숨같던 사랑도 난 알고 있죠 사실은 영원히 할 수 없는 나란 걸 나의 사랑 오 나의 사랑 그댈 지워버리는 일 내 맘이 아직 그댈 찾고 있네요 종일 그대 이름만 부르고 또 불러보는 나 다른 세상 있다면 다른 세상 있다면 그대가 날 알아본다면 날 알아 본다면 그 때는 그댈 놓치지 않을게요 자꾸 난 겁이 나죠 못난 내 가슴 이기지 못할까봐 겨우 덮은 내 사랑 다시 또 넘쳐 그댈 괴롭힐까봐 다 비워내도 버리고 버려도 멈출 수가 없다면 떠날게요 나 떠날게요 그대 없는 세상으로 눈물이 마를까요 나 사는 동안 모두 잊혀질까요 그 많은 기억
2007.03.05~03.11,70,1484802,그녀가 울고있네요,가비엔제이,The Very Surprise,2006.11.02,R&B / Soul,"김세진,ARTSUN",그대 날 떠난뒤에 변한건  아무것도 없어  어제처럼 나 길을 걷고 숨  쉬고 또 얘기하지  하지만 조금 다른 건 많던  웃음이 사라졌어  아무것도 아닌 일인데  자꾸만 난 눈물이 헤퍼져  하루가 가고 일년이 가고  아무렇지 않게 살다가  난 니가 없다는 걸 알게 되는  그 순간이 정말 힘들어져  나 한번만 울어버릴게 맘껏  소리내어 울어볼게  내 안에 눈물 내 슬픔까지도  모두 말라버렸으면 좋겠어  사랑이 끝났다고 모든게 다 끝난 건 아냐  매일처럼 나 밥을 먹고  하루를 또 살아가지  하지만 조금 다른 건 많던  웃음이 사라졌어  아무것도 아닌 일인데  자꾸만 난 눈물이 헤퍼져  하루가 가고 일년이 가고  아무렇지 않게 살다가  난니가 없다는걸 알게되는  그 순간이 정말 힘들어져  나 한번만 울어버릴게  맘껏 소리내어 울어볼게  내 안에 눈물 내 슬픔까지도  모두 말라버렸으면 좋겠어  넌 모두 잊었겠지만 난 다 기억해  나의 사랑아 제발 내 곁을  떠나지 말아줘  내 가슴 속에 멍든 상처가  너 때문이란 걸 알잖아  내 눈가에 흐르는 이 눈물이  바로너라는걸 잘 알잖아  나 한 번만 울어 버릴게  맘껏 소리내어 울어 볼게  내안에 눈물 내 슬픔까지도  모두 말라버렸으면 좋겠어  남은 사랑도 가져가
2007.03.05~03.11,71,1459449,까만안경 (Feat. Day Light),"이루,Daylight",이루 LEVEL II,2006.10.09,Ballad,윤명선,까만 안경을 써요 아주 까만 밤인데 말이죠   앞이 보이지 않아도  괜찮아요 나는 울고 싶을 뿐이죠  한 여자가 떠나요 너무나 사랑했었죠  그래요 내 여자에요 내 가슴 속에서 울고 있는 여자  사랑해요 나도 울고 있어요 오 난 보고 싶어서 만나고 싶어서 차라리 죽고만 싶어요  미안해요 잘해주지 못한 나지만 이별까지도 사랑할거에요 행복한 사람이 되어주세요 제발요  한 여자가 떠나요 너무나 사랑했었죠  그래요 내 여자에요 내 가슴 속에서 울고 있는 여자  사랑해요 나도 울고 있어요 오 난 보고 싶어서 만나고 싶어서 차라리 죽고만 싶어요  미안해요 잘해주지 못한 나지만 이별까지도 사랑할거에요 행복한 사람이 되어주세요  사랑해요 나도 울고 있어요 난 보고 싶어서 만나고 싶어서 차라리 죽고만 싶어요  미안해요 잘해주지 못한 나지만 이별까지도 사랑할거에요 행복한 사람이 되어주세요 제발요
2007.03.05~03.11,72,1574391,Loving Memory,"자우림,드렁큰타이거",Spray Love,2007.02.16,Rock,김윤아,아 그리움에 이 가슴이 저려오네 아 다시 못 올 사랑의 기억이여 아 외로움은 겨울의 비처럼 차네 아 이 가슴은 비에 젖어 우네 한 순간의 잘못된 선택인가 아니면 필연적인 운명의 장난일까 Uh 아픔은 책임 없는 사랑의 탓 혹은 사랑이란 아픔의 빛과 그림자 외로움은 항상 내 맘을 맴돌아 왜 무관심한 세상은 나를 몰라봐 내 바로 앞에 걷고 있는 너도 전혀 눈치 채지 못한 채 나를 지나치지 아니면 모른 척 나를 피해가 달이 뜨는 밤이 되면 불길한 예감 난 무관심한 세상에 낙오된 피해자 uh 낙오된 피해자 사람은 왜 만나게 되고 왜 머물지 못하는가 그대와 나는 서로의 빛나는 상흔이 되었네 사람은 왜 사랑을 하고 왜 사랑을 지우는가 그대는 나의 어두운 그림자 눈부신 신기루 In loving memory 죽어가는 영혼들은 회오리 바람 쳐 Do U remember me 빛 바래진 사진처럼 잊혀질 기억 속에 잊혀지기 싫어 그들은 그리움을 외쳐 누군가 들어주리 간절히 바랬어 Now pay attention read between the sentence 당신들의 관심에 세상이 바뀌거든 당신들의 관심에 세상이 바뀌거든 아 외로움은 겨울의 비처럼 차네 아 희미해진 사랑의 기억이여 아 외로움은 겨울의 비처럼 차네 아 희미해진 사랑의 기억이여 아 외로워라 아 외로워라  한 순간의 잘못된 선택인가 아니면 필연적인 운명의 장난일까 Uh 아픔은 책임 없는 사랑의 탓 혹은 사랑이란 아픔의 빛과 그림자 외로움은 항상 내 맘을 맴돌아 왜 무관심한 세상은 나를 몰라봐 내 바로 앞에 걷고 있는 너도 전혀 눈치 채지 못한 채 나를 지나치지 아니면 모른 척 나를 피해가 달이 뜨는 밤이 되면 불길한 예감 난 무관심한 세상에 낙오된 피해자 무관심한 세상에 낙오된 피해자 한 순간의 선택이 잘못인가 필연적인 운명의 장난일까 장난일까  What is the end so
2007.03.05~03.11,73,1583270,궁금해... (Feat. Eric),린,The Pride Of The Morning,2007.03.08,Ballad,최갑원,Yeah We back together now Just kickin' back in the same studio We 'bout to make it happen so Just kick back and listen 내가 왜 이런지 모르니 다 알면서도 그러니 무슨 말을 해야 아는지 하나 둘 셋 따지듯이 묻지 너의 눈을 보면 느끼지 I know 넌 누굴 사랑 하는지 자신 있게 말해봐 남자답게 용기 내봐 니 맘을 언제까지 숨겨둘거니 떨리니 너무나 흔한 그 말 사랑해란 말하기가 그렇게나 어렵나 한 마디 못 할 만큼 두근거리니 설레니 부끄럽니 정말 니 진심이 너무 궁금해 날 사랑한단 말해봐 Right now 날 아껴준단 말해봐 Right now 모든 사람들이 알 만큼 난 너의 여자라 큰 소리로 외쳐봐 더 늦기 전에 다가와 My love 더 늦기 전에 안아봐 My love 기나긴 시간을 기다린 내 작은 입술에 입맞춤을 건네봐 날 사랑하긴 하는데 왠지 달아날 것 같아 불안해 이런 저런 생각 때문에 늘 망설였던 너의 수줍은 고백 더 생각을 할 시간을 달란 너의 말 이젠 싫어 자꾸 머뭇머뭇 하다가 그러다 날 놓칠 거야 니 맘을 언제까지 숨겨둘거니 떨리니 너무나 흔한 그 말 사랑해란 말하기가 그렇게나 어렵나 한 마디 못 할 만큼 두근거리니 설레니 부끄럽니 정말 니 진심이 너무 궁금해 날 사랑한단 말해봐 Right now 날 아껴준단 말해봐 Right now 모든 사람들이 알 만큼 난 너의 여자라 큰 소리로 외쳐봐 더 늦기 전에 다가와 My love 더 늦기 전에 안아봐 My love 기나긴 시간을 기다린 내 작은 입술에 입맞춤을 건네봐 널 사랑한단 그 흔해빠진말로는 내 맘을 다 표현하긴 부족해 뭔가 빠진듯해 딱 2% 부족해 난 네게 special 하고 싶은데 언젠간 고백할게 on special day 앨범 자켓 속에도 쓸께 on special thanks 가사 속에도 slow jam or dance 가슴속안에 평생 promise that enough said I really love you 언제까지나 Baby I do really love you 내 맘 변하지가 않아 I really love you 너만 항상 사랑할거야 Baby I do really love you 날 사랑한단 말해봐 Right now 날 아껴준단 말해봐 Right now 모든 사람들이 알 만큼 난 너의 여자라 큰 소리로 외쳐봐 더 늦기 전에 다가와 My love 더 늦기 전에 안아봐 My love 기나긴 시간을 기다린 내 작은 입술에 입맞춤을 건낼 때 널 사랑한다 말할게 I do 널 아껴준다 말할게 I do 모든 사람들이 알 만큼 넌 나의 남자라 큰 소리로 외칠게 더 늦기 전에 다가가 My love 더 늦기 전에 안겨 나 My love 기나긴 시간을 기다린 니 떨린 입술에 입맞춤을 해줄게 전화할께 니가 외로울 때 챙길게 니가 아플 때 웃을께 니가 웃을 때 아플 땐 나만 아플께 ok 절대 바람 안필께 니가 싫어하는 술 담배 끊을께 아니 줄일께 that's my girl
2007.03.05~03.11,74,1521181,내 사람입니다,더넛츠(TheNuTs),Whispers Of Love,2006.12.18,Rock,강은경,뵙고 싶었죠 당신이군요   그녀의 마음 흔든 그 사람  못났다 웃어도 좋아요  염치없지만 당신께 이렇게 무릎 꿇어요 내 사랑입니다 목숨 같은 내 여자입니다 부탁해요 부탁해요 그녈 흔들지 마요 내 전부입니다 그녀 없인 난 무너집니다 도와줘요 떠나줘요 그녀가 없어도 당신은 살잖아요 나는 안돼요 가진 게 없죠 그래요 나는 보잘 것 없죠 당신에 비해 하지만 내 안에 눈물은 팔아서라도 그녀를 행복케 해줄 거예요 내 전부입니다 그녀 없이 나 무너집니다 도와줘요 떠나줘요 그녀가 없어도 당신은 살잖아요 나는 안돼요 내 눈을 원하면 그대가 가져요 심장을 원하면 얼마든 가져요 내 숨을 원하면 그것도 가져요 그녀만은 하나만은 나에게서 제발 데려가지 말아요 날 울리지 마요 난 사랑합니다 그녀만을 참 사랑합니다 단 한 사람 단 한 사람 그녀가 있기에 숨 쉬며 살아가는 남자입니다
2007.03.05~03.11,75,1576344,안녕? (Original Ver.),더필름,안녕?,2007.02.22,Ballad,더필름,한참 니 전화번호를 누르다 한참 니 전화번호를 지우다 한참 멍하니 앉아 니가 보낸 편질 보며 웃다가 한참 울다가 자꾸 니 목소리가 생각나 자꾸 니 얼굴이 보고싶어 자꾸 사진을 꺼내 우리 함께한 노래를 부르다 혼자 말로 해 안녕 어떻게 지내 별일 없니 안녕 그냥 생각나 전화했어 안녕 니가 보고싶을 땐 늘 이렇게  알아 다 부질없는 일인걸 알아 이미 다 지난 얘기야 벌써 세월이 흘러 계절은 또 우리 앞을 스치잖아 마냥 가잖아 안녕 어떻게 지내 별일 없니 안녕 그냥 생각나 전화했어 안녕 우리 못 본지도 참 오래됐지  안녕 왜 자꾸 눈물이 나는지 안녕 내가 요새 많이 힘든가봐 니가 보고 싶을 땐 늘 난 이렇게 말해  안녕  안녕 안녕  안녕  안녕 왜 자꾸 눈물이 나는지 안녕 내가 요새 많이 힘든가봐 니가 보고 싶을 땐 늘 난 이렇게 말해 음 니가 보고 싶을 땐 늘 난 이렇게 지내
2007.03.05~03.11,76,1534968,가거라 사랑아,서문탁,Leap Of Truth,2007.01.08,Rock,,내 가슴이 물어봐 그는 어디갔냐고 내 가슴이 내게 화를내 그를 잃은거냐고 난 대답하지 이젠 끝난거라고 철없는 투정 다 소용없다고 이대로 보내주라고 이젠 놓아줄께 가거라 사랑아 너와함께였기에 행복했었단 내것이 아닌 내 사랑아 자꾸 토해내도 맘에 쌓이는 너를 잊기는 아프겠지만 아픈것 만큼 사랑한 걸 테니 참고참아도 흐르는 흐르는 흐르는 눈물 삼킬께 내눈물이 울먹여 멈출수가 없다고 내기억이 내게 애원해 지울수가 없다고 오 난 대답하지 어떻게 잊겠냐고 그저 가슴에 그냥 두라고 사랑을 참아 보라고 이젠 놓아줄께 가거라 사랑아 너와 함께였기에 행복했었단 내것이 아닌 내 사랑아 자꾸 토해내도 맘에 쌓이는 너를 잊긴 아프겠지만 아픈것 만큼 사랑한 걸 테니 참고 참아도 흐르는 흐르는 흐르는 또 하루를 살아가면 하루만큼 널 잊겠지 잊은만큼 아파도 사랑에 베인 상처가 쉽게 아물순 없겠지 사랑한 나를 더 아프게 자 이젠 보내줄께 고맙다 사랑아 못난 나를 만나서 미안했었다 내 사랑아닌 내 사랑아 지금 널 보내면 다신 찾진 안을께 너를 잡진 않을께 너와 만났던 이 멋진 기적을 평생을 꿈꿔 죽어도 죽어도 죽어도 잊진않을께
2007.03.05~03.11,77,1570653,얼룩진 거울,화요비,Somewhere Over The Rainbow Vol.4,2007.02.15,Ballad,정연준(업타운),거울 속에는 그대로 있어요  늘 곁에 있던 그대가  나의 눈 속에 사는 그대가  내 곁에 왔나요  날 감싸고 있군요  다시 거울을 보고  흐트러진 날 정리하는 나  수줍음이 많아  그대 날 볼 때면  어김없이 거울부터 찾던  그런 나였기에  온 걸 알아요  오늘도 거울을 보며  또 그대를 느껴요  늘 곁에 있던 그대라  그댈 보며 추억을 봐요  오랫동안 그대  날 바라보고 있나요  거울에서 잠시도  돌아서기가 싫은걸 보면  그림자처럼 늘  곁에 있어주던 그대이기에  거울 속에서만 살아있어요  곁에 있는 듯  오늘도 나  나의 거울은 얼룩져있네요  내 눈물 때문에 모두  얼룩진 거울뿐이죠  잠시 눈을 감는 것마저  아쉬운 날 버리지 말아요
2007.03.05~03.11,78,1583271,미칠 것 같다,린,The Pride Of The Morning,2007.03.08,Ballad,최갑원,나 혼자 서 있다 이 길에 남았다 너에게 보기 좋게 버려졌다 왜 끝이 났는지 왜 가야 하는지 이유도 모른다 너의 뒷 모습도 너의 발소리도 한 겨울 찬 바람에 살 베 듯이 차갑다 온 몸이 떨리고 눈물이 흘러도 날 두고서 넌 떠난다 정말 미칠 것 같다 정말 니가 야속하다 너란 사람만 믿고 살았지만 비참하게 날 속여버렸다 아무것도 몰라서 사랑밖에 난 몰라서 니 맘대로 날 잠시 갖고 놀다 질렸나 보다 나란 사람은 난 주저 앉았다 그저 울었다 내 눈에 눈물이 내 안에 이별이 내 몸을 누른다 일어나고 만다 견뎌내고 만다 이 까짓 이별 따윈 보란 듯이 이긴다 날 애써 달래고 날 추스려 봐도 난 서 있을 힘이 없다 정말 미칠 것 같다 정말 니가 야속하다 너란 사람만 믿고 살았지만 비참하게 날 속여버렸다 아무것도 몰라서 사랑밖에 난 몰라서 니 맘대로 날 잠시 갖고 놀다 질렸나 보다 나란 사람은 숨이 멎어 버릴 것 같다 나 이러다가 죽을 것 같다 나만 사랑한단 그 말에 내 모든 걸 줬는데 한 마디 말 없이 날 떠나버린 너  정말 미칠 것 같다 정말 니가 야속하다 너란 사람만 믿고 살았지만 비참하게 날 속여버렸다 아무것도 몰라서 사랑밖에 난 몰라서 니 맘대로 날 잠시 갖고 놀다 질렸나 보다 나란 사람은
2007.03.05~03.11,79,1578936,Pop (Feat. Annie K),엔젤,My Name Is Enjel,2007.02.26,Rap / Hip-hop,라이머,무대가 열리고 시선이 모이면 연습은 필요없어 준비는 다 됐어 hey girl 이제 그만 내려와줄래 쇼는 시작됐어 ready go now make it bounce 넌 아무도 봐주질 않지 나에 빛에 너는 시들어가고 날 모두가 원하고있지 이제는 너도 내가 움직여줄께 초점없는 눈동자 빗나간 몸 동작 어설픈 흉내는 pop 터트려 흔들리는 사람들 그속에 아직은 어색한 니 모습 pop pop make it pop 어리숙한 멜로디 뻔한 옷차림 작아지는 니 목소리 긴장한 움직임 i'm a q u e e n make u hot hot 나를 봐 이제 느껴봐 넌 아무도 봐주질 않지 나에 빛에 너는 시들어가고 날 모두가 원하고있지 이제는 너도 내가 움직여줄께 날 비추는 조명과 터지는 함성과 준비된 무대로 pop 터트려 이젠 보여주겠어 증명해 주겠어 날 따라 모두 다 pop pop make it pop Do it girl right now just bounce with me 모든 시선이 내게로 모이지 오늘밤 make it pop come on let it flow let me show you ma moves won't you follow me you are so funny see them laughing at you haha don't you what they are waiting for need to get off from that unfittable dance floor 말해봐 뭘 원하는지 i'm gonna give to you girl 들어봐 뭘 말하는지 you know i'm give to you girl 여길봐 누굴 보는지 i'm gonna give to you girl 선택은 끝났어 초점없는 눈동자 빗나간 몸 동작 어설픈 흉내는 pop 터트려 흔들리는 사람들 그속에 아직은 어색한 니 모습 pop pop make it pop 날 비추는 조명과 터지는 함성과 준비된 무대로 pop 터트려 이젠 보여주겠어 증명해 주겠어 날 따라 모두 다 do it girl let me show you learn how to move your booty shake it to the right shake it to the left uh uh make it pop do it girl let me show you learn how to move your booty shake it to the right shake it to the left uh uh make it pop
2007.03.05~03.11,80,1585329,To The Maximum,맥시멈크루,To The Maximum,2007.03.13,Rap / Hip-hop,,여기서 끝낼 얘기면 시작도 안했어 We take it to the maximum 끝까지 가겠어 올라갈 준비 해 To the maximum 정상까지 Yeah No limit y'all 아마 나를 믿지 않겠지 우리의 시작은 미약했지 아무 준비랄 것도 없이 열정 하나로 밀어붙였지 오 다시 그 때로 돌아간다 해도 나는 이 길을 선택할래 또 누구나 한번은 겪어야만 하는 시련일 테니까 아무리 세상이 변해도 포기못해 나의 꿈 가슴은 맨 처음 그대로 나이는 숫자일 뿐 어차피 난 실패를 믿지 않아 You can't stop me now We keep movin' 꺾이지 않는 끈기가 우리의 무기 여기서 끝낼 얘기면 시작도 안했어 We take it to the maximum 끝까지 가겠어 올라갈 준비 해 To the maximum 정상까지 Yeah No limit y'all  Brand New Kicks 비껴쓴 모자 오늘 아침도 내 꿈을 쫓아 끝없는 넥타이 부대 사일 통과 나를 반기는 연습실로 가 근데 한가지 문제 내가 춤에 목숨 걸은게 같잖은지 나 가는 길마다 무시 경멸 퍼붓네 왜 날 그렇게 보는건데 삶에 각본은 없네 니가 감동 없는 삶을 살아갈 동안 우린 꿈을 이뤄내 어차피 난 실패를 믿지 않아 You can't stop me now We keep movin' 꺾이지 않는 끈기가 우리의 무기 여기서 끝낼 얘기면 시작도 안했어 We take it to the maximum 끝까지 가겠어 올라갈 준비 해 To the maximum 정상까지 Yeah No limit y'all  여기서 끝낼 얘기면 시작도 안했어 We take it to the maximum 끝까지 가겠어 올라갈 준비 해 To the maximum 정상까지 Yeah No limit y'all
2007.03.05~03.11,81,1467722,거리에서,성시경,The Ballads,2006.10.10,Ballad,윤종신,니가 없는 거리에는
