time,rank,song_id,title,singers,album,date,genre,creator,lyric
2005.09.12~09.18,64,904640,경고,KYT(코요태),필업 (Feel Up),2005.08.30,Dance,유유진,"uh- yeh this song is KYT 2005 remake song  yeh like this like that  cuz a party aint a party till  we run through jigga  ky, and the t whut whut! party aint a party  till we run through it what yeah kyt.   정말 니가 몰랐니 우리가 만난다는 걸  너와 그는 이미 다 끝났잖아  왜 또 그를 흔들어 내게서 뺏어가려해  이제서야 그가 필요해졌니   나와 나만의 baby boo 사랑은 for life  너는 막을 수 없어 우리는 bonny &amp; clyde  No. 1,2,3, it goes 하늘 끝까지  너의 단 한번의 기회는 끝나고 말았지    그리쉽게 네가 원하는걸 가지려 했다니 madada now you left with nada  이젠 내게 다가오는건 my lover  Say good bye to my baby,  while we pass you by!    니가 그를 버린걸알아  아주 냉정히 넌 떠났었잖아  너 때문에 헤매던 그를  위로했던건 바로 나야    생각해봐 그의 맘을  네게 상처받은 뒤로  얼마나 힘들었을지  이제서야 너의 그늘을 벗어나  그는 내게 맘을 열게 된거야    너는 이러면 안돼 그에게 다가오지마  그의 사랑 받을 자격 넌 없어  네가 필요할때만 넌 그를 찾아오잖아  이젠 내가 너를 용서 않을래    친구의 친굴 사랑하게 된 나는  슬픈 영화속의 주인공이 될지 몰라서  혼자 나만을 원망한 나  다신 그런 바보같은 생각하지 않을꺼야   Yeah you know who we be  koyote in 2005  prime time to shine  kyt hit me one more time    니가 그를 버린걸알아  아주 냉정히 넌 떠났었잖아  너 때문에 헤매던 그를  위로했던건 바로 나야    이제와서 어떻게 넌  옛날로 돌아가자는 말을  또 쉽게 꺼낼 수 있니  니가 그의 마음에 줬던 상처가  이제 겨우 사라지고 있는데    다시 그를 찾지마  그에게 다가 오지마  이젠 내가 그의 곁에 있으니    그와 나의 사랑을  더 이상 방해하지마  이제 그에게는 내가 필요해    너는 이러면 안돼  그에게 다가오지마  그의 사랑 받을 자격 넌 없어   네가 필요할때만  넌 그를 찾아오잖아  이젠 내가 너를 용서 않을래  (Let's get it to the party time go)    Hit me one more time,  baby one more time uh    Hit me one more time,  baby one more time uh    Hit me one more time,  baby one more time uh  1.2.3 everybody put your hands up    Hit me one more time,  baby one more time uh    Hit me one more time,  baby one more time uh    Hit me one more time,  baby one more time uh  It's kyt to the like a song yeah-"
2005.09.12~09.18,65,902092,어쩌다가 (New Ver.),란(RAN),어쩌다가,2005.08.11,Ballad,"이한민,예인",어쩌다가 널 사랑했나봐  죽을만큼 널 사랑했나봐  난 아직까지 그리운걸보면  아직도 널 사랑하나봐   어쩌다가 우리 이별하나봐  나 없이도 잘 살 널 생각하면  나 아프고 또 아파 눈물만 나  왜 이렇게 니 행복이 싫은지    새로운 사람 만났어도  제발 날 잊고 살지 않길  이런 날 욕해도 어쩔수 없잖아  내맘 나도 몰라    너의 그 행복 이제는  나에게 상처가 되는걸  차라리 다시는 널 볼 수 없도록  두눈 멀게해 슬퍼   하지만 나도 그리 편치 않아  너의 그 슬픈 눈이 서로 힘들게 하잖아  차갑게 돌아선 나를  제발 잊고 살아가 그리 쉽지 않겠지만  (잠깐의 마음속에 남겨진 흔적들로  깊이 패어버린 그대의 상처)  슬픔의 고통 우릴 더 아프게 할 뿐야  제발 이제 날 버려    어쩌다가 살다보면 한 번쯤   미치도록 내가 보고 싶을땐  내 곁에 사람이 너로 보일때  자꾸 행복해서 미안해질때    널 위한 이별이라 해도  언젠간 모두 잊는데도  한번쯤 돌아볼 상처로 남은 널  용서 하게될까   다시 날 찾지 않는데도  너무 행복하진 말아줘  아직 널 못지운 미련한  아픔에 죽을것만같아    I can love you forever  Never come to me again  너를 너무 미워한 너를 너무 사랑한    새로운 사람 만났어도  (제발 만나지 않길바래)  제발 날 잊고 살진 않길  (나를 잊지마 부탁이야)  이런 날 욕해도 어쩔수 없잖아  내맘 나도 몰라 (나도 몰랐어)    너의 그 행복 이제는 (너의 행복을)  나에게 상처가 되는걸 (들어주지 못함이야)  차라리 다시는 널 볼수없도록  두눈 멀게해 슬퍼 -
2005.09.12~09.18,66,864910,행운,KCM,Growing Up,2005.06.21,Ballad,나인,참 오래 걸렸어 다른 사람과  마주앉아 웃을 수 있기까지  그래 그래서 나 잊은거라 생각했었어  다 지나간 일인거라고   아니었나봐 심장이 멎어버렸어  반가운 웃음을 얼마나 연습했는데   그날처럼 눈물부터 흘러내렸어  짧은 순간 사랑했던 그때로 나 되돌아갈래  단한번도 간적 없나봐  아마도 난 널 만나려고 살았나봐   참 힘이 들었어 너란 사람과  아무 상관없는 나 되기까지  언제 어디서 널 마주치게 될 순간에도  웃으며 인사할거라고   왜 몰랐을까 아픔도 너였겠지만  웃음을 찾아준 사람도 너였다는 걸   그날처럼 눈물부터 흘러내렸어  짧은 순간 널 사랑했던  그때로 나 되돌아갈래  단 한번도 간적 없나봐  아마도 난 널 만나려고   고마워요 그동안 날 살게 해줘서  너의 사랑 너의 기억 지금도 날 숨쉬게해  나 간직할께 짧은 내 삶에  아름다운 너를 남겨준 저 하늘에 -
2005.09.12~09.18,67,928697,일년이면,휘성(Realslow),LOVE.. LOVE..? LOVE..!,2005.09.21,R&B / Soul,휘성(Realslow),시간이 자꾸 빨리 흘러서  애꿎은 시계 마저 부수고  사랑한 날을 거꾸로 세며  아직 그대만 기다리죠    우리 함께 있던 날이 많아요  걷던 길이 너무 많아요  그 시간들을 더듬어 보며  기억을 살려내죠    일년이면 입 맞추던 기억을 잊고  더 지나면 목소리도 까맣게 잊고  나만 혼자 파란 봄과 하얀 겨울  속에 추억들과 살아도    십년이면 나도 지쳐 그대를 잊고  더 지나면 다시 사랑 못할 것 같아  단 하루도 못 가게 잡고  헤어진 그 날에 살죠    시간이 자꾸 빨리 흘러서  얇아진 달력마저 가리고  못해준 생일까지 챙기려  그대 사진에 선물하죠    내가 못한 일이 너무 많아요  주지 못한 것도 많아요  다 해준다던 내 거짓말도  두 번 다시 못 하지만    일년이면 입 맞추던 기억을 잊고  더 지나면 목소리도 까맣게 잊고  나만 혼자 파란 봄과 하얀  겨울 속에 추억들과 살아도    십년이면 나도 지쳐 그대를 잊고  더 지나면 다시 사랑 못할 것 같아  단 하루도 못가게 잡고  헤어진 그 날에 살죠    그대가 돌아올 날  늘 오늘 일지도 몰라  언제나 서둘러 눈 뜨고서  그대가 떠나간 그날에 입던  옷을 다시 꺼내 입고  그대 마중을 나가는 나    일년이면 입맞추던 기억을 잊고  더 지나면 목소리도 까맣게 잊고  나만 혼자 파란 (그대가)  봄과 하얀 (없는 난)  겨울 속에 추억들과 살아도  (겨울을 혼자 보내도)    십년이면 나도 지쳐 그대를 잊고  더 지나면 다시 사랑 못할 것 같아  (난 못할 것 같아)  꿈에라도 그대를 안고 (그대를 안고서)  남겨진 사랑하다가    일년동안 입맞추던 기억을 잊고  어떻게든 목소리도 힘들게 잊어  내가 다시 파란 봄과 하얀 겨울 속을  행복하게 살도록 (겨울이 행복하도록)    그댈 보낸 길마저도 밟지 않아요  그대 닮은 사람마저 미워해봐요  또 들려오는 그대 소식에  내 귀를 막아보다가  그대라도 행복하기를 빌죠 -
2005.09.12~09.18,68,925420,베르사이유의 장미,네미시스,베르사이유의 장미 (La Rose De Versailles),2005.09.15,Rock,,잠들지 말아요 아직은 안돼요 난 여기 있으니 눈을 뜨고 날 봐요 받기만 했어요 처음부터 항상 갈 곳을 잃어버린 나로 인해 물든 사랑  잠들지 말아요 아직은 안돼요 난 여기 있으니 눈을 뜨고 날 봐요 받기만 했어요 처음부터 항상 갈 곳을 잃어버린 나로 인해 물든 사랑  이젠 그대에게로  언제나 함께 할게요 이 몸은 당신의 그림자 그대와 함께 했던 이 곳도 이제는 세느강 저편으로 사람들이 원하는 건 사랑보다 더 큰 변화 다른 세상 그 때엔 그대만 사랑할게 난  미안해 말아요 당신이 필요한 이곳에 남아서 조금만 더 견뎌요 그대와 함께한 행복했던 시간 그 기억만으로도 괜찮아요 잠시면 돼 그댈 기다릴게요  사람들이 원하는 건 사랑보다 더 큰 변화 다른 세상 그 때엔 그대만 사랑할게 난  잠들지 말아요 아직은 안돼요 난 여기 있으니 눈을 뜨고 날 봐요 받기만 했어요 처음부터 항상 갈 곳을 잃어버린 나로 인해 물든 사랑  이젠 그대에게로 -
2005.09.12~09.18,69,889549,바본가봐,아이비,My Sweet And Free Day,2005.07.19,Ballad,강은경,그 남자 참 좋은 사람 같았어 따뜻한 말투도 나를 위한 배려도 못된 너보다 냉정한 너보다 그래 어쩌면 그 사람곁이 차라리 나에겐 나을지 몰라 혹시라도 굳은 표정 들킬까 일부러 크게 웃어도 봤지만 약속있단 거짓말로 일어선건 가려도 삼켜도 자꾸 새 나오려던 내 눈물 때문에 바본가봐 정말 난 바본가봐 떠난 사람 잊지 못하고 왜 아직도 기다리고 있는지 미쳤나봐 눈물이 미쳤나봐 니가 보고 싶다고 너 아니면 안된다고 나 자꾸만 흘러  잔인하게 나를 버린 너인데 새로운 사랑 난 해도 되는데 나의 심장 한 조각쯤 떼어낸 듯 이렇게 아프게 너를 그리워하며 왜 앓고 있는지 바본가봐 정말 난 바본가봐 떠난 사람 잊지 못하고 왜 아직도 기다리고 있는지 미쳤나봐 눈물이 미쳤나봐 니가 보고 싶다고 너 아니면 안된다고 나 자꾸만 흘러 너는 벌써 다 잊었니 어떻게 나를 지운거니 가르쳐줘 아무것도 난 몰라  니가 그랬잖아 언젠가 말했잖아 나의 가슴속이 바로 니 집이라고 늘 내 안에 산다고 그랬잖아 내게 약속했잖아 다시 돌아와야해 언제라도 나의 가슴 속 너의 집으로
2005.09.12~09.18,70,863192,Hi Ya Ya 여름날,동방신기(TVXQ!),2005 Summer: Hi Ya Ya (여름날) (Single),2005.06.20,Dance,배화영,"Beautiful ocean bright Just You and  I In your eyes I can feel heavenly paradise.  don't be afraid of what you feel Inside  That's OK You don't have to cry yourself.    I'll give you word Only one love You know  no one can make one happy as the way you do.  Baby that's the true love(my love) As always  I'm here Baby This is our world    눈부신 태양아래  그대와 단둘이서 (둘이서)  작은 배낭을 메고  함께 길을 떠나요 (떠나요)    달리는 창 밖으로  펼쳐진 푸른 바다 (내 곁에)  내 곁엔 어느새 잠든  천사를 닮은 너    Dancing in summer paradise  사랑해 hi ya ya ya-  여름날 우리 추억을 평생 간직해  표현이 서툴고 어색할지 몰라도  ""널 사랑해"" forever come with me-    하얀 백사장 위로  걸어오는 너 (오는 너)  너무나 눈부신 모습  바라 볼 수가 없어(그대와)    시원한 바람 맞으며  단둘이 거닐 땐 (See my smile)  가쁘게 뛰는 내 마음  들릴까 걱정돼 (till the end of time)    Dancing in summer paradise  사랑해 hi ya ya ya-  여름날 우리 추억을 평생 간직해  표현이 서툴고 어색할지 몰라도  ""널 사랑해"" forever come with me-    십년이 지나도 이 모습 이대로  변함없이 그대 항상 내 곁에  있었음 정말 좋겠어 (till the end of time)    Always be happy together  사랑해 hi ya ya ya-  끝없이 펼쳐진채 우릴 축복해    Dancing in summer paradise  너를 사랑해 hi ya ya ya-  여름날 우리 추억을 평생 간직해  표현이 서툴고 어색할지 몰라도  ""널 사랑해"" forever come with me-"
2005.09.12~09.18,71,905584,오늘은 헤어지는 날,거미,For The Bloom,2005.09.01,R&B / Soul,최갑원,눈 감아도 잠이 오지 않았어 자꾸만 뒤척거린 어젯밤 네 생각이 마치 자장가 같아 쉽게 잠들던 나였는데 왜 널 만나러 가기 싫은지 왜 걷는 것도 힘이 드는지 늘 나보다 더 늦던 네가 먼저 나와서  나를 기다리는 너를 보니 알 것 같아 오늘은 헤어지는 날이었나 봐 아무 표정 없는 얼굴로 꺼낸 끝내고 싶단 그 말도  조심스레 너만 조금씩 준비해 왔었나 봐 많이 눈치 느린 나라서 헤어질 줄 몰라서 혼자만 사랑했나 봐 눈을 떠도 너를 쳐다보지 못했어 이별이 선물이 되는 오늘 밤 그 선물이 받기 싫다고 해도 떨린 내 손에 꼭 쥐어주는 너  왜 널 만나러 가기 싫었는지 왜 걷는 것도 힘이 들었는지 늘 나보다 더 늦던 네가 먼저 나와서  나를 기다리는 너를 보니 알 것 같아 오늘은 헤어지는 날이었나 봐 아무 표정 없는 얼굴로 꺼낸 끝내고 싶단 그 말도  조심스레 너만 조금씩 준비해 왔었나 봐 많이 눈치 느린 나라서 헤어질 줄 몰라서  혼자만 사랑했나 봐 I don't wanna be away.  Don't you never go away. Don't you make me cry.  Don't you make me cry.  I don't want you out my way. 내가 언제부터 싫어졌는지 내가 쓸모 없는지  (말을 해줘) 정말 궁금한게 너무나 많은데 제발 돌아오라는 말도 내가 잘못이 많다는 말도  하지 못한 내가 서러워 소리 내어 울어도 정말 끝이라는 그 말에 너무 놀란 귓가에 들리는 차가운 그 말 오늘은 헤어지는 날
2005.09.12~09.18,72,916287,바보 (Unforgettable),동방신기(TVXQ!),Rising Sun,2005.09.12,Ballad,권윤정,거짓말 모두 거짓말이죠  시간이 그댈 잊게 한단 말 이별의 아픈 마음은 조금 무뎌졌지만  그댈 향한 나의 맘 여전히 그대로인데    쉬울 거란 생각 안 했지만  많은 시간이 흘렀어도 니가 없는 건 낯설기만 해    아직 사랑하는데 아직 널 원하는데 그대 없이 난 괜찮아 질 수 없는걸  미련하게 보여도 이게 나인걸  나조차 몰랐죠 그대만 그리워 하죠   거짓말 그건 거짓말이죠  이제는 그댈 잊고 산단 말  내 모습 초라할까 봐 알량한 자존심에  그저 해본 말일뿐 그대를 잊은 적 없죠   맘에 안든 버릇 떠올리며 잊어보려고 애를 써도  그 모습마저 그리워지는..    아직 사랑하는데 아직 널 원하는데 그대 없이 난 괜찮아 질 수 없는걸  미련하게 보여도 이게 나인걸  나조차 몰랐죠 그대만 그리워하죠   난 멈춘 적 없죠 그댈 사랑하는 맘  한번도 변한 적 없었죠 (변한적 없었죠) 아뇨 점점 커져만 가는 사랑만큼  내 맘도(내 맘도) 단지 함께했던  그 시간만 가만히 멈춰버린걸 oh-    작은 내 품 안에서 힘들었을 그대를 보낸 뒤에야 헤아려 볼 수 있는걸  But I love you everyday  늘 그랬듯이 여전히 그대만 (처음처럼)  기다리고 있는 내게  See you once again my love -
2005.09.12~09.18,73,905859,이름,엠투엠(MToM),M to M,2005.09.03,Ballad,박경진,꼭 잊을께 하나 남지않게  널 처음 본 그날 기억하지  떠나달라며 흘린 니 눈물에  난 괜찮은척 자신있는척  웃으며 약속 했는데    아무리 세월이 흐르고 흘러도  지워지지 않는 이름  이젠 눈물로 내 가슴에  남은 너를 씻어보려고    오늘도 밤새워 울고 또 울어도  더 커져만 가는 이름  내 눈에 내 두볼에 작은 내 손에  자꾸 번져만 가는 이름    다 잊으면 그 땐 행복할까  널 처음 본 그 날 기억만큼  그저 인사로 받은 네 이름만  모르게 되면 낯설게 되면  네 모든게 잊혀질까    아무리 세월이 흐르고 흘러도  지워지지 않는 이름  이젠 눈물로 내 가슴에  남은 너를 씻어보려고    오늘도 밤새워 울고 또 울어도  더 커져만 가는 이름  내 눈에 내 두볼에 작은 내 손에  자꾸 번지는 네 이름만-    눈을 감으면 그저 숨을 쉬지 않으면- 그토록 소리쳐 부르고 불러도  나 가질수 없는 이름  이젠 차라리 나를 지워  너를 모두 잊을수 있게    이렇게 힘들게 원하고 원해도  나 닿을수 없는 이름  저 하늘 위에서는 떠난 널 만나  다시 사랑을 할수만 있게-
2005.09.12~09.18,74,898404,광 (Club Mix),SG워너비,The Voices - 광,2005.07.27,Dance,,이렇게 또 하루를 버텨냈어 널 기억 꼭 끌어안고 나보다 나은 사람을 만났어도 기다려줄게 내 눈은 이렇게 나빠졌는데 왜 너만은 알아보는지 세상이 날 버린다해도  너 하나만 돌려줘 너를 다시는 못볼것 같아서 너 없인 안될것 같아서 한번만 너 아닌 날 위해  살아봐도 괜찮겠니 아파도 널 훔쳐보겠어  내 눈에 널 숨기고 절대 울지 않아 널 흘리지 않아 내 눈에 사는 너니까  너를 다시는 못볼것 같아서 너 없인 안될것 같아서 한번만 너 아닌 날 위해  살아봐도 괜찮겠니 아파도 널 훔쳐보겠어  내 눈에 널 숨기고 절대 울지 않아 널 흘리지 않아 내 눈에 사는 너니까 못 견디게 그리워  도저히 안되겠어 못 이기는 척해  한번만 내게 져주면 돼 눈물을 다 쏟아버려도 추억을 다 쓰고 버려도 눈물이 나는 건 너 없는  날 잘 알기 때문에 세상에 소리쳐 말할께  이렇게 널 사랑해 다신 놓치 않아 널 보내지 않아 그게 날 살게 할 테니
2005.09.12~09.18,75,930037,너의 결혼식에서 Part 2 (Feat. 데니안),홍경민,Emotion In Memory,2005.09.30,Ballad,데니안,환한 표정과 밝은 미소지으며  자리를 가득 메운 너의 사람들  엄마 손을 꼭 잡은 채 그저  멍하니 물끄러미 바라다 보는 아이들    너의 친구들과 너의 가족들  너를 아끼고 사랑하는 모든 사람들  그리고 말없이 그늘 뒤로 숨죽인채  아무도 모르고 있는 내 존재    어느새 끊임없는 박수와 찬사속에  천천히 걸어들어오는 네 모습에  너무나 사랑스런 신부의 모습이구나  역시나 내가 상상했던 모습이구나    그 모습에 나도 모르게  내 입가에 살짝 미소가 흘러 내려  숨죽여 아무리 혼자 참으려고  애써봐도 소용없어 눈물이 흘러내려    이제 나도 널 잊어야  할때가 된것같아  아무리 노력해봐도  지울수는 없을것 같았는데    언제까지나 기다리겠다는  나의 슬픈바램이  지금 너의 모습에  조금씩 무너져 간다   평생 네 옆에 있는  한 사람만을 사랑하며  함께 살겠냐는 주례 선생님의 말씀  수줍게 대답하는 어여쁜 너의 모습에  예전의 우리 언약식이 떠오르네    그날의 함께 했던 희미한 추억속에  영원히 함께 하자했던 약속이  이 세상에서 가장 행복한 남자였는데  그런데 이젠 아무런 소용이 없는데   이제 새로운 인생의 문을 향해  조금씩 걸어 나가네  우리만의 기억 때문에  내게 받은 아픈 추억 때문에  혹시 지금도 아파하는지 참아내   다신 내 모습은 생각조차 않겠다던  기억에서 조차 지워버린다던  그 날의 네 모습이 떠올라  그 날들이 떠올라    오늘처럼 행복해 하는  네 모습 처음봤어  설명해 주지 않아도  좋은 사람 만났다는거 알아   내가 못해준 사랑까지  모두 받을수 있길 바래  지난 아픈 시간들  모두 지워질수 있도록    오늘 찍은 다정한 기념사진에서 조차  아마도 내 모습을 찾아볼 수 없겠지  이제 서로가 어떻게 살아가는지  소식 조차 들을 수 없겠지   멀리 사라져가는 너의 뒷모습을 보며  이젠 다른 남자 아내가 된 너를 보며  텅 빈 예식장에 혼자 남아 기도해  행복하라고 부디 행복하라고-
2005.09.12~09.18,76,926201,혜화동,SG워너비,Classic Odyssey: Remake,2005.09.09,R&B / Soul,김창기,오늘은 잊고 지내던  친구에게서 전화가 왔네  내일이면 멀리 떠나간다고    어릴적 함께 뛰놀던  골목길에서 만나자하네  내일이면 아주 멀리 간다고    덜컹거리는 전철을 타고  찾아가는 그 길  우린 얼마나 많은 것을  잊고 살아가는지    어릴적 넓게만 보이던  좁은 골목길에  다정한 옛 친구  나를 반겨 달려 오는데    어릴적 함께 꿈꾸던  부푼 세상을 만나자 하네  내일이면 멀리 떠나 간다고    언젠가 돌아오는 날  활짝 웃으며 만나자 하네  내일이면 아주 멀리 간다고    덜컹거리는 전철을 타고  찾아가는 그 길  우린 얼마나 많은 것을  잊고 살아 가는지    어릴적 넓게만 보이던  좁은 골목길에  다정한 옛 친구  나를 반겨 달려오는데    우린 얼마나 많은 것을  잊고 살아가는지 -
2005.09.12~09.18,77,902650,사랑해요,이소은,Think Of Me (Repackage),2005.08.24,Ballad,이소은,고마워요 닿을듯 그대 옆에 있기에 더는 내일이 나 두렵지 않죠  사랑땜에 힘든 건 이별땜에 아픈건  영화 속에만 있었으면해    언제나 난 믿었죠 내 반쪽 그대라고  너무나 익숙해서 늘 불안했었던 나를  너무나 행복해서 많이 울었던 나를  말없이 안아주었죠 이제는 안아줘    보여요 그대맘 바라보기만 해도  사랑해 사랑해요 말로는 다 못할 만큼  알아요 그대 맘 아무 말도 안 해도  사랑해 사랑해요 눈물을 잊을만큼 사랑해요   빗물조차 예뻐요 혼자가 아니기에  더는 어두움도 난 무섭지 않죠  스쳐가는 연인은 가슴시린 얘기는  소설 속에만 있었으면 해   언제나 날 믿었죠 내 반쪽 그대라고  너무나 익숙해서 늘 불안했었던 나를  너무나 행복해서 많이 울었던 나를  말없이 안아주었죠 이제는(이제는) 안아줘   보여요 그대맘 바라보기만 해도  사랑해 사랑해요 말로는 다 못할 만큼  알아요 그대 맘 아무 말도 안 해도  사랑해 사랑해요 눈물을 잊을만큼  사랑해요..   보여요 그대 맘 바라보기만 해도  사랑해 사랑해요 말로는 다 못할 만큼  알아요 그대 맘 아무 말도 안해도  사랑해 사랑해요 눈물을 잊을만큼  사랑해요..   보여요 그대 맘 바라보기만 해도  사랑해 사랑해요 말로는 다 못할 만큼  알아요 그대 맘 아무 말도 안 해도  사랑해 사랑해요 눈물을 잊을만큼  사랑해요 -
2005.09.12~09.18,78,926204,단발머리,SG워너비,Classic Odyssey: Remake,2005.09.09,R&B / Soul,박건호,그 언젠가 나를 위해 꽃다발을 전해주던 그 소녀  오늘따라 왜 이렇게 그 소녀가 보고 싶을까  비에 젖은 풀잎처럼 단발머리 곱게 빗은 그 소녀  반짝이는 눈망울이 내 마음에 되 살아나네   내 마음 외로워 질때면 그날을 생각하고  그날이 그리워질때면 꿈길을 헤메는데  우~ 못잊을 그리움 남기고  그 소녀 데려간 세월이 미워라   그 언젠가 나를 위해 꽃다발을 전해주던 그 소녀  오늘따라 왜 이렇게 그 소녀가 보고 싶을까  비에 젖은 풀잎처럼 단발머리 곱게 빗은 그 소녀  반짝이는 눈망울이 내 마음에 되 살아나네   내 마음 외로워 질때면 그날을 생각하고  그날이 그리워질때면 꿈길을 헤메는데  우~ 못잊을 그리움 남기고  그 소녀 데려간 세월이 미워라   그 언젠가 나를 위해 꽃다발을 전해주던 그 소녀  오늘따라 왜 이렇게 그 소녀가 보고 싶을까  비에 젖은 풀잎처럼 단발머리 곱게 빗은 그 소녀  반짝이는 눈망울이 내 마음에 되 살아나네
