time,rank,song_id,title,singers,album,date,genre,creator,lyric
2005.06.20~06.26,1,837567,사랑했나봐,윤도현,Difference,2005.04.29,Rock,전해성,이별은 만남보다 참 쉬운 건가봐  차갑기만 한 사람  내 맘 다 가져간걸 왜 알지 못하나  보고싶은 그 사람   사랑했나봐 잊을 수 없나봐  자꾸 생각나 견딜수가 없어  후회하나봐 널 기다리나봐  또 나도 몰래 가슴 설레어와  저기 널 닮은 뒷 모습에   기억은 계절따라 흩어져 가겠지  차갑기만 한 사람  빈 가슴 애태우며 난 기다리겠지  어설픈 내 사랑은   사랑했나봐 잊을수 없나봐  자꾸 생각나 견딜 수 가 없어  후회 하나봐 널 기다리나봐  또 나도 몰래 가슴 설레어와  저기 널 닮은 뒷 모습에   기억은 계절따라 흩어져 가겠지  차갑기만 한 사람  빈 가슴 애태우며 난 기다리겠지  어설픈 내 사랑은   못되게 눈 돌리며 외면한  니 모습 모른 척 할래  한번쯤은 날 뒤돌아 보며  아파했다 믿을래   바보인가봐 한마디 못하는  잘 지내냐는 그 쉬운 인사도  행복한가봐 여전한 미소는  자꾸만 날 작아지게 만들어  멀어지는 니 모습처럼   언젠가 다른사람 만나게 되겠지  널 닮은 미소짓는  하지만 그 사람은 니가 아니라서  왠지 슬플 것 같아  잊을 수 없는 사람 -
2005.06.20~06.26,2,732519,가시,버즈,Buzz Effect,2005.03.03,Rock,임선아,너없는 지금도 눈부신 하늘과 눈부시게 웃는 사람들 나의 헤어짐을 모르는 세상은 슬프도록 그대로인데 시간마저 데려가지 못하게 나만은 널 보내지 못했나봐 가시처럼 깊게 박힌 기억은 아파도 아픈 줄 모르고 그대 기억이 지난 사랑이 내 안을 파고드는 가시가 되어 제발 가라고 아주 가라고 애써도 나를 괴롭히는데 아픈 만큼 너를 잊게 된다면 차라리 앓고 나면 그만인데 가시처럼 깊게 박힌 기억은 아파도 아픈 줄 모르고 그대 기억이 지난 사랑이 내 안을 파고드는 가시가 되어 제발 가라고 아주 가라고 애써도 나를 괴롭히는데 너무 사랑했던 나를 그게 두려웠던 나를 미치도록 너를 그리워했던 날 이제는 놓아줘 보이지 않아 내안에 숨어 잊으려하면 할 수록 더 아파와 제발 가라고 아주 가라고 애써도 나를 괴롭히는데
2005.06.20~06.26,3,845580,천하무적 (Feat. 박장근 Of Supersta),MC몽,His Story,2005.05.13,Rap / Hip-hop,MC몽,Yo! Listen Up This is MC MONG 2nd Round  Fresh Back on this track grap a microphone mack let`s get ready to rumble   슈퍼맨이 되겠다던 꼬마아이는  참 힘든 일도 많았지만 홀로 싸워온 오늘 밤도 그 아인 세상과 ON &amp; ON 연기든 랩이든 MC든 이제 천! 하! 무! 적!  꼭꼭 숨어라 니 머리카락 보일라  내 어릴적 놀았던 순수했던 놀이다 왜소한 몸집에 작디 작은 아이는  가슴속에 백원짜리 꿈을 가진 아이다 지구를 지켜라 배트맨 슈퍼맨 내 어릴적 꿈은 마쵸맨  난 생각하는 것 마다 마다 유치해  그래도 이 자리에 서있게 만든 이유다  연필을 씹어먹던 코흘리개 아이는  이제는 마이크를 잡고 내가 랩을 해  내 꿈이 언제까지 이어 질지 몰라도  적들과 부딪치면 나는 항상 웃을래  슈퍼맨이 되겠다던 꼬마아이는  참 힘든 일도 많았지만 홀로 싸워온 오늘 밤도 그 아인 세상과 ON &amp; ON 연기든 랩이든 MC든 이제 천! 하! 무! 적!  모두다 비켜 눈물을 감춰  앞길을 밝혀 자신을 지켜  세상이 널 버려 널 자꾸 속여도 천하무적  아이고 아침이야 벌러덩 일어나  밤새도록 마신 술에 내 뱃속은 우울해 똑같은 하루에 내 몸을 던지네  밤이나 낮이나 일하는 내가 한심해 꽃들이 만발하는 화사한 봄날에  내 스스로 내 자신을 자꾸 구속해 이리치고 저리치여 머리는 아픈데  왜 이렇게 나의 길은 꾸불꾸불해 어릴적 그린 그림은 이게 아닌데  순수했던 꿈은 나는 잠시 잊었네 잠시 잊은 꿈은 나는 다시 찾기위해  고통쯤은 참아내고 세상에서 이겨내  슈퍼맨이 되겠다던 꼬마아이는  참 힘든 일도 많았지만 홀로 싸워온 오늘 밤도 그 아인 세상과 ON &amp; ON 연기든 랩이든 MC든 이제 천! 하! 무! 적!  모두다 비켜 눈물을 감춰  앞길을 밝혀 자신을 지켜  세상이 널 버려 널 자꾸 속여도  천! 하! 무! 적!  Let`s Get It On Let`s Get It Warm Let`s Get It On Let`s Get It Warm  Let`s Get It On Let`s Get It Warm   넌 땡전 한푼 없어 이젠 자꾸 숨이 막혀 다시 돌아가고 싶어 우린 천! 하! 무! 적!  넌 땡전 한푼 없어 이젠 자꾸 숨이 막혀 다시 돌아가고 싶어 우린 천! 하! 무! 적!   슈퍼맨이 되겠다던 꼬마아이는  참 힘든 일도 많았지만 홀로 싸워온 오늘 밤도 그 아인 세상과 ON &amp; ON 연기든 랩이든 MC든 이제 천! 하! 무! 적!  모두다 비켜 눈물을 감춰  앞길을 밝혀 자신을 지켜  세상이 널 버려 널 자꾸 속여도 천하무적  슈퍼맨이 되겠다던 꼬마아이는  참 힘든 일도 많았지만 홀로 싸워온 오늘 밤도 그 아인 세상과 ON &amp; ON 연기든 랩이든 MC든 이제 천! 하! 무! 적!  모두다 비켜 눈물을 감춰  앞길을 밝혀 자신을 지켜  세상이 널 버려 널 자꾸 속여도 천하무적
2005.06.20~06.26,4,847132,체념 後(후),빅마마,It`s Unique,2005.05.18,R&B / Soul,이영현,이젠 너없는 익숙함으로  모든걸다 너없는 처음그자리로  지울수 없었던 마지막 내 한마디도  이젠 조금씩 잊혀져가고 있어   아주 오래된 친구인 것처럼  마주쳐도 애써 웃어보였지만  뒤돌아서면 난 왠지 모를 아픔에  그언젠가부턴가 기도했었어   아직아니라고 아직아니라고  다잊었다고 생각했던 내가 바보라고  다른사람이라 생각하고싶어서  못본척 그냥 지나쳐도  나를 이해해줘 라고 말야   아주 오래된 친구인 것처럼  웃으면서 너와 얘기할때마다  숨길수 없었던 이기적인 나의 욕심에  그언제부턴가 기도했었어   아직아니라고 아직아니라고  다잊었다고 생각했던 내가 바보라고  다른사람이라 생각하고 싶어서  못본 척그냥 지나쳐도  나를 이해해줘 라고 말야   안타까운 마음에 내게 잘해주지는 마  또다른 기대들로 널 힘들게 할지몰라  돌이킬수 없다면 니맘이 정그렇다면  이대로 영원히 너를 묻어둘께   약속할께 난 널 잊을꺼라고  내모든걸 건다해도 너를 지운다고  이거하나만 부디 이해해줄래  너란 사람 있었단것만  나 기억하게 허락해줘 -
2005.06.20~06.26,5,842022,같은 생각,신혜성,오월지련,2005.05.06,Ballad,"박창현,신혜성",눈을 떠 보니 어딘가 어색해 진건 그냥 나만의 예감이 아닌가봐 늘 그랬듯이 늘 같았던 우리 생각은 헤어질때도 이렇게 같은가봐 아니길 바래 이번만은 아니길 바래 우리 생각이 같지 않기를 바래 늘 그랬듯이 내 곁에서 웃어주겠니 이젠 그럴 수 없다는 걸 알지만 아니라면 내 사랑이 아니면 그냥 아무것도 모른채 살겠지만 이렇게 마음이 아픈건 어쩔수 없는 너를 향한 내 마지막 선물 눈을 떠보니 잠에서 깨어났나봐 얼마나 오래 꿈꾸고 있었는지 하늘을 보니 내 눈가에 눈물이 고여 다시 눈감고 싶지만 그럴 수 없어 아니라면 내 사랑이 아니면 그냥 아무것도 모른채 살겠지만 이렇게 마음이 아픈건 어쩔수 없는 너를 향한 내 마지막 선물 늘 같은 생각과 같은 꿈을 꾸기를 그렇게도 깊게 원했었지만 이게 우리 마지막 같은 생각이란걸 다신 같을 수 없는 생각인걸 눈을 뜨면 내 사랑이 맞다면 그냥 아무 일도 없던 걸로 되기를 이렇게 마음이 아픈건 어쩔수 없는 너를 향한 내 마지막 선물 내 마지막 그대
2005.06.20~06.26,6,847126,여자,빅마마,It`s Unique,2005.05.18,R&B / Soul,최갑원,내겐 힘이 들었어 다시 살아가는 일  아프고 슬픈 이별에 데이고 다쳐서 우-  너무 하고 싶었어 다시 사랑하는 일  여리고 지친 내맘을 기댈 자리를 찾는  여자 이니까 -  나를 사랑한다면 아무것도 바라지 않아  손을 대면 차가운 내 가슴 안아주면되  깊게 새긴 이별도 바보 처럼 벌써 잊은 거냐고  그런 말은 내게 묻지 말아줘   잊어내고 싶었어 버림받은 상처는  사랑을 도려내버린 텅빈 마음을  이젠 메워 보려고   나를 사랑한다면 아무것도 바라지 않아  손을 대면 차가운 내가슴 안아주면되  깊게 새긴 이별도 바보처럼 벌써 잊은거냐고  그런 말은 내게 묻지 말아줘  삼켜버린 눈물이 혹시라도  입에 가득고여 새버릴까봐   나를 사랑해도 되냐고  묻고 또 물어도 대답은 못하지만  나를 사랑한다면 아무것도 바라지 않아  손을 대면 차가운 내 가슴 안아주면되  깊게 새긴 이별도 바보처럼 벌써 잊은 거냐고  그런말은 내게 묻지말아줘   이제 나는 괜찮아 누구라도 나는 괜찮아  버릇처럼 흘리는 내눈물 가려주면되  쉽게 사랑한다고 그러다가 나만 다칠꺼라고  그런말은 내게 하지말아줘 -
2005.06.20~06.26,7,845586,I Love U Oh Thank U (Feat. 김태우 Of God),MC몽,His Story,2005.05.13,Rap / Hip-hop,"이상백,MC몽",I love U oh thank U 언제나 내 맘속엔 나는 니가 있어  나는 느낄 수 있어  니가 어디에 있던 나는 갈수 있어  그래야 이 힘든 삶을 살수 있어   I love U oh thank U 난 사랑을 몰랐어  못났어 욕심과 자만을 멈출줄 몰랐어  잘났어 항상 제멋에 나는 살았어  시작과 끝을 알수 없는 길을 걸었어   그래 결코 넌 내게 쉽지 않은 사람이야 우린 저 높은 태양처럼 식지 않는 사랑이야  수많은 별들도 우릴 축복해주는 밤이야  이제야 내가 너로 인해 변할수 있는 기회야   너로 인해 난 사랑을 알고 사랑을 믿고 너로 인해 난 믿음을 알고 꿈을 꾸고  I love U oh thank U 고마워 사랑을 배웠어  I love U oh thank U   너보다 좋은건 이 세상에 없는걸 너의 사랑 그보다 큰 선물은 없어  늘 곁에 있어준 그 하나로 충분해  I want U so I love U so thank U   때론 내 이기심에 너를 가둬둘지도 몰라 힘든 날이 많아 니가 많이 울지도 몰라  내가 못나 부족하고 모잘라  니가 견디기 힘들지도 몰라 날 떠날지 몰라   하지만 날 놓치면 결국 후회할지도 몰라  감히 어떤 누구도 우리 사이는 못 갈라  우리 같은 인연은 다시 태어나도 못 만나  너만을 지켜주며 숨 쉬게 할 수 있는 나  그래 결코 넌 내게 쉽지 않은 사람이야 우린 저 높은 태양처럼 식지 않는 사랑이야  수많은 별들도 우릴 축복해주는 밤이야  이제야 내가 너로 인해 변할수 있는 기회야   오늘도 눈을 감아 니 얼굴을 상상하고 내일도 눈을 감아 우리 미래를 그려보고  I love U oh thank U 고마워 사랑을 배웠어  I love U oh thank U 고마워   너보다 좋은건 이 세상에 없는걸 너의 사랑 그보다 큰 선물은 없어  늘 곁에 있어준 그 하나로 충분해  I want U so I love U so thank U   검은 머리 파 뿌리 될 때까지 널 사랑할께 세상이 반쪽이 되도 끝까지 널 지켜줄께  슬플때는 기대 나는 어깨가 되어줄께  아플때면 기대 나는 너의 약이 되어줄께   고마워 날 웃게해준 너의 미소가  고마워 날 일깨워준 너의 충고가  고마워 미래를 만들어준 믿음과  I love U oh thank U 고마워 고마워   너에게 약속해 변하지 않는 나를 누구보다 너에게 잘할수 있는 날  부족해 보여도 항상 웃어주는 너  I want U so I love U so thank U   그래 결코 넌 내게 쉽지 않은 사람이야  우린 저 높은 태양처럼 식지 않는 사랑이야  수많은 별들도 우릴 축복해주는 밤이야  이제야 내가 너로 인해 변할수 있는 기회야   결코 넌 내게 쉽지 않은 사람이야 우린 저 높은 태양처럼 식지 않는 사랑이야  수많은 별들도 우릴 축복해주는 밤이야  I love U oh thank U 고마워 고마워   I want U I love U thank U  my baby my lady  my lovely yeah -
2005.06.20~06.26,8,711628,광 (狂),SG워너비,살다가,2005.02.28,Ballad,안영민,이렇게 또 하루를 버텨냈어  너의 기억 꼭 끌어안고  나보다 나은 사람을 만났어도  기다려줄게   내 눈은 이렇게 나빠졌는데  왜 너만은 알아 보는지  세상이 날 버린다해도 너 하나만 돌려줘   너를 다시는 못볼것 같아서  너 없인 안될것 같아서  한번만 너 아닌 날 위해 살아봐도 괜찮겠니   아파도 널 훔쳐보겠어 내 눈에 널 숨기고  절대 울지 않아 널 흘리지 않아  내 눈에 사는 너니까   잘 안돼 널 잊으려 해보는 일  나완 어울리지 않나봐  그리움을 잘라내는게 담배보다 힘들어   너를 다시는 못볼것 같아서  너 없인 안될것 같아서  한번만 너 아닌 날 위해 살아봐도 괜찮겠니   아파도 널 훔쳐보겠어 내 눈에 널 숨기고  절대 울지 않아 널 흘리지 않아  내 눈에 사는 너니까   못 견디게 그리워 도저히 안되겠어  못 이기는 척해 한번만 내게 져주면 돼   눈물을 다 쏟아 버려도  추억을 다 쓰고 버려도  눈물을 나는 건 너 없는 나를 잘 알기 때문에  세상에 소리쳐 말할께 이렇게 널 사랑해  다신 놓지 않아 널 보내지 않아  그게 날 살게 할 테니-
2005.06.20~06.26,9,851423,흩어진 나날들,박효신,Neo Classicism,2005.06.03,R&B / Soul,강수지,아무일 없이 흔들리듯  거리를 서성이지 우연히 널 만날 수 있을까 견딜 수가 없는 날 붙들고  울고 싶어  어두운 마음에 불을 켠 듯한  이름 하나 이젠 무너져 버린거야  힘겨운 나날들 그래 이제 우리는 스치고  지나가는 사람들처럼 그렇게 모른 채  살아가야지 아무런 상관없는 그런  사람들에겐 이별이란 없을 테니까  어두운 마음에 불을 켠  듯한 이름 하나 이젠 무너져 버린거야  힘겨운 나날들  그래 이제 우리는 스치고  지나가는 사람들처럼 그렇게 모른 채  살아가야지 아무런 상관없는 그런  사람들에겐 이별이란 없을 테니까  그래 이제 우리는 스치고  지나가는 사람들처럼 그렇게 모른 채  살아가야지 아무런 상관없는 그런  사람들에겐 이별이란 없을 테니까
2005.06.20~06.26,10,672010,꽃피는 봄이오면,BMK,Soul Food,2005.01.13,Ballad,조은희,꽃피는 봄이오면  니가 떠난 그 후로 내 눈물은 얼 수 없나봐 얼어붙고 싶어도 다시 흐른 눈물 때문에 널 잃은 내 슬픔에 세상이 얼어도 날이 선 미움이 날 할퀴어도 뿌리 깊은 사랑을 이젠 떼어낼 수 없나봐 처음부터 넌 내 몸과 한 몸이었던 것처럼 그 어떤 사랑조차 꿈도 못꾸고 이내 널 그리고 또 원하고 난 니 이름만 부르짖는데 다시 돌아올까 네가 내 곁으로 올까 믿을 수가 없는데 믿어주면 우린 너무 사랑한 지난 날처럼 사랑하게 될까 그 때의 맘과 똑같을까 계절처럼 돌고 돌아 다시 꽃 피는 봄이 오면 기다리는 이에겐 사랑말곤 할게 없나봐 그 얼마나 고단한지 가늠도 못했었던 나 왜 못 보내느냐고 오 왜 우냐고 자꾸 날 꾸짖고 날 탓하고 또 그래도 난 너를 못잊어 다시 돌아올까 네가 내 곁으로 올까 믿을 수가 없는데 믿어주면 우린 너무 사랑한 지난 날처럼 사랑하게 될까 그 때의 맘과 똑같을까 계절처럼 돌고 돌아 다시 꽃 피는 봄이 오면 참 모질었던 삶이였지만 늘 황폐했던 맘이지만 그래도 너 있어 눈부셨어 널 이렇게도 그리워 견딜 수가 없는 건 나 그 때의 나 그 날의 내 모습이 그리워 시간에게 속아 다른 누굴 허락하고 다른 누군가에게 기대 서로 묻고 산다고 해도 날 기억해줘 한 순간이지만 우리가 사랑했다는 걸 너와 나눈 사랑은 참 삶보다 짧지만 내 추억 속에 사는 사랑은 영원할테니까 꼭 찰나같아 찬란했던 그 봄날은
2005.06.20~06.26,11,711627,죄와벌,SG워너비,살다가,2005.02.28,Ballad,남민설,떠날까봐 널 가뒀으니  내게만 보여줬던 네 모습은  혼자 숨겨두고 싶었어    달콤한 독이 되어 퍼져버린  너에 대한 내 미련들이  가녀린 내 사랑을 헤쳐갔어  내게서 널 뺏어간거야    이젠 보낼게 널 놓아줄게  내가 없는게 더 행복한 너라면  못난 내 사랑도 못된 미련도  난 혼자 남아 지워갈게    차츰 넌 향기없는 꽃이 되어  원망하듯 시들어갔어   미안해 내 사랑이 서툴러서  너를 다치게 했었나봐    이젠 보낼게 널 놓아줄게  내가 없는 게 더 행복한 너라면  못난 내 사랑도 못된 미련도  난 혼자 남아 지워갈게    행복해도 돼 꼭 그래야 해  그것만 믿고 널 보내는 나니까  마지막 인사로 이 말만 해줘  조금은 사랑했었다고 uh    아픈 가슴을 지녀 그리워져도  널 찾지는 않을 거야 uh    마지막 인사로 이 말만 해줘  조금은 사랑했었다고    이젠 보낼게 널 놓아줄게  내가 없는게 더 행복한 너라면  못난 내 사랑도 못된 미련도  난 혼자 남아 지워갈게    행복해도 돼 꼭 그래야 해  그것만 믿고 널 보내는 나니까  마지막 인사로 이 말만 해줘  조금은 사랑했었다고    나 혼자 남아 지워갈게 -
2005.06.20~06.26,12,843729,그녀에게,유엔,그녀에게,2005.05.09,Ballad,원태연,뛰어가는 그녀에게 말 한마디 꼭 한마디 할 말을 못했어요 울지마라 말해 놓고 목이 메여 숨이 막혀 할 말을 못했어요 어쩌죠 뛰지마요 걸어가줘요 당신의 뒷모습이 난 좋아 잘 가세요 잘 살아줘요 열심히 행복해줘요 후회하고 또 후회하겠지만 당신을 보내드릴게 떠나가는 그녀에게 사랑한다 말 못하고 눈물만 흘렸어요 울지마라 말해놓고 목이 메어 숨이 막혀 눈물을 흘렸어요 어쩌죠  잘했어요 잘 한거에요 당신 참 잘하셨어요 착한 사람 날 위해 울어주는 이 세상 오직 한 사람 사랑하는 그녀와 난 사랑한단 말 못하고 눈물만 닦아줬죠 우린 서로 마주 보며 사랑한단 말 못하고 눈물만 닦아줬죠 어쩌죠  그녀가 돌아봐요 울면서 돌아봐요 울면서 돌아보는 그녀를 보내려고 돌아보는 그녀에게 오른손을 흔들면서 안녕을 말했어요 울고있는 그녀에게 안녕이라 말하면서 나도 울었어요 사랑하는 그녀에게 사랑한단 말 못하고 나는 울었어요 우린 서로 사랑하며 서로를 보냈어요  이러면 안되는데 어쩌죠
2005.06.20~06.26,13,845591,홈런 (Feat. 옥주현),MC몽,His Story,2005.05.13,Rap / Hip-hop,MC몽,"이젠 울지마 항상 그대만을 바라볼께  따뜻한 손길로 감싸줄께 두 눈을 감고  make a for from me I still promise you  좀 더 멋지게 매우 폼나게  널 위해 그라운드를 달릴께  아직은 후보 타자 홈 조차  밟지 못한 새내기 골 보이  세상이 날 버렸어 원망하며  나 홀로 울 때 힘들 때  내 옆에 너의 따뜻한 손길을 난 기억해  아무것도 가진 건 없어도  I'm the boo or maybe in the boo  널 만나는 순간이 지루함의  흘러가는 연속이라도  나를 보고 바보라고 사람들이 놀려대  우리 만남을 무시해  괜찮아 난 너만 있으면 돼  운동을 못해도 니 사랑을 가진것이  내 인생의 홈런이야  얼굴은 못 생기고 가진 건 없어도  니가 있단 자체가 홈런이야  운동을 못해도 니 사랑을 가진것이 내 인생의 홈런이야  얼굴은 못생기고 가진 건 없어도  니가 있단 자체가 홈런이야  이젠 울지마 항상 그대만을 바라볼께  따뜻한 손길로 감싸줄께 두 눈을 감고  make a for from me I still promise you  넌 나의 영원한 파트너  늘 주머니 속에 넣고 싶은 너  나로 인해 울 때가 더 많은 너  나 같은 놈 만나기엔 아까운 너  Got to know You got to know that  너 없인 하루도 살 수 없다는 걸  알아야 돼 Come to my day  넌 내게 살아있는 또 하나의 미래 그녀에게 몸을 던져  내 사랑은 스트라이크  너에게만큼은 당당한 터프가이  That's Right 너로 인해 아름다운  Feel Alright (Let's go tonight)  작은 마음을 모아 두 손을 감아  우리 아직 사랑에 목 말라 갈 길이 많아  너를 사랑하는 마음은 하나  이젠 울지마 항상 그대만을 바라볼께  따뜻한 손길로 감싸줄께 두 눈을 감고  make a for from me I still promise you  눈 딱 감고 날 믿어 볼래?  Oh,I promise you 내 사랑 Baby  눈 딱 감고 날 믿어 볼래?  You are the only one baby  눈 딱 감고 날 믿어 볼래?  널 위해 만든 내 사랑의 노래  눈 딱 감고 날 믿어 볼래?  Making me a crazy  눈 딱 감고 날 믿어 볼래?  Oh,I promise you 내 사랑 Baby  눈 딱 감고 날 믿어 볼래?  You are the only one baby  눈 딱 감고 날 믿어 볼래?  널 위해 만든 내 사랑의 노래  눈 딱 감고 날 믿어 볼래?  눈 딱 감고 날 믿어 볼래?"
2005.06.20~06.26,14,860577,보통여자,린,One And Only Feeling,2005.06.16,R&B / Soul,린,잊은 거니 정말 다 잊은거니  난 모든게 그대론데  아직도 널 찾아 헤매이는데  어디에 있는거니 대답해줘  한번만 더 나를 꼭 안아줘  너만 사랑해 눈이 멀어버려 볼 수 없는데  이제는 끝나버린 이야기로  덮어두긴 너무도 아파 이러는가봐  너를 못 잊고 찾고 있나봐  지운거니 정말 다 지운거니  우린 아직 못해본게  너무 많아 견딜 수 없는데  그 많은 약속들은 어떡하니  한번만 더 내게 기회를 줘  우리 사랑을 어떻게 버리니  난 안되는데 내게는 널 추억할 사진 한 장  없다는게 너무도 아파 이러는가봐  너를 못 잊고 찾고 있나봐  그래 어쩔 수 없는가봐 나도 보통 여자 인가봐  이별에 담담할 수 있을거라 살아왔는데  아닌가봐 너를 눈물로 붙잡고 싶어  되돌려줘 내 사랑을 너 없이는 살 수가 없는데  어떡하라고 난 어떡하라고  내게 이러니 이제는 끝나버린 이야기로  덮어두긴 너무도 아파 이러는가봐  너를 못잊고 찾고 있나봐
2005.06.20~06.26,15,732512,겁쟁이,버즈,Buzz Effect,2005.03.03,Rock,최갑원,미안합니다 고작 나란 사람이 당신을 미친 듯 사랑합니다 기다립니다 잘난 것 하나 없는데 염치없이 당신을 원합니다 세상을 더 헤매어 봐도 눈을 더 크게 뜨고 찾아도 당신은 단 하나란 걸 알아서 내가 꼭 갖고 싶지만 날 사랑해줘요 날 울리지마요 숨 쉬는 것보다 더 잦은 이 말 하나도 자신 있게 못하는 늘 숨어만 있는 나는 겁쟁이랍니다 미안합니다 미련한 미련 때문에 내 손으로 당신을 못 놉니다 내 눈에 당신이 박혀서 다른 무엇도 볼 수 없어서 가슴에 옮겨와 달라는 말도 이젠 해보고 싶지만 날 사랑해줘요 날 울리지마요 숨 쉬는 것보다 더 잦은 이 말 하나도 자신 있게 못하는 늘 숨어만 있는 나는 겁쟁이랍니다 조금씩 커져가는 사랑은 한 번씩 나도 몰래 새어 나와서 길을 잃은 아이처럼 울고 보채도 터진 내 맘은 모르겠죠 눈을 감지 마요 나를 바라봐요 당신의 귓가에 다가가 말하려 해도 당신 앞에 설 때면 뒷걸음만 치는 그저 난 겁쟁이랍니다 그대만 나는 기다립니다
2005.06.20~06.26,16,711626,살다가,SG워너비,살다가,2005.02.28,Ballad,류재현,살아도 사는게 아니래  너 없는 하늘에  창 없는 감옥같아서  웃어도 웃는게 아니래  초라해 보이고  우는것 같아 보인데  사랑해도 말 못했던 나  내색조차 할 수 없던 나  나 잠이 드는 순간 조차  그리웠었지  살다가 살다가 살다가 너 힘들때  나로 인한 슬픔으로  후련할 때까지  울다가 울다가 울다가 너 지칠때  정 힘들면 단 한번만 기억하겠니  살다가  웃어도 웃는게 아니래  초라해 보이고  우는것 같아 보인데  사랑해도 말 못했던 나  내색조차 할 수 없던 나  나 잠이 드는 순간 조차  그리웠었지  살다가 살다가 살다가 너 힘들때  나로인한 슬픔으로  후련할 때까지  울다가 울다가 울다가 너 지칠때  정 힘들면 단 한번만 기억하겠니  우린 마지못해 웃는거겠지  우린 마지못해 살아가겠지  내 곁에 있어도 내 곁에 있어도  눈물 나니까 살다가 살다가 살다가 너 힘들때  나로인한 슬픔으로  후련할 때까지  태워도 태워도 태워도 남았다면  남김없이 태워도 돼  후련할 때까지  나 살다가  나 살다가
