time,rank,song_id,title,singers,album,date,genre,creator,lyric
2008.12.07~12.13,55,1975477,여자라서 하지 못한 말,유미,Melody & Memory,2008.12.02,Ballad,Minuki,오늘도 나는 웃는다 친구들이 너의 안부를 물어 눈치도 없나 봐 널보고 싶다고 자꾸만 부르래 혹시나 하는 마음에 거짓 아닌 거짓말했어 너무나 바빠서 요즘 들어 나도 너의 얼굴을 볼 수 없다고 널 사랑하다가 널 많이 미워하다가 다시 그리워하다가 지쳐서 우는 내가 너무 싫다 사랑해 한마디 하면  돌아올 것 같은데 여자라서 차마 못하는 말 별거 아닌 줄 알았어 널 안보면 그만이라고 사랑이 그때는 이별이 그때는 바보처럼 쉬운 줄 알았어 널 사랑하다가 널 많이 미워하다가 다시 그리워하다가 지쳐서 우는 내가 너무 싫다 사랑해 한마디 하면 돌아올 것  같은데 여자라서 차마 못하는 말 너를 사랑하는 것도 내 맘대로 할 수가 없고 너를 지우는 것조차 할 수 없잖아 보고 싶다 너를 미치도록 보고 싶다고 가슴속에 맴도는 그 말 가끔은 널 잊고 잘사는 것 같아 하루도 못 가 네 생각에 또 우는 내가 싫다 미안해 한마디 하면  돌아올 것 같은데 여자라서 다 하지 못하는 말 널 사랑하다가 널 많이 미워하다가 다시 그리워하다가 지쳐서 우는 내가 너무 싫다 사랑해 한마디 하면  돌아올 것 같은데 여자라서 차마 못하는 말
2008.12.07~12.13,56,984646,애인 있어요,이은미,Ma Non Tanto,2005.10.24,Ballad,최은하,아직도 넌 혼잔거니  물어보네요 난 그저 웃어요  사랑하고 있죠 사랑하는 사람 있어요   그대는 내가 안쓰러운 건가봐  좋은 사람있다며 한번  만나보라 말하죠  그댄 모르죠 내게도  멋진 애인이 있다는 걸  너무 소중해 꼭 숨겨두었죠   그 사람 나만 볼 수 있어요  내 눈에만 보여요  내 입술에 영원히 담아둘거야  가끔씩 차오르는 눈물만 알고 있죠  그 사람 그대라는 걸   나는 그 사람 갖고 싶지 않아요  욕심내지 않아요  그냥 사랑하고 싶어요  그댄 모르죠 내게도  멋진 애인이 있다는걸  너무 소중해 꼭 숨겨두었죠   그 사람 나만 볼 수 있어요  내 눈에만 보여요  내 입술에 영원히 담아둘거야  가끔씩 차오르는 눈물만 알고 있죠  그 사람 그대라는걸   알겠죠 나 혼자 아닌걸요  안쓰러워 말아요  언젠간 그 사람 소개할께요  이렇게 차오르는 눈물이 말하나요  그 사람 그대라는 걸 -
2008.12.07~12.13,57,1973358,눈사람 (Feat. 융진 Of Casker),에코브릿지,Somewhere Over The Rainbow Vol.7 (Christmas Party (Mood)),2008.11.28,Ballad,에코브릿지,White 눈이 내리면 오늘도 잊겠지 늘 그랬듯이 Let me see the merry Christmas come true Blue 눈을 가진 너 언제나 웃지만 슬픈 눈빛을 Let me show the merry Christmas come true 어두운 밤이 되고 아무도 없는 길에 홀로 가만히 무슨 생각 하는지 나처럼 우리 지난 날 떠올리는지 너 그리운 거니 아님 누군가 필요한 거니 Let me show the merry Christmas 너 외로운 거니 아님 내 곁에 다시 오고 싶니 Let me show the merry merry Christmas  어두운 밤이 되고 아무도 없는 길에 홀로 가만히 무슨 생각 하는지 나처럼 우리 지난 날 떠올리는지 너 그리운 거니 아님 누군가 필요한 거니 Let me show the merry Christmas 너 외로운 거니 아님 내 곁에 다시 오고 싶니 Let me show the merry merry Christmas Let me see the merry merry Christmas
2008.12.07~12.13,58,1918284,사랑후애 (僞愛),FTISLAND(FT아일랜드),Colorful Sensibility,2008.08.22,Rock,한성호,내 사랑이라 생각했고  내 전부라고 생각했고  내 마지막이 될 사랑  그게 너라고 믿었어  너 하나만을 위해 웃고  너 하나만을 위해 살고  그게 행복일거라고  니 사랑을 믿었는데  모두 다 거짓말이야  다 거짓말이야  너의 사랑은 다 거짓말이야  이토록 아프게 해서  날 슬프게 해서  울리고 간 사랑이잖아  나만을 사랑한다고  날 지켜준다고  너의 사랑은 다 거짓말이야  내 마음 다 가져가고  사랑도 가져가고  떠나는 게 사랑이잖아  한 사람에게 사랑받고  한 사람에게 사랑주고  그 사람이 너일거라  바보처럼 믿었는데  모두 다 거짓말이야  다 거짓말이야  너의 사랑은 다 거짓말이야  이토록 아프게 해서  날 슬프게 해서  울리고 간 사랑이잖아  나만을 사랑한다고  날 지켜준다고  너의 사랑은 다 거짓말이야  내 마음 다 가져가고  사랑도 가져가고  떠나는 게 사랑이잖아  사랑이라는 말은 거짓말  사랑을 한단 말도 거짓말  영원이라는 말도 거짓말  돌아온다는 약속만을  내게 남긴채  그대는 어디로 그대는 어디로  멀어지고 멀어져도  나는 너 하나만을 사랑해  너 다시 돌아올까봐  내게로 올까봐  나는 사랑을 다시 못하잖아  이토록 아프게 해도  날 슬프게 해도  너 하나만 기다리잖아  모두 다 거짓말이야  다 거짓말이야  우리 이별은 다 거짓말이야  니가 내 사랑이니까  내 전부이니까  너 하나만 기다리잖아
2008.12.07~12.13,59,1958148,Wrong Number,동방신기(TVXQ!),The Fourth Album `MIROTIC` (Special Edition),2008.11.12,Ballad,"강준우,MARVINAMBROSIUS,CHRISTOPHERLEEJOE,IainJamesFarqharson,Philippe-MarcAnquetil",하루에 열두 번씩 전활 걸어 확인하고 어쩌다 통화중일 때면 괜한 의심으로 넌 또 메세질 남겨놔 이 시간에 대체 누구길래 전활해 있지도 않은 여잘 상상해 만들어내 숨이 막힐 것 같아 사랑이라는 말에 날 가둬두고 지겨운 잔소리는 쌓여 또 집착이 되고 No 널 지울래 다신 내 전화에 네가 뜨지 못하게 I set You Got The Wrong Number You Got The Wrong Number I'm Sorry You Got The Wrong Number So Don't Call Me No More 마치 넌 엄마처럼 하룰 다 알고 있고 어디서 누구와 뭘 할까 불안하고 날 위한 거라 또 믿지 관심이였단 말로 변명을 하지만 지나친 구속은 사랑을 더 아프게 만드는 걸 끊긴 전화에 매달리면 뭘 해 들려 오는 건 뻔해 What to Say You Got The Wrong Number You Got The Wrong Number I'm Sorry You Got The Wrong Number So Don't Call Me No More You Got The Wrong Number You Got The Wrong Number I'm Sorry You Got The Wrong Number So Don't Call Me No More 다 지워버린 다 바꿔버린 너와 날 기억하고 있는 숫자 비밀번호 언제라도 내 이름이 뜰 때마다 울리던 너의 벨 소리 모두 다 지워 Reset Reset wow 미쳐버리겠다 닥쳐주길 원했다 너의 그물 속에 바보 같은 fish 이걸로는 안돼 Cash 너의 사랑이 내 살을 도려내 아련해 오늘 나 머리가 아파와 또 다시 환청이 들려와 관심 있는 척 날 위한 척 이라는 곳에 난 그대만의 꼭두각시 No라는 소리에 모든 숨을 죽일 필요가 없는데 니 품안에 있는 날 놓아줘 say 벗어날 수 있게 날 도와줘 say 다시 시작할 수 없을 만큼 너무 멀리 와버렸어 You Got The Wrong Number You Got The Wrong Number I'm Sorry You Got The Wrong Number So Don't Call Me No More You Got The Wrong Number You Got The Wrong Number I'm Sorry You Got The Wrong Number So Don't Call Me No More Wrong Number Wrong Number I'm Sorry You Got The Wrong Number I'm Sorry You Got The You Got The I'm Sorry You Got The So Don't Call Me No More
2008.12.07~12.13,60,1953949,무슨 사랑이 그래요,"백찬,이수영",무슨 사랑이 그래요 (Single),2008.11.06,Ballad,강은경,항상 이런 식인가요 여자를 만날 때마다 왜 그렇게 설레도록 잘해준건가요 책임지지도 못할 걸 내가 그리 쉽게 보였었나요 왜 그랬어요  바보야 나같은 걸 왜 사랑해 볼 게 뭐가 있니 해준 게 뭐가 있니 너만 힘들어질 뿐이야 이거 봐 지금도 널 울리잖아 누굴 사랑할 자격도 난 없는 것 같아 무슨 남자가 그래요 한 입으로 두 말 왜 해요 죽을만큼 나를 사랑한다면서요 무슨 사랑이 그래요 상처만을 주고 떠나가나요 정말 나빠요 그래 돌아서자마자 내가 무너질 거 맞아 왜 눈물이 나지 나 어떻게 살지 후 죽을 것 같다 아냐 며칠이면 괜찮겠지 너도 빨리 날 잊고 좋은 남자 만나 무슨 남자가 그래요 한입으로 두 말 왜 해요 죽을 만큼 나를 사랑한다면서요 무슨 사랑이 그래요 상처만을 주고 떠나가나요 정말 나빠요 제발 보낼 때 떠나가란 말야 나를 보지 마 네 눈물 보면 마음 약해지니까 사랑하긴 했나요 한 번만 듣고 싶어요 나는 아직 사랑하는데 나를 울려도 좋아요 나쁜 남자래도 좋아요 그대 곁에 있을 수만 있게 해줘요 미워도 보고 싶은걸 미치도록 좋은걸 어떡해요 가지 말아요
2008.12.07~12.13,61,1972849,Part 2,넬(NELL),The Trace,2008.11.27,Rock,,지나가더군요 마음이 어떻든 시간은 그렇게 계속 흘러가고 믿기 힘들었던 받아들일 수 없던 그 모든 일들에 익숙해지네요 멍하니 있다 눈물이 흘러 누가 볼까 봐 고갤 떨구고 도망치듯 그 자릴 피하긴 해도 풀려진 신발 끈을 묶으려 주저앉다가 무너져 내려 순간 모든 게 멈춰버리긴 해도 익숙해요  버텨지더군요 고달픈 하루도 어떻게 해서든 또 지나가고 수많은 사람 속에서 들려온 안녕이란 말 그 한마디에 가슴이 덜컥 내려앉는 일에도 아직까지도 너의 말투로 말하는 내가 너무 싫어서 그저 조용히 침묵하는 일에도 익숙하죠  익숙하긴 하지만 여전히 낯설고 버텨지긴 하지만 힘든 건 여전해 놓아버린 듯해도 여전히 손끝에 지워낸 듯하지만 여전히 가득해 멍하니 있다 눈물이 흘러 누가 볼까 봐 고갤 떨구고 도망치듯 그 자릴 피하긴 해도 풀려진 신발 끈을 묶으려 주저앉다가 무너져 내려 순간 모든 게 멈춰버리긴 해도 맘에도 없는 말들로 그렇게 널 떠나보내고 멀어진 뒷모습에 참고 있던 눈물 왈칵 쏟아 내버렸죠 그때 니가 나에게 했던 그 말 아직 기억하는지 또 다른 겨울이 찾아오면 모든 게 다 잊혀질 거라고 했던 그 말
2008.12.07~12.13,62,1988008,윈터키스 (Feat. 백찬 Of 에이트),박정현,Winter Kiss (Newways Always) (Digital Single),2008.12.08,Dance,,정말 이상하죠 나 왠지 춥지 않네요 그대 생각 만으로 올 겨울은 먹고 살기 바빠 내 두 다리가 아파 쓰러질 때까지 뛰었어 하지만 매일같이 난 무기력했어 근데 널 만나서 내 삶이 바꼈어 사랑의 묘약에 호랑이 기운이 솟아났어 춤추는 눈꽃 속에 그대와 손을 꼭 마주잡고 나눴던 달콤한 키스 별빛 아래 약속할께 사랑해 그대와 나 영원히 함께 할꺼야 하얀 겨울 축복속에  날 날 사랑한다는 그대 그 목소리는 아무리 들어도 또 듣고 싶어 매년 새롭게 찾아오는 이 겨울이지만 네가 없다면 나에게 늘 똑같겠지 난 들어도 들어도 또 듣고싶은 네 목소리 처럼 겨울도 네가 있어 항상 새로워져 춤추는 눈꽃 속에 그대와 손을 꼭 마주잡고 나눴던 달콤한 키스 별빛 아래 약속할께 사랑해 그대와 나 영원히 함께 할꺼야 하얀 겨울 축복속에  올 겨울이 가고 눈사람이 녹아도 다시 추워지고 몇 번씩 반복되도 내 사랑 변하지 않아 난 춤추는 눈꽃 속에 그대와 손을 꼭 마주잡고 나눴던 달콤한 키스 별빛 아래 약속할께 사랑해 그대와 나 영원히 함께 할꺼야 하얀 겨울 축복속에
2008.12.07~12.13,63,1929843,남자를 믿지마 (Feat. Big Tone),M(이민우),M Rizing,2008.09.23,Dance,용감한형제,This one is for Playuh'z Just wanna make it clear So grab a hottie let's party take shots And bounce to this here Brave Brovas Tone and Big M Nah we ain't goin' no where So all my sexy ladies where U at 그냥 어쩌다가 정이 들어 버렸어 너는 어느 순간 가족이 돼 있어 바라볼수록 네가 자꾸 질려서 나의 마음이 양심이 더 찔려서 너를 보냈어 별로 사랑하지 않는 것 같아서 널 떠나보냈어 난 네가 떠나간다면 나는 너를 붙잡아 네가 돌아온다면 나는 부담스러워 이런게 남자야 나는 나쁜 놈이야 이렇게 비겁한 남자를 믿지 말어 남 주기는 아깝고 나도 갖기는 싫어 결혼하기는 싫고 연애하기는 좋아 이런게 남자야 나는 나쁜 놈이야 이렇게 비겁한 남자를 믿지 말어 널 정말 사랑하지만 널 항상 아프게 하는 난 정말 나쁜 놈인걸 이러는 나를 정말 용서 하지마 너를 보냈어 별로 사랑하지 않는 것 같아서 널 떠나보냈어 난 네가 떠나간다면 나는 너를 붙잡아 네가 돌아온다면 나는 부담스러워 이런게 남자야 나는 나쁜 놈이야 이렇게 비겁한 남자를 믿지 말어 남 주기는 아깝고 나도 갖기는 싫어 결혼하기는 싫고 연애하기는 좋아 이런게 남자야 나는 나쁜 놈이야 이렇게 비겁한 남자를 믿지 말어 I don't know me but i can't stop I don't know me but i can't stop I don't know me but i can't stop I don't know me but you know Cause I'm a badboy 너무나도 이기적인 나 잘 빠진 Shorty 지나가면 저절로 눈이 돌아가 That's just me 솔직해 No Fantasy from D 너도 잘 알잖아 내 Style 싫다해도 날 보면 U Smile ah ha 이런게 나에요 이대로 날 떠나도 절대 원망 따윈 않해요 우린 Love보단 정이 뿌리처럼 너무 깊은 사이 Say Bye or be mine 넌 나만의 Dambi 난 네 Badboy 영원히 나 너에게 더 미안해져 다가오지 말고 날 내버려둬 이제 그만 나 같은 남잘 사랑 하지마 네가 떠나간다면 나는 너를 붙잡아 네가 돌아온다면 나는 부담스러워 이런게 남자야 나는 나쁜 놈이야 이렇게 비겁한 남자를 믿지 말어 남 주기는 아깝고 나도 갖기는 싫어 결혼하기는 싫고 연애하기는 좋아 이런게 남자야 나는 나쁜 놈이야 이렇게 비겁한 남자를 믿지 말어
2008.12.07~12.13,64,1959669,즉흥여행 (Feat. MC몽),윤종신,동네 한 바퀴,2008.11.25,Ballad,윤종신,Yo 넌 영원한 슈퍼스타 불을 붙인 가슴에 뜨거운 내 가슴에 날 안아줘 꽉 안아줘 넌 영원한 슈퍼스타 No way But crazy my heart You make me crazy my girl 날 사랑한다고 말해줘 느끼고 싶어 모든 걸 불을 붙인 가슴에 뜨거운 내 가슴에 날 안아줘 꽉 안아줘 넌 영원한 슈퍼스타 날 사랑한다고 해줘 그리고 떠나는 거야 어디가 되던 너만 있으면 돼 서둘러 날 믿는다고 말해줘 숨 막히는 세상 잠깐 등질 수 있니 내 손 잡고 달려 맞바람을 마셔보자 오랜 나의 고민 다 날려본다 우리 사랑이면 준비 끝 무슨 짐이 또 필요해 세상 어디든 떠날 곳 달려 가슴이 벅차오르게 생각만 해도 떨리는 출발의 이 느낌 아무것도 필요 없어 나와 떠나줘 아침에 일어나 커피 한잔 만 해줘 평생을 내 옆에서 그냥 웃어줘 모든 걸 다 줄게 사랑한다고 말해줘 날 사랑한다고 해줘 그리고 만드는 거야 시간이 흘러 돌아보면 짜릿한 추억 날 최고라고 말해줘 숨 막히는 세상 움츠려든 나에게 크게 소리 질러 맞바람을 마셔보자 오랜 나의 고민 다 날려본다 우리 사랑이면 준비 끝 무슨 짐이 또 필요해 세상 어디든 떠날 곳 달려 가슴이 벅차오르게 생각만 해도 떨리는 출발의 이 느낌 돌아올 땐 피곤해 의자 모두 젖힌 채 세상모르게 잠들지 몰라도 너와 나의 두 손은 살며시 포개진 채 아직도 꿈 속에선 그 곳이야 Yo 넌 영원한 슈퍼스타 아무것도 필요 없어 나와 떠나줘 아침에 일어나 커피 한잔 만 해줘 평생을 내 옆에서 그냥 웃어줘 모든 걸 다 줄게 넌 영원한 슈퍼스타 달려 가슴이 벅차오르게 생각만 해도 떨리는 출발의 이 느낌 생각만 해도 떨리는 이 느낌
2008.12.07~12.13,65,1976261,있잖아 나말야 (Vocal 명인희 Of TheThe & 강균성),룸메이트,RoomMate Mini Album `있잖아 나말야`,2008.12.01,Ballad,"룸메이트,작사/작곡가황현(MonoTree)Ambler좋아요총건수104140곡#황현#작",그땐 아무것도 몰랐거든 사랑이 녹슬 줄 몰랐거든 있잖아 나말야 너를 미워해 있잖아 나말야 충분히 울었고 소리내 웃었어 나혼자 멈췄고 시간은 흘렀지 사랑해 사랑해 수없이 말해도 그 끝엔 항상 왜 다른 말이될까 있잖아 나말야 너를 미워하게 됐어 매달리고 떼를 쓰던 그때로 돌아가진않아 난 지쳤고 알았어 괜한 걱정은 불편해 니가 되고 싶었던 지난 시간 다 후회할게 처음엔 그랬어 이번엔 달랐어 더이상 아프지 않을 줄 알았어 사랑해 사랑해 달콤한 귓속말 이젠 상해버린 기억이 됐지 있잖아 나말야 너를 미워하게 됐어 매달리고 떼를 쓰던 그때로 돌아가진않아 난 지쳤고 알았어 괜한 걱정은 불편해 니가 되고 싶었던 지난 시간 다 후회할게 있잖아 나말야 너를 미워해 있잖아 이제는 나는 널 몰라 있잖아 나말야 너를 미워해 이제는 널 몰라 웃기지 근데 왜 나는 달라진게 없지 웃다가도 니 목소리가 들려 눈물이 흘렀어 아무래도 내맘은 아직 니품에 있나봐 꺼내줘요 내힘으론 말을 듣지않는 나야 그 땐 아무것도 몰랐거든 그 땐 우리 녹슬 줄 몰랐거든 가슴이 자꾸 거짓말을 한다고 애써 너를 밀어낸 그 날 부터 있잖아 나말야 너를 미워해 있잖아 이제는 나는 널 몰라 있잖아 나말야 너를 미워해 이제는 널 몰라
2008.12.07~12.13,66,1951549,"오, 아, 오",BIGBANG,Remember,2008.11.05,Rap / Hip-hop,"JohnLarkin,AntonioNunzioCatania",Get a move on Let's go high way Burn the bridge It's the Big Bang Baby tell me girl 어디 숨었기에 내 기억  주머니에 내가 너한테 무슨 큰 죄졌기에 뭐가 그리 질렸기에 날 똑똑히 봐 I got you got you 안 놓친다 Everything's about you 너무 사랑해도 죄가 되나 단 한줌의 재가 돼 가 시끄러운 자명종소리 징그러운 너의 목소리 오늘도 아침부터 네 생각에 깨는 이 고통이 니가 그 놈 때문이건 아님 피치 못할 사정이건 I don't give up I need you right now I miss you right now what you waiting for 널 기다리는 나 아무런 말 없이 내 손을 잡고 조금만 더 come on closer 너를 향해 Let's go love soldier 오아오 오아오와우와 가지 말라고 제발 후회할 거라고 오아오 오아오와우와 널 보면 욕이 나와 그래도 좋다고 가 가 가 bye bye bye baby 다신 눈에 띄지마 니네 둘다 go run 다 다 다 lie lie lie baby 사랑 웃기지마 얼마나 가나 go run 네가 해달란 건 다해줬어 늘 힘들 때면 내가 달래줬어 그런데 넌 떠나 가네 벌써 Baby come back to me 오늘 너의 그 남잘 만났어 그 옆엔 니가 아니였어 끼리끼리 아주 잘 만났어 Baby come back to me What you waiting for 그를 기다리는 너 아무런 말 없이 그 손을 놓고 조금만 더 come on closer 나를 향해 Let's go love soldier 오아오 오아오와우와 가지 말라고 제발 후회할 거라고 오아오 오아오와우와 널 보면 욕이 나와 그래도 좋다고 아무런 이유 없이 너에게 달려가 너도 내 맘과 같다면 기다렸단 듯이 나에게 안겨봐 Run to me lady 자꾸만 멀어져 가는 네게 지쳐가 아직 늦지 않았다면 Baby plz you n me Together forever 이 자릴 지킬게 오아오 오아오와우와 가지 말라고 제발 후회할 거라고 오아오 오아오와우와 널 보면 욕이 나와 그래도 좋다고 후회할 거라고 그래도 좋다고 가 가 가 bye bye bye baby 다신 눈에 띄지마 니네 둘 다 go run 다 다 다 lie lie lie baby 사랑 웃기지마 얼마나 가나 go run
2008.12.07~12.13,67,1984550,랄랄라,"소녀시대(GIRLS`GENERATION),윤상",Song Book,2008.12.05,Electronica,,오늘처럼 흐린 햇살마저 눈부신 날이면 주머니에 가득한 먼지를 탁탁 털어 버리지 해묵은 한숨을 털어 내고 때묻은 상처를 지우고 나면 차라리 날아가 버릴 것 같아 눈물이 나 이렇게 어렵지 않은 수고로도 가벼워져 버릴 만큼 난 강해져 있어 장난처럼 널 떠올릴 수도 있는 걸 아무렇지도 않게 콧노랠 부르며  오늘처럼 흐린 햇살마저 눈부신 날이면 주머니에 가득한 먼지를 탁탁 털어 버리지 해묵은 한숨을 털어 내고 때묻은 상처를 지우고 나면 차라리 날아가 버릴 것 같아 눈물이 나 이렇게 어렵지 않은 수고로도 가벼워져 버릴 만큼 난 강해져 있어 장난처럼 널 떠올릴 수도 있는 걸 아무렇지도 않게 라라라랄라 이렇게 어렵지 않은 수고로도 가벼워져 버릴 만큼 난 강해져 있어 장난처럼 널 떠올릴 수도 있는 걸 아무렇지도 않게 콧노랠 부르며
2008.12.07~12.13,68,1945479,사랑은 없다,구피,2008 Neo Goofy,2008.10.29,Rap / Hip-hop,박성호(구피),사랑은 없다 후회도 없다 그저 멍든 가슴만 내겐 남아있다 눈물도 없다 추억도 없다 뜨겁게 사랑했던 날들 모두 다 지웠다 사랑은 한순간의 불장난과 같다고 누가했어 돌릴 수 없는 길을 다시 걸어가야만 했어 이처럼 아프고 괴로운게 사랑이야 맞아 나 진작 알아채야 했어 안해야 했어 불나방같이 타오르는 불속으로 들어가 죽어가는 걸 알면서도 계속 뛰어들어가 달콤한 사탕 맛본 어린 아이처럼 난 사랑이란 달콤한 기억만 떠올라 oh no pain no gain 내 눈에 고인 눈물 내 어깨에 나를 짓누르는 삶의 무게보다 더 무겁게 느껴지는건 널 보내야 하는 것 더욱 더 무섭게 느껴지는 건 널 지울 수 없는 것 사랑은 모래성과 같아 쌓기 너무나 힘들지만 거친 파도가 밀려오면 너무나 쉽게 무너져 우리의 믿음도 너무나 허무하게 점점 무너져 너와 나의 약속 이렇게 쉽게 잊혀져 사랑은 없다 후회도 없다 그저 멍든 가슴만 내겐 남아있다 눈물도 없다 추억도 없다 뜨겁게 사랑했던 날들 모두 다 지웠다 상처가 깊이 나서 흉터로 남겠지만 가슴이 멍들어서 아프겠지만 널 사랑하면서 더 망가져 갈 내 자신에게 너무 너무나 미안해 잊을래 사랑은 사치 내게 있어는 마치 잘 맞지 않은 옷을 입은 것 같이 편하지가 않았지 첨부터 어긋나기만 했던 우리 사랑은 시소같이 균형은 맞질 않고 삐걱대기만 했었지 뜨거운 가슴 하나만 있으면 널 사랑해줄 것 같던 철부지 아이였어 난 미련한 놈이였어 뜨거운 열정 하나만 있으면 행복해 질 거같던 착각에 살았소 그렇게 사랑을 믿었소 그래 사랑을 믿었어 이젠 난 모두 지웠어 내 자신까지 우는 법까지 그래 사랑을 믿었어 이젠 난 모두 지웠어 내 자신까지 우는 법까지 사랑은 없다 후회도 없다 그저 멍든 가슴만 내겐 남아있다 눈물도 없다 추억도 없다 뜨겁게 사랑했던 날들 모두다 지웠다
