time,rank,song_id,title,singers,album,date,genre,creator,lyric
2000.05.28~06.03,17,3680,너를 위해,임재범,Story Of Two Years,2000.05.16,Ballad,채정은,어쩜 우린 복잡한 인연에  서로 엉켜있는 사람인가봐  나는 매일 네게 갚지도 못할만큼  많은 빚을 지고 있어  연인처럼 때론 남남처럼  계속 살아가도 괜찮은 걸까  그렇게도 많은 잘못과 잦은 이별에도  항상 거기 있는 너  날 세상에서 제대로 살게해 줄  유일한 사람이 너란걸 알아  나 후회없이 살아가기 위해  너를 붙잡아야 할테지만  내 거친 생각과 불안한 눈빛과  그걸 지켜보는 너  그건 아마도 전쟁같은 사랑  난 위험하니까 사랑하니까  너에게서 떠나줄꺼야   날 세상에서 제대로 살게해 줄  유일한 사람이 너란걸 알아  나 후회없이 살아가기 위해  너를 붙잡아야 할테지만  내 거친 생각과 불안한 눈빛과  그걸 지켜보는 너  그건 아마도 전쟁같은 사랑  난 위험하니까 사랑하니까  너에게서 떠나줄꺼야  너를 위해 떠날꺼야
2000.05.28~06.03,18,38426,멍,김현정,Kim Hyun Jung 3,2000.05.22,Dance,유유진,너 나를 쉽게 봤어  그렇지 않니  너는 몰라 너무 몰라 사랑을  안돼 니 맘대로 나를  떠날 수 없어  끝낸다면 내가 끝내 기억해  잘못이었어 너를 만난건  너는 사랑따윈 관심도  없던 거야  다만 넌 니 뜻대로 모두 맞춰줄  너 하나 밖에 모르는 내가  필요했을 뿐  다 돌려놔 너를 만나기전에  내 모습으로  추억으로 돌리기엔 내  상처가 너무커  바랄게 다음번에 너 누굴  사랑한다면  너 같은 사람 꼭 만나기를  잘못이었어 너를 믿은건  우린 하나라던 그건 다 말뿐이야  여러번 나를 속인 것도 모자라  니 주변의 사람들과 나를  비교 했었지  다 돌려놔 너를 만나기전에  내 모습으로  추억으로 돌리기엔 내  상처가 너무커  바랄게 다음번에 너 누굴  사랑한다면  너 같은 사람 꼭 만나기를
2000.05.28~06.03,19,34093,오랜 방황의 끝,김태영,오랜 방황의 끝,2000.01.10,Ballad,김창환,그대 두 손을 잡고 고개를 숙인채로  나를 용서해달라면서 난 많이 울었지  나의 긴 방황 끝에 결국 내가 찾은건  아직도 날 기다리고 있는 그대였었어  알아 그 동안 많이 들었어  그대가 나땜에 무척 힘들어 했었다는 걸  알아 순간의 나의 잘못이 얼마나 많은  상처로 그대를 괴롭혔는지  이젠 되돌려줄께 못다한 내 사랑이  오직 나 하나만 믿고 기다린 그대에게  내 모든 걸 다바쳐 나의 사랑속에서  이젠 그댈 편히 쉬게 할꺼야  그대 내 손을 잡고 날 감싸주면서  돌아왔으면 됐다면서 날 위로했지  수척해진 얼굴로 미소를 띄운채  내 두눈에 고인 눈물을 닦아주었지  알아 그 동안 많이 들었어  그대가 나땜에 무척 힘들어 했었다는 걸  알아 순간의 나의 잘못이 얼마나 많은  상처로 그대를 괴롭혔는지  이젠 되돌려줄께 못다한 내 사랑을  오직 나 하나만 믿고 기다린 그대에게  내 모든 걸 다바쳐 나의 사랑속에서  이젠 그댈 편히 쉬게 할꺼야  이젠 되돌려줄께 못다한 내 사랑을  오직 나 하나만 믿고 기다린 그대에게  내 모든 걸 다바쳐 나의 사랑속에서  이젠 그댈 편히 쉬게 할꺼야
2000.05.28~06.03,20,445159,그대가 그대를,이승환,His Ballad Ⅱ,2003.03.12,Ballad,"이승환,이지은",참 많이 모질었었죠 나 당신께  나같지 않은 말땜에 놀랬겠죠  편할날이 없었죠 틀렸던 걸까봐  말없이 놓아준 그대가  정말로 내사랑 같아서  왜 그랬나요 울거면서  잘 가라는 듯 왜  그게 되나요 못보는게 그대가  그대를 음  참많이 오래 견디죠 나 당신을  조금만 멀리 보여도 보고싶죠  갚을게 많아서 못준게 많아서 혹시 날 못있고 산다면  꼭 한번 만나고 싶어서  잘지내나요 혼잔가요  나아닌 누군가와 사랑하나요 우릴 지운  그대가 나아닌 그대를  우리가 사랑했던게 간직 할 만한  슬픔이었음 해요 왜 그랬나요 울거면서  잘 가라는 듯 왜 그게 되나요 못보는게  그대가 그대를 음 우리 오래 오래 살아요  꼭 한번이라도 보게 못한 얘기들도 하구요  맛나는 것도 먹어요 우리 정말로 오래오래  살아요 천년만년  어쩌면 인연이 다하여  뜻하지 않은 어느 곳  그리 우리 다시 만나면  이제 편히 쉬게요
2000.05.28~06.03,21,610605,송인 (送人),조수미,허준 OST,2000.05.08,Drama,,가지 못하네 돌아갈데가 없어  살아 헤어질 이 마음 가없이 떠도네 살아서 우네 갈 곳을 잃었구나  죽어도 못 맺을 이 몸은 천공을 헤매리 가없는 저 세월은 꿈도 한도 없구나 천년을 울어봐도 가는 해만 덧없어라 가지 못하게 갈 곳을 잃었구나 죽어도 못 맺을 이 몸은 천공을 헤매리 살아서 슬퍼라
2000.05.28~06.03,22,37516,위대한 탄생 (Fetticcini),드렁큰타이거,위대한 탄생,2000.03.29,Rap / Hip-hop,김성애,Boom Bap으로 Rap으로  취해봐 보여봐 너의 그 진정한 모습을  흑과 백과 선과 악과 너와 나와 그들과  그것을 위하여  가!장 아름답고 소중한 그것을 위해  나!는 지난 겨울처럼 또 다시 나타나  다!가가고 있어 그 곳으로 가고있어  라!샬락 붐- 터지고 있는 나의 슬픔  마!지막까지 포기할 수 없는 나의 마음  바!라만 보지마 다같이 외쳐봐  사!고 팔고 떠도는 너의 영혼을 그들은  아! 그 귀신처럼 덤벼 보고 되고있어  자!존심까지 화장으로 지워버려  차!별과 가식으로 너를 묻어버려  타!오르는 열망으로 취한 나의 타령  카!마카마카마카마 make a million  파!란 하늘 향해 겨뤄 Baby lon  하!늘을 향해 주먹을 질러봐  주먹을 질러봐 주먹을 질러봐   Boom Bap으로 Rap으로  취해봐 보여 봐 너의 그 진정한 모습을  흑과 백과 선과 악과 너와 나와 그들과  그것을 위하여  가!위 눌리는 현실에서 깨어나고싶어  나!는 나 너는 너 그들을 따라가긴 싫어 모두  다! 의지를 버리지 말고 앞으로 밀고 나가봐  라!일락 향기보다 달콤한 독을 알아봐  마!구 입을 놀리는 너는 내주먹의 맛을 봐  바!람과 함께 사라지는 우리 인생들  사!슬에 묶여 함께 끌려가는 인생들  아!무리 외쳐봐도 듣지않는 그 이들  자!신의 노예 속박에서 뛰어나와서  차!가워진 마음 녹여 모두다 다가와 더  타!오르는 열망으로 깨닮음으로  카!마카마카마카마 make a million  파!란 하늘 향해 겨뤄 Baby lon  하! 주먹을 질러봐  주먹을 질러봐 주먹을 질러봐   Boom Bap으로 Rap으로 취해봐 보여 봐 너의 그 진정한 모습을  흑과 백과 선과 악과 너와 나와 그들과  그것을 위하여 one shot  Boom Bap으로 Rap으로  취해봐 보여봐 너의 그 진정한 모습을  흑과 백과 선과 악과 너와 나와 그들과  그것을 위하여 one shot  카마카마카마카마 make a million  파란 하늘 향해 겨뤄 Baby lon  하! 주먹을 질러봐  주먹을 질러봐 주먹을 질러봐
2000.05.28~06.03,23,4067,아가페,이브,너에게로 날다,2000.02.28,Rock,G.고릴라,그대 곁에는 내가 있잖아   병든 세상은 무너져가지만   나의 너마저 보낼 수 없어   저 어둠속에 널 보낼 수 없어   Oh Please forgive me   내가 그녀를 위해 내가   영혼을 모두다 그녀를 위해   Give me 나를 그녀 대신에 나를   당신께 모든걸 바쳐   Can you feel the love   comin out   영혼을 모두다 그녀를 위해   Give me 나를 그녀   대신에 나를   당신께 모든걸 바쳐   널 나에게 맡겨두면돼  이 세상을 가져버린 어두운   저 하늘도   너를 데려갈 순 없어   Forever I'm Foever  I'm by your side I'm by  your side  Until the end Until the end  그대와 저 끝까지도  I'm by your side I'm by  your side  Until the end Until the end  그대와 저 끝까지도  널 나에게 맡겨두면 돼  이 세상을 가져버린 어두운  저 하늘도  너를 데려갈 순 없어  Forever I'm Foever  I'm by your side I'm by  your side  Until the end Until the end  그대와 저 끝까지도  I'm by your side I'm by  your side  Until the end Until the end  그대와 저 끝까지도  I'm by your side I'm by  your side  Until the end Until the end  그대와 저 끝까지도  I'm by your side I'm by  your side  Until the end Until the end  그대와 저 끝까지도
2000.05.28~06.03,24,26837,Hey U,샤크라,Chakra,2000.03.02,Dance,이상민,니가 아니니 니가 니가 아니었니  니가 아니니 니가 니가 아니었니  니가 아니니 니가 니가 아니었니  니가 아니니 니가 니가 아니었니  니가 아니니 니가 니가 아니었니  니가 아니니 니가 니가 아니었니  니가 아니니 니가 니가 아니었니  니가 아니니 니가 니가 아니었니  hey u hey u hey u hey   u hey u   love u love u love u love   u love u  hey u hey u hey u hey u   hey u  love u love u love u love u   첫번째 내 남잔 그대로 떠나   보내고 good bye   저기 저 저 남자 내게로 어서  오세요 baby   매일 난 한 사람에 빠져   상상속으로 빠져들곤 하지  그렇지 그 사람을 위해 살아가지   어디선가 본적없는 you   어느새 내 사람이 되어   머릿속에 빙글빙글   사랑일것 같지 모두다 그렇겠지   도무지 알 수 없어 살 수가 없어  일년에 입을 옷 며칠 다 입고   너를 놓치기 싫어하지   혼자의 시간이 어딨겠어   나는 매일 너와 함께하고   지내고 사랑하고 얘기해요  나만의 시간 이젠 없어   날려버려 너를 위해   그러는 거 아니 이러는거 아니   상상이나 되니 어처구니 없이   돌아가는   사랑인줄 알면서도 너를 그냥   보면 좋아   그게 좋아 니가 좋아   언젠가 이루어 질거라 믿고   지금은 너만 사랑하는 거야   두근 두근 두근 두근 두근   두근 두근 두근    설레이는 이 내 맘이   차근 차근 차근 차근 차근   차근 차근 차근    다가가 얘기할까   조금 조금 조금 조금 조금  조금 조금 조금   조금씩 사랑을 표현해   이제 이제 이제 이제 이제   이제 이제 이제   그대 이름을 부르며 다가가  hey u hey u hey u hey   u hey u   영화처럼 순수한 사랑을  love u love u love u love   u love u  영원토록 나 하나만 사랑해   오늘 난 너무 화가나 코도   삐뚤 입도 삐뚤   얼굴도 삐뚤인 여자가 네   옆에서 있는걸 봤어   달려가서 둘의 사일 비집고 들어가   집으로 달려가서 달력을 끄리내려   너를 보는것 만으로 해가   바뀌었구나 때가 왔다   새 천년 새 남자를 잡아야   할때가 왔다   최대한 꾸미고 가자나   me yeowon come on   첫번째 내 남잔 그대로 떠나   보내고 good bye   저기저 저 남자 내게로 어서   오세요 baby   내가 어떻게 됐겠어 말을   걸지 못했지만   you의 목소리는 들었어   너무 멋있었어   말을 걸려고 코앞까지 달려가다   넘어지는 나를 일으키는   그대 목소리   괜찮아요 괜찮지 않으면   어쩔라구요  어디라도 다쳤을라고 마음이   다쳤어요   오늘 위해 일년을 기다렸는데   이게 뭐야  그대를 사랑해요 come on   두근 두근 두근 두근 두근   두근 두근 두근    설레이는 이 내 맘이   차근 차근 차근 차근 차근   차근 차근 차근    다가가 얘기할까   조금 조금 조금 조금 조금   조금 조금 조금   조금씩 사랑을 표현해   이제 이제 이제 이제 이제   이제 이제 이제   그대 이름을 부르며 달려가  hey u hey u hey u hey   u hey u   영화처럼 순수한 사랑을  love u love u love u love   u love u  영원토록 나 하나만 사랑해   hey u hey u hey u hey   u hey u   영화처럼 순수한 사랑을  hey u hey u hey u hey  u hey u  영원토록 나 하나만 사랑해
2000.05.28~06.03,25,91014,주문을 걸어,박혜경,+01,1999.12.23,Rock,강현민,(나나나 나나나 -)  파란 바람이 불어 괜히 설레이던 날  하얗게 빛나는 너를 보게됐어 오-  스쳐 지나 갔지만 까만 너의 눈 속엔  너를 바라보는 내 모습이 있어 오-   And I`ll be seeing you!  꼭 보게 될거야  네게 주문을 걸었으니  오 그렇게 난 그렇게 널 만날꺼야   오 찾게 될꺼야  너는 마법에 빠진거야  오 그렇게 꼭 그렇게 날 찾을꺼야   (나나나 나나나 -)  매일 너의 꿈 속에 나를 보게 될꺼야  놀라지는 말아 우연이 아니야 오-  한 순간이었지만 너의 마음 가득히  까만 눈에 비친 내 모습이 있어 오-   And I`ll be seeing you!  꼭 보게 될거야  네게 주문을 걸었으니  오 그렇게 난 그렇게 널 만날꺼야   오 찾게 될꺼야  너는 마법에 빠진거야  오 그렇게 꼭 그렇게 날 찾을꺼야   I`ll be seeing you!  오 찾게 될꺼야  너는 마법에 빠진거야  오 그렇게 꼭 그렇게 날 찾을꺼야 -  (나나나 나나나 -)
2000.05.28~06.03,26,2222185,비인 (悲忍),윤손하,Sona,2000.05.03,Ballad,최희진,이젠 그대를 보낼 수 있어
2000.05.28~06.03,27,87596,편지,채정안,편지,2000.05.08,Dance,최준영,
2000.05.28~06.03,28,88423,Love,윤현석,Will (1집),2000.02.29,Ballad,,"묻고 싶어 너를 만나게 되면 나를 떠난 후 정말 괜찮은지 또 다른 누굴 만나 날 잊고 사는지 혹시 나와 같은지 그 누군가가 너를 물을 때마다 이젠 날 떠나 행복할 거라고 해 나 또한 알고싶어 너무 힘들어 너를 잊을 수 없어 사랑해, 사랑해 너의 사랑이 너무 필요해 기억해 날 잊지마 너를 너무 사랑해 너 하나만을 사랑한 죄밖에 없어 사랑 때문에 모든 걸 포기했어 이제 단 하나 나의 바램이 있다면 행복하게 살아줘"
2000.05.28~06.03,29,3676,Sentiment,비쥬,Face The Music R&B,2000.05.17,R&B / Soul,비쥬,뒤돌아 보지마  조금만 가면 다 끝나는거야  널 힘들게 했던 나의 사랑도  우리의 미래도  이젠 나를 떠나 저 하늘 아래  이 넓은 세상 위를  자유롭게 날아봐  너무 보고싶어 눈물이 나도  슬픈 꿈을 꾼거라고 생각해  내가 그리워도 참아야해  난 행복해야돼  그렇게 날 잊어줘  너를 보낸 나를 위해서 이 참을 수 없는 그리움들을  너도 느끼는지  가끔 너도 나처럼  잠들때마다 내 이름 부르니  지금 내게 전화하고 싶은지  날 사랑해서 아팠던만큼 행복한지  그대 항상 어느곳에 있어도  세상에서 제일 행복해야 돼  세상에 저 많은 사람중에  한사람일 뿐야  그렇게 날 잊어줘  너를 보낸 나를 위해서  Quand je dors pas Seule dans la nuit  Y a des voix  qui m' chuchotent tout bas  une histoire  qui n'est rien qu'a' moi  Pleure plus bas  j'entends qu' toi  Mem'si tu m'aim' par a'-coups  si je suis pour toi qu' une page  je pense a' toi  이젠 나를 떠나 저 하늘 아래  이 넓은 세상 위를  자유롭게 날아봐  너무 보고싶어 눈물이 나도  슬픈 꿈을 꾼거라고 생각해  내가 그리워도 참아야해  난 행복해야돼  그렇게 날 잊어줘  너를 보낸 나를 위해서  세상에 저 많은 사람중에 한사람일 뿐야 그렇게 날 잊어줘 너를 보낸 나를 위해서
2000.05.28~06.03,30,85257,바꿔,이정현,Let`s Go To My Star,1999.10,Dance,최준영,모두 제정신이 아니야 다들   미쳐가고만 있어   어느 누굴 믿어 어찌믿어   더는 못믿어   누가 누굴 욕하는거야 그러는   넌 얼마나 깨끗해   너나 할것없이 세상속에   속물들이야   바꿔 바꿔 바꿔 내 모든걸   다 바꿔 바꿔 바꿔   사랑도 다 바꿔 바꿔 바꿔 거짓은   다 바꿔 바꿔 바꿔 세상을 다 바꿔  THANGTH IT WAS A MUST   TO TRUST YOU NOW I CRUSH   YOU ANALYSIN MY BRAIN   너의 가식적인 사랑   나를 다시 사랑하길 바래   내가 다시 돌아오길 바래   그럼 바꾸길 바래 늦기전에   날 잡길 바래  한 여자의 지난 과거가 왜   용서받지 못할 일이야   맘에 걸렸다면 처음부터 왜   날 사랑해   모든 것이 변해버렸어 예전의   나로 착각하지마   나를 버린것을 후회해도   이미 늦었어   바꿔 바꿔 바꿔 내 모든걸   다 바꿔 바꿔 바꿔   사랑도 다 바꿔 바꿔   바꿔 거짓은   다 바꿔 바꿔 바꿔 세상을   다 바꿔 바꿔 바꿔 내 모든걸 다  바꿔 바꿔 바꿔  사랑도 다 바꿔 바꿔 바꿔  거짓은 다 바꿔 바꿔  바꿔 세상을  다 바꿔 바꿔
2000.05.28~06.03,31,87039,천애 (For You......),이지훈,Eternity Friend.....,2000.04.03,Ballad,강타(KANGTA),한참동안 숨겨왔던 내 숨죽인 눈물 여전히 고운 하얗게 식은 넌 아무말도 없어  소리없이 멈춰버린 내 떨리는 두 손  이제 다시 너의따스함을 느낄 순 없는건지 멈춰있었던 시간속에서 너를 만났었던 거였니  세상 어느 곳에도 이제 더이상 너의 모습을 볼 순 없는지 늦지 않았으면 해 지켜내야 해 니가 어느곳에 있어도  어떤 대답이라도 해줬으면 해 이렇게 애원하는 내게 그렇게도 힘들었던 니 여린 마음에 그 어떤것도 해줄 수 없던 난 대체 뭐였는지 한 순간도 내 앞에선 흔들리지 않던 너  돌아서선 얼마나 많이 괴로워 아파했었을지 멈춰있었던 시간속에서 너를 만났었던 거였니  세상 어느 곳에도 이제 더이상 너의 모습을 볼 순 없는지 늦지 않았으면 해 지켜내야 해 니가 어느곳에 있어도  어떤 대답이라도 해줬으면 해 이렇게 애원하는 내게  널 찾을수 있는곳에  살아갈 수 없다면  날 도와주겠니  내가 갈 수 있도록 항상 넌 다음 세상에서 도  날 만날 거라고 내 두눈을 보며  수줍게 웃곤했는 데  니가 있는 그곳에 소리없이 다가가 난 기도해 잠시 멈춰있었던 시간속에서 너를 만났었던 거였니  세상 어느곳에도 이제 더이상 더이상은  널 볼 순 없는지  늦지 않았으면 해 지켜내야 해 니가 어느곳에 있어도  어떤 대답이라도 해줬으면 해 이렇게 애원하는 내게
2000.05.28~06.03,32,88429,Smile Again (하늘에서),임창정,White,2000.02.10,Ballad,조규만,또 울고 있었군요 이젠 그만 나를 놓아요 커다란 그대 사랑 안고선 맘 편히 쉴 수 있게 긴 세월이 흐른 후 그대 좋은 사람 만나서 행복한 모습 볼 수 있도록 나 그댈 지킬께요 우리 함께 한 많은 날들이 너무나 소중해 그래도 웃을 수 있죠 혼자인게 서러울 땐 그댈 아프게 한 내 모습만 떠울리며 살아요  긴 그대의 한숨을 모두 가져갈 수 없다면 차라리 그대 그림자 되어 나 항상 그대 곁에 우리 함께 한 많은 날들이 너무나 소중해 그래도 웃을수 있죠 혼자인게 서러울 땐 그댈 아프게 한 내 모습만 기억해봐요 그대  세상에 홀로 남겨진 그대를 잠시라도 만날 수 있다면 단 하루라도 야위어 가는 그댈 위해 날 닮은 사람 보내줄께요 그에게서 날 봐요
2000.05.28~06.03,33,86132,애인,허쉬,Hush,1999.12.01,Dance,,다시 한번 나는 사랑에 또 빠졌어 이번에는 달라 전과 비교하지마 자존심은 모두 버리고 우 네 맘을 뺏을래 baby baby 네가 좋아한단 레몬향을 뿌리고 몸에 붙는 빨간 옷도 골라 입었어 이런데도 안넘어 오면 우 남자가 아니지 baby 너무 놀라 지는마 이런 나의 변신을 나와 함께 한다면 매일이 이런 기쁨일텐데 왠지 어리숙한 말투 착한 네 웃음이 내 마음을 끌었어 너라면은 내가 믿고 기댈 수 있다는 확신이 생겨난거야 내가 너에게 바라는 건 정말 진실한 마음뿐야 지금 너 그대로 baby baby  짙은화장대신 비누향을 풍기고 오늘만은 나의 청순함을 보일래 이런대도 안흔들리면 우 남자가 아니지baby 너무 놀라지는마 이런 나의 변신을 나와 함께 한다면 매일이 이런 기쁨일텐데 왠지 어리숙한 말투 착한 네 웃음이 내 마음을 끌었어 너라면은 내가믿고 기댈 수 있다는 마음 더해만가 이젠 용길 내줄래 기다리고 있잖아 너와 함께 한다면 언제나 나는 행복할꺼야 이젠 거릴 걸어가도 모든 여자들이 너를 보는것 같아 그런 부러운 시선이 나는 즐겁지만 넌 나만보고 걸어줘 내가 너에게바라는건 좀 더 나은 네 모습보다 변하지 않는 사랑을 할 나만의 너니까baby
2000.05.28~06.03,34,494157,다 알아요,양파,Yangpa Best,2003.11.13,Ballad,,다 알아요 모두 다 알아요  나를 떠나야 했었다는걸  너무 많은 것을 바라는 날 감당할 수 없어  이내 지쳐가는 그대를 모른 건 아니었어요  나 다른 건 없어요 꼭 한번만 보고 싶어요  그대 얼굴 예전처럼 밝은지  하지만 떠나간 그대의 그 미안함 덜어주려면  그대를 잊는게 더 옳은 거겠죠 다 알아요 알잖아요 이건 알잖아요  그럴 수 밖에 없었다는 걸  너무 초라하게 기억될 날 보여줄 수 없어  끝내 잡지 않은 내 맘을 모른건 아니잖아요  나 다른 건 없어요꼭 하나만 묻고 싶어요  그대 맘이 예전보다 나은건지  하지만 떠나간 그대의 그 미안함 덜어주려면  그대를 잊는게 더 옳은 거겠죠 다 알아요  다시 한번 생각해요 우리의 약속 많이 힘들어도 헤어짐은 없기로 했던 걸  그대 곁에 있고 싶은 욕심이라 해도 한곳만 바라볼 거예요 뒷모습만이라도  또 다른 건 몰라도 꼭 하나만 기억해줘요  이런 사랑 다시 오지는 않겠죠 그리고 우리 헤어짐은 긴 행복을 위한거겠죠 이런 내 믿음이 틀리진 않겠죠 난 믿어요  이런 식으로 끝나진 않겠죠 다 알아요
2000.05.28~06.03,35,1606633,Tonight,터보,터보(Turbo) 5집 `Email My Heart`,2000.01.26,Ballad,이승호,너에게 더 가까이 다가가고 싶지 향긋한 향기 상큼한 느낌 가지고 싶지 눈을 감고 너를 만지고 싶지 냇가에 흐르는 시냇물처럼 끊이지않는 숨결이지 잠들은 너의 얼굴 보고 싶지 커튼 사이 햇살에 비친 나른한 꿈결 느껴지지 tonight 오늘밤 all night 세상에 벽을 쌓고 끝없는 사랑을 나누고 싶지 all night 까맣게 젖은 너의 머릿결 상큼한 솔잎 같은 너의 향기 하얗게 나를 보며 웃어봐 가까이 내게 다가와 줘 귓가에 들려오는 니 숨결 바다의 파도소리 같겠지 촉촉한 너의 입술 닿으면 눈부신 행복이 나 오늘밤 단 둘이서 먼 여행을 떠나갈 거야 서로가 너무나 원했었지만 차마 갈 수 없었던 곳 널 안고 싶었어 널 갖고 싶었어 넌 하지만 이미 다른 사랑이 널 원했었지만 간절했었지만 손 끝 조차 닿지 않는 안타까움만 너의 이름만 불러봐도 터질 것 같은 나의 사랑 널 만지고 널 느끼고 널 마시고 내게 입맞춤도 더 가까이 내 품 가득 안고파 그렇게 나를 떠나갈 때 어리석게 난 사랑이 뭔지도 넌지도 몰랐어 너의 빈자리가 더욱 더 커져갈 때 그 자리엔 쓰러질 것만 같은 후회만 남았어 돌이킬 수 없는 선택을 해버린 널 알게 됐고 또 한 번의 아득한 절망에 다시 만난 넌 날 깨닫게 했지 아직도 그대로라는 걸 널 향한 내 사랑과 미래 이래선 안되는 걸 알지만 체념은 그리 쉽진 않았어 사랑은 자꾸 너를 찾는데 참을 수 없었어 이 세상이 이런 나를 용서하지 않는다해도 이제야 비로소 찾은 사랑을 이젠 포기할 수 없어 왜 그랬었냐고 왜 보냈었냐고 왜 사랑도 아닌 사람 곁에서 왜 내게 왔냐고 왜 이제서냐고 그때처럼 너를 보낼 줄 알았다고 아마 그 때 니 아픈 만큼 내가 다시 겪는가봐 tonight 오늘밤 어쩌면 마지막이 될 지 그저 하룻밤이 될 지도 모르겠지 그저 거품처럼 사라지는 인어의 꿈이 될 지도 모르겠지 난 영원히 오늘밤 짧은 순간의 기억만으로도 살아갈 수 있을 만큼 너를 사랑하고 있지 눈 감으면 너와의 깊은 입맞춤을 기억하며 살아가는 내가 될 수만 있다면 하고 기도하지 tonight tonight tonight tonight 슬픔은 없어 tonight tonight tonight tonight
