time,rank,song_id,title,singers,album,date,genre,creator,lyric
2005.09.12~09.18,32,926199,비 오는 날의 수채화,SG워너비,Classic Odyssey: Remake,2005.09.09,R&B / Soul,강인원,빗방울 떨어지는 그 거리에 서서 그대 숨소리 살아있는 듯 느껴지면  깨끗한 붓 하나를 숨기듯 지니고 나와  거리에 투명하게 색칠을 하지    음악이 흐르는 그 카페엔 초콜렛색 물감으로  빗방울 그려진 그 가로등불 아랜  보라색 물감으로    세상사람 모두 다 도화지 속에 그려진  풍경처럼 행복하면 좋겠네  욕심많은 사람들 얼굴 찌푸린 사람들  마치 그림처럼 행복하면 좋겠어    음악이 흐르는 그 카페엔 초콜렛색 물감으로  빗방울 그려진 그 가로등불 아랜  보라색 물감으로    세상사람 모두 다 도화지 속에 그려진  풍경처럼 행복하면 좋겠네  욕심많은 사람들 얼굴 찌푸린 사람들  마치 그림처럼 행복하면 좋겠어    빗방울 떨어지는 그 거리에 서서 그대 숨소리 살아있는 듯 느껴지면 오 -
2005.09.12~09.18,33,916286,Rising Sun (순수),동방신기(TVXQ!),Rising Sun,2005.09.12,Dance,유영진,"Now I cry under my skin  하늘을 향해 간 나의 눈물로 만든 비가  대지에 내려도 세월에 박힌 내 아픔을 씻어가도   No! 용서 내겐 절대적인 사치  No! 표적 없이 날아간 길을 잃은 분노  No! 나 미련 같은 말로 기도하는 속죄  No! Here I go, Come back!   힘을 잃어버린 날개  재가 되어 버릴 것만 같은 날들  비상하리란 꿈의 파편들로 맞은  나의 아침엔 반짝임이 없는데   진실은 누구라도 갖고 있는 것  하지만 보여준 얼굴엔 거짓뿐인걸  영원에 남겨진 나를 찾는가?   나를 닮아 가슴 안에 가득 차  커져가는 Innocent  불꽃은 밝게 타오르게  마지막이 찬란한 노을처럼  (I'm) waiting for Rising sun   Now burn my eyes  Sun comes up blowing the fog  Never lies to be your mind  Got to be a true   내 갈 길이 101 깨달음에 깨달음에  도달할 수가 없는 게 현실인걸  나의 태양 앞에 부끄럽지 않게  I just try me and now   정말 혼돈에 끝은 어딜까?  Somebody talks  매일 같은 답은 아냐  절망 행복의 밑그림 일까?  Somebody talks  시간만이 아는 해답   인생은 마치  끝없는 궤도를 달리는 별 같아  마치 수많은 질문과 해답을 찾아가  미완성의 그림을 그려가는 것  (Do) you know why?   이 시간은 언제나 흘러가  돌아오지 않는다는 것을 잘 알아  하루하루 후회를 남겨 두지마  고독이 낳은 분노마저 삼켜봐  고단해진 슬픔의 눈물에서  실현되는 행복의 가치를 믿어봐   시련들이 내민 손에 작은 입맞춤  고난의 뜰에 핀 나의 순수함  아무것도 정한 건 없겠지만  매일 새로운 날이 계속 될 테니까   나를 닮아 가슴 안에 가득 차  커져가는 Innocent  불꽃은 밝게 타오르게  마지막이 찬란한 노을처럼  (I'm) waiting for Rising sun   정말 혼돈에 끝은 어딜까  Somebody talks  매일 같은 답은 아냐  절망 행복의 밑그림 일까  Somebody talks  시간만이 아는 해답   Rise up! Rise up!"
2005.09.12~09.18,34,851277,"떠나가요, 떠나지마요",더크로스,Rush,2005.06.15,Ballad,SiHa,이제 더 이상 날 보지말아요  날 안아 줄 수없는거라면  이젠 그만 뒤돌아서 나를 떠나가줘요  뒷모습만이라도 보게해줘요    하루에 한 번쯤 너를 생각하겠지  그 한번이 스물 네 시간 일꺼야  시간이 지나면 널 잊을수있겠지  내 모두를 잊은채 살아가겠지    떠나가요 떠나지마요 내 소중한 사랑  내겐 누구보다 소중한 그대니까요  마지못해 눈 꼭 감은채 소리 질러요  안녕 이젠 안녕 내 소중한 사랑    그대 손을 잡던 그 날부터 생각했어요  보내기 정말 힘들꺼라고  알아요 알아요 이젠 나도 알아요  이만 이 손 놓고 그댈 보내야죠  아파서 아파서 그게 너무 아파서  마음으로 잡은 손 놓지못해    떠나라고 떠나가라고 거짓말하고  눈물흘리는 내 맘은 그댈 잡고있죠  사랑했다고 잘가라고 거짓말하고  난 속으로 소리질러요 사랑한다고  언제나 그댄 행복해야하니까  보내야죠 그댈 사랑하니까    꿈을 꿔요 또 늦지마요 내 소중한 사랑  내겐 누구보다 소중한 그대니까요  마지못해 눈 꼭감은채 소리질러요  안녕 이젠 안녕 내 소중한 사랑    떠나가요 떠나지마요 내 소중한 사랑  내겐 누구보다 소중한 그대니까요  마지못해 눈 꼭 감은채 소리 질러요  안녕 이젠 안녕 내 소중한 사랑 -
2005.09.12~09.18,35,905581,손틈새로...,거미,For The Bloom,2005.09.01,R&B / Soul,최갑원,널 만난 그 순간 모든 것이 멈춘 듯  움직일 수 없었어  처음엔 두 손이 그 담엔 두 눈이  하나 둘씩 떨려왔어   똑같은 시간에 내가 걷는 거리에  하필이면 너도 같은 거릴 걷고 있는지  우연은 지독하게 내 뒤에 서서  날 괴롭히는게 좋은가봐   날 보던 그 순간 죄를 지어버린 듯  내 얼굴을 가렸었어  나를 본 게 맞을까 나를 알아 봤을까  서둘러서 걱정했어   혹시 나를 다정히 부른 네 목소리에  나도 몰래 반갑다고 대답할지 몰라서  아무 말 할 수 없게  입마저 가리고 고개 돌렸는데   (죽어있던 기억들이 살아있나 봐)  이젠 너를 모두 잊었다고 믿었었나 봐  (조금도 잊어내지 못한 건가 봐)  네가 걷는 소리 하나까지 기억하나 봐   (날 몰라 보는건지 스쳐 지나가)  내 얼굴을 가린 손 틈새로 너를 보다가  (행복했던 추억들이 자꾸 생각나)  내 이름 부르길 바랬나 봐   불 꺼진 내 방에 네가 없는 내 방에  버릇처럼 불을 켰어  새어 나온 한숨이 고여 있는 눈물이  내 발 아래 가득했어   헤어지던 그 날에 찢어버린 사진을  조심스레 밤을 새워 다시 붙여보지만  찢겨져 조각이 난 우리 사랑은  절대로 붙일 수 없나 봐   (죽어있던 기억들이 살아 있나 봐)  이젠 너를 모두 잊었다고 믿었었나 봐  (조금도 잊어내지 못한 건가 봐)  네가 걷는 소리 하나까지 기억하나 봐   (날 몰라 보는건지 스쳐 지나가)  내 얼굴을 가린 손 틈새로 너를 보다가  (행복했던 추억들이 자꾸 생각나)  내 이름 부르길 바랬나 봐   여전히 내 두 눈은 널 아는데  너의 그림자도 한 눈에 난 알아보는데  나와는 다른지 모르는 척 했는지  벌써 다 잊었는지   (내가 만약 다가가서 말을 했다면)  예전 그때처럼 나를 보고 웃어줬을까  (아직도 사랑한다 말을 했다면)  너도 내 맘처럼 나를 다시 사랑해줄까   (죽어있던 기억들이 살아 있나 봐)  (조금도 잊어내지 못한 건가 봐)  네가 걷는 소리 하나까지 기억하나 봐   (날 몰라 보는건지 스쳐 지나가)  내 얼굴을 가린 손 틈새로 너를 보다가  (행복했던 추억들이 자꾸 생각나)   (죽어있던 기억들이 살아 있나 봐)  (조금도 잊어내지 못한 건가 봐)  네가 걷는 소리 하나까지 기억하나 봐   (날 몰라 보는건지 스쳐 지나가)  내 얼굴을 가린 손 틈새로 너를 보다가  (행복했던 추억들이 자꾸 생각나)   이름 부르길 바랬나봐 -
2005.09.12~09.18,36,864433,Girls On Top,보아(BoA),Girls On Top,2005.06.24,Dance,유영진,모든게 나에게 여자가  여자다운 것을 강요해  날 바라보는 네 야릇한  시선들이 난 싫어  약한 여자 사랑에 약한 여자 Whoo  내게 강요하지 마  틀에 갇혀버릴 내가 아닌 걸  내 뜻대로  전부 나의 뜻대로  나는 나인걸 누구도 대신 하지 말아  그렇게 만만하게 넘어갈  내가 아니야  내 모습 그대로 당당하고 싶어  그늘에 갇혀 사는 여자를   기대하진 마  섹시한 차분한 영원히  한 남자만 아는 따분함  그건 바로 착각 모든 남자들의 관심사 난 이 세상을 모두 바꿔버릴 꿈을 다 가진걸 Get it up 난 부족해 Get it up 모든 게 다 말이 되지 않잖아 그들만의 평등 같은 건 그대들이 만든 기준에 맞게 나는 나인걸 누구도 대신 하지 말아 그렇게 만만하게 넘어갈 내가 아니야 내 모습 그대로 당당하고 싶어 그늘에 갇혀 사는 여자를  기대하진 마 모든게 나에게 여자가 여자다운 것을 강요해 더 이상은 참지 말아 Shake it Everything I like that 마음을 더 열어봐 우린 같은 곳을 향해가잖아 모두 함께 영원할텐데 서로 다른 성일뿐 존재하기 위한  인간인걸 Why 이젠 부정하지 마 남자들 모두가 세상의 진리는 절대로 불변의 법칙이라고 이 칼을 잡은 난 세상의 지배자 힘의 논리 남자만의 법칙들 아주 웃기시네 Blurr Blurr Blurr Blurr Do you need money I Pay you 돈에 눈이 멀어 자존심을 사는 남자 그대 이젠 맞이해라 Dooms and a Dooms 자 이제 보아 얘길 담아 듣자 새 시대 Story Girls on Top 이 세상의 반 그건 여자들이  만들거야 Go baby Girl Rise up Throw your hands up Do you like that 당당하게 난 멀리 앞을 향해  걸어갈래 Go baby Go baby 나는 나인걸 누구도 대신 하지 말아 그렇게 만만하게 넘어갈 내가 아니야 내 모습 그대로 당당하고 싶어 그늘에 갇혀 사는 여자를  기대하진 마
2005.09.12~09.18,37,884620,내 사랑 송이 (Feat. 원우),클론,Victory,2005.07.08,Dance,김창환,널 보면 내 맘이 아파   항상 나를 보며 웃어주는 너   내 사랑 다 줘도 모자란데   아직도 널 힘들게 해   너의 눈가에 맺혀진   그 눈물을 말없이 바라보면서   아무런 위로도 할 수 없던   내 마음이 너무도 아파서   그저 너의 어깨를 두드리며   힘내라는 말을 네게 했지만   되려 나를 보며 웃어주던   그 눈빛이 고마워서 울었어   내 곁에 있어줘 난 말할   수 없었지   널 볼 수 없는 단 일초도   난 불안해 하면서   저 문이 열리고 또 니가   들어올 때   너 어디 갔다 왔냐면서   난 화를 냈었지만   널 보면 내 맘이 아파   항상 나를 보며 웃어 주는 너   내 사랑 다 줘도 모자란데  때론 널 힘들게 하고   언제나 내 곁에 있어   오직 나를 위해 살아가는 너   사랑이 너무도 힘들까봐   고맙다는 말도 못해   항상 하나뿐인 친구라며   우정마저 네게 모두 맡긴 채   가끔 바쁘다는 핑계로  난 너희들을 잊고 살아 가지만   니가 곁에 있어 웃고 있는   원래의 그 모습을 볼 때면   너에 위대한 그 사랑 앞에  나도 몰래 고개를 숙이지   넌 항상 날 위해 내 손발이   돼주고   넌 언제나 나의 뒤에서   내 그림자를 밟지   사랑이란 벌로 난 너를   가둬둔 채   난 한번도 네게 고맙다는   말조차 못했어   널 보면 내 맘이 아파   항상 나를 보며 웃어주는 너   내 사랑 다 줘도 모자란데   때론 널 힘들게 하고   언제나 내 곁에 있어   오직 나를 위해 살아가는 너   사랑이 너무도 힘들까봐   고맙다는 말도 못해   사랑한다 송이야   이젠 점점 익숙해져 가는 너희들의 생활을 보면서 이젠 종종 아무렇지 않게 너희들을 만나곤 하지만 가끔 헤어질때 돌아서는 너희들의 모습을 보면서 니가 너무나도 고마워서 나도 몰래 눈물을 삼키지 말없이 혼자서 넌 눈물을 닦았지 그런 니 모습을 볼까봐 넌 화장을 고치고 아무일 없는듯 넌 날보며 웃지만 너에게 짐이 되어 버린 내 맘이 아팠지 널 보면 내맘이 아파 항상 나를 보며 웃어주는 너 내 사랑 다 줘도 모자란데 때론 널 힘들게하고 언제나 내 곁에 있어 오직 나를 위해 살아가는 너 사랑이 너무도 힘들까봐 고맙다는 말도 못해 널 보면 내 맘이 아파 항상 나를 보며 웃어주는 너 내사랑 다줘도 모자란데 때론 널 힘들게하고 언제나 내곁에 있어 오직 나를 위해 살아가는 너 사랑이 너무도 힘들까봐 고맙다는 말도 못해
2005.09.12~09.18,38,889545,오늘밤 일,아이비,My Sweet And Free Day,2005.07.19,Dance,J.Y.Park,오 자꾸 눈이 마주쳤어 피하려 했지만 늦었어 이미 벌써 음 서로 바라보고 있었어 눈이 맞아 버렸어 오 이미 늦어 버렸어 마음속엔 해선 안 될 생각들이 계속 떠오르고 살며시 자리를 뜨는 너를 나도 모르게 따라가고 있어 오늘밤 일을 절대로 입 밖에 내선 안돼 어서 약속해 그럼 날 다시 볼 수 있어 내 남자 귀에 절대로 들어가는 일이 없게 혼자 간직해 그것만 지키면 돼 방 안을 들어서는 내게 기다렸다는 듯이 나의 입술을 두 손을 너의 그 숨소리와 함께 오 나도 모르게 나의 품에 널 꽉 안고 있었어 마음속엔 해선 안 될 일을 하고 있는 걸 알지만 나를 끄는 너무나 큰 힘을 거부할 수가 없었어 오늘밤 일을 절대로 입 밖에 내선 안돼 어서 약속해 그럼 날 다시 볼 수 있어 내 남자 귀에 절대로 들어가는 일이 없게 혼자 간직해 그것만 지키면 돼 오늘밤 일을 절대로 입 밖에 내선 안돼 어서 약속해 그럼 날 다시 볼 수 있어 내 남자 귀에 절대로 들어가는 일이 없게 혼자 간직해 그것만 지키면 돼  It's secret You must keep it 이미 떨어져 버린 꽃잎 꽃은 모르지 안 보는 뒤에서 떨어진 꽃잎이 무슨 짓을 한지 떨어진 꽃잎을 매일 밤 다른 꽃을 피워 니가 깊이 잠을 자고 있을 때 걔는 잠에서 깨어 물을 뿌리고 다른 싹을 틔워 오늘밤 일을 절대로 입 밖에 내선 안돼 어서 약속해 그럼 날 다시 볼 수 있어 내 남자 귀에 절대로 들어가는 일이 없게 혼자 간직해 그것만 지키면 돼 오늘밤 일을 절대로 입 밖에 내선 안돼 어서 약속해 그럼 날 다시 볼 수 있어 내 남자 귀에 절대로 들어가는 일이 없게 혼자 간직해 그것만 지키면 돼
2005.09.12~09.18,39,882495,이여름  Summer,쿨(COOL),Forever,2005.07.15,Dance,이승호,너무나 소중했던 사랑이  뜨거운 태양아래서  까맣게 나를 태우고 떠나가 버렸어   마지막 사랑이길 바랬어  하지만 험한 이 세상  그렇게 약해 빠진 널  어떻게 믿고 살겠어    이거 왜이래 잘못봤어  깡으로만 살아온 나  여자 하나쯤 하고 까불다  큰 코 다쳤어    이 여름 Summer  너 없이 안되겠어 never  너무나 보고 싶어 니가  다시 내게 빨리 돌아와  이젠 나 끝내 널 찾고 말겠어  다시 내곁에 너를두고  우린 영원히 아름다운 사랑하겠어 오~    이 여름 Summer  어디에 있는거니 My Love  사랑이 뭔지 이제야  좀 알 것 같은데    나 없이 안되는 걸 몰라  얼마나 보고픈걸 몰라  눈물로 사랑했던 나를 떠나게 한거니    헐겁던 허리살은 악착같이 조였니  텅비어 가벼웠던 머리속은 뭘 채웠니  아직도 어머니가 식충이라 부르니  서랍 속 성인전용 DVD는 갖다줬니   어떻게 해야 할지 몰랐어  어디를 가야 찾을지  무엇을 해야 그녀가 다시 돌아올지   그래서 매일 편질 보냈어  만화책 대신 신문을  드라마 대신 뉴스를  조금씩 힘든 숙제를   이거 왜 이래 심하잖아  내색하진 않았지만 어떡하겠어  죽기 아니면 까무라치기    이 여름 Summer  너 없인 안되겠어 never  너무나 보고 싶어 니가  다시 내게 빨리 돌아와  이젠 나 끝내 널 찾고 말겠어  다시 내곁에 너를 두고  우린 영원히 아름다운 사랑하겠어 오~    이 여름 Summer  어디에 있는거니 My Love  사랑이 뭔지 이제야 좀 알 것 같은데   나도 너 없인 살 수 없어  니 얼굴 너무 보고싶어  이젠 널 눈물없이 사랑할수 있을거야    이 여름 Summer
2005.09.12~09.18,40,860577,보통여자,린,One And Only Feeling,2005.06.16,R&B / Soul,린,잊은 거니 정말 다 잊은거니  난 모든게 그대론데  아직도 널 찾아 헤매이는데  어디에 있는거니 대답해줘  한번만 더 나를 꼭 안아줘  너만 사랑해 눈이 멀어버려 볼 수 없는데  이제는 끝나버린 이야기로  덮어두긴 너무도 아파 이러는가봐  너를 못 잊고 찾고 있나봐  지운거니 정말 다 지운거니  우린 아직 못해본게  너무 많아 견딜 수 없는데  그 많은 약속들은 어떡하니  한번만 더 내게 기회를 줘  우리 사랑을 어떻게 버리니  난 안되는데 내게는 널 추억할 사진 한 장  없다는게 너무도 아파 이러는가봐  너를 못 잊고 찾고 있나봐  그래 어쩔 수 없는가봐 나도 보통 여자 인가봐  이별에 담담할 수 있을거라 살아왔는데  아닌가봐 너를 눈물로 붙잡고 싶어  되돌려줘 내 사랑을 너 없이는 살 수가 없는데  어떡하라고 난 어떡하라고  내게 이러니 이제는 끝나버린 이야기로  덮어두긴 너무도 아파 이러는가봐  너를 못잊고 찾고 있나봐
2005.09.12~09.18,41,863579,못다핀 꽃 한송이,마야,소녀시대,2005.06.29,Rock,,언제 가셨는데 안 오시나  한 잎 두고 가신 님아  가지 위에 눈물 적셔놓고  이는 바람소리 남겨놓고    앙상한 가지 위에  그 잎새는 한 잎  달빛마저 구름에 가려  외로움만 더해가네    밤새 새소리에 지쳐버린  한 잎마저 떨어지려나  먼 곳에 계셨어도 피우리라  못다 핀 꽃 한 송이 피우리라    언제 가셨는데 안 오시나  가시다가 잊으셨나  고운 꽃잎 비로 적셔놓고  긴긴 찬바람에 어이하리    앙상한 가지 위에  흐느끼는 잎새  꽃 한 송이 피우려 홀로  안타까워 떨고 있나    함께 울어주던 새도 지쳐  어디론가 떠나간 뒤  님 떠난 그 자리에 두고 두고  못다 핀 꽃 한 송이 피우리라    언제 가셨는데 안 오시나  한 잎 두고 가신 님아    밤새 새 소리에 지쳐버린  한 잎마저 떨어지려나  먼 곳에 계셨어도 피우리라  못다 핀 꽃 한 송이 피우리라
2005.09.12~09.18,42,845591,홈런 (Feat. 옥주현),MC몽,His Story,2005.05.13,Rap / Hip-hop,MC몽,"이젠 울지마 항상 그대만을 바라볼께  따뜻한 손길로 감싸줄께 두 눈을 감고  make a for from me I still promise you  좀 더 멋지게 매우 폼나게  널 위해 그라운드를 달릴께  아직은 후보 타자 홈 조차  밟지 못한 새내기 골 보이  세상이 날 버렸어 원망하며  나 홀로 울 때 힘들 때  내 옆에 너의 따뜻한 손길을 난 기억해  아무것도 가진 건 없어도  I'm the boo or maybe in the boo  널 만나는 순간이 지루함의  흘러가는 연속이라도  나를 보고 바보라고 사람들이 놀려대  우리 만남을 무시해  괜찮아 난 너만 있으면 돼  운동을 못해도 니 사랑을 가진것이  내 인생의 홈런이야  얼굴은 못 생기고 가진 건 없어도  니가 있단 자체가 홈런이야  운동을 못해도 니 사랑을 가진것이 내 인생의 홈런이야  얼굴은 못생기고 가진 건 없어도  니가 있단 자체가 홈런이야  이젠 울지마 항상 그대만을 바라볼께  따뜻한 손길로 감싸줄께 두 눈을 감고  make a for from me I still promise you  넌 나의 영원한 파트너  늘 주머니 속에 넣고 싶은 너  나로 인해 울 때가 더 많은 너  나 같은 놈 만나기엔 아까운 너  Got to know You got to know that  너 없인 하루도 살 수 없다는 걸  알아야 돼 Come to my day  넌 내게 살아있는 또 하나의 미래 그녀에게 몸을 던져  내 사랑은 스트라이크  너에게만큼은 당당한 터프가이  That's Right 너로 인해 아름다운  Feel Alright (Let's go tonight)  작은 마음을 모아 두 손을 감아  우리 아직 사랑에 목 말라 갈 길이 많아  너를 사랑하는 마음은 하나  이젠 울지마 항상 그대만을 바라볼께  따뜻한 손길로 감싸줄께 두 눈을 감고  make a for from me I still promise you  눈 딱 감고 날 믿어 볼래?  Oh,I promise you 내 사랑 Baby  눈 딱 감고 날 믿어 볼래?  You are the only one baby  눈 딱 감고 날 믿어 볼래?  널 위해 만든 내 사랑의 노래  눈 딱 감고 날 믿어 볼래?  Making me a crazy  눈 딱 감고 날 믿어 볼래?  Oh,I promise you 내 사랑 Baby  눈 딱 감고 날 믿어 볼래?  You are the only one baby  눈 딱 감고 날 믿어 볼래?  널 위해 만든 내 사랑의 노래  눈 딱 감고 날 믿어 볼래?  눈 딱 감고 날 믿어 볼래?"
2005.09.12~09.18,43,848804,나비무덤,테이크(TAKE),To Girl,2005.05.27,Ballad,최태규,standing beside you as sleep  wipe my tears as I close the door  불러도 대답이 없어요 제발 날 불러봐요    아무말도 안할거란걸 알아  그렇게 못할 것도 알아  하지만 너 무슨말을 할까봐  조용히 귀를 열고서  아직 너의 집을 서성거리죠    아마도 예전처럼 날보며 웃을 니 생각에  자꾸 잊게 되어가는나    나는 너를 못봐도 난 너와 아직 있는데  매일 니생각 날때면 이렇게  난 니앞에 앉아 있어  세월 흘러가면서 나 자꾸 지워지겠지  이젠 더 이상 버티기 힘들어  너를 잊는 나를 용서해    내 눈물도 말라 가겠죠 이젠  더 이상 흐르지도 않죠  하지만 더 깊어가는 숨소리  내곁에 멈춰 잠들어 하루종일 너를 찾게 되는걸    아마도 예전처럼 너 따뜻하진 않겠지만  그건 나의 운명이니까    나는 너를 못봐도 나 항상 여기있는데  매일 니생각 날때면 이렇게  난 니앞에 앉아 있어  세월 흘러가면서 난 자꾸 지워가겠지  이젠 더 이상 버티기 힘들어  너를 잊는 나를 용서해    너를 이렇게 안아봐도 난 아무 느낌 없어  이젠 너 없는건지 왜 그걸 모르니 넌 이미 여기엔 없는데  하늘이 갈라놓은 너와의 이별을  돌릴순 없어 나 잊혀진 추억에 널 남겨둘게    나는 너를 못봐도 나 항상 여기있는데  매일 니생각 날때면 이렇게  난 니앞에 앉아 있어  세월 흘러가면서 난 자꾸 지워가겠지  이젠 더 이상 버티기 힘들어  너를 잊는 나를 용서해    standing beside you as sleep  wipe my tears as I close the door  언제나 니곁에 있을게    standing beside you as sleep  wipe my tears as I close the doorwipe my tears as I close the door
2005.09.12~09.18,44,847126,여자,빅마마,It`s Unique,2005.05.18,R&B / Soul,최갑원,내겐 힘이 들었어 다시 살아가는 일  아프고 슬픈 이별에 데이고 다쳐서 우-  너무 하고 싶었어 다시 사랑하는 일  여리고 지친 내맘을 기댈 자리를 찾는  여자 이니까 -  나를 사랑한다면 아무것도 바라지 않아  손을 대면 차가운 내 가슴 안아주면되  깊게 새긴 이별도 바보 처럼 벌써 잊은 거냐고  그런 말은 내게 묻지 말아줘   잊어내고 싶었어 버림받은 상처는  사랑을 도려내버린 텅빈 마음을  이젠 메워 보려고   나를 사랑한다면 아무것도 바라지 않아  손을 대면 차가운 내가슴 안아주면되  깊게 새긴 이별도 바보처럼 벌써 잊은거냐고  그런 말은 내게 묻지 말아줘  삼켜버린 눈물이 혹시라도  입에 가득고여 새버릴까봐   나를 사랑해도 되냐고  묻고 또 물어도 대답은 못하지만  나를 사랑한다면 아무것도 바라지 않아  손을 대면 차가운 내 가슴 안아주면되  깊게 새긴 이별도 바보처럼 벌써 잊은 거냐고  그런말은 내게 묻지말아줘   이제 나는 괜찮아 누구라도 나는 괜찮아  버릇처럼 흘리는 내눈물 가려주면되  쉽게 사랑한다고 그러다가 나만 다칠꺼라고  그런말은 내게 하지말아줘 -
2005.09.12~09.18,45,837567,사랑했나봐,윤도현,Difference,2005.04.29,Rock,전해성,이별은 만남보다 참 쉬운 건가봐  차갑기만 한 사람  내 맘 다 가져간걸 왜 알지 못하나  보고싶은 그 사람   사랑했나봐 잊을 수 없나봐  자꾸 생각나 견딜수가 없어  후회하나봐 널 기다리나봐  또 나도 몰래 가슴 설레어와  저기 널 닮은 뒷 모습에   기억은 계절따라 흩어져 가겠지  차갑기만 한 사람  빈 가슴 애태우며 난 기다리겠지  어설픈 내 사랑은   사랑했나봐 잊을수 없나봐  자꾸 생각나 견딜 수 가 없어  후회 하나봐 널 기다리나봐  또 나도 몰래 가슴 설레어와  저기 널 닮은 뒷 모습에   기억은 계절따라 흩어져 가겠지  차갑기만 한 사람  빈 가슴 애태우며 난 기다리겠지  어설픈 내 사랑은   못되게 눈 돌리며 외면한  니 모습 모른 척 할래  한번쯤은 날 뒤돌아 보며  아파했다 믿을래   바보인가봐 한마디 못하는  잘 지내냐는 그 쉬운 인사도  행복한가봐 여전한 미소는  자꾸만 날 작아지게 만들어  멀어지는 니 모습처럼   언젠가 다른사람 만나게 되겠지  널 닮은 미소짓는  하지만 그 사람은 니가 아니라서  왠지 슬플 것 같아  잊을 수 없는 사람 -
