time,rank,song_id,title,singers,album,date,genre,creator,lyric
2007.03.05~03.11,1,1563237,미인 (美人),이기찬,Para Ti,2007.02.02,Ballad,안영민,헤어질 때 늘 하던 짧은인사가  오늘따라 왜 이렇게 서글픈거니  눈물이 두 뺨 위로 흘러내릴때  그때서야 이별인 줄 알았어요    제발 가지 말라고 차갑게 떠나지 말라고  가슴 아프도록 외쳐보지만  너는 떠나간다고 나의 손을 놓는다고  나를두고 돌아서 버린 너    다시 사랑한다 해도 다른 누군갈 만나도  나는 너와 같은 사람 다신 만나진 못해  백 번 천 번을 말해도 울며 다짐을 해봐도  떠나가는 네 얼굴 보고싶은..  내가 정말 싫어    모두 꿈일꺼라고 깨면 다 돌아올꺼라고  아픈 마음을 위로해보지만  점점 멀어져가는 너의 모습을 보면서  울고있는 내가 다 가여워    다시 사랑한다해도  다른 누군가를 만나도  나는 너와 같은 사람 다신 만나지 못해.  백번 천번을 말해도 울며 다짐을 해봐도  떠나가는 네 얼굴 보고싶은 내가 싫어.    정말 사랑했었다면  나를 사랑했었다면  가는 길에서라도 한번쯤은 돌아봐줘    이거 하나만 알고 가  이 말 하나만 듣고 가  나보다 더 좋은 사람 만나도  날 잊으면 안돼..
2007.03.05~03.11,2,1569649,유혹의 소나타,아이비,A Sweet Moment,2007.02.12,Dance,휘성(Realslow),내 손만 잡으려말고 날 안아봐   두 눈 다 꼭 감은채로 느낌을 봐   가슴이 참 복잡할 땐 날 바라봐   난 널 유혹하는 거란다   손발을 Do It 단 둘이 둘이   이 밤을 Take It   달빛을 켜서 네 맘을 비춰 자   내게 보여줘   한순간 숨 막힐 듯한 네 표정과   한숨만 푹 쉬고 마는 입술을 봐   겁먹기 딱 편한 매력 난 있지만   다 널 유혹 하는 거란다   손발을 Do It 단 둘이 둘이   이 밤을 Take It   달빛을 켜서 네 맘을 비춰 자   내게 보여줘   Baby U Don't Have To Worry   Everything's Alright   손발을 Do It 단 둘이 둘이   이 밤을 Take It   One One n Two   이제부터 우리 둘 의 시간   Three n Four 아직 밤은 깊어   Five n Six 나를 가져가게 놔둘 시간   Seven Tonight Gotta Make up   Ur Mind   I GOTTA Do It So pretty pretty   I'm Gonna Make It   온몸을 던져 진하게 Touch YA   유혹의 SONATA   Baby U Don't Have To Worry   Everything's Alright   손발을 Do IT 단 둘이 둘이   이 밤을 Take It   어쩜 이런 기회를 잡고 나를   만나러 왔니   어떤 이도 찾지 못하게 숨겨온   내 사랑   더 빨리 Do IT 단 둘이 둘이   눈길을 Take It   두 손을 펴서 두 팔을 벌려 자   나를 감싸줘   손발을 Do It 단 둘이 둘이  이 밤을 Take It  달빛을 켜서 네 맘을 비춰 자  내게 보여줘  Baby U Don't Have To Worry  Everything's Alright  선택은 빨리 한 순간 뿐인  기회는 지금 YO
2007.03.05~03.11,3,1568562,같은 베개...,테이,애인,2007.02.09,Ballad,조은희,하룻밤 자고나면 괜찮을거라 그 밤이 어느새 천번째 밤이야 니가 떠난 그 날부터 매일밤 나를 위로해 줬던건 언젠가 니가 내게 사준 베개야 한시도 떨어져 살수가 없을때 서로같은 베개위에서라도 꼭 잠들자고 약속했었던 똑같은 베개 베고서 잠이들면 어디서든 함께있는 거라던 꿈속에서도 헤어지지 말자던 그런 니가 너무 그리워 잠들때까지 전화기를 붙잡고 사랑한다는말 지겹게 나누고 두 베개가 하나되는 그 날을 그리며 행복했던날 이제는 그 베개를 끌어 안고서 눈물을 흘리고 후회를 흘리고 너에게 다 미쳐주지 못했었던 나의 마음을 또 흘리지 똑같은 베개 베고서 잠이 들면 어디서든 함께 있는 거라던 꿈속에서도 헤어지지 말자던 그런 니가 너무 그리워 언젠가 잊혀질 날이 올 것 같아서 슬픔도 멈출날 올 것 같아서 외려 두려워 시간이 내 맘까지 앗아갈까 아직도 너만 꿈꾸고 있는 바보 이런 나도 잠들날이 올까봐 똑같은 베개 베고서 잠이들면 어디서든 함께 있는거라던 꿈속에서도 헤어지지 말자던 그런 니가 너무 그리워 사랑이 눕던 그 곳에 그 자리위에 영원토록 이거릴 또 누워도 너와 똑같은 추억 하나 가진 날 그래도 너라서 고마워
2007.03.05~03.11,4,1575129,수취인 불명,프리스타일,수취인불명,2007.02.22,Rap / Hip-hop,미노(프리스타일),안돼겠지 이젠  잘지내니 나는 요즘 그냥 그렇게 살어 예전보다 살만한데 맘은 그렇지 않아 안본지 오래됐어 요즘에 너는 어때 나같은거 이제는 별로 관심없겠지만 그건좀 어때 예전에 달고 살던 기침은 약좀 잘 챙겨먹어 고집부리지말구 감기라도 걸리면 넌 무척오래 가잖아 따뜻하게 좀 입고 다녀 멋부리지말고 요즘들어서 친구들이 내게 자꾸 말해 사랑은 다른 사랑으로 잊어버리라고 안쓰러운 눈빛으로 나를 보며말해 머리가 멍해지고 말라가는 병에 걸렸다고 길을걷다 멈춰서 한숨만 쉴꺼라고 이름을 불러도 잘 듣지 못할꺼라고 눈만 뜨고 있지 사는게 아니라고 당분간 그 심장은 잠시 멈출꺼라고 왜 이런거죠 내가 왜 이런거죠 아무렇지 않은데 왜 내가 힘들까요 내가 아픈가요 많이 아픈가요 난 아무렇지않죠 정말 아무렇지않죠 모든게  그래 니가 오늘하루 아무런일도없듯 나역시 오늘하루도 보통으로 살어 그런데 사람들이 나를 보며 말해 그러다 죽겠다고 이젠 좀 잊으라고 내색조차 안하려고 정말 애쓰는데 결국 아무리 숨겨봐도 나는 역시 안돼 그렇지 내가 하는 일이 다 그렇지 뭐 사랑하는 사람조차 볼수없으니까 오랜만에 니 생각나 편지한통 썼는데 그런데 마땅하게 어디로 보낼곳이 없어 사실은 나 미치도록 니가 보고싶고 많이 아파 너무도 힘들다고 말하려고했어 내가 지금 뭐를 어찌해야할지 어떻게 시작할지 너에게 물어보려했어 정말 뭐가 뭔지 대체 정말 뭐가 뭔지 나는 어떻게 너 없인 아무것도 못해 왜 이런거죠 내가 왜 이런거죠 아무렇지 않은데 왜 내가 힘들까요 내가 아픈가요 많이 아픈가요 난 아무렇지않죠 정말 아무렇지않죠 모든게 왜 이렇게 살아가는지 이렇게 힘든지 왜이렇게 된거죠 아무일도 없던것처럼 난 웃고 지내요 정말 아무렇지도않게 근데 왜 이런거죠 내가 왜 이럴까요 아무렇지않은데 왜 내가 힘들까요 내가 아픈가요 많이 아픈가요 난 아무렇지않죠 정말 아무렇지않죠 모든게 근데 왜 자꾸만
2007.03.05~03.11,5,1579229,왼쪽가슴,케이윌,왼쪽 가슴,2007.03.06,Ballad,박진영,그렇게 쉬울 줄 몰랐죠 나를 잊을 줄은 알았지만 그렇게 빠를 줄 몰랐죠 다른 사람 생길 줄 알았지만 나밖에 나 밖엔 안 된다며 울던 그대 곁에 어떻게 다른 사람이 있죠 왼쪽 가슴이 너무 아파 뭔가 누르는 것만 같아 하루 종일 숨을 쉴 때마다 니 생각이 떠오르거나 니 소식이 들릴 때마다 몇 달째 이렇게 계속 아파 잘한 일이라고 몇 번을 다짐해봐도  어떻게 웃을 수가 있죠 아직도 난 숨도 못 쉬는데 어떻게 행복할 수 있죠 모든게 난 어색하기만 한데 나 없이 나 없인 못 산다며 울던 그대 눈이 어떻게 다른 사람을 보죠 왼쪽 가슴이 너무 아파 뭔가 누르는 것만 같아 하루 종일 숨을 쉴 때마다 니 생각이 떠오르거나 니 소식이 들릴 때마다 몇 달째 이렇게 계속 아파 잘한 일이라고 몇 번을 다짐해봐도 다짐해봐도 다짐해봐도 하고 또 해봐도 넌 내 여자 같아 아직도 넌 내 여자 같아 어떻게 널 보내란 말이야 왼쪽 가슴이 너무 아파 뭔가 누르는 것만 같아 하루 종일 숨을 쉴 때마다 니 생각이 떠오르거나 니 소식이 들릴 때마다 몇 달째 이렇게 계속 아파 잘한 일이라고 몇 번을 다짐해봐도
2007.03.05~03.11,6,1558954,미워요,씨야,All Star,2007.01.29,Ballad,안영민,평생을 나만  사랑한다고 해놓고  평생을 나만  바라본다고 해놓고  나 그댈 이토록  사랑하게 해놓고  안녕이란 말도 없이  떠나간 그대가 미워요  마음이 약해서  그댈 붙잡지도 못하고  못난 정 때문에 잊지도 못하고  사랑한다고 하더니  나를 떠나가버린 그 사람  지켜준다고 약속하더니  나를 울리고 떠난 그 사람  오 바람아 불어라  그리운 이 내 마음  전해지도록  내 님이 있는 곳  너는 알고 있잖아    사랑이 사랑을  잊혀지게 한다는 그 말  아무리 되내어도 그리움만 차  사랑한다고 하더니  나를 떠나가버린 그 사람  지켜준다고 약속하더니  나를 울리고 떠난 그 사람  오 바람아 불어라  그리운 이 내 마음  전해지도록  내 님이 있는 곳  너는 알고 있잖아  그래도 사랑했던 사람  내게는 다정했던 사람  이제 잊어야 하겠지  사랑아 사랑아  너 없이 나 어떻게 살라고  못난 내 사랑아  이제는 내가 널 보내줄께  오 세월아 흘러라  사랑한 추억 모두 잊혀지도록  그리운 내 님이  생각나지 않도록  여자의 가슴에  사랑만 남겨놓고 떠난 사람아  미워요 그 사람  내가 사랑했던 사람
2007.03.05~03.11,7,1581597,톡!톡!톡! (Toc Toc Toc)(CF - 투싼 `이효리`편),이효리,Toc Toc Toc (Single),2007.02.27,Dance,,Yeah turn the Lights off   get you’re freak on mami   It’s time for U to shake   that mami   Girl U know da deal   So u better teach’em   somthin’ talk to them   아슬아슬 훔쳐보는 니 시선이   느껴지지   살금살금 다가오는 니 숨소리   들려 오지   내 방 앞에 멈춰 있는 발걸음이   느껴질 때   두근두근 설레이는 내가슴은   Hot in here   살며시 단 둘이 단 둘이 놀아   아무도 모르게   이제 널 초대해 Come on Come on   이 밤의 fantasy   내게 노크를 해줘 Baby Toc   Toc Toc   나의 마음을 열어줘 Honey 꼭꼭꼭   오늘밤 우린 Crazy 오늘 난   너의 Lady   불같은 느낌은 On n On n   On n On  빗물처럼 촉촉하게 내 입술이  젖어 들지   바람처럼 나른하게 네 숨결이   불어오지   머리부터 발끝까지 네 손길이   스쳐질 때   태양처럼 달아오른 이 시간은   Hot in here   살며시 단 둘이 단 둘이 놀아   아무도 모르게   이제 널 초대해 Come on   Come on   이 밤의 fantasy   내게 노크를 해줘 Baby Toc   Toc Toc   나의 맘을 열어줘 Honey 꼭꼭꼭   오늘밤 우린 Crazy 오늘   난 너의 Lady   불같은 느낌은 On n On n   On n On   너의 그 부드러운 touch는   마치 티슈   나를 불태우며 녹여 니   뜨거운 키스   내게 전해져 니 맘이 On   and On   나 또한 원해 널 너처럼   원해 Girl   오늘밤 나는 너의 All night love   너를 흠뻑 적셔줄께 소나기처럼   So follow me mam 어서   니 옷을 벗어   여기는 할로윈 파티도 아닐   뿐더러 더워   내게 노크를 해줘 Baby   Toc Toc Toc   나의 맘을 열어줘 Honey 꼭꼭꼭   오늘밤 우린 Crazy 오늘   난 너의 Lady   불같은 느낌은 On n On n   On n On   다시 노크를 해줘 Baby Toc   Toc Toc   나의 문을 열어줘 Honey 꼭꼭꼭  어두운 별빛 아래 비밀스런 밤에   매일 밤 너와 나 On n On n   On n On  Hey U lady lady Don’t stop   Shake it baby KK   Make it crazy Let’s take it   to the Top   We won’t stop  Hey U lady lady Don’t stop  Shake it baby KK  Make it crazy Let’s take it  to the Top  We won’t stop
2007.03.05~03.11,8,1560045,추억은 사랑을 닮아,박효신,The Breeze Of Sea,2007.01.29,Ballad,"박효신,김태윤",그대가 부네요 내 가슴 안에 그대라는 바람이 언제나 내게 그랬듯이 내 맘 흔들어 놓고 추억이란 흔적만 남기고 달아나죠 난 길을 잃었죠 늘 그대라는 사람만 보다가 단 한 번 의심하지 않고 여기까지 왔는데 그대 없는 낯설은 길 위에 남아있죠 가져 가세요 좋은 기억마저도 그대가 없이는 내겐 짐만 될텐데 자꾸 꺼내보면 그리움만 커져서 다시 돌아가는 길 발걸음 또 멈추게 하죠 추억은 사랑을 닮아 난 자꾸 돌아보겠죠 그곳엔 아직도 그대가 있어서 그래서 아픈가봐요 한 번쯤 꼭 한 번쯤은 그대도 날 볼까봐 오늘도 기다려요 나 이제 어쩌죠 아무리 그댈 달아나려 해봐도 한뼘도 멀어지지 못해 매일 같은 자리에 매일 같은 무게로 하루를 살아가죠 어딜 보아도 온통 그대 뿐이죠 날 보던 눈빛이 자꾸 맘에 걸려서 다시 눈을 감고 그댈 지우려하면 굳게 다문 입술이 떨려와 참았던 눈물이 흐르죠 추억은 사랑을 닮아 난 자꾸 돌아보겠죠 그곳에 아직도 그대가 있어서 그래서 아픈가봐요 한 번쯤 꼭 한 번쯤은 그대도 날 볼까봐 오늘도 기다려요 어느 날 뒤돌아보다 그대가 나를 본다면 난 어떻게 하죠 아무말 못하는 나를 잘 알잖아요 추억은 바람을 타고 언젠가 흩어질텐데 울어도 소리쳐봐도 모른 척 버리려해도 잊지 못할 그 사람 오늘도 기다려요 나를 잘 알잖아요
2007.03.05~03.11,9,1580618,비행소녀,마골피,비행소녀,2007.03.25,Ballad,윤명선,활주로를 떠나  비행기는 이제  어둠속을 날아요  서울의 야경은  물감처럼 번져 가고  저기 어딘가에  내가 아는 사람  손 흔들고 있을까  마지막의 인사를 해요  내가 가는 길이  너무 나도 힘든  이별의 길이지만  후회하지 않고  웃으면서 떠나 갔죠  사실 울고 있죠  많이 울고 있죠  창피하게 말예요  어둠 속을 날아 가죠  안녕  기억 안녕  입술로 되내어 보네  사랑해  라는 단 한마디  안녕  추억 안녕  너무나 눈물이 나요  영원히  그댈  사랑해요  안녕    어둠속을 떠나  비행기는 이제  어딘가에 내려요  낯설은 도시는  사실 많이 두렵지만  저기 어딘가에  내가 아는 사람  손 흔들고 있을까  마지막의 인사를 해요  안녕  기억 안녕  입술로 되내어 보네  사랑해  라는 단 한마디  안녕  추억 안녕  너무나 눈물이 나요  영원히  그댈  사랑해요  안녕  기억 안녕  입술로 되내어 보네  사랑해  라는 단 한마디  안녕  추억 안녕  너무나 눈물이 나요  영원히  그댈  사랑해요    안녕
2007.03.05~03.11,10,1556547,Fan,에픽하이(EPIKHIGH),Remapping The Human Soul,2007.01.23,Rap / Hip-hop,"Tablo,미쓰라진",oh 가질수가 없어도  내 머릿속에 서라도  만질수가 없어도  그저 헛된 꿈이라도  말할수가 없어도  멀리서 숨어서라도  You know I do  널 사랑한다고  내가 누군지는 몰라도  Oh baby don't you know  내 이름도 모르죠  오늘도 밤새도록 맘 졸이고  그대 바라보고 있죠  Oh so beutiful  손에 쥔 당신의 독사진  세상의 환호성에 파묻힌  내 미친 사랑의 속삭임  듣고 있지도 않겠죠  난 죽어도 안되겠죠  그러겠죠 다음 세상에도  내가 누군지도 모르고 살겠죠  너무나도 그댈 가지고 싶어  난 돌이킬수가 없죠  오늘밤도 입을 맞추고 싶어  베개를 꽉 붙잡겠죠  오늘이 우리의 첫 만남이  맞는거겠죠  그런 문답은 언제나  당신만 하는 거겠죠  나는 그대 뒷모습에  오늘도 말을 걸겠죠  항상 같은건데도  떨림에 인사를 건네죠  이 세상의 모든 귀를 막아도  그대만은 내 말을 들어줘  멀어지는 그대 뒷모습에  굳어가는 날 흔들어줘  멀리서 저 멀리서 점이 되어가  어디에서 그댈 볼 수 있을까  말해줘  oh 가질수가 없어도  내 머릿속에 서라도  만질수가 없어도  그저 헛된 꿈이라도  말할수가 없어도  멀리서 숨어서라도  You know I do 널 사랑한다고  내가 누군지는 몰라도  내 머릿속에 서라도  만질수가 없어도  그저 헛된 꿈이라도  말할수가 없어도  멀리서 숨어서라도  You know I do 널 사랑한다고  내가 누군지는 몰라도  오늘은 왜 웃지 않고  있을까 그대 무슨 일인지  별일 아니었음 좋겠는데  시름이 가득한 그대 얼굴  난 볼 수 가 없는데  차라리 내가 아픈게 낫겠어  그럴 수 가 없는게  너무나도 안타까워  오늘 하루만은  날 반가워 잘있었죠  물어본다면  대답 할 수 있는 날 안아줘  닿지도 만질수도  안을수도 없는 그대여  오늘밤도 난 그댈 만나러 가요  내 꿈속에서  꿈속에서라도 모두가 말리고  내 사랑 비웃더라도  미쳤다고 모두가 말하고  온 세상 지우더라도  당신은 내껀데  보잘것 없는 시선들에게 뺏겨  왜 No 난 절대 못해  나만 바라보게 해줄께  모든걸 다 줄께 입맞출 때  세상을 다 가져다 줄께  절대 날 떠나가지 못하게  불이 꺼져버린  가슴에 가둘께  You are My star  I'm your no1 fan  baby please take my hand  oh 가질수가 없어도  내 머릿속에 서라도  만질수가 없어도  그저 헛된 꿈이라도  말할수가 없어도  멀리서 숨어서라도  You know I do  널 사랑한다고  내가 누군지는 몰라도  내 머릿속에 서라도  만질수가 없어도  그저 헛된 꿈이라도  말할수가 없어도  멀리서 숨어서라도  You know I do  널 사랑한다고  내가 누군지는 몰라도  oh 가질수가 없어도  내 머릿속에 서라도  만질수가 없어도  그저 헛된 꿈이라도  말할수가 없어도  멀리서 숨어서라도  You know I do  널 사랑한다고  내가 누군지는 몰라도  내 머릿속에 서라도  만질수가 없어도  그저 헛된 꿈이라도  말할수가 없어도  멀리서 숨어서라도  You know I do  널 사랑한다고  미친 사랑에 빠진  boy say girl say oh oh oh  바보같은 사랑에 빠진  boy say girl say oh oh oh  헛된 사랑에 빠진  boy say girl say oh oh oh  나같은 사랑에 빠진  boy say girl say oh oh oh  내가 누군지는 몰라도
2007.03.05~03.11,11,1575512,잊었니...,윤미래,t 3 YOONMIRAE,2007.02.23,R&B / Soul,,진실은 거짓이 되고 술은 눈물과 섞여 쓰라린 내 맘 속을 태워 내려가네 여전히 니 품 안에 웃던 그 날 그 날에 멈춰 미소 지어 보는 난 내일이 되면 꿈이라고 오늘도 애써 잠들려 난 눈을 감지만 눈물이 고인 내 가슴 속은 진실을 알려 잊었니 우린 사랑했잖니 나만 사랑한단 우리의 약속을 잊었니 우린 행복했잖니 너 없이 난 천천히 죽어가는데 넌 어딨니 거짓은 진실이 돼 술은 눈물과 섞여 내 맘속에 아픔을 불 질러 네게 기대려 해도 옆에 넌 있진 않지만 내일이 되면 넌 날 깨워주겠지 There's just no more U and Me 오늘도 널 기다리며 눈을 감지만 눈물에 잠긴 내 가슴 속은 거짓을 알려 잊었니 우린 사랑했잖니 나만 사랑한단 우리의 약속을 잊었니 우린 행복했잖니 너 없이 난 천천히 죽어가는데 잊었니 벌써 딴 사랑을 찾아 간 거니 넌 어떻게 나 없이 살아가 난 너 없이 살아지는데 내 영혼도 날 떠난대 해는 너무 빨리 떠 오지만 너는 오지 않아 돌아와 제발 우린 사랑했잖니 나만 사랑한단 우리의 약속을 잊었니 우린 행복했잖니 너 없이 난 천천히 죽어가는데 잊었니 우린 사랑했잖니 나만 사랑한단 우리의 약속을 잊었니 우린 행복했잖니 너 없이 난 천천히 죽어가는데 넌 어딨니
2007.03.05~03.11,12,1563629,남자야,먼데이키즈(MondayKiz),El Condor Pasa,2007.02.01,Ballad,"민영기,황성진",이미 다른 사람 곁에 니가 있는데 그의 손을 잡고 있는데 한 걸음도 못하고 늘 제자리인 걸 또 오늘도 하루 만큼 멀어지는 걸 내가 될 수 없는지 널 사랑할 사람 바보처럼 눈물로 삼켜보지만 가슴에 니가 꼭 꽂혀서 눈가에 니가 꼭 맺혀서 입가에 수없이 맴돈말 널 사랑 한다고 잊으려 발버둥쳐봐도 지우려 술에 늘 취해도 그리울 너잖아 찾아올 너잖아 시린 가슴 한숨에 털어내려해도 가슴 끝에 사는 한 사람 가끔 먼발치라도 한순간이라도 보고싶어 니가 있는 거릴 걷는데 내가 될 수 없는지 널 사랑할 사람 바보처럼 눈물로 삼켜보지만 가슴에 니가 꼭 꽂혀서 눈가에 니가 꼭 맺혀서 입가에 수없이 맴돈말 널 사랑한다고 잊으려 발버둥쳐봐도 지우려 술에 늘 취해도 그리울 너잖아 찾아올 너잖아  이런 나를 모르고 못난 날 버리고 그렇게 그에게 안겨서 살아가잖아 그 사람 자꾸만 미워서 내사랑 가진게 미워서 또다시 되돌려 달라고 말하고 싶지만 나보다 잘해줄 남자야 나보다 사랑할 남자야 부디 날 잊어줘 그렇게 살아줘
2007.03.05~03.11,13,1574696,하루살이,BMK,999.9,2007.03.01,Ballad,조은희,그리움은 부지런도 해 내가 눈을 뜨기만을 기다린듯 해 네가 변했는데 세상은 하나 변한 게 없어 변함없다는 게 나를 울게 해 난 이렇게 아픈데 못 잊겠어 오늘은 널 못 보내겠어 하루만 널 원 없이 그리다가 오늘까지 실컷 널 사랑하다 내일은 꼭 내일은 아주 널 잊겠다고 또 다짐하고 또 다짐을 해 할수록 더 느는 거짓말처럼 외로움이 두꺼워져서 단추 없는 맘을 여밀 수도 없게 해 너무 추운데도 안기고 싶은 가슴이 없어 나의 심장이 다 부르터가도 얼어붙어만 가도 못 잊겠어 오늘은 널 못 보내겠어 하루만 널 원 없이 그리다가  오늘까지 실컷 널 사랑하다 내일은 꼭 내일은 아주 널 잊겠다고 또 다짐하고 또 다짐을 해 할수록 더 느는 거짓말 처럼 온종일 널 잊자는 생각에 매달리고 매달리다 고단함에 잠드는 어쩌면 난 쓸쓸한 하루살이 같아 하루가 전부인 양 내 삶이 길어도 사랑은 항상 너일 테니까 오늘이 또 흘러가 다시 내일 되면 내일도 오늘일 뿐 널 백지처럼 지울 날은 끝내 안 올지 몰라 너를 알기 전으로 돌아가기 전에는 더 안 되는 일 난 못하는 일 못 잊어 널 못 잊어 난 못 잊어
2007.03.05~03.11,14,1566277,Irony (아이러니),원더걸스,The wonder begins,2007.02.13,Dance,박진영,자꾸 첨이란 말을 너무 많이해  이런 감정은 첨이라며 말을 하는게 이상해  난 다른 여자들과 다르다는게 좀 수상해  내가 아는 애만 해도 몇 명인데  그 여자들은 아무 의미도 없다는게 이상해  그동안 사귀었던 여잔 뭐였는데  말이 도무지 안되잖아    ***  남잔 다 믿어서는 안된다고 하면서  너만 다르다고 말하는 건 뭐야  Irony 말도 안 돼 x 3  말도 안 되는 말 정말  여잔 다 가지고 놀기만 했었다면서  나만 다르게 생각한단 건 뭐야  Irony 말도 안 돼 x 3  말도 안 되는 말 정말    다른 남자 애들 안 좋은 얘기를  자꾸 내게 자세히 말해 주는게 너무 이상해  니 친구들 안 좋은 얘길 왜 내게 계속 말해  너만 안 그렇단 말이 좀 이상해  니 친구들 모두 너와 함께 다니잖아 말이 돼  친구들 모두 다 그러고 있는데  너만 안그러고 있는게    *** 반복      너무 진실한 것처럼 말이지  너무 그러니까 이상한거지  말을 곧이 곧대로 듣지 못하고  자꾸 의심하게 돼 믿지 못하고  잠시 생각해보면 니가 뭣하러  그렇게까지 나에게 환심을 사려  할까 싶어서 믿어보려고도 해봤어  하지만 수상해 아무래도 안되겠어    *** 반복
2007.03.05~03.11,15,1459456,흰눈,이루,이루 LEVEL II,2006.10.09,Ballad,이주호,한 사람을 너무 사랑했던거죠   얼마나 나를  아프게 할지도 모르고   기뻐했죠  이 세상에 그댈 가진 사람  나 하나 뿐이라며  흰 눈이 내리던 어느 날  그 고운 입술로 날 사랑한다고   안녕이란 말을 하고  그대가 내 곁을 떠나갔죠   몰랐었죠 우리 헤어진다는건   정말 그대가 내 사랑인줄 알았는데  좋아했죠 그대 나와 같은 생각하고 있을거라 믿었죠 흰 눈이 내리던 어느 날 그 고운 입술로 날 사랑한다고  안녕이란 말을 하고 그대가 내 곁을 떠나갔죠  하얀 눈위에 멀어져 가는 그대가 남겨둔 발자국 세며 멍하니 바보처럼 떠나가는 뒷모습 보면서 울었죠 흰 눈이 내리던 어느 날 그 고운 입술로 날 사랑한다고  안녕이란 말을 하고 그대가 내 곁을 떠나갔죠  흰 눈이 내리던 어느 날 그 고운 입술로 날 사랑한다고  안녕이란 말을 하고 그대가 내 곁을 떠나갔죠  내 곁을 떠나갔죠
