time,rank,song_id,title,singers,album,date,genre,creator,lyric
2006.10.30~11.05,49,1370962,Second,브라운아이드걸스,Your Story (스페셜 리페키지 앨범),2006.08.25,R&B / Soul,김영아,Yeah baby You just blew your chance get the idea This is the bomb track You know what I'm sayin' The hottest track I can't take another lover I could not forget you never 이젠 너 아니면 안되는 날 알잖아 내겐 너 하나뿐인데 uh 나는 이미 다른 사랑 할 수 없는 걸 내 곁을 떠나지 말아 처음엔 친구였어 풋풋한 동갑내기 좋은 친구였어 난 차분하고 무뚝뚝했지 그런 니가 마치 하늘의 밝은 태양처럼 웃던 때 주위가 환해 보였네 내 마음 속 그대 자리는 점점 커져 Feel the love 우리는 점점 가까워져 그대의 왼손 네 번째 손가락에서 반짝이던 그 반지도 아무 장애 못돼 우리에겐 첨부터 그녈 알고 시작했지만 시간이 지날수록 네게 집착하는 나 알고 있지만 나 참아 봤지만 yeah 다신 널 보내긴 싫어 온종일 네 전화만 기다리다가 어느새 그녀에게 전활 걸고 있는 난 너의 목소리 듣게 될까봐 yeah 숨조차 쉴 수가 없어 I can't take another lover I could not forget you never 이젠 너 아니면 안되는 날 알잖아 내겐 너 하나뿐인데 uh 나는 이미 다른 사랑 할 수 없는 걸 내 곁을 떠나지 말아 혹시나 그녀 얘길 니가 할까 봐 전보다 너뿐이란 말을 자주 하는 나 이렇게라도 어떻게라도 니 사랑 지키고 싶어 I can't take another lover I could not forget you never 이젠 너 아니면 안되는 날 알잖아 내겐 너 하나뿐인데 uh 나는 이미 다른 사랑 할 수 없는 걸 내 곁을 떠나지 말아 세상 모든 사람 날 욕해도 세상의 모든 걸 다 잃는대도 그래도 I will be okay 내 가슴에 깊게 패인 너 없이는 난 insane 오직 네 존재만이 이젠 내가 살아가는 이유 니가 부족해도 내 곁에만 있어 그대 날 떠나지 말아줘 나의 몸과 맘 깊숙이 널 원해 Oh never say goodbye 나는 할 수 없단 말야 너를 줄 수 없단 말야 더는 니가 없이 살 수 없는 나잖아 내겐 너 하나뿐인데 uh 이런 나를 욕한대도 할 수 없는 걸 다신 날 혼자 두진 마 I can't take another lover I could not forget you never 이젠 너 아니면 안되는 날 알잖아 나는 이미 다른 사랑 할 수 없는 걸 내 곁을 떠나지 말아  I can't take another lover
2006.10.30~11.05,50,1484166,잘할게,세븐,Se7olution,2006.11.01,Ballad,이영현,I'm loving you 믿을 수 밖에 없는 말 거짓말처럼 뒤바뀐 내 작은 말 I'm missing you 메아리처럼 들리는 말 허공속에 외치고 외치는 내 작은 말 나는 왜 니 앞에서 처음 나처럼 웃고 마는지 돌아서면 이렇게 아픈데 아파야 된다면 그 아픔마저 다 참을께 서러워 기대고 싶어져도 나 꾹 참아볼께 버려야 된다면 남김없이 버려도 볼께 마지막까지 잡고 있던 자존심까지 모두다  잊지 못할 기억 한 귀퉁이라도 혹시나 짐은 아닐까 멍한 날 가다듬고 손 때 묻은 너와 내 사진첩만이 행복했던 내가 있었음을 말하는데 세상에 둘도 없는 사랑이라 불렀잖아 왜 이제는 못 부르는지 아파야 된다면 그 아픔마저 다 참을께 서러워 기대고 싶어져도 나 꾹 참아볼께 버려야 된다면 남김없이 버려도 볼께 마지막까지 잡고 있던 자존심까지 모두다 셀 수도 없을만큼 나 한움큼 쏟아내고 날 위로할 차례인지 아님 널 잊을 차례인지 미친 척 하고라도 사랑한다 외칠래 수많은 인연중에 나 기억하라고 기다릴 수 있단 말은 내 안에 아껴 둘께 아끼고 아껴서 닳을 때쯤엔 되뇌어 볼께 만약 먼 훗날에 다시 시작할 수만 있다면 나 네게 하고 싶은 첫 마디 진심으로 나 잘할께
2006.10.30~11.05,51,1368011,Happy Day,체리필터,Peace N’ Rock N’ Roll,2006.08.17,Rock,정우진,난 내가 말야 스무살 쯤엔 요절할 천재일 줄만 알고 어릴 땐 말야 모든 게 다 간단하다 믿었지 이제 나는 딸기향 해열제 같은 환상적인 해결책이 필요해 징그러운 일상에 불을 지르고 어디론가 도망갈까 찬란하게 빛나던 내 모습은 어디로 날아갔을까 어느 별로 작은 일에도 날 설레게 했던 내 안의 그 무언가는 어느 별에 묻혔나 가끔 울리는 전화벨소리 두근거리며 열어보면 역시 똑같은 이상한 광고 메세지일 뿐이야 이제 여기 현실은 삼류영화 속 너무 뻔한 일들의 연속이야 징그러운 일상은 멈춰 세우고 어디론가 도망갈까 거칠 것이 없었던 내 모습은 어디로 사라졌을까 어느 틈에 작은 일에도 늘 행복했었던 예전 그대로의 모습 찾고 싶어 찬란하게 빛나던 내 모습은 어디로 날아갔을까 어느 별로 작은 일에도 날 설레게 했던 내 안의 그 무언가는 어느 별에 묻혔나  찬란하게 빛나던 내 모습은 어디로 날아갔을까 어느 별로 작은 일에도 날 설레게 했던 내 안의 그 무언가는 어느 별에 거칠 것이 없었던 내 모습은 어디로 사라졌을까 어느 틈에 작은 일에도 늘 행복했었던 예전 그대로의 모습 다시 찾고만 싶어
2006.10.30~11.05,52,1472026,내가 누웠던 침대 (In My Bed),비,Rain`s World,2006.10.13,Ballad,박진영,오늘 들었어 네게 새로운 남자가 생겼다고 벌써 니 친구의 입을 통해서 모두 다 퍼졌어 니가 어떻게 사귀고 있는지 너무 놀라버렸어 나에게 주었던 똑같은 선물을 만들어줬어 똑같은 내용이 담긴 편질 덧붙였어 이런 사랑은 처음이라면서 baby 내가 누웠던 침대에 누워 내게 주었던 눈빛을 주며 사랑을 나눠 다른 사람과 어떻게 벌써 이렇게 날 잊어 믿어지지가 않아 정말 날 사랑하기는 한 건 맞아 나는 아직도 다른 사랑은 생각조차도 하지 못하는데 나를 불렀던 똑같은 호칭으로 그 사람을 부르고 내가 널 데려 간 곳들을 그 사람 손잡고 마치 처음가보는 사람처럼 설레이는 척하며 모든 게 나와 함께했던 소중한 추억들인데 그 사람과 다시하면 다 지워질텐데 우리추억들을 왜 지우는데 왜왜 내가 누웠던 침대에 누워 내게 주었던 눈빛을 주며 사랑을 나눠 다른 사람과 어떻게 벌써 이렇게 날 잊어 믿어지지가 않아 정말 날 사랑하기는 한 건 맞아 나는 아직도 다른 사랑은 생각조차도 하지 못하는데 내가 탔던 차 내가 앉던 의자 내가 서있던 자리에 그 사람이 있어 사랑한다고 말하던 입술로 이제 다른 사람의 입을 맞추고 있어 내가 누웠던 침대에 누워 내게 주었던 눈빛을 주며 사랑을 나눠 다른 사람과 어떻게 벌써 이렇게 날 잊어 믿어지지가 않아 정말 날 사랑하기는 한 건 맞아 나는 아직도 다른 사랑은 생각조차도 하지 못하는데 내가 누웠던 침대에 누워 내게 주었던 눈빛을 주며 사랑을 나눠 다른 사람과 어떻게 벌써 이렇게 날 잊어 믿어지지가 않아 정말 날 사랑하기는 한 건 맞아  baby tell me why
2006.10.30~11.05,53,1322134,연예인,싸이(PSY),싸집,2006.07.24,Dance,싸이(PSY),나의 그대가 원한다면 어디든 무대야  유머러스한 남자가 요즘엔 추세야  남자다운 남자는 낭자를 기쁘게 할 줄 알아야해  같이 놀고 가지고 놀고 잘 놀 줄 알아야 해  오늘부로 너의 연예인이 되기 위해 해 데뷔 무대  코믹 멜로 액션 에로 맘에 드는 걸 찍으시죠  지금부터 슛 들어갑니다 영화한편 찍으시죠  엔딩에 키스씬 있다 참고 하시죠    그대의 연예인이 되어 항상 즐겁게 해 줄게요  연기와 노래 코메디까지 다 해줄게  그대의 연예인이 되어 평생을 웃게 해 줄게요  언제나 처음 같은 마음으로    너를 슬프게 하는 사람 누구야  오늘 모습도 이뻐 뭐야 왜 우는데  그러자 그녀가 웃는데  항상 개인기와 신기한 이벤트 쇼쇼쇼  준비 다 끝났으니 우울한 날엔 말씀하셔셔셔  분위기 띄울땐 댄스 뮤직 한 곡 때리고  무드 잡을 땐 발라드 한 곡 뽑고  리듬 타고플땐 힙합 힙힙힙합  하늘 높이 뛰고플땐 락엔롤    그대의 연예인이 되어 항상 즐겁게 해 줄게요  연기와 노래 코메디까지 다 해줄게  그대의 연예인이 되어 평생을 웃게 해 줄게요  언제나 처음 같은 마음으로    난 그대의 연예인  난 그대의 연예인  난 당신의 연예인  난 당신의  난 당신의 댄스 가수    때로는 영화배우 같아 때로는 코미디언 같아  때로는 탤런트 같아 때로는 가수 같아  너의 기분에 따라 난 난 (난 그대의 연예인)    그대의 연예인이 되어 평생을 웃게 해 줄께요  언제나 처음 같은 마음으로  난 그대의 연예인
2006.10.30~11.05,54,1455983,해바라기,JK김동욱,Zebra,2006.10.02,Ballad,JK김동욱,나는 술을 못하지 기억도 잘 못하지  살아가는것이 힘들지   너는 곁에 없지만   나는 눈물 겹지만  살지   어렸을때 우리 둘 항상 즐거웠었지  싸우다가 웃었지   그때 니가 생각나 우리둘이 떠올라   난 웃지   슬픈세월만이 남아서  이제는 지난 추억으로 잊혀지겠지  아직도 그대로니 니마음엔  내가 널 울게했던 기억들  후회만이 남아서 눈물자국 남아서  못잊지   눈물같던 세월 지나서  이렇게 우리 잊혀지며 살아가겠지  잘살고 있는거니 내곁에  니가 남긴 추억만 남아서  슬픔도 감춰가며 사진만 바라보다  난 울지   사랑은 끝났어도 잊지못할것같아  죽는날까지 널 향하지   무척이나 울겠지   숨이 다할때 까지   나는
2006.10.30~11.05,55,1479605,Honey,김장훈,It`s Me,2006.10.25,Ballad,윤명선,우리 헤어진건가요  정말 떠난건가요  전화해도 받질 않네요  그댈 잊을 수가 없어서  쓰러지고 말았어요  이런 내 모습 실망하지 말아요  눈물처럼 하루가 가요  그대 맘은 괜찮은가요 my love  honey oh honey  많이 보고 싶어  그 누구의 가슴에서 울고 있나요  honey oh honey  슬픔 속을 떠나  행복하게 살아줘요  사랑했던 사람아    예쁜 드레스를 보면요  자꾸 그대 생각나요  이런 내 가슴 터질 것만 같아요  눈물처럼 하루가 가요  정말 그대 괜찮은가요 my love  honey oh honey  많이 보고 싶어  그 누구의 가슴에서 울고 있나요  honey oh honey  슬픔 속을 떠나  행복하게 살아줘요  사랑했던 사람아  honey oh honey  많이 보고 싶어  그 누구의 가슴에서도  울지 말아요  Honey oh Honey  슬픔 속을 떠나  행복하게 살아줘요  사랑했던 사람아  사랑하는 사람아
2006.10.30~11.05,56,1486731,열정 (My Everything),천상지희더그레이스(TheGrace),열정 (My Everything),2006.11.03,Ballad,,네 생각 네 표정 나를 웃게 해 나의 기쁨도 작은 슬픔도 네가 주는 것 나 아직은 사랑에 서툴러 벅찰 때도 있어 조금 천천히 널 보여줘 You're my all my everything 어렵지 않게 네가 느껴지고 있는 걸 그 모습 그 열정 잃어버리지는 말아 진지한 너의 눈빛이 너의 약속이 내 가슴안에 그대로 전해져 와 미래는 내가 함께 그려져 있는 걸 난 알아 볼 수 있는 걸 보석같은 마음 아프지 않게 다치지 않게 지켜줄께요 진실함에 무뎌진 세상에 길을 열어 보여 줘 너의 곁에서 걸을 수 있게 You're my all my everything 어렵지 않게 네가 느껴지고 있는 걸 그 모습 그 열정 잃어버리지는 말아 진지한 너의 눈빛이 너의 약속이 내 가슴안에 그대로 전해져 와 미래는 내가 함께 그려져 있는 걸 and you always be my all my everything 사랑이란거죠 가슴이 시키는 일 꿈이 멀지 않음을 느낄 수가 있는 걸 고마운 사람 느린 나를 기다려 주었지 열중 할거야 너만의 내가 되게 해줘 You're my all my everything 시간은 우리에게 아픔도 준다는걸 잘 알고 있는걸 두려워 하지 않아 함께 살아 간다는 것 모든 짐들을 나눠 가지는 친구가 돼 가는 것 나 여기 있을게 불안해 하지 말아 You're my all my everything 어렵지 않게 네가 느껴지고 있는 걸 그 모습 그 열정 잃어버리지는 말아 진지한 너의 눈빛이 너의 약속이 내 가슴안에 그대로 전해져 와 미랜 네 곁에서 웃을 수 있겠지 예쁜 모습의 노을이 돼 있겠지 and you always be my all my everything
2006.10.30~11.05,57,1484803,사랑시,가비엔제이,The Very Surprise,2006.11.02,R&B / Soul,서정진,그대를 다 잊고 살죠  그댈 다 지우고 살죠  그대와 연관된 모든 것들을  다 끊었죠  미워서 헤어지는게  아닌 걸 그대 잘 알잖아요  우린 쉽게 헤어지려고  서롤 미워하는 거죠    사랑 내게 아픔만 주고 간 사람  사랑 나를 울리고 간 사람  사랑 나를 바보로 만들고  바람처럼 저 멀리 떠나갔죠    미치도록 사랑했죠  죽도록 미워도 해봤었죠  이제서야 알게 된거죠  그대 아니면 난 안되요    사랑 내게 아픔만 주고 간 사람  사랑 나를 울리고 간 사람  사랑 나를 바보로 만들고  바람처럼 저 멀리 떠나갔죠    그대 사진을 지웠죠  한 장씩 지울 때마다  그댄 사라지는게 아니라  오래 오래 내 기억속에 남는거죠    사랑 세상에서 가장 슬픈 그 말  사랑 내겐 너무 아픈 그 말  사랑 이젠 이름만 들어도  나를 자꾸 울게 만드는 그 말  그 말만은 하지마요
2006.10.30~11.05,58,1484163,Se7olution (Intro),세븐,Se7olution,2006.11.01,Dance,세븐,고민하지 말고 나의 노랠 찾아 너의 귀에 꽃아 넣으면 돼 Everybody better listen up 지금껏 막혀 있던 혈관 속에 피가 도네 빠르게 오랜 시간동안 뭉쳐진 감정들이 한 순간에 모두 분해돼 새로워진 s e v e n 음악에 나와 입맞추고 with me 하늘을 나는 이 느낌 yeh 자 더 높이 that right yo we gonna get it so fly you won't regret it 깊게 숨을 마셔봐 자 make it everybody say it's se7oLution yo this is se7oLution that s e v e n it's se7oLution yeh yo this is se7oLution from me to you se7oLution
2006.10.30~11.05,59,1423391,말괄량이 (Feat. 카를로스(업타운)),배슬기,The First Album,2006.09.22,Dance,"김세진,서정진",너의 사소한 움직임이  내 마음을 흔들고  지금처럼 섹시한 눈빛으로  on n on n on  넌 내 어디가 좋은거니  솔직히 말해  너의 전부가 다 좋다는  그런식은 싫어  tell me that you love  내 몸매가 좋아  tell me that you love  내 얼굴이 좋아  tell me that you love  나의 긴머리가 좋아  우리 솔직해 볼까  all right tonight  이제 니 진심을 말해봐  and i tonight  모든 준비가 다 끝났어  tell me that you love  내 어디가 좋아  tell me that you love  내 다리가 좋아  tell me that you love  나의 엉덩이가 좋아  착해서 좋다는 건 싫어  너 지금 내게 뭘 원하니  솔직히 말해  나와 함께라면 좋다는  그런식은 싫어  tell me that you want  손을 잡고 싶어  tell me that you want  영활 보고싶어  tell me that you want  그냥 함께 걷고 싶어  우리 솔직해 볼까  all right tonight  이제 니 진심을 말해봐  and i tonight  모든 준비가 다 끝났어  tell me that you love  내 어디가 좋아  tell me that you love  내 다리가 좋아  tell me that you love  나의 엉덩이가 좋아  착해서 좋다는 건 싫어  잔소리들은 집어쳐  쓸데없는 말들로  시간 보내지 말고  내 곁으로 조금만  더 가까이 다가와  사랑이란 말보다  그냥 널 안아줄게  그대 내 품에 안긴채  yes party time out lady  all right tonight  이제 니 진심을 말해봐  and I tonight  모든 준비가 다 끝났어  tell me that you want  내 입술을 원해  tell me that you want  내 손길을 원해  tell me that you want  오늘 함께 있길 원해  솔직하지 못한건 싫어  all right tonight  이제 니 진심을 말해봐  and i tonight  모든 준비가 다 끝났어  tell me that you love  내 어디가 좋아  tell me that you love  내 다리가 좋아  tell me that you love  나의 엉덩이가 좋아  착해서 좋다는 건 싫어
2006.10.30~11.05,60,1454589,Key Of Heart (CF - 올림푸스),보아(BoA),Key Of Heart (Single),2006.09.21,Dance,,La la la la la la La la la la la la   그 누구라도 잘못 끼워버린 단추 하나처럼  엇갈려 버리는 날 있겠죠  난 믿고 있었지만 솔직한 마음을 외면한 듯  멀어져가는 뒷 모습 보며 아무 말 할 수 없었죠   지금 이대로 전하고 싶어 잠겨있던 마음의 열쇠가  이 가슴속에 빛나고 있어요  더욱 강하게 지키고 싶어  셀 수도 없이 많은 추억을  이어주고 있는 이름은 Just the key of heart   I believe love to heart  I believe love to heart   미안하다고 이야기한다면 알 수 있어도  혼자선 말 할 수 없겠죠  그대도 지금 나와 같은 생각 하고 있는거죠  인연이 우릴 부르니까 그대를 향해 가는걸   지금 이대로 전하고 싶어 잠겨있던 마음의 열쇠가  이 가슴속에 빛나고 있어요  눈을 감은 채 기도할게요  두근거리는 이 마음 모두  그대에게 전해지도록 Just the key of heart   우연히 그댈 만난 기적도 이 세상에 태어난 의미도  저 마다 서로 가슴에 새긴 채  망설임 없이 손을 잡았던  그대와 나만의 작은 얘기를  끝나지 않게 하고 싶어 Just the key of heart   La la la la la la La la la la la la  La la la la la la La la la la la la  La la la la la la
2006.10.30~11.05,61,1483672,님,HUS(허밍어반스테레오),Monochrome,2006.10.30,Electronica,이지린,내 님 생각이 난다마는 뭐 어쩌겠느냐 참고 참고 못참을리 없겠다만 내 님 생각이 난다마는 뭐 어쩌겠느냐 참고 참고 못참을리 없겠다만 야하하 야하하하 그리워라 야하하 야하하하 그리워라 나도 이 기나긴 이 봄밤 내 허리 뚝 끊어내어 고이고이 넣었다가 님 생기면 풀어낼까보다 풀어낼까보다 풀어낼까보다 풀어낼까보다  내 님 생각이 난다마는 뭐 어쩌겠느냐 울고 울고 그만울리 없겠다만 내 님 생각이 난다마는 뭐 어쩌겠느냐 울고 울고 그만울리 없겠다만 야하하 야하하하 그리워라 야하하 야하하하 그리워라 나도 이 기나긴 봄밤 내 두 눈 뚝 뽑아내어 고이고이 넣었다가 님생기면 풀어낼까보다 풀어낼까보다 풀어낼까보다 풀어낼까보다  너무 그리워요 너무 그리워요 너무 그리워요 너무 그리워요 내 사랑  너무 그리워요 너무 그리워요 너무 그리워요 너무 그리워요 내 사랑
2006.10.30~11.05,62,1484164,Girl Friend,세븐,Se7olution,2006.11.01,Dance,TEDDY,나만을 잡고 있는  네 작은 손길 속에서  You feelin' me  I do too Girl  뛰기 시작하는  내 심장을 느껴줘  So Deep  Cuz you got that thing I need  널 처음 봤던 그 날  이미 난 알고 있었어  Let me tell you girl  Anytime any place  you rock my world  아프고 외롭던 내 기나긴  지난 날의 끝인 걸  기다렸던 니가 왔기에  All my pain is gone  잠시라도 나를 놓지마  꿈에서 깨어날까봐 난 두려워져  조금씩만 내게 널 보여봐  감추려 말고 Trust me Baby  You know I got you  You're My Girl Friend 내 곁엔  너만 있어준다면  이 세상을 다 가진 것 같아  You're My Girl Friend 내 안에  살아 숨쉬어 준다면  You rock my world as long as  you be My Girlfriend  매일 밤 따스한  네 품으로 달려 갈때면  Everyday and Night  24 7 Baby I'm by your side  어린 아이처럼  앞만 보고 뛰는 걸  And I swear I wish I could fly  Sexy한 너의 몸짓  시원한 향기 속에서  Oh my god  look so Beautiful  온몸엔 소름 돋는  기쁨에 소릴 질러  기다렸던 니가 왔기에  I'm singing my song  잠시라도 날 떠나지마  갈수록 간절한  내 맘은 더 깊어져  이대로만 내게 널 맡겨봐  감추려 말고 Trust me Baby  You know I got you  You're My Girl Friend 내 곁엔  너만 있어준다면  이 세상을 다 가진 것 같아  You're My Girl Friend 내 안에  살아 숨쉬어 준다면  You rock my world as long as  you be My Girlfriend  너로 인해 또 다시 태어난 날 봐  미소속에 살아 숨쉬고 있잖아  All my life 너만 알고 싶어  Til' I die  하늘 끝까지 날아가 With you  I fly  You're My Girl Friend 내 곁엔  너만 있어준다면  이 세상을 다 가진 것 같아  You're My Girl Friend 내 안에  살아 숨쉬어 준다면  You rock my world as long as  you be My Girlfriend  as long as  you be My Girlfriend
2006.10.30~11.05,63,1484167,Last Of Diary,세븐,Se7olution,2006.11.01,Ballad,윤경,하루만 견뎌내면 하루만 잊고 살 수만 있다면 얼마나 좋을까 가슴에 숨소리도 그리움에 흐르는 눈물도 니 이름 하나만 매일 새기나 봐 스며온 아침 햇살 속에 너의 향기 느낄 때마다 혼자란 게 눈물이 나 닿으면 잡힐 것만 같은 너를 추억하는 일이 이렇게 아픈 줄 모르고 보낸게 후회 돼 내 앞에서 웃고 있는 너의 얼굴 만지려 두 손을 뻗으면 지난 밤 꿈처럼 사라지네 하루만 더 지나면 웃게 될거란 그 말을 언제쯤 내 맘도 믿을까 가슴이 뛰는대로 쏟아지는 추억들을 어떻게 막을 수 있는지 아직 모르나 봐 밤 하늘 흐린 별빛처럼 너의 가슴에 지워져 갈 나라는게 눈물이 나 손 끝에 느껴질 것 같은 너를 지난 날처럼 안아줄 수 없단게 참아도 참아도 힘이 들어 내 품에서 잠든 너의 머릿결을 만지려 두 손을 뻗으면 먼지가 되어서 사라지네  어떻게 널 잊어 어떻게 널 지워 너처럼 잊고 살 수 있게 말을 해 줘  하루만 더 참아볼게 하루만 더 살아 견딜게 시간이 지나면 달라져 가겠지 잊어줄 수 있는 것도 사랑이라 말했던 니 말을 기억해 하루만 지나면 잊을게
2006.10.30~11.05,64,1114180,술이야,바이브,Re - Feel,2006.02.27,Ballad,류재현,슬픔이 차올라서  한 잔을 채우다가  떠난 그대가 미워서  나 한참을 흉보다가  나 어느새 그대 말투  내가 하죠  난 늘 술이야  맨날 술이야  널 잃고 이렇게  내가 힘들 줄이야  이제 남남이야  정말 남이야  널잃고 이렇게 우린 영영  이젠 우리 둘은 남이야  슬픔이 차올라서  한 잔을 채우다가  떠난 그대가 미워서  나 한참을 흉보다가  또 다시 어느새  그대 말투 또 내가 하죠  난 늘 술이야 맨날 술이야  널 잃고 이렇게  내가 힘들 줄이야  이제 남남이야  정말 남이야  널 잃고 이렇게 우린  영영 이제 우리 둘은  술마시면 취하고  나 한 얘기를 또하고  이젠 너 남인줄도 모르고  너 하나 기다렸어  난 늘 술이야 맨날 술이야  널 잃고 이렇게  내가 힘들 줄이야  이제 남남이야 정말 남이야  널 잃고 이렇게 우리  영영 이젠 우리 둘은  정말 영영 이제  우리 둘은 남이야  저물어 가는  오늘도 난 술이야
2006.10.30~11.05,65,1484169,Can You Feel Me (Feat. G-Dragon),세븐,Se7olution,2006.11.01,Dance,"세븐,이승민",자꾸 이러면 곤란해  어서 말 좀 해봐  정말 힘들게 왜 그래 e yeah  이건 정말 아니잖아  돌이킬 수가 없는게 가슴 아파  지금까지 모두 거짓이었던  니 사랑이 생각이 나  연락이 없던 어젯밤 새벽  너를 봤다는 내 친구 모르겠어  Can you feel me  너라면 믿기겠니  사실이 아니라 말해봐  나 크게 웃게  거짓말이라도 해보겠니  너는 왜 입을 다문걸까  오오 이건 말이 안돼  오오 그게 말이 돼  오오 이건 말이 안돼  verse 2 Come on let's go  가고 싶으면 가도 돼  붙잡지는 않아  애써 웃지마 어색해  심한 욕이 나오잖아  니가 힘들길 바랄게 빌어볼게  쉴 새 없이 다른 사람 만나서  상처로만 가득 해봐  연락이 없던 어젯밤 새벽  너를 봤다는 내 친구 미치겠어  Can you feel me  너라면 믿기겠니  사실이 아니라 말해 봐  나 크게 웃게  거짓말이라도 해보겠니  너는 왜 입을 다문걸까  왜 내 기분이 거지같은지  사랑을 구걸받는 이런 내 모습이  하늘이 쪼개지고 비가 내리듯이  가슴이 터지고 눈물이 흐르지  한 평생 약속한 사랑이  한 순간 야속하게  남이 돼서 떠나갈래  Like this like that  마지막 네 기억마저 분노가 돼  이젠 너를 원치 않아  두 번 다시 찾지 않아  착각 좀 하지마 baby  Can you feel me  내 사랑이 쉬웠니  확실히 너를 믿었던 나  널 믿었던 나  나 크게 울게  매달리기라도 해보겠니  어차피 마지막이니까  마지막이야  Can you feel me  오오 이건 말이 안돼  오오 그게 말이 돼  사실이 아니라 말해봐  나 크게 웃게  오오 이건 말이 안돼  오오 그게 말이 돼  너는 왜 입을 다문걸까  오오 이건 말이 안돼  오오 그게 말이 돼  오오 이건 말이 안돼  오오 그게 말이 돼
