time,rank,song_id,title,singers,album,date,genre,creator,lyric
2011.03.20~03.26,1,3172166,가슴이 뛴다,케이윌,가슴이 뛴다,2011.03.10,Ballad,김이나,입술 끝에 맺혀있는 말  너만 보면 하고 싶은 말  너무 소중해 아껴두려고  참고 또 참는 말  할 수 있어 행복한 그 말 발음조차 달콤한 그 말 제일 좋은 날 제일 멋지게 네게 해주고 싶은 그 말 너를 사랑해 사랑해 사랑한다 한 번 두 번을 말해도 모자라서  아끼지 못해 숨기지 못해 솔직한 내 맘을 고백을 해 정말 너만이 너만이 전부인 난 너를 보고 또 안아도 벅차는 난 말할 때 마다 다시 설레서  쉬운 적 없던 그 말 너를 사랑해 울다가도 웃게하는 말 웃다가 또 울게하는 말 아주 먼 훗날 너의 귓가에 하고 눈감고 싶은 그 말 너를 사랑해 사랑해 사랑한다 한번 두 번을 말해도 모자라서 아끼지 못해 숨기지 못해 솔직한 내 맘을 고백을 해 정말 너만이 너만이 전부인 난 너를 보고 또 안아도 벅차는 난 말할 때 마다 다시 설레서 쉬운 적 없던 그 말 너를 사랑해 네가 다가온다 나를 본다 가슴이 뛰어온다  매일 너를 봐도 이런건 기적일까 계속된 꿈인 걸까 사랑해 사랑해 사랑해 널 다시 물어도 대답은 똑같은데 돌려 말하고 꾸며 볼래도 결국에 내 맘은 이런거야 정말 너만이 너만이 전부인 나 너를 보고 또 안아도 눈물이 나 어떻게 네가 내게 온거니 믿을 수 없을 만큼 너를 사랑해
2011.03.20~03.26,2,3164048,미친거니 (Feat. 방용국),송지은,미친거니,2011.03.03,Ballad,,사랑이 아냐 이건 사랑이 아냐 너의 집착일 뿐이야 어디 있든지 내가 무얼 하든지 무서워 나를 바라보는 넌 너의 그림자를 따라 밟다 난 전화를 걸어 네 떨리는 숨소리에 짜릿해져버려 빨라지는 네 발걸음 따라 뛰는 내 심장 미칠 것만 같아 어두워지는 긴 밤 너의 집 앞 불 꺼진 가로등 밑에서 너를 본다 네 방 창 문 틈에서 밤이 끝날 때까지 날 찾아봐 어서 나와 숨 막히는 숨바꼭질을 계속해 넌 넌 넌 넌 절대 내게서 떨어질 수 없어 미친거니 왜 그러니 이제 그만 나 좀 내버려둬 네가 보여 숨이 막혀 내 눈 앞에서 좀 사라져줘 넌 날 절대 벗어날 수 없어 넌 날 사랑 할 수밖에 없어 도망쳐봐 네가 어디에 있든지 난 볼 수 있으니 널 알지 깊숙이 넌 날 절대 벗어날 수 없어 넌 날 사랑 할 수밖에 없어 이제 날 봐 I Don't Wanna Cry No More more 사라져 버려 그만 좀 꺼져 버려 정말 숨도 못 쉬겠어 어딜 가든지 내가 어디 있든지 무서워 나를 따라오는 너 수백 번이고 수만 번이고 전화를 걸었는데 왜 왜 넌 대답이 없어 잊었니 우리 만난 지 벌써 천일이 됐어 네가 좋아하는 선물을 준비했어 네가 자주 가는 거리에 앉아 널 기다리고 있어 내 사랑을 알아 집착이라 말하지 마 사랑을 몰라 넌 미쳤다고 말하지 마 내 맘을 몰라 넌 넌 넌 넌 넌 절대 내게서 떨어질 수 없어 미친거니 왜 그러니 이제 그만 나 좀 내버려둬 네가 보여 숨이 막혀 내 눈 앞에서 좀 사라져줘 너도 날 원하잖아 나를 사랑하잖아 나를 도망치지 마 헛소리 좀 집어 치워 정신 차려 그만 좀 해 이제 나를 놓아줘 이건 아냐 사랑이 아니야 내게 상처뿐이야 이러지마 널 사랑 했지만 이제는 아니야 너의 기억에서 날 잊어줘 I Don't Wanna Cry No More More
2011.03.20~03.26,3,3169779,직감,CNBLUE(씨엔블루),FIRST STEP,2011.03.21,Rock,한성호,네가 날 떠날 거란 직감이 와 Don't give up 자꾸만 이런 저런 핑계들만 Don't give up 느낌이 달랐던 싸늘한 Bye Bye Don't give up 난 보낼 수 없어 Because I love you 나를 사랑한다 할 땐 언제고 이제 와서 Why you say goodbye 이대로 보낼 순 없어 never because I love you 이유 아닌 이유로 나를 떠나가려 하지마 Please don't go go go 제발 떠나가지마 한번만이라도 날 돌아봐줄래 Please don't go go go 슬픈 인사는 싫어 널 사랑하니까 다시 돌아와 Step by step one two three Dipdi daridu 긴긴 시간들이 너를 지워가겠지만 Step by step one two three Dipdi daridu 난 하루 하루가 고통일거야 너와 난 끝이라는 직감이 와 Don't give up 자꾸만 이런저런 짜증들만 Don't give up 기회만 엿보다 차가운 Bye Bye Don't give up 난 보낼 수 없어 Because I love you 거짓 같은 사랑이 점점 나를 아프게만 해 Please don't go go go 제발 떠나가지마 한번만이라도 날 돌아봐줄래 Please don't go go go 슬픈 인사는 싫어 널 사랑하니까 다시 돌아와 Step by step one two three Dipdi daridu 긴긴 시간들이 너를 지워가겠지만 Step by step one two three Dipdi daridu 난 하루 하루가 고통일거야 Uh 네 입술은 이별을 말하길 원해 네 눈빛은 나를 피하려고만 해 I ready know 난 아주 직감적으로 I don't wanna say goodbye Don't say goodbye 이별을 말하지마 Don't say bye bye 나를 떠나지마 사랑을 떠나서 나란 사람에게 이러지마 Because I love you Don't say no no no 내 눈을 피하지마 한 걸음 한 걸음 왜 멀어지려 해 Don't say no no no 그런 표정은 싫어 눈물로 이렇게 애원하잖아 Please don't go go go 제발 떠나가지마 Don't break my heart Don't you break my heart 나를 떠나지마 yeah still loving you Please don't go go go 슬픈 인사는 싫어 널 사랑하니까 다시 돌아와 Step by step one two three Dipdi daridu 긴긴 시간들이 너를 지워가겠지만 Step by step one two three Dipdi daridu 매일 매일이 악몽일거야
2011.03.20~03.26,4,3174148,가슴 시린 이야기 (Feat. 용준형 Of Beast),휘성(Realslow),가슴 시린 이야기,2011.03.15,Ballad,휘성(Realslow),세상에 가장 예쁜 거짓말 goodbye goodbye 가슴 찢겨도 뱉는 그 말 goodbye goodbye 좋은 안녕이란 말 말도 안되는 그말 사랑한 만큼 믿었던 만큼 아파 아파 네가 너무 미워서 너무 슬퍼서 아파 아파 이게 이별이잖아 좋을 리가 없잖아 그래도 goodbye 안녕 미워도 너는 내사랑 사랑을 알려준 첫 사람 그런 너를 보내는 한 남자의 거짓말 goodbye goodbye 나만 느끼던 너의 체온도 goodbye goodbye 나만 맞추던 너의 입술도 goodbye goodbye 너무 절망스러워 그래도 널 위해서 남자로써 꼭 해야하는 말 goodbye goodbye 마지막으로 너를 힘껏 안고서 goodbye goodbye 늘어난 테잎처럼 무겁게 더듬대며 행복해 goodbye 안녕 미워도 너는 내사랑 사랑을 알려준 첫 사람 그런 너를 보내는 한 남자의 거짓말 goodbye goodbye 안녕 좋은 사람 만나 행복해 뻔한 드라마 속 이별 장면을 베낀다 말이 좋은 안녕이지 결국 널 누군가에게 뺏긴다 부모를 잃은 아이처럼 우리가 낳은 사랑은 버려진다 그래 이별은 너와 나의 책임이야 사랑 앞에 우린 죄인이야 울지마 바보야 나 정말 괜찮아 어떻게든 살아 행복할게 만남 사랑 추억 이별 참 고마웠었어 그 동안 이를 악물고 너를 보낼게 어떻게든 너를 잊을게 우리 둘이서 만든 가슴 시린 이야기 goodbye goodbye 안녕 미워도 너는 내사랑 사랑을 알려준 첫 사람 처음이자 마지막 너를 위한 거짓말 goodbye goodbye
2011.03.20~03.26,5,3325048,나 항상 그대를 (With YB),윤도현,[서바이벌 나는 가수다] 경연1. `80년대 명곡 부르기,2011.03.20,Rock,김민정,나 항상 그대를 그리워하는데  맘처럼 가까울 수 없어  오늘도 빛바랜 낡은 사진 속에  그대 모습 그리워하네  나 항상 그대를 보고파하는데  그대는 어디로 떠났나  다정한 그 모습 눈물로 여울져  그대여 내게 돌아와요  돌아와 그대 내게 돌아와  나 온통 그대 생각뿐이야  불같은 나의 사랑 피할 순 없어  그대여 내게 음~ 돌아와요   돌아와 그대 내게 돌아와  나 온통 그대 생각뿐이야  불같은 나의 사랑 피할 순 없어  그대여 내게 돌아와요  돌아와 그대 내게 돌아와   나 온통 그대 생각뿐이야  불같은 나의 사랑 피할 수 없어  그대여 내게 ~~~~ 음~ 돌아와요
2011.03.20~03.26,6,3156950,TONIGHT,BIGBANG,빅뱅 미니앨범 4집,2011.02.24,Dance,"G-DRAGON,E.Knock,필강",Tonight such a beautiful night sing with me now 2011 follow me big bang big bang we're back again one more time say no way no way 너무 쉽게 또 남이 돼 big bang big bang don't stop let's play ok ok go go go 나 미칠 것 같애 아마 지친 것 같애 아냐 질린 것 같애 벌써 따분해 시시해 한 여자로는 만족 못 하는 bad boy but I'm nice 안 넘어가고는 못 배길걸 let me blow ya mind 언제부터였는지 감흥이 없어진 우리 이젠 마치 진 빠진 김 빠진 콜라같지 무감각해진 첫 느낌 서로를 향한 곁눈질 그깟 사랑에 난 목매지 않아 Don't wanna try no more 너를 찾아서 우에오 날 비춰주는 저 달빛아래로 그댈 찾아서 우에오오오 끝이 어딘지 모르겠지만  hey Tonight tonight tonight tonight 아직 난 사랑을 몰라 또 홀로 가여운 이 밤 상처 날 이별이 무서워 so what so what 널 처음 만난 순간이 그리워 no more no more 그저 아픔에 서툰 걸 난 피하고 싶은 걸 But You know that I love you girl girl girl 질질끄는 성격 say no  차가운 입술로 널 얼어 붙게 하는 나나나 Take ma soul take ma heart back 새로운 설레임 get that 사랑은 내게는 어울리지 않아 don't think too much it's simple 너를 찾아서 우에오 날 비춰주는 저 달빛아래로 그댈 찾아서 우에오오오 끝이 어딘진 모르겠지만  hey Tonight tonight tonight tonight 아직 난 사랑을 몰라 또 홀로 가여운 이 밤 안녕이란 말의 슬픈 의미 어두운 그림자는 가려지고 내 마음 속 잊어버린 너를 향한 나의 기억 너를 찾아서 우에오 날 비춰주는 저 달빛아래로 저 달빛아래로  그댈 찾아서 우에오오오 끝이 어딘지 모르겠지만 어딘지 몰라 Tonight tonight tonight tonight 아직 난 사랑을 몰라  또 홀로 가여운 이 밤 너를 찾아서 우에오 날 비춰주는 저 달빛아래로 그댈 찾아서 우에오오오 끝이 어딘지 모르겠지만 goodnight
2011.03.20~03.26,7,3138749,내꺼중에 최고,이현,내꺼중에 최고,2011.02.15,Ballad,방시혁,넌 내꺼중에 최고
2011.03.20~03.26,8,3319849,반짝반짝,걸스데이,Girl`s Day Party #3,2011.03.18,Dance,남기상,Girls Day Do you hear me Listen  내 말을 좀 들어봐  오빤 정말 나빴어  내 맘을 왜 훔쳤어  오빤 정말 못됐어  어쩜어쩜 어떡하면 난 좋아  웃지마 웃지마 너무 멋져 난 몰라  하지마 하지마 마마마마마마마마  가지마 가지마 마마마마마마마마  I Love you  슬쩍슬쩍 바라보지마  반짝반짝 내 입술 바라보지마  좋아하는 우리사이 멀어질까봐  멀어질까 두려워  Hey Boy  You make me feel like weak girl  Don't worry baby  Now I'm falling love  With U  내 입술만 바라보는  나쁜 오빠 오오오  틈만나면 힐끔힐끔  오빤 나빠 오오오  몰라몰라 싫어져도 난 몰라  웃지마 웃지마 장난만 좀 치지마  하지마 하지마 마마마마마마마마  가지마 가지마 마마마마마마마마  I Love you  슬쩍슬쩍 바라보지마  반짝반짝 내 입술 바라보지마  좋아하는 우리사이 멀어질까봐  멀어질까 두려워  나의 사랑은 달라  Come Come I feel inside  자꾸자꾸 좋아져  Love Love in sweety mind  We make it so good  We make it so Hot  I wanna be your girl  Let it all change  가까운 듯 멀어질 듯 알수가 없어  너와 빙글빙글 돌고도는 사랑은 싫어  이젠 그만 할까봐 너무 아파서 미워  하지마 하지마 마마마마마마마마  가지마 가지마 마마마마마마마마  I Love you  슬쩍슬쩍 바라보지마  반짝반짝 내 입술 바라보지마  좋아하는 우리사이 멀어질까봐  멀어질까 두려워  슬쩍슬쩍 바라보지마  반짝반짝 내 입술 바라보지마  좋아하는 우리사이 멀어질까봐  멀어질까 두려워  G I R L 너만의 Lady  D A Y Oh 난 너의 Medic  G I R L  This is the Girls Day
2011.03.20~03.26,9,3143550,나만 몰랐던 이야기,아이유,Real+,2011.02.17,Ballad,김이나,정말 넌 다 잊었더라
2011.03.20~03.26,10,3156953,CAFE,BIGBANG,빅뱅 미니앨범 4집,2011.02.24,Dance,"G-DRAGON,PEEJAY,DJ머프",네가 앉아있던 그 하얀 의자만이
2011.03.20~03.26,11,3110565,톡톡 (Tok Tok) (Feat. SOYA),마이티마우스,Mighty Fresh,2011.01.18,Rap / Hip-hop,"상추,쇼리",boy I like the way you   talk talk  내 귓가에 쏙쏙 달콤하게   tok tok  말해줄래 love love  ma baby boo ma love is true  너와 어디든지 walk walk  내 품 안에 쏙쏙 들어와줘 꼭꼭  말해 줄게 love love  ma baby boo come on   baby tell me  니 맘을 다 말해줘  너와 처음 마주친 순간  마법에 홀린듯한  말로는 설명 못할  아는 사람은 다 아는 그 느낌  I got my eyes on you why   don't you come get   close a girl  언제든 널 안아줄 남자가  바로 여기 나란걸  너에게 난 자존심 따윈  아예 없는 바보지  사랑해 라는 한마디 하나면  충분한 남자지  나를 믿어 이제 지난 얘기는 끝  니 얘기만 노래로   만들고 부를게  boy I like the way you   talk talk  내 귓가에 쏙쏙 달콤하게   tok tok  말해줄래 love love  ma baby boo ma love is true  너와 어디든지 walk walk  내 품 안에 쏙쏙 들어와줘 꼭꼭  말해 줄게 love love  ma baby boo come on   baby tell me  니 맘을 다 말해줘  사랑한단 말로  내 맘을 전부 보여주긴   너무 부족해  적고 적어도 세상의 단어는  너무나도 적어 답답할 정도지  적어도 니 아름다움   정돈 돼야지  수백 가지 글과 말 대신   내 품 입술  내 눈빛이 너와 내   사랑의 대화지  이젠 난 항상 그대 곁에  손잡고 같이 갈게  세상 가장 아름답게  make our future  모두의 낮보다 빛나는  많은 밤 속에서 넌 내가   꾸는 꿈이야  이 모든 게 너만을 향한 나의 맘  boy I like the way you   talk talk  내 귓가에 쏙쏙 달콤하게   tok tok  말해줄래 love love  ma baby boo ma love is true  너와 어디든지 walk walk  내 품 안에 쏙쏙   들어와줘 꼭꼭  말해 줄게 love love  ma baby boo come on   baby tell me  니 맘을 다 말해줘  보면 볼수록 너 란걸 느껴  말로는 설명할 수 없는 이 느낌  외롭고 힘들 땐 언제나  내 이름을 크게 불러봐  항상 옆에 있다는 걸 잊지마  영원히 함께 할 너와나  boy I like the way   you talk talk  내 귓가에 쏙쏙 달콤하게   tok tok  말해줄래 love love  ma baby boo ma   love is true  너와 어디든지 walk walk  내 품 안에 쏙쏙 들어와줘 꼭꼭  말해 줄게 love love  ma baby boo come on   baby tell me  니 맘을 다 말해줘
2011.03.20~03.26,12,3293345,사랑은 똑같다,"먼데이키즈(MondayKiz),가비엔제이",소울트레인 (Soul Train) Part.1,2011.03.16,Ballad,박성용,끝내 너를 놓지 못하고
2011.03.20~03.26,13,3156952,WHAT IS RIGHT,BIGBANG,빅뱅 미니앨범 4집,2011.02.24,Dance,"G-DRAGON,PEEJAY,DJ머프",Tell me what is right
2011.03.20~03.26,14,3111583,Black & White,지나,Black & White,2011.01.18,Dance,양파,Black Black Black White
2011.03.20~03.26,15,638570,바람이 분다,이소라,눈썹달,2004.12.10,Ballad,이소라,바람이 분다 서러운 마음에  텅 빈 풍경이 불어온다  머리를 자르고 돌아오는 길에  내내 글썽이던 눈물을 쏟는다  하늘이 젖는다  어두운 거리에 찬 빗방울이 떨어진다  무리를 지으며  따라오는 비는 내게서 먼 것 같아  이미 그친 것 같아   세상은 어제와 같고 시간은 흐르고 있고  나만 혼자 이렇게 달라져 있다  바람에 흩어져 버린  허무한 내 소원들은 애타게 사라져간다  바람이 분다  시린 한기 속에 지난 시간을 되돌린다  여름 끝에 선  너의 뒷모습이 차가웠던 것 같아  다 알 것 같아  내게는 소중해했던 잠 못 이루던 날들이  너에겐 지금과 다르지 않았다  사랑은 비극이어라 그대는 내가 아니다  추억은 다르게 적힌다   나의 이별은  잘 가라는 인사도 없이 치러진다  세상은 어제와 같고 시간은 흐르고 있고  나만 혼자 이렇게 달라져 있다  내게는 천금같았던 추억이 담겨져 있던  머리위로 바람이 분다  눈물이 흐른다
2011.03.20~03.26,16,3145784,파파라치 (Feat. 에릭),간미연,Watch,2011.02.17,Dance,"방시혁,Pdogg,에릭",미치 미치겠어 미치겠어
2011.03.20~03.26,17,3174560,Brothers＆Me (With JYP & Rain),김태우,T-school,2011.03.29,Ballad,박진영,Yeah
2011.03.20~03.26,18,3164251,이 밤이 지나면,먼데이키즈(MondayKiz),Nostalgia Part.2,2011.03.03,Ballad,이지영,불빛만이 가득한 이 밤
2011.03.20~03.26,19,3166756,가질 수 없는 너,현빈,"현빈, 가질 수 없는 너",2011.03.07,Ballad,,술에 취한 니 목소리  문득 생각났다던 그 말  슬픈 예감 가누면서  네게로 달려갔던 날 그 밤  희미한 두 눈으로  날 반기며 넌 말했지  헤어진 그를 위해서  남아있는 이 삶도 버릴수 있다고  며칠사이 야윈 널 달래고  집으로 돌아 오면서  마지막 까지도 하지 못한 말  혼자서 되뇌였었지  사랑한다는 마음으로도  가질 수 없는 사람이 있어  나를 봐 이렇게 곁에 있어도  널 갖지  못하잖아    눈물섞인 니 목소리  내가 필요하다던 그말  그것으로 족한거지  나 하나 힘이 된다면 네게  붉어진 두눈으로  나를 보며 넌 물었지  사랑의 다른 이름은  아픔이라는 것을 알고있느냐고  며칠사이 야윈 널 달래고  집으로 돌아 오면서  마지막 까지도 하지 못한 말  혼자서 되뇌였었지  사랑한다는 마음으로도  가질 수 없는 사람이 있어  나를 봐 이렇게 곁에 있어도  널 갖지  못하잖아
2011.03.20~03.26,20,3051244,좋은 날,아이유,Real,2010.12.09,Dance,김이나,어쩜 이렇게 하늘은 더 파란 건지  오늘따라 왜 바람은 또 완벽한지  그냥 모르는 척 하나 못들은 척  지워버린 척 딴 얘길 시작할까  아무 말 못하게 입맞출까  눈물이 차올라서 고갤 들어  흐르지 못하게 또 살짝 웃어  내게 왜 이러는지 무슨 말을 하는지  오늘 했던 모든 말 저 하늘 위로  한번도 못했던 말  울면서 할 줄은 나 몰랐던 말  나는요 오빠가 좋은걸 어떡해   새로 바뀐 내 머리가 별로였는지  입고 나왔던 옷이 실수였던 건지  아직 모르는 척 기억 안 나는 척  아무 일없던 것처럼 굴어볼까  그냥 나가자고 얘기할까  눈물이 차올라서 고갤 들어  흐르지 못하게 또 살짝 웃어  내게 왜 이러는지 무슨 말을 하는지  오늘 했던 모든 말 저 하늘 위로  한번도 못했던 말  울면서 할 줄은 나 몰랐던 말  나는요 오빠가 좋은걸  어떡해   이런 나를 보고  그런 슬픈 말은 하지 말아요  철없는 건지 조금 둔한 건지  믿을 수가 없는걸요  눈물은 나오는데 활짝 웃어  네 앞을 막고서 막 크게 웃어  내가 왜 이러는지 부끄럼도 없는지  자존심은 곱게 접어 하늘위로  한 번도 못했던 말  어쩌면 다신 못할 바로 그 말  나는요 오빠가 좋은걸  아이쿠 하나 둘  I'm in my dream  It's too beautiful beautiful day  Make it a good day  Just don't make me cry  이렇게 좋은 날
2011.03.20~03.26,21,3110148,잘 된 일이야,나비,Hello,2011.01.19,Ballad,강은경,Hello Hello Hello Hello Hello
2011.03.20~03.26,22,3325187,비오는 날의 수채화,박정현,[서바이벌 나는 가수다] 경연1. `80년대 명곡 부르기,2011.03.20,Ballad,강인원,빗방울 떨어지는
2011.03.20~03.26,23,3325191,짝사랑,정엽,[서바이벌 나는 가수다] 경연1. `80년대 명곡 부르기,2011.03.20,Ballad,이호섭,마주치는 눈빛이 무엇을 말하는지   난 아직 몰라 난 정말 몰라   가슴만 두근두근   아~ 사랑인가 봐  속삭이는 눈빛이   무엇을 말하는지  난 아직 몰라 난 정말 몰라  가슴만 두근두근 아~ 사랑했나봐  해질 무렵이면 창가에 앉아  나는요 어느 샌가 그대모습 그려요  사랑한다고 좋아한다고  말해 말해주세요  눈물만큼 고운별이 될래요  그대 그대 가슴에   마주치는 눈빛이  무엇을 말하는지  난 아직 몰라 난 정말 몰라  가슴만 두근두근  아~ 사랑인가봐  해질 무렵이면 창가에 앉아 나는요 어느 샌가 그대모습 그려요  사랑한다고 좋아한다고  말해 말해주세요  눈물만큼 고운별이 될래요  그대 그대~~  그대~~ 가슴에
2011.03.20~03.26,24,3314976,최고의 사랑 (후쿠야마 마사하루 리메이크),2AM,최고의 사랑 (후쿠야마 마사하루 리메이크),2011.03.16,Ballad,FukuyamaMasaharu,그대는 꿈 같은 사람이기에
2011.03.20~03.26,25,3089448,샤이보이,시크릿,샤이보이,2011.01.06,Dance,"김기범,강지원",뚜루왑 두밥 두밥
2011.03.20~03.26,26,3173249,이런 쓰레기 같은...,엠투엠(MToM),이런 쓰레기같은...,2011.03.10,Ballad,최갑원,툭툭 털고 일어 날 이별이 아니었나 봐 나다 말다 할 눈물이 아니었나 봐 그래 그래서 울기만 해서 자꾸 못나졌나 봐 오랜 만에 만나서 쓰잘데 없는 얘기로 너의 가는 길 막아서 미안하지만 아직 못 다한 나 정말 해야 할 부탁 하나가 있어 한번 더 사랑해 주라 이렇게 빌잖아 니가 있어야지 난 나일 수 있잖아 쓰레기처럼 버려진 내 사랑 주워주면 안 되니 한번 더 나를 봐주라 가슴만 치잖아 거짓말 아니야 모두 다 내 잘못이야 잘 해줄게 헤어지지 않게 우리 다시 만나자 모두 끝이 났다고 깨끗이 잊으라 하고 기다린 대도 절대로 안 올 거라고 그래 그래서 참지 못 해서 내가 찾아온 거야 여전하다 그 얼굴 내 손이 만지던 얼굴 니가 얼마나 보고 싶었는지 아니 그만 가라고 또 오지 말라고 그런 말은 하지 마 한번 더 사랑해 주라 이렇게 빌잖아 니가 있어야지 난 나일 수 있잖아 쓰레기처럼 버려진 내 사랑 주워주면 안 되니 한번 더 나를 봐주라 가슴만 치잖아 거짓말 아니야 모두 다 내 잘못이야 잘 해줄게 헤어지지 않게 우리 다시 만나자 싫어 널 지워야만 하는 일 나 하지 않을래 그것만 빼고 다 할게 비웃어도 널 위해서 라면 죽을 수도 있다고 떠나가지 마 더 가지마 뒤돌아서 돌아 와 제발  한번 더 사랑해 주라 이렇게 빌잖아 니가 있어야지 난 나일 수 있잖아 쓰레기처럼 버려진 내 사랑 주워주면 안 되니 한번 더 나를 봐주라 가슴만 치잖아 거짓말 아니야 모두 다 내 잘못이야 잘 해줄게 헤어지지 않게 우리 다시 만나자
2011.03.20~03.26,27,3329348,It`s Beautiful,윤하(YOUNHA),It`s Beautiful,2011.03.22,Ballad,임지훈,want to be waterful
2011.03.20~03.26,28,3118780,하루하루,김보경,The First Day,2011.01.24,Ballad,김태성,거짓말 날 위해 하는 말
2011.03.20~03.26,29,3174348,Nothing`s Over,인피니트,Inspirit,2011.03.17,Dance,"한재호,김승수,송수윤",니가 멀어진다  멀리 점이 된다  발을 떼지 못해  마음만 뒤쫓아 따라 간다  나는 아직인데  변명도 못했는데  한 발 물러서서 goodbye  아주 잠시만 난 goodbye  Nothing's over  Nothing's over  Nothing's over  Nothing's over  Nothing's over  주문을 외워 내게  딴 놈 만나면 안돼  벌써 그러면 안돼  아직은 끝난 게 아니야  끝난 게 아니야  널 보낸 적 없어    I think about you  all day long  잠시뿐인 어둠 속에서 조차  널 찾아 헤메어  닫힐 뿐인 감정 속에서  날 찾아와 감싸안던  따뜻한 너의 멜로디  I hear that never forget you  I will find my baby  Nothing's over  Nothing's over  Nothing's over  Nothing's over  Nothing's over  주문을 외워 내게  딴 놈 만나면 안돼  벌써 그러면 안돼  아직은 끝난 게 아니야  끝난 게 아니야  널 보낸 적 없어    우리 처음 봤던 날 너무나 떨렸던 나  니가 내게 했던 말  바보처럼 믿은 나 니 생각에  잠 못 이루던 다 미루던  날 안아줘 이미 멀어져 버려도  날 안아줘  헤어질 수 도 있어  그래 그럴 수 있어  하지만 이렇겐 아니야  이렇겐 아니야  난 끝낼 수 없어  딴 놈 만나면 안돼  벌써 그러면 안돼  아직은 끝난 게 아니야  끝난 게 아니야  나에겐 너 뿐야
