time,rank,song_id,title,singers,album,date,genre,creator,lyric2011.08.14~08.20,70,3482503,사랑해요 사랑해요,럼블피쉬,사랑해요 사랑해요,2011.07.13,Ballad,"조영수,안영민",곁에 있을땐 소중한 줄 몰랐죠 내 소심한 성격조차 받아준 그댄데 곁에 있을땐 당연한 줄 알았죠 한 없이 주던 그 사랑  받기만 했던 나  내겐 운명 같던 사람이  내겐 목숨같던 사람이  떠나가요 멀어져요  나 이제 어쩌죠  사랑해요 사랑해요  아무리 둘러봐도  그대만큼 날 아껴줄 사람  세상엔 없네요  바보처럼 바보처럼 그대만은 영원할 줄 믿었죠 이젠 내가 더 그댈 사랑해요  집에 갈때면 항상 바래다주던 그대 내곁에 없어서  너무나 외로워 나만 사랑했던 사람이 나만 지켜주던 사람이 떠나가요 멀어져요  나 이제 어쩌죠  사랑해요 사랑해요  아무리 둘러봐도  그대만큼 날 아껴줄 사람  세상엔 없네요  바보처럼 바보처럼  그대만은 영원할 줄 믿었죠  이젠 내가 더 그댈 사랑해요  이렇게 아플줄 정말 몰랐어  그대란 한 사람  나에겐 전부였어  사랑해요 사랑해요  아무리 둘러봐도  그대만큼 날 아껴줄 사람  세상엔 없네요  미안해요 미안해요  바보같은 내게 돌아와줘요  예전처럼 나에게 다시 사랑한다고 말해줘요  My love
2011.08.14~08.20,71,3475250,빙빙빙 (Feat. 써니사이드 챙),"먼데이키즈(MondayKiz),가비엔제이",소울트레인(Soul Train) Part.2,2011.07.08,Ballad,민명기,다 받아줄땐 언제고  함께하쟤놓고  우리 왜 헤어진거니 말해봐 why why why  너 high high high  내게서 멀어진거니 너 잘해줄땐 언제고  결혼하쟤놓고  결국엔 남이된거니 말해줘 lie lie lie 이건 아니야  우리 사랑이 이것밖에 안돼 가슴이 부르터도 찢기듯 갈라져도  다시 너만 덧나서  숨도 못쉴 것 같은데 오늘도 빙빙빙 니곁을 맴돌다  눈물에 잠겨 나 죽을지 몰라 멋진이별 한거라고  참 잘한거라고  내가 날 추스려봐도 내 맘은 cry cry cry  또 cry cry cry  나란 놈 별수 없나봐 내가 널 차버렸다고  울려버렸다고  잘난 척 자랑해봐도 내 맘은 I miss you 니가 그립다  우리 사랑을 끝낸건 나인데 가슴이 부르터도 찢기듯 갈라져도  다시 너만 덧나서  숨도 못쉴 것 같은데 오늘도 빙빙빙 니곁을 맴돌다  눈물에 잠겨 나 죽을지 몰라 하나만 바랄게 내안에 널 잊게  해달라고 수천번 바래봐도  나도 모르게 두 발은 너에게 꿈 속에서도 너를 찾는데 I ain`t never been like this 크게 부푼 시련에  애가 탈 뿐 울고 있을 뿐  just like kids  우리에게 닥친 결말에 쓴 웃음 지을뿐 잡을 수 없는 어제는 슬픈 멜로디  소리없는 미련이 내 주윌 맴도니 하루라도  멀리 아주 멀리멀리 벗어나야만해 알잖아 you know our love is dead 사랑은 죽었다고 사랑은 죽었다고  너란 사람 없다고 우린 될 수 없다고  내 머리는 알면서도  귓가에 윙윙윙  니 이름 맴돌아 어린 애처럼 널 찾고있는데 가슴이 부르터도  자꾸만 갈라져도  다시 너만 덧나서  숨도 못쉴것 같은데 오늘도 빙빙빙 니곁을 맴돌다  눈물에 잠겨 나 죽을지 몰라
2011.08.14~08.20,72,3459504,다이어리,나비,다이어리,2011.07.01,Ballad,"이기(오레오),노주환",너를 너무 사랑한게 이유였다면 내가 너무 행복한게 이유였다면 잘못했어 이리 쉽게 헤어져서 난 너무 아파 너무 아파 주르륵 주르륵 주르륵 주르륵 널 써 내려가 흐르는 흐르는 흐르는 흐르는 눈물아 멈춰 왜 홀로 이렇게 맘 아파해야 하는 거야 싫어 사랑했다면 정말 날 사랑했다면 나의 마음 깊은 곳에 너 떠나주길 바래 다신 볼 수 없어도 어떻게든 잘 살 테니까 oh baby oh bye bye 너만 알던 가슴이라 바보가 됐어 약해빠진 마음이라 눈물이 났어 니가 미워 두 번 다시 찾지 않을께 너무 아파 너무 아파 주르륵 주르륵 주르륵 주르륵 널 써내려 가 흐르는 흐르는 흐르는 흐르는 눈물아 멈춰 왜 홀로 이렇게 맘 아파해야 하는 거야 난 싫어 사랑했다면 정말 날 사랑했다면 나의 마음 깊은 곳에 너 떠나주길 바래 다신 볼 수 없어도 어떻게든 잘 살 테니까 oh baby 정말 널 사랑했었어 지금의 시간이 다 지나가길 바래 그래 또 사랑하기 싫어 다신 날 찾지마 제발 떠날 거라면 그렇게 떠날 거라면 나의 마음 깊은 곳에 널 남겨주길 바래 그 기억 하나로 난 어떻게는 잘 살 테니까 oh baby oh bye bye oh bye bye 너를 너무 사랑한 게 이유였다면 1986년 3월22일 엄마의 다이어리
2011.08.14~08.20,73,3499374,두 바보 (Feat. 미노 Of 프리스타일),이보람,조영수 All Star - 이보람,2011.07.25,Ballad,,because of loving u 오늘도 입가에 맴돈 말  loving u 돌아서면 혼자 하는 그말 내 오랜 친구로 때론 연인처럼  내곁에 있는 너  loving u 남들 다하는 사랑이  나만 조금 달라요 표현하지도 못하는  사랑을 하며 살아요 마음으로만 말하고  생각으로만 만지고 주위를 맴돌다가  돌아서버리고 말아요 이렇게 사는 것도  나쁘지는 않겠죠 가슴 아픈 이별 따위에  아파할일도 없겠죠 이게 참 힘드네요 생각같지 않아서 더 이상 그대를 맴돌기가 벅차요 because of loving u 오늘도 입가에 맴돈 말   loving u 돌아서면 혼자 하는 그말 내 오랜 친구로 때론 연인처럼  내곁에 있는 너 loving u 아직도 그대는 눈치 채지 못했죠 아무리 노력을 해도  알아주지도 않아요 큰소리로 웃고 그댈 먼저 챙겨도  고맙다는 눈인사만  건네 버리고 마네요 말 못하는 바보라서 이러고 살아요 두 번 다시는 못 볼까봐  두려워서 이래요 혼자하다 말아버리는  사랑이 될까 겁나요 요즘 정말 내 꼴이 말이 아니네요 because of loving u 오늘도 입가에 맴돈 말  loving u 돌아서면 혼자 하는 그말 내 오랜 친구로 때론 연인처럼  내곁에 있는 너 loving u 늘 한숨만 쉬고 또 그리워하는 이 사랑이 답답해 이대로 널 보내면 안될것 같아 이렇게 니 한걸음 뒤에 오래전부터 난 항상 너의 뒤에 허수아비처럼 서있었어 니 옆에 있어도 가까이 있어도  만질수 없는 너 loving u 웃는 모습을 볼 때마다  내 것이 아니라 아파요 항상 옆에 있어도  혼자란 생각에 슬프죠 언제쯤이면 그대 옆에  함께 설 수 있나요 언제쯤이면 그대를 보며  웃어 볼 수 있나요 시작부터 사랑이란 걸  모두 망쳐버렸죠 옆자리를 비워둔 채로  그대 뒤를 걷네요 알아채지도 못하게  문을 잠궈 버렸죠 미치도록 내 사랑은  엉망이 됐네요
2011.08.14~08.20,74,3462710,A Bitter Day (Feat. 용준형 & G.NA),현아,A Bitter Day (Feat. 용준형 & G.NA),2011.06.30,Ballad,"최규성,용준형",A Bitter Day  다 이렇게 지워가겠지 언제가는 잊혀지겠지 나 그제서야 웃겠지만  지금은 나도 어쩔수가 없네 날씨가 좋아도  기분은 전혀 좋지 않아 날 놀리는 것 같아 괜히 막 화가 견디기 힘든 상황에 빠져서  허우적대네 나와 정 반대 세상은  아무렇지도 않게 잘 돌아가잖아 너 또한 잘 살아가더라고  It's not fair  이건 불공평해 지나가는 사람들 시선조차 내게 동정이 돼 되는 일이 하나 없어  오늘 아침에 내려야 할 곳을 놓쳐서 문득 니 생각에 뒤늦게 내린  인적드문 정거장에 오늘따라 쓸쓸해보여서  그냥 눈물이 났어 그렇게 한참을 걸었어  밉기만 했던 니가  새삼스리 그리웠어 널 붙잡을 힘도없이  약해빠졌었던 지난 날의 내가  너무 한심해서 A Bitter Day   다 이렇게 지워가겠지 언제가는 잊혀지겠지 나 그제서야 웃겠지만  지금은 나도 어쩔수가 없네 아무것도 할수가 없어  지금 또 니 생각이 나서 참 슬프지만  정말 힘이 들겠지만  계속 지워볼게 변명처럼 들리겠지  무슨 말을 해도 이 모든게 다 널 위한거라 말을 해도  넌 내겐 너무나도 과분해서 어울리지 않는  옷을 걸친듯 불편해서 아름답지만 나도 니가  내 옆에서 시들어가는데 그걸 지켜보는  내 기분 어떻겠어  아예 시작을 하지말걸 처음 그때 니 눈을 보지 말걸 널 놓아주고나면  홀가분해질거라 생각했는데  그게 아니더라 또 이별은 머리는 아는데  마음이 부정을 못하더라고 매일 널 그리고 지우기를 반복해  아픈건 내가 다 할게 넌 그저 행복했음 좋겠어  지금의 선택 헛되지않길  후회하지 않길  널 위해 항상 기도할게 A Bitter Day   다 이렇게 지워가겠지 언제가는 잊혀지겠지 나 그제서야 웃겠지만  지금은 나도 어쩔수가 없네 아무것도 할수가 없어  지금 또 니 생각이 나서 참 슬프지만  정말 힘이 들겠지만  계속 지워볼게 조금씩 잊혀질거야  시간이 지나가면  웃으며 추억할 수 있겠지 시간이 약이란 흔한 말 말고  더 확실한 방법을 내게 말을 해줘 내게 받던 것 보다  더 큰 사랑 받을 수 있어  넌 여전히 아름다워 영원할거라 했잖아  결국 우리도 남들과 똑같아 A Bitter Day   다 이렇게 지워가겠지 언제가는 잊혀지겠지 그 날이 오겠지
2011.08.14~08.20,75,3478954,I Believe (신승훈),김조한,[나는 가수다] 경연6-1. `이 무대에서 도전하고 싶은 노래`,2011.07.10,Ballad,양재선,I Believe   그댄 곁에 없지만   이대로 이별은 아니겠죠   I Believe   나에게 오는 길은   조금멀리 돌아올 뿐이겠죠  모두 지나간 그 기억 속에서   내가 나를 아프게 하며   눈물을 만들죠  I Believe   I Believe   I Believe  I Believe   내가 아파할까 봐  그대는 울지도 못했겠죠   I Believe   흐르는 내 눈물이   그댈 다시 내게 돌려주겠죠   자꾸 멈추는 내 눈길 속에서   그대 모습들이 떠올라   눈물을 만들죠   나만큼 울지 않기를   그대만은 눈물 없이 날   편하게 떠나주기를  언젠가 다시 돌아올   그대라는 걸 알기에   난 믿고 있기에 기다릴게요   난 그대여야만 하죠   나 그댈 알기 전 이세상도   이렇게 눈부셨는지   그  하늘 아래서 이젠   눈물로  남겨졌지만   이 자릴 난 지킬게요   그대란 이유만으로   나에게는   그대란 이유만으로   나에게는 기다림조차  충분히 행복하겠죠   사랑한 이유만으로   또 하루가 지나가고   오늘도 잊어도 기다릴게요   난 그대여야만 하죠   Oh I believe    I believe  I believe  I believe  Oh I believe    I believe I believe I believe  I say Oh I believe   I believe I believe I believe I believe I say Oh I believe     I believe I believe I believe I believe Oh I believe     I believe I believe I believe Oh I believe    I believe I believe I believe  I believe
2011.08.14~08.20,76,3500553,희나리 (구창모),김범수,[나는 가수다] 경연6-2. `청중 평가단 추천곡`,2011.07.24,Dance,추세호,사랑함에 세심했던 나의 마음이 그렇게도 그대에겐 구속이었소 믿지 못해 그런 것이 아니었는데 어쩌다가 헤어지는 이유가됐소 내게 무슨 마음의 병 있는 것처럼 느낄 만큼 알 수 없는 사람이 되어 그대 외려 나를 점점 믿지 못하고 왠지 나를 그런 쪽에 가깝게 했소 나의 잘못이라면 그대를 위한 내 마음의 전부를 준 것 뿐인데 죄인처럼 그대 곁에 가지 못하고 남이 아닌 남이 되어버린 지금에 기다릴 수밖에 없는 나의 마음은 퇴색하기 싫어하는 희나리 같소 퇴색하기 싫어하는 희나리 같소 내게 무슨 마음의 병 있는 것처럼 느낄 만큼 알 수 없는 사람이 되어 그대 외려 나를 점점 믿지 못하고 왠지 나를 그런 쪽에 가깝게 했소 나의 잘못이라면 그대를 위한 내 마음의 전부를 준 것 뿐인데 죄인처럼 그대 곁에 가지 못하고 남이 아닌 남이 되어버린 지금에 기다릴 수밖에 없는 나의 마음은 퇴색하기 싫어하는 희나리 같소 퇴색하기 싫어하는 희나리 같소
2011.08.14~08.20,77,3525692,레이싱퀸,마이티마우스,레이싱퀸 2 OST Part.1,2011.08.12,Rap / Hip-hop,"상추,쇼리",Ladiez time's up gentlemen   time's up party peepz   time's up  U know what I'm watin for  ballerz time's up riderz   time's up hey fellaz time's up  Tell me what U waiting for  난 지금 무중력 우주 위에 둥둥 떠  별들도 리듬에 맞춰 날 바라보며   춤을 춰  I got that playa flava I know u  like ma swagga hey lady don't be shy  나와 같이 날자 fly  Hey yo Hands in the A yo  Oh ma Party people in the club  SAY OH SAY OH SAY OH  Oh ma Party people in the club   SAY OH  Now everybody dance oh   Come on everybody dance  Dance till the break of dawn  Everybody get down down to the floor  자 좀 더 볼륨 올려 빙빙빙 머리   돌려 get crazy  나를 누르는 중력을 이겨라   put ur hands up  우린 이 밤의 C.E.O drug   없이도 high 되는 style  Fiesta fellas we don't stop  Hey yo Hands in the A yo  Oh ma Party people in the club  SAY OH SAY OH SAY OH  Oh ma Party people in the club   SAY OH  Ladiez time's up gentlemen   time's up party peepz   time's up  U know what I'm wating for  ballerz time's up riderz   time's up hey fellaz time's up  Tell me what U waiting for  Now everybody dance oh   Come on everybody dance  Dance till the break of dawn  Everybody get down down to the floor  Now everybody dance oh  Come on everybody dance Dance till the break of dawn Everybody get down down to the floor
2011.08.14~08.20,78,3526342,EV1,자우림,EV1 / PEEP SHOW,2011.08.12,Rock,김윤아,기묘한 얘기 하나가 있었어  EV1 이라 불리던 차의 얘기 이제쯤 너도 아마 알고 있겠지  세상은 이상한 얘기로 가득하지 아직은 달릴 수가 있었는데  사막 한가운데로 버려진 빨간색 초록색 EV1 거짓말이라고 해줘 EV1 EV1 EV1의 이야기 인간은 때로 신의 이름을 외치면서  증오와 몰이해로 살인을 저지르고 타인의 불행 아직 오지 않은  고통을 내 것이 아니니까  아랑곳하지 않지 마치 당연한 것처럼 아직은 달릴 수가 있었는데  사막 한 가운데로 버려진 빨간색 초록색 EV1 거짓말이라고 해줘 모순과 부조리와 눈물  아무리 외면해도  세상은 처음부터 그런 곳이었어 진짜 이유를 말해줘요  아무리 비참해도 내가 생각한  그런 이유는 아니라고 말해줘 EV1 EV1 EV1 EV1 EV1의 이야기
2011.08.14~08.20,79,3527201,내 사람이여 (이동원),YB,[나는 가수다] 경연7-2. `청중평가단 추천곡`,2011.08.14,Rock,백창우,내가 너의 어둠을 밝혀 줄수 있다면 빛하난 가진 작은 별이 되어도 좋겠네 너 가는 길마다 함께 다니며 너의 길을 비추겠네 내가 너의 아픔을 만져 줄 수 있다면 이름없는 들의 꽃이 되어도 좋겠네 음 - 눈물이 고인 너의 눈속에 슬픈 춤으로 흔들리겠네 그럴수 있다면 그럴수 있다면 내 가난한 삶과 영혼을  모두 주고 싶네 내가 너의 사랑이 될수 있다면 노래 고운 한마리  새가 되어도 좋겠네 너의 새벽을 날아 다니며 내 가진 시를 들려 주겠네 그럴수 있다면 그럴수 있다면 이토록 더운 가슴 하나로  내가슴에 묻히고 싶네 그럴수 있다면 그럴수 있다면 네 삶의 끝자리를 지키고 싶네 내 사람이여 내 사람이여 너무 멀리 서있는 내 사람이여 내 사람이여  너무 멀리 서있는 내 사람이여 너무 멀리 서있는 내 사람이여
2011.08.14~08.20,80,3411851,나와 같다면 (김장훈),김연우,[서바이벌 나는 가수다] 경연3-2. `네티즌 추천곡`,2011.05.22,Ballad,박주연,어떤 약속도 없는 그런 날에  너만 혼자 집에 있을때  넌 옛 생각이 나는지  그럴땐 어떡하는지  또 우울한 어떤날  음 비 마저 내리고  늘 우리가 듣던 노래가  라디오에서 나오면  나처럼 울고 싶은지  왜 자꾸만 후회되는지  나의 잘못했던 일과  너의 따뜻한 마음만  더 생각나  또 우울한 어떤날  음 비 마저 내리고  늘 우리가 듣던 노래가  라디오에서 나오면 나처럼 울고 싶은지 왜 자꾸만 후회되는지  나의 잘못했던 일과  너의 따뜻한 마음만  더 생각나 그대여 나와 같다면  내 마음과 똑같다면  그냥 나에게 오면 돼  널 위해 비워둔 내 맘  그 자리로
2011.08.14~08.20,81,3514352,취중진담 (전람회),김조한,[나는 가수다] 경연7-1. `내가 부르고 싶은 노래`,2011.07.31,R&B / Soul,김동률,널 사랑해 이렇게 널 사랑해 어설픈 나의 말이 촌스럽고  못미더워도 그냥 하는 말이 아니야 그래 난 취했는지도 몰라  실수인지도 몰라 아침이면 까마득히 생각이 안나  불안해할지도 몰라 하지만 꼭 오늘밤엔  해야할 말이 있어 약한 모습 미안해도 술김에 하는  말이라 생각지는 마 언제나 네 앞에 서면 준비했었던 말도 왜 난 반대로 말해놓고  돌아서 후회하는지 이젠 고백할게 처음부터  너를 사랑해왔다고 이렇게 널 사랑해 어설픈 나의 말이 촌스럽고  못미더워도 그냥 하는 말이 아냐 두 번 다시 이런일 없을꺼야 아침이 밝아오면 다시 한번  널 품에 안고 사랑한다 말할게 자꾸 왜 웃기만 하는거니 농담처럼 들리니 아무말도 하지않고 어린애 보듯 날 바라보기만 하니 언제나 네 앞에 서면  준비했었던 말도 왜 난 반대로 말해놓고  돌아서 후회하는지 이젠 고백할게 처음부터  너를 사랑해왔다고 이렇게 널 사랑해 어설픈 나의 말이  촌스럽고 못미더워도 아무에게나 늘 이런 얘기하는  그런 사람은 아냐 너만큼이나 나도 참 어색해 너를 똑바로 쳐다볼 수 없어 자꾸만 아까부터 했던  말 또 해 미안해 하지만 오늘 난 모두 다 말할꺼야 널 사랑해 이렇게 널 사랑해 어설픈 나의 말이 촌스럽고  못미더워도 그냥 하는 말이 아니야 두번 다시 이런 일 없을꺼야 아침이 밝아오면 다시 한번  널 품에 안고 사랑한다 말할께 널 사랑해
2011.08.14~08.20,82,3527202,그대 내 맘에 들어오면은 (조덕배),조관우,[나는 가수다] 경연7-2. `청중평가단 추천곡`,2011.08.14,Ballad,조덕배,뛰어갈 텐데 날아갈 텐데  그대 내 맘에 들어오면은 다가가면 뒤돌아 뛰어가고  쳐다보면 하늘만 바라보고  스쳐가듯 내 곁을 지나가도  돌아서서 모른 척하려 해도  내 마음에 강물처럼  흘러가는 그대는 무지갠가  뛰어갈 텐데 날아갈 텐데  그대 내 맘에 들어오면은  아이처럼 뛰어가지 않아도  나비 따라 떠나가지 않아도  오래오래 그대 곁에 남아서  강물처럼 그대 곁에 흐르리  뛰어갈 텐데 뛰어갈 텐데  날아갈 텐데   그대 내 맘에 들어오면은  뛰어갈 텐데  날아갈 텐데   그대 내 맘에 들어오면은  내 맘에 들어오면은
2011.08.14~08.20,83,3527286,휘가로 (Figaro),나인뮤지스,Figaro,2011.08.18,Dance,"한재호,김승수,송수윤","Give up up tonight Give up up tonight Give up up  난 그런식으론 안돼 Give up up tonight Give up up tonight Give up up  난 그런식으론 안돼 그저 슬쩍 몇 번 훑다가 날 콕콕 찔러 보다가 날 갖겠다 넌 싶겠지 저리 가라 촐싹대다 다칠라 또 집적대다 혼날라 oh, hey lady oh no 저속히 사냥해 신속히 낚아채 나 아는 사랑은 그러는게 아니야 진득히 기다려 진득히 다가서 내 맘을 가져가 그러는게 맞잖아 Gone by the midnight  by the midnight  이제 더는 다치고 다치긴 싫어 Gone by the midnight  by the midnight  그럴 바엔 가고 또 가고 똑같이 가줄게 Dance come on dance Dance come on dance 급하게 오르고 급하게 싫증내 참 쉽게 생각해 그러는게 아니야 ah ah ah ah 깊숙히 스미고 간절히 원하고  떨리게 해야지 그러는게 맞잖아 Gone by the midnight  by the midnight  이제 더는 바꾸고 바꾸긴 싫어 Gone by the midnight  by the midnight  그럴 바엔 받고 또 받고 또 한수 둬줄게 It's time to get down, get down  It's time to get down Give up up tonight Give up up tonight Give up up  난 그런식으론 안돼 Give up up tonight Give up up tonight Give up up  난 그런식으론 안돼 Gone by the midnight  by the midnight  이제 더는 다치고 다치긴 싫어 Gone by the midnight  by the midnight  그럴 바엔 가고 또 가고 똑같이 가줄게 이제 더는 바꾸고 바꾸긴 싫어  Gone by the midnight  by the midnight 그럴 바엔 받고 또 받고 또 한수 둬줄게"
2011.08.14~08.20,84,3450766,Sweet Dream,레인보우,Sweet Dream,2011.06.22,Dance,"길학미,더블케이(DoubleK)",Hey Boy Your My Dream  Uh Don't you Wake Me Up  Baby I can't let you go  달콤한 꿈 속에서  날 깨우지 말아줘  사랑의 품 속으로  날 계속 데려가줘  날 바라보는 그대  그 무거운 시선이  느껴지는데 I know  아무 말 없이도 알죠 눈빛만 봐도 날 떠나려는 그대 그 차가운 말만은 하지 말아줘 Oh baby 우린 잘해왔잖아 어둠이 와도 넌 늘 그 자리에 날 비추던 star 따스하게 날 감싸주던 sunshine 넌 그래왔잖아 늘 함께했잖아 이럴순 없어 떠나가지마  Baby I can't let you go 달콤한 꿈 속에서 날 깨우지 말아줘 사랑의 품 속으로 날 계속 데려가줘 난 두 귀를 막아도 오 그대의 목소리가 들리는데 Oh baby 내게 말했었잖아 사랑한다고 넌 늘 그 자리에 날 비추던 star 따스하게 날 감싸주던 sunshine 넌 그래왔잖아 늘 함께했잖아 이럴순 없어 떠나가지마  Baby I can't let you go 달콤한 꿈 속에서 날 깨우지 말아줘 사랑의 품 속으로 날 계속 데려가줘 내 손을 놓지 말아줘 우린 사랑의 비가 와도 이 비가 다 지나가고 나면 볼 수 있을거야 Rainbow 빨주노초파남보 무지개 그게 바로 우리 앞 펼쳐진 미래 누가 뭐래도 난 꿈을 믿지 그건 너라는 내 one and only sweet dream 라라 라라 그대없이 멀어지는 나의 sweet dream 라라 라라 그대없이 사라지는 나의 sweet dream Baby I can't let you go 달콤한 꿈 속에서 날 깨우지 말아줘 사랑의 품 속으로 날 계속 데려가줘 Baby I can't let you go
2011.08.14~08.20,85,3530042,IDOL,자우림,陰謀論 (음모론),2011.08.18,Rock,김윤아,"아무 것도 모르고 유치한 감상에 빠지는 게 아니야 어디까지나 비현실적이라는 것 쯤 누구보다 잘 알아 그래도 나는 꿈을 꾸잖아 이상한 이 세상에서도 이해할 수 없다는 듯 눈을 흘기는 네가 난 더 불쌍해 달콤한 데 빠지는 게 뭐가 나쁘단 건지 헛된 망상에 빠지는 게 뭐가 나쁜지 나는 사랑을 할 뿐이야 쇼가 계속되는 동안 아이돌 세상이 날 꿈꾸게 해주지 않으니까야 현실이 내게 아프게만 다가오니까야 아무도 상처입지 않아 너는 나만의 아이돌 HIRO, oh, JOE, FREDDY, JANE TOM, MICHEL AND CATE HEATHER AND TILDA 나는 사랑을 할 뿐이야 아무 것도 모르고 유치한 감상에 빠지는 게 아니야 어디까지나 비현실적이라는 것 쯤 누구보다 잘 알아 그래도 나는 꿈을 꾸잖아 이상한 이 세상에서도 이해할 수 없다는 듯 눈을 흘기는 네가 난 더 불쌍해 달콤한 데 빠지는 게 뭐가 나쁘단 건지 헛된 망상에 빠지는 게 뭐가 나쁜지 나는 사랑을 할 뿐이야 쇼가 계속되는 동안 아이돌 아이돌 아이돌"
