time,rank,song_id,title,singers,album,date,genre,creator,lyric
2015.11.23~11.29,1,7933703,못먹는 감 (Sour Grapes),"SanE,매드클라운",못먹는 감,2015.11.19,Rap / Hip-hop,"SanE,매드클라운",나 지금 뭐래니 나도 잘 몰라  너 조금 놀랬지 미안해 사과 나 내일 일어나면 후회할 거 알아도  질러 보려 해 해 해 해 어머님 누구니 한번 뵙고 싶다 어떻게 해야지 내게 바나나 나 내일 일어남 후회할거 알아도 찔러 보려 해 해 해 해 아 몰라 못 먹는 감 못 먹는 감 못 먹는 감 걍 그림에 그림에 떡떡 야 니 콧대가 차로 치면 삼각 별이라며 반도 전체가 니 양식장 바다가 삼면이라며 근데 잠깐 넌 불안 불안해 내가 볼 때 두 눈망울에 외로움이 음 그렁그렁해 날 몰래 본거 다 알아 볼 빨개졌네 뭘 아닌 척 귀엽긴 하하 니 심장치고 갔으니까 난 뺑소니네 어이구 사랑의 교통사고 뛰뛰빵빵 넌 날 사귀어야 돼 그건 내 결심이야 남친 있으면 정리해라 이건 선심이야 어 만나야 돼 진심 난 치토스 같은 자식 언젠간 먹고 말거야 이게 발라드 랩 정신이야 whow 내가 좀 노골적이라 넌 좀 설렜을 건데 이런 치명적 고백 처음일거다 꺼지라고 어떻게 사랑이 그래 내 맘에 살랑살랑 자꾸 바람이 부네 eh 나 지금 뭐래니 나도 잘 몰라  너 조금 놀랬지 미안해 사과 나 내일 일어나면 후회할 거 알아도  질러 보려 해 해 해 해 어머님 누구니 한번 뵙고 싶다 어떻게 해야지 내게 바나나 나 내일 일어남 후회할거 알아도 찔러 보려 해 해 해 해 아 몰라 못 먹는 감 못 먹는 감 못 먹는 감 걍 그림에 그림에 떡떡 칭찬 좀 할게 너는 비쥬얼류 갑갑 붙여줘야 해 너의 이름 앞엔 갓갓 역대급 퀄 이런 개이득 대박각 고마워 참 잘 자라줘서 짝짝 박수 쳐줄게 인정 내 취향 넌 웃는 모습 완전 존예 순간 캡쳐 할 뻔 멍청한 사내놈들에게 스캐너 한번 찌융 훑어만 줘도 널 위해 대출하려 할 걸 족족 수컷 follower 득실 돼 니 인스타그램 look at her picture 자동반사 텐트치게 돼 사스가 성진국처럼 적나라 가림 없지 노모 가식 역시 no no Ay bay bay 이런 실물깡패 니 옆에 서면 호모새피엔스 돼요 백에 백 U so fly 하늘 위 미친 연처럼 아낌 없이 날려줄게 만세 나 지금 뭐래니 나도 잘 몰라  너 조금 놀랬지 미안해 사과 나 내일 일어나면 후회할 거 알아도  질러 보려 해 해 해 해 어머님 누구니 한번 뵙고 싶다 어떻게 해야지 내게 바나나 나 내일 일어남 후회할거 알아도 찔러 보려 해 해 해 해 아 몰라 못 먹는 감  못 먹는 감 못 먹는 감 걍 그림에 그림에 떡 또 하나의 사랑 노래가 나왔네 딴 거 해보려 했지만 또 발라드 랩 나 지금 랩퍼 아냐 노래하는 남자 욕먹어도 좋아 먹을 수 있어 니 쪽으로 고갤 천천히 돌렸네 내 착각 니가 날 볼 리 없네 못 먹어도 격하게 찔러보지 누가 알아 니가 열 번 찍은 나무될지 난공불락 못 먹는 감 못 먹는 감 못 먹는 감 걍 그림에 그림에 떡떡 못 먹는 감 못 먹는 감 못 먹는 감 걍 그림에 그림에 떡떡
2015.11.23~11.29,2,7911687,Boys And Girls (Feat. Babylon),지코(ZICO),Boys and Girls,2015.11.03,Rap / Hip-hop,지코(ZICO),Don't worry about money 놀자 오빠가 무리할게 넌 그냥 옆에서 편하게 groove 타기만 해 alright I’m a boy you’re a girl I’m a boy but you’re a girl I’m a boy you’re a girl 아름다운 여자는 대접 받아야 해 아는 친구들 불러모아 흥이 많고 사교성 좋은 애들로만 여긴 한국이지만 서구적인 느낌 가득 아 참 일렉은 절대 안 틀 거야 흠뻑 다 젖어 알콜로 샤워해 ice bucket challenge 저 고주망태는 누가 낚아 챌는지 키는 컸어도 호기심은 미성년 주체 못하는 바람에 주최한 festivity OH UH OH UH 날 알아봐도 티나게 리액션 하지 말아줘 OH UH OH UH 인스타 업뎃이 목적이면 겉옷 챙겨서 나가줘 OH UH OH UH 안목 있는 누나들 want to see ma tattoo 전화기 뒤집자 분위기 좋으니까 진지 빠는 즉시 귀가조치야 Don't worry about money 놀자 오빠가 무리할게 넌 그냥 옆에서 편하게 groove 타기만 해 alright I’m a boy you’re a girl I’m a boy but you’re a girl I’m a boy you’re a girl 아름다운 여자는 대접 받아야 해 이 파티에는 대부분이 잘나가니까 섣불리 가오 잡다간 곧바로 망신살 사양 말고 마셔 그건 네 인생샷 아무나 잡고 사진 박아도 네 인생샷 I’m intoxicated 남여남여 나눠 착석해 음탕한 게임 하더라도 밖에선 입 단속해 해 뜨고 네 화장도 뜨고 나 먼저 자리 뜨기 전까지 계속 뜨거 OH UH OH UH 다 망가지는 마당에 고상한 척은 자제해 OH UH OH UH 뜬금없는 일 얘기나 고민 상담은 따로해 OH UH OH UH 흑기사 자처하는 쟤는 무슨 심보 전화기 뒤집자 분위기 좋으니까 진지 빠는 즉시 귀가조치야 Don't worry about money 놀자 오빠가 무리할게 넌 그냥 옆에서 편하게 groove 타기만 해 alright I’m a boy you’re a girl I’m a boy but you’re a girl I’m a boy you’re a girl 아름다운 여자는 대접 받아야 해 Say hello to ma little friends 개념 다 차있지 실수하지 않게 당부해놨지 OH UH OH UH 부담 없이 누리면 돼 Don't worry about money 놀자 오빠가 무리할게 넌 그냥 옆에서 편하게 groove 타기만 해 alright I’m a boy you’re a girl I’m a boy but you’re a girl I’m a boy you’re a girl 아름다운 여자는 대접 받아야 해
2015.11.23~11.29,3,7861392,또 다시 사랑,임창정,또 다시 사랑,2015.09.22,Ballad,임창정,아픔이 좀 더 작아질까 의미 없는 만남을 하다가 어느 날 그대가 흘린 눈물 왠지 나와 같다 느껴서 이렇게 그대를 지키는가 봐요 행복하고 싶었던 그대를 몰랐던 누군갈 또 알아가면서 분명 행복할 걸 알겠지만 내가 그대를 만났다는 건 어쩌면 흘러가는 흔한 인연이란 것 일지 모르지만 오늘도 다시 또 다시 사랑해요 사랑 언제나 이번이 마지막이라며 처음인 듯 찾아오니까 어느 날 그대가 숨긴 눈물 왠지 나와 같다 느껴서 이렇게 그대를 지키는 가 봐요 행복하고 싶었던 그대를 몰랐던 누군갈 또 알아가는 게 혹시 두렵기도 하겠지만 내가 그대를 만났다는 건 어쩌면 흘러가는 흔한 인연이란 것일지 모르지만 오늘도 다시 또 다시 사랑해요 사랑 언제나 이번이 마지막이라며 처음인 듯 찾아오니까 절대 우리 작은 다툼조차 하지 마요 이별 후엔 서운함만 가슴속에 남으니 사소한 그 표현이 그 말들이 언제나 나에겐 참 고마울 거예요 내가 그대를 만났다는 건 어쩌면 흘러가는 흔한 인연이란 것 일지 모르지만 오늘도 다시 또 다시 사랑해요 사랑 언제나 이번이 마지막이라며 처음인 듯 찾아오니까 사랑 언제나 이번이 마지막이라며
2015.11.23~11.29,4,7931723,꿀잼,다이나믹듀오,GRAND CARNIVAL,2015.11.17,Rap / Hip-hop,다이나믹듀오,kick back 꿀잼 허니잼 here I am  and I'm lookin' at you 꿀잼 허니잼 오늘은 선을 넘고 싶은 밤 다리에 깁스를 한 듯 따분해 수요일 자정의 담을 겨우 넘은 밤 찾아 다니지 아무도 관심 없는 우리 둘만의 잉여공간 적당히 취한 너는 보도 위에서 트리플 악셀 밝게 빛이 나는 너의 얼굴과 네온에 온 거리는 착색 돼 나의 연아 손목엔 도장 찍고 전화 꺼놔 아무도 없는 클럽의 두 시 반 술과 음악이 있는 수요일 밤 친구가 될 수 있을까 내일부터 anymore 꿀잼 오늘밤은 핵잼 꿀잼 허니잼 here I am  꿀잼 오늘밤은 핵잼 광대뼈가 조금 욱신욱신 해 now I’m lookin’ at you 난 김건모 넌 나의 90년대 너랑 있을 때 난 최고 무지 편해 그만 두리번대 이정도 뮤직 불이면 술이면 우리 둘이면 돼 분위기 죽여 넌 묻어 얼굴을 내 가슴에 내 손가락 니 귀 뒤로 날아가 널 마중해 blues time 친구 연인 그 중간 선을 smooth하게 넘는 이 순간 아무도 없는 클럽의 두 시 반 어색함이 선을 긋지만 더 가까이 붙지 난 수요일 밤 오늘밤은 우리 순진한 척 하며 뒤로 숨지마 턱 밑까지 차오른 충동 속에 빠져볼까 둘이 손잡고 풍덩 꿀잼 오늘밤은 핵잼 꿀잼 허니잼 here I am  꿀잼 오늘밤은 너와나 단둘이만 핵잼 광대뼈가 조금 욱신욱신 해 now I’m lookin’ at you 태양은 아직 멀었고 지금 우리 기분은 탑 이 밤을 경영 관리 잘 한다면 우린 대성할 것 같아 심장은 불 뿜지 마치 dragon dragon 잘 길들여 승리해요 서로에 대한 호감은 이순간부로 격렬하게 팽창한다 빅뱅 빅잼 꿀잼 오늘밤은 핵잼 꿀잼 허니잼 here I am 꿀잼 오늘밤은 핵잼
2015.11.23~11.29,5,7924015,안아보자,포맨,4MEN 1st Live Album,2015.11.10,Ballad,최성일,말을 하지 많이 힘들었다고 이런 내가 미안해 티를 내지 이젠 내게 지친걸 사랑하지 않는 걸 눈치도 없이 무슨 일인지 걱정한 내가 바보 같아 꼭 한번만 더 안아보자 조금만 더 이렇게 있자 다시는 안 그럴 테니까 오늘만 그렇게 하자 매일 밤 널 보내던 익숙한 나의 인사가 이별 인사가 될 줄 몰랐어 꼭 한번만 더 안아보자 못 보겠단 너를 불러내놓고 또 아무 말 못하고 잡은 네 손만 놓지 못하고 참았던 눈물이 흘러 꼭 한번만 더 안아보자 조금만 더 이렇게 있자 다시는 안 그럴 테니까 오늘만 그렇게 하자 매일 밤 너를 보내던 익숙한 나의 인사가 이별 인사가 될 줄 몰랐어 힘들었지 참 미안해 이제 그만 아프지 마 제발 힘들었지 떠나지마 참 미안해 이러지마 이제 그만 내 곁에 있어 내 걱정은 하지마 난 괜찮아 난 괜찮아 우리 다시는 울지 말자 오늘까지만 아파하자 이제 널 보내줄 테니까 한번만 내게 웃어줘 매일 밤 네가 그리워 견딜 자신이 없지만 그냥 아무 일 없던 것처럼 꼭 한번만 더 안아보자
2015.11.23~11.29,6,7896508,스물셋,아이유,CHAT-SHIRE,2015.10.23,Dance,아이유,I'm twenty three  난 수수께끼 Question 뭐게요 맞혀봐요 I'm twenty three 틀리지 말기 Because  난 몹시 예민해요 맞혀봐 한 떨기 스물셋 좀  아가씨 태가 나네 다 큰 척해도 적당히 믿어줘요 얄미운 스물셋 아직 한참 멀었다 얘  덜 자란 척해도 대충 속아줘요 난 그래 확실히 지금이 좋아요  아냐 아냐 사실은 때려 치고 싶어요 아 알겠어요 나는 사랑이 하고 싶어 아니 돈이나 많이 벌래 맞혀봐  어느 쪽이게 얼굴만 보면 몰라 속마음과 다른 표정을 짓는 일 아주 간단하거든 어느 쪽이게 사실은 나도 몰라 애초에 나는 단 한 줄의  거짓말도 쓴 적이 없거든 여우인 척 하는 곰인 척 하는 여우 아니면 아예 다른 거 어느 쪽이게 뭐든 한 쪽을 골라 색안경 안에 비춰지는 거 뭐 이제 익숙하거든 Check it out 겁나는 게 없어요 엉망으로 굴어도  사람들은 내게 매일 친절해요 인사하는 저 여자 모퉁이를 돌고도 아직 웃고 있을까 늘 불안해요 난 영원히 아이로 남고 싶어요 아니 아니 물기 있는 여자가 될래요 아 정했어요 난 죽은 듯이 살래요 아냐 다 뒤집어 볼래 맞혀봐 어느 쪽이게 얼굴만 보면 몰라 속마음과 다른 표정을 짓는 일 아주 간단하거든 어느 쪽이게 사실은 나도 몰라 애초에 나는 단 한 줄의  거짓말도 쓴 적이 없거든 여우인 척 하는 곰인 척 하는 여우 아니면 아예 다른 거 어느 쪽이게 뭐든 한 쪽을 골라 색안경 안에 비춰지는 거 뭐 이제 익숙하거든 난 당신 맘에 들고 싶어요 아주 살짝만 얄밉게 해도 돼요 난 당신 맘에 들고 싶어요 자기 머리 꼭대기 위에서 놀아도 돼요 맞혀봐 어느 쪽이게 얼굴만 보면 몰라 속마음과 다른 표정을 짓는 일 아주 간단하거든 어느 쪽이게 사실은 나도 몰라 애초에 나는 단 한 줄의  거짓말도 쓴 적이 없거든 여우인 척 하는 곰인 척 하는 여우 아니면 아예 다른 거 어느 쪽이게 뭐든 한 쪽을 골라 색안경 안에 비춰지는 거 뭐 이제 익숙하거든
2015.11.23~11.29,7,7935396,HOT PINK,EXID,HOT PINK,2015.11.18,Dance,"신사동호랭이,BEOMxNANG,LE(EXID),몬스터팩토리",U I Like The Way U Pink It U I Like The Way U Pink It Everybody Knows PINK HOT PINK HOT PINK HOT PINK HOT HOT HOT HOT HOT PINK PINK HOT PINK HOT 나나나나나나나 여기 있는 모두가 똑같은 색이야  네가 볼 때 사실 그렇게 보고 싶은 거지 내가 볼 땐 나는 어떤 색 같니 네가 봐도 조금 다르지 않니 난 더 가까이 와서 맘을 좀 열어봐 Oh 너 빼고 다 아는 내 깔롱 네가 어디에서도 경험 못할 내 Color Push Push Work It Out Don't Stop Hey Work It Out 불 보듯 뻔한 네 말로 이런 건 어디도 없지 빨주노초파남보 Push Push Work It Out Never Stop It Girl Work It Out 시간이 갈수록 불안해져 가 그냥 이대로 날 지나칠까 봐 아직 네가 보지 못한 게 많은데  그걸 왜 자꾸 너만 몰라 Everybody Knows PINK HOT PINK HOT 넌 듣도 보도 못한 PINK HOT PINK HOT 내가 바로 그 유명한 HO HO HO HOT PINK  네 눈 돌아 돌아 돌아 돌아갈 걸 PINK HOT PINK HOT 나나나나나나나 비가 떨어지고 네 안에 번지듯  아무도 몰래 물들여 줄래 두 눈을 감고서 그냥 느껴도 돼 곁에 있을게 널 위해서 그냥 한 번 속는 셈 치고 날 들여다 봐 다시 눈 비비고 Yeah Push Push Work It Out Don't Stop Hey Work It Out 이런 건 처음이지 환영해 어서 와 Hot  Pink Hot Hottie Hottie Hot So Hot Push Push Work It Out Never Stop It Girl Work It Out 이 밤이 갈수록 지쳐가는 나 그냥 이제 널 놔 버릴까 봐 아직도 가슴에 뭔가 남았는데 그걸 왜 자꾸 너만 몰라 Everybody Knows PINK HOT PINK HOT 넌 듣도 보도 못한 PINK HOT PINK HOT 내가 바로 그 유명한 HO HO HO HOT PINK  네 눈 돌아 돌아 돌아 돌아갈 걸 PINK HOT PINK HOT 나나나나나나나 낯뜨겁게 네 눈이 부시게 오에오에오 오에오에오 조심스럽게 조금 더 민감하게 오에오에오 나나나나나나나
2015.11.23~11.29,8,7931712,지못미,iKON,WELCOME BACK,2015.11.16,R&B / Soul,"TEDDY,KUSH,B.I,BOBBY",언제나 넌 같은 자리에 항상 날 기다렸지만 I was gone I was gone 바보같이 나를 믿지 마 영원히 널 지키겠단 말 거짓말 거짓말 오늘따라 자주 보던 TV Drama에선 뻔한 장면들이 날 보며 비웃고 있어 난 마치 죄인처럼 run away 넌 오늘도 내게 소리 질러 go away 내가 이기적인 놈이란 걸 넌 알고 있었잖아 사소한 관심을 바란 네가 부담스러웠나 봐 그 흔한 사진 한 장도 남기지 못한 채 마지막 순간까지도 우린 나만 생각해 미안 미안 지켜주지 못해 미안해 잘 살길바래 미안 미안 너도 날 잊어줘 아프지만 영원히 함께하잔 그 약속 이제는 없는 거야 지켜주지 못해서 미안해 언제나 난 다른 자리에 매일 밤 나의 친구들과 I’m out all night 뒤집어놓은 내 전화기엔 너의 마지막 한 통의 부재중 전화 오늘따라 흘러나오는 Radio에선 같이 즐겨 듣던 노래가 나오고 있어 난 마치 죄인처럼 run away 넌 오늘도 내게 소리 질러 go away 너에게 오고 가는 사람들 중 한 명이기를 바람 그리고 눈물 벚꽃 모두 떨궈 새싹 피기를 바람 그리고 우리 추억 노을처럼 짧고 아름답기를 바래 이 모든 것 발을 못 뗀 너의 가냘픈 등 기분 좋게 밀기를 미안 미안 지켜주지 못해 미안해 잘 살길바래 미안 미안 너도 날 잊어줘 아프지만 영원히 함께하잔 그 약속 이제는 없는 거야 지켜주지 못해서 미안해 지금까지 차마 못 했던 말 미안해 내가 부족해 끝까지 작은 모습뿐 이라서 yeah 널 채워주지 못한 나를 용서해 나보다 괜찮고 잘난 사람 만나길 바래 미안 미안 지켜주지 못해 미안해 잘 살길바래 미안 미안 너도 날 잊어줘 아프지만 영원히 함께하잔 그 약속 이제는 없는 거야 지켜주지 못해서 미안해 지켜주지 못해서 미안해
2015.11.23~11.29,9,7877917,I (Feat. 버벌진트),태연(TAEYEON),I - The 1st Mini Album,2015.10.07,Ballad,"태연(TAEYEON),Mafly,버벌진트",빛을 쏟는 Sky  그 아래 선 아이 I  꿈꾸듯이 Fly  My Life is a Beauty  어디서 많이 들어본 이야기  미운 오리와 백조  또 날기 전의 나비  사람들은 몰라  너의 날개를 못 봐  네가 만난 세계라는 건  잔인할지도 몰라  But strong girl  you know you were born to fly  네가 흘린 눈물  네가 느낀 고통은 다  더 높이 날아오를 날을 위한  준비일 뿐 Butterfly  Everybody's gonna see it soon  빛을 쏟는 Sky  그 아래 선 아이 I  꿈꾸듯이 Fly  My Life is a Beauty  잊었던 꿈 내 맘 또 그려내  움츠렸던 시간  모두 모아 다 삼켜내  작은 기억 하나 둘씩 날 깨워가  세상 가득 채울 만큼  나를 펼쳐가  길고 긴 밤을 지나  다시 Trip 길을 떠나볼래  Why not  이 세상에 내 맘을  깨워 주는 한마디  혼자였던 Yesterday  셀 수 없는 시선에  떨어지는 눈물로 하루를 또 견디고 아슬했던 Yesterday 쏟아지던 말들에 흔들리는 나를 또 감싸고 빛을 쏟는 Sky 그 아래 선 아이 I 꿈꾸듯이 Fly My Life is a Beauty My Life is a Beauty 꽃잎은 저물고 힘겨웠던 난 작은 빛을 따라서 아득했던 날 저 멀리 보내고 찬란하게 날아가 빛을 쏟는 Sky 새로워진 Eyes 새로워진 Eyes 저 멀리로 Fly Fly High Fly High 난 나만의 Beauty 눈 감은 순간 시간은 멈춰가 난 다시 떠올라
2015.11.23~11.29,10,7881505,No Make Up,Zion.T,No Make Up,2015.10.12,R&B / Soul,"Zion.T,KUSH",진하게 화장을 하고 예쁘게 머리를 하고 오늘도 집을 나서는 넌 예뻐 높은 구두를 신고 짧은 치마를 입고 있는 너 너무나 아름다워 but 넌 모를 거야 자다가 일어나 살짝 부은 얼굴이 얼마나 예쁜지 넌 모를 거야 자기 전 세수한 니 모습이 얼마나 예쁜지 자꾸 거울 보지 마 몸무게 신경 쓰지 마 넌 그냥 그대로 너무 예쁜 걸 No make up ye no make up ye No make up 일 때 제일 예쁜 너 빨간색 립스틱보다 투명한 립밤이 좋아 저 하늘 구름보다 자연스러워 어제도 힘들었는지 너무 지쳐 보여 너 이리 와서 내 품에 안겨 baby 넌 모를 거야 아이라인 없이 웃는 너의 예쁜 눈 웃음을 넌 모를 거야 메이크업 베이스 지우면 빛나는 우윳빛 피부 자꾸 거울 보지 마 몸무게 신경 쓰지 마 넌 그냥 그대로 너무 예쁜 걸 No make up ye no make up ye No make up 일 때 제일 예쁜 너 아무리 얘기해도 넌 모르겠다고 하지만 바보 같아 오늘 내일 다음 날도 매일 말해주고파 예쁜 얼굴 넌 그냥 그대로 너무 예쁜 걸 No make up ye no make up ye No make up 일 때 제일 예쁜 너
2015.11.23~11.29,11,7891119,OOH-AHH하게,TWICE(트와이스),THE STORY BEGINS,2015.10.20,Dance,"블랙아이드필승,SamLewis",모두 나를 가지고 매일 가만 안 두죠 내가 너무 예쁘죠 나 때문에 다 힘들죠 어딜 걷고 있어도 빨간 바닥인거죠 Red carpet 같은 기분 모두 날 쳐다 보죠 oh 어떤 사람은 어머님이 누구냐고 신선하게 말 걸어도 아무 느낌이 안 들죠 하지만 나도 누군가 하고 사랑에 빠져보고 싶어 Baby 잘 들어요 내 Boy 단 한번도 느껴본 적 없는 걸 알게 해주는 사람 기다리고 있는 걸 얼마가 돼도 기다리고 싶어 I just wanna fall in love 어떻게 내가 움직일 수 없게  날 Ooh Ahh Ooh Ahh 하게 만들어줘 가짜 가짜 진심 없는 가짜  잘 가 잘 가 Huh OOH AHH하게 어떻게 이제 더 할말이 없게  날 Ooh Ahh Ooh Ahh 하게 만들어줘 Bla La La La 말만하지 말고  느껴지게 Huh OOH AHH하게 날 봐 거봐 또 두 번 봐 한번 지나치고 등을 돌려 쳐다봐 TWICE 어딜 가더라도 항상 민 낯 하지만 내가 제일 빛나 낮은 신발 신어도 가치는 High 머릿속엔 늘 영화 속 같은 La La La 장면들이 지나가네 생각만해도 떨리네 Yeah 이제는 나도 누군가 하고 사랑에  빠져 보고 싶어 Baby 잘 들어요 내 Boy 단 한번도 느껴본 적 없는 걸 알게 해주는 사람 기다리고 있는 걸 얼마가 돼도 기다리고 싶어 I just wanna fall in love 어떻게 내가 움직일 수 없게  날 Ooh Ahh Ooh Ahh 하게 만들어줘 가짜 가짜 진심 없는 가짜  잘 가 잘 가 Huh OOH AHH하게 어떻게 이제 더 할말이 없게  날 Ooh Ahh Ooh Ahh 하게 만들어줘 Bla La La La 말만하지 말고  느껴지게 Huh OOH AHH하게 아무하고 만나 시작하기 싫어  쉽지 않은 여자 그게 나인걸  Let me see How you gon treat me I ain't no easy Better think about it TWICE Let me see How you gon treat me I ain't no easy Better think about it TWICE 어떻게 내가 움직일 수 없게  날 Ooh Ahh Ooh Ahh 하게 만들어줘 가짜 가짜 진심 없는 가짜  잘 가 잘 가 Huh OOH AHH하게 어떻게 이제 더 할말이 없게  날 Ooh Ahh Ooh Ahh 하게 만들어줘 Bla La La La 말만하지 말고  느껴지게 Huh OOH AHH하게 OOH AHH하게
2015.11.23~11.29,12,7854179,취향저격,iKON,WELCOME BACK,2015.11.16,Rap / Hip-hop,"B.I,BOBBY,KUSH",너는 내 취향저격 내 취향저격 말하지 않아도 느낌이 와 머리부터 발끝까지 다 너는 내 취향저격 난 너를 보면 가지고 싶어서 안달이 나 자기 전까지도 생각이 나 pow 가는 발목 아래 운동화와 청색 스키니진의 완벽한 조화 살짝 큰 듯한 가디건 아래 뚝 떨어진 긴 생머리가 참 고와 수줍은 눈웃음도 멍 때리는 듯한 모습도 예쁘게만 보이고 가슴이 막 떨려 왜 이제야 나타났니 you're my 취향저격 oh oh 너의 가녀린 미소 oh oh 나를 보는 눈빛도 흠잡을 데가 없어 한시도 지루할 틈이 없어 perfect oh oh 애교 섞인 목소리 oh oh 가까워지는 우리 왜 이제야 나타났어 드디어 사랑이 찾아왔어 너는 내 취향저격 내 취향저격 말하지 않아도 느낌이 와 머리부터 발끝까지 다 너는 내 취향저격 난 너를 보면 가지고 싶어서 안달이 나 자기 전까지도 생각이 나 pow A girl 잠시 말 좀 물을게 그 까칠한 말투는 어디서 또 배웠대 you work and walk and spit words like a boss wonder woman 현실판은 너의 여성스러움 Oh 느낌적인 느낌 또 뭔가 매혹적인 눈빛에 매료돼 섬세한 그 손길 또 뭔가 어정쩡한 몸짓 I like it babe oh oh 너의 가녀린 미소 oh oh 나를 보는 눈빛도 흠잡을 데가 없어 한시도 지루할 틈이 없어 perfect oh oh 애교 섞인 목소리 oh oh 가까워지는 우리 왜 이제야 나타났어 드디어 사랑이 찾아왔어 너는 내 취향저격 내 취향저격 말하지 않아도 느낌이 와 머리부터 발끝까지 다 너는 내 취향저격 난 너를 보면 가지고 싶어서 안달이 나 자기 전까지도 생각이 나 pow 난 니가 정말 좋아 또 가끔 하품하는 모습까지도 내 스타일이야 오 마음이 잘 맞아 내 가슴이 벅차올라 니가 날 부를 때마다 입가에 웃음이 끊이질 않아 Oh girl you know that I love you 너는 내 취향저격 내 취향저격 말하지 않아도 느낌이 와 머리부터 발끝까지 다 너는 내 취향저격 난 너를 보면 가지고 싶어서 안달이 나 자기 전까지도 생각이 나 pow 난 니가 정말 좋아 또 가끔 하품하는 모습까지도 내 스타일이야 난 니가 정말 좋아 또 가끔 하품하는 모습까지도 내 스타일이야
2015.11.23~11.29,13,7943030,그날을 내 등 뒤로,허각,겨울동화,2015.11.23,Ballad,전해성,어제보다 한산해진 걸  난 그래서 처량한데  왜 난 지금 혼자서 걷나  그 좋은 널 뒤에 두고  자꾸 내 뒤를 따라오지 마요  지금은 헤어질 때  따라와 안기지 좀 마요  그대 눈물은 보기 싫어  안녕 이제 그만 정주는 짓 다 그만  힘들어 우리 사랑하면서 살 날들이 잡힐 듯 가슴속에 간직한 그날을 내 등 뒤로 조용히 떠나보낸다 자꾸 내 이름 부르지 좀 마요 지금은 헤어질 때 내 앞을 가로막지 마요  그대 눈물은 보기 싫어 안녕 이제 그만 정주는 짓 다 그만 힘들어 우리 사랑하면서 살 날들이 잡힐 듯 가슴속에 간직한 그날을 내 등 뒤로 조용히 떠나보낸다 너란 사람은 그렇게 나란 사람은 이렇게 엇갈리며 멀어지며 잊혀져 안녕 그래 지금 이 인사는 마지막 미안해 다신 그댈 널 잡을 수 없기에 잡힐 듯 가슴속에 간직한 그날을 내 등 뒤로 조용히 떠나보낸다 내 사랑 떠나보낸다
