time,rank,song_id,title,singers,album,date,genre,creator,lyric2016.07.25~07.31,20,8244030,Why,태연(TAEYEON),Why - The 2nd Mini Album,2016.06.28,Dance,조윤경,Why  Oh yeah yeah Oh 언젠가는 내 두 발이 Oh 닿는 대로 이끌리는 시선을 뺏겨버린 대로 가볍게 걸어갈 낯선 곳을 그리다 또 결국엔 허전한 긴 한숨에 멈춰 Why Why 돌아서 또 넌 Why Why 꿈만 가득해 지금 떠난다면 Good Good Good yeah 만나게 될 모든 건 Great Great yeah 가벼워진 맘이 Work Work baby 이미 이미 눈 앞에 아른아른대는데 망설여 Why 나침반 위 돌아가던 바늘이 멈춘 곳에 가득 핀 이름 모를 꽃잎이 널 위해 끌어당긴 빛이 담긴 풍경 속에 어서 뛰어들어 나보다 자유롭게 더 Why Why Why 괜히 미뤄 왔던 날 많았던 걱정이 모두 다 사라진 tonight yeah 바람 불어오면 Good Good Good yeah 펼쳐지는 모든 건 Great Great yeah 달라지는 맘이 Work Work baby 이미 이미 눈 앞에 아른아른대는데 지금 떠난다면 Good Good Good yeah 만나게 될 모든 건 Great Great yeah 가벼워진 맘이 Work Work baby 이미 이미 눈 앞에 아른아른대는데 망설여 Why 쫓아가기도 벅차 숨이 찬 세상이 전부는 아냐 하루 종일 걸어도 똑같은 풍경은 절대 보이지 않아 하얀 종이에 적어 본 Why 잉크처럼 번지는 맘 I'm falling I'm falling I'm falling to you 바람 불어오면 Good Good Good yeah 펼쳐지는 모든 건 Great Great yeah 달라지는 맘이 Work Work baby 이미 이미 눈 앞에 아른아른대는데 지금 떠난다면 Good Good Good yeah 만나게 될 모든 건 Great Great yeah 가벼워진 맘이 Work Work baby 이미 이미 눈 앞에 아른아른대는데 망설여 Why
2016.07.25~07.31,21,8247080,쿵,Zion.T,쇼미더머니 5 Special,2016.06.29,Rap / Hip-hop,Zion.T,"제일 먼저 기억나는 건 새까만 벽 앞에 걸려있던 마이크 30000원  어머니가 쓰시던 노트북에 깔았던 빨간색 마름모 그 때 부터였지 열일곱, 열여덟 열일곱, 열여덟  Dynamic Duo, 1tym - hot 뜨거 Oh yeah, oh shit 이런 건 처음 들어 쿵쿵쿵 옆집 사람들은 날 싫어해 ""시끄러워 게임 그만해 컴퓨터 끄고 공부나 해"" (게임 아닌데)  어 지금 들리는 박수 소리는 가끔 어색해 쿵쿵 그때 난 짝짝 소리를 듣게 될 줄은 Gray Loco Crush Elo 다 잘지내?  각자 자리에서 빛나고 있지 존나 멋지게 가끔 소주 한 잔 땡길 때 못 보는 게 씁쓸해 근데 씁쓸해도 어쩔 수 없지 갈 길이 멀기에 조명이 꺼지면 우린 어디에 있을까 그게 궁금해  안경이 무거워 조명이 너무 밝어 다들 부담스러워 날 그렇게 보지말어 난 여전해  난 여전히 녹음실에 서서 밤새고 노래를 쓰고있지 I'm still on my way 여전히 여기 이 자리 내 가족 내 친구 우리동네 이 거리 Still on my way 난 바뀐게 없지 거의 없지  쿵쿵 내 심장 소리 쿵쿵 쿵쿵"
2016.07.25~07.31,22,8033528,어디에도,엠씨더맥스,pathos,2016.01.28,Ballad,"송양하,이수(엠씨더맥스)",차가워진 눈빛을 바라보며 이별의 말을 전해 들어요 아무 의미 없던 노래 가사가 아프게 귓가에 맴돌아요 다시 겨울이 시작되듯이 흩어지는 눈 사이로 그대 내 맘에 쌓여만 가네 떠나지 말라는 그런 말도 하지 못하고 고개를 떨구던 뒷모습만 그대 내게 오지 말아요 두 번 다시 이런 사랑 하지 마요 그댈 추억하기보단 기다리는 게 부서진 내 맘이 더 아파와 다시 누군가를 만나서 결국 우리 사랑 지워내도 행복했던 것만 기억에 남아 나를 천천히 잊어 주기를 아무것도 마음대로 안 돼요 아픔은 그저 나를 따라와 밤새도록 커져 버린 그리움 언제쯤 익숙해져 가나요 많은 날들이 떠오르네요 우리가 나눴던 날들 애써 감추고 돌아서네요 떠나지 말라는 그런 말도 하지 못하고 고개를 떨구던 뒷모습만 그대 내게 오지 말아요 두 번 다시 이런 사랑 하지 마요 그댈 추억하기보단 기다리는 게 부서진 내 맘이 더 아파와 다시 누군가를 만나서 결국 우리 사랑 지워내도 행복했던 것만 기억에 남아 나를 천천히 잊어 주기를 부를 수도 없이 멀어진 그대가 지나치는 바람에도 목이 메어와 어디에도 그대가 살아서 우린 사랑하면 안 돼요 다가갈수록 미워지니까 행복했던 것만 기억에 남아 나를 천천히 잊어 가기를 사랑했던
2016.07.25~07.31,23,8148487,하늘바라기 (Feat. 하림),정은지,Dream,2016.04.18,Ballad,"이단옆차기,정은지,LongCandy",꽃 잎이 내 맘을 흔들고  꽃 잎이 내 눈을 적시고  아름다운 기억  푸른 하늘만  바라본다 꼬마야 약해지지마  슬픔을 혼자 안고 살지는 마  아빠야 어디를 가야  당신의 마음처럼 살 수 있을까  가장 큰 별이 보이는 우리 동네  따뜻한 햇살 꽃이 피는 봄에 그댈 위로해요 그댈 사랑해요  그대만의 노래로  뚜루뚜뚜두 두두두 뚜루뚜뚜두 두두두 뚜루뚜뚜두 두두두 하늘바라기 하늘만 멍하니  가장 큰 하늘이 있잖아 그대가 내 하늘이잖아 후회 없는 삶들 가난했던 추억 난 행복했다 아빠야 약해지지마  빗속을 걸어도 난 감사하니깐  아빠야 어디를 가야  당신의 마음처럼 살 수 있을까  가장 큰 별이 보이는 우리 동네  따뜻한 햇살 꽃이 피는 봄에 그댈 위로해요 그댈 사랑해요  그대만의 노래로  따뜻한 바람이 부는 봄 내음 그대와 이 길을 함께 걷네  아련한 내 맘이 겨우 닿는 곳에 익숙한 골목 뒤에 숨어있다가 그대 오기만 오기만 기다린 그때가 자꾸만 떠올라 가장 큰 별이 보이는 우리 동네  따뜻한 햇살 꽃이 피는 봄에 그댈 위로해요 그댈 사랑해요  그대만의 노래로  뚜루뚜뚜두 두두두 뚜루뚜뚜두 두두두 뚜루뚜뚜두 두두두 하늘바라기 하늘만 멍하니
2016.07.25~07.31,24,8109412,D (half moon) (Feat. 개코),DEAN,130 mood : TRBL,2016.03.24,R&B / Soul,"Deanfluenza,개코",Love love the stars Love love the moon 별 다를 것 없이 똑같은 공기 똑같은 침대에서 보이는 천장까지 왜 별 이유 없이 공허한 건지 그저 몇 시간 째 멍만 때리는 게 처음에는 배가 고픈가 했었는데 No way no way no way 요새는 칸예 새 앨범을 들어도 뻔해 뻔해 뻔해 TV를 틀어 놓은 채 채널만 돌려 보네 But bae 별 의미 없네 다 너의 반 반 반의 반의 반도 채워주질 못 하네 채워지지가 않네 Yeah 딱 너의 반 반 반의 반이라도 내게 남았더라면 이렇게 붕 떠있지는 않을 텐데 너 없는 밤도 달은 떴다는데 보이지 않아 네 생각에 가려진 채 Yeah 마음이 기운 채로 판단이 설 리가 너 하나 없다고 내가 이럴 리가 없는데 자꾸 그 때로 또 되감기 돼 네가 있던 자리 그 자리 위 밤하늘까지 보여 저 반 쪽 짜리 달이 딱 지금 나의 모습 같지 다 너의 반 반 반의 반의 반도 채워주질 못 하네 채워지지가 않네 Yeah 딱 너의 반 반 반의 반이라도 내게 남았더라면 이렇게 붕 떠있진 않을 텐데 내일의 어둠이 저 달을 한 입 삼키면 둘이 만들었던 세계도 더 작아질 텐데 그리움만 꽉 차겠지 지루한 하루들을 보낸 후 보름달 하늘에 뜰 때쯤에는 우린 하나라고 떠들고 다닐 때만 해도 너는 너고 나는 나라는 게 이렇게도 명확해질지 몰랐어 서로 생각할 시간 시간 초과된 기분 더 지나면 서로 돌아오라고도 못 해 난 지금 돈키호테처럼 정처 없이 네 사랑을 꿈꾸네 난 네 눈만 봐도 텅 빈 이 맘을 다 채울 텐데 다 너의 반 반 반의 반의 반도 채워주질 못 하네 채워지지가 않네 Yeah 딱 너의 반 반 반의 반이라도 내게 남았더라면 이렇게 붕 떠있진 않을 텐데 Love love the stars Love love the moon 딱 너의 반 반 반의 반이라도 내게 남았더라면 그랬더라면
2016.07.25~07.31,25,8233292,공중도덕 (Air DoTheQ),"TheQuiett,SUPERBEE,myunDo,플로우식(Flowsik),Dok2",쇼미더머니 5 Episode 1,2016.06.18,Rap / Hip-hop,"TheQuiett,SUPERBEE,myunDo,플로우식(Flowsik),Dok2",제대로 보여줘왔지 모두 앞에 내가 새로운 걸 할 때 이 랩 게임은 바뀌어 왔네  Backpack rap에서 Trap rap &amp; everythang  도덕 motherfuckas we gotta get paid  1LLIONAIRE flow 너는 막을 수가 없어 내게 몰려오는 돈과 명예 니가 나를 댓글 같은 걸로 욕하던 때 그 순간에도 내 몸값은 더욱 높아졌네 이 말은 그냥 하는 말이 아냐 난 재작년보다 세배를 벌어 내 삶은 좀 많이 변했지만 내 Rap은 gutter  넌 아직도 과거를 말하지 Yo shut the fuck up  난 앞으로 나갈 마음 밖에는 좆도 없어  My ambitions as a motherfuckin ridah  Hustler's life 나의 음악들을 팔어  뭘 좀 아는 자식들은 우릴 알어 제대로 떴지 공중에 Holla I'm the hottest m'fucka  내겐 여름도 겨울 절대 멋없는 것은 안해 이 철없는 놈은 I'm on my cassidy shit 홍대 City 막걸리 아재를 빙의한 것처럼 늘 Hustle  나를 더러운 속옷처럼 빨아 기억나 어릴 적이 치킨 껍질만 먹고선 바로 버리는 벌이를 버는 부자가 되는 게 꿈이였는데 이젠 두 마리를  Spend it everyday yo 하나를 이뤘으니  Let me take it to the next level 이제는 지구 전 세계에 지폐를 내 Money clip에 비대한 내 꿈 때문에 이제 내 지갑은 위인전 되겠군 Dang 난 아냐 거짓말쟁이  세다 100살 할아버지 되는 Money I'll get it  WoOh 봉준호 감독님의 전화를 받았지 Cuz I'm a monster 이건 괴물2 촬영씬 Yeh yeh myunDo finally made it Top 16  이 곡이 끝난 뒤 날 기다리는 건 더 높은 위치 Dok2 &amp; The Quiett과의 연결고리 History in the makin  난 쇼미 역사를 써내리지 My name myunDo go tell em  Turn up 82 workin all day 82 all day  Work hard play hard  왜 두 개를 못 해 한 번에 연남동에 한 번 와봐 Espanol로 Come to mi casa  살아있는 교과서 한 번 더 That's que pasa  아침 해를 보는 일 뭐 먹을지 고르기 가끔 망할 녹음이 안 될 땐  플스방에 가 With Superbee  UFC 하다보면 시간이 금방 흘러가 일상 속에서 영감 받고 난 가사 쓰러 가 불금엔 우리 김치힐갱끼리 술 마시러 다녀 어디든 Kidk Kidk 맨날 집에 가야 된다면서  왜 잔뜩 취해서 내게 던져 휴지를 Mc Rap형 또 사라졌네 역시 여자 번호 따러갔네 역시 멋이 가나 나랑 Play형은 감탄 중 물론 거절당할 건 이미 알잖아 서울 빌딩 숲에 치여 Uh 멍드는 사이 Uh 떠오르는 히트곡과 명곡의 Sign  I’m one of a kind This one’s for the books Mike Tyson on a fight night Smash y’all tonight 봄은 Flow season 시든 꽃들은 뽑고 다시 씨를 심어 Let me pick up 10억짜리 열매 총대 꽉 들어매 끝나지 않는 전쟁 애들도 이젠 TV를 보고 배워 내가 선생님 넌 질 걸 이미 알아 겁먹어 먼저 GG를 치지 A fake you are CG beneath me Even when I lay down Lei Wu Long with the moves versatile Been in this world longer storms were stronger 태평양을 건너 무대 위로 너머 돈이 안 보이냐 Listen to the words I offer Before you get buried 먼저 주둥이부터 덮어 네 말은 미세먼지 무게는 가벼워 힙합의 민족 마이크 잡는 거는 아무나 넌 아줌마 애기 With a lollipop I’m done with them half ass raps don’t give me 반토막 Your delivery’s lukewarm dude Straight food 철가방 속 차가운 국 Flow는 둘째 치고  Honestly you missing that boom  I got that 태풍의 눈 훔쳐 네 꿈 VROOOM  You need 부모님’s permission give a call 아들 음악 그만 때려쳐  형이 마이크 잡고 I will roll up both of my sleeves  And then put hands on you Steven Segaul Hold up YYYYAH ya’ll sweeter than 콜라 when you see me you roll up See me grip the mic and its over  네 모습 보고 아직도 멀었어  꼭대기 I’m on top of the mountain with 도덕 도덕 도덕 래퍼가 되기  전에 인간부터 되고 오려무나 욕심 따윈 개나 줘버려 매사에 버럭 두 눈에 불을 켜고 덤벼 들면 어떤 일이든지  네 뜻대로 잘 되나 봐라 마음에 여유 하나 없는 것들이  삶에 풍요를 바래 돈을 벌어 성공에 눈멀어 I don‘t fuck wit that shit 난 그 덜 떨어진 인간들과는 내가 가는 길은 같이 안 걸어 I got that sick flow yeah I flow sick too Superbee 처럼 기분이 좌 까칠함은 싹 밀어버려 면도 부드럽게 올라가 내 이름의 값 크리스토퍼 백 빼곤 빽 따윈 두지않아 비리 없이  I be illin on charts Nah bitch u aint Killin my vibe Yeah boii this is illionaire life Get down to the 본론 ball on 그래 내가 여태 번돈 그걸론 만족할순없지  Hold on I want more 내가 왔네 돈 벌러 아니 놀러  쇼미더머니 승패는 상관없이 힙합 하나로 다 발라 너희 부정할 수 없는 Classic 진짜 아는 놈은 알아서 다 알아 먹지
2016.07.25~07.31,26,8184472,자격지심 (Feat. 은하 Of 여자친구),박경(블락비),자격지심,2016.05.25,Rap / Hip-hop,박경(블락비),You 도대체 문제가 뭐야 말 좀 해봐 Hey you 질투하는 거야 자격지심인 거야 boy 몇 번이나 말했잖아 나에겐 한 사람밖에 없다고 귀여워 너답지 않은 너가 빠라바빠빠 빠라바빠빠 빠라바빠빠 넌 모를 거야 내 맘을 너 지금 어딜 보는 건지 지나가는 쟤 쳐다봤지 쇼윈도를 보는 척하면서 눈은 왜 그리 돌아가니 그래 나보다 키 크고 어깨도 넓은 거 나도 보이는데 너가 그래버리면 더 비참해지잖아 왜 그리 자신 없어 어딜 보긴 뭘 어딜 봐 어느 누구와도 너를 비교한 적 없어 소심하게 굴지 마 어제 카페 그 알바생 앞에서 왜 그리 웃는데 내가 이상한 건지 너가 이상한 건지 몰라 궁금해 머릿속이 You 도대체 문제가 뭐야 말 좀 해봐 Hey you 질투하는 거야 자격지심인 거야 boy 몇 번이나 말했잖아 나에겐 한 사람밖에 없다고 귀여워 너답지 않은 너가 빠라바빠빠 빠라바빠빠 빠라바빠빠 넌 모를 거야 내 맘을 하나만 물어볼게 차 있단 그 오빠 얘긴 왜 자꾸 해 뚜벅이가 뭐 어때서 어디든 가줄게 너 친구들 남자 친구 놈들 딱 들어보니 가식덩어리들  I told ya 남잔 늑대 순하디 순한 너에겐 위험해 yo 숨어 있어 내 울타리 안에 우리 사진으로 메신졀 프사해  왜 그리 자신 없어 아무것도 필요 없어 내겐 누구보다 큰 너 나도 알고 있어 남자는 다 똑같애  그걸 아는 사람이 그래 밀고 당길 땐 벌써 지났는데 내가 이상한 건지 너가 이상한 건지 몰라 궁금해 머릿속이 You 도대체 문제가 뭐야 말 좀 해봐 Hey you 질투하는 거야 자격지심인 거야 boy 몇 번이나 말했잖아 나에겐 한 사람밖에 없다고 귀여워 너답지 않은 너가 빠라바빠빠 빠라바빠빠 빠라바빠빠 넌 모를 거야 내 맘을 빠라바빠빠 빠라바빠빠 빠라바빠빠 넌 모를 거야 내 맘을 혹시나 해서 말인데 오해할까 걱정인데 이거 절대 자격지심 아냐 아냐 혹시나 해서 말인데 난 아무 상관없는데 그러는 거 자격지심 맞아 맞아
2016.07.25~07.31,27,8243822,비행소년 (Feat. 거미),"매드클라운,샵건",쇼미더머니 5 Episode 2,2016.06.25,Rap / Hip-hop,"매드클라운,샵건",그날을 기억해 처음 집을 나와 성신여대 네 평짜리 방바닥엔 바퀴벌레 커핀 식었고 소화제를 또 씹었네 엄마한테 전화를 걸어 아들 별일 없네 꿈과 숨바꼭질 술래는 여기 없네 잠들지 못 해 But don't give up yeah 스물넷 딴따라 아들 더 삐딱하게 바지를 내려 입고 신었네 더러워진 팀벌랜드 뛰었네 떨어지든 날던 일단은 뛰어야지 넘어지건 말건 내가 넘어지건 말건 세상은 날 가르쳐 뛰길 포기하고 넘어지는 방법 But nah I'm gonna fly away 미안해 미안해 미안해요 Mama 너무 멀리 떠나왔죠 아직 기다리나요 미안해 미안해 I'm going home 이젠 멋진 날이 와요 비바람이 치는 거친 하늘 위로 난 날아 12시간씩 일하시는 어머니 가족사진에 오려 붙인 아버지 사진 대환 없고 한숨 가득한 나의 좁은 집 조용히 신발만 대충 신고 뛰쳐나왔지 어 가는 길마다 자꾸 비바람이 쳐 도망치다보면 다시 집 앞에 있어 94 말했잖아 내 가족 내가 지켜 성공할 수만 있다면 나 무릎이라도 꿇지 뭐 어 자초한 길 끝까지 가야지 엄마 당신의 청춘을 내가 갚아줄게 하나씩 애비 없는 자식이라며 욕먹었던 양아치 그 양아치가 TV에서 랩 하지 이렇게 나 이제 날아볼게 미안해 미안해 미안해요 Mama 너무 멀리 떠나왔죠 아직 기다리나요 미안해 미안해 I'm going home 이젠 멋진 날이 와요 비바람이 치는 거친 하늘 위로 난 날아 I'm gonna fly away 고장 난 비행기처럼 놓쳐버린 풍선처럼 저기 높은 곳에선 슬픔들이 작아질까 바람 부는 방향 따라 떠나가 늦깎이 스물 청춘의 주소 번지수를 적어 사랑 앞에 철없고 비틀대듯 걸음을 절어 무댈 끝내고 두 손엔 오만 원이 쥐어졌고 내 광진구 옥탑방 택시빈 이만오천 원 그게 아까워서 걸었네 한남대교를 지났고 돌아가는 집까진 아직은 좀 멀어 상상을 해 완벽한 선을 그리는 비행 Uh 날개는 없기에 다시 나는 뛰네 One day I'm gonna fly away yes 미안해 미안해 미안해요 Mama 너무 멀리 떠나왔죠 아직 기다리나요 미안해 미안해 I'm going home 이젠 멋진 날이 와요 비바람이 치는 거친 하늘 위로 난 날아 미안해 미안해 미안해요 Mama 너무 멀리 떠나왔죠 아직 기다리나요 미안해 미안해 I'm going home 이젠 멋진 날이 와요 비바람이 치는 거친 하늘 위로 난 날아
2016.07.25~07.31,28,8233293,신사 ($insa),"Zion.T,씨잼(CJamm),레디(Reddy),서출구",쇼미더머니 5 Episode 1,2016.06.18,Rap / Hip-hop,"Zion.T,씨잼(CJamm),레디(Reddy),서출구",신사 숙녀 여러분 신사 홍대 어디든 이 노래가 흘러 나오겠지 Huh 뭔가 신나 신나 내 기분 다들 인사 인사 나를 보면 우린 뛰지 않아 뛰지 않아 Son 아무리 급하다 해도 품위를 지켜야지 난 내가 최고라고 믿어 아마 진짜일수도 있어 거짓말 탐지기도 하나 해보고도 싶어 생각대로 행동하고 믿어보는 타입 Uh 래퍼들이 밤새 연습하는 Flow는 Mine 누구에겐 개 또한 장하게 가족의 뒤에 가끔 여자들이 보내는 DM I will shine 모두 Stop 하고 술렁일때까지 Uh 모델들이 와서 내게 술 먹일 때까지 그때까지 연습해야지 위너의 자세 갈까봐 YG 누가 건들 때는 침착하게 Hol' up ho hol' up What‘s your name man 기억이 안 나는 게 그게 내 탓이냐 왜 이래 야 새벽인데 꺼져봐 Uh Pay attention 그냥 숙녀만 Woh Hol' up ho hol' up What’s your name girl 좀 더 붙어봐 난 없어 촌스러운 체인도 신사 숙녀 여러분 신사 홍대 어디든 이 노래가 흘러 나오겠지 Huh 뭔가 신나 신나 내 기분 다들 인사 인사 나를 보면 우린 뛰지 않아 뛰지 않아 Son 아무리 급하다 해도 품위를 지켜야지 날 간지로 따지면 비머 E30 Hot 뜨거 난 여자들의 시선이 Uh 비싼 행복들을 전부 다 사길 원해 술은 안 하지만 매일 기분 좋게 건배 Money Power Respect I want it 내 이마 Line 처럼 Rhyme은 깔끔해 호박씨 까는 놈들아 You wanna play rough Ok say hello to my lil friend woh 숙녀를 대할 땐 난 여름 같아서 숙녀 맘을 녹여 Like ice cream 비 오는 날씨엔 귀찮아 우산은 절대로 난 뛰지도 않아 Rolex gold chain BBS Wheels boy 토니 몬타나 난 화를 못 참아 Boy 내 위치가 꼭대기더라도 변하지 않는 태도 난 항상 진실을 말해 내가 거짓말을 할 때도 신사 숙녀 여러분 신사 홍대 어디든 이 노래가 흘러 나오겠지 Huh 뭔가 신나 신나 내 기분 다들 인사 인사 나를 보면 우린 뛰지 않아 뛰지 않아 Son 아무리 급하다 해도 품위를 지켜야지 쏘맥을 말어 And we call it 샴페인 My family my crew we share the same pain 손이 더러워져도 상관 없지 형제들과 악수하고 한 발을 절며 걷지 Riding with it top down 술은 쏟지 않아 향기없는 여자의 뒤는 쫓지 않아 아버지께 배웠지 인마 원래 신사는 고집을 꺾지 않아 Dancing in the hotel too many lies Too many stories that I don’t tell 준비를 하고서 계산하듯이 난 오는 밤들을 새지 No worries 금방 올 테니 Now go to sleep my baby 영화 같은 인생 필름 끊어질 때까지 마시고 사랑해 우린 영원할 것 같이 너도 알지 우리가 걷는 방식 내 삶을 사는데 자존심은 안 팔지 신사 숙녀 여러분 신사 홍대 어디든 이 노래가 흘러 나오겠지 Huh 뭔가 신나 신나 내 기분 다들 인사 인사 나를 보면 우린 뛰지 않아 뛰지 않아 Son 아무리 급하다 해도 품위를 지켜야지 신사 숙녀 여러분 신사 홍대 어디든 이 노래가 흘러 나오겠지 Huh 뭔가 신나 신나 내 기분 다들 인사 인사 나를 보면 우린 뛰지 않아 뛰지 않아 Son 아무리 급하다 해도 품위를 지켜야지
2016.07.25~07.31,29,8244031,Starlight (Feat. DEAN),태연(TAEYEON),Why - The 2nd Mini Album,2016.06.28,Ballad,이스란,Love is amazing ah  You are my starlight 내 맘을 비춰  함께 있으면 온종일 꿈꾸는 기분  You are my starlight 참 행복해져  선물 같아 너란 사랑  혼자가 익숙했던   회색 빛의 나의 하루에  사뿐히 다가와선   날 두드린 그 날을 기억해  빛처럼 날 비춰  어둠에서 나를 깨우곤  닫힌 맘의 창을 열어 줬어  내 눈에 비친 잔뜩 찡그린 Yeah  어색한 얼굴 뒤로 조금씩 웃어보던 너    사랑스러워 참을 수 없었지 Oh            기적처럼 발견한 넌 늘 미소 짓게 해  You are my starlight 내 맘을 비춰 함께 있으면 온종일 꿈꾸는 기분 You are my starlight 참 행복해져 선물 같아 너란 사랑 아무런 의미 없던  아주 사소한 일상들도 처음 본 세상처럼 새로운 느낌  난 매일 놀라 어느새 날 바꿔 텅 비어 있던 내 얼굴 위로 새로운 날 그려 줘 You are my starlight  You You You You You You  내 맘을 비춰  함께 있으면 온종일 꿈꾸는 기분  You are my starlight 참 행복해져  Oh No No No No 선물 같아 선물 같아 너란 사랑  맘이 흐린 날에도 맑게 개어  너를 본 순간 오직 너만으로 충분해 널 그저 바라만 봐도  입가에 번지는 기쁨 이토록 날 웃게 할 한 사람 너뿐이야 You are my starlight 감출 수 없어 함께 있으면 내 맘이 춤추는 기분 You are my starlight 참 감사해져  꿈만 같아 너란 사랑 You are my starlight My emotion you feel me 별처럼 빛나는 나를 봐 Oh 매일 깨달아 You are my starlight  Yeah Oh Oh Yeah Yeah My baby baby
2016.07.25~07.31,30,8028701,시간을 달려서 (Rough),여자친구(GFRIEND),여자친구 3rd Mini Album `SNOWFLAKE`,2016.01.25,Dance,"이기(오레오),용배(RBW)",다가서지 못하고 헤매이고 있어 좋아하지만 다른 곳을 보고 있어 가까워 지려고 하면 할수록 멀어져 가는 우리 둘의 마음처럼 만나지 못해 맴돌고 있어 우린 마치 평행선처럼 말도 안돼 우린 반드시 만날 거야 기다릴게 언제까지나 미처 말하지 못했어 다만 너를 좋아했어 어린 날의 꿈처럼 마치 기적처럼 시간을 달려서 어른이 될 수만 있다면 거친 세상 속에서 손을 잡아줄게 다가서려 해봐도 엇갈리고 있어 좋아한단 말도 아직 못하고 있어 머뭇거리는 널 보고 있으면 우린 아직도 많이 어리긴 한가 봐 좁혀지지 않아 한 끗 차이 우린 마치 평행선처럼 언젠가는 못다한 말을 전할 거야 다가갈게 언제까지나 미처 말하지 못했어 다만 너를 좋아했어 어린 날의 꿈처럼 마치 기적처럼 시간을 달려서 어른이 될 수만 있다면 거친 세상 속에서 손을 잡아줄게 시간 속에 갇혀 길을 헤매여도 그렇지만 우린 결국 만날 거야 진심인 것만 알아줘 정말 서툴기만 한대도 미처 말하지 못했어 다만 너를 좋아했어 어린 날의 꿈처럼 마치 기적처럼 시간을 달려서 어른이 될 수만 있다면 거친 세상 속에서 너를 안아줄게 이거 하나만 약속해 변치 않기를 바랄게 그때도 지금처럼 날 향해 웃어줘 시간이 흘러서 어른이 될 수만 있다면 엇갈림 그 속에서 손을 잡아줄게
