time,rank,song_id,title,singers,album,date,genre,creator,lyric2016.09.12~09.18,48,8189661,쏘쏘,백아연,쏘쏘,2016.05.24,R&B / Soul,"백아연,김은수,오현주,김원",눈이 높은 건 절대 아닌데 딱히 맘이 끌리지가 않아 한두 번 만나보고 며칠을 연락해도 어색한 공기만 흐를 뿐 참 답답해 이상해  자꾸 어긋나는 일  대체 뭐가 문젤까  누굴 만나도 so so 혼자인 것도 so so 설레이지도 나쁘지도 않은 기분 so so 감을 잃어가 점점 사랑은 어떻게 하는 거였더라  기억도 잘 안 나 커플들이 부럽기는 해도 좋겠다 혼자인 게 외롭지는 않아 견딜만해 한가로운 내 전화 약속도 없는 주말 TV 앞의 내가 싫을 뿐 참 궁금해 신기해 사랑에 빠지는 일 나만 빼고 전부 다 누굴 만나도 so so 혼자인 것도 so so 설레이지도 나쁘지도 않은 기분 so so 감을 잃어가 점점 사랑은 어떻게 하는 거였더라 어디서 뭐 하냐고 태어나긴 했냐고 이제는 좀 나타나줘 내 맘 줄 사람 보자마자 안아주고 싶어 노력해 봐도 so so 애를 써봐도 so so 감동이 없고 재미없고 그저 그래 so so so so 기억도 안 나 덤덤 가슴이 뛰어본 게 언제쯤 일까 나도 누군갈 좋아해 보고 싶어 사랑하고 싶어
2016.09.12~09.18,49,8217164,Monster,EXO,EX`ACT - The 3rd Album,2016.06.09,Dance,"kenzie,딥플로우",She got me gone crazy 왜 심장이 뛰니 넌 아름다워 나의 Goddess 닫혀있지 Yeah yeah 두드릴 테니 날 들여보낼래 감춰진 스릴을 줄게 눈동자의 호기심에 이미 넌 빠져들었고 Don't be afraid Love is the way Shawty I got it You can call me monster I’m creeping in your heart babe 뒤집고 무너트리고 삼켜 그래 널 훔쳐 탐닉해 널 망쳐 놓을거야 네 맘속에 각인된 채 죽어도 영원히 살래 Come here girl You call me monster 네 맘으로 들어갈게 She got me gone crazy 왜 심장이 뛰니 내가 좀 성격이 급해 그닥 온순하지 못해 널 미워했어 하지만 너를 원해 That’s right my type 가슴은 거짓말 안 해 시작됐어 내 안에서 위험한 신호를 보내 Don’t be afraid Love is the way Shawty I got it You can call me monster I’m creeping in your heart babe 뒤집고 무너트리고 삼켜 그래 널 훔쳐 탐닉해 널 망쳐 놓을거야 네 맘속에 각인된 채 죽어도 영원히 살래 Come here girl You call me monster 네 맘으로 들어갈게 전율이 와 네 삶을 다 뒤집어 버리는게 I’m sorry you make me so crazy you know you do 모두 날 두려워해 so I’m untouchable man 근데 네 진심은 왜 결국에 날 거부 못해 숨어서 훔쳐보다가 깜짝 놀라지 Who 네겐 안티노미 같은 난 네 존재의 일부 How we do 날 그대로 받아들여 너의 두려운 걱정은 접어두렴 네가 견딜만한 고통을 누려 더 깊이 빠져들어 널 맘대로 가지고 놀아 내 손에서 맘껏 놀아 도망가지마 넌 영원히 맴돌아 You can call me monster I’m creeping in your heart babe 뒤집고 무너트리고 삼켜 그래 널 훔쳐 탐닉해 널 망쳐 놓을거야 네 맘속에 각인된 채 죽어도 영원히 살래 Come here girl You call me monster 네 맘으로 들어갈게 Creeping creeping creeping Creeping creeping creeping You Creeping
2016.09.12~09.18,50,8250334,Shut Up (Feat. 유희열),언니쓰,언니들의 슬램덩크,2016.07.01,Dance,"박진영,제시(Jessi)",Shut Shut Up Shut Shut Up  Shut Shut Up  배터리가 다 돼서  전화를 못 받았어  나중에 하려다가 잘까봐 안 했어  그게 말이 되니 내가 무슨 바보니  그 말을 믿으라고  한두번도 아니고  말을 하면 할수록  더 손해야 이 바보야  그냥 떠나 남자답게  말도 안 되는 말 그만해 좀 제발  끝났단 걸 왜 몰라  왜 이제 와서 이래 이젠 그 입 좀  Shut 에에에에에 Shut Up 이이이이이  Shut 나나나나나 Shut Up 어쩌고 저쩌고 너의  Shut 에에에에에 Shut Up 이이이이이  Shut 나나나나나 Shut Up 어쩌고 저쩌고 너의  나는 가기 싫은데  친구들이 가재서  할 수 없이 갔다가  재미없게 있었어  그게 말이 되니 내가 무슨 바보니  그 말을 믿으라고  한두번도 아니고  말을 하면 할수록  더 손해야 이 바보야  그냥 떠나 남자답게  말도 안 되는 말 그만해 좀 제발  끝났단 걸 왜 몰라  왜 이제 와서 이래 이젠 그 입 좀  Shut 에에에에에 Shut Up 이이이이이  Shut 나나나나나 Shut Up 어쩌고 저쩌고 너의  Shut 에에에에에 Shut Up 이이이이이  Shut 나나나나나 Shut Up 어쩌고 저쩌고 너의  더 이상 내 앞에서 엉겨 붙지마  내가 말 했잖아 이번이 마지막  가짜 가짜 진심 없는 가짜  thought I told you twice  저리 치워 니 낯짝  너는 너 나는 나  쳐다보지마 니 갈 길이나 가  머리 어깨 무릎 발  어디 가서 물어봐  나 같은 여자 있나 한번 찾아봐  왜 이제 와서 이래 이젠 그 입 좀  Shut 에에에에에 Shut Up 이이이이이  Shut 나나나나나 Shut Up 어쩌고 저쩌고 너의  Shut 에에에에에 Shut Up 이이이이이 Shut 나나나나나 Shut Up 어쩌고 저쩌고 너의
2016.09.12~09.18,51,8261335,아름다워 (Beautiful) (Feat. 지코 (ZICO)),씨잼(CJamm),쇼미더머니 5 Episode 4,2016.07.09,Rap / Hip-hop,"씨잼(CJamm),지코(ZICO)",I‘m on one No lie 부정 말아 그냥 빨아 이거 이거 자꾸 시간은 안 보고 시계만 봐 그게 다야 Yup 숫자 대신에 박아놨거든 다이아 쟤네랑 비교한 거 아니지 나는 달러 이건 멋이 아냐 나는 이제 아름다워 지 삶과 상관없는 가사나 써대는 Fakers 내가 돌아보면 합죽이가 되어버리는 Haters 너네 중 반은 사실 래퍼가 되고 싶은 거 잘 생각해 래퍼들은 못 해 날 씹는 거 인마 I'm your leader 멋쟁이들은 날 밀어 객기로 인터뷰로 깝치는 놈들이 싫어 Ah 요새 대세 근데 난  아직 못 해 대인배 Who's hot 비와이 이놈도 섹시스트릿 Babe 원래 꿈은 래퍼도 아닌데 계속 가요 세상에 아름다운 여자들이 너무 많아서 I’m beautiful 워우워우워 멋있는 정도를 넘어선 놈 In this world world world 세대가 바뀌어도 이런 물건은 No one one one 인기가 식질 않네 더워 워워 이건 상식 밖의 Swaging 참 아름다워 Uh Uh We are so beautiful We are so beautiful 내 말은 너흰 그냥 다 병신들 Started from the bottom Now we 아름 to the 다워 Good boy Don't play no games 살아 Like me 다시 말해 너의 Role model right here 난 Beautiful Beautiful I got beautiful flows 필요해 나보다 훨씬 대단한 Beautiful woman 또 나와야지 되나 시즌 3 5 6 멍청이들에겐 더 해줄게 많지 It's doublem boy 한국서 너무 미리 난 아이폰 10 넌 아직도 017 있다는 느낌이니 지금 여기 나의 라이벌 맨 위에 래퍼들이 날 견제하고 있다고 이번 쇼미 사실 저번보다 힘들어 못 들어주겠네 이놈들 목소리부터 구려 사실 거의 그래 이 나라 래퍼 90 어쨌든 Zion.T and Kush Thanks for the good music 소재가 없으면 꼰대가 되나 봐 그렇지 난 구릴 바엔 그냥 당장에라도 여길 뜨지 But I’m beautiful 워우워우워 멋있는 정도를 넘어선 놈 In this world world world 세대가 바뀌어도 이런 물건은 No one one one 인기가 식질 않네 더워 워워 이건 상식 밖의 Swaging 참 아름다워 Uh Uh We are so beautiful We are so beautiful 내 말은 너흰 그냥 다 병신들 Started from the bottom Now we 아름 to the 다워 망나니 Season approaching 점점 커지는 덩치 We own it 여자도 상기시키는 립서비스 우린 더블링 없이 해도 관객이 피처링해 난 꿈을 먹고 살고 넌 나이를 먹지 매일 Errday 가요 작곡하고 방송 활동 와중에도 랩에 소홀한 적 없어 한결같은 내 태도 인지도 궁한 래퍼들 트위터에 날 언급하지 네 팔로워 절반을 차지한 지코의 팬덤 Cause I’m beautiful 워우워우워 멋있는 정도를 넘어선 놈 In this world world world 세대가 바뀌어도 이런 물건은 No one one one 인기가 식질 않네 더워 워워 이건 상식 밖의 Swaging 참 아름다워 Uh Uh We are so beautiful We are so beautiful 내 말은 너흰 그냥 다 병신들 Started from the bottom Now we 아름 to the 다워
2016.09.12~09.18,52,8244030,Why,태연(TAEYEON),Why - The 2nd Mini Album,2016.06.28,Dance,조윤경,Why  Oh yeah yeah Oh 언젠가는 내 두 발이 Oh 닿는 대로 이끌리는 시선을 뺏겨버린 대로 가볍게 걸어갈 낯선 곳을 그리다 또 결국엔 허전한 긴 한숨에 멈춰 Why Why 돌아서 또 넌 Why Why 꿈만 가득해 지금 떠난다면 Good Good Good yeah 만나게 될 모든 건 Great Great yeah 가벼워진 맘이 Work Work baby 이미 이미 눈 앞에 아른아른대는데 망설여 Why 나침반 위 돌아가던 바늘이 멈춘 곳에 가득 핀 이름 모를 꽃잎이 널 위해 끌어당긴 빛이 담긴 풍경 속에 어서 뛰어들어 나보다 자유롭게 더 Why Why Why 괜히 미뤄 왔던 날 많았던 걱정이 모두 다 사라진 tonight yeah 바람 불어오면 Good Good Good yeah 펼쳐지는 모든 건 Great Great yeah 달라지는 맘이 Work Work baby 이미 이미 눈 앞에 아른아른대는데 지금 떠난다면 Good Good Good yeah 만나게 될 모든 건 Great Great yeah 가벼워진 맘이 Work Work baby 이미 이미 눈 앞에 아른아른대는데 망설여 Why 쫓아가기도 벅차 숨이 찬 세상이 전부는 아냐 하루 종일 걸어도 똑같은 풍경은 절대 보이지 않아 하얀 종이에 적어 본 Why 잉크처럼 번지는 맘 I'm falling I'm falling I'm falling to you 바람 불어오면 Good Good Good yeah 펼쳐지는 모든 건 Great Great yeah 달라지는 맘이 Work Work baby 이미 이미 눈 앞에 아른아른대는데 지금 떠난다면 Good Good Good yeah 만나게 될 모든 건 Great Great yeah 가벼워진 맘이 Work Work baby 이미 이미 눈 앞에 아른아른대는데 망설여 Why
2016.09.12~09.18,53,8252588,리본 (Ribbon),비스트,Highlight,2016.07.04,Ballad,용준형,단단했던 매듭이 결국엔 풀려버리고 마네요 설마 했던 이별이 가까이 다가와 버렸네요 정말로 아마도 지금 이 순간이 가장 힘든 순간이에요 내겐 걱정 말아요 그래도 그대 원망하진 않아요 모든 걸 잃어도 돌릴 수 없고 소중한 걸 지킬 수조차 없는 초라한 내 모습 뗄 수 없는 입술이 그댈 잡을 수 없게 하죠  난 다시 한 번 풀려버린 우리를 예쁘게 묶고 싶어 있는 힘껏 서로를 당기며 사랑을 매듭지을 수 있게 Tie up a ribbon 절대 풀리지 않게  Tie up a ribbon 서로를 놓을 수 없게 아직 늦은 게 아니라면 너도 나와 같을 수 있다면 받아들이는 게 아냐 내 뜻대로 할 수 있는 건 지금처럼 질질 짜거나 취한 채로 널 향해 걷는 거 아주 가끔씩 꿈에 찾아온 널 반갑게 맞아주는 거 아무렇지 않은 척 괜찮다며 웃어주는 것뿐이야 Baby 맞아 좋은 남잔 아니었어 나는 너에게 언제나 부족한 사람이었기에 지금처럼 노래 부르는 것도 부담이라면 미안해 전부를 버려도 바꿀 수 없고 싫어도 빼앗길 수밖에 없는 초라한 내 모습 뗄 수 없는 입술이 그댈 잡을 수 없게 하죠  난 다시 한 번 풀려버린 우리를 예쁘게 묶고 싶어 있는 힘껏 서로를 당기며 사랑을 매듭지을 수 있게 Tie up a ribbon 절대 풀리지 않게  Tie up a ribbon 서로를 놓을 수 없게 아직 늦은 게 아니라면 너도 나와 같을 수 있다면 너무 아름답게 또 당연한 듯이 내 곁에 머물러준 너 그래서 가까이 와버린 이별조차 알아채지 못한 걸까 이렇게 쉽게 끝나버린 만큼 그리움도 쉽게 지울 순 없을까 언제쯤이면 나는 널 웃으며 떠올릴 수 있을까 난 다시 한 번 풀려버린 우리를 예쁘게 묶고 싶어 있는 힘껏 서로를 당기며 다시 널 사랑할 수 있게 Tie up a ribbon 절대 풀리지 않게  Tie up a ribbon 서로를 놓을 수 없게 아직 늦은 게 아니라면 너도 나와 같을 수 있다면 Tie up a ribbon
2016.09.12~09.18,54,8086947,한숨,이하이,SEOULITE,2016.03.09,R&B / Soul,종현(JONGHYUN),숨을 크게 쉬어봐요  당신의 가슴 양쪽이 저리게  조금은 아파올 때까지  숨을 더 뱉어봐요  당신의 안에 남은 게 없다고   느껴질 때까지   숨이 벅차올라도 괜찮아요  아무도 그댈 탓하진 않아  가끔은 실수해도 돼  누구든 그랬으니까   괜찮다는 말   말뿐인 위로지만 누군가의 한숨  그 무거운 숨을  내가 어떻게 헤아릴 수가 있을까요 당신의 한숨 그 깊일 이해할 순 없겠지만 괜찮아요  내가 안아줄게요 숨이 벅차올라도 괜찮아요 아무도 그댈 탓하진 않아 가끔은 실수해도 돼 누구든 그랬으니까  괜찮다는 말 말뿐인 위로지만 누군가의 한숨 그 무거운 숨을 내가 어떻게 헤아릴 수가 있을까요 당신의 한숨 그 깊일 이해할 순 없겠지만 괜찮아요 내가 안아줄게요 남들 눈엔 힘 빠지는 한숨으로 보일진 몰라도 나는 알고 있죠 작은 한숨 내뱉기도 어려운 하루를 보냈단 걸 이제 다른 생각은 마요 깊이 숨을 쉬어봐요 그대로 내뱉어요 누군가의 한숨 그 무거운 숨을 내가 어떻게 헤아릴 수가 있을까요 당신의 한숨 그 깊일 이해할 순 없겠지만 괜찮아요 내가 안아줄게요 정말 수고했어요
2016.09.12~09.18,55,9640320,Carnival (The Last Day),가인,End Again,2016.09.09,Dance,김이나,너무 늦었나요 혹시  많이 기다렸나요  때론 내가 없는  밤이 깊고 길고 어두웠나요  그럼 늦은 저녁을 멈춰 천천히  내가 처음부터 없던 날로  떠나볼까요  나 걱정 안 할 수 있게  오늘 밤 카니발의 문이 열리면  그땐 정말 날 잊어  끝이란 놀라워요  어제와 같은 밤일 뿐인데  한밤의 카니발의  그 불빛보다 정말 뜨거웠던  나 거기 있었다는 걸  아름다웠다는 걸  내 안에 담고 불꽃처럼 사라져  하얀 밤이 있어  딴 세상에 온 것 같은 밤  그런 밤이 있어  내가 딴 사람이 된 것 같은 밤  제일 환한 불꽃이 되어 춤추다  마치 꿈인 듯이  흔적 없이 사라진다면  다 완벽할 것 같은데  오늘 밤 카니발의 문이 열리면 그땐 정말 날 잊어 끝이란 놀라워요 어제와 같은 밤일 뿐인데 한밤의 카니발의 그 불빛보다 정말 뜨거웠던 나 거기 있었다는 걸 아름다웠다는 걸 내 안에 담고 불꽃처럼 사라져 나는 거기 있었고 충분히 아름다웠다 밤은 사라지고 우린 아름다웠어 이보다 완벽한 순간이 내게 또 올까 welcome to my carnival 열리면 난 그대를 떠나요 걱정 마 울지 마요 어제와 같은 밤일 뿐인데 welcome to marvelous day 꿈꾸던 그날 정말 기다렸던 나 처음부터 모든 건 그댈 위한 거란 걸 그 마음만 믿고 나를 잊고 살아요
2016.09.12~09.18,56,8026677,잊어버리지마 (Feat. 태연),Crush,잊어버리지마,2016.01.22,R&B / Soul,"Crush,Zion.T",너와 나 언젠가 남이 되어도 영영 닿을 수 없는 사이 되어도 잊어버리지마 잃어버리지마 혹시나 다른 사람의 손 잡고 있어도 영영 닿을 수 없는 곳에 있어도 잊어버리지마 잃어버리지마 따뜻해 볼이 맞닿을 때 살며시 시린 내 손 잡아줄 때 차가운 세상에 지친 내 맘을 온기로 감싸네 예에이에 내 눈에 담긴 너의 얼굴 내 품에 잠든 너의 모습 이대로 멈췄으면 해 꽉 잡은 두 손 놓치면 안돼 너와 나 언젠가 남이 되어도 영영 닿을 수 없는 사이 되어도 잊어버리지마 잃어버리지마 혹시나 다른 사람의 손 잡고 있어도 영영 닿을 수 없는 곳에 있어도 잊어버리지마 잃어버리지마 마주 앉아 널 바라보는 지금이 영원하길 바래 혹시나 시간이 우릴 질투 할까 봐 사실 걱정 돼 변치 마 always by my side 영원히 함께 my love 언젠가 날 기억해주길 한번쯤은 뒤 돌아보길 부디 놓지 말아줘 우릴 계속 바라봐주길 Oh My love 시간이 지나 baby 너와 나 우리가 남이 되어도 잊어버리지마 날 잊어버리지마 랄라 랄라랄라 랄라 이 노랠 잊어버리지마
2016.09.12~09.18,57,7891119,OOH-AHH하게,TWICE(트와이스),THE STORY BEGINS,2015.10.20,Dance,"블랙아이드필승,SamLewis",모두 나를 가지고 매일 가만 안 두죠 내가 너무 예쁘죠 나 때문에 다 힘들죠 어딜 걷고 있어도 빨간 바닥인거죠 Red carpet 같은 기분 모두 날 쳐다 보죠 oh 어떤 사람은 어머님이 누구냐고 신선하게 말 걸어도 아무 느낌이 안 들죠 하지만 나도 누군가 하고 사랑에 빠져보고 싶어 Baby 잘 들어요 내 Boy 단 한번도 느껴본 적 없는 걸 알게 해주는 사람 기다리고 있는 걸 얼마가 돼도 기다리고 싶어 I just wanna fall in love 어떻게 내가 움직일 수 없게  날 Ooh Ahh Ooh Ahh 하게 만들어줘 가짜 가짜 진심 없는 가짜  잘 가 잘 가 Huh OOH AHH하게 어떻게 이제 더 할말이 없게  날 Ooh Ahh Ooh Ahh 하게 만들어줘 Bla La La La 말만하지 말고  느껴지게 Huh OOH AHH하게 날 봐 거봐 또 두 번 봐 한번 지나치고 등을 돌려 쳐다봐 TWICE 어딜 가더라도 항상 민 낯 하지만 내가 제일 빛나 낮은 신발 신어도 가치는 High 머릿속엔 늘 영화 속 같은 La La La 장면들이 지나가네 생각만해도 떨리네 Yeah 이제는 나도 누군가 하고 사랑에  빠져 보고 싶어 Baby 잘 들어요 내 Boy 단 한번도 느껴본 적 없는 걸 알게 해주는 사람 기다리고 있는 걸 얼마가 돼도 기다리고 싶어 I just wanna fall in love 어떻게 내가 움직일 수 없게  날 Ooh Ahh Ooh Ahh 하게 만들어줘 가짜 가짜 진심 없는 가짜  잘 가 잘 가 Huh OOH AHH하게 어떻게 이제 더 할말이 없게  날 Ooh Ahh Ooh Ahh 하게 만들어줘 Bla La La La 말만하지 말고  느껴지게 Huh OOH AHH하게 아무하고 만나 시작하기 싫어  쉽지 않은 여자 그게 나인걸  Let me see How you gon treat me I ain't no easy Better think about it TWICE Let me see How you gon treat me I ain't no easy Better think about it TWICE 어떻게 내가 움직일 수 없게  날 Ooh Ahh Ooh Ahh 하게 만들어줘 가짜 가짜 진심 없는 가짜  잘 가 잘 가 Huh OOH AHH하게 어떻게 이제 더 할말이 없게  날 Ooh Ahh Ooh Ahh 하게 만들어줘 Bla La La La 말만하지 말고  느껴지게 Huh OOH AHH하게 OOH AHH하게
2016.09.12~09.18,58,5791706,오늘부터 우리는 (Me Gustas Tu),여자친구(GFRIEND),여자친구 2nd Mini Album `Flower Bud`,2015.07.23,Dance,"이기(오레오),용배(RBW)",널 향한 설레임을 오늘부터 우리는  꿈꾸며 기도하는 오늘부터 우리는 저 바람에 노을 빛 내 맘을 실어 보낼게 그리운 마음이 모여서 내리는 Me gustas tu gustas tu su tu tu ru 좋아해요 gustas tu su tu ru ru 한 발짝 뒤에 섰던 우리는 언제쯤 센치해 질까요 서로 부끄러워서 아무 말도 못하는 너에게로 다가가고 싶은데 바람에 나풀거리는 꽃잎처럼  미래는 알 수가 없잖아 이제는 용기 내서 고백할게요 하나보단 둘이서 서로를 느껴 봐요 내 마음 모아서 너에게 전하고 싶어 설레임을 오늘부터 우리는 꿈꾸며 기도하는 오늘부터 우리는 저 바람에 노을 빛 내 맘을 실어 보낼게 그리운 마음이 모여서 내리는 Me gustas tu gustas tu su tu tu ru 좋아해요 gustas tu su tu ru ru 한 걸음 앞에 서서 두 손을 놓지 말기로 약속해요 소중해질 기억을 꼭 꼭 담아 둘게요  지금보다 더 아껴 주세요 달빛에 아른거리는 구름처럼  아쉬운 시간만 가는데 이제는 용기 내서 고백할게요 둘 보단 하나 되어 서로를 느껴 봐요 내 마음 모아서 너에게 전하고 싶어 설레임을 오늘부터 우리는 꿈꾸며 기도하는 오늘부터 우리는 저 바람에 노을 빛 내 맘을 실어 보낼게 그리운 마음이 모여서 내리는 감싸 줄게요 그대 언제까지나  언제까지나 사랑이란 말 안 해도 느낄 수 있어요 고마운 마음을 모아서 널 향한 설레임을 오늘부터 우리는 꿈꾸며 기도하는 오늘부터 우리는 저 바람에 노을 빛 내 맘을 실어 보낼게 그리운 마음이 모여서 내리는 Me gustas tu gustas tu su tu tu ru 좋아해요 gustas tu su tu ru ru
2016.09.12~09.18,59,8028724,너는 나 나는 너,지코(ZICO),Break Up 2 Make Up,2016.01.25,R&B / Soul,지코(ZICO),넌 나고 난 너야 난 너고 넌 나야 마음이 같다면 둘은 서로가 될 거야 넌 나고 난 너야 그림 너무 좋아 오그라든다는 말은 누가 만든 걸까 girl 뺨 한 대만 때려줘 며칠 사이 내게 무슨 일이 벌어진 건지 전 여친 번호 지우고 힙합만 듣던 난 어쿠스틱해졌어 tell me what you want from me 가장 예쁠 나이엔 실컷 사랑해봐야 돼 eh 네 사연 속에 나오는 쓰레기 걔랑은 비교도 안되게 내가 잘할게 왜냐면 넌 나고 난 너야 난 너고 넌 나야 마음이 같다면 둘은 서로가 될 거야 넌 나고 난 너야 그림 너무 좋아 오그라든다는 말은 누가 만든 걸까 친구들이 말해 좋을 때야 난 딱히 걱정 없고 하도 좋아서 문제야 이거 봐 욕도 줄이고 있고 바지도 올려 입고 아무한테나 미소 안 보이고 있어 거울 그만 봐 고칠 데가 어디 있어 민낯일 때 제일 이뻐 이 장면 우리 엄마 보면 기절할 노릇일 걸 더 이상의 표현은 아낄게 사실 너 이름만 옮겨 적으면 그만인데 I believe in destiny 사주나 타로 카드에 점쳐질 만남은 안 해 yeah 집착 쩌는 네 전 남친이 집 근처도 얼씬 못하게 내가 잘할게 왜냐면 Because 넌 나고 난 너야 난 너고 넌 나야 마음이 같다면 둘은 서로가 될 거야 넌 나고 난 너야 그림 너무 좋아 오그라든다는 말은 누가 만든 걸까 밤새 쪽쪽 거리다가 누추한 모습으로 함께 아침을 맞아 good morning 새삼스럽게 넌 심각하게 예뻐 그 입 당장 가져와 Mwah 넌 나고 난 너야 난 너고 넌 나야 마음이 같다면 둘은 서로가 될 거야 넌 나고 난 너야 그림 너무 좋아 오그라든다는 말은 누가 만든 걸까 Let me talk to you yeah I am you you are me I am you you are me
2016.09.12~09.18,60,9628822,Y (Feat. BUMZU),"Kei(러블리즈),myunDo",Y,2016.09.02,Rap / Hip-hop,"미노(프리스타일),myunDo",My baby I love you so much  forever you and I I love you oh I love you so much  forever you and I My baby I love you so much  forever you and I I love you oh I love you so much  forever you and I 어딜 가나 무얼 하나  공허한 마음뿐 그저 허전함만 It doesn't feel right without you 적응이 안돼 내 옆에 이제 네가 없다는 게  기분 이상해 시간이 약이란 거짓말은  도대체 누가 한 소리야 그래서 시간은 언제  가는 건데 답답해 내 머리 안 너에 대한  생각은 왜 줄지 않고  늘어만 가는데 숨기고 싶고 부정하고  싶어도 어쩔 수 없나봐  감정이라는 게 Please tell me why  왜 나를 떠나갔어 Please tell me why  사랑하는 나를 두고  Tell me Please tell me why  내게 다시 돌아와줘 지난 아픈 기억들은  모두 잊고서  우리 다시 시작해  Baby My baby I love you so much  forever you and I I love you oh I love you so much  forever you and I My baby I love you so much  forever you and I I love you oh I love you so much  forever you and I 전화를 해야 되나  문자를 해야 되나  Should I start with a small talk 요즘엔 맨날 이런  생각들밖에 안돼 너한테 하고 싶은  말들이 난 참 많은데 I was the luckiest guy  in the world back then 그 땐 왜 몰랐나 싶어 정작 너와의 이별 뒤에 네 facebook  twitter and instagram에 들어가 하루에도 수십 번씩  소식 체크해 Please tell me why  왜 나를 떠나갔어 Please tell me why  사랑하는 나를 두고  Tell me Please tell me why  내게 다시 돌아와줘 지난 아픈 기억들은  모두 잊고서  우리 다시 시작해  Baby My baby I love you so much  forever you and I I love you oh I love you so much  forever you and I My baby I love you so much  forever you and I I love you oh I love you so much  forever you and I 난 지금 여기 있는데  널 항상 기다리는데 어떡해야 하는지  되돌릴 순 없는지  다시 내게 돌아와줘 My baby I love you so much  forever you and I I love you oh I love you so much  forever you and I My baby I love you so much  forever you and I I love you oh I love you so much  forever you and I
