time,rank,song_id,title,singers,album,date,genre,creator,lyric2015.11.23~11.29,75,7870707,AIRPLANE,iKON,WELCOME BACK,2015.11.16,Rap / Hip-hop,"B.I,BOBBY",잠깐 멈춰 봐 이대로 가면 우린 다신 못 봐 비행기 떠나면 난 잘 지낼게 넌 꼭 잘 지내야 돼 라고 말하고 가면 잘 지낼 수 있겠냐 너라면 애써 태연한 척하지 마 너 눈물 고였어 세상 잃어버린 듯한 슬픔이 보였어 하루만 더 있다가 짐 풀고 이따가 영화나 보러 가자 나 울고 있잖아 please La li la di dada la li da 너를 감싸 안은 하늘이 싫다 La li la di dada la li da 너를 밝혀주는 저 달이 밉다 La li la di dada la li da 이대로 보내기는 아쉬우니까 이건 아마 세상 가장 쓸쓸한 멜로디야 Hey Mr. Airplane 잠깐 멈춰 봐 비가 오잖아 바람 불잖아 지금 가면 위험하니까 Hey Mr. Airplane 잠깐 멈춰 봐 시간 많잖아 내일도 있잖아 그녀를 내려줘 아님 나도 태워 줘 하루만 한 시간만 딱 일 분만 한마디만 하게 Hey Mr. Airplane 잠깐 멈춰 봐 가벼운 미소만을 남기고 웃는 얼굴로 넌 떠났지 우리 기약을 굳게 믿는 척하면서 널 잡기 위해서 내 모든 짓을 해볼 걸 적어도 후회 속에서까지 살지 않기 위해서 Girl 평생 그리워질 그대의 존재 그냥 내 품에서 더 깊은 잠에 들어 왜 잔인하게 아름다운 저녁 하늘 바라봐 너의 마지막이라니까 또 눈물 나잖아 Please La li la di dada la li da 너를 감싸 안은 하늘이 싫다 La li la di dada la li da 너를 밝혀주는 저 달이 밉다 La li la di dada la li da  이대로 보내기는 아쉬우니까  이건 아마 세상 가장 쓸쓸한 멜로디야 Hey Mr. Airplane 잠깐 멈춰 봐 비가 오잖아 바람 불잖아 지금 가면 위험하니까 Hey Mr. Airplane 잠깐 멈춰 봐 시간 많잖아 내일도 있잖아 그녀를 내려줘 아님 나도 태워 줘 하루만 한 시간만 딱 일분만 한 마디만 하게 Hey Mr. Airplane 잠깐 멈춰 봐 꼭 오늘 가야 해 왜 내일은 안돼 보내기 싫은데 가면 언제 오는데 너와 멀어지는 게 난 두려워  우리 이대로 자연스러운 이별이 될까 봐  하루만 한 시간만 딱 일 분만 잠깐 멈춰 봐 비가 오잖아 바람 불잖아 지금 가면 위험하니까 Hey Mr. Airplane 잠깐 멈춰 봐 시간 많잖아 내일도 있잖아 그녀를 내려줘 아님 나도 태워 줘 하루만 한 시간만 딱 일 분만 한 마디만 하게 Hey Mr. Airplane 잠깐 멈춰 봐
2015.11.23~11.29,76,7852842,그렇게 됐어,플라이투더스카이,Love & Hate,2015.09.14,R&B / Soul,심은지,그렇게 됐어 한 두달 쯤 됐어 뭐 때문에 헤어졌냐는 친구들 말에 그냥 그렇게 됐어 마치 사랑한 적 없던 것 처럼 술잔을 비워내며 뭐 그렇게 됐어 유난스럽지 않게 이별을 말하고 있는 내 맘은 아직 너로 가득 차있는 걸  왜 이렇게 됐어 우리가 왜 이렇게 벌써 널 떠올릴 자신이 없어 왜 이렇게 됐지 우리가 왜 이렇게 미치도록 아파서 하는말야 그렇게 됐어 그렇게 될까 그런 날이 올까 들려오는 니 소식에 무뎌지는 날이 사실 힘들다는 말 나도 모르게 새어 나올까 봐 니 이름도 편하게 꺼내지 못해 차인거냐 놀리는 농담에 시덥지 않은 위로에 또 하루만큼 멀어진 걸까 왜 이렇게 됐어 우리가 왜 이렇게 벌써 널 떠올릴 자신이 없어 왜 이렇게 됐지 우리가 왜 이렇게 미치도록 아파서 하는말야 그렇게 됐어 정말 뜨거웠다 해도   많이 아팠었다 해도 그저 흔한 이별 얘기 처럼 둘만 아는 얘기들도  혹시 우스워질까봐     말을 아끼고 아끼다 하지 못했어 왜 이렇게 됐어 우리가 왜 이렇게 벌써 널 떠올릴 자신이 없어 왜 이렇게 됐지 우리가 왜 이렇게 미치도록 아파서 하는말야 그렇게 됐어
2015.11.23~11.29,77,2101367,그런가 봐요...,V.One,2004 History Will Begine...,2003.01.19,Ballad,이희승,고맙다는 그 말 잘 못하는 사람 미안할 땐 괜히 더 화내는 사람 통화하다 먼저 끊는 사람 지난 사랑 얘길 늘 하는 사람 미리 해둔 약속 잘 어기는 사람 했던 얘기를 또 물어보는 사람 괜찮다고 걱정 말라하면 그 말 믿는 사람 그게 나래요 그녀가 말했죠 여자를 떠나게 만드는 남자들을 아냐고 그 이유 다 갖춘사람 오 다 나래요 그래서 날 떠나갔죠 그녀는 모르죠 나 얼마나 그녈 많이 사랑한지 그녈 위해선 아마 더한 버릇도 내가 다 고쳤을 텐데 그녀는 모르죠 내 모자란 자존심에 말 못했던 수많은 얘기 눈으로만 말한 걸 아마 듣지도 못하고 가나봐요  말하지 않아도 내 맘 아는 사람 약속에 늦어도 웃어주던 사람 작은 선물 뜻 없이 건네도 좋아하던 사람 그게 그녀죠 그녀는 말했죠 이별한 후에 더 차가운 여자 맘을 아냐고 만날 때 후회 없었던 오 그 이유라 미련조차 없다했죠 그녀가 떠났죠 이렇게 날 미련 속에 남겨두고 미안한 일이 너무 나도 많아서 후회뿐인 나를 두고 그녀는 떠났죠 다른 사랑 이래서는 안 된다며 내 마지막은 그녀였단 얘기를 끝내 듣고도 모른체 가나봐요  그녀는 모르죠 나 얼마나 그녈 많이 사랑한지 그녈 위해선 아마 더한 버릇도 내가 다 고쳤을 텐데 그녀는 모르죠 내 모자란 자존심에 말 못했던 수많은 얘기 눈으로만 말한 걸 아마 듣지도 못하고 가나봐요 나의 사랑이 날 두고 떠나가요
2015.11.23~11.29,78,7926003,LIGHTSABER,EXO,LIGHTSABER,2015.11.11,Dance,"정주희(JamFactory),찬열,MQ",- LIGHTSABER -   넌 외로운 꽃  차갑게 얼은 눈빛  깊숙이 숨은 별빛  그 짙은 어둠 속  긴 잠에 빠진 너를  깨워낼 수만 있다면  멀리 찬란하게 뻗은 빛을 따라와  여기 차오르는 눈부심을 느껴봐  너의 세상에 내가 닿을 때  깨어나 너를 피워내 eh eh eh  손을 내민 널 지키러 이곳을   찾아 헤맸던 너를 위한 savior   암흑 속 내가 손을 잡을게  A life saver Lightsaber  Lightsaber Lightsaber Lightsaber  Lightsaber Lightsaber Drop Oh Lightsaber oh  Light Light Light Light Light  Woo Oh Woo Oh   Light Light Light Light Lightsaber  Light Light Light Light Light  Woo Oh Woo Oh   Light Light Light Light Lightsaber  얼었던 너의 맘을  녹아 내리게 해  그 속에 이젠 너와 내가  빛의 춤을 춰  Here we go  Danger 위험해  어둠에 빛이 박힌 모양샌  더 서둘러 먼동 트기 전  누구도 못 보게 너를 데려와  내 옆에  고갤 숙여 하얗게 타는  나의 그림자를 따라오면 돼   궤도하는 시공 속에서  조금씩 선명해지는 찰나  눈을 감아 잠시  Light Light Light Light Light  Woo Oh Woo Oh   Light Light Light Light Lightsaber  Light Light Light Light Light  Woo Oh Woo Oh   Lightsaber Lightsaber  별처럼 쏟아져 어둠을 거슬러  너를 피워낼 시간  감춘 너의 눈물마저 빛이 나게   새벽 끝에 왔어  모두 제자리로 가는 길  바로 여기에 내 모든 걸  네게 줄게  손을 내민 널 지키러 이곳을   찾아 헤맸던 너를 위한 savior   암흑 속 내가 빛이 돼줄게  A life saver Lightsaber  Light Light Light Light Light  Woo Oh Woo Oh  Light Light Light Light Lightsaber  Light Light Light Light Light  Woo Oh Woo Oh  Light Light Light Light Lightsaber  Drop  Light Light Light Light Light  Woo Oh Woo Oh  Light Light Light Light Lightsaber  Lightsaber Lightsaber  Lightsaber Lightsaber  Lightsaber
2015.11.23~11.29,79,5721440,LOVE ME RIGHT,EXO,LOVE ME RIGHT - The 2nd Album Repackage,2015.06.03,Dance,"오유원,김동현",Oh Yeah C’mon Take your time 왠지 두근대는 밤이야 Na Na Na Na Na Na Na Na So tonight 달 끝까지 달려가볼까 Yea Yea Yea Yea Yea Yea Yea Yea Just right 시동을 걸어 엑셀에 발을 올려 모든 것이 특별해 너와는 잘 어울려 무엇을 원하던 Imma make it work Yeah Shawty Imma party till the sun down 지금 이 신비로운 느낌은 뭘까 와줘 내게로 어서 Before the sun rise 네가 없는 난 어딜 가도 Nobody Yeah 오 도로 위에 여긴 runway 날 바라보는 눈 속 milky way Just love me right 아하 Baby love me right 아하 오 내게로 와 망설이지마 넌 매혹적인 나의 universe Just love me right 아하 내 우주는 전부 너야 Just love me right Just love me right Just love me right 내 우주는 전부 너야 Shine a light 별빛 속을 달려 은하술 건너 Na Na Na Na 멈출 순 없어 오예 우릴 비추는 달빛은 여전하지 네 궤도 안 헤매고 있어 난 아직 I can do this all night long baby 네가 없는 난 어딜 가도  반쪽짜리니까 달빛 찬란한 밤 펼쳐진 별들의 불꽃놀이 좀 더 높이 날아가볼까 날아가볼까 가슴 터질듯한 이 순간 우리 둘만 떠올라 발 밑에 지구를 두고 love me right 도로 위에 여긴 runway 날 바라보는 눈 속 milky way Just love me right 아하 Baby love me right 아하 So come on baby 눈이 부시게 더 아름다운 너의 universe 아름다운 lady Just love me right 아하 내 우주는 전부 너야 오 Just love me right Just love me right Can you love me right Just love me right I just wanna make you love me 내 우주는 전부 너야 수 없는 밤이 찾아와도 내 하늘엔 오직 너만 빛나 Woo Yeah 속삭여줘 내게만 밤하늘을 너와 내가 물들여가 도로 위에 여긴 runway 날 바라보는 눈 속 milky way Just love me right 아하 Baby love me right 아하 오 내게로 와 망설이지마 넌 매혹적인 나의 universe Just love me right 아하 내 우주는 전부 너야 Just love me right Oh oh oh yeah Just love me right Just love me right 우리만의 시간 내 우주는 전부 너야 Just love me right Just love me right Just love me right I just wanna make you love me Yea Woo You got to love Yea You got to love me Yea 내 우주는 전부 너야 Yea You love me Yea You love me Yea 내 우주는 전부 너야
2015.11.23~11.29,80,7881338,집으로 가는 길,비투비,I Mean,2015.10.12,Ballad,"ZeroZine(MosPick),예아나이스(MosPick)",누구나 손가락질 받을 때면 가슴 한 켠이 뜨거워지는 걸 느끼죠 I believe I believe I believe It's alright 그댄 따뜻한 그 말 한마디가 필요했다는 걸 알아요 강한 척 밀어내도 어디로 가는지 무거운 발걸음이 많이 지쳐 보여요 언제나 기다릴게요 편히 쉴 수 있도록 집으로 가는 길 매일 걷던 그 길을 헤매다 길을 잃은 아이처럼 방황의 끝에 서 있죠 Oh 힘들어도 꿈을 잃지 말아요 세상의 모든 게 그댈 속일지라도 더 이상 슬퍼 말아요 이젠 웃어요 변명이란 이불 덮어줘 그렇지 않으면 내가 너무 추워 우스워 보이기 싫어서 핑계를 베고 누워 언제나 불안 속에 살아 뜨거워 그래서 내게 보내나 봐 차가운 시선 이 세상 어디도 날 위한 곳은 없어 도망치듯 집으로 두 발을 움직여 Stop해 고인 눈물 그만 닦고 일어서 주저앉아 나만 왜 나만 왜 징징대 봤자야 쉿 하고 일어서 웃겨 나도 못 보면서 남의 눈치 보네 해 보기도 전에 지레 포기하지 따뜻함에 안주하기엔 세상이란 술은 독해 언제부터였는지 힘없는 뒷모습엔 상처만 남았네요 언제나 열어 둘게요 편히 쉴 수 있도록 집으로 가는 길 매일 걷던 그 길을 헤매다 길을 잃은 아이처럼 방황의 끝에 서 있죠 Oh 힘들어도 꿈을 잃지 말아요 세상의 모든 게 그댈 속일지라도 더 이상 슬퍼 말아요 혹시 길을 걷다 발목을 다쳐도 주저앉아 포기하진 말아요 많이 힘들지 괴롭지 매일이 혼자인 것처럼 외롭지 But don't give up on me now 이젠 나와 힘든 길을 같이 걷자 Oh no way 집으로 가는 길 매일 걷던 길 헤매다 길을 잃은 아이처럼 방황의 끝에 서 있죠 Oh 힘들어도 끈은 놓지 말아요 세상의 모든 게 그댈 속일지라도 더 이상 슬퍼 말아요 이젠 웃어요
2015.11.23~11.29,81,7931720,요즘어때? (Feat. DEAN),다이나믹듀오,GRAND CARNIVAL,2015.11.17,Rap / Hip-hop,"다이나믹듀오,Deanfluenza",느껴지네 의자 밑에 구명조끼  tokyo new york 나성 불란서  날라 다녀 무대위도 마찬가지  sold out 콘서트 완전 불 났어 프로듀서들은 비트가 든  냉장고를 통째로 맡겨 난 김풍처럼 요리조리 해서  친절하게 떠 먹이지 원하면 전체공개 해  나의 레시피 시동을 걸어 예열  핸들 위에 삼지창 클래스 앞에 g 만루홈런  만들 때는 없었지 받아들였어 내게 드리운  그림자와 빛 어둠은 의식하되  눈은 밝은 쪽만 향하지  분기별로 차트에  자리 몇 개 분양 받은 다음 제주도 바다 위에서  cuban 시가 태우고 손엔 입질 nothin but smooth sailing  우리음악도 smooth sailing  내겐 매일이 blessing  믿기 힘든 일이 생겨  스튜디오 안에서 preemo와 chill 담 달엔 nba2k의 playlist에  NAS Jay Z 노래 옆에 AEAO shit 배고픈 거 보다 아픈 게 문제인 이 바닥이지만  난 정치인이 아니야 그저 영원히 내 삶이  사각팬티 안에 바람 같은 기분이길 바라  뭐하러 빡빡하게 살아 요즘 어때  좋다 나쁘다 하지 뭐 별일 없고  있다 없다 하지 뭐 궁금하다면 썰 풀어볼게 if you don't know now you know 요즘 어때  좋다 나쁘다 하지 뭐 별일 없고  있다 없다 하지 뭐 궁금하다면 썰 풀어볼게 if you don't know 일년 반이란 시간도 지갑도  탈탈 털렸지 혹 붙은 뒤통수는  알딸딸 뼈저렸지 거 누구처럼 말발 하나로  판 뒤집는 재주는 없어서 술로 몸은 버렸어도  그 천성은 못 버려서 활달  바보처럼 깔깔 웃지  속으론 칼 갈어 확실히 선을 긋지  적과 동지를 나눠 여러 번 밑줄을 긋지  실패는 교과서 내 팔자는 기구해  때론 바닥을 기구 하지만 난 열 받을수록  더 높이 나는 기구 이기구 지구 하길  계속하니 더 커지구 학교운동장처럼 점점 더  작아지는 지구 질투 더 커 보여 남의 떡 다들 내 실투만 기다려  상대팀 덕 아웃 같이  일등은 외로워 모두가 적 그래서 내 귓등의 가려움은  만성적인 지병 내 성치 않은 정신엔  성취가 보여주는 경치만이 잘 듣는 신경안정제 얄밉게 빈정거리는 말들조차  농담으로 인정  잠시 신처럼 각성돼  다들 발정제 먹인 돼지 돈이면 질질 싸 TV쇼와의 케미  본질은 질식사 거의 매미처럼 빛 보고나면 빌빌 싸 여태 수태 봤지 질질짜며  떠나는 실직자  요즘 어때  좋다 나쁘다 하지 뭐 별일 없고  있다 없다 하지 뭐 궁금하다면 썰 풀어볼게 if you don't know now you know 요즘 어때  좋다 나쁘다 하지 뭐 별일 없고  있다 없다 하지 뭐 궁금하다면 썰 풀어볼게 if you don't know now you know 요즘 어때  좋다 나쁘다 하지 뭐 별일 없고  있다 없다가 하지 뭐 but I don't give a fuck 담담하게 그래왔던 듯  uh 어때 어때  it's unfair unfair and it's freaking me out  but 뭐 어때 어때 it’s okay okay 또 안 그런 척 하곤 love this game I said I love this game  love this pain so plz don't ask me that's all I know  it's all I know
2015.11.23~11.29,82,5713422,와리가리,혁오(HYUKOH),22,2015.05.28,Rock,오혁,그런 슬픈 말을 하지 마요 아마 그럴 줄은 알았는데 이젠 좀 잔잔하다 했었는데 뒤도 돌아보지 않아 그런 마음을 낮추지 마요 저기 다가온다 기대했는데 또 한 편 언젠가는 떠나갈걸 이젠 슬쩍 봐도 알아 And we play comes and goes cause we did this when we were child before and we play comes and goes cause big boys still play the game all the time 다 쓴 야광별을 떼어냈죠 옅은 빛을 살피고 있으면 내일이 그리 기다려졌는데 이젠 그렇지도 않아 어렸을 때 몰래 훔쳐봤던 아빠의 수첩 같은 일기장엔 오늘의 걱정이 적혀있던 게 이제야 생각나네 And we play comes and goes cause we did this when we were child before and we play comes and goes cause big boys still play the game all the time 익숙하니 또 무뎌지네요 흘러간 장면이 펼쳐지네요 다시 그 순간을 마주한대도 그땐 또 지금 같진 않겠지 And we play comes and goes cause we did this when we were child before and we play comes and goes cause big boys still play the game all the time Familiarity is a common sense I feel like I’m not here anymore 그냥 다들 안고선 살고 있더라고 다들 그렇게들 떠나나요 이미 저 너머 멀리에 가있네 여기에는 아무도 안 올 테니 그냥 집으로 돌아갈래
2015.11.23~11.29,83,7943649,멈춰진 (Feat. 케이트),2LSON,멈춰진 (Feat. 케이트),2015.11.23,R&B / Soul,2LSON,여전히 하고 싶은 말 많은 나  하고 싶던 말 많았던 너  계속 될 줄 알았던 우린  이제 여기까진가 봐 아직은 그래 언제나 그랬듯이  또 버릇처럼 난  여기 그대로인데 보고 싶어  죽을 것만 같아 나  어디 있니  I love you baby  멈춰진 함께했던 시간  기억할게 난 여기서  작은 몸짓까지도  사랑해  한걸음마다 새겨진  너의 흔적과 기억들인데     아주 먼 곳이라도 달려가  너를 안고 싶은데  어떡하지  I love you baby  멈춰진 함께했던 시간  기억할게 난 여기서  작은 몸짓까지도 I love you baby 멈춰진 함께했던 시간 기억할게 난 여기서 작은 몸짓까지도 사랑해
2015.11.23~11.29,84,5644620,CALL ME BABY,EXO,The 2nd Album `EXODUS`,2015.03.30,Dance,"조윤경,1월8일,김동현",CALL ME BABY   Call me baby  이 거리는 완전 난리야  Call me baby  사람들 사이는 남이야  Call me baby  함께하는 매 순간이  Like BOOM BOOM BOOM  BOOM BOOM  What up  Hey Girl 영원 같던 찰나  운명 같은 순간  나를 한 순간 뚫고가  번개처럼 이 세계를  넌 내 이름 불러주며  나에게로 다가와  놀라워 섬광처럼 가득 차  너를 마주한 순간 oh my  편하게 여기 앉아  이제 내 얘기를 들어봐  Oh I don't care  나 멀리멀리 돌아간대도  이렇게 너의 곁에  단 한 남자가 되어줄 테니  메마른 내 입술에  너 스며들어와 나를 깨워  The time's wasting girl  So don't wait don't wait too long  빛나는 것들은 많아  그 안에 진짜를 봐봐  Call me baby Call me baby  Call me baby Call me baby  You know my name girl  널 향해 커져간 마음아  너 말곤 그 문을 닫아  You know I'm here girl  Call me baby Call me baby  Call me baby Call me baby  몇 번이라도 Call me girl  나를 나로 존재하게 해  내 세상은 오직 you're the one  You're the one   Girl you're the one I want  빛나는 것들은 많아  그 안에 진짜를 봐봐  Call me baby Call me baby  Call me baby Call me baby  몇 번이라도 Call me girl  Baby girl 욕심들 속에 날 선  그 어떤 말도 넘어설  그런 믿음을 보여준 너   모두 변해 날 떠나간대도  너는 나만의 lady   내 손을 잡아주는 그거면 돼  빛나는 것들은 많아  그 안에 진짜를 봐봐  Call me baby Call me baby  Call me baby Call me baby  You know my name girl  널 향해 커져간 마음아  너 말곤 그 문을 닫아  You know I'm here girl  Call me baby Call me baby  Call me baby Call me baby  어둔 미로 속에 갇혔던 Oh 나  그 어둠 속에서  날 깨워준 네 목소리 들려와   날 다시 태어나게 해 Yeah  E X O Listen Say my name Louder  혼란스러운 공간 속  날 이끌어줄 빛이 되고  놓치지 않아준 너라면  What up  널 안고 변치 않을게  널 안고 나를 떠나버린  사람들과 마주해   Never don't mind about a thing  내 가슴속 그 거대한 공백에 널 더해   흔들리는 세상 속에서  Whoo Babe  빛이 돼준 오직 한 사람 바로 너  Girl you're the one I want  You're the one I want  빛나는 것들은 많아  그 안에 진짜를 봐봐  Call me baby Call me baby  Call me baby  I'll be your baby yeah  You know my name girl  Ho  나를 나로 존재하게 해  You know I'm here girl  내 세상은 오직 you're the one  You're the one  Girl you're the one I want  빛나는 것들은 많아  그 안에 진짜를 봐봐  Call me baby Call me baby  Call me baby Call me baby  몇 번이라도 Call me girl
2015.11.23~11.29,85,5822923,가슴 뛰도록,SG워너비,THE VOICE,2015.08.19,Ballad,강은경,사랑해 사랑해 사랑해   매일 아침 눈을 뜰 때마다  나를 설레게 하는 사람  나의 심장이 살아 숨쉰다는 걸  가르쳐 주는 사람 벅찬 가슴으로 힘껏 달려가  보고 싶었다고 말할 수 있는  네가 있다는 것 하나만으로  내 하루는 눈부셔  너를 사랑해 가슴이 뛰도록 매일 감사해 눈물이 나도록   내가 태어난 이유  내가 살아갈 이유 너였던 거야 너를 위해 난 존재해  옆에 있단 이유만으로도  어깰 펴지게 하는 사람  빈틈 많은 내 삶을 미소로  가득 채워준 단 한 사람   기쁜 날엔 함께 웃을 수 있고  힘든 날엔 서로 기댈 수 있는  네가 있다는 것 하나만으로  이 세상은 살만해  너를 사랑해 가슴이 뛰도록  매일 감사해 눈물이 나도록  내가 태어난 이유  내가 살아갈 이유 너였던 거야  너를 위해 난 존재해  널 향한 나의 고마움  살아가며 전부 갚아갈게   나의 곁에 있던 모든 날  단 한 점도 후회 없게  사랑해 사랑해 소중한 내 사람   삶의 끝까지 함께할 한 사람  네가 곁에 있는 게 네가  내 사람인 게 너무 감사해 그게 너라서  하루만큼 매일 더 네 맘보다  내가 더 많이 사랑해  가슴 뛰도록 사랑해
2015.11.23~11.29,86,3973781,크리스마스니까,"성시경,박효신,이석훈,서인국,빅스",Jelly Christmas 2012 HEART PROJECT,2012.12.06,Ballad,"서정진,김두현",오늘은 뭔가 좀 다른 기분 Feeling  이젠 때가 된 것 같은 느낌 Love U  하늘에선 마침 눈이 내려  Now It's Falling  뭔가 잘 될 것 같은 예감  하얀 거리마다  행복해 보이는 연인들  니 맘은 어떤지 내 맘과 같은지  우리 시작해볼까  오늘은 괜찮을까요  내 맘이 전해질까요  내리는 하얀 눈처럼  너에게 닿을까요  숨겨왔던 내 맘 전부 고백할게요  바로 오늘 크리스마스이니까  사실 그대도  조금은 기댈 했잖아요  못 이기는 척 웃는 너  그런 니가 사랑스러워  오늘은 괜찮을까요  내 맘이 전해질까요  내리는 하얀 눈처럼  너에게 닿을까요  숨겨왔던 내 맘 전부 고백할게요  바로 오늘 크리스마스  많은 사람들 속에 너만 내 눈에 보여 의상 좋고 머리도 괜찮고 얼굴 상태 나쁘지 않아 오늘만 기다렸단 말야 눈치껏 눈도 내린단 말야 또박또박 연습한 멘트 뚜벅뚜벅 걷는 발걸음이 벌써 네 앞에 도착했어 올해 크리스마스 선물은 나야 귀요미 루돌프 남 오늘이야 메리 크리스마스 조금만 더 용길 낼게 이 순간이 지나버리면 널 놓칠지 몰라 진심이 더 진심처럼 느껴지는 게 바로 오늘 크리스마스이니까 너와 나 영원히 Christmas Love
2015.11.23~11.29,87,7943058,고백송,GOT7(갓세븐),MAD Winter Edition,2015.11.23,R&B / Soul,"박진영,크루셜스타(CrucialStar),잭슨(GOT7)",수백 번 성공한적 없는 고백   자신감이 없는 나  Should I just go back   반드시 고백한다  말만 하면 뭐해 In the end   니 앞에서 들 수 없는 나의 고개  난 니가 좋아 이 말이  도대체 왜 어려운지  말 하려다 말려다  말 하려다 말려다  편지를 써서 주는 것 마저도  왜 힘이 들지  썼다가 또 찢었다  썼다가 또 찢었다  너의 마음이 나와 달라   너를 두 번 다신 못 볼까 봐  그게 너무 두려워서  말할 용기가 나질 않아  이렇게 노래를 빌려  나의 마음을 너에게 열게  I love you baby I I love you  아주 오래 전부터  I love you baby I I love you   하루 종일 너의 답장을 기다려  혹시라도 말 실수 할까 봐서  썼다 지웠다를 반복해  나의 진심관 달리 말이 헛 나오네  거울을 보며 연습했던  드라마 같은  대사들은 네 앞에 서면  까먹은 채로 허둥대  내 손은 너의 손 앞에서 멈칫해  심장소리가 너에게  들릴 듯이 커지네 yeah  너의 마음이 나와 달라   너를 두 번 다신 못 볼까 봐  그게 너무 두려워서  말할 용기가 나질 않아  이렇게 노래를 빌려  나의 마음을 너에게 열게  I love you baby I I love you  아주 오래 전부터  I love you baby I I love you   내 심장은 DRUM  소리처럼 두근거려  내 품은 너를 꽉 안을 날만 기다려  내 달력은 빨간  표시만을 기다리고  내 고백은 나의 용기만을 기다려  여전히 나는 소심한 바보지만  수많은 밤을 새며  썼던 이 노래가  나의 진심을 전해주길 원해  이어폰 한 쪽을 너의 손에  어때  I love you baby I I love you 아주 오래 전부터 I love you baby I I love you
