time,rank,song_id,title,singers,album,date,genre,creator,lyric2016.09.12~09.18,72,9641843,Nothing (Prod. By 스윙스) (Feat. 스윙스),나다(NADA),언프리티 랩스타 3 Track 7,2016.09.10,Rap / Hip-hop,"스윙스,나다(NADA)",너무 멀게만 보였던 꿈이 내게 오라 손짓을 하네 일이 너무 없어 죽을 것 같았는데 죽을 듯이 일을 하네 내 능력 밖에 일이라도 쉬운 듯이 하네 내가 믿는 신은 딱 견딜만한 시련을 준다는 걸 확실히 아네 내 기준에서 이미 성공했어 그 기준이 낮냐는 말은 됐어 그냥 내가 녹음 하고 싶을 때 녹음해줄 사람 내게 쩌는 곡을 주는 사람 내가 만약 헛소리를 하더라도 사랑 해줄 팬들만 있다면 살아 누군가에겐 우습고 작은 것들을 위해 5년을 목맸어 이게 별거 아니라고 맞아 별거 아니었어 첫 사랑도 다시 보니까 뭐 별거 아니었어 그땐 왜 그리 울었을까 그 오빠도 5년전 고민도 어제의 고민도 지나고 보면 별거 아냐 매여있지 않고 다 지나가 버렸어 난 여전히 버스를 타 알아보면 그냥 알아보게 둬 인사한번 그게 뭐가 어려워 나도 사람인데 뭐가 어려워 더 뜨고 나니 전과 좀 달라 아니 네가 보는 시선이 달라 그대로 행동 할뿐 뭣 하러 방송과 현실의 자아를 갈라 My name is Nada Nada is nothing  아무것도 아냐 난이게 참 좋아 정말 비워낼 때 기회는 찾아와 무에서 유를 창조해 왔잖아 기회를 잡아 저들 기억은 언제 바뀔지 몰라 독이었던 게 돈이 되기도 하네 돈이 되는게 독이 되기도 하네 그래서 더 이상 돈에 휘둘리지 않아 난 간절해 근데 절박하진 않아 무서워하던 것들 두려움 또 외로움 내가 만들어 낸 것일뿐 컨트롤 할 수 있어 이 거품 사람들은 내가 뜬 게 한방이라 하네 근데 한방이란 것도 작은 것들이 모여 만들어내 한발 한발 계속 가야지만 한방이 돼 내가 말했잖아 가진 듯이 있는 듯이 너무 쉬운 듯이 하다 보니 한방이 됐네 That was nice Nada I see you're improving I like that keep doing your thing this is Moon Swings 이 곡은 후렴이 필요 없지 그래서 그냥 rhyme으로 떡칠 Just Music Linchpins Unpretty let's do it Swings is back 벌써부터 난리가 난 internet 누군 반겨주고 누군 미워하지 난 그저 멈췄던 지점에서 다시 이어가지 나답게 여전히 hot해 가운데 손가락으로 답해 멍청한 것들에겐 9년 전 이미 개강 첫날처럼 한바퀴 돌며 접수했네 fuck you babies 뭘 모르는 놈들 계획을 짜봤자 그건 나에겐 고름 힘도 안 쓰지 너에겐 오른 손쯤 내 운명 내가 만들어 필요 없는 손금 고생이나 고난이나 고민은 nothing 난 물 같은 존재지 그래 없어 거품 넌 사이다 난 fire 밑바닥을 이미 여러번 친 아이야 그래서 내가 겪은 것은 nothing 오늘이 시작 이젠 첫승에서 천승 나보고 미친 새끼래 모두가 역사 안에서 안 그런 천재 한 명 대 봐 이런 정신병자 놈은 어디 없네 누구 날 시험해 누구는 귀엽대 못 느끼면 넌 개구리처럼 귀없네 내 소갠 필요 없어 알아서 잘 기억해 에 에 날 못 이겨 나 혼자였어도 근데 또 있어 난 별로였던 놈들을 모아 별로 만들었어 공연장에선 여자들이 쓰러져 지노는 더 힐 난 메세나폴리스 welcome to the life 난 데낄라를 토해 매일 매일 만들지 좆되는 노랠 이건 nothing 내 인생은 show네 창문 좀 내려봐 바람이 시원해 깊게 마셔 익숙해져 이 zone에 사자가 되려면 넌 사자들과 자야지 병신과 지내면 내년쯤에 넌 양아치 무슨 말인지 알어 그래 맞아요 내 랩을 듣다보면 뭐가 될 것 같어 나는 mc K-I-N-G 이젠 더 바삐 해야겠지 목 매야겠지 stay on top 지구의 자전처럼 never stop 내 몰락을 계산한다면 니가 알파고를 가졌어도 에러야 잘 봐 motherfucker 나는 100억짜리 yacht 살거야 물론 당장은 돈은 없네 믿는 대로 되는 법 이건 시간의 문제 난 아직 시간은 많으니 이건 nothing
2016.09.12~09.18,73,8247080,쿵,Zion.T,쇼미더머니 5 Special,2016.06.29,Rap / Hip-hop,Zion.T,"제일 먼저 기억나는 건 새까만 벽 앞에 걸려있던 마이크 30000원  어머니가 쓰시던 노트북에 깔았던 빨간색 마름모 그 때 부터였지 열일곱, 열여덟 열일곱, 열여덟  Dynamic Duo, 1tym - hot 뜨거 Oh yeah, oh shit 이런 건 처음 들어 쿵쿵쿵 옆집 사람들은 날 싫어해 ""시끄러워 게임 그만해 컴퓨터 끄고 공부나 해"" (게임 아닌데)  어 지금 들리는 박수 소리는 가끔 어색해 쿵쿵 그때 난 짝짝 소리를 듣게 될 줄은 Gray Loco Crush Elo 다 잘지내?  각자 자리에서 빛나고 있지 존나 멋지게 가끔 소주 한 잔 땡길 때 못 보는 게 씁쓸해 근데 씁쓸해도 어쩔 수 없지 갈 길이 멀기에 조명이 꺼지면 우린 어디에 있을까 그게 궁금해  안경이 무거워 조명이 너무 밝어 다들 부담스러워 날 그렇게 보지말어 난 여전해  난 여전히 녹음실에 서서 밤새고 노래를 쓰고있지 I'm still on my way 여전히 여기 이 자리 내 가족 내 친구 우리동네 이 거리 Still on my way 난 바뀐게 없지 거의 없지  쿵쿵 내 심장 소리 쿵쿵 쿵쿵"
2016.09.12~09.18,74,9606664,꿈 (She`s Dreaming),EXO,LOTTO - The 3rd Album Repackage,2016.08.18,R&B / Soul,첸(CHEN),별들마저 잠이 드는 늦은 밤 외로이 뜨는 달 살며시 창가에 내려와 비춰 주며 잠이 든 널 꿈꾸게 해 그곳 안에선 넌 유리로 만든 구둘 신고 내게 다가와 수줍은 모습으로 내 품에 안겨 웃곤 해 She's dreaming She's dreaming 달빛에 짙게 물든 밤 유일한 우리의 시간 She's dreaming She's dreaming 내 안에 잠이 든 널 마지못해 웃으며  난 그저 너를 바라본다 아침이 오면 아무 일 없듯 깨버리니까 난 늘 언제나 너의 꿈에 나타나 단둘이 함께하곤 했어 순진한 아이 같은 널 보면 괜스레 나까지 웃게 돼  미치겠어 욕심부리고 싶어 널 품에 안고 사랑한다 말하는 것도 웃기지 아침이 오면 또 기억 못할 텐데 난 잊혀질까 겁나 No no no come back 깊은 밤이 끝날 때면 연기처럼 난 희미하게 사라져 다시 어두운 밤에 꿈을 가지고 내려와 너에게  매일 꿈속에 너를 몇 번이고 찾아가도 처음 본듯한 얼굴로 바라볼 땐 가끔씩 참기 힘든걸 She's dreaming She's dreaming She's dreaming She's dreaming 달빛에 짙게 물든 밤 짙게 물든 밤 유일한 우리의 시간 너는 기억할까 She's dreaming She's dreaming She's dreaming She's dreaming 내 안에 잠이 든 널 잠이 든 널 마지못해 웃으며  난 그저 너를 바라본다 너를 바라본다 아침이 오면 또 다시 아무 일 없듯 아무 일 없듯 깨버리니까 잊혀질 꿈
2016.09.12~09.18,75,9634955,Lucky Girl,RedVelvet(레드벨벳),Russian Roulette - The 3rd Mini Album,2016.09.07,Dance,kenzie,Mm Bob Bob 무슨 얘길 할까  Mm Bob Bob 넌 무뚝뚝해  Mm Bob Bob Enjoy the show 나 속으로만 세어댔지 1 2 3  또 반응 없는 너를 보면 Down 자꾸 이럴 거면 나도 지치지  Mm Ba Ra Bob Bob Mm Ba Ra Bob Hey 차갑기만 한 너 친구들 그만두라고 네 곁에 밤새 있고 싶어 솔직히 Sssh Wait Listen 난 너의 행운 난 그대의 Honeydew Boy I won't let you go All I wanna do is be your girl 너의 Lucky Girl 너의 인생을  바꿔줄게요 그런 느낌이 왔어 Lucky Girl Lucky Girl Lucky Girl Lu Lucky Girl  사실 너란 아이 참 따뜻한 아이지 겉으론 관심 없는 척 날 챙겨줬잖아 이젠 다른 날을 세자 1 2 3  오늘부터 우리 둘이 많이 사랑해요 이런 말도 해  Give me Give me Give me Give me Give me Give me Hey 시간이 없어요  더는 망설이지 말고 네 곁에 밤새 있고 싶어 솔직히 있고 싶어 솔직히 난 너의 행운 난 그대의 Honeydew Boy I won't let you go All I wanna do is be your girl 너의 Lucky Girl 너의 인생을  바꿔줄게요 그런 느낌이 왔어 Lucky Girl Lucky Girl Lucky Girl Lu Lucky Girl  Lucky Girl I’ll be your  I’ll be your Lucky Girl 난 너의 행운 난 그대의 Honeydew Boy I won't let you go  All I wanna do is be your girl 너의 Lucky Girl 너의 인생을  바꿔줄게요 그런 느낌이 왔어 나를 잡아요 맘이 말하고 있어 잘 될 거야 다 그런 느낌이 왔어 Lucky Girl Lu Lucky Girl
2016.09.12~09.18,76,9630201,"No Thx (Prod. By DEAN) (Feat. 수란, DEAN)",육지담,언프리티 랩스타 3 Track 5 & 6,2016.09.03,Rap / Hip-hop,"Deanfluenza,육지담,SURAN(수란)",내가 손목 건다 했지  너 너 후회할 거라고 오해 좀 말라고 당당하던  그 때 넌 어디로 지금 꼴이 웃긴 거  너도 알지 문자 씹은 거  실수 아닌 거 알지 나 욕먹는 거 걱정하는  척하면서 제발  끼 부리지 말지 처음부터 잘하랬지  나는 변한다고 그렇게 거지같이 구는데  맘 떠났지 뭐 우리가 평생의 피앙새니 역겨운 소리 집어치고  이제 집 좀 가자 쫌 더럽게 굴지 마 마지막까지 철없게 살 거니 죽을 때까지 넌 나를 처음부터  담을 그릇 아니었어 내가 니 안에 살긴  지랄 토나와 또 alright no thx alright no thx 모든 게 다 오해였다 너 빌어도 그만 no thx 퍽이나 미안해 라면 끓이러 가야돼 bye 넌 라면 먹고 갈래 할 때가 그립겠네 but 죽었다 깨도 없네 no way 혹시나 비벼볼만하다  생각하냐 대체 어떤 욕을  더 원해 워메 더는 우연인 척  얼쩡거리면서 더러브게 굴지 좀 말어 oh stupid  백화점 다 둘러보니까  나만한 물건이 없지 근데 어쩜 좋니  찌질이한텐 다신  팔 맘이 없지 너는 할 말이 없지  입이 두 개라도  그냥 닥쳐 몰랐어 내가 만나는  동안엔 천사여서 욕 한번 안 해서  순진한 줄 알겠지 내 별명은 사실  욕 지담인데 메롱 alright no thx alright no thx 모든 게 다 오해였다 너 빌어도 그만 no thx 퍽이나 미안해 라면 끓이러 가야 돼 bye no interview no interview 어떤 것도 오 오 묻지말어 alright alright alright alright alright i i i get it now get it now 날 떠나니 실감이 나  oh 되도 않는 말들이나  늘어놓는 너를 보니까 웃음이나 so i  alright no thx alright no thx 모든 게 다 오해였다 너 빌어도 그만 no thx 퍽이나 미안해 라면 끓이러 가야 돼 bye alright no thx alright no thx 모든 게 다 오해였다 너 빌어도 그만 no thx 퍽이나 미안해 라면 끓이러 가야 돼 bye no interview no interview 어떤 것도 묻지말어 no interview no interview 신경꺼줘  love is over
2016.09.12~09.18,77,9620473,나만 안되는 연애,볼빨간사춘기,Full Album RED PLANET,2016.08.29,Folk,안지영,왠지 오늘따라 마음이 아픈지 했더니 오늘은 그대가 날 떠나가는 날이래요 왜 항상 나는 이렇게 외로운 사랑을 하는지 도무지 이해가 안가는 이상한 날이에요 왜 그랬는지 묻고 싶죠 날 사랑하긴 했는지 그랬다면 왜 날 안아줬는지 그렇게 예뻐했는지 나만 이런 세상을 살고 있는 것 같아요 바라보기만 하다 포기할 수는 없겠죠 근데도 이렇게 아픈 마음만 가지고 사는 건 도무지 불공평해서 견딜 수가 없어요 Please come back to me 왠지 오늘만은 그렇게 보내기 싫은지 오늘은 그대와 나 마지막인가 봐요 왜 항상 나는 이렇게 아무 말도 못하는지 도무지 이해가 안가는 이상한 날이에요 시작부터 사랑하지 않았다고 내게 말했었다면 그랬다면 나의 마음은 이렇게 굳게 닫혔을까요 나만 이런 세상을 살고 있는 것 같아요 바라보기만 하다 포기할 수는 없겠죠 근데도 이렇게 아픈 마음만 가지고 사는 건 도무지 불공평해서 견딜 수가 없어요 그대는 아무렇지 않겠죠 Please come back to me  내 눈물로 더 이상 붙잡을 수는 없겠죠 Please come back to me  근데도 이렇게 아픈 마음만 가지고 사는 건 도무지 불공평해서 견딜 수가 없어요 Please come back to me Please come back to me 나는 사실 이성적인 게 참 싫어요 그래서 우린 헤어져야만 했으니까 아무렇지 않게 살아가도 매일 밤이 고통스럽겠죠 그대가 정이 많은 사람이었다면 날 안아주진 않았을까요
2016.09.12~09.18,78,9637651,On My Way (Feat. GRAY & BewhY),스윙스,감정기복 II Part.3 : 심리치료 (Psychotherapy),2016.09.08,Rap / Hip-hop,"스윙스,BewhY(비와이)",나는 그저 가는 길을 가지 비켜라 지구 정복할 거니까 계속 지켜봐 소년 같다는 말 맞아 나는 그냥 나 게으름은 없어 쉬는 방법도 몰라  최고의 duo chart killers  바로 Gray와 나 2년 만에 부활했어  여전히 on top 이름도 모르지만 저  champagne 갖고 와 시비 걸지마 여기  경호원들이 널 pop  아 you now rockin with the best  과하게 노출하는 chest  내 대답은 yes 딱 달라붙는 dress wrestle할  때처럼 press 방금 만났지만 10분 뒤에  할 수 있어 sex 난 한국 kanye west  맘에 안 들면 올라가서  너의 mic을 뺏어 생각나는 대로  토해내는 이 가사  여자들은 근데 왜 모잘  뺏어갈까 Club에서 날 볼 때  이해할게 okay  내 관심사는 오로지  니 몸몸몸매  내 놀이터는 강남  사무실은 홍대 같이 노는 놈은 C Jamm  주중에도 좆돼 uh we money making motherfuckers 이건 chart 못 올라가  괜찮아 필요 없어 돈 걱정할 것 없어  하고 싶은 거 해 It's Just Music 우린  하고 싶은 거 해  I'm on my way yes I'm the best  I'm a star I'm on my way  누가 날 막아 No Way I'm on my way 하늘을 찌르러 가 1 2 3 4  I'm standing on the front line 나는 그저 가는 길을 가지 비켜라 지구 정복할 거니까 계속 지켜봐 소년 같다는 말 맞아 나는 그냥 나 게으름은 없어 쉬는 방법도 몰라  6명에게 둘러싸였어 날 사랑한대 근데 난  얘 이름도 몰라 집에 언제 가v 말했지  너랑 안 가 I don't want no love  이젠 아니야 내 style 생각 없이 살고 싶어  영원히 40년 뒤 club의  유일한 할아버님 지팡이 들고 놀지도 모르지 Hugh Hefner가  내 꿈 그래서 돈 벌길  한 번뿐인 인생  끼치자고 민폐 매미처럼 짧잖아  눈치보긴 질색 남들 좀 놀게 냅 둬  건드리지마 누구든 재미없는  삶은 싫어하니까 The world is yours  이 말만은 믿어 무엇이든 주문하면 돼  편하게 시켜 왕처럼 걸어 왕처럼 말해 그럼 왕 취급받다가  결국 진짜 왕 돼 for real 기존에 받았던 교육은 버려 넌 누구든지 될 수 있어  너의 영웅처럼 이걸 깨달으면 편견의  학교는 끝나 aaaaay  welcome to the good life I'm on my way yes I'm the best  I'm a star I'm on my way 누가 날 막아 No Way I'm on my way 하늘을 찌르러 가  1 2 3 4  I'm standing on the front line 이제 모두 알아 날 다음  목표는 백인 허나 난 아직이지만  비행기는 ready 난 꿈속에 살어 허나  쟤네한텐 freddy 곧 난 탑 스타들과 비교되지 클럽 얘기 해볼까 그래  난 돈 벌 때  빼곤 안가 기회다 싶어  쟤넨 날 유혹해 그럴 수 밖에 BewhY 이니까 내 성공의 비결은 바로  나의 이름빨 나는 그저 가는 길을 가지 비켜라 지구 정복할 거니까 계속 지켜봐 소년 같다는 말 맞아 나는 그냥 나 게으름은 없어 쉬는 방법도 몰라 나는 그저 가는 길을 가지 비켜라 지구 정복할 거니까 계속 지켜봐 소년 같다는 말 맞아 나는 그냥 나 게으름은 없어 쉬는 방법도 몰라
2016.09.12~09.18,79,9630200,Ain`t Got Nobody (Prod By. DEAN) (Feat. DEAN),미료,언프리티 랩스타 3 Track 5 & 6,2016.09.03,Rap / Hip-hop,"Deanfluenza,미료",yo 미 미 미리오  한국 힙합 씬 내가 그 길이오  날 알지 못하면  허니 팸처럼 길 잃어  날 따라와 내가 진리요 빛이요  난 매번 색달라져 like 카멜레온  음원은 낼 때마다  지붕이 뚫리었나  raining money million or billion  babies in pavilion  and ill kill the stereo  자체가 스웩인데 뭘 더 증명해  네이버에 나를 검색해봐 극명해  중요한 건 난 아직 현재 진행형에  끝이란 없어 모두 다 어서  내 뒤로 와서 배경해  밤하늘이 깔리고 다시 음악이 흐르면 let it flow flow 건배해 가끔 숨이 가쁘고 고장이 난 듯 삐걱거려도 just keep dancing’ again&amp;again like a boomerang you ain’t got nobody ain’t got nobody ain’t got nobody you ain’t got nobody ain’t got nobody ain’t got nobody you ain’t got nobody ain’t got nobody ain’t got nobody you ain’t got nobody ain’t got nobody nobody body can do it like me 나는 무한 스펀지 남들의 장점을 흡수해 무대에 선 뒤 내 커리어의 값을 해 덤불이 있어도 선물이라 맘쓰네 백만 톤의 자석같이 남녀노소를 다 끄네 uh you ain’t got nobody 비루해 랩은 다 비슷한 카피 흠 지루해 그런데 카피한 죄책감 그런건 없더라 뒤로 미루네 하지만 날 봐 난 오리지널에 real해 애들은 친목질 하느라 가로수길 다녀 while I’m killing people with my music 나의 kill 관여 100pro 매일 같이 세트로 받는 사랑과 축복 이제 나는 꿈을 현실에 풀어 밤하늘이 깔리고 다시 음악이 흐르면 let it flow flow 건배해 잡음들은 잠시 hoo  그 누군가가 들이 닥쳐도 just keep groovin’ again&amp;again like a boomerang you ain’t got nobody ain’t got nobody ain’t got nobody you ain’t got nobody ain’t got nobody ain’t got nobody you ain’t got nobody ain’t got nobody ain’t got nobody you ain’t got nobody ain’t got nobody nobody body can do it like me hold up we be killin' killing’ em fanxy child 이제 전 세계를 뒤집어 클럽 에스키모 shout out to reone and delly boi I ain’t no I ain’t no deal with y’all 돈만 쫓는 놈들과 뭘 하겠어 we’re just having fun with it but we ain’t got no respect for 비즈니스 맨 no relax relax baby 하루 이틀 일도 아닌데 이제 I put my people first 너희는 stay there nobody 넌 no nobody relax relax baby 하루 이틀 일도 아닌데 이제 I put my people first 너희는 stay there nobody 넌 no nobody
2016.09.12~09.18,80,8243822,비행소년 (Feat. 거미),"매드클라운,샵건",쇼미더머니 5 Episode 2,2016.06.25,Rap / Hip-hop,"매드클라운,샵건",그날을 기억해 처음 집을 나와 성신여대 네 평짜리 방바닥엔 바퀴벌레 커핀 식었고 소화제를 또 씹었네 엄마한테 전화를 걸어 아들 별일 없네 꿈과 숨바꼭질 술래는 여기 없네 잠들지 못 해 But don't give up yeah 스물넷 딴따라 아들 더 삐딱하게 바지를 내려 입고 신었네 더러워진 팀벌랜드 뛰었네 떨어지든 날던 일단은 뛰어야지 넘어지건 말건 내가 넘어지건 말건 세상은 날 가르쳐 뛰길 포기하고 넘어지는 방법 But nah I'm gonna fly away 미안해 미안해 미안해요 Mama 너무 멀리 떠나왔죠 아직 기다리나요 미안해 미안해 I'm going home 이젠 멋진 날이 와요 비바람이 치는 거친 하늘 위로 난 날아 12시간씩 일하시는 어머니 가족사진에 오려 붙인 아버지 사진 대환 없고 한숨 가득한 나의 좁은 집 조용히 신발만 대충 신고 뛰쳐나왔지 어 가는 길마다 자꾸 비바람이 쳐 도망치다보면 다시 집 앞에 있어 94 말했잖아 내 가족 내가 지켜 성공할 수만 있다면 나 무릎이라도 꿇지 뭐 어 자초한 길 끝까지 가야지 엄마 당신의 청춘을 내가 갚아줄게 하나씩 애비 없는 자식이라며 욕먹었던 양아치 그 양아치가 TV에서 랩 하지 이렇게 나 이제 날아볼게 미안해 미안해 미안해요 Mama 너무 멀리 떠나왔죠 아직 기다리나요 미안해 미안해 I'm going home 이젠 멋진 날이 와요 비바람이 치는 거친 하늘 위로 난 날아 I'm gonna fly away 고장 난 비행기처럼 놓쳐버린 풍선처럼 저기 높은 곳에선 슬픔들이 작아질까 바람 부는 방향 따라 떠나가 늦깎이 스물 청춘의 주소 번지수를 적어 사랑 앞에 철없고 비틀대듯 걸음을 절어 무댈 끝내고 두 손엔 오만 원이 쥐어졌고 내 광진구 옥탑방 택시빈 이만오천 원 그게 아까워서 걸었네 한남대교를 지났고 돌아가는 집까진 아직은 좀 멀어 상상을 해 완벽한 선을 그리는 비행 Uh 날개는 없기에 다시 나는 뛰네 One day I'm gonna fly away yes 미안해 미안해 미안해요 Mama 너무 멀리 떠나왔죠 아직 기다리나요 미안해 미안해 I'm going home 이젠 멋진 날이 와요 비바람이 치는 거친 하늘 위로 난 날아 미안해 미안해 미안해요 Mama 너무 멀리 떠나왔죠 아직 기다리나요 미안해 미안해 I'm going home 이젠 멋진 날이 와요 비바람이 치는 거친 하늘 위로 난 날아
2016.09.12~09.18,81,8161257,내 입술 따뜻한 커피처럼 (Feat. 이성경) (Prod. by 박근태),에디킴,내 입술 따뜻한 커피처럼,2016.04.29,Ballad,"원태연,에디킴",울지마 이미 지난 일이야  삶의 반직선 위에 점일 뿐이야  살아가면서 누구나 겪는 일이야  어른이 되는 단지 과정일 뿐이야  단지 과정일 뿐이야  제발 이러지 말아요 끝이라는 얘기  나는 항상 시작인걸요  그댈 사랑하는 마음  점점 커져가고 있는 날 잘 알잖아요  네가 밟고 걷는 땅이 되고 싶던  잠시라도 네 입술 따뜻하게  데워줄 커피가 되고 싶던  oh 난 아직 사랑해  나를 많이 알잖아요 그댈 사랑하며 나를 모두 버렸다는 걸 혼자 울며 걷는 나를 모르나요 그러니 제발 이러지 마요 그래 어느 하늘 아래 안에 작은 내 사랑 이젠 나의 사랑한단 말도 의미도 잠시 우리의 힘들었던 지나간 나의 넌 기리 위리 우리의 히리 위리 돌릴 수 없는 우리 I know 이제는 돌리지 못할 거란 걸 you know 아니 너를 사랑한단 걸 오래 전 노래처럼 오래 오래 널 간직할래 그래 너만을 위한 나의 사랑은 이래 난 하지만 행복해 나같이 나쁜 남자를 만나 힘들었던 그만큼 너를 아껴줄 자상하고 부드럽고 따뜻한 그런 남자였음 좋겠어 hey I just wanna let you go 꿈에서라도 싫어요 떠나지 말아요 나는 죽을지도 몰라요 이대로 행복한걸요 모르겠나요 아무것도 바라지 않아 지나간 사랑으로 날 그대의 추억 속에서 살게 할 건가요 사랑은 계속 커져갈 텐데 이대로 나를 정말 보낼 건가요 울지마 이미 지난 일이야 버틸 수 없을 만큼 힘들겠지만 삶의 반직선 위에 점일 뿐이야 어느 때보다도 긴 시간이겠지만 살아가면서 누구나 겪는 일이야 쉽게 받아 들일 수는 없겠지만 어른이 되는 단지 과정일 뿐이야 단지 과정일 뿐이야
2016.09.12~09.18,82,9631523,화해,임창정,I`M,2016.09.06,Ballad,임창정,아직도 나를 기억하나요 많은 시간을 흘려 보냈죠 내 옷깃을 여며주던 그대 앞모습이 아직도 내겐 어제와 같은데 아직도 가끔 생각나나요 원망하고 또 오해하고 찾아 헤매 사랑하고 참 오랜 세월이 미워 미뤄왔던 우리를 화해하게 했죠 떠나간 그대 모습 없지만 나 언제나 또 바라죠 그대가 참 행복하길 가끔은 날 생각하길 떠나온 시절 우리 겪었던 어리석었던 얘기도 천천히 잊혀져 가게 모두 버리지 말고 가끔 꺼내봐요 아직도 가끔 생각나나요 원망하고 또 오해하고 찾아 헤매 사랑하고 이 오랜 세월이 그토록 미워했던 우리를 불러다 화해하게 했죠 떠나온 그 시절 그린다음 이 커져버린 후회가 그때는 잘 몰랐기에 이토록 가슴 아파요 떠나온 시절 우리 겪었던 어리석었던 얘기도 천천히 잊혀져 가게 모두 버리지 말고 가끔 꺼내봐요 이 아물어버린 상처도 어느 날 문득 언젠가 문득 저려 오는 것 떠나간 그대 모습 없지만 나 언제나 또 바라죠 그대가 참 행복하길 가끔은 날 생각하길 떠나온 시절 우리 겪었던 어리석었던 얘기도 천천히 잊혀져 가게 모두 버리지 말고 가끔 꺼내봐요
