time,rank,song_id,title,singers,album,date,genre,creator,lyric2012.07.01~07.07,67,3848383,BUBIBU (Remix Ver.),Apink(에이핑크),BUBIBU,2012.07.06,Dance,"황금두현,노는어린이",오늘 어떤가요 내 모습 요즘 들어 내가 예뻐보인대 자꾸 자꾸 거울만 보네요 난 오늘 좀 괜찮은 여자 두근 두근 두근 떨려와 니 생각만 하면 떨려와 이런 날 어떡해요 oh oh 내가 바보같지만 이런 내가 부끄럽지만 용기내 말할래요 천천히 너의 두 볼에 BUBIBU 니 손 꼭 잡고 BUBIBU 너만 보면 나는 간지러 그댈 보면 나는 룰루랄라 이름만 들어도 좋아 목소리만 들어도 좋아 니가 너무 좋아 니가 너무 좋아 어떡해 조금씩 너의 입술에 BUBIBU 너는 내 전부 BUBIBU 너만 보면 난 기분 다 좋아요 이름만 들어도 좋아 목소릴 들어도 좋아 좋아 좋아 좋아 너무 좋아 좋아 어떡해 난 좋아 조금 무뚝뚝해보여도 내 눈엔 따뜻한 그런 남자죠 자꾸 니 얼굴만 보네요 하나뿐인 내 남자친구죠 자꾸 자꾸 자꾸 자꾸만 니 생각이 나요 자꾸만 이런 날 어떡해요 oh oh 산책도 갈래요 소풍도 가고 싶죠 할 일이 너무 많죠 천천히 너의 두 볼에 BUBIBU 니 손 꼭 잡고 BUBIBU 너만 보면 나는 간지러 그댈 보면 나는 룰루랄라 이름만 들어도 좋아 목소리만 들어도 좋아 니가 너무 좋아 니가 너무 좋아 어떡해 조금씩 너의 입술에 BUBIBU 너는 내 전부 BUBIBU 너만 보면 난 기분 다 좋아요 이름만 들어도 좋아 목소릴 들어도 좋아 좋아 좋아 좋아 너무 좋아 좋아 어떡해 난 좋아 난 좋아 난 좋아 난 좋아 난 좋아 천천히 너의 두 볼에 BUBIBU 니 손 꼭 잡고 BUBIBU 너만 보면 나는 간지러 그댈 보면 나는 룰루랄라 이름만 들어도 좋아 목소리만 들어도 좋아 니가 너무 좋아 니가 너무 좋아 어떡해 조금씩 너의 입술에 BUBIBU 너는 내 전부 BUBIBU 너만 보면 난 기분 다 좋아요 이름만 들어도 좋아 목소릴 들어도 좋아 좋아 좋아 좋아 너무 좋아 좋아 어떡해 난 좋아
2012.07.01~07.07,68,3701333,Heaven,에일리,Heaven,2012.02.09,Ballad,휘성(Realslow),니가 있는 곳에 나도 함께 할게 니가 가는 곳에 나도 함께 갈게 널 위해서 매일 웃고 널 위해서 기도하고 니 생각에 잠들고 널 부르며 눈을 떠 내 옆에서 지켜주고 내 옆에서 감싸주는 넌 나의 천국인걸 You're my only one way 오직 너를 원해 내가 니 곁에 있음에 감사해 You're the only one babe 힘든 세상 속에 사랑을 알게 해준 너 하나로 나는 행복해 Heaven Heaven Heaven Heaven Heaven Heaven Heaven Heaven Heaven Heaven 우리 함께라면 we will never cry never never cry Heaven Heaven Heaven Heaven Heaven Heaven Heaven Heaven Heaven Heaven 영원히 둘이서 never gonna be alone 니 품에서 숨을 쉬고 니 품에서 입 맞추고 니 목소릴 들으면 꿈 꾸는 것 만 같아 니 눈에서 알 수 있어 니 사랑을 알 수 있어 넌 나의 천국인걸 You're my only one way 오직 너를 원해 내가 니 곁에 있음에 감사해 You're the only one babe 힘든 세상 속에 사랑을 알게 해준 너 하나로 나는 행복해 Heaven 나만의 사람 그래 나를 지켜줄 사람 어떤 슬픔도 어떤 아픔도 너와 함께 한다면 어느 누구도 난 부럽지 않아 떨리는 두 손을 잡아줘 내가 사는 이유 너니까 You're my only one way 오직 너를 원해 내가 니 곁에 있음에 감사해 You're the only one babe 힘든 세상 속에 사랑을 알게 해준 너 하나로 나는 행복해 Heaven Heaven Heaven Heaven Heaven Heaven Heaven Heaven Heaven Heaven 우리 함께라면 we will never cry never never cry Heaven Heaven Heaven Heaven Heaven Heaven Heaven Heaven Heaven Heaven 영원히 둘이서 never gonna be alone oh so alone
2012.07.01~07.07,69,3743293,이상형,버스커버스커,버스커 버스커 1집,2012.03.29,Rock,"장범준,황용하",헤이 브래드 완전 뷰리풀 걸   저기 데어  어디 웨어 헐 헐  이게 뭐야 이게  아 왜 좋자나  그대 새끼 발톱이 날 설레게 해  그대의 아홉 번째에 척추가   날 미치게 해 좋아요  볼록 나온 뱃살부터   보드라운 턱선이  조그맣네 잡히는 손가락   쪼글쪼글 팔꿈치 너무 좋아요  좋아요 너의 통통한 손목  좋아요 너의 꼬불꼬불 곱슬머리  좋아요 너의 하나하나들이  좋아요 너의 높은 하이톤의 목소리  은은하게 드러난 오장육부가  내 가슴을 뛰게 해 배배 꼬인  달팽이관이 너무 섹시한 걸요  어렴풋이 드러난 세 번째 갈비뼈가  무릎에 연골과 음 복숭아뼈  탱글탱글 광대뼈 너무 좋아요  좋아요 너의 통통한 손목  좋아요 너의 꼬불꼬불 곱슬머리  좋아요 너의 하나하나들이  좋아요 너의 높은 하이톤의 목소리 그댈 바라보고 있으면  점점 멀어지나요  왜 내 마음을 몰라요 날 사로잡는 그대여 기다리고 있으면  점점 멀어지나요 왜 내 마음을 몰라요 왜 좋아요 너의 통통한 손목 좋아요 너의 꼬불꼬불 곱슬머리 좋아요 너의 하나하나들이 좋아요 너의 높은 하이톤의 목소리
2012.07.01~07.07,70,3834233,태양은 없다,보헤미안,태양은 없다,2012.06.29,Ballad,"김현아,작곡가조영수작사작곡모음탈퇴회원좋아요총건수26677곡#작곡가#조",하루하루 I wait for you  너만 기다리는데  한 순간도 너를 잊을 수 없어 baby I cry for you  네가 다녀 갈까봐  오늘도 난 그곳에 있다 손발이 차가워 가슴이 시려  넌 내게 없으면 내게 태양은 없다 사랑이 떠난 곳  매일 기다린다 말한 곳  그 곳에 있다  나 이렇게 하루하루  I wait for you  너만 기다리는데  한 순간도 너를 잊을 수 없어 baby I cry for you  네가 다녀 갈까봐  오늘도 난 그곳에 있다 오늘은 와 줄까 내일은 올까  소리쳐 부르면 내 목소리 들릴까 언제든 괜찮아 조금 늦어져도  괜찮아 그 곳에 있다  나 이렇게 하루하루  I wait for you  너만 기다리는데  한 순간도 너를 잊을 수 없어 baby I cry for you  네가 다녀 갈까봐  오늘도 난 그곳에 있다 한번이라도 단 한번만이라도  미치도록 보고 싶어 I wait for you  너만 기다리는데  한 순간도 너를 잊을 수 없어 baby I cry for you  네가 다녀 갈까봐  오늘도 난 그곳에 있다 하루하루 I wait for you  너만 기다리는데  한 순간도 너를 잊을 수 없어 baby I cry for you  뜨거운 태양 있어도  너 아니면 태양은 없다
2012.07.01~07.07,71,3772625,떠나간다,노을,떠나간다,2012.04.19,Ballad,최규성,나는 괜찮아  내가 널 잊어야 행복할 수 있다면  이미 떠나버린 니맘을  붙잡을 수는 없다는 게 느껴져서 언젠가 다시 웃으며 볼 수 있게 웃으며 보내줄게 어쩌다가 가끔 취해 전화를 걸어 울면서 너를 찾겠지만 떠나간다 떠나간다 날 버리고 떠나간다 내가 사랑했던 추억들도 다 가지고 떠나간다 울어본다 울어본다 가지 말라고 울어본다 너무 사랑했던 널 결국 나는 널 보내준다 니가 간다 좋았던 날들 이젠 내게 다시 올진 모르겠지만 그만해줘야지 남은 사랑은 모두 그 사람에게 받겠지 너 없인 아직 자신이 없어서 마지막 힘을 다해서 떠나려는 너를 밀어내는 너를 눈물로 잡아보지만 떠나간다 떠나간다 날 버리고 떠나간다 내가 사랑했던 추억들도 다 가지고 떠나간다 울어본다 울어본다 가지 말라고 울어본다 너무 사랑했던 널 결국 나는 널 보내준다 니가 간다 그저 널 바라보면서 설레던 그 시간이 추억이 되어 매일밤을 버티지만 you don't have to cry 그대 나 때문에 슬퍼마요 그대 웃어야 내가 살아요 그대 떠나간다 떠나간다 날 버리고 떠나간다 내가 사랑했던 추억들도 다 가지고 떠나간다 울어본다 울어본다 가지 말라고 울어본다 너무 사랑했던 널 결국 나는 널 보내준다 니가 간다
2012.07.01~07.07,72,3805780,겸손은 힘들어,리쌍,Unplugged,2012.05.25,Rap / Hip-hop,"조영남,개리",밤바바 밤바바 밤바 밤밤바바  밤바바 밤바바 밤바 밤밤바바  밤바바 밤바바 밤바 밤밤바바  밤바바 밤바바 밤바 밤밤바바  세상에는 이런 사람 저런 사람  세상에는 잘난 사람 못난 사람  많고 많은 사람들이 있지만   그 중에 내가 최고지  겸손 겸손은 힘들어  겸손 겸손은 힘들어  겸손 겸손은 힘들어 겸손은 힘들어  나는 성공한 노는 오빠   놀때는 마치 날아가는 헬리콥터  가는 곳은 언제나 꽃밭   얌전 빼는꼴은 절대로 못 봐  광대 같은 가수 같지만   마술 같은예술 낭만  즐기며 사는 잘 나가는 순정마초  넘치는 돈 좀 쓰러 어디든지 가볼까  도도한 숙녀님들 혼 좀 한번 내볼까  겸손 겸손은 힘들어 겸손  겸손은 힘들어  겸손 겸손은 힘들어 겸손은 힘들어  돌아가신 울 아버지 울 할머니  겸손하라 겸손하라 하셨지만  지금까지 안되는 건 딱 한 가지  그건 겸손이라네  잘난 척하는 사람 앞엔  고개 안 숙여 그 고집은  절대로 안 굽혀 십 년을 넘게 난 이렇게 살아서 하나도 안 두려워 안 부러워 내 맘대로 사는 것이  난 즐거워 내 색깔 내 가사 내 음악 사랑  내 사상 내 삶 모든 것이 다 자랑스러워 넘치는 돈 좀 쓰러 어디든지 가볼까 도도한 숙녀님들 혼 좀 한번 내볼까 겸손 겸손은 힘들어 겸손 겸손은 힘들어 겸손 겸손은 힘들어 겸손은 힘들어 손뼉을 치면서 겸손 겸손은 힘들어  겸손 겸손은 힘들어 겸손 겸손은 힘들어 겸손은 힘들어 세상에서 제일 힘든 겸손 겸손은 힘들어  겸손 겸손은 힘들어 겸손 겸손은 힘들어  겸손은 힘들어  정말로 힘들어 힘들어
2012.07.01~07.07,73,3838853,Love Is Energy,치치,Love Is Energy,2012.06.29,Dance,김희영,"하루를 못 참겠어 전화기만 쳐다봐 일분도 못 참겠어  너만 생각만 하나봐 내 맘 모르는 그 눈빛이 미치겠어 난 보나마나 너는 나를 흔들지  도대체 어디를 바라보는지 내가 니 여자일 거라는 생각엔  아무런 표정이 대답이 없지 그래도 넌 아직 나의 에너지  숨이 막혀오는 나의 시너지 매일 평생을 일생을 지켜줄 남자가  너라는 걸 모르지 Love is energy Love is energy Love is energy in my heart Love is energy You’re my energy Love is energy in my heart 진짜 사랑을 원해 누구도 니 자릴 가질 수 없게 Love is energy You’re my energy Love is energy in my heart Feel my heart 이별은 해봤어도 사랑은 나 첨인걸 세상을 다 준대도 너 아니면 싫은걸 비밀이 많은 너의 story 이젠 말해봐 Yo, 뭐든 해줄 거라 말은 잘하지  이런 저런 말로 녹이지 Lie to me U lie to me 꼭 필요할 때만 너는 입을 다물지 그런 너를 왜 난 매일 찾는지  알 순 없지만 그저 원하지 Come to me baby come to me yeah cuz I’m mad mad for ma love Love is energy Love is energy Love is energy in my heart Love is energy You’re my energy Love is energy in my heart 진짜 사랑을 원해 누구도 니 자릴 가질 수 없게 Love is energy You’re my energy Love is energy in my heart Feel my heart You’d better get it &amp; I just  step stepin’ it dub, dub, dub can U feel it I’m gonna makin’ it what, what, what You’d better get it  I just step stepin’ it dub, dub, dub Now what U wanna do Hey, change your beat again Love is energy, Oh God have mercy Look at me now,  please don’t say that lie lie Love is energy, Oh God have mercy Look at me now,  please don’t say that lie lie Love is energy Love is energy Love is energy in my heart Love is energy  You’re my energy Love is energy in my heart 진짜 사랑을 원한다면  이제 내게 맘을 열어줄래 Love is energy You’re my energy Love is energy in my heart Feel my heart"
2012.07.01~07.07,74,3832075,완벽한 날 (feat. 아이비),버벌진트,10년동안의오독 I,2012.06.21,Rap / Hip-hop,버벌진트,아침마다 눈을 뜨자마자 버릇처럼 내뱉는 나의 혼잣말 thank you for another beautiful day 미리 감사드리고 나서 우리 구의 최고 산책코스 응봉산으로 go 한강을 내려다 바라보고 집으로 돌아오는 길 횡단보도 앞 까페에서 espresso 로 카페인 보충한 후  피가 도는 속도가 빨라질 때쯤 영감의 radar 켜 new rhymes new melody 아니면 하다못해 제목이라도 건지면 lucky me 속으로 외치면서 발걸음이  가벼워지겠지 what a way to start a day sweet 완벽한 날  the start of a perfect day 새로산 신발 새로산 옷 꺼내 걸친채 let's get it on again 좋은 느낌 it's gon be a perfect day let's get it on again 좋은 느낌 it's gon be a perfect day 완벽한 날   it's the start start start of a perfect day 완벽한 날   it's the start start start of a perfect day 샤워를 마치고 난 후 거울 앞 남의 몸 보듯이 내 몸을 훑어봐 눈을 반쯤 감고 말해  damn I'm cold 하얗고 해맑고 순진하던 때는 지나갔지 아이스크림값이 차값이 달라지고 헤어짐과 만남이 빨라지고 크게 보였던 방이 작아지고 now I got my mind on my money money on my mind 넌 얼마나 버니 친구들이 모여 한다는 대화가 이런 식 이게 어른이 되어가는 과정 글쎄 whatever 돈이란 게 the more the better 아니겠어 아님 말구 기합넣고 시작해 내 하루 완벽한 날  the start of a perfect day 새로산 신발 새로산 옷 꺼내 걸친채 let's get it on again  좋은 느낌 it's gon be a perfect day let's get it on again 좋은 느낌 it's gon be a perfect day 완벽한 날   it's the start start start of a perfect day 완벽한 날   it's the start start start of a perfect day 엘레베이터 함께 탄 여자 perfect 미소로 인사를 보냈네 perfect 처음 걸려 온 전화 perfect 계좌번호 달래 돈 보낸대 perfect 어제완 달라 I'm feeling perfect 뭘 입어도 지키는 철칙 빨간 아이템 최소한 하나 옷이 안 되면 빨간 양말 신발을 벗고 페달을 밟아 부드럽게 차가 좀 막힌다고 해도 나 절대 짜증 안 나 왜냐면 나의 곁에 바로 이럴 때를 대비해서 어제 사놓은 양고기 샌드위치 이 맛을 모르면 you ain't speaking my language 고수 커민 코코넛 좋아하는 사람 손들어 wassup 완벽한 날   it's the start start start of a perfect day 완벽한 날   it's the start start start of a perfect day 완벽한 날 완벽한 날  완벽한 날 완벽한 날 완벽한 날 완벽한 날 완벽한 날
2012.07.01~07.07,75,3827997,Animal (Feat. 정호석 Of 방탄소년단) (Radio Edit),조권,I`m Da One,2012.06.25,Dance,"Avicii,LaurenDyson,방시혁,Pdogg,Wonderkid,정호석","더 이상은 나를 제어 못하겠어 어떻게 해요 누가 날좀 날좀 날좀 take control 내 귀엔 beat 흔들리는 Disco ball 이 makes me free 그럼 또 사정 없이 조권 on the floor 이 바닥에 crazy boy는  나 하나야 on the floor 누가 make some noise 해도  한 주먹에 blow 진짜 beat 흔들리는 Disco ball 이  makes me free 이 바닥에 crazy boy는 나 하나야  on the floor I'm an animal. Won't you see  me go o-o-oh I'm an animal You'll watch me  on the floor o-o-oh Don't stop the beat stop the  beat make it drop Don't stop the beat make it drop Don't stop the beat stop the  beat make it drop Don't stop the beat make it drop 이 바닥에 crazy boy는  나 하나야 on the floor 누가 make some noise 해도  한 주먹에 blow 진짜 beat 흔들리는 Disco ball 이  makes me free 이 바닥에 crazy boy는 나 하나야  on the floor Yeh, I'm the anima-a-a-al Yeh, I'm the anima-a-a-al Yeh, I'm the anima-a-a-al Yeh, I'm the anima-a-a-al I'm an animal Won't you see me go o-o-oh I'm an animal You'll watch me  on the floor o-o-oh Don't stop the beat stop the  beat make it drop Don't stop the beat make it drop Don't stop the beat stop the  beat make it drop Don't stop the beat make it drop 뜨거워진 나를 take control  음악에 데였어 걱정은 하지 말아 이 바닥에  crazy boy Get on the floor  내 무대는 저기 저기 저 날 빛추는 조명 앞엔  hurry hurry up Hot hot 해 분위긴 더위타 좀더 강하게 시선은 물들어가 미리미리 봐 어디를 가든지 난 화려한 무대를 모두 삼켜버린 animal Rah Yeh, I'm the anima-a-a-al Yeh, I'm the anima-a-a-al Yeh, I'm the anima-a-a-al Yeh, I'm the anima-a-a-al"
2012.07.01~07.07,76,3843387,Run To You (Swing),레드애플,Run To You,2012.07.05,Dance,안영민,Baby baby Run to you 난 너뿐이야 lady 랄랄랄랄라랄라 내 곁으로 와 오늘 밤 Run to you 내가널 지켜줄께 랄랄랄랄라랄라 나는 니가 필요해 oh come on 사막의 물처럼 밤하늘 달처럼 너는 절대적이야 내겐 너뿐이야 all right 나의 손을 잡아줘 all right 뜨겁도록 안아줘 던져진 주사윈걸 시작은 됐어 Baby baby Run to you 난 너뿐이야 lady 랄랄랄랄라랄라 내 곁으로 와 오늘 밤 Run to you 내가 널 지켜줄께 랄랄랄랄라랄라 나는 니가 필요해 oh come on girl all right 도망치지 말아줘 all right 밀어내지 말아줘 내 인생의 드라마 주인공은 너 Baby baby Run to you 난 너뿐이야 lady 랄랄랄랄라랄라 내 곁으로 와 오늘 밤 Run to you 내가 널 지켜줄께 랄랄랄랄라랄라 나는 니가 필요해 oh come on 널 만나기전 내 인생은 풍랑 마치 넌 종교같아 절대적인 나의 사랑 오늘밤 저 달이 꼭 비춰주는 사람 조금만 불어와도 설레이는 바람 지금껏 해온 사랑이란 슬픈 물거품 타인에게 보여지는 기념품 이렇게 365일 숨차도록 매일 너를 향해 달려 Run to you 푸른 달빛이 뜨는 밤 오오오 사랑을 속삭여 줄래 오오 all right 오직 너 하나뿐이야 all right 지금 나에겐 오직 너란 여자가 전부인걸 Run to you 니 앞에 서있을게 랄랄랄랄라랄라 언제까지나 니 곁에 Run to you 내가 널 지켜줄게 랄랄랄랄라랄라 나는 니가 필요해 Baby Run to you
2012.07.01~07.07,77,3811405,Someday (피쳐링. 윤도현 Of YB),리쌍,Unplugged,2012.05.25,Rap / Hip-hop,개리,모든 것이 멈춘 채  시간은 또 조용히 흐르네 가라앉던 가슴이  또다시 숨이 꽉 막히네  나 홀로 버려진 채 사라지는 아픔마저도  미치도록 아쉬운데 너 없이 견디는 이 시간도  끝나겠지 언젠가는 Someday 다 잊혀져갈 사랑  그리운 내 사랑  언제나 힘들게만 한 그대여 Someday 내 가엾은 내 사랑  그리운 내 사랑 언제나 행복해야 해 날 떠나서 언제나 불안했던 사랑의 계단 그 어떤 순간에도 내 손을 놓지  않았던 네가 항상 너무 고맙다 이젠 날 떠나서 행복해라 제발  나와 찍은 사진처럼 웃어라  맨날슬프고 힘든 시간의 연속  타들어가는 맘속 불안한 두 손  혹독한 이별의 구속 아프고 아물고 또다시 아파오는  고통의 반복 힘들다 정말 미치도록 사라지는 아픔마저도  미치도록 아쉬운데 너 없이 견디는 이 시간도  끝나겠지 언젠가는 Someday 다 잊혀져갈 사랑  그리운 내 사랑 언제나  힘들게만 한 그대여 Someday 내 가엾은 내 사랑  그리운 내 사랑  언제나 행복해야 해 날 떠나서 날 떠나서 날 떠나서 날 떠나서 Someday 다 잊혀져갈 사랑  그리운 내 사랑 언제나 힘들게만 한 그대여 Someday 내 가엾은 내 사랑  그리운 내 사랑  언제나 행복해야 해 날 떠나서 날 떠나서 날 떠나서  날 떠나서  지금 내가 할 수 있는 건  니가 행복하길 바라는 것 이대로  시간이 흘러 상처들이 아무는 것  널 부르고 싶어도  그저 입을 다무는 것 끝없는 후회들과 계속 싸우는 것  억지로 써내려가는 이별의 말들 하나씩 지워가는 내 지난 날 들  이렇게 멍하니 이겨내 보는 하루하루 내 전부 내 희망 내 사랑 너 너 너 날 떠나서
2012.07.01~07.07,78,3828029,이미 슬픈 사랑 (원곡가수 야다),이영현,`나는 가수다 2` 6월 17일 - 고별 가수전,2012.06.17,Ballad,이재혁,널 볼 수 있어 행복했었지 그대가 날 위해 있어준 시간만큼 너의 부모님께 전해 들었지 나 아닌 사람과 결혼하게 된 걸 너 그렇게 힘든데 내게 말 못하고 울고 있던 게 생각나 떠나는 그대여 울지 말아요 슬퍼말아요 내가 단념할게요 마음 편히 가시도록 내 사랑 그대가 날 떠나 행복할 수 있다면 내가 떠나갈게요 나의 그대 삶에 축복을 너무 걱정 마 철없던 내가 너 없인 무엇도 할 수는 없지만 넌 널 위해 살아줘 나는 어떻게든 살아갈 수 있을 거야 떠나는 그대여 울지 말아요 슬퍼말아요 내가 단념할게요 마음 편히 가시도록 내 사랑 그대가 날 떠나 행복할 수 있다면 내가 떠나갈게요 나의 그대 삶에 축복을 떠나는 그대여 울지 말아요 슬퍼말아요 내가 단념할게요 마음 편히 가시도록 내 사랑 그대가 날 떠나 행복할 수 있다면 내가 떠나갈게요 나의 그대 삶에 축복 떠나는 그대여 울지 말아요 슬퍼말아요 내가 단념할게요 마음 편히 가시도록 내 사랑 그대가 날 떠나 행복할 수 있다면 내가 떠나갈게요 나의 그대 삶에 축복을 나의 그대 삶에 축복을
2012.07.01~07.07,79,3822827,제트별 (Jet),f(x),`Electric Shock` The 2nd Mini Album,2012.06.10,Dance,kenzie,"Make U Lose Control Make U Lose Control Make U Lose Control Make U Lose Control 구름 속 헤치고 구름 속 헤치고 썬더빔 속으로  썬더빔 속으로  이제 넌 무시무시한 내 최면에  걸렸어 낚였어 로보트가 됐어 귀엽다 예쁘다 흠뻑 빠졌는데  사실 난 쉽지 않단 걸 알아야 돼 예쁘장한 나 귀여워 통통한 다리 나 애기 같대  나는 서울 도쿄 파리 뉴욕 너무  바쁜 스케줄 여기 번쩍 저기 찰칵  Just Like A Butterfly Let's Fly High Fly  별나라 갈래 파란 제트기를 타자 파일럿 Oh My God 맙소사 너에게 빠져들어  자꾸 빠져들어 나  Automatically Wow 따라라라랄라라  따라라 라랄라랄라 Boy, We Fly Higher &amp; Faster  This Only Gets Better 따라라라랄라라  따라라 라랄라랄라 Boy, We Fly Higher &amp; Faster  This Gunna Be So Killa Make U Lose Control Make U Lose Control Make U Lose Control Make U Lose Control 구름 속 헤치고 구름 속 헤치고 썬더빔 속으로  썬더빔 속으로 이제 넌 무시무시한 내 최면에  걸렸어 낚였어 로보트가 됐어 뽀얗다 미쳤다 흠뻑 빠졌는데  사실 난 쉽지 않단 걸 알아야 돼 넌 약간 긴장 설레니 내 핑크빛 볼 보다 빨개졌어 나는 서울 도쿄 파리 뉴욕 너무  바쁜 스케줄 여기 번쩍 저기 찰칵  Just Like A Butterfly Let's Fly High Fly  별나라 갈래 파란 제트기를 타자 파일럿 Oh My God 맙소사 너에게 빠져들어  자꾸 빠져들어 나  Automatically Wow 다 너무나 쉽게 사랑에 빠져들어가  나만의 그 느낌 너를 찾았어 이제야 Let's Fly High Fly  별나라 갈래 파란 제트기를 타자 파일럿 Oh My God 맙소사 너에게 빠져들어  자꾸 빠져들어 나  Automatically Wow Let's Fly High Fly  별나라 갈래 파란 제트기를 타자 파일럿 Oh My God 맙소사 너에게 빠져들어  자꾸 빠져들어 나  Automatically Wow 따라라라랄라라  따라라 라랄라랄라  따라라라랄라라 따라라 라랄라랄라  따라라라랄라라라"
