time,rank,song_id,title,singers,album,date,genre,creator,lyric2016.07.25~07.31,43,7911687,Boys And Girls (Feat. Babylon),지코(ZICO),Boys and Girls,2015.11.03,Rap / Hip-hop,지코(ZICO),Don't worry about money 놀자 오빠가 무리할게 넌 그냥 옆에서 편하게 groove 타기만 해 alright I’m a boy you’re a girl I’m a boy but you’re a girl I’m a boy you’re a girl 아름다운 여자는 대접 받아야 해 아는 친구들 불러모아 흥이 많고 사교성 좋은 애들로만 여긴 한국이지만 서구적인 느낌 가득 아 참 일렉은 절대 안 틀 거야 흠뻑 다 젖어 알콜로 샤워해 ice bucket challenge 저 고주망태는 누가 낚아 챌는지 키는 컸어도 호기심은 미성년 주체 못하는 바람에 주최한 festivity OH UH OH UH 날 알아봐도 티나게 리액션 하지 말아줘 OH UH OH UH 인스타 업뎃이 목적이면 겉옷 챙겨서 나가줘 OH UH OH UH 안목 있는 누나들 want to see ma tattoo 전화기 뒤집자 분위기 좋으니까 진지 빠는 즉시 귀가조치야 Don't worry about money 놀자 오빠가 무리할게 넌 그냥 옆에서 편하게 groove 타기만 해 alright I’m a boy you’re a girl I’m a boy but you’re a girl I’m a boy you’re a girl 아름다운 여자는 대접 받아야 해 이 파티에는 대부분이 잘나가니까 섣불리 가오 잡다간 곧바로 망신살 사양 말고 마셔 그건 네 인생샷 아무나 잡고 사진 박아도 네 인생샷 I’m intoxicated 남여남여 나눠 착석해 음탕한 게임 하더라도 밖에선 입 단속해 해 뜨고 네 화장도 뜨고 나 먼저 자리 뜨기 전까지 계속 뜨거 OH UH OH UH 다 망가지는 마당에 고상한 척은 자제해 OH UH OH UH 뜬금없는 일 얘기나 고민 상담은 따로해 OH UH OH UH 흑기사 자처하는 쟤는 무슨 심보 전화기 뒤집자 분위기 좋으니까 진지 빠는 즉시 귀가조치야 Don't worry about money 놀자 오빠가 무리할게 넌 그냥 옆에서 편하게 groove 타기만 해 alright I’m a boy you’re a girl I’m a boy but you’re a girl I’m a boy you’re a girl 아름다운 여자는 대접 받아야 해 Say hello to ma little friends 개념 다 차있지 실수하지 않게 당부해놨지 OH UH OH UH 부담 없이 누리면 돼 Don't worry about money 놀자 오빠가 무리할게 넌 그냥 옆에서 편하게 groove 타기만 해 alright I’m a boy you’re a girl I’m a boy but you’re a girl I’m a boy you’re a girl 아름다운 여자는 대접 받아야 해
2016.07.25~07.31,44,8252404,현상수배 (Wanted),"씨잼(CJamm),레디(Reddy)",쇼미더머니 5 Episode 3,2016.07.02,Rap / Hip-hop,"Zion.T,씨잼(CJamm),레디(Reddy)",현상수배 현상수배  현상수배 현상수배  현상수배 현상수배  현상수배 현상수배  현상수배 현상수배  현상수배 현상수배  현상수배 현상수배 현상수배  현상수배 현상수배  날 쫓는 애들 많아 그래 정말 그래  날 미워하는 애들  내 실수를 정말 원해 OK  날 마주 해봐 그냥  상상으로만 너 근데   내 앞에서 하면 문제  그런 말은 넣어두길  내가 잡히기를 원하는 게 아냐   내가 나타나길 원해 OK  경쟁구도는 꿀잼   근데 이제 나랑 안 돼 게임이  매력 없는 래퍼들 때문에   씨잼이는 됐어 연예인이  Young leader 우 맞아  흘러넘쳐 여유가  밤새고서 촬영 와서  그냥 음 어 요요 딱 난 잘하기만 해 Yo why you mad at me  난 가사 까먹어도 돼  이미 꽤 해냈으니  이제 클럽에 가더라도 Son  꽤 품위를 지켜  근데 키 큰 남자 인기는  잠깐 유행이었나 싶어  현상수배 현상수배  현상수배 현상수배  현상수배 현상수배  현상수배 현상수배  현상수배 현상수배  현상수배 현상수배  현상수배 현상수배 현상수배  내 간지는 착하지 않아 Illegal   내 현상금을 올려 올해 안에 난 Million  Ooh 딴 래퍼들도 옷을  나처럼 입고 싶어 해  니네가 생각하는 거보다  난 훨씬 위험해  보고 배워 내 간지는  마치 예수님의 자비  나한텐 식은 죽 먹기 Ooh  마치 이 노래의 싸비  다시 태어난 기분이야  뭐든 다 할 수 있을 정도로  난 너무 잔인해 G2  멘탈을 난도질할 정도로  여자들은 나를 찾아다녀  너랑 다른 이유로  난 절대로 안 숨어다녀  너랑 다른 이유로  생긴 대로 살래  너랑은 다른 이유로  오늘도 밤을 고장 냈어  너랑은 다른 이유로  찌질이들이 인스타로만  훔쳐보던 개쩌는   여자애랑 난 매일매일  연락도 해 요점은  첫 등장에 나 같은 놈을  기다렸다는 반응  나한테 불가능을 갖다 줘도  불태워버려 가능  현상수배 현상수배  현상수배 현상수배  현상수배 현상수배  현상수배 현상수배  현상수배 현상수배  현상수배 현상수배  현상수배 현상수배 현상수배 너네 꿈을 그려 그거 우리 몽타주  우린 니네 원하는 거 붙여 콜라주  현상수배 현상수배 현상수배 현상수배 현상수배 현상수배 현상수배 현상수배 현상수배 현상수배 현상수배 현상수배 현상수배 현상수배 현상수배
2016.07.25~07.31,45,8279153,All Mine,f(x),All Mine - SM STATION,2016.07.22,Electronica,"이스란,김민정",Oh oh oh oh Oh oh oh oh  Oh oh oh oh oh All Mine Oh oh oh oh Oh oh oh oh  Oh oh oh oh oh All Mine 맘이 맘대로 안돼  내 심장 소린 점점 빨라져 말이 맘대로 안돼  내 맘을 따라 잡을 수 없어 Baby Baby 네 눈을 볼 때면  맘이 맘이 이 시공의 벽을 넘어 널 내 품에 안고 Dive All Mine 무지개도 All Mine 저 바다도 All Mine 햇살까지 Oh oh oh oh oh All Mine All Mine 온 세상이 네 입술이 마법 부려  피어난 Fantasy 꿈의 그림  작은 두 손에 꼭 쥐어봐  너 몰래 My Heart  향기로운 말로 나의 귓가에 속삭여줬어 이 순간 보여지는 모든 환상이 내 거라고 Baby Baby 내 손을 꼭 잡아  우린 우린 이 시공의 벽을 넘어 난 네 손을 잡고 Fly All Mine 흰 구름도 All Mine 이 바람도 All Mine 향기까지 Oh oh oh oh oh All Mine Oh oh oh oh Oh oh oh oh  Oh oh oh oh oh All Mine Oh oh oh oh Oh oh oh oh  Oh oh oh oh oh All Mine 상상했던 사랑인 거죠  하늘 위 바다 끝 어딜 보아도 알록 달록 아름다워  도무지 난 눈을 뗄 수가 없죠 꿈에서도 펼치게  밤새 설레설레 잠도 못 들게 눈을 감아도 영원해주길 All Mine 네 목소리 All Mine 네 눈빛도 All Mine 네 품까지 Oh oh oh oh oh All Mine 네 사랑이 마법 부려  펼쳐진 Fantasy 꿈의 그림  작은 두 손에 꼭 쥐어봐  너 몰래 My Heart  Oh oh oh oh Oh oh oh oh  Oh oh oh oh oh All Mine
2016.07.25~07.31,46,8028724,너는 나 나는 너,지코(ZICO),Break Up 2 Make Up,2016.01.25,R&B / Soul,지코(ZICO),넌 나고 난 너야 난 너고 넌 나야 마음이 같다면 둘은 서로가 될 거야 넌 나고 난 너야 그림 너무 좋아 오그라든다는 말은 누가 만든 걸까 girl 뺨 한 대만 때려줘 며칠 사이 내게 무슨 일이 벌어진 건지 전 여친 번호 지우고 힙합만 듣던 난 어쿠스틱해졌어 tell me what you want from me 가장 예쁠 나이엔 실컷 사랑해봐야 돼 eh 네 사연 속에 나오는 쓰레기 걔랑은 비교도 안되게 내가 잘할게 왜냐면 넌 나고 난 너야 난 너고 넌 나야 마음이 같다면 둘은 서로가 될 거야 넌 나고 난 너야 그림 너무 좋아 오그라든다는 말은 누가 만든 걸까 친구들이 말해 좋을 때야 난 딱히 걱정 없고 하도 좋아서 문제야 이거 봐 욕도 줄이고 있고 바지도 올려 입고 아무한테나 미소 안 보이고 있어 거울 그만 봐 고칠 데가 어디 있어 민낯일 때 제일 이뻐 이 장면 우리 엄마 보면 기절할 노릇일 걸 더 이상의 표현은 아낄게 사실 너 이름만 옮겨 적으면 그만인데 I believe in destiny 사주나 타로 카드에 점쳐질 만남은 안 해 yeah 집착 쩌는 네 전 남친이 집 근처도 얼씬 못하게 내가 잘할게 왜냐면 Because 넌 나고 난 너야 난 너고 넌 나야 마음이 같다면 둘은 서로가 될 거야 넌 나고 난 너야 그림 너무 좋아 오그라든다는 말은 누가 만든 걸까 밤새 쪽쪽 거리다가 누추한 모습으로 함께 아침을 맞아 good morning 새삼스럽게 넌 심각하게 예뻐 그 입 당장 가져와 Mwah 넌 나고 난 너야 난 너고 넌 나야 마음이 같다면 둘은 서로가 될 거야 넌 나고 난 너야 그림 너무 좋아 오그라든다는 말은 누가 만든 걸까 Let me talk to you yeah I am you you are me I am you you are me
2016.07.25~07.31,47,8181755,Good Luck,AOA,Good Luck,2016.05.16,Dance,"한성호,장연정,이노베이터",Good luck 길이길이 You like me Good luck 길이길이 I like you Good luck 놓치지 마 Lucky lucky Good luck 나는 너의 Lucky lucky 어디서나 어딜 가나 당당한 Walking 흑백 세상 속에 나는 컬러풀한 Scene Girls girls on top 더 자신 있게 Boom boom beat drop 꾸미지 않아도 혼자 주목받는 Skill 재미없는 남자들은 한순간에 Skip Girls girls on top 그중에서도 I’m I’m the top 날 둘러싸는 시선이 반해버린 눈빛이 시시하게 느껴 져 내 사랑 갖고 싶다면 내 마음 뺏고 싶다면 색다르게 시작해 절대 나를 놓치지는 마 Good luck 길이길이 You like me Good luck 길이길이 I like you Good luck 손 내밀어 Lucky lucky Good luck 나는 너의 Lucky lucky Good luck 길이길이 You like me Good luck 길이길이 I like you Good luck 놓치지 마 Lucky lucky Good luck 나는 너의 Lucky lucky 지루해진 너에게 난 얼음처럼 Chill 머릴 써 봐 Loose해 뻔한 사랑은 Kick Boys boys watch out 니 가슴속에 Boom boom beat drop 콧대 높게 굴지 만 까다롭긴 하지만 아직 서투를 뿐이야 차가운 말투지만 보기보다 Lovely girl 정말 날 원한다면 절대 나를 놓치지는 마 Good luck 길이길이 You like me Good luck 길이길이 I like you Good luck 손 내밀어 Lucky lucky Good luck 나는 너의 Lucky lucky Good luck 길이길이 You like me Good luck 길이길이 I like you Good luck 놓치지 마 Lucky lucky Good luck 나는 너의 Lucky lucky 수작 부리는 걸 볼 줄 아는 Skill 진부한 남자애들은 다 Skip 그래 너는 왕자님 Prince 미안한데 아가 나는 South god Queen 내게 야하고 싶어 하는 애들 잘 봐 눈높이가 달라 You boy go wow wow 난 주인공 넌 Extra boy Good luck yeah good luck I give you extra love 내 사랑 갖고 싶다면 내 마음 뺏고 싶다면 색다르게 시작해 Good luck 길이길이 You like me Good luck 길이길이 I like you Good luck 손 내밀어 Lucky lucky Good luck 나는 너의 Lucky lucky Good luck 길이길이 You like me Good luck 길이길이 I like you Good luck 놓치지 마 Lucky lucky Good luck 나는 너의 Lucky lucky Good luck 놓치지 마 Lucky lucky Good luck 나는 너의 Lucky lucky
2016.07.25~07.31,48,8161257,내 입술 따뜻한 커피처럼 (Feat. 이성경) (Prod. by 박근태),에디킴,내 입술 따뜻한 커피처럼,2016.04.29,Ballad,"원태연,에디킴",울지마 이미 지난 일이야  삶의 반직선 위에 점일 뿐이야  살아가면서 누구나 겪는 일이야  어른이 되는 단지 과정일 뿐이야  단지 과정일 뿐이야  제발 이러지 말아요 끝이라는 얘기  나는 항상 시작인걸요  그댈 사랑하는 마음  점점 커져가고 있는 날 잘 알잖아요  네가 밟고 걷는 땅이 되고 싶던  잠시라도 네 입술 따뜻하게  데워줄 커피가 되고 싶던  oh 난 아직 사랑해  나를 많이 알잖아요 그댈 사랑하며 나를 모두 버렸다는 걸 혼자 울며 걷는 나를 모르나요 그러니 제발 이러지 마요 그래 어느 하늘 아래 안에 작은 내 사랑 이젠 나의 사랑한단 말도 의미도 잠시 우리의 힘들었던 지나간 나의 넌 기리 위리 우리의 히리 위리 돌릴 수 없는 우리 I know 이제는 돌리지 못할 거란 걸 you know 아니 너를 사랑한단 걸 오래 전 노래처럼 오래 오래 널 간직할래 그래 너만을 위한 나의 사랑은 이래 난 하지만 행복해 나같이 나쁜 남자를 만나 힘들었던 그만큼 너를 아껴줄 자상하고 부드럽고 따뜻한 그런 남자였음 좋겠어 hey I just wanna let you go 꿈에서라도 싫어요 떠나지 말아요 나는 죽을지도 몰라요 이대로 행복한걸요 모르겠나요 아무것도 바라지 않아 지나간 사랑으로 날 그대의 추억 속에서 살게 할 건가요 사랑은 계속 커져갈 텐데 이대로 나를 정말 보낼 건가요 울지마 이미 지난 일이야 버틸 수 없을 만큼 힘들겠지만 삶의 반직선 위에 점일 뿐이야 어느 때보다도 긴 시간이겠지만 살아가면서 누구나 겪는 일이야 쉽게 받아 들일 수는 없겠지만 어른이 되는 단지 과정일 뿐이야 단지 과정일 뿐이야
2016.07.25~07.31,49,8068881,넌 is 뭔들,마마무(Mamamoo),Melting,2016.02.26,Dance,"김도훈(RBW),문별(마마무),솔라(마마무)",Come on Hey Mommy  Come on Hey Daddy 이리와서 얘들 좀 봐 Come on Hey Sister  Come on Hey Brother 누가 얘들 좀 말려줘 귀여운 척 섹시한 척 이쁜 척 그런 거 안해도 날 알아보는 너  센스매너 말투표정 행동 하나까지 섬세한 널 알아보는 나  우리 둘 사이 딱 한 뼘 사이 매일 아침 난 너의 목소리로 눈을 뜨고 우리 둘 사이 딱 맞는 타입 Come on 거기 미스터  Come on 이리와 봐 천천히 아주 조금씩 Hey 거기 미소가 예쁜 남자 바로 너 너어어어 아아아아 날 미치게 하는 그런 남자 몸매도 얼굴도 시선강탈 Hey Mr. 생각이 멋진 남자 바로 너  너어어어 아아아아 나 지금 너 땜에 혼란스러  제발 누가 나 좀 말려줘  월화수목금토일 난 매일매일 너를 생각해 넌 나를 생각해 Word up Moon star A형 B형 AB O형 플러스 마이너스 상관없어  S극과 N극처럼 어떤 공식이든 끌려 단지 그냥 너라서  우리 둘 사이 딱 한 뼘 사이 매일 밤마다 너의 자장가로 잠이 들고 우리 둘 사이 딱 맞는 타입 Come on 거기 미스터  Come on 이리와 봐 조용히 속삭여줄래 Hey 거기 미소가 예쁜 남자 바로 너 너어어어 아아아아 날 미치게 하는 그런 남자 몸매도 얼굴도 시선강탈 Hey Mr. 생각이 멋진 남자 바로 너  너어어어 아아아아 나 지금 너 땜에 혼란스러 제발 누가 나 좀 말려줘 I like eye contact 입술을 꽉 깨물어 Your Lips 너의 두 눈이 스칠 때면 Two Eyes 숨막히는 이끌림이 날 어지럽게 해 나 너만의 영원한 소녀 팬 is 뭔들 모든 게 넌 is 뭔들 완벽해 That's right That's right 우리 사이  자꾸 떠오르네 문득 너라면 난 is 뭔들 24시간 1분 1초가 조마조마해 조금이라도 널 놓칠까 봐 24시간 지금 이순간 Come on 나를 봐봐 Come on 넌 is 뭔들 이젠 우릴 말리지마 Hey Hey Hey Yeah Hey 거기 미소가 예쁜 남자 바로 너  너어어어 아아아아 날 미치게 하는 그런 남자  몸매도 얼굴도 시선강탈 Hey Mr. 애매모호 피아노 맨 바로 너 너어어어 아아아아 나 지금 너 땜에 혼란스러  제발 누가 나 좀 말려줘 Come on 넌 is 뭔들
2016.07.25~07.31,50,8244052,Butterfly,비스트,Highlight,2016.07.04,Ballad,용준형,불어오는 바람에 흔들린 건  네 잘못이 아냐 널 잡아주지 못한 건 나니까  미안해 하지 마 보잘 것 없는 내게 날아와  따스한 온기를 나눠 준 너  이젠 모두 다 식었지만  여전히 고마운 마음뿐이야 부디 오래 걸리지 않길  아무리 멀어도 내가 널 볼 수 있게  난 그거 하나면 괜찮아  넌 아름답게 날아가 My butterfly my butterfly my butterfly 부디 오래 걸리지 않길 걱정하지 마 그냥 예전으로  돌아온 것 뿐이야 네가 오기 전 내 세상은  원래 어두웠으니까 아무리 참아내려고 해도  되지 않는 게 있다면 널 부르는 입술이 참 밉고도  안쓰러울 뿐이야 부디 오래 걸리지 않길  아무리 멀어도 내가 널 볼 수 있게  난 그거 하나면 괜찮아  넌 아름답게 날아가 My butterfly my butterfly my butterfly 부디 오래 걸리지 않길 정말 괜찮다고 쓰러지려는  마음을 일으켜 세우고 실은 아무것도 버리지 못한  나약한 나라고 제발 돌아와 날 떠나지 마  쉬운 말조차도 할 수 없는 건 내게서 벗어난 너의 날갯짓이  너무 아름다워서  부디 오래 걸리지 않길  아무리 멀어도 내가 널 볼 수 있게  난 그거 하나면 괜찮아  넌 아름답게 날아가 My butterfly my butterfly my butterfly 부디 오래 걸리지 않길
2016.07.25~07.31,51,8124417,봄이 좋냐??,10cm,3.2,2016.04.01,Folk,10cm,꽃이 언제 피는지  그딴 게 뭐가 중요한데 날씨가 언제 풀리는지  그딴 거 알면 뭐 할 건데 추울 땐 춥다고 붙어있고 더우면 덥다고 니네 진짜 이상해 너의 달콤한 남친은 사실 피씨방을 더  가고 싶어하지 겁나 피곤하대 봄이 그렇게도 좋냐 멍청이들아 벚꽃이 그렇게도 예쁘디 바보들아 결국 꽃잎은 떨어지지  니네도 떨어져라 몽땅 망해라 망해라 아무 문제 없는데  왜 나는 안 생기는 건데 날씨도 완전 풀렸는데  감기는 왜 또 걸리는데 추울 땐 추워서 안생기고 더우면 더워서 인생은 불공평해 너의 완벽한 연애는 아직 웃고 있지만 너도 차일거야 겁나 지독하게 봄이 그렇게도 좋냐 멍청이들아 벚꽃이 그렇게도 예쁘디 바보들아 결국 꽃잎은 떨어지지 니네도 떨어져라 몽땅 손 잡지 마 팔짱 끼지 마 끌어 안지 마 제발 아무것도 하지 좀 마 설레지 마 심쿵하지 마 행복하지 마 내 눈에 띄지 마 봄이 그렇게도 좋냐 멍청이들아 벚꽃이 그렇게도 예쁘디 바보들아 결국 꽃잎은 떨어지지 니네도 떨어져라 몽땅 망해라 망해라 망해라 망해라
2016.07.25~07.31,52,5466962,스토커,10cm,3.0,2014.11.19,Folk,10cm,나도 알아 나의 문제가 무엇인지 난 못났고 별 볼 일 없지 그 애가 나를 부끄러워 한다는 게 슬프지만 내가 뭐라고 빛나는 누군갈 좋아하는 일에  기준이 있는 거라면 이해할 수 없지만 할 말 없는걸 난 안경 쓴 샌님이니까 내가 이렇게 사랑하는데 이렇게 원하는데 나는 아무것도 할 수 없고 바라만 보는데도 내가 그렇게 불편할까요 내가 나쁜 걸까요 아마도 내일도 그 애는 뒷모습만 이제 알아 나의 할 일이 무엇인지 다 포기하고 참아야 하지 저 잘 나가는 너의 남자친구처럼 되고 싶지만 불가능하지 빛나는 누군갈 좋아하는 일에 기준이 있는 거라면 이해할 수 없지만 할 말 없는걸 난 안경 쓴 샌님이니까 내가 이렇게 사랑하는데 이렇게 원하는데 나는 아무것도 할 수 없고 바라만 보는데도 내가 그렇게 불편할까요 내가 나쁜 걸까요 아마도 내일도 그 애는 나는 왜 이런 사람 이런 모습이고 이런 사랑을 하고 나는 아무것도 될 수 없고 바라만 보는데도 내가 그렇게 불편하니까 내가 나쁜 거니까 아마도 내일도 그 애는 나도 알아 나의 문제가 무엇인지
2016.07.25~07.31,53,8266230,못참겠어 (Feat. 로꼬),에릭남(EricNam),못참겠어,2016.07.15,Dance,"Tablo,로꼬",뜨거운 햇살에 달린듯이  지치고 목이 말라  You know what I mean  깊은 바다에 빠진 느낌  숨쉴 수가 없어  I think I'm in too deep  Because of you 말하고 싶어  And baby you 너만 보면 Ooh girl I just can't help myself  Can't wait no longer  이젠 못 참겠어  Wanna be with you you tonight Yeah  No more playin' cool cool you and I  목마른 내 맘을 적셔 All right  내게 숨을 불어 넣어줘 My life  Without you 의미가 없어  나를 받아줘 사랑하게 해줘  알면 안되는 비밀같이  내 맘을 숨겨야 해서 힘들었지  애써 안되는 표정관리  입을 열다가 또 입술만 깨물지  Because of you 말하고 싶어  And baby you 너만 보면 Ooh girl I just can't help myself  Can't wait no longer  이젠 못 참겠어  Wanna be with you you tonight Yeah  No more playin' cool cool you and I  목마른 내 맘을 적셔 All right  내게 숨을 불어 넣어줘  My life being without you girl  의미없어 난 너 밖에 없어 Oh no  사실 나는 참을성이 아주 많아  맞아본 적도 없는 등짝 스매싱  그러니까 내가 못 참겠다고  말을 할 때는 꿀밤 대신  눈을 감아줬으면 해  니가 자꾸 나를 무례하게 해  태양은 뜨겁지만 나는 맨 눈으로  너를 보고 땀을 흘릴래  I wanna be with you you tonight Yeah  No more playin' cool cool you and I  목마른 내 맘을 적셔 All right baby  내게 숨을 불어 넣어줘 My life without you 의미가 없어 나를 받아줘 사랑하게 해줘
2016.07.25~07.31,54,8026677,잊어버리지마 (Feat. 태연),Crush,잊어버리지마,2016.01.22,R&B / Soul,"Crush,Zion.T",너와 나 언젠가 남이 되어도 영영 닿을 수 없는 사이 되어도 잊어버리지마 잃어버리지마 혹시나 다른 사람의 손 잡고 있어도 영영 닿을 수 없는 곳에 있어도 잊어버리지마 잃어버리지마 따뜻해 볼이 맞닿을 때 살며시 시린 내 손 잡아줄 때 차가운 세상에 지친 내 맘을 온기로 감싸네 예에이에 내 눈에 담긴 너의 얼굴 내 품에 잠든 너의 모습 이대로 멈췄으면 해 꽉 잡은 두 손 놓치면 안돼 너와 나 언젠가 남이 되어도 영영 닿을 수 없는 사이 되어도 잊어버리지마 잃어버리지마 혹시나 다른 사람의 손 잡고 있어도 영영 닿을 수 없는 곳에 있어도 잊어버리지마 잃어버리지마 마주 앉아 널 바라보는 지금이 영원하길 바래 혹시나 시간이 우릴 질투 할까 봐 사실 걱정 돼 변치 마 always by my side 영원히 함께 my love 언젠가 날 기억해주길 한번쯤은 뒤 돌아보길 부디 놓지 말아줘 우릴 계속 바라봐주길 Oh My love 시간이 지나 baby 너와 나 우리가 남이 되어도 잊어버리지마 날 잊어버리지마 랄라 랄라랄라 랄라 이 노랠 잊어버리지마
2016.07.25~07.31,55,8271314,쌈박자 (XamBaqJa) (Prod. by BewhY),"BewhY(비와이),사이먼도미닉",쇼미더머니 5 Episode 5,2016.07.16,Rap / Hip-hop,"BewhY(비와이),사이먼도미닉",쌈박자 쌈박자 쌈박자 쌈박자 Mr. 송대관 Woo woo woo 마이너스 One 박 Mr. 송대관 Woo woo woo 마이너스 One 박 Produced by BewhY Oh 이런 나 때문에 다른 애들 존재감은 빵 난 그었지 한국사에 획을 싹 발바닥이 가벼워지는 기분이야 숙녀들은 이 곡이 나올 땐 입지 말아야 해 치마 하나 두 석 지금부터 이건 국민가요 하나 두 석 전 세계로 퍼지는 훈민정음 내 투자로만 이뤄놨던 나의 일을 봐 내가 이용한 거라곤 딱 내 이름만 내 음악 때문에 나는 미남이 돼가 네가 밟고 있는 대한민국 땅은 내가 먹었어 이젠 소화를 위해서 이 땅은 바로 나의 위로 가 너만 질려 하는 그 곡은 역주행 중 차트를 봐봐 내 이름이 유행 중 무역 회사는 나 때문에 바빠지겠군요 BewhY는 대한민국 1위 수출 품목 쌈박자 쌈박자 쌈박자 쌈박자 Mr. 송대관 Woo woo woo 마이너스 One 박 Mr. 송대관 Woo woo woo 마이너스 One 박 난 싸가지가 너무 바가지 힙합 하지 않으면 망하지 나 아직 아저씨 아니야 고작 삼땡 됐고 I got ssamthing special 난 효미더머니 매 시즌 우승자 나의 부 나의 모님이 내 프로듀사 외쳐줘 장순필 정진곤 장순필 정진곤 장순필 정진곤 오해 마 이건 감성팔이가 아니지 난 아직 파리는 안 가봤지만 불어로 토요일이 뭔진 알지 Samedi Samedi Samedi 총알 좀 있는 놈들의 Gun fight 피윰 피윰 피윰 쌈박한 나는 파티야 지금 With my champagne queen 가시나야 올라타라 마 나의 바나나보트 긴장 안 하면 놓쳐 나를 더 꽉 잡아줘 식을 리가 있나 뜨거운 내 삶은 삶은 도미니 날 입에 올릴 거면 한참은 고민해 불만 많아진 난 이제 지겨워 미국도 World famous 심지어 이 훅도 Woh 쌈박자 쌈박자 쌈박자 쌈박자 Mr. 송대관 Woo woo woo 마이너스 One 박 Mr. 송대관 Woo woo woo 마이너스 One 박 연예인의 연예인의 연예인의 연예인의 연예인의 연예인의 연예인 난 네 애인의 네 애인의 네 애인의 네 애인의 네 애인의 네 애인의 네 애인 너와 나와 너와 나와 너와 나와 너와 나와 너와 나와 너와 나와 너와 나와 너와 나와 너와 나와 너와 나와 너와 나와 너와 나와 쌈박자 쌈박자 쌈박자 쌈박자 Mr. 송대관 Woo woo woo 마이너스 One 박 Mr. 송대관 Woo woo woo 마이너스 One 박
