time,rank,song_id,title,singers,album,date,genre,creator,lyric2011.08.14~08.20,56,3434891,그렇고 그런 사이,장기하와얼굴들,장기하와 얼굴들,2011.06.09,Rock,장기하,새파란 하늘 쨍쨍 해가 떴네  어저께랑 날씨는 같지만   똑같은 느낌은 아닐 걸  니가 여태껏 누려왔던   모든 것들이   온 데 간 데 없을 걸  그렇다고 마냥   울먹 울먹거릴 것만은   아니잖어 그렇잖어  니가 그렇게 그렇게   그렇게 원했던 나잖어  니가 여태껏 바래왔던   모든 것들이 이제부터   한 개 한 개 이뤄질 걸  니가 원하는 것들은   내가 다 줄 테니까  절대로 딴 데 가서   기웃기웃 하지를 마  니가 원하는 것들은   내가 줄 수 있으니까  자다가도 딴 생각은 마  왜냐하면은 오늘부터  너랑 나랑은 너랑 나랑은 예   너랑 나랑은 말하자면은   그렇고 그런 사이니까   사이니까 예 그런 사이니까  말하기도 좀 그렇지마는  너랑 나랑은 너랑 나랑은 예   너랑 나랑은 말하자면은   그렇고 그런 사이니까 사이니까 예   그런 사이니까  니가 원하는 것들은   내가 다 줄 테니까  절대로 딴 데 가서   기웃기웃 하지를 마  니가 원하는 것들은   내가 줄 수 있으니까  자다가도 딴 생각은 마  너랑 나랑은 너랑 나랑은 예   너랑 나랑은  말하자면은 그렇고 그런  사이니까 사이니까 예   그런 사이니까  말하기도 좀 그렇지마는  너랑 나랑은 너랑 나랑은 예   너랑 나랑은  말하자면은 그렇고 그런  사이니까 사이니까 예   그런 사이니까  말하기도 좀 그렇지마는  너랑 나랑은 너랑 나랑은 예   너랑 나랑은  말하자면은 그렇고 그런  사이니까 사이니까 예   그런 사이니까  다시 한번 말하겠지마는  너랑 나랑은 너랑 나랑은 예  너랑 나랑은 말하자면은 그렇고 그런 사이니까 사이니까 예  그런 사이니까 말하기도 좀 그렇지마는 너랑 나랑은 너랑 나랑은 예  너랑 나랑은 말하자면은 그렇고 그런 사이니까 사이니까 예  그런 사이니까
2011.08.14~08.20,57,3507555,툭하면 (Feat. Skull),브레이브걸스,Back To Da Future,2011.07.29,Dance,용감한형제,"난 너 땜에 잠도 못 자 오늘도  비오는 거릴 걸었어   자꾸만 눈물이 나서  그냥 걷다 보면   너를 잠시 잊을 것 같아서  소리쳐 펑펑 울었어 매일 울었어   니가 너무 미워져 la la la la  너를 비워낼 수 없는  슬픔이 나를 더욱 힘들게만 해  별이 빛나는 밤   너와 같이 하고 싶어  떨리는 이 맘   너는 알고 있는지  너 왜 툭하면 헤어 지자 하고  툭하면 꺼지라 말하고  툭하면 심한 말 하고  제 제 제 멋대로 하고 널 사랑한단 말이야  그만 상처 주란 말이야  너무 아프단 말이야  왜 툭하면 날 울려 기분 더럽게  너는 반대로만 하는 청개구리  이건 해도 너무해 어떻게 어쩜 그리  여자 맘을 몰라 너무 몰라  하얀 백지 같던 내 맘   시꺼멓게 만들고  넌 나 모른 척 하고 너는 가고  Why why why   내 속을 뒤집어 놔 놔 놔  너 땜에 나 미쳐 가 가 가  I'm a little girl   니 사랑을 기다리는 난 난   just a little girl  별이 빛나는 밤   너와 같이 하고 싶어  떨리는 이 맘   너는 알고 있는지  너 왜 툭하면 헤어 지자 하고  툭하면 꺼지라 말하고  툭하면 심한 말 하고  제 제 제 멋대로 하고 널 사랑한단 말이야  그만 상처 주란 말이야  너무 아프단 말이야  왜 툭하면 날 울려 기분 더럽게  I won't cry  I'm alright  내가 너무 아프단 걸 왜 넌 모를까  I won't cry, I'm alright  바보같이 이런 사랑 다신 안 할래  너 왜 툭하면 헤어 지자 하고 툭하면 꺼지라 말하고 툭하면 심한 말 하고 제 제 제 멋대로 하고 널 사랑한단 말이야 그만 상처 주란 말이야 너무 아프단 말이야 왜 툭하면 날 울려 기분 더럽게"
2011.08.14~08.20,58,3422448,Midnight Circus,써니힐,Midnight Circus,2011.06.03,Dance,김이나,"Midnight Circus Riddle me 어머  Midnight Circus Riddle me 어머  칠흑 같은 미래  마치 끈에 묶인 광대같이 나를 가둔 여긴 마치  드라큘라큘 드라큘라큘 삐걱대고 달려가는  Midnight Circus 위태로운 롤러코스터  Midnight Circus 아래 보면 정말 끝인 거  Creepy night 끝을 보는 순간 지는 거  Troubled night 지는 순간 넌 Out 되는 거 Show must go on, never stop 내가 울 때 네가 웃는다  Ironic하게도 사랑받고 싶은 거짓말  난 행복하다  Replay Replay 날 보고 네가 웃는다  난 다시 홀린다 화려한 불빛 춤 추는 곳 Welcome to Midnight Circus  Circus Show Midnight Circus Riddle me 어머  Midnight Circus Riddle me 어머 창살 없는 감옥 마치  매를 맞는 재롱잔치 비극적인 희극 마치  무대 없는 노름 마치 빛을 보고 달려드는 Midnight Circus 나비떼들 같은 People Midnight Circus 위로하면 난 맘 약해져 Don't rely 약해지면 네가 책임져  Don't deny 책임 못질 거면 즐겨줘 Show must go on, never dream 내가 울 때 네가 웃는다  Ironic하게도 사랑받고 싶은 거짓말  난 행복하다  Replay Replay 날 보고 네가 웃는다  난 다시 홀린다 화려한 불빛 춤 추는 곳 Welcome to Midnight Circus  Circus Show Welcome to the circus-tronic  crazy sunny land Welcome to the circus-tronic  crazy sunny land Hey 나에겐 NG도 장치도 없어  속임수 같은 건 없어 Attention, Mr.A, Mr.B One 절대 뒤를 돌아 보지마 Two 절대 다른 말은 듣지마 Three fall Here comes the highlight of the show 그리고 아무도 없었다  불 켜진 이 곳엔 비어있던 무대 위에서  난 여태 혼자 울고 웃고 난 갈 곳 따윈 없었다  쇼 끝난 이 곳엔 화려한 불빛에 속는 곳 We're in the midnight, midnight circus show Midnight Circus Riddle me 어머  Midnight Circus Riddle me 어머"
2011.08.14~08.20,59,3507156,잊어준다,가비엔제이,잊어준다,2011.07.27,Ballad,민명기,아프다 사랑한만큼 아프다   헤어지잔말 준비도 없이   예고도 없이 내 가슴을 콕 찌른다  못됐다 정말 너말야 못됐다   사랑해놓고 어떻게   니가 어떻게 이래  근데 웃음만 나오는데  죽을만큼 아플 줄 알았겠지   오늘부터 힘을 내 일어선다   주눅들지 말고 어깨 활짝 펴고   잊어 잊어 널 잊어준다  너 없다고 세상이 끝난거니   눈물 닦고 소리쳐 널 날려본다  잊어 잊어 너만은 꼭 잊어준다  괜찮다 이까짓거 뭐 괜찮다   밥도 잘 먹고 건강해야지   행복해야지 니가 떠난 걸 후회하게  죽을만큼 아플 줄 알았겠지   오늘부터 힘을내 일어선다  주눅들지 말고 어깨 활짝 펴고 잊어 잊어 널 잊어준다 너없다고 세상이 끝난거니  눈물닦고 소리쳐 널 날려본다 잊어 잊어 너만은 꼭 잊어준다 다가오지마 이런다고  우린 뭐가 달라져 돌아보지마 더 이상 변하지 않아 가버려 사랑이 다 뭐야 이별이다 뭐야  떠나 떠나 널 떠나준다 맘에 없는 걱정마 난 괜찮아 니 가슴에 기댈일 없을테니까  잊어 잊어 너도 날 꼭 잊어주길
2011.08.14~08.20,60,3457206,She,민경훈,소풍,2011.06.27,Rock,김도훈,그녀의 웃는  그 입술에 난 놀라죠 새 빨갛게 꽃이 핀  장미만큼 진해서 손톱 모양 같은 눈 웃음에  가슴 설레죠 어린 날의 첫 사랑  만난 듯이 기뻐서 아주 가끔 그녀가  슬픈 이유 알고 있어요 애가 타게 말 못 하게  눈물이 나지만 아무리 참아봐도  난 널 아무리 숨겨봐도  난 널 가슴을 잡아봐도  난 널 그 누구보다 사랑해 저 하늘 아래 하나의 태양  그런 사람은 너 하나뿐야 오늘도 어제처럼  널 그리다 잠이 든다 세상 어떤 말이  그녀 이름보다 예쁠까  어떤 말이 그 보다  기분 좋게 들릴까 나 혼자만 그녀를 알고  안고 살 수 없을까 간절하게 아름답게  영원히 함께해 아무리 참아봐도  난 널 아무리 숨겨봐도  난 널 가슴을 잡아봐도  난 널 그 누구보다 사랑해 저 하늘 아래 하나의 태양  그런 사람은 너 하나뿐야 오늘도 어제처럼 널 그리다  잠이 든다 다시는 그녀 안의 상처  그녀 만의 눈물 내 눈에는 안 보이게  어떻게든 그를 대신해 그 미소 지킬게 행복하게 해줄게 너를 사랑한다 My love  가슴이 타오른다 My love 몇 번을 태어나도  난 널 그 누구보다 사랑해 저 하늘 아래 하나의 태양  그런 사람은 너 하나뿐야 오늘도 어제처럼 널 그리다  잠이 든다
2011.08.14~08.20,61,3467464,죽을래 사귈래,센치한하하(하하&amp;10cm),무한도전 서해안 고속도로 가요제,2011.07.02,Rock,"권정열,윤철종",음와 오빠야  너 정말 죽을래 아니면 나랑 사귈래 난 네가 좋아 넌 나를 몰라 난 너만 원해 넌 나를 피해 하지만 너는 하지만 너는 하지만 넌 나를 몰라 난 네가 좋아 넌 나를 피해 난 너만 원해 하지만 너는 하지만 너는 도대체 통화중 부재중 너 정말 죽을래 사귈래 아니면 나랑 살래 어떡할래 넌 내 맘 몰라 넌 너무 몰라 넌 내가 겁나 뭐 그리 겁나 하지만 너는 하지만 너는 도대체 통화중 부재중 너 정말 죽을래 사귈래 아니면 나랑 살래 어떡할래 너 진짜 이럴 거야 오빠가 너 혼낼 거야 오빠가 너 벌줄 거야 왜 왜 왜 왜 왜 난 네가 좋아 난 너만 원해 하지만 너는 하지만 너는 넌 내 맘 몰라 넌 너무 몰라 하지만 너는 하지만 너는 도대체 통화중 부재중 너 정말 죽을래 사귈래 아니면 나랑 살래 어떡할래 난 너를 간절히 원하는데 너와 연락이 닿지 않는 이유 이제야 나 알고 말았어 어떻게 내게 이럴 수가 수신거부 스팸차단 접근금지 너 정말 죽을래 사귈래 아니면 나랑 살래 어떡할래 죽을래 사귈래 아니면 나랑 살래 어떡할래 죽을래 사귈래 죽을래 사귈래 죽을래 사귈래 죽을래 사귈래 죽사 죽사 죽사 죽사 죽사 죽사 죽사 죽사 사사사 너 정말 죽을래 아니면 나랑 사귈래 센치한 하하
2011.08.14~08.20,62,3511081,또 보고 싶어 (Feat. 상추),NS윤지,또 보고 싶어,2011.07.29,Dance,,Wanna stick with you  Ma lover girl I know u feel me 1 2 3 4 I Can't wait girl  A B C D Baby call me 내 맘을 흔들어  나를 설레이게 만들어 내 말은 다 들어 참 고마워 baby 볼수록 정들어 웃을땐 넘 귀여워 I love you I just wanna C U lover boy  lover girl 괜시리 웃음이 나 I just wanna call U lover boy  call me 지금 널 듣고싶어 hey baby call me now 금방 같이 있어 놓고 또 보고싶어 내 맘을 어쩌면 좋아 내 맘도 같은걸 눈을 뜨자마자 니가 또 보고싶어 이런게 사랑이래 This is the love 가슴이 두근두근두근 떨려 자꾸자꾸 니가 끌려 어쩌면 좋아 내 맘을 천천히 한발 두발 내게 와줘 스리슬쩍 나를 안아줘 하루종일 나와 있어줘 세상이 눈 부셔  니가 있어 매일 숨을 쉬어 이런 내 emotion 다 좋은걸 baby 내 키에 눈 맞춰  살며시 넌 입을 맞춰 I love you I just wanna C U lover boy  lover girl 언제든 달려와줘 run to you baby I just wanna call u lover boy  call me 사랑을 속삭여줘 hey baby call me now 금방 같이 있어 놓고 또 보고싶어 내 맘을 어쩌면 좋아 내 맘도 같은걸 눈을 뜨자마자 니가 또 보고싶어 이런게 사랑이래 This is the love 가슴이 두근두근두근 떨려 자꾸자꾸 니가 끌려 어쩌면 좋아 내 맘을 천천히 한발 두발 내게 와줘 스리슬쩍 나를 안아줘 하루종일 나와 있어줘 이 느낌이 영원히 변하지 않게 내가 더 잘할게  내가 더 아낄게 우리 사랑을 hey Sweety ma lovely baby 또 보고싶어 ASAP 무슨짓을 해도 다 이뻐  스티커 처럼 딱 붙어 있고싶어 같이 있자 조금만 더  마지막으로 오분만 더 행복만 행복만 행복만 줄게 Yo ma lover girl 금방 같이 있어 놓고 또 보고싶어 I feel you lover girl  stick with me baby 눈을 뜨자마자 니가 또 보고싶어 이렇게 널 사랑해  This is the love 가슴이 두근두근두근 떨려 자꾸자꾸 니가 끌려 어쩌면 좋아 내 맘을 천천히 한발 두발 내게 와줘 스리슬쩍 나를 안아줘 하루종일 나와 있어줘
2011.08.14~08.20,63,3515581,Change The Game,"정형돈,데프콘,제이디",Change The Game,2011.08.02,Rap / Hip-hop,"정형돈,데프콘",매번 실패와 실패를 거듭하며  지내 가끔은 눈물흘려 빌고 비네 나는 한계에 부딪힌 사람은 아닌지 이것이 내게 주어진 멋진 삶인지 젊음이란 단어를 막 쓰기에도 뭔가 부족함이 많을 뿐인데도 나를 응원하는 사람들이 눈에 보여 내가 멈출수 없는 이유 크게 퍼져 함성이 내 마음을 수놓고 다시한번 감동을 불붙여줘 그래 알아 이건 또 다른 고비의 여정 같이 가자 우리는 돼 무한도전 I Need a Love More More Your Love 쓰러지지 않게 두 손을 잡아요 I Find My Way I Find My Way 두렵진 않아 내 옆에 너만 있으면 I Need a Love  oh oh oh oh oh I Need Your Love  oh oh oh oh oh oh oh 굳은살이 박힌 손이 말하듯 숨이 턱까지 차는 뜨거운 사람들 노력의 의미를 잘 알기에 그들은 오늘도 새로운 길을 달리네 삶이란 노를 젓는 그런 마음으로 초심을 잃지 않겠다는 마음으로 이제는 내가 아닌 우리라는 설레임 그 설레임을 등에지고 Once Again! 함성이 내 마음을 수놓고 큰 감동을 불 붙여줘 그래 알아 이건 또 다른 고비의 여정 같이 가자 무한도전 I Need a Love More More Your Love 쓰러지지 않게 두 손을 잡아요 I Find My Way I Find My Way 두렵진 않아 내 옆에 너만 있으면 I Need a Love  oh oh oh oh oh I Need Your Love oh oh oh oh oh oh oh 대단하진 않지만 나는 믿어 누군가에게는 힘이 되어줄꺼라 믿어 지친 일상에서 그래 잠시라도 웃고 모두와 소중히 기쁨을 나누면 서로의 등을 바라보며 스텝을 맞추고 뜨거운 땀에 젖은 어깨를 나누고 1등이 1등을 만드는 세상이 아닌 내일의 1등이 모두다 되어가리 함성이 내 마음을 수놓고 다시한번 감동을 불붙여줘 그래 알아 이건 또 다른 고비의 여정 같이 가자 우리는 돼 무한도전 I Need a Love More More Your Love 쓰러지지 않게 두 손을 잡아요 I Find My Way I Find My Way 두렵진 않아 내 옆에 너만 있으면 I Need a Love  oh oh oh oh oh I Need Your Love  oh oh oh oh oh oh oh 때론 눈물도 흘려봤고 서로를 이해 못 한적도 있었고 하지만 이젠 좀 알것같아요 결국 우린 하나였다는 걸 I Need a Love More More Your Love 쓰러지지 않게 두 손을 잡아요 I Find My Way I Find My Way 두렵진 않아 내 옆에 너만 있으면 I Need a Love  oh oh oh oh oh I Need Your Love  oh oh oh oh oh oh oh 다치고 넘어지고 쓰러져도 일어나 아프고 눈물나고 외로워도 일어나 깨지고 부서지고 망가져도 일어나 내 옆에 너만 있으면 나는 일어나 I Need a Love  oh yeah yeah I Need Your Love
2011.08.14~08.20,64,3516648,Roly-Poly in 코파카바나,티아라,Roly-Poly in 코파카바나,2011.08.02,Dance,"신사동호랭이,최규성",어디서 오셨나요   자꾸 눈이 가네요   그대 눈빛이  나는 참 맘에 드네요  옆으로 가고 싶지만   용기가 않나서   가슴이 떨려와  나는 참 망설이네요  몰라 어떡해   난 몰라 미치겠어   널 놓치기 싫어 너에게로  점점 다가갈래   점점 내 앞에서   떠날 수 없게  Roly Poly Roly Roly Poly  날 밀어내도   난 다시 네게로 다가가서  Roly Poly Roly Roly Poly  나만 보일꺼야   너에게 나를 보여 줄꺼야  시계는 왜 보나요   우리 만남부터 쭉 멈춰 있는데  나는 참 맘에 드네요  나 오늘 이상하네요   자꾸 떨리네요   그대를 보고서  나는 참 망설이네요  몰라 불안해   난 몰라 미치겠어   어디로 갈까봐 한걸음 더  점점 다가갈래 점점 내 눈에서   떠날 수 없게  Roly Poly Roly Roly Poly  날 밀어내도   난 다시 네게로 다가가서  Roly Poly Roly Roly Poly  나만 보일꺼야   너에게 나를 보여 줄꺼야  I like like this  I like like that I like this  like that yeah Roly Poly Roly Roly Poly 날 밀어내도  난 다시 네게로 다가가서 Roly Poly Roly Roly Poly 나만 보일꺼야  너에게 나를 보여 줄꺼야 Ah Ah Ah Ah Tonight 시간이 된거야 내게로 올거야  Oh Tonight Ah Ah Ah Ah Tonight 널 기다릴 거야  너도 날 놓치기 싫을 거야
2011.08.14~08.20,65,3518342,Freestyle,4minute,Freestyle,2011.08.03,Dance,,I wanna Freestyle oh I wanna Freestyle oh 난 항상 새로운 내 삶을 원해 넌 항상 아니라고 하지 말래 모두 다 똑같은 생각들 난   no no no no 내 모습 내 방식 아니라 말해 난 달라 똑같은 말 뿐인 너  no no no no What's you gonna do Tell me! What's you gonna do 모두들 같은 얼굴 같은 표정  oh oh oh oh What's you wanna say Come on! What's you wanna say 지겨워 듣기 싫어 그만 좀 해 집어치워 제발 Get away 패션은 센스 있게 생각은 더 새롭게 네 속에 감춰진 너를 보여줘 모두들 No way go away 항상 같은 말만해 남들과는 달라도 틀리진 않아 내 Style은 높게 넓게  남들과는 다르게 내 멋대로 만들어가  oh oh oh I wanna Freestyle oh I gotta Freestyle oh I wanna Freestyle oh 그 따위 뻔한 소린 그만해 I wanna Freestyle oh I gotta Freestyle oh I wanna Freestyle oh 난 항상 새로운 내 삶을 원해 늘 똑같은 것들에  내가 맞춰야만 하는 건지 더 이상 이런 식은 식상해  한심하게 나를 보는  사람들도 이상해 어설프게 흉내 낸 Fashion 엉성해  노력해 The Passion 난 달라 격이 다른 Sense 그만 좀 해 시끄러  Talk to my hand What's you gonna do Tell me! What's you gonna do 모두들 같은 얼굴 같은 표정  oh oh oh oh What's you wanna say Come on! What's you wanna say 지겨워 듣기 싫어 그만 좀 해 집어치워 제발 Get away 패션은 센스 있게 생각은 더 새롭게 네 속에 감춰진 너를 보여줘 모두들 No way go away  항상 같은 말만해 남들과는 달라도 틀리진 않아 내 Style은 높게 넓게  남들과는 다르게 내 멋대로 만들어가  oh oh oh oh I wanna Freestyle oh I gotta Freestyle oh I wanna Freestyle oh 그 따위 뻔한 소린 그만해 I wanna Freestyle oh I gotta Freestyle oh I wanna Freestyle oh 난 항상 새로운 내 삶을 원해 눈치 따윈 보지마 신경 쓰지마 네 맘이 가는 대로 좀더 솔직해져 봐 느껴봐 이젠 내게 보여줘 네 맘대로 모두들 No way go away  항상 같은 말만해 남들과는 달라도 틀리진 않아 내 Style은 높게 넓게  남들과는 다르게 내 멋대로 만들어가  oh oh oh oh I wanna Freestyle oh I gotta Freestyle oh I wanna Freestyle oh 그 따위 뻔한 소린 그만해 I wanna Freestyle oh I gotta Freestyle oh I wanna Freestyle oh 난 항상 새로운 내 삶을 원해
2011.08.14~08.20,66,3514354,고래사냥 (송창식),자우림,[나는 가수다] 경연7-1. `내가 부르고 싶은 노래`,2011.07.31,Rock,최인호,자 떠나자 동해바다로   신화처럼 숨을 쉬는 고래 잡으러  술마시고 노래하고 춤을 춰봐도   가슴에는 하나가득 슬픔 뿐이네  무엇을 할것인가 둘러 보아도   보이는 건 모두가 돌아 앉았네  자 떠나자 동해 바다로   삼등삼등 완행열차   기차를 타고 허   간밤에 꾸었던 꿈의 세계는  아침에 일어나면 잊혀 지지만 그래도 생각나는   내 꿈 하나는   조그만 예쁜 고래 한 마리  자 떠나자 동해 바다로   신화처럼 숨을 쉬는 고래 잡으러  자 떠나자 동해 바다로   신화처럼 숨을 쉬는 고래 잡으러  자 떠나자 동해 바다로   신화처럼 숨을 쉬는 고래 잡으러  자 떠나자 동해 바다로   신화처럼 숨을 쉬는 고래 잡으러  자  떠나자 동해 바다로   신화처럼 숨을 쉬는 고래 잡으러  자 떠나자 동해 바다로  삼등삼등 완행열차 기차를 타고 자  떠나자 동해 바다로  신화처럼 숨을 쉬는 고래 잡으러
2011.08.14~08.20,67,3385548,Ma Boy (마보이),씨스타19,Ma Boy,2011.05.03,Dance,,"Let's go S.I.S.T.A.R, Sistar   Baby stop breakin' my heart   You heard me   No more next time   I hope you got that boy   Hey girls It's gon' be alright   Hey boys Better make it right   Hey girls We got ya back   got ya back ga ga ga got ya back  말하지 않아도 알 수 있다 했잖아   내 맘 어떤지 넌 알고 있겠지   그래서 믿고 참고 기다렸지   혼자 두지 않겠다고 했잖아   약속했었지 손가락 걸었지   그런데 왜 또 거짓말을 해   사랑한다는 말 그리 어렵니   한마디 말이면 되는걸   너 자꾸 변해가 나도 이젠 조금   지쳐가 Oh Oh   시간이 갈수록 더 모르겠어   좋아질수록 나는 더 아픈데   날 좀 바라봐   Oh Ma Boy Oh Ma Boy Baby   니가 무슨 사랑을 알아   내 맘만 아파  Oh Ma Boy Oh Ma Boy Baby  니가 어떻게 내 맘을 알아  Don't let me down Boy  너 때문에 내가 미쳐   why try'n play games with me?  너로 인해 하루에도 나는 몇 번씩   UP &amp; DOWN, Don't let me down,   난 울어 매일 밤 No No   Stop breakin' ma heart  너는 내 기분도 모르고 눈 돌려   What I got what you lookin’for  한 눈 팔지마 이게 내 마지막 경고   oh, no  This gon' be the last time  사랑한다는 말 그리 어렵니  한마디 말이면 되는걸  너 자꾸 변해가 나도 이젠 조금  지쳐가 Oh Oh  시간이 갈수록 더 모르겠어  좋아질수록 나는 더 아픈데  날 좀 바라봐  Oh Ma Boy Oh Ma Boy Baby  니가 무슨 사랑을 알아  내 맘만 아파  Oh Ma Boy Oh Ma Boy Baby  니가 어떻게 내 맘을 알아  Don't let me down Boy  Woo Boy 더 좋아질수록 Woo Boy   아픈 내 맘을 아니 너  내 맘에 작은 속삭임 때론 나를   보는 따뜻한 눈길  그거 하나면 되 오직 너만 원해   아직도 너만 내 맘 모르잖아  Oh Ma Boy Oh Ma Boy Baby  니가 무슨 사랑을 알아 내 맘만 아파  Oh Ma Boy Oh Ma Boy Baby  니가 어떻게 내 맘을 알아  Don’t let me down Boy  Ma Boy"
2011.08.14~08.20,68,3373007,Don`t Cry,박봄,Don`t Cry,2011.04.21,Dance,"LydiaPaek,TEDDY",사랑은 너무 쉽게 변해만 갔죠
2011.08.14~08.20,69,3498196,아는 여자,피기돌스,하쿠나 마타타,2011.07.22,Dance,"조성룡,이동욱",난 몰라 아잉 사랑에 잠을 설쳐본적 있나요 가슴이 두근두근 뛰어본적 있나요 사랑 사랑 사랑 사랑 사랑에 오 사랑에 아파 울어본적 있나요 가슴을 콕콕콕콕 바늘로 찔르는 느낌 아야 아야 아야 아야 사랑에 오 밥 먹을때도 너만 생각이 나 가슴이 찌릿찌릿 자꾸 저려와 밥이 목구멍에 넘어가질 않어 나 어떻게 할지 모르겠어 아 왜 이렇게 사랑은 또 시작됐는지 아 왜 이렇게 하염없이 끌려가는지 또 아는동생이라고 말할게 뻔한데 나 이제 그런 아는여자 싫어 아 잔인한 사람 아 잔인한 사랑 정말 모르겠다 모르겠다 내맘을 모르는 너 사랑에 발을 삐어본적 있나요 눈 앞에 아찔아찔  벼락 떨어지는 느낌 엄마야 엄마야 엄마야 엄마야  어떡해 난 영화 볼때면 더욱 생각이나  자꾸만 주인공이 내 얘기 같아 눈물이 앞을 가려 숨이 탁탁 막혀 콧물은 왜 자꾸 나는 걸까 아 왜 이렇게 사랑은 또 시작됐는지 아 왜 이렇게 하염없이 끌려가는지 또 아는동생이라고 말할게 뻔한데 나 이제 그런 아는여자 싫어 아 잔인한 사람 아 잔인한 사랑 정말 모르겠다 모르겠다 내맘을 모르는 너 사랑한다 말해줄듯 말 듯 왜 자꾸 내 맘을 줬다 폈다 가지고 놀아 왜 아 글쎄 내 맘도 몰라주는데 왜 왜 자꾸 설레이냐고 슈비루밥 빠 왜 이렇게 사랑은 또 시작됐는지 아 왜 이렇게 하염없이 끌려가는지 또 아는동생이라고 말할게 뻔한데 나 이제 그런 아는여자 싫어 왜 이렇게 사랑은 또 시작됐는지 아 왜 이렇게 하염없이 끌려가는지 또 아는동생이라고 말할게 뻔한데 나 이제 그런 아는여자 싫어
