time,rank,song_id,title,singers,album,date,genre,creator,lyric2015.06.22~06.28,63,4579468,봄 사랑 벚꽃 말고,"HIGH4(하이포),아이유",봄 사랑 벚꽃 말고,2014.04.08,Ballad,아이유,길었던 겨우내 줄곧 품이 좀 남는 밤색 코트 그 속에 나를 쏙 감추고 걸음을 재촉해 걸었어 그런데 사람들 말이 너만 아직도 왜 그러니 그제서야 둘러보니 어느새 봄이 손 잡고 걸을 사람 하나 없는 내게 달콤한 봄바람이 너무해 나만 빼고 다 사랑에 빠져 봄노래를 부르고 꽃잎이 피어나 눈 앞에 살랑거려도 난 다른 얘기가 듣고 싶어 한바탕 휩쓸고 지나가버릴 오오 봄 사랑 벚꽃 말고 봄 사랑 벚꽃 말고 봄 사랑 벚꽃 말고 봄 사랑 벚꽃 말고 손에 닿지도 않을 말로 날 꿈틀거리게 하지 말어 맘 먹고 밖에 나가도 막상 뭐 별 거 있나 손 잡고 걸을 사람 하나 없는 내게 오 사랑노래들이 너무해 나만 빼고 다 사랑에 빠져 봄노래를 부르고 꽃잎이 피어나 눈 앞에 살랑거려도 난 다른 얘기가 듣고 싶어 한바탕 휩쓸고 지나가버릴 오오 봄 사랑 벚꽃 말고 남들보다 절실한 사랑 노래 가사를 불러 봐 수많은 연인들 가운데 왜 나는 혼자만 똑같은 거리와 어제와 같은 옷차림 난 제자린데 왜 세상은 변한 것만 같지 누군가와 봄길을 거닐고 할 필욘 없지만 누구나 한번쯤은 머물고 싶은 그런 기억을 만들고 싶어 떨어지는 벚꽃잎도 엔딩이 아닌 봄의 시작이듯 사실은 요즘 옛날 생각이 나 걷기만 해도 그리워지니까 다시 느낄 수 있나 궁금해지지만 Then you know what 나만 빼고 다 사랑에 빠져 봄노래를 부르고 꽃잎이 피어나 눈 앞에 살랑거려도 난 다른 얘기가 듣고 싶어 한바탕 휩쓸고 지나가버릴 오오 봄 사랑 벚꽃 말고 봄 사랑 벚꽃 말고 봄 사랑 벚꽃 말고 봄 사랑 벚꽃 말고 봄 사랑 벚꽃 말고
2015.06.22~06.28,64,4646573,너의 의미 (Feat. 김창완),아이유,꽃갈피,2014.05.16,Ballad,김한영,너의 그 한 마디 말도 그 웃음도  나에겐 커다란 의미  너의 그 작은 눈빛도  쓸쓸한 그 뒷모습도 나에겐 힘겨운  약속  너의 모든 것은 내게로 와  풀리지 않는 수수께끼가 되네  슬픔은 간이역의 코스모스로 피고  스쳐 불어온 넌 향긋한 바람  나 이제 뭉게구름 위에 성을 짓고  널 향해 창을 내리 바람 드는 창을  너의 그 한 마디 말도 그 웃음도  나에겐 커다란 의미  너의 그 작은 눈빛도  쓸쓸한 그 뒷모습도 나에겐 힘겨운  약속  너의 모든 것은 내게로 와  풀리지 않는 수수께끼가 되네  슬픔은 간이역의 코스모스로 피고  스쳐 불어온 넌 향긋한 바람  나 이제 뭉게구름 위에 성을 짓고  널 향해 창을 내리 바람 드는 창을  슬픔은 간이역의 코스모스로 피고  스쳐 불어온 넌 향긋한 바람  나 이제 뭉게구름 위에 성을 짓고  널 향해 창을 내리 바람 드는 창을  너의 그 한 마디 말도 그 웃음도  나에겐 커다란 의미 너의 그 작은 눈빛도 쓸쓸한 그 뒷모습도 나에겐 힘겨운 약속
2015.06.22~06.28,65,5697094,잘됐으면 좋겠다,홍대광,너랑,2015.06.18,Dance,"LUVAN(러반),77어린이",이 노랜 너에게만 부를 노래 너만 상상하며 만든 노래 너를 떠올리며 나 망설임도 없이 쭉 써내려 간 노래야 이 노랠 듣는 너의 마음이 마냥 기쁨 만이기를 바래 지극히 순수한 행복이기를 바래 지금부터 잘 됐으면 좋겠다 우리 이뤄지면 정말 좋겠다 서로 위로가 필요할 때면 잔잔한 노래가 되어 주는 연인들처럼 혼자는 이제 안녕 새로운 사랑이 찾아온 거야 벅차 오르는 기분이 좋아 그래 나는 정말 네가 좋아  잘 됐으면 좋겠다 내 말이 조금은 놀랍겠지만 갑자기라 뜬금 없겠지만 열 번 스무 번을 고민 고민해 봐도 고백하는 게 답인 거야 Girl do you know this song is  only for you 그래 이 노랜 너의 노래야 정말 열심히 쓴 널 위한 세레나데 자 들어 봐 잘 됐으면 좋겠다 우리 이뤄지면 정말 좋겠다 서로 위로가 필요할 때면 잔잔한 노래가 되어 주는 연인들처럼 혼자는 이제 안녕 새로운 사랑이 찾아온 거야 벅차 오르는 기분이 좋아 그래 나는 정말 네가 좋아 어젯 밤 꿈처럼 너와 나 둘이 손을 잡고 걸으며 딴따단 딴딴따단   분홍 길을 걸으면 좋겠다 나 널 좋아해 같이 사랑을 시작해 보자 나와 함께 걷는 거야 또 뛰는 거야 그것보다 좋은 건 없을 거야 잘 됐으면 좋겠다 우리 이뤄지면 정말 좋겠다 서로 위로가 필요할 때면 잔잔한 노래가 되어 주는 연인들처럼 혼자는 이제 안녕 새로운 사랑이 찾아온 거야 벅차오르는 기분이 좋아 그래 나는 정말 네가 좋아  잘 됐으면 좋겠다
2015.06.22~06.28,66,5748502,나쁜놈 (Feat. 매드클라운),씨스타,SHAKE IT,2015.06.22,Ballad,"더네임,매드클라운",입술에 짙게 묻은 이별을 닦아내고 싶다가도 네 옷깃에 묻은 립스틱 생각에 너를 절대 용서 못할 것 같아 나만 사랑한다던 새빨간 거짓말 또 어디서 또 누구랑 속삭이겠지 Love is gone Love is over 너만 사랑했던 내가 미쳤었나 봐 eh Love is gone My love is over 나를 이렇게 아프게 해  네가 뭔데 나쁜 놈 Oh 나쁜 놈 Oh 나쁜 놈 Oh Love is gone 여전히 차갑지 난 이별 앞 망설이지도 않고 독한 말 또 뱉고 표정 하나 변하지도 않고 차라리 잘 됐어 어쩔 뻔 했어 내 가면 못 봤으면 진짜 너 어쩔 뻔 했어 넌 뭔가 애쓰는 듯한데 그럴 필요 없지 가슴 아픈 표정 짓고 난 그 표정 전에도 해 봤지 끝났어 너 없고 나 없어 두리번거려 봤자 너 없고 나 없어 내 가슴에 새겨진 새파란 멍 자국 네 이름도 네 번호도 다 지워 버릴래 Love is gone Love is over 너만 사랑했던 내가 미쳤었나 봐 eh Love is gone My love is over 나를 이렇게 아프게 해  네가 뭔데 눈물이 뚝 뚝뚝뚝 너도 아픈 척 뻔뻔한 니 얼굴 치워 줄래 눈 앞에서 꺼져 줄래 눈물이 뚝 뚝뚝뚝 이제 너란 놈 난 다시 돌아보지 않을래 바보 같이 울지 않을래 Love is gone Love is over 너만 사랑했던 내가 미쳤었나 봐 eh Love is gone My love is over 나를 이렇게 아프게 해  네가 뭔데 나쁜 놈 Oh 나쁜 놈 Oh 나쁜 놈 Oh Love is gone 난 머리로는 이해 되는데 내 맘이 안 그래 친구들은 할 만큼 했대 이제 그만 관두래 남몰래 가슴에 또 그려 보는 얼굴 I'm always missing you 나쁜 놈 내 전부
2015.06.22~06.28,67,5476552,니가 모르게 (You Don`t Know),로꼬,LOCOMOTIVE,2014.11.28,Rap / Hip-hop,로꼬,난 오늘밤도 너를 떠올려 니가 모르게 니가 모르게 난 지금 이 순간에도 어김없이 너를 떠올려 니가 모르게 니가 모르게 오늘도 조용하게 말하지 닿을 수 있다면 당장 그리로 달려갈 수 있다면 어쩔 수 없다는 상황 탓을 하며 괜히 상상해 보는 너와 마주치는 장면 날 달래주는 말 언젠가는 그래 다시 볼 수 있겠지 널 언젠가는 매일 너의 사진들을  확인하는 나와는 다르게 애써 무관심한 척 보낸 말들 더는 아무것도 모른 채 살고 있겠지 노래를 듣게 되도 그냥 지나치겠지 용기를 내고 싶어 마셨던 술 때문에 잃었던 기억 서롤 붙잡고 췄던 춤  더 빠져들기 싫어서 멈췄던 대화 넌 지금쯤 어떤 상대와 또 인연을 맺고 있을 수도 있어 이기적이지만 그 인연은 아니길 난 빌어 난 오늘밤도 너를 떠올려 니가 모르게 니가 모르게 난 지금 이 순간에도 어김없이 너를 떠올려 니가 모르게 니가 모르게 This song is about you you you you you but you don't know This song is about you you you you you but you don't know This song is about you you you you you but you don't know This song is about you you you you you but one two three 생각했었지 미련을 갖기엔 인생은 너무 짧다 그런 말을 하기엔 난 아직 어린가 봐 너의 말 한마디에 아무것도 하지 못하고 있는 나를 알기에 걷어내고 싶어 네 마음에 모든 벽 궁금해 그 벽장 속에 모든 것 조금이라도 내가 담겨있을 까 아니면 다른 누군가로 가득 차 있을까 분명히 언젠가는 잊혀지겠지 시간은 가고 이 노래가 남겨지겠지 이 감정을 버리고 싶지 않아서 난 끄적였던 가사들을 이 곳에 다 담았어 넌 지금 나의 모든 것을 벌거벗겨 그래도 난 부끄럽지 않아 당당하게 서있어 하지만 넌 아무것도 보지 못해 지금도 너를 떠올리네 니가 모르게 난 오늘밤도 너를 떠올려 니가 모르게 니가 모르게 난 지금 이 순간에도 어김없이 너를 떠올려 니가 모르게 니가 모르게 This song is about you you you you you but you don't know This song is about you you you you you but you don't know This song is about  you you you you you but you don't know This song is about  you you you you you but you 나도 알아 내 손을  네 몸에 댈 수 없어 너무 멀어 내 목소리를 낼 수 없어 나도 모르게 커져가는 욕심 너에게도 나라는  존재가 닿길 바라지 나도 알아 내 손을 네 몸에 댈 수 없어 너무 멀어 내 목소리를 낼 수 없어 나도 모르게 커져가는 욕심 너에게도 나라는 존재가 닿길 바라지 난 오늘밤도 너를 떠올려  니가 모르게 니가 모르게 난 지금 이 순간에도  어김없이 너를 떠올려 니가 모르게 니가 모르게 This song is about you you you you you  but you don't know This song is about you you you you you but you don't know This song is about you you you you you but you don't know This song is about you you you you you but one two three
2015.06.22~06.28,68,1509829,기다리다,윤하(YOUNHA),Audition,2006.12.04,Ballad,심재희,어쩌다 그댈 사랑하게 된거죠 어떻게 이렇게 아플 수 있죠  한번 누구도 이처럼 원한 적 없죠  그립다고 천번쯤 말해보면 닿을까요  울어보고 떼쓰면 그댄 내맘 알까요    그이름 한번쯤 미워해볼까요  서운한 일들만 손꼽을까요  이미 사랑은 너무 커져있는데  그댄 내가 아니니 내맘 같을 수 없겠죠  그래요 내가 더 많이 좋아한거죠...    아홉번 내 마음 다쳐도 한번 웃는게 좋아  그대 곁이면 행복한 나라서  시린표정 한번 조차도 편히 지은적 없죠  그대 말이면 뭐든 다 할듯 했었죠    천년같은 긴 기다림도 그댈 보는게 좋아  하루 한달을 그렇게 일년을...  오지않을 그댈 알면서 또 하염없이 뒤척이며  기다리다 기다리다 잠들죠...      나 언제쯤 그댈 편하게 볼까요  언제쯤 이 욕심 버릴까요  그대 모든게 알고 싶은 나인데  언제부터 내 안에 숨은듯이 살았나요  꺼낼 수 조차 없는 깊은 가시가 되어    아홉번 내 마음 다쳐도 한번 웃는게 좋아  그대 곁이면 행복한 나라서  시린표정 한번 조차도 편히 지은적 없죠  그대 말이면 뭐든 다 할듯 했었죠    천년같은 긴 기다림도 그댈 보는게 좋아  하루 한달을 그렇게 일년을...  오지않을 그댈 알면서 또 하염없이 뒤척이며  기다리다 기다리다 잠들죠...      그댈 위해 아끼고 싶어 누구도 줄 수 없죠  나는 그대만 그대가 아니면  혼자인게 더 편한 나라 또 어제처럼 이곳에서  기다리고 기다리는..  나 예요..
2015.06.22~06.28,69,5740286,여름이잖아요,2BIC(투빅),여름특집,2015.06.17,R&B / Soul,강은경,도대체 인생이란 놈은  대체 뭔데 뭐길래  얼마나 만만찮은 거길래  대체 뭐길래 왜 늘 헉헉대게 하나 대체 세상이란 놈은 뭔데 뭐길래 왜 매번 뒤통수만 치는 건지 매일 사는 게 참 팍팍하고 모진 현실 앞에 막막할 땐 눈 감고 그려 봐요 야자수 그늘 아래 보석 빛 푸른 물결 달콤한 칵테일 다 함께 저 바다로 가요 탁 트인 해변으로 가요 열심히 수고한 그대여 오늘을 누려 봐요 신나는 여름이잖아요 지친 마음 멀리 던져 버리고 우리 지금 함께 떠나요 I say 라라라라라 오 라라라라라 대체 행복이란 놈은 뭔데 뭐길래 왜 나만 비껴가고 있는 건지 같은 하루하루 갑갑하고 왠지 가슴 속이 답답할 땐 눈 감고 들어 봐요 숲 속의 바람 소리 초록 빛 나무 사이 별들의 속삭임 다 함께 저 산으로 가요 시원한 계곡으로 가요 열심히 수고한 그대여 오늘을 누려 봐요 신나는 여름이잖아요 지친 마음 멀리 던져 버리고 우리 지금 함께 떠나요 그대여 어디로든 가요 원하는 그곳으로 가요 열심히 수고한 그대여 오늘을 누려 봐요 신나는 여름이잖아요 지친 마음 멀리 던져 버리고 우리 지금 함께 떠나요 I say 라라라라라 오 라라라라라 지금껏 잘 견딘 그대 오늘도 사느라 애쓴 그대 떠나요
2015.06.22~06.28,70,5470838,GOOD BOY,GDXTAEYANG,GOOD BOY,2014.11.21,Rap / Hip-hop,G-DRAGON,Put your hands in the air How y’all feeling out there We gon' party over here 모두 같이 sing it let me hear you say La la la la la la la la La la la la la la la la La la la la la la la la La la la la la la la la la I am a good boy I am a good good I am a good boy 어딜 가나 줄을 서 여자들은 날 보면 눈에 불을 켜 낮에는 lil hamster but 밤에 사랑을 나눌 땐 gangster 다정 다감한 눈빛 자연스러운 skin ship 넌 움찔 흠칫 할걸 네가 뭘 원하는지 말 안 해도 돼 굳이 눈치로 다 알아 Eh eh eh 보기와는 다르게 I don’t play play play 널 갖고 장난 안 해 사람들은 말해 나 같은 남자를 조심하라고 너무 믿지 말아 보나마나 뻔하다고 What you know about me 네가 날 아냐고 I am a good boy I am a good good I am a good boy Everyday fresh 한 옷 차림에 반전되는 심한 낯가림 다만 살짝 짓는 눈웃음에 주위 사람들 얼어 죽음 But I don’t really care and I don’t need that 난 너만 있으면 돼 내게 기대 이게 게임이라면 yes I’m a player and you could be my coach love affair Eh eh eh 보기와는 다르게 I don’t play play play 널 갖고 장난 안 해 사람들은 말해 나 같은 남자를 조심하라고 너무 믿지 말아 보나마나 뻔하다고 What you know about me 네가 날 아냐고 I am a good boy I am a good good I am a good boy Hey 나와 같이 춤을 춰 밤 새워 동화 같은 꿈을 꿔 Hey 난 백마 탄 왕자 너는 구두를 잃어버린 어여쁜 낭자 baby where u at 내 손을 잡아 위험하니까 where u at 널 하늘로 데려가 줄 테니까 Put your hands in the air How y’all feeling out there We gon' party over here 모두 같이 sing it let me hear you say La la la la la la la la La la la la la la la la La la la la la la la la La la la la la la la la la I am a good boy I am a good good I am a good boy
2015.06.22~06.28,71,5690596,너여야만 해,김성규,2nd Mini Album `27`,2015.05.11,Rock,"김종완(NELL),ZOOEY",I want you back  난 네가 없으면  가슴이 턱 막혀서  숨을 쉴 수가 없어  I want you back  네가 없는 내 모습  상상해본 적 없고  원해 본 적도 없어  너여야만 해  타오른 내 심장은   아니면 안돼  내 질문의 대답은  갈색 머리부터 하얀 발끝까지  내 것이어야 해 I want you back  난 네가 없으면  우두커니 멈춰서  움직일 수가 없어  I want you back  네가 없는 내 모습  맹세코 단 한번도  생각해 본 적 없어  너여야만 해  타오른 내 심장은  아니면 안돼  내 질문의 대답은  갈색 머리부터 하얀 발끝까지  내 것이어야 해 모두 다  돌아서려 할 때마다   얼어붙어 발걸음이   외면하려 귀를 막아도  계속 들려 그 목소리  Cuz I belong to you   And I wish you belong to me   너여야만 해  네가 아니면 안돼  나의 순간부터 영원까지 전부  너이길 바래  그러길 바래  너여야만 해  타오른 내 심장은  네가 아니면 안돼  내 질문의 대답은  내 모든 기쁨도 내 모든 슬픔도  너이길 바래 그러길 바래  너여야만 해  I want you back  Yes I want you back girl  I want you back  Yes I want you back girl  I want you back  Yes I want you back girl  I want you back Yes I want you back girl
2015.06.22~06.28,72,5721454,LOVE ME RIGHT (漫遊宇宙),EXO,LOVE ME RIGHT - The 2nd Album Repackage,2015.06.03,Dance,"오유원,김동현,임흔엽",Oh Yeah C’mon Take your time jin wan bo kuai xin tiao de jie  zou Na Na Na Na Na Na Na Na So tonight yao ni he wo man you dao yue qiu Yea Yea Yea Yea Yea Yea Yea Yea Just right you men cai dao di kuai jia su  qi dong zhe yin qing zhe gan jue bu ke si yi da pei  te bie pin lu ni xu xia de qi ji Imma make it work Yeah Shawty Imma party till the sun down wu fa jie shi xian zai gan jue  dao de shen mi kuai tou ben dao wo huai li Before the sun rise mei you ni de wo zhi neng cheng wei Nobody Yeah Oh ni wo ben chi zai zhe runway  shang yan shen yang yi shan liang   milky way Just love me right Uh huh Baby love me right Uh huh Oh xiang wo kao jin shi fang yi  qie you yu wei wo zhan fang mei li universe Just love me right Uh huh wo de yu zhou quan dou shi ni Just love me right Just love me right Just love me right wo de yu zhou quan dou shi ni Shine a light dian liang wu shu de ai du yin he er lai Na Na Na Na wu fa zai deng dai Oh yeah yue qiu xiang ni hong ban yi ran  zhao zhe wo men wo yi ran zai ni de gui dao  shang pai huai I can do this all night long baby mei you le ni wo yao qu na li  zhao hui xin de can hai xing xing xiang yan huo you xi  wu dao  yue guang xia re qing  yan shao yi shi zai shi yao fei de geng gao yao fei de geng gao xin zang shun jian kuang tiao  zai yin bao sheng kong li kai zhe di biao di qiu fang zai jiao xia shuai diao  love me right ni wo ben chi zai zhe runway  shang yan shen yang yi shan liang   milky way Just love me right Uh huh Baby love me right Uh huh So come on baby geng jia yao yan de ni bu man ni de mei li universe mei li de lady Just love me right Uh huh wo de yu zhou quan dou shi ni Oh Just love me right Just love me right Can you love me right Just love me right I just wanna make you love me wo de yu zhou quan dou shi ni qi dai mei yi ge ye wan jiang lin chu xian zai wo tian ji zui  xuan de ni Woo Yeah tang zai hei ye de huai li bu xiang qing xing gan jue shun jian he ni yi qi ni wo ben chi zai zhe runway  shang yan shen yang yi shan liang   milky way Just love me right Uh huh Baby love me right Uh huh Oh xiang wo kao jin shi fang yi  qie you yu wei wo zhan fang mei li universe Just love me right Uh huh wo de yu zhou quan dou shi ni Just love me right Oh oh oh yeah Just love me right Just love me right zai yi qi de guang yin wo de yu zhou quan dou shi ni Just love me right ji dong de Cosmic ride Just love me right jiu wo he ni ye jian fei xing Just love me right I just wanna make you love me Yea Woo You got to love Yea You got to love me Yea wo de yu zhou quan dou shi ni You love me Yea You love me Yea You love me Yea wo de yu zhou quan dou shi ni
2015.06.22~06.28,73,5744111,너랑,홍대광,너랑,2015.06.18,Ballad,"LUVAN(러반),77어린이,홍대광",멍하니 누워있어 잠은 오는데 자고 싶지가 않아 요즘 맨날 이래 혼자선 난 아무것도 아무 것도 하기가 싫어 영화를 보고 싶니 아니 맛있는걸 먹고 싶니 아니 밖에 나가 놀고 싶니 아니 그럼 지금 하고 싶은 건 뭔데 지금 내가 하고 싶은 건 딱 하나 너랑 둘이 노는 것 너랑 영활 본다면 너랑 밥 먹는다면 너랑 둘이 밖에 나가 논다면 너랑 둘이 잠든다면 더 많이 좋아졌나봐 니가 없으면 뭘 해도 즐겁지 않아 요즘 맨날 이래 혼자선 난 아무것도 아무 것도 하기가 싫어 영화를 보고 싶니 아니 맛있는 걸 먹고 싶니 아니 밖에 나가 놀고 싶니 아니 그럼 지금 하고 싶은 건 뭔데 지금 내가 하고 싶은 건 딱하나 너랑 둘이 노는 것 너랑 영활 본다면 너랑 밥 먹는다면 너랑 둘이 밖에 나가 논다면 너랑 둘이 잠든다면 내일 만나면 제일 먼저 날 따뜻하게 안아줘 난 너만 있으면 다 괜찮아 너만 있으면 이 노랠 듣고 싶어 너랑 하루 종일 안고 싶어 너랑 같은 집에 살고 싶어 너랑 사랑해 지금 내가 하고 싶은 건 딱 하나 너랑 둘이 노는 것 너랑 영활 본다면 너랑 밥 먹는다면 너랑 둘이 밖에 나가 논다면 너랑 둘이 잠든다면  너랑 둘이 잠든다면
2015.06.22~06.28,74,5721554,소개받기로 했어,벤,소개받기로 했어,2015.06.03,Ballad,꿀단지,신사동 가로수길 오후 네 시 반 우리가 자주 가던 그 카페에서 널 처음 본 그때처럼 새 옷을 입고 새사람 만나기로 했어 그 사람 너처럼 인상도 좋고 성격도 좋은 사람이래 이제 너 없이도 지낼 수 있을지도 몰라 근데 왜 눈물이 나니 너로 가득했었던 날들아 안녕 눈물로 지새우던 밤들아 안녕 채우지 못 할 것 같던 너의 빈자리 대신 할 새사람을 소개받기로 했어 우리가 즐겨듣던 그 노래 위로 어색한 인사를 나누고 전혀 관심도 없는 그 사람 번호를 받고 애써 웃어야겠지 온통 너 하나였던 기억아 안녕 매일을 되뇌이던 추억아 안녕 밤새워 떠올렸었던 너의 얼굴을 대신 할 새 사람을 소개받기로 했어 내 삶에 전부였던 사람아 안녕 내 가슴 뛰게 했던 사람아 안녕 내안에 너를 살게 한 너의 흔적을 지워 줄 새 사랑을 찾아보기로  너로 가득했었던 날들아 안녕 너로 가득했었던 날들아 안녕 눈물로 지새우던 밤들아 안녕 채우지 못 할 것 같던 너의 빈자리 대신 할 새사람을 소개받기로 했어
2015.06.22~06.28,75,5592623,My Type (Prod. By 버벌진트),"제시(Jessi),치타(CHEETAH),강남",언프리티 랩스타 Track 3,2015.02.13,Rap / Hip-hop,"제시(Jessi),치타(CHEETAH),버벌진트",Unpretty Rapstars let me ask you all a question whats yo type baby 구체적인 게 좋아 다 말해줘 나에게 까칠해도 돼 It’s alright it’s alright girl 함께 걸을 때의 속도 또 피해줬으면 하는 옷도 빠짐없이 내게 말해줘 girl every little thing 난 자신 있어 What I need man a big balla Bossman Dude is shot calla I need a smooth ride a stallion 피가 쏠려 뜨거워진 온도 복종 다가와서 뽀뽀해 내 목과 다리 부드럽게 접촉해 I'm da Queen 오늘 밤 제대로 모셔 건조한 내 등에 발라 baby 로션 구체적인 게 좋아 다 말해줘 나에게 까칠해도 돼 It’s alright it’s alright girl 함께 걸을 때의 속도 또 피해줬으면 하는 옷도 빠짐없이 내게 말해줘 girl every little thing 난 자신 있어 cause I’m your type 다른 남자와는 달라 네가 아는 그 누구보다 네가 원하는 걸 알아 사소한 너의 취향까지 so give me a chance 지금 내게 기회를 줘 you are my type my type my type my type and I’ll be your type 내 이상형은 나보다도 더한 색기 굳이 말 안 해도 백날 나불대는 새끼 들보다 행동으로 한 방을 보여주고 한눈 팔 생각조차 못 하게 내 머릴 재끼는 새끼 You wanna check it 그런 남자한텐 들어줘 난 백기 내 취미는 이게 자기 얘긴지도 모르고 살면서 엄한 여자 옆에 있는 애들 뺏기 구체적인 게 좋아 다 말해줘 나에게 까칠해도 돼 It’s alright it’s alright girl 함께 걸을 때의 속도 또 피해줬으면 하는 옷도 빠짐없이 내게 말해줘 girl every little thing 난 자신 있어 cause I’m your type 다른 남자와는 달라 네가 아는 그 누구보다 네가 원하는 걸 알아 사소한 너의 취향까지 so give me a chance 지금 내게 기회를 줘 you are my type my type my type my type and I’ll be your type NASA 없이도 자기 능력으로 밤낮없이 날 우주로 데려가 줄 오 내가 말하는 나사는 조이고 푸는 게 아냐 그건 내가 하지 don't worry now put your guns up no more  frontin show me baby let me see what  your packin body language body body language 내 몸을 불러 get rid of the other bitch cause I’m your type 다른 남자와는 달라 네가 아는 그 누구보다 네가 원하는 걸 알아 사소한 너의 취향까지 so give me a chance 지금 내게 기회를 줘 you are my type my type my type my type and I’ll be your type
