time,rank,song_id,title,singers,album,date,genre,creator,lyric2015.11.30~12.06,63,7931713,이리오너라 (B.I&BOBBY),iKON,WELCOME BACK,2015.11.16,Rap / Hip-hop,"B.I,BOBBY",iKON is coming to town iKON is coming to town iKON is coming to town iKON is coming to town 볼륨을 높여 창문을 올려 미간을 좁히고 언성을 높여 이게 우리 anthem 이리오너라 이리오너라 게 아무도 없느냐 얼쑤 덩기덕 쿵 더러러러러 This is iKON anthem 대한민국 센터 BOBBY와 나의 콤비는 서태웅과 강백호 젊은이 텐션 우린 좀 핫해서 사람들의 단추를 풀어버리는 해커 엔돌핀이 샘솟지 let’s just chill 여전히 철이 없지 니들이 제아무리 날고 기어도 다 씹어 먹어줄게 Call me 아저씨도 뻐끔 이 구역을 뺏어 짜치는 놈들은 숨어 의자를 제껴 판때기는 내 꺼고 여기 분위기는 얘 꺼 이의 있는 사람들은 이제 집 갈 시간 됐어 집중 우리들이 나대는 지금 Fixin 너네들의 잘못된 리듬 심쿵 온몸이 춤추는 기분 5세대 YG we gon go get em 볼륨을 높여 창문을 올려 미간을 좁히고 언성을 높여 이게 우리 anthem 이리오너라 이리오너라 게 아무도 없느냐 얼쑤 덩기덕 쿵 더러러러러 너네들과 처음부터 차이 나게 시작부터 깡패 부셔줄게 들어와봐 내 앞에 Kick and snare 가슴 벅차게 울리는 bass 내 친구들과 함께 폼생폼사 ye 이게 방식 21세기의 쌧삥이들의 간지 행진 충만한 느낌과 music 허를 찌르는 우리들의 불규칙 누구든 안심하는 순간 내게 바로 먹혀 난 지킬 건 지켜 like 강균성의 순결 다들 궁금해하지 my business 권태기 부부처럼 니들과는 관계없어 갈 데까지 가라 하지 말란 짓만 하자 혹시 나를 모른다면 지금부터 알아가라 주인 없던 대한민국 가요계는 내 꺼 아니꼽거나 자신 있음 주도권을 뺏어 볼륨을 높여 창문을 올려 미간을 좁히고 언성을 높여 이게 우리 anthem 이리오너라 이리오너라 게 아무도 없느냐 얼쑤 덩기덕 쿵 더러러러러 BOBBY와 BI의 콤비는 마치 영구와 땡칠이 용이와 영길이 서수남과 하청일 BOBBY와 BI의 콤비는 마치 장국영과 주윤발 배추도사 무도사 맥주와 치킨 iKON is coming to town iKON is coming to town iKON is coming to town iKON is coming to town
2015.11.30~12.06,64,4543502,야생화,박효신,야생화,2014.03.28,Ballad,"박효신,김지향",하얗게 피어난 얼음 꽃 하나가 달가운 바람에 얼굴을 내밀어 아무 말 못했던 이름도 몰랐던 지나간 날들에 눈물이 흘러 차가운 바람에 숨어 있다 한줄기 햇살에 몸 녹이다 그렇게 너는 또 한번 내게 온다 좋았던 기억만 그리운 마음만 니가 떠나간 그 길 위에 이렇게 남아 서있다  잊혀질 만큼만 괜찮을 만큼만 눈물 머금고  기다린 떨림 끝에  다시 나를 피우리라 사랑은 피고 또 지는  타버리는 불꽃 빗물에 젖을까 두 눈을 감는다 어리고 작았던 나의 맘에 눈부시게 빛나던 추억 속에 그렇게 너를 또 한번 불러본다 좋았던 기억만 그리운 마음만 니가 떠나간 그 길 위에 이렇게 남아 서있다  잊혀질 만큼만 괜찮을 만큼만 눈물 머금고 기다린 떨림 끝에 다시 나는  메말라가는땅 위에 온몸이 타 들어가고 내 손끝에 남은 너의 향기 흩어져 날아가 멀어져 가는 너의 손을 붙잡지 못해 아프다 살아갈 만큼만 미워했던 만큼만 먼 훗날 너를 데려다 줄  그 봄이 오면 그날에 나 피우리라
2015.11.30~12.06,65,7896506,새 신발,아이유,CHAT-SHIRE,2015.10.23,Ballad,아이유,안녕 오래 기다렸니   지루했지  I run and I run and I run and I run   나 지금 기분이 딱 완벽해   나를 시무룩하게 만들 생각은 마  에나멜 플랫 슈즈 위 따다닥  빨간 뾰족구두를 신고 또각  키가 큰 거울 앞에 다가가  한 바퀴 사뿐히 빙그르르  아직 춤춰요 Mr 분홍신  앞코를 부딪혀 like 도로시  발에 꼭 맞는 새 신을 신고  너에게 갈 준비됐어  설레 아이쿠  내 맘속에 작은 소용돌이  살랑 달큰한 바람은 나를 들뜨게  높은 계단 좁은 골목 난 어디든 가  내 마음에 꼭 맞는 새 신발을 신고  오늘 컨디션은 어떠니  하루 종일 나랑 여기 거기  또 저기 갈 준비됐니   단단히 맘먹었지  혹시나 일찍 집에 들어갈 생각은 마 근사한 음악소리 빠라밤  심장은 리듬이 돼요 빠담  우리랑 같이 춤춰요 마담  한 바퀴 사뿐히 빙그르르 들뜬 기분으로 아니마토 여기선 좀 더 빨리 가볼까 알레그로 특별히 신경 써서 아첸토 코러스부터 다시 한 번 설레 아이쿠 내 맘속에 작은 소용돌이 살랑 달큰한 바람은 나를 들뜨게 높은 계단 좁은 골목 난 어디든 가 내 마음에 꼭 맞는 새 신을 신고 얼마나 좋니 파란 하늘 아래서  사랑하기 완벽한 날이지 왼손을 꼭 잡아줘 지금부터는 달릴 거야 설레 아이쿠 내 맘속에 하얀 바람개비 싱그르 웃는 손톱달이 뜰 때까지 높은 계단 좁은 골목 난 어디든 가 한 걸음 또 한 걸음 온 세상을 걷자 설레 아이쿠 내 맘속에 작은 소용돌이 살랑 달큰한 바람은 나를 들뜨게 높은 계단 좁은 골목 난 어디든 가 내 마음에 꼭 맞는 새 신발을 신고
2015.11.30~12.06,66,7863752,커피 (Prod. by G-Park 박명수),"유재환,김예림(투개월)",커피 (Prod. by G-Park 박명수),2015.09.23,Dance,"박명수,유재환",니 손이 차서 맘이 차서 커피가 다 식어 버려 우리 같이 시킨 건데 Would you like some coffee 니가 있을까 또 가 봤어 항상 똑같은 길 똑같은 카페 너와 같이 앉아 마시던 커피가 똑같아 참 여전히 쓰다 내 손에 들려 있는 참 따뜻한 향도 그대로인 커피가 입에 닿을 때마다 뜨거워서 아프잖아 커피에 모든 게 다 데였어 니 손이 차서 맘이 차서 커피가 다 식어 버려 우리 같이 시킨 건데 왜 어째서 내가 든 커피만 따뜻해 색깔이 같아 식은 줄 몰랐어 니 커피 항상 같은 컵에 담긴 니 커피 너와 같은 커피인 줄만 알았던 그런 나 아닌 걸 알던 너 커피 커피 커피 커피 커피 커피 커피 Would you like some coffee 뭐야 이거 헤어진 건지 아니 헤어진 건지 기다리는 건지 아니 기다려야 할지 고개 들고서 말 좀 해 봐 그러다 커피잔 속에 빠지겠어 정말 미안한데 커피 한 모금 마시면 말해 내 손에 들려 있는 참 따뜻한 향도 그대로인 커피가 입에 닿을 때마다 뜨거워서 아프잖아 커피에 모든 게 다 데였어 니 손이 차서 맘이 차서 커피가 다 식어 버려 우리 같이 시킨 건데 왜 어째서 내가 든 커피만 따뜻해 색깔이 같아 식은 줄 몰랐어 니 커피 항상 같은 컵에 담긴 니 커피 너와 같은 커피인 줄만 알았던 그런 나 아닌 걸 알던 너 커피 커피 커피 커피 커피 커피 커피 음 어 아메리카노 주세요 아메리카노요 니 손이 차서 맘이 차서 커피가 다 식어 버려 우리 같이 시킨 건데 왜 어째서 내가 든 커피만 따뜻해 달콤하지 않아 쓰기만 했던 니 커피 항상 같이 마시던 우리 커피 너와 같이 마실 마지막 가장 쓴 커피를 한 모금 넘긴다 만난 날도 보내는 날도 커피 한 잔이 있었어 커피를 보면 그 작은 컵에 니 얼굴은 언제나 까맣게 담겼어
2015.11.30~12.06,67,7915771,신세계,브라운아이드걸스,BASIC,2015.11.05,Dance,"김이나,미료",시간이 어디선가 휘어져 버린 ground 어지러운가 파란 비명소리가 내 눈을 닮은 brown 기분 탓인가 내가 알았던 모든 것 아름답게 다 뒤엉켜 있어 아름다운 건 엉켜있어 내가 너와 늘 그렇듯이 trip 그 속으로 shoot um um um trip 더 안으로 shoot um um um trip 빛 속으로 shoot um um um 어쩌면 내 모든 게 달라질 것 같아 어디까지 보이니 all about the world 궁금한 적 없었니 all about the world 나만 빼고 여기 모두 stop space time of the world 내가 다 볼 때까지 시간 나의 모든 공간 빛 speed all about the universe is all about to be reversed see 착각이 아닌 거야 내가 달라진 건 패러다임뿐 한 차원 전의 나를 볼 수 있는 건 패러다임 shift 내가 알았던 모든 것 어지럽게 다 뒤바뀌어 있어 어지러웠던 모든 것 다시 자리를 찾아갔어 느린 빨라지는 그림 um um um 느린 빛 속의 secret um um um 느린 시간 속에 우린 um um um 이 모든 시작으로 다가가고 있어 어디까지 보이니 all about the world 궁금한 적 없었니 all about the world 나만 빼고 여기 모두 stop space time of the world 내가 다 볼 때까지 시간 나의 모든 공간 빛 speed all about the universe is all about to be reversed see all the patterns and colors 경험의 세계란 건 실재와는 달랐어 옳고 그름을 갈라 놓지마 지금은 영원 같은 찰나 plus minus 내 신경의 각성 furious 새로운 법칙을 재작성해 I got high blood pressure I gotta need some fresh air 모든 시간이 0에 가까워져 서 있는 공간이 멀었다 가까워져 다시 hey Mr. Huxley 너와 내가 하나 돼 경계는 녹아 구분이 안 돼 의식의 확장이 초대해준 new world 너 놀라니 놀라지 마 why am I so serious why don’t you be curious babe 어디까지 보이니 all about the world 궁금한 적 없었니 all about the world 나만 빼고 여기 모두 stop space time of the world 내가 다 볼 때까지 시간 나의 모든 공간 빛 speed all about the universe is 누가 만든 비밀인지 all about the world 궁금한 적 없었니 all about the world 나만 빼고 여기 모두 stop space time of the world 내가 다 볼 때까지 시간 나의 모든 공간 빛 speed all about the universe is all about to be reversed see
2015.11.30~12.06,68,7924215,사슬 (Chained Up),빅스,Chained Up,2015.11.10,Dance,"Misfit,라비(빅스)",잔뜩 긴장한 채 어깨를 굴려  난 네 주윌 어슬렁거려 uh  나를 굴복시킨 채찍 너머로  넌 날 응시해 뚫어지게 옳지 착하지 거친 내 숨결 다가와 어루만질 때  나는 이렇게 아픈데 너무 아픈데 돌아서지 못해 Eenie meenie minie moe 주인이자 먹잇감 Yeah yeah Eenie meenie minie moe 사랑이자 독재자  넌 나의 사랑이자 독재자 손을 들어 난 Freeze Armor Down Na na na na Na na na Na na na 날 차갑게 내쳐도 괜찮아 떠날 수 없어 Chained up Chained up 무릎 꿇어 난 Freeze Armor Down Na na na na Na na na Na na na 또 이러다 다쳐도 괜찮아 난 꼼짝없이 Chained up Chained up 철컹 철컹 쇠사슬이 걸린 이미 나 태어나 처음 널 봐 버린 짐승처럼 무조건 네게 길들여진 절대 너를 떠날 수 없어 Think about it 가려운 상처 너는 딱 거길 긁어줘 세상 너만이 아는데 날 아는데 돌아올 수밖에  Eenie meenie minie moe 아픔이자 치료약  Yeah yeah Eenie meenie minie moe 감옥이자 paradise  넌 내 감옥이자 paradise 손을 들어 난 Freeze Armor Down Na na na na Na na na Na na na 날 차갑게 내쳐도 괜찮아 떠날 수 없어 Chained up Chained up 무릎 꿇어 난 Freeze Armor Down Na na na na Na na na Na na na 또 이러다 다쳐도 괜찮아 난 꼼짝없이 Chained up Chained up 손길을 되새겨 새겨 새겨 cuz I'm not ready to go no I'm not ready to go 널 흉터처럼 새겨 새겨 새겨 cuz I'm not ready to go 아마 영원히 그렇겠지 I love her 매일 너의 머리맡에 잠이 들어 난  I want her 거부할 수 없어 거부할 수 없어  또 LOCK LOCK LOCK 내 심장에 줄을 달아 못 박고 BANG POW POW 절대로 너를 벗어날 수 없는 나 사랑에는 높낮이가 없는 줄 알던 난 영원히 갇혀 살아 영원히 영원히 갇혀 살아 바보처럼 난 Freeze Armor Down Na na na na Na na na Na na na 몇 번이고 가까이 다가가  두 발이 묶여 Chained up Chained up 얼어버려 난 Freeze Armor Down Na na na na Na na na Na na na 내 주인은 너란 걸 잘 알아  영원히 네게 Chained up Chained up  바보처럼 난 Freeze I'm a slave Na na na na Na na na Na na na 난 사나운 눈빛을 내려놔 두 발이 묶여 Chained up Chained up 얼어버려 난 Freeze Armor Down Na na na na Na na na Na na na 날카로운 발톱을 묻어놔 영원히 네게 Chained up Chained up
2015.11.30~12.06,69,7963665,Merry Christmas,소녀시대-태티서(Girls`Generation-TTS),Dear Santa - X-Mas Special,2015.12.04,Ballad,"100%서정,이스란,김인형",꿈을 꾼 것 같아 찰나 스쳐 지난 시간 어느새 하얗게 새 옷을 입은 밤 따스히 피어난 모닥불 아래 모여 앉아 행복했던 추억 상자를 열어봐 이 기쁨의 눈물이 빛이 되고 저 밤하늘 별처럼 비추죠 모두 Merry Christmas 다시 아름다운 이 계절 예쁜 순간들로 기쁜 얘기들로 서로를 다 채워 모두 Merry Christmas 지난 1년 동안 늘 반짝인 나날들 온 세상을 하나 둘씩 비춰 따뜻한 오늘 밤 오늘 밤 마주한 눈빛은 항상 포근하게 빛나 마치 지난날을 감싸 안아주듯 난 눈 감고 손 모아 기도하죠 저 내일도 행복만 가득히 모두 Merry Christmas 다시 아름다운 이 계절 예쁜 순간들로 기쁜 얘기들로 서로를 다 채워 모두 Merry Christmas 지난 1년 동안 늘 반짝인 나날들 온 세상을 하나 둘씩 비춰 따뜻한 오늘 밤 눈이 덮어도 얼어붙어도 햇살은 언제나 있는 걸 빛이 돼줄게 모두 녹여줄게 두 눈 감아봐 맘껏 그려봐 보다 더 행복한 New Year 온 몸 감싸는 낯선 설렘에 모든 게 선물인 걸 모두 Merry Christmas 하얀 천사 같은 12월 함께 걸어 온 길 눈에 덮어 놓고 새롭게 시작해 모두 Merry Christmas 지난 1년 동안 늘 반짝인 나날들 온 세상을 하나 둘씩 비춰 따뜻한 오늘 밤 오늘 밤 오늘 밤
2015.11.30~12.06,70,7947906,But (Feat. 백지영),길,R.O.A.D PROJECT #1,2015.11.25,R&B / Soul,"길,주비트레인",술을 따르고 마지막 잔을 부딪치고서 붉어지는 얼굴을 숨기며 하면 안될 말을 건네 우리 헤어지는 건가요 우리 사랑 할 만큼 한 거죠 내가 떠나가도 후회 없나요 오 또 맘을 바꾸지는 말아요 Maybe Crazy but I love you 너는 행복해야 해 날 지워야만 해 Maybe Crazy but I love you 내가 아니길 바래 더 좋은 사랑 만나 취기가 오르네 텅 빈 술잔을 내려놓지 못해 울고 있는 내게 해줄 거라곤 미안하단 그 말 밖엔 우리 헤어질 수 있을까 많은 밤을 함께 했던 우린데 이제 내가 없는 세상 끝에서 네가 부디 잘 지내길 바랄게 Maybe Crazy I love you 너는 행복해야 해 날 지워야만 해 Maybe Crazy I love you 내가 아니길 바래 더 좋은 사람 만나 돌아서면 네가 나를 보고 있진 않을까 돌아서서 미안하다 말을 다시 해볼까 돌아가면 우리 다시 사랑 하지 않을까 돌이킬 수 없는 너와 나의 마지막 인사 Maybe Crazy but I love you 너는 행복해야 해 날 지워야만 해 Maybe Crazy but I love you 내가 아니길 바래 더 좋은 사람 만나 Maybe Crazy but I love you 너는 행복해야 해 날 지워야만 해 Maybe Crazy but I love you 내가 아니길 바래 더 좋은 사람 만나
2015.11.30~12.06,71,7965433,Hello Bitches,CL,Hello Bitches,2015.12.05,Rap / Hip-hop,"TEDDY,CL,DannyChung,JeanBaptiste",엉덩이 빵빵빵   남자들은 탐탐탐   내 입술은 냠냠냠   어딜가도 당당당  등장은 짠짠짠   뛰자뛰자 방방방  디스코 팡팡팡   Hello Bishes  난 지금 어디여   Shopping spree in Tokyo   Wake up in my private jet   매일 아침 꼬끼오  Flipping cards in Macau   내가 제일 잘나가  Stop blowin up my phone   And won't you hit me up on kakao   Diamonds in my grill and   날 말려 누가   Skin tone 22 karats gold  I got in Dubai   My boys won't hesitate  to run up on your boys  My boys won't hesitate  to run up on your boys  엉덩이 빵빵빵  남자들은 탐탐탐  내 입술은 냠냠냠  어딜가도 당당당  등장은 짠짠짠  뛰자 뛰자 방방방  디스코 팡팡팡  Hello Bishes  Yellow gold and it glow  like a yellow bone  Couldn't see me with a selfie  from my telephone  Got hella dough hello kitty  getting hella old  Want me to love em long time  and I tell em no  Sake to soju  Nagasaki to Seoul  you can find me in Shanghai  you know what them  shots of Baijeodu  Got these Asian girls  dancing on the couches  yeah they know me  and they singing every word like  they was at the karaoke huh  엉덩이 빵빵빵  남자들은 탐탐탐  내 입술은 냠냠냠  어딜가도 당당당  등장은 짠짠짠  뛰자뛰자 방방방  디스코 팡팡팡  Hello Bishes  Lights out  Killin' it some more  Bad girls get down on the floor  Lights out Killin' it some more Bad girls get down on the floor Lights out Killin' it some more Bad girls get down on the floor Lights out Killin' it some more Bad girls get down on the floor 하나 둘 셋 Bishes
2015.11.30~12.06,72,7956372,매일매일 (Feat. 스윗소로우),별,Everyday Christmas,2015.12.01,R&B / Soul,"영준(브라운아이드소울),전홍준",하얀 눈이 너 떠난 밤이 날 찾아와 기억들이 찬 바람같이 부는 밤 들리는 겨울 노래 소리 텅 빈 내 맘에 울려 그댄 내게 어서 내게 유난히 환한 불빛들이 아픈 나를 비추는 밤 니가 없는 나는  매일 매일 그리워 매일 매일 그리워 내 맘에 매일 매일 눈이 와 매일 매일 눈이 와 늦기 전에 너의 발걸음을 돌려서 내게 돌아와 내게 돌아와 매일 메리 Christmas day 매일 메리 Christmas day 내 맘은 매일 너와 Falling in love 매일 너와 Falling in love 따스했던 우리를 찾아 나에게 다시 돌아와 오늘 밤 괜시리 쓸쓸한 내 손이 오늘따라 참 미워 그댄 내게 어서 내게 하얗게 날리는 추억이 나의 뺨을 스치는 밤 니가 없는 나는 매일 매일 그리워 매일 매일 그리워 내 맘에 매일 매일 눈이 와 매일 매일 눈이 와 늦기 전에 너의 발걸음을 돌려서 내게 돌아와 내게 돌아와 매일 메리 Christmas day 매일 메리 Christmas day 내 맘은 매일 너와 Falling in love 매일 너와 Falling in love 버려진 추억을 담아 나에게 다시 돌아와 오늘 밤 오늘 밤 조용히 불러보는 그리운 그 이름 매일 매일 보고 싶어 내 맘에 매일 매일 눈물이 나 늦기 전에 너의 발걸음을 돌려줘 내게 돌아와 매일 메리 Christmas day 매일 메리 Christmas day 내 맘은 매일 너와 Falling in love 매일 너와 Falling in love 따스했던 우리를 찾아 나에게 다시 돌아와 오늘 밤 매일매일 그리워 매일매일 눈이 와
2015.11.30~12.06,73,7935701,눈치 없이 (INSENSIBLE),이홍기(FT아일랜드),FM302,2015.11.18,Ballad,"Hong`sTower,한성호",언제부터인 걸까 다 잊은 줄 알았는데 거짓말이었나 봐 하루조차 못 견디고 넋이 나간 사람처럼 울잖아 I don't wanna believe 또 눈치 없이 너를 보낸 날처럼 또 눈치 없이 비마저 내려와 그만두라고 바보처럼 이런다고 다 소용없다고 Oh woo oh 다그치면 그럴수록 눈물만 나 친구에게 물었어 넌 잘 지내고 있는지 하지 않아도 될 말을 oh yeah 괜한 걱정인 건 알지만 잊혀질게 난 두려운 마음에 I don't wanna believe 또 눈치 없이 너를 보낸 날처럼 또 눈치 없이 비마저 내려와 그만두라고 바보처럼 이런다고 다 소용없다고 Oh woo oh 다그치면 그럴수록 눈물만 나 널 사랑한 기억이 오늘을 살 수 있게 나를 지켜주니까 난 니가 없인 사랑을 모르니까 난 니가 없인 무너질 테니까 미친 것처럼 비가 오면 니가 다시 올 것만 같은데 Oh 언젠간 돌아와 줘 또 눈치 없이 너를 보낸 날처럼 또 눈치 없이 비마저 내려와 그만두라고 바보처럼 이런다고 다 소용없다고 Oh woo oh 다그치면 그럴수록 눈물만 나
2015.11.30~12.06,74,7953787,Whalien 52,방탄소년단,화양연화 pt.2,2015.11.30,Rap / Hip-hop,"Pdogg,브라더수,방시혁,RM,SUGA,j-hope,SlowRabbit",이 넓은 바다 그 한가운데 한 마리 고래가 나즈막히 외롭게 말을 해 아무리 소리쳐도 닿지 않는 게 사무치게 외로워 조용히 입 다무네 아무렴 어때 뭐가 됐던 이젠 뭐 I don’t care 외로움이란 녀석만 내 곁에서 머물 때 온전히 혼자가 돼 외로이 채우는 자물쇠 누군 말해 새끼 연예인 다 됐네 Oh fuck that 그래 뭐 어때 누군가 곁에 머물 수 없다 한대도 그걸로 족해 날 향해 쉽게 얘기하는 이 말은 곧 벽이 돼 외로움조차 니들 눈엔 척이 돼 그 벽에 갇혀서 내 숨이 막혀도 저 수면 위를 향해 Hey oh oh hey oh yeah Lonely lonely lonely whale 이렇게 혼자 노래불러 외딴 섬 같은 나도 밝게 빛날 수 있을까 Lonely lonely lonely whale 이렇게 또 한 번 불러봐 대답 없는 이 노래가 내일에 닿을 때까지 No more no more baby No more no more 끝없는 무전 하나 언젠가 닿을 거야 저기 지구 반대편까지 다 No more no more baby No more no more 눈먼 고래들조차 날 볼 수 있을 거야 오늘도 다시 노래하지 나 세상은 절대로 몰라 내가 얼마나 슬픈지를 내 아픔은 섞일 수 없는 물과 기름 그저 난 수면 위에서만 숨을 쉴 때 관심 끝 외로운 바닷속 꼬마 나도 알리고 싶네  내 가치를 Everyday 걱정의 멀미를 해 늘 스티커는 귀 밑에 Never end 왜 끝은 없고 매번 hell 시간이 가도 차가운 심연 속의  Neverland But 늘 생각해 지금 새우잠 자더라도 꿈은 고래답게 다가올 큰 칭찬이 매일 춤을 추게 할거야 나답게 Ye i'm swimmin' 내 미래를 향해 가 저 푸른 바다와 내 헤르츠를 믿어 Hey oh oh hey oh yeah Lonely lonely lonely whale 이렇게 혼자 노래불러 외딴 섬 같은 나도 밝게 빛날 수 있을까 Lonely lonely lonely whale 이렇게 또 한 번 불러봐 대답 없는 이 노래가 내일에 닿을 때까지 어머니는 바다가 푸르다 하셨어 멀리 힘껏 니 목소릴 내라 하셨어 그런데 어떡하죠 여긴 너무 깜깜하고 온통 다른 말을 하는  다른 고래들 뿐인데 I juss can't hold it ma 사랑한다 말하고 싶어 혼자 하는 돌림 노래 같은 악보 위를 되짚어 이 바다는 너무 깊어 그래도 난 다행인 걸 눈물 나도 아무도 모를테니 I'm a whalien Lonely lonely lonely whale 이렇게 혼자 노래불러 외딴 섬 같은 나도 밝게 빛날 수 있을까 Lonely lonely lonely whale 이렇게 또 한 번 불러봐 대답 없는 이 노래가 내일에 닿을 때까지 No more no more baby No more no more 끝없는 무전 하나 언젠가 닿을 거야 저기 지구 반대편까지 다 No more no more baby No more no more 눈먼 고래들조차 난 볼 수 있을 거야 오늘도 다시 노래하지 나
2015.11.30~12.06,75,7948056,고칠게,진원,고칠게 - 다시부르기,2015.11.25,Ballad,2soo,요즘 너무나 네가 낯설게 느껴져 어제는 전화도 한번 없었지 어디니 밥은 먹었냐고 묻는 상냥한 네 말 기다렸는데 아무 말도 없는 너를 보며 느껴 내가 알던 네가 맞는 건지 다른 사람 네게 생긴 건지 이제 더 이상 날 사랑하지 않니 우리 이별인거니 왜 내가 싫어졌는지 내게 말해줄 순 없니 자꾸만 전화해서 귀찮아 진거니 아직도 난 너를 사랑하고 있는데 난 어떡해 난 어떡해 내가 뭘 잘못한 건지 왜 내가 싫증나는지 뭘 내가 잘못하고 있는 거라면 말 해줄래 네가 말하는 그 모습처럼 고칠게 다 고칠게 떠나지마 나는 아직도 니가 내것만 같은데 오늘도 네게 전화를 걸어서 잘자라 오늘밤 꿈에서 보잔 달콤한 말 해줄 것 같은데 보고 싶다 자꾸 생각난다 내게 말해주던 너는 어디갔니 사랑한다 너만 사랑한다고 말했던 거 거짓말이니 모두 거짓이었니 왜 내가 싫어졌는지 내게 말 해줄 순 없니 자꾸만 전화해서 귀찮아진거니 아직도 난 너를 사랑하고 있는데 난 어떡해 난 어떡해 왜 그리 차가운건지 예전에 니가 맞는지 너 전에 만나던 그 사람 때문이니 말해줄래 네가 만나는 그 사람처럼 고칠게 다 고칠게 떠나지마
