time,rank,song_id,title,singers,album,date,genre,creator,lyric
2015.06.22~06.28,1,5748499,SHAKE IT,씨스타,SHAKE IT,2015.06.22,Dance,"이단옆차기,핫띠",너만을 유혹하는 춤  우우우 우우우우 심장에 매력 발산 중  우우우 우우우우 손끝만 스쳐도 막 쿵쿵쿵쿵 Oh 내 맘이 흔들려 Shake it shake it for me Shake it shake it for me 나나나 나나나 나나나  Hey 나나나 나나나 나나나  짜릿한 이 느낌  날 춤을 추게 해  지금 이 순간  Shake it Bae bae baby Love me love me love me now 흔들리는 내 맘 모르겠니 So let's dance Just shake it let's dance 좀 더 핫하게 완전 와일드하게 Make it louder 우우우 더 크게 make it louder 우우우 날 자꾸 흔들어 흔들어 놀라게 흔들어 Shake it oh shake it 밤새 나와 Shake it baby 아주 fun하고 smart하게  흔들흔들어 온몸이 찌릿찌릿 우리 둘이  흔들흔들어 심하게 통하니 여기 불났으니 When I Move  움직여 자리 잡았으니 Shake it shake it for me Shake it shake it for me 나나나 나나나 나나나  Hey 나나나 나나나 나나나  짜릿한 이 느낌  날 춤을 추게 해  지금 이 순간  Shake it Bae bae baby Love me love me love me now 흔들리는 내 맘 모르겠니 So let's dance Just shake it let's dance 좀 더 핫하게 완전 와일드하게 Make it louder 우우우 더 크게 make it louder 우우우 날 자꾸 흔들어 흔들어 놀라게 흔들어 Shake it oh shake it 밤새 나와 Shake it baby Shake it oh shake it Shake it up shake it for me Shake it oh shake it Shake it up shake it for me Shake it oh shake it Shake it up shake it for me Shake it oh shake it Shake it up shake it for me Shake it for me my baby Shake it for me my baby 그렇게 모두 모여 dance Just shake it let's dance 좀 더 핫하게 완전 와일드하게 Make it louder 우우우 더 크게 make it louder 우우우 날 자꾸 흔들어 흔들어 놀라게 흔들어 Shake it oh shake it 밤새 나와 Shake it baby
2015.06.22~06.28,2,5704397,이럴거면 그러지말지 (Feat. Young K),백아연,이럴거면 그러지말지,2015.05.20,Ballad,"심은지,백아연",궁금해서 잠이 안 와 그때 왜 그랬어 구차해도 묻고 싶어 그때 난 뭐였어 나나나나 나나 나나 나만 애 탄거니 나나나나 나나 나나 난 진심인데 넌 그랬구나 그랬어 좋았는데 넌 아니었나 봐 그랬구나 그때 넌 그런 줄 모르고 나 혼자 이럴 거면 바래다주었던 그날 밤 넌 나를 안아주지 말았어야지 설렘에 밤잠 설치게 했던 그 말 그 말도 말았어야지 그러지는 말지 비겁하게 숨어버린 너를 돌아 올 거라고 믿은 내가 바보야 사랑스럽게 날 보던 네 눈빛에 빠졌던 내가 바보지 이럴 줄도 모르고 이렇게 돼 버린 이상 그냥 얘기할게 이미 떠나버린 니 맘 돌릴 순 없으니 그랬구나 그랬어 좋았는데 넌 아니었나 봐 그랬구나 그때 넌 네 생각 뿐인데 나 혼자 이럴 거면 바래다주었던 그날 밤 넌 나를 안아주지 말았어야지 설렘에 밤잠 설치게 했던 그 말 그 말도 말았어야지 이럴 줄은 몰랐어 어때 넌 어떻게 하고 싶니 지금 이 순간의 감정일지 중간에 금방 에러가 날것인지 I don’t know 하지만 내 생각엔 오래가진 못할 거 같아 너 아닌 나 때문에 이 관계는 이어지지 못해 잠 못 들어 아픈 이 새벽 잘 지내니 문자 한번쯤은 해주지 혹시나 하며 올린 우리 얘기에 좋아요 누르지 말지 괜히 기대 하게 바래다주던 그 날 밤처럼 돌아와서 포근하게 나를 안아줘 설렘에 밤잠 설치게 했던 말로 또 두근거리게 해줘 다시 날 녹여줘 이럴 거면 귀엽다고 하지 말지 그러지 말지 혼잣말만 늘어가네 전하지도 못할 말만
2015.06.22~06.28,3,5748406,심쿵해 (Heart Attack),AOA,Heart Attack,2015.06.22,Dance,"용감한형제,차쿤(일렉트로보이즈)",A ye Brave sound  And it goes a little something like this  완전 반해 반해 버렸어요  부드러운 목소리에  반해 반해 버렸어요  난 떨려  AOA Let's Go  내가 미쳤나 봐 왜 또 이러지  내 마음 열여덟 소녀 마냥  막 쿵쿵대  숨길 수 없나 봐 난 매일 이러지  눈이라도 마주치면  귀까지 확 빨개져   이해 못해  네가 걔를 못 봐서 그래   딱 첫눈에 확 반해 버린다는 말에  그 마음 이해 가더라  나도 좀 알겠더라  널 처음 본 그 순간  완전 반해 반해 버렸어요   넓은 어깨 날렵한 눈매에   부드러운 목소리에  반해 반해 버렸어요  너의 얇고 긴 손가락만 봐도  난 떨려   어머나 자꾸만 심쿵해  널 보면 볼수록  가슴이 쿵쿵대 나도 모르겠어  심쿵해 나 어쩌면 좋아  자꾸만 네 품에  꼭 안기고 싶어 baby  어쩌다 눈이라도 마주치면  난 심쿵 거려   너의 작은 관심이라도 받을까  아등바등 거려  너는 대체 걔가 뭐가 그리 좋아  라고 묻는 친구들에게 말해  야 모르면 말을 말어  이해 못해 네가 걔를 못 봐서 그래  딱 첫눈에 확 반해 버린다는 말에  그 마음 이해 가더라  나도 좀 알겠더라  널 처음 본 그 순간  완전 반해 반해 버렸어요   넓은 어깨 날렵한 눈매에   부드러운 목소리에  반해 반해 버렸어요  너의 얇고 긴 손가락만 봐도 난 떨려  어머나 자꾸만 심쿵해 널 보면 볼수록 가슴이 쿵쿵대 나도 모르겠어 심쿵해 나 어쩌면 좋아 자꾸만 네 품에 꼭 안기고 싶어 baby 오 나의 왕자님 어디를 보나요 바로 여기 내가 있는데요 너무나 멋진 그대 난 그대 하나면 돼 난 그대 없이 못 살아요  완전 반해 반해 버렸어요 부드러운 목소리에 반해 반해 버렸어요 난 떨려 어머나 자꾸만 심쿵해  Everybody say What AOA 쿵쿵대 And it goes a little something like this 심쿵해 한번 더 say What AOA 네 품에 꼭 안기고 싶어 baby
2015.06.22~06.28,4,5719286,뱅뱅뱅 (BANG BANG BANG),BIGBANG,A,2015.06.01,Rap / Hip-hop,"TEDDY,G-DRAGON,T.O.P",난 깨어나 까만 밤과 함께 다 들어와 담엔 누구 차례 한 치 앞도 볼 수 없는 막장 게릴라 경배하라 목청이 터지게 찌질한 분위기를 전환해 광기를 감추지 못하게 해 남자들의 품위 여자들의 가식 이유 모를 자신감이 볼만해 난 보란 듯이 너무나도 뻔뻔히 니 몸속에 파고드는 알러지 이상한 정신의 술렁이는 천지 오늘 여기 무법지 난 불을 질러 심장을 태워 널 미치게 하고 싶어 B I G Yea we bang like this 모두 다 같이 총 맞은 것처럼 BANG BANG BANG BANG BANG BANG 빵야 빵야 빵야 BANG BANG BANG BANG BANG BANG 빵야 빵야 빵야 다 꼼짝 마라 다 꼼짝 마 다 꼼짝 마라 다 꼼짝 마 오늘 밤 끝장 보자 다 끝장 봐 오늘 밤 끝장 보자 빵야 빵야 빵야 널 데려가 지금 이 순간에 새빨간 저 하늘이 춤출 때 돌고 돌아 너와 나 이곳은 Valhalla 찬양하라 더 울려 퍼지게 We go hard 불침번 밤새 달려 축지법 이 노래는 꼭지점 신이나 불러라 신점 큰 비명소리는 마성의 멜로디 검은 독기의 연결 고리 사방 팔방 오방 가서 푸는 고삐 whoo 난 불을 질러 네 심장을 태워 널 미치게 하고 싶어 B I G Yea we bang like this 모두 다 같이 총 맞은 것처럼 BANG BANG BANG BANG BANG BANG 빵야 빵야 빵야 BANG BANG BANG BANG BANG BANG 빵야 빵야 빵야 다 꼼짝 마라 다 꼼짝 마 다 꼼짝 마라 다 꼼짝 마 오늘 밤 끝장 보자 다 끝장 봐 오늘 밤 끝장 보자 빵야 빵야 빵야 Ready or not Yea we don't give a what Ready or not Yea we don't give a what Let’s go 남자들은 위로 여자들은 get low 당겨라 bang bang bang let the bass drum go 남자들은 위로 여자들은 get low 당겨라 bang bang bang let the bass drum go let the bass drum go let the bass drum go bang bang bang bang bang bang let the bass drum go bang bang bang bang bang bang let the bass drum go
2015.06.22~06.28,5,5743804,음오아예 (Um Oh Ah Yeh),마마무(Mamamoo),Pink Funky,2015.06.19,Dance,"김도훈(RBW),솔라(마마무),문별(마마무),화사(마마무)",oh yes 음 오 아 예  너에게  빠져들겠어  자꾸 반응하잖아  oh yes 음 오 아 예   그래 난 다가가겠어  넌 내 취향저격 ace  내 앞을 지나갔어  눈빛이 마주쳤어 스타일이 좋아 느낌이 좋아 다를 게 없는 오늘  너 땜에 달아오른 오늘이 좋아 음오아예 첫 번째 플랜 감탄사 그 동안에 찾아 헤멘 남자 음오아 예스 맞는 옷처럼 잘 어울리는 너야 부드럽게 이런 말 어떤 것 같아 음 두 번째 플랜 먼저 당기기 오오 동공 떨리는 초침  스탠바이 큐 아 시간되면 차 한잔 할래요 예스 이런 건 어떤 것 같아 oh yes 음 오 아 예   너에게 빠져들겠어  자꾸 반응하잖아  oh yes 음 오 아 예   그래 난 다가가겠어  넌 내 취향저격 ace  본능을 따르겠어  날 감추지 않겠어  오늘은 달라 먼저 다가가 걸음은 도도하게  말투는 애교 있게 날 보는 눈빛 음오아예 help me  시간 좀 되나요 나 좀 도와줘요 그 쪽 때문에  오감이 제멋대로예요 그 쪽이 예고 없이 날리는 미소에 음 콜린퍼스도 울고 갈  당신의 매너에 오 여자라 해도 믿을만한 피부 아예 넌 존재자체 감탄사 절로 나네 음오아예  나도 모르게  달아오르네 홀릭 oh yes 음 오 아 예  너에게 빠져들겠어  자꾸 반응하잖아  oh yes 음 오 아 예  그래 난 다가가겠어  넌 내 취향저격 ace  목소리도 oh yes  눈웃음도 oh yes  네 모든 게  머리부터 발끝까지 다 oh yes 지금 널 보면 난 oh yes 단 둘이서 oh yes  드루루 드루루 드루루 oh yes 뜨거워지는 이 분위기  너와 나의 거리 우리 사이로 한 여자가  걸어 와 때마침 그의 여자친구인 건지  아님 친군 건지 다가와 언니 이 여자 누구예요 여자였어 OH MY GOD oh yes 음 오 아 예  너에게 빠져들겠어  자꾸 반응하잖아  oh yes 음 오 아 예  그래 난 다가가겠어  넌 내 취향저격 ace  목소리도 oh yes  눈웃음도 oh yes  Oh 너의 모든 게  머리부터 발끝까지 다 oh yes
2015.06.22~06.28,6,5700639,마음,아이유,마음,2015.05.18,Folk,아이유,툭 웃음이 터지면 그건 너 쿵 내려앉으면은 그건 너 축 머금고 있다면 그건 너 둥 울림이 생긴다면 그건 너 그대를 보며 나는 더운 숨을 쉬어요 아픈 기분이 드는 건 그 때문이겠죠 나를 알아주지 않으셔도 돼요 찾아오지 않으셔도 다만 꺼지지 않는 작은 불빛이 여기 반짝 살아있어요 영영 살아있어요 눈을 떼지 못 해 하루종일 눈이 시려요 슬픈 기분이 드는 건 그 때문이겠죠 제게 대답하지 않으셔도 돼요 달래주지 않으셔도 다만 꺼지지 않는 작은 불빛이 여기 반짝 살아있어요 세상 모든 게 죽고 새로 태어나 다시 늙어갈 때에도 감히 이 마음만은 주름도 없이 여기 반짝 살아있어요 영영 살아있어요 영영 살아있어요
2015.06.22~06.28,7,5719287,WE LIKE 2 PARTY,BIGBANG,A,2015.06.01,Rap / Hip-hop,"TEDDY,KUSH,G-DRAGON,T.O.P",오늘도 친구들이 왔어 MAN HOW YOU BEEN WHATS UP AYE 여기 한 잔만 줄래 제일 늦게 마시는 사람 술래 그냥 섞어 마셔 CHAMPAGNE AND IF U KNOW WHAT I’M SAYIN 내 손목을 보니 시간은 금이야 불금이야 YOU DIG 우린 젊기에 후회 따윈 내일 해 조금 위험해 AYE MAN YOU BETTER SLOW IT DOWN 다시 돌아오지 않을 오늘을 위해 저 하늘을 향해 건배해 WE LIKE 2 PARTY YEAH YEAH YEAH YEAH WE LIKE 2 PARTY 머리 위에 해 뜰 때까지 WE LIKE 2 PARTY YEAH YEAH YEAH YEAH WE LIKE 2 PARTY 서쪽에서 해 뜰 때까지 오래간만에 불장난해 지금 이 순간 나랑 같이 밖에 나갈래 시끌 시끌 분위기는 환상 겁이 없는 멋쟁이들 꽐라 여기저기 널부러진 OPUS ONE에 마무리는 달콤하게 D’yquem 너는 빼지 않지 가지 함께 천국까지 맨 정신은 반칙 우린 젊기에 후회 따윈 내일 해 조금 위험해 AYE MAN YOU BETTER SLOW IT DOWN 다시 돌아오지 않을 오늘을 위해 저 하늘을 향해 건배해 WE LIKE 2 PARTY YEAH YEAH YEAH YEAH WE LIKE 2 PARTY 머리 위에 해 뜰 때까지 WE LIKE 2 PARTY YEAH YEAH YEAH YEAH WE LIKE 2 PARTY 서쪽에서 해 뜰 때까지 너 없인 미쳐버리겠어 DJ PLAY A LOVE SONG 나 취한 게 아냐 네가 보고 싶어 죽겠어 SO DJ PLAY A LOVE SONG WE LIKE 2 PARTY YEAH YEAH YEAH YEAH WE LIKE 2 PARTY 머리 위에 해 뜰 때까지 WE LIKE 2 PARTY YEAH YEAH YEAH YEAH WE LIKE 2 PARTY 서쪽에서 해 뜰 때까지
2015.06.22~06.28,8,5721440,LOVE ME RIGHT,EXO,LOVE ME RIGHT - The 2nd Album Repackage,2015.06.03,Dance,"오유원,김동현",Oh Yeah C’mon Take your time 왠지 두근대는 밤이야 Na Na Na Na Na Na Na Na So tonight 달 끝까지 달려가볼까 Yea Yea Yea Yea Yea Yea Yea Yea Just right 시동을 걸어 엑셀에 발을 올려 모든 것이 특별해 너와는 잘 어울려 무엇을 원하던 Imma make it work Yeah Shawty Imma party till the sun down 지금 이 신비로운 느낌은 뭘까 와줘 내게로 어서 Before the sun rise 네가 없는 난 어딜 가도 Nobody Yeah 오 도로 위에 여긴 runway 날 바라보는 눈 속 milky way Just love me right 아하 Baby love me right 아하 오 내게로 와 망설이지마 넌 매혹적인 나의 universe Just love me right 아하 내 우주는 전부 너야 Just love me right Just love me right Just love me right 내 우주는 전부 너야 Shine a light 별빛 속을 달려 은하술 건너 Na Na Na Na 멈출 순 없어 오예 우릴 비추는 달빛은 여전하지 네 궤도 안 헤매고 있어 난 아직 I can do this all night long baby 네가 없는 난 어딜 가도  반쪽짜리니까 달빛 찬란한 밤 펼쳐진 별들의 불꽃놀이 좀 더 높이 날아가볼까 날아가볼까 가슴 터질듯한 이 순간 우리 둘만 떠올라 발 밑에 지구를 두고 love me right 도로 위에 여긴 runway 날 바라보는 눈 속 milky way Just love me right 아하 Baby love me right 아하 So come on baby 눈이 부시게 더 아름다운 너의 universe 아름다운 lady Just love me right 아하 내 우주는 전부 너야 오 Just love me right Just love me right Can you love me right Just love me right I just wanna make you love me 내 우주는 전부 너야 수 없는 밤이 찾아와도 내 하늘엔 오직 너만 빛나 Woo Yeah 속삭여줘 내게만 밤하늘을 너와 내가 물들여가 도로 위에 여긴 runway 날 바라보는 눈 속 milky way Just love me right 아하 Baby love me right 아하 오 내게로 와 망설이지마 넌 매혹적인 나의 universe Just love me right 아하 내 우주는 전부 너야 Just love me right Oh oh oh yeah Just love me right Just love me right 우리만의 시간 내 우주는 전부 너야 Just love me right Just love me right Just love me right I just wanna make you love me Yea Woo You got to love Yea You got to love me Yea 내 우주는 전부 너야 Yea You love me Yea You love me Yea 내 우주는 전부 너야
2015.06.22~06.28,9,5742255,느껴 (My Everything),범키,느껴 (My Everything),2015.06.19,R&B / Soul,범키,내 곁에 잠들어 있는  널 볼 때면 난 느껴 지금이 꿈이 아닌 것이 너무나 난 기뻐 우 우리 매일 함께 눈 뜨는 것 지금 이 순간이 선물인걸 날 보며 미소 짓는  너를 볼 때마다 나는 느껴 다시 너의 웃는 모습을  볼 수 있다는게 기뻐 서로의 두 손을 잡고서  기도하며 잠이 드는 것 하루하루가 기쁨인걸 yeah 오늘은 내 목소리로 널 노래할게 Cause you are my soul my song my love my everyday 내일은 내 두 눈으로 널 그려줄게 Cause you are my home my joy my life my everything my everything you Rejoice evermore that's right Pray without ceasing Give thanks in everything 늘 기적 속에 살면서도  잘 모르고 두 눈을 뜨고 있어도  나는 보이지 않았지 캄캄한 어둠 속에 빠져서 잊고 있었어 너와의 매일이 축복인걸 But when I find it hard  to see that in the dark you pick me up you show me how to understand  my life to carry on 이제 난 알아  다시는 절대 잊지 않을게 이 모든 것들이 행복인걸 오늘은 내 목소리로 널 노래할게 Cause you are my soul my song my love my everyday 내일은 내 두 눈으로 널 그려줄게 Cause you are my home my joy my life my everything You're my everything You're my everything 늘 헤매었던 날 Baby you're my everything 넌 온전하게 만들어 You're my everything My everything you I'd rather have bad times with you than good by myself cause you're my soul my song my love my everyday I'd rather have hard times with you than good by myself cause you're my home my joy my life my everything
2015.06.22~06.28,10,5682700,LOSER,BIGBANG,M,2015.05.01,Rap / Hip-hop,"TEDDY,T.O.P,G-DRAGON",LOSER 외톨이 센 척하는 겁쟁이 못된 양아치 거울 속에 넌 JUST A LOSER 외톨이  상처뿐인 머저리 더러운 쓰레기 거울 속에 난 I'M A 솔직히 세상과 난 어울린 적 없어 홀로였던 내겐 사랑 따윈 벌써 잊혀 진지 오래 저 시간 속에 더 이상은 못 듣겠어 희망찬 사랑 노래 너나 나나 그저 길들여진 대로 각본 속에 놀아나는 슬픈 삐에로 난 멀리 와버렸어 I'M COMING HOME 이제 다시 돌아갈래 어릴 적 제자리로 언제부턴가 난 Yeah 하늘 보다 땅을 더 바라보게 돼 숨쉬기조차 힘겨워 손을 뻗지만 그 누구도 날 잡아 주질 않네 I'M A LOSER 외톨이 센 척하는 겁쟁이 못된 양아치 거울 속에 넌 JUST A LOSER 외톨이 상처뿐인 머저리 더러운 쓰레기 거울 속에 난 I'M A 반복되는 여자들과의 내 실수 하룻밤을 사랑하고 해 뜨면 싫증 책임지지 못 할 나의 이기적인 기쁨 하나 땜에 모든 것이 망가져버린 지금 멈출 줄 모르던 나의 위험한 질주 이젠 아무런 감흥도 재미도 없는 기분 나 벼랑 끝에 혼자 있네 I'M GOING HOME 나 다시 돌아갈래 예전의 제자리로 언제부턴가 난 Yeah 사람들의 시선을 두려워만 해 우는 것조차 지겨워 웃어보지만 그 아무도 날 알아주질 않네 I'M A LOSER 외톨이 센 척하는 겁쟁이 못된 양아치 거울 속에 넌 JUST A LOSER 외톨이 상처뿐인 머저리 더러운 쓰레기 거울 속에 난 파란 저 하늘을 원망하지 난 가끔 내려놓고 싶어져 I WANT TO SAY GOOD BYE 이 길의 끝에 방황이 끝나면 부디 후회 없는 채로 두 눈 감을 수 있길 LOSER 외톨이 센 척하는 겁쟁이 못된 양아치 거울 속에 넌 JUST A LOSER 외톨이 상처뿐인 머저리 더러운 쓰레기 거울 속에 난 I'M A LOSER I'M A LOSER I'M A LOSER I'M A LOSER
2015.06.22~06.28,11,5684826,BAE BAE,BIGBANG,M,2015.05.01,Rap / Hip-hop,"G-DRAGON,TEDDY,T.O.P",I'M IN LOVE  눈에 콩깍지 씌었어 BABE  하의 실종에 흰 와이셔츠 BABE  사람이야 천사야  OH JESUS BABE  눈부셔 BABE  SUNGLASS BABE  정신이 망신이야 홀렸어 네게  피가 한쪽으로 또 쏠렸어 네게  위험해  YOU'RE SO DANGEROUS BABE  살려줘 BABE  경찰 불러 BABE  BABY BABY 지금처럼만  아름다워 줄래 넌  시간이 지나도 내가 설렐 수 있게  BABY BABY 넌 시들지 마  이기적인 날 위해  그 모습 그대로  넌 그대로 여야만 해  사슴같이 예쁜 눈  나의 PRINCESS  나를 보고 비웃는 게  너무 CHIC 해  미친 거 아닐까  자연 미인 특이해 특이해  내게 완벽한 그대여  나의 MUSE 해  우리 둘이 편해 완전 살찌네  너와 몸이 완전 착착 감기네  영원히 넌 스물다섯이야 내게  변치 않아 BABE 5 X 5 BABE BABY BABY 지금처럼만 아름다워 줄래 넌 시간이 지나도 내가 설렐 수 있게 BABY BABY 넌 시들지 마 이기적인 날 위해 그 모습 그대로 넌 그대로 여야만 해 난 예쁜 꽃을 든 남자 모든 이가 사랑할 너란 꽃을 든 남자 그대 향기에 취해 난 또 몽롱해지고 꺾이지 말아주오 제발 너만은 찹쌀떡 찹쌀떡 궁합이 우리 우리 궁합이 찹쌀떡 찹쌀떡 궁합이 우리 우리 궁합이
2015.06.22~06.28,12,5731852,그리고 안녕,이승기,그리고...,2015.06.10,Ballad,"김도훈(RBW),최갑원",작은 너의 입술이 처음 내게 했던 말 안녕이란 그 말이 참 듣기 좋더라 우리가 시작이 된 것 같아 우리가 우리가 된 것 같아 너를 집에 데려다 주고 돌아오는 그 길에 설레게 한 그 말이 이젠 Good bye Good bye 안녕 안녕 안녕이라는 말 끝이란 건 아니야 같은 하늘 아래 있으니까 안녕 안녕 안녕 말을 하지만 나의 가슴 속엔  너만 너만 꼭 너만 있을 테니까 짧은 시간이었지만 추억은 많더라 한결같은 사랑은 늘 감동이더라 오늘이 마지막은 아니야 알겠니 그러니까 울지 마  너는 세상 어디 있어도 찾아갈 수 있으니 아무 걱정하지 마 잠시 Good bye Good bye 안녕 안녕 안녕이라는 말 끝이란 건 아니야 같은 하늘 아래 있으니까 안녕 안녕 안녕 말을 하지만 나의 가슴 속엔  너만 너만 꼭 너만 있을 테니까 날 잊지 마 날 잊지 마 날 잊지 마 날 잊지 마 날 잊지 마 내가 없는 봄이 지나도 안녕 안녕 안녕 말하지만 이 마음은 언제나 너를 닮은 꽃을 피울 거야 사랑 사랑 사랑한다는 그 말 다른 사람 아닌 너만 너만 꼭 너만 듣게 될 거야
2015.06.22~06.28,13,5702706,꺼내 먹어요,Zion.T,Eat,2015.05.19,R&B / Soul,Zion.T,안녕 쉽지 않죠 바쁘죠 왜 이렇게 까지 해야 하나 싶죠 바라는 게 더럽게 많죠 그렇죠 쉬고 싶죠 시끄럽죠 다 성가시죠 집에 가고 싶죠 집에 있는데도 집에 가고 싶을 거야 그럴 땐 이 노래를 초콜릿처럼 꺼내 먹어요 피곤해도 아침 점심 밥 좀 챙겨 먹어요 그러면 이따 내가 칭찬해줄게요 보고 싶어 많이 좋아해요 더 많이 안아주고 싶어요 사랑 사랑 비슷한 걸 해요 어쩌면 정말 사랑해요 배고플 땐 이 노래를 아침 사과처럼 꺼내 먹어요 피곤해도 아침 점심 밥 좀 챙겨 먹어요 그러면 이따 밤에 잠도 잘 올 거에요 힘들어요 아름다워서 알아봐줘요 나를 흘려 보내지 마요 나를 사랑해줘요 날 날 놓치지 마요
2015.06.22~06.28,14,5674119,Me You (Feat. 백예린 Of 15&),SanE,양치기 소년,2015.04.23,Rap / Hip-hop,SanE,Oh boy I'm kinda new to this  어떻게 말해야 되지  그냥 솔직히 말할게  Baby I think I'm in love  자꾸 기분이 Up 돼  생각만 해도 찡해  장난 아냐 No playing  확신이 들어  There is something going between  Me you me you  Me you me you it's you and  Me you me you  Me you me you it's you and  Me you me you  Me you me you  It's you and me and you  I sing this song like  I don't need no girlfriend  왜냐면 드디어 만났거든  Girlfriend  이 노랠 듣고 꺼져  Ex girlfriends  Don't call me  그녀가 불안해하잖아  What you want from me  이유는 간단해  Cause she got something for me  너와는 달라 달라 달라  말 못했지만  넌 돈 쓰길 바라고 그녀는  마음 쓰기 바래  Yeah I said it whoop  비교해서 미안 그녀 함께하다  너와 놀면 하품이 나 Yawning  So what Sso what  날 위해 그녈 위해  너는 Block block block  Oh boy I'm kinda new to this  어떻게 말해야 되지  그냥 솔직히 말할게  Baby I think I'm in love  자꾸 기분이 Up 돼  생각만 해도 찡해  장난 아냐 No playing  확신이 들어  There is something going between  Me you me you  Me you me you it's you and  Me you me you  Me you me you it's you and  Me you me you  Me you me you  It's you and me and you  I rap this song like  I don't need no girlfriend  왜냐면 지금 옆에 있는  Soul friend  친구도 되 연인도 되니  Oh well  그녀 남자로서 한 마디 해줄게  Ex boyfriends  Just don't call her  이제 그녀는 내가 있으니  밤에 전화하지 마  뭐 하냐 묻지 마  괜히 걸어봐라 뿌르르르  어 어 엄한 소리 들을라  니 Lip service  느끼해하지 Mayo  그녀 내 말투엔 빨개져  You gotta ketchup  Mr 껄떡 전엔 신사답게 끝냈지만  딱 잘라 말할게 얄짤없어 I You  Boy I'm kinda new to this  어떻게 말해야 될까  그냥 솔직히 말할게  Baby I think I'm in love  자꾸 기분이 Up 돼  생각만 해도 찡해  장난 아냐 No playing  확신이 들어  There is something going between  Me you me you  Me you me you it's you and  Me you me you  Me you me you it's you and  Me you me you  Me you me you  It's you and me and you  Oonce again  Me you me you  Me you me you it's you and  Me you me you  Me you me you it's you and  Me you me you  Me you me you  It's you and me and you  and me and you  and me and you  and me and you  and me and
