time,rank,song_id,title,singers,album,date,genre,creator,lyric2011.03.20~03.26,72,3108907,비밀 (Special Vocal. 박완규),부활,부활 Collaboration Project  `+ (plus)` / +1,2011.01.17,Rock,김태원,빈 의자와 마주 앉아서 가끔 나 혼자서 말을 하고 언제부턴가 나도 모르는사이 자꾸 뒤돌아 보게 되고 비밀처럼 계절이 흘러 상처들이 아물어가면 설레이던 너는 설레이던 너는 한편의 시가 되고 너무나 보고 싶어서 보고 싶어져서 가끔식 홀로 두눈을 감곤해 너와 나 사랑을 하던 날들과 헤어지던 날을 난 간직하게 돼 너무나 그리워져서 너무 그리워서 너의 이름을 홀로 부르곤해 너무 사랑해서 너무 사랑해서 넌 내안에 늘 있나봐 있나봐  비밀처럼 계절이 흘러 상처들이 아물어가면 설레이던 너는 설레이던 너는 한편의 시가 되고  너무나 보고 싶어서 보고 싶어져서 가끔식 홀로 두눈을 감곤해 너와 나 사랑을 하던 날들과 헤어지던 날을 난 간직하게 돼 너무나 그리워져서 너무 그리워서 너의 이름을 홀로 부르곤해 너무 사랑해서 너무 사랑해서 넌 내안에 늘 있나봐  너무나 보고 싶어서 보고 싶어져서 너의 이름을 홀로 부르곤해 너무 사랑해서 너무 사랑해서 넌 내안에 늘 있나봐 있나 봐
2011.03.20~03.26,73,3319848,장난치지마,치치,장난치지마,2011.03.18,Dance,,Hey Hey Check It Up Now Hey Hey 다 잘들어봐 Hey We Got The Brand New Style 우린 바로 무대위의 Shinning Star Hey Hey Here We Go Now Hey Hey 우릴 따라와 Hey We Got The Brand New Style 지금부터 보여줄게 잘 들어봐 왜 나를 갖고 장난쳐 나를 갖고 장난쳐 싫어 Brake It Down 정말 싫어 I'm Gonna Brake you 왜 나를 갖고 장난쳐 나를 갖고 장난쳐 싫어 Brake It Down 정말 싫어 I'm Gonna Brake you 차 한잔하자고 밥 한번 먹고 싶다고 한번만 만나달라고 했던 건 너였어 손잡고 싶다고 입맞춤 하고 싶다고 한번만 안고 싶다고 했던 건 너였어 왜 나를 갖고 장난쳐 나를 갖고 장난쳐 싫어 Brake It Down 정말 싫어 I'm Gonna Brake you 왜 나를 갖고 장난쳐 나를 갖고 장난쳐 싫어 Brake It Down 정말 싫어 I'm Gonna Brake you 매일 내 맘을 헤집어놓은 너라는 못된 Virus 이제는 No You'd Better Run Away From Me Cuz Cuz 내가 흔들어 놀게 Better Run Away It's My Turn To Lie 또 널 내가 가지고 놀게 You Just Like Nerd 이젠 내차례 됐어 I'm Gonna Break Break Break You're Heart  차 한잔하자고 밥 한번 먹고 싶다고 한번만 만나달라고 했던 건 너였어 손잡고 싶다고 입맞춤 하고 싶다고 한번만 안고 싶다고 했던 건 너였어 왜 나를 갖고 장난쳐 나를 갖고 장난쳐 싫어 Brake It Down 정말 싫어 I'm Gonna Brake you 왜 나를 갖고 장난쳐 나를 갖고 장난쳐 싫어 Brake It Down 정말 싫어 I'm Gonna Brake you Hey Boy Hey Boy 정신 차려봐 조금 더 진지하게 조금 더 남자답게 Hey Girl Hey Girl 정신차려봐 헤프게 굴지말고 조금 더 여자답게 왜 나를 갖고 장난쳐 나를 갖고 장난쳐 싫어 Brake It Down 정말 싫어 I'm Gonna Brake you 왜 나를 갖고 장난쳐 나를 갖고 장난쳐 싫어 Brake It Down 정말 싫어 I'm Gonna Brake you 왜 나를 갖고 장난쳐 나를 갖고 장난쳐 싫어 Brake It Down 정말 싫어 I'm Gonna Brake you 왜 나를 갖고 장난쳐 나를 갖고 장난쳐 싫어 Brake It Down 정말 싫어 I'm Gonna Brake you
2011.03.20~03.26,74,3160020,별 (Feat. JD),프리스타일,일곱 번째 하소연,2011.02.28,Rap / Hip-hop,미노(프리스타일),우리 이제는 몰라
2011.03.20~03.26,75,3118474,내겐 너무 멋진 그대,씨야,See You Again,2011.01.21,Ballad,"김도훈(RBW),황성진",너의 그런 표정 처음이었어
2011.03.20~03.26,76,3135864,그 남자는 반대,DMTN,달마시안 1st Mini Album,2011.02.14,Dance,"DavidKim,박장근,디스크브라더스",Don't wanna be lonely I wanna just fall in love 그댈 사랑해 so won't you come in to my heart oh oh follow me follow me oh oh follow me follow me I need you girl 널 사랑해 oh oh you you you 니가 좋아하는 그 남자 내가 본 중 최고로 나쁜 남자 난 정말 답답답답한걸 난난난감한걸 다 바람둥인걸 왜 모르니 baby 왜 이렇게 바보처럼 속고만 사니 결국 끝엔 니가 당해 울게 뻔해 왜 넌 눈을 감고 또 귀를 막고 사랑을 하니 girl 그 남자는 반대 그 남자는 안돼요 내게로 와요 그 사람을 믿지 말아요 나와 함께 fall in love 우리 함께 fall in love 눈을 떠 봐요 so won't you come in to my Come in to my heart 그 남자가 너를 배신하면 내가 혼쭐을 내줄께 너의 기념일도 못 챙겨주면 내가 대신 해줄께 난 그 녀석이랑은 정 반대 걱정 안 해도 돼 so follow me follow me follow me follow me oh girl 그대가 아플까 봐 말 못했어 당신이 좋다면 그래 나도 좋았어 허나 그에게서 더 당하는 꼴 이제 더는 못 참아 그 남잔 술만 마시면 뭐로 변해 너 말고 다른 여자도 너무 많아 왜 넌 눈을 감고 또 귀를 막고 사랑을 하니 girl 그 남자는 반대 그 남자는 안돼요 내게로 와요 그 사람을 믿지 말아요 나와 함께 fall in love 우리 함께 fall in love 눈을 떠 봐요 so won't you come in to my Come in to my heart follow me follow me 나만 믿고 따라와 you're my l o v e l o v e 난 오직 너 하나만 girl i wanna be wanna be 니가 원했던 사랑 so I believe I believe oh I believe I believe L O V E LOVE 사랑하는 그대 내 가슴에 담고서 나를 원하면 또 포근히 감싸 줄게요 나와 함께 fall in love 우리 함께 fall in love 눈을 떠 봐요 so won't you come in to my Come in to my heart
2011.03.20~03.26,77,3324658,I Don`t Know Why,CNBLUE(씨엔블루),FIRST STEP,2011.03.21,Rock,"정용화(CNBLUE),한성호",왜 갑자기 날 떠나려고 하는지 물어봐도 차가워진 너의 눈빛만 왜 갑자기 넌 내가 싫어졌는지 물어봐도 대답조차 하지를 않아 가지마 가지마 내 말이 들리니 널 사랑하고 있어 I don't know why I don't know why 날 보고 말해 I don't know why I don't know why 사랑하면서 왜 떠나가는지 주저 없이 내뱉던 내 첫사랑에 얘기들 쓸데없이 내뱉던 내 구차한 그 변명들 주저 없이 내뱉던 내 유치한 그 농담들 쓸데없이 내뱉던 내 짜증 섞인 투정들  나 말고 다른 사람이 생겼냐고 물어봐도 하염없이 눈물만 흘려 넌 내게 무슨 잘못이 있었냐고 물어봐도 고개만 숙인 채 넌 울어 가지마 가지마 내 말이 들리니 널 사랑하고 있어 I don't know why I don't know why 날 보고 말해 I don't know why I don't know why 사랑하면서 왜 떠나가는지 주저 없이 내뱉던 내 첫사랑에 얘기들 쓸데없이 내뱉던 내 구차한 그 변명들 주저 없이 내뱉던 내 유치한 그 농담들 쓸데없이 내뱉던 내 짜증 섞인 투정들  가지마 가지마 내 말이 들리니 널 사랑하고 있어 You don't know why you don't know why 사랑하는데 I don't know why I don't know why 어떻게 나를 버릴 수가 있어 주저 없이 내뱉던 내 첫사랑에 얘기들 쓸데없이 내뱉던 내 구차한 그 변명들 주저 없이 내뱉던 내 유치한 그 농담들 쓸데없이 내뱉던 내 짜증 섞인 투정들
2011.03.20~03.26,78,3271752,설마,휘성(Realslow),가슴 시린 이야기,2011.03.15,Ballad,휘성(Realslow),이별은 아니겠지 설마
2011.03.20~03.26,79,3324659,사랑은 비를 타고,CNBLUE(씨엔블루),FIRST STEP,2011.03.21,Rock,한성호,창가에 흐르는 빗물에 숨겨놓은 그댈 떠올리고 가슴에 흐르는 눈물로 그대를 지워보곤 하죠 이 소리를 듣고 있죠 비를 좋아하던 그대도 나를 기억하나요 비가오면 나는 그댈 그려요 사랑은 비를 타고 내려 추억은 비를 타고 흘러 내리는 빗소리에 또 그댈 떠올려요 눈물은 비를 타고 내려 기억은 비를 타고 흘러 굳은 가슴 적셔 놓고 떠나가네요 비를 타고 그댄 비를 보면 비를 닮아 슬퍼진다고 말했죠 우리의 사랑도 이젠 비를 닮아 버린 얘기이죠 그댄 떠나갔어도 나를 기억해줘요 나를 기억해줘요 그리움이 많아서 차오를 때 비가 부를 테니까 사랑은 비를 타고 내려 추억은 비를 타고 흘러 내리는 빗소리에 또 그댈 떠올려요 눈물은 비를 타고 내려 기억은 비를 타고 흘러 굳은 가슴 적셔 놓고 떠나가네요 비를 타고  나를 잊었더라도 나를 잊었더라도 다시 기억해줘요 다시 기억해줘요 그리움이 많아서 차오를 때 비가 부를 테니까 어디서든 행복하기를 어디서든 웃고 있기를 비를 닮아 슬픈 사랑 그만 하기를 이것만은 잊지 말아요 그댈 사랑하는 바램이 비를 타고 그대 곁에 내릴 테니까 사랑은 비를 타고 내려 추억은 비를 타고 흘러 내리는 빗소리에 또 그댈 떠올려요 눈물은 비를 타고 내려 기억은 비를 타고 흘러 굳은 가슴 적셔 놓고 떠나가네요 비를 타고
2011.03.20~03.26,80,3271448,무지개 (후쿠야마 마사하루 리메이크),비스트,무지개 (후쿠야마 마사하루 리메이크),2011.03.14,Ballad,,들어봐 나만의 소중한 이야기 익숙한 목소리로 지금부터 시작해 어쩌면 뻔한 얘기지 특별한 것은 너일 뿐 이 노래와 우리 둘 사이 그리 멀지도 않으니까 너에게로 간다 이렇게 바람 따라간다 숨 차게 기다려주겠니 기억하지 못할 꿈 속에 가만히 잠이 든 무지개 다시 떠오를 수 있게 날아 올라가  말해봐 너의 마음 속 숨겨왔던 이야기 같이 꿈꾸던 편한 우리 사이 아직까지 난 기억해 잘가란 인사 같은 건 듣지 못해도 괜찮은 걸 언젠간 다시 만날 오직 한사람 바로 너야 차가운 날도 한 걸음 참아내질 못한 그리움 이제 만날 수 있을까 기억하지 못할 꿈 속에 가만히 잠이 든 무지개 다시 떠오를 수 있게 더 높이 날아가 언젠간 언젠간 우리가 만나면 만나면 지난 시간을 가로질러 언젠간 언젠간 우리 단 둘이서 둘이서 처음 만났던 그 날처럼 약속해 언제 어디선가 반드시 만나겠지 이길 따라가면 끝엔 네가 있을런지 넌 아직 그 때의 우릴 기억할지 잘 모르겠지만 난 지금도 널 향해 어딜가던 뭘하던 다 너로인해 창 밖을 보니 비가 내리네 곧 찾아 올거야 무지개처럼 우리 시간이 너에게로 간다 이렇게 바람따라 간다 숨차게 기다려 주겠니 기억하지 못할 꿈 속에 가만히 잠이 든 무지개 다시 떠오를 수 있게 차가운 날도 한걸음 참아내지 못할 그리움 이제 만날수 있을까 기억하지 못할 꿈 속에 가만히 잠이 든 무지개 너의 하늘 위로 떠오를 수 있게 날아보는거야
2011.03.20~03.26,81,3319548,헤어지고 한번 웃지도 못했어,수빈,Return,2011.03.18,Ballad,필승불패,아무리 울어도 아픈걸 참아보려 해도 아픈걸 괜찮아 질거라고 괜찮아 질거라고 이러다 미칠것 같은데 내가 왜 이래야 하는지 많이 사랑했나봐 많이 사랑했나봐 헤어진후에 아파서 한번 웃지도 못했어 시간이 흘러도 내 가슴은 널 보내지 못해 흔한 이별도 못이겨 죽지 못해서 사는데 돌릴수 없는 이별이기에 자꾸 눈물이 나와 답답해 거리를 걸었어 답답해 거리를 달렸어 울면서 소리쳤어 울면서 소리쳤어 헤어진후에 아파서 한번 웃지도 못했어 시간이 흘러도 내 가슴은 널 보내지 못해 흔한 이별도 못이겨 죽지 못해서 사는데 돌릴수 없는 이별이기에 자꾸 눈물이 나와 이렇게 될거란걸 알았다면 조금만 널 사랑을 했을텐데 내 전부 모두 줬기에 사랑했기에 잊지못하는데 헤어진후에 아파서 정말 아파서 아파서 너무 가슴이 아파서 죽은것 처럼 아무것도 못해 난 너무 가슴이 아파
2011.03.20~03.26,82,3324660,Lie,CNBLUE(씨엔블루),FIRST STEP,2011.03.21,Rock,김재양,기억을 지운다 눈물로 지운다 내 안에 담을 수가 없는 널 추억을 떠민다 아픔을 떠민다 내 안에 머물 수가 없도록 기억을 버린다 눈물로 버린다 아무런 기대조차 없도록 애타는 내 가슴조차 알지 못하게 아프게 널 밀어내도 너만을 기다리고 그리워 멈출 수가 없나 봐 어쩔 수가 없나 봐 아직도 너를 보낼 수 없나 봐 버리고 버려도 가슴에 자라나 마르지 않는 눈물 되어 지우고 지워도 자라나 아픔도 모를 상처로 남아 하루 또 하루 희미해진 초라한 내 사랑 이제는 잡으려 아무리 애써도 안돼  울음을 삼킨다 가슴을 파고든 그리움 고개를 들 수 없도록 지쳐간 내 가슴 조차 알지 못하게 아프게 널 밀어내도 너만을 기다리고 그리워 멈출 수가 없나 봐 어쩔 수가 없나 봐 아직도 너를 보낼 수 없나 봐 버리고 버려도 가슴에 자라나 마르지 않는 눈물 되어 지우고 지워도 자라나 아픔도 모를 상처로 남아 하루 또 하루 희미해진 초라한 내 사랑 이제는 잡으려 아무리 애써도 안돼  늘 불안했던 그 눈빛 언제나 날 가두고 달려와 줄 것만 같은 기대 자꾸 날 멍들게 해 이제 더 이상 너 올 수 없는데 버리고 버려도 가슴에 자라나 마르지 않는 눈물 되어 지우고 지워도 자라나 아픔도 모를 상처로 남아 사랑해 너만을 사랑해 안을 수도 없어 아파도 잡으려 아무리 애써도 내 사랑 아무리 불러도 안돼
2011.03.20~03.26,83,3099149,Stay,엠블랙,BLAQ Style,2011.01.10,Dance,"라도,김지인,원택(1Take),길미",A STAY Love is all over
2011.03.20~03.26,84,3174455,내 사랑,M4,정규 1집,2011.03.11,Ballad,김원,가끔 내 볼을 꼬집어 보곤해   혹시나 꿈인지 아닌지   친구들이 날보고 변했대   툭 하면 혼자 웃는 다고   세상이 아름다워 보이는건   그대가 있기 때문에   보고 또 봐도 보고픈 내 사랑   돌아서면 또 그리운 내 사랑   사랑이란 말도 부족해서   어쩔줄 모르겠어   매일 만나도 설레는 내사랑   내 맘속에 하나뿐인 사랑   그대밖에 모르는  바보가 되도 좋아   행복한 바보니까   머리속에는 언제나 니생각   지갑속 사진은 니얼굴   친구들이 날 보고 놀려대   사랑이 밥먹여 주냐고   언제나 내마음이 배부른건   그대의 사랑때문에   보고 또 봐도 보고픈 내 사랑   돌아서면 더 그리운 내 사랑   사랑이란말도 부족해서  어쩔 줄 모르겠어   매일 만나도 설레는 내 사랑   내 맘속에 하나뿐인 사랑   그대 밖에 모르는  바보가 되도 좋아   행복한 바보니까   때로는 힘들고 지쳐도   우리 절대로 놓치 않기로해   난 그대 밖에 몰라   그대없인 안돼   너무 사랑하니까   내맘 다 줘도 부족한 내 사랑   눈에 넣어도 안 아픈 내 사랑   다시 태어나도 단한사람   그대만 그대만 사랑할래   매일 만나도 설레는 내사랑   내맘속에 하나뿐인 사랑  그대밖에 모르는 바보가 되도 좋아  행복한 바보니까  그대없는 세상은 절대 상상할수도 없어  그대는 내 사랑
2011.03.20~03.26,85,3053253,이게 아닌데,아이유,Real,2010.12.09,Ballad,"김이나,김형석",전부 말할래 나 다 말할래 나  어떻게 너 그랬냐고  참지 않을래 나 안 버틸래 나  우는 내 얼굴 안 예뻐도  뻔히 알면서 왜 물어봐  잘 지내냔 그런 말이 다 뭐야  내가 어떤 사랑 했었는지  너는 다 알고 있잖아  이게 아닌데 왜 또 입술은 왜  실없는 농담만 하고 웃고 있는지  나빠질 건 더 없는데  뭐가 무서워 거짓말 하는지  그나마 너를 보는 게 좋은 건지    뭐든 해볼래 나 안 가릴래 나  어떻게든 잡아볼래  미안해서라도 너 돌아오게  지겹게 울고 애원할래  괜히 안부 따윈 묻지마  어리다고 바본 아닌 거잖아  사실은 다 너만 편하려고  걱정하는 척 하잖아  이게 아닌데 왜 또 입술은 왜  실없는 농담만 하고 웃고 있는지  나빠질 건 더 없는데  뭐가 무서워 거짓말 하는지  그나마 너를 보는 게 좋은 건지  이게 다 뭐야 진실이 뭐야  내가 정말 원한 게 뭐야  끝까지 왜 난 너에게  맞출 수 밖엔 없는 거야    이건 아닌데 정말 아닌 건데  이대로 끝날 사이는 아닌 거잖아  나를 좀 봐 나 울잖아  내가 울면은 맘 약해졌잖아  내가 이렇게 솔직히 말하잖아  내가 아프잖아  이건 아니잖아
2011.03.20~03.26,86,3324661,One Time,CNBLUE(씨엔블루),FIRST STEP,2011.03.21,Rock,정용화(CNBLUE),거울에 비친 미소를 잃은 내 모습이 말하지 I know you know 난 일어설 힘도 없어 음악 없는 삶 내게는 거짓일 뿐이야 I know you know 내 노래를 들어 심장이 뜨거워져 Boom Boom tap Boom Boom tap 아침이 밝은 후에 잠든 내 꼴이 Uh No pain no gain 잃은 것 몇 개를 세진 않아 얻을 게 더 많아 끝없이 뱉는 내 마음속의 Fire 그칠 줄 모르고 오르네 더 Higher 평생 못 할 일 따윈 없어 이마에 흐른 땀은 식지도 않았어 내 노래를 듣고 소리쳐 나를 보며 소리쳐 one time one time 이 순간 만은 one time 다시 한번 더 소리쳐 이 순간을 위해서 one time one time 저 천국보다 더 높은 하늘위로 창가에 비친 표정 잃은 내 얼굴이 말하지 I know you know 왜 눈물만 흐르는지 음악 없는 삶 내게는 가식일 뿐이야 I know you know 너에게 바칠 내 노래를 들려줄게 Boom Boom tap Boom Boom tap 한 손엔 기타 딴 손엔 네가 있기를 바래 내가 끌어 당기는 곳으로 와 담긴 내 마음 전할 수 있게 No doubt One way a only one way 뚫어질 듯 나만 바라봐 내가 보여줄 테니 약속할게 We We We We We a Make you high 내 노래를 듣고 소리쳐 나를 보며 소리쳐 one time one time 이 순간 만은 one time 다시 한번 더 소리쳐 이 순간을 위해서 one time one time 저 천국보다 더 높은 하늘위로 What What What I can do it look at me slow down and down What What What Can't stop I'm ready I well do relax your mind What What What I can do it look at me slow down and down Are you ready yes sir Let's go to the world Ready yes sir Top of the world  내 노래를 듣고 외쳐봐 나를 보며 외쳐봐 one time one time 이 시간만은 one time 다시 크게 더 외쳐봐 이 순간을 위해서 one time one time 저 천국보다 더 밝은 태양위로 내 노래를 듣고 소리쳐 나를 보며 소리쳐 one time one time 이 순간 만은 one time 다시 한번 더 소리쳐 이 순간을 위해서 one time one time 저 천국보다 더 높은 하늘위로 하늘위로  태양위로
2011.03.20~03.26,87,3319657,불면증 (Feat. 최강희),곰PD,곰PD와 절묘한 친구들,2011.03.18,Ballad,곰PD,마지막 한 잔의 커피 마시지 말 걸 그랬어 드라마 마지막 편도 다음에 볼걸 그랬어 누군가에겐 익숙하지만 내게는 낯선 새벽 세 시 잠 못 드는 이 밤 비도 내리지 않고 아른아른 빛나는 별 하나 천천히 내게 다가와 살며시 꺼낸 우리 이야기 해묵은 기억들 하나둘씩 떠올라 별빛 따라 반짝이네 골목길 가로등 아래서서 사랑을 속삭이는 연인들 우리 함께 나눈 비밀스런 얘기들 새벽바람 따라 실려 오고 천천히 내게 다가와 살며시 꺼낸 우리 이야기 해묵은 기억들 하나둘씩 떠올라 바람 따라 일렁이네 나지막이 불러보는 너의 이름은 새벽공기처럼 낯설고 아득한 기억 너머의 너의 모습 그리다 아침이 오겠지 아침이 오겠지  어느덧 벌써 굿모닝 이제 우리는 굿바이 새벽 먼지 따라 흩어지는 기억들 졸린 눈을 비비며 안녕 안녕 졸린 눈을 비비며 안녕 안녕
2011.03.20~03.26,88,3173219,입이 떨어지지 않아서,케이윌,가슴이 뛴다,2011.03.10,Ballad,"더네임,민연재",차가웠었어 내게 말은 안해도  두 눈에 고인 눈물이 이별을 말했어  눈을 감았어 가볍게 돌아선  너를 난 볼 수 없었어  손 쓸 수 없을 만큼  순식간에 끝났어  멍하니 말없이 눈물만 흘렸어  입이 떨어지지 않아서  발이 떨어지지 않아서  돌아서는 너의 얼굴  난 보고만 있었어  독한 맘을 먹지 못해서  자꾸 눈물만 쏟잖아  니가 떨어지지 않아서  숨도 못 쉬고 울고 있어    언제부터니 왜 말을 안 했니  너는 준비가 된 거니  화내건 욕을 하건  뭐라도 했어야지 눈치 없이  널 믿은 내 잘못인 거니  입이 떨어지지 않아서  발이 떨어지지 않아서  돌아서는 너의 얼굴  난 보고만 있었어  독한 맘을 먹지 못해서  자꾸 눈물만 쏟잖아  니가 떨어지지 않아서  숨도 못 쉬고 울고 있어    입이 떨어지지 않아서  발이 떨어지지 않아서  돌아서는 널  보고만 있었어  독한 맘을 먹지 못해서  자꾸 눈물만 쏟잖아  니가 떨어지지 않아서  숨도 못 쉬고 울고 있어
2011.03.20~03.26,89,3168671,oH! aH!,김형준,1st Mini Album My Girl,2011.03.08,Dance,"이트라이브,키겐",oH oH oH  oH oH a Ha Uh Huh  oH oH oH Wow  oH oH a Ha  I got u Be my girl Come on  oH oH oH Yeah  oH oH oH  넌 아직 내 마음을 몰라  애타는 나의 눈을 바라봐  넌 믿기 어렵겠지만  또 니 생각에 난 오 미쳐  Baby Baby Baby Baby Baby  오늘도 너의 뒤를 따라  몰래 숨어서 너를 바라봐  눈부신 너의 미소가  내 안에 들어와 또 미쳐  Baby Baby Baby Baby Baby  You're my beautiful girl  Be my girl  맘의 문을 열어  Be my girl  신비로운 My girl 넌 아름다워  숨을 쉴 수 없어 Baby  I don't know I don't know  I don't know I don't know  Why Why Why 오 몰라 어떻게  I don't know I don't know  I don't know I don't know  Bomb Bomb B Bomb Bomb B  Bomb Bomb B Bomb B Bomb  Yo Listen  처음 너를 본 순간 숨이 막히고  어느새 매일 너의 집 앞이고 그래  앞뒤도 안 가리고  You can call me anytime  나의 바비걸 Uh  I need your love in my life  어두운 삶 속에서 너와 내가  함께 하는 꿈을 꾸고 있어  Huh I Don't stop  아직도 내 마음을 몰라  답답해 죽을 것만 같아  넌 믿기 어렵겠지만  간절히 원해 난 다가와  Baby Baby Baby Baby Baby  You're my beautiful girl  Be my girl  맘의 문을 열어  Be my girl  신비로운 My girl 넌 아름다워  숨을 쉴 수 없어 Baby  oH oH oH oH oH a Ha  oH oH oH oH oH  oH oH oH oH oH a Ha  오 몰라 어떻게  oH oH oH oH oH a Ha  oH oH oH oH oH  Bomb Bomb B Bomb Bomb B  Bomb Bomb B Bomb B Bomb  Hey girl Oh my love 다가와줘  말해줘 말해줘  I don't know why  나도 왜 그런지 몰라  부글부글 끓어대는 애 타는 맘    You're my beautiful girl  Be my girl  맘의 문을 열어  Be my girl  신비로운 My girl 넌 아름다워  숨을 쉴 수 없어 Baby  I don't know I don't know  I don't know I don't know  Why Why Why 오 몰라 어떻게  I don't know I don't know  I don't know I don't know  Bomb Bomb B Bomb Bomb B  Bomb Bomb B Bomb B Bomb  Bomb Bomb B Bomb Bomb B  Bomb Bomb B Bomb B Bomb  oH oH a Ha  oH oH oH  oH oH a Ha
2011.03.20~03.26,90,3326860,반딧불 (후쿠야마 마사하루 리메이크),테이,반딧불 (후쿠야마 마사하루 리메이크),2011.03.21,Ballad,,정말 고마워 이거리에서 너를 만나고 나를 알게 되어서 너의 모두가 알고 싶어서 사랑할꺼야 아껴줄꺼야 어디에 있었니 왜 난 널 몰랐니 할말이 너무 많은걸 누구를 사랑해 왔던 어떤 아픔이 있다해도 이젠 네곁에 내가 있잖아 지금 나의 두눈이 너만 보잖아 화가난 얼굴도 또 웃는 얼굴도 조금 어색해도 이젠 말할수 있는걸 사랑해 너를  억지로 웃는걸 싫어하는것도 나와 닮아서 그런건가봐 때론 다르고 때론 같아서 이렇게 우리 사랑하고 있어 오늘은 내가 자란 그 동네에 가보자 너와 함께 가보고 싶어 오래된 교회와 내가 다녔던 학교 근처 너를 소개할 사람이 있어 이제 반딧불 같이 우리의 사랑을 우리의 모습을 환하게 비추자 모두사라져도 나를 비추는 사람 그게 너라면 좋겠어  지금 나의 두눈이 너만 보잖아 처음 만난 봄과 뜨겁던 여름과 돌아온 가을과 내손을 잡고 걷던 겨울을 너에게 줄께 정말 고마워 이 거리에서 나를 만나줘서 니가 곁에 있어서
2011.03.20~03.26,91,3317176,앵그리 (원제: We No Speak Americano),LPG,앵그리 (Angry),2011.03.17,Dance,,papa i'americano
