time,rank,song_id,title,singers,album,date,genre,creator,lyric2014.04.21~04.27,59,4600124,"끊어줄래 (Feat. San E, 태완)",한해,끊어줄래,2014.04.14,Rap / Hip-hop,"한해,Xepy,SanE",Brand New Music Proudly Presents  This Boy From Phantom   And He Go By The Name of 한해  We Also Got C LUV In The House   And Of Course You Know Me San E  So Ladies And Gentleman  Please Give It Up We Would Appreciate  저기 지나가는 아무데나  많은 모두에게 물어봐  네가 얼마나 예쁜지   아침에 불을 켜도 밤에   불을 꺼도 네 얼굴이 생각나  너는 죽어도 모르지만  주말이 끝나는 것보다   너랑 전화 끝내버리는게   월요일 아침보다 싫은데   네가 통화 중일 때마다   그게 남자일까봐 미치겠단말야  이젠 끊어줄래   Hang Up Hang Up  끊어줄래   Hang Up Hang Up  그 남자들과의 통화도 관계도 이젠   끊어줄래   Hang Up Hang Up  끊어줄래   Hang Up Hang Up  널 향한 수많은 시선도 약속도 이젠  안간힘을 써 티 안 내려고   네 인스타에 댓글다는  늑대들의 정모  다 밥맛 없어 네가 예쁘다느니  또 귀엽다느니   그 재수없는 껄떡거림이  더 별로인 건 걔네들의   질이 안 좋아 보여   내가 말해줄게 확실히  관상부터 변태 아니면 사기꾼아  걔네들 꺼 들어가본건 아니고   Uh 왜 전화 오자마자  폰 뒤집어  야 그런 행동들이 나의 속 뒤집어  이건 No 집착 No   진상 No 핀잔  너도 이해된다며 말 비꼬지마   사랑 앞에 쿨한게 어딨어  어눌한듯해도 확실하게   홍진호의 Diction  전부 다 끊어줘 그게 되지 않는다면  우리 사이도 부러져   이젠 끊어줄래  Hang Up Hang Up  끊어줄래   Hang Up Hang Up  그 남자들과의   통화도 관계도 이젠   끊어줄래   Hang Up Hang Up  끊어줄래   Hang Up Hang Up  널 향한 수많은  시선도 약속도 이젠 Give me attention San E A-Yo  끊어 줄래 지금 오는 폰콜 도대체 누구 두 번 다시 Don't Call Back 내 친구들 물어 왜 왜 이런 널 좋아해 난 대답해 She's Like Money 옌 달러 내게 위안 주는   Only 원 You Get It She's Like Money 옌 달러 내게 위안 주는   Only 원 C LUV 이제 끊어줄래 Hang Up Hang Up  끊어줄래 Hang Up Hang Up 그 남자들과의  통화도 관계도 이젠  끊어줄래  Hang Up Hang Up 끊어줄래  Hang Up Hang Up 널 향한 수많은 시선도 약속도 이젠
2014.04.21~04.27,60,4590769,"야하게 (Feat. 계범주, 지희필)",뉴챔프,"야하게 (Feat. 계범주, 지희필)",2014.04.15,Rap / Hip-hop,뉴챔프,야하게 좀 입지마요 비칠까봐 불안하잖아요 나만 볼꺼야 my sexy lady 야하게 좀 입지마요 너의 새끈한 바디에 그 미끈한 다리에 나 미끄러질 것 같아 니 삐끗할 것 같은 발목 넌 내 품에 쓰러질 것 같아 원피스 길이는 최전방 더 올라가면 난리나 클라라 시구하듯 웨이비한 기지개 고무고무야 팔다리가 넌 후디에 블루진만 입어도 야해 제발 남자들 좀 죽이지마 화장기 연한게 좀 더 우아해 아이라인 무섭게 그리지마 마네킹 몸매는 바비 미모는 세계가 인정했잖2  딴 놈 들 시선이 질투나 나 너때문에 데뷔했잖니 야하게 좀 입지마요 비칠까봐 불안하잖아요 나만 볼꺼야 my sexy lady 야하게 좀 입지마요 숨이 멎을 것 같애 레깅스 차림의 산책 워킹하는 기세는 슈퍼모델 진격의 여신 그렇게 걸어올때면 고장난 차 처럼 멍 때려 meganfox 앞에 입 벌린 본네트가 된 것 처럼 넌 후디에 블루진만 입어도 야해 제발 남자 들 좀 죽이지마 화장기 연한게 좀 더 우아해 아이라인 무섭게 그리지마 집에갈 땐 꼭 나한테 call 해 니 몸매 굴곡처럼 이 세상은 험해 왜 몰라 넌 가릴수록 좀 더 좀 더 궁금해지는 걸 야하게 좀 입지마요 비칠까봐 불안하잖아요 나만 볼꺼야 my sexy lady 야하게 좀 입지마요 뜨거워지네 니가뜨면 겨울왕국도 단숨에 녹겠지 서양 이목구비에 흑발이 묘하게 어울리네 마네킹이래도 속겠지 see through crop top hot pants 굳이 안입어도 넌 hot해 Box T shirt man to man high waist 뭘 입어도 니 몸매는 착해 야하게 좀 입지마요 비칠까봐 불안하잖아요 나만 볼꺼야 my sexy lady 야하게 좀 입지마요 나만 볼꺼야 my sexy lady
2014.04.21~04.27,61,4590994,Right Here Waiting,낙준(버나드박),K팝 스타 시즌3 Special Track,2014.04.09,Ballad,RichardMarx,Oceans apart day after day  And I slowly go insane  I hear your voice on the line  But it doesn't stop the pain  If I see you next to never  How can we say forever  Wherever you go  Whatever you do  I will be right here waiting for  you  Whatever it takes  Or how my heart breaks  I will be right here waiting for  you  Oh can't you see it baby You've got me goin' crazy Wherever you go Whatever you do I will be right here waiting for you Whatever it takes Or how my heart breaks I will be right here waiting for you Wherever you go Whatever you do I will be right here waiting for you Whatever it takes Or how my heart breaks I will be right here waiting for you
2014.04.21~04.27,62,4583490,소재,악동뮤지션,PLAY,2014.04.07,Dance,이찬혁,요새 마음만큼 생각이   안 따라줘  의욕은 넘치는데 소재가   다 떨어졌네요  내 이야기의 소재가 되어   줄 분 없나요  손을 높이 들고 눈을 크게 뜨고  뭐 모자는 쓰지 말고 이때   이때까지 갈고  닦았던 닦았던 너만의 걸   너만의 걸 보여봐  Show me what you have   your own  음 음 소질이 있군 충분히   소재로 쓰이겠어 I like it   너 거기 패딩 잠바 오리털이군   쓸모가 있겠어 so good   사랑은 초콜릿이다 어 미안해   흔해 다음 기회에 도전해  소재TOP STAR2 참가자 여러분  대망의 1위는 두구두구두구두  어어 어어어 어어어어어어  어어 어어어 어어어어어어  주위에 흔하디 흔한 곳에서  너를 발견하겠지 그리곤 안녕하겠지  어어 어어어 어어어어어어  어어 어어어 어어어어어어  전혀 예상하지 못한 곳에서  네가 내게 오겠지 yeah  3 2 1  전엔 익숙하던 게 쉽게   안 떠올라  두 손에 잡히는 게 없어   난 끝인가 봐요  내 이야기의 소재가 되어줄   분 없나요  피곤한 아침 허무한 밤  오늘과 같이 따분한 날  나 좀 특별하고 싶다 손   hands up  그래 솔직히 너 정돈 좀   handsome  틀리든 말든 자존심 다 무대로   올리고 이제 보여줘 보여줘  수 많은 페이지 속에 내가 한  소재로 남을 수 있게 기다려왔던 오늘을 위해 아껴둔  걸 모두 shout it out 긴장하지마 괜찮아 맘이  두근두근 거리면 거기가 내 자리야 Be where you should be 어어 어어어 어어어어어어 어어 어어어 어어어어어어 주위에 흔하디 흔한 곳에서 너를 발견하겠지 그리곤  안녕하겠지 어어 어어어 어어어어어어 어어 어어어 어어어어어어 전혀 예상하지 못한 곳에서 네가 내게 오겠지 손을 높이 들고 HEY 눈을  크게 뜨고 HEY 특별한 무대를 꿈꾸고 있는  사람 all say HEY HEY 손을 높이 들고 HEY 아껴둔  너만의 걸 보여봐 SHOW ME WHAT YOU HAVE  YOUR OWN
2014.04.21~04.27,63,4252728,처음엔 사랑이란게,버스커버스커,버스커 버스커 2집,2013.09.25,Rock,장범준,거리에 오 겹쳐진 그녀  모습 속에는  오 난 그어떤 그리움도  찾아볼 순 없군요  거리에 일렁이는 그녀  모습 속에는  오 난 그어떤 외로움도  찾아볼 순 없군요 처음엔 사랑이란 게 참 쉽게  영원할 거라 그렇게 믿었었는데 그렇게  믿었었는데 나에게 사랑이란 게 또다시  올수 있다면 그때는 가깝진 않게 그다지  멀지도 않게 난 예 벤치에 앉아있는 그녀  모습 속에는 오 난 그어떤 그리움도 찾아볼 순  없군요 벤치에 들려오는 그녀  웃음 속에는 오 난 그어떤 외로움도  찾아볼 순 없군요 처음엔 사랑이란 게 참 쉽게  영원할 거라 그렇게 믿었었는데 그렇게  믿었었는데 나에게 사랑이란 게 또다시  올수 있다면 그때는 가깝진 않게 그다지  멀지도 않게 머린 아픈데 오 너는 없고  그때 또 차오르는 니 생각에 어쩔 수 없는 나의 맘 그때의 밤 나에겐 사랑이란 게 아 사랑이란 처음엔 사랑이란 게 참 쉽게  영원할 거라 그렇게 믿었었는데 그렇게  믿었었는데 나에게 사랑이란 게 라랄라라 워 허허어 허어 워  허어허어 예 라랄라라 워 허허어 허어 워  허어허어 예
2014.04.21~04.27,64,4193337,으르렁 (Growl),EXO,The 1st Album `XOXO` Repackage,2013.08.05,Dance,서지음,Yo Okay 나 혹시 몰라 경고하는데 잘 들어 지금 위험해 So Dangerous 자꾸 나를 자극하지마 큰일 나  나도 날 몰라  숨이 자꾸 멎는다 네가 날 향해 걸어온다 나를 보며 웃는다 너도 내게 끌리는지  눈앞이 다 캄캄해 네가 뚫어져라 쳐다볼 땐 귓가에 가까워진 숨소리 날 미치게 만드는 너인걸 아무도 널 못 보게 품에 감추고 싶어 널 노리는 시선들 내 안에 일어난 거센 소용돌이  검은 그림자 내 안에 깨어나 널 보는 두 눈에 불꽃이 튄다 그녀 곁에서 모두 다 물러나 이젠 조금씩 사나워진다 나 으르렁 으르렁 으르렁 대 나 으르렁 으르렁 으르렁 대 나 으르렁 으르렁 으르렁 대 너 물러서지 않으면 다쳐도 몰라 날이 선 눈빛과 베일듯한 긴장감 지금 탐색 중이야 너의 주위를 Babe Babe Oh 넌 그냥 그대로 있어 나만을 바라보면서 절대 널 보내지 않아 두고 봐 Babe  흐린 공간속에서 선명하게 빛나는 널 노리는 시선들 내 안에 울리는 경보 울림소리 검은 그림자 내 안에 깨어나 널 보는 두 눈에 불꽃이 튄다 그녀 곁에서 모두 다 물러나 이젠 조금씩 사나워진다 나 으르렁 으르렁 으르렁 대 나 으르렁 으르렁 으르렁 대 나 으르렁 으르렁 으르렁 대 너 물러서지 않으면 다쳐도 몰라 E X O 또 다른 늑대들이 볼세라 너무나 완벽한 내 여자라 품속엔 부드럽게 너를 안고 너만을 위해서 나는 난폭해지고 결국엔 강한 자가 얻게 되는 미인 자리가 없으니까 그냥 돌아가 I win 가능성 제로야 닳으니까 그만 봐 그녀를 넘본다면 나를 먼저 넘어봐  우리 말곤 하나둘씩 지워버리자 너하고 나만 여기 남아 멈춰진 듯이 워 검은 그림자 내 안에 깨어나 널 보는 두 눈에 불꽃이 튄다 그녀 곁에서 모두 다 물러나 이젠 조금씩 사나워진다 나 으르렁 으르렁 으르렁 대 나 으르렁 으르렁 으르렁 대 나 으르렁 으르렁 으르렁 대 너 물러서지 않으면 다쳐도 몰라 나 으르렁 으르렁 으르렁 대 나 으르렁 으르렁 으르렁 대 나 으르렁 으르렁 으르렁 대 너 물러서지 않으면 다쳐도 몰라
2014.04.21~04.27,65,3174148,가슴 시린 이야기 (Feat. 용준형 Of Beast),휘성(Realslow),가슴 시린 이야기,2011.03.15,Ballad,휘성(Realslow),세상에 가장 예쁜 거짓말 goodbye goodbye 가슴 찢겨도 뱉는 그 말 goodbye goodbye 좋은 안녕이란 말 말도 안되는 그말 사랑한 만큼 믿었던 만큼 아파 아파 네가 너무 미워서 너무 슬퍼서 아파 아파 이게 이별이잖아 좋을 리가 없잖아 그래도 goodbye 안녕 미워도 너는 내사랑 사랑을 알려준 첫 사람 그런 너를 보내는 한 남자의 거짓말 goodbye goodbye 나만 느끼던 너의 체온도 goodbye goodbye 나만 맞추던 너의 입술도 goodbye goodbye 너무 절망스러워 그래도 널 위해서 남자로써 꼭 해야하는 말 goodbye goodbye 마지막으로 너를 힘껏 안고서 goodbye goodbye 늘어난 테잎처럼 무겁게 더듬대며 행복해 goodbye 안녕 미워도 너는 내사랑 사랑을 알려준 첫 사람 그런 너를 보내는 한 남자의 거짓말 goodbye goodbye 안녕 좋은 사람 만나 행복해 뻔한 드라마 속 이별 장면을 베낀다 말이 좋은 안녕이지 결국 널 누군가에게 뺏긴다 부모를 잃은 아이처럼 우리가 낳은 사랑은 버려진다 그래 이별은 너와 나의 책임이야 사랑 앞에 우린 죄인이야 울지마 바보야 나 정말 괜찮아 어떻게든 살아 행복할게 만남 사랑 추억 이별 참 고마웠었어 그 동안 이를 악물고 너를 보낼게 어떻게든 너를 잊을게 우리 둘이서 만든 가슴 시린 이야기 goodbye goodbye 안녕 미워도 너는 내사랑 사랑을 알려준 첫 사람 처음이자 마지막 너를 위한 거짓말 goodbye goodbye
2014.04.21~04.27,66,4572452,2 Years Apart,에디킴,2 Years Apart,2014.04.03,Rock,에디킴,못 참겠어 제대하고 만나고 싶은데 휴가 때마다 널 꼬시는 걸 기다려줘 그 동안은 남자 만나도 돼  대신 22시 전에 들어가 간만에 클럽이나 가볼까  옷장에서 Swag 나는 재킷을 입고 딱 그때 내 앞에 다른 남자와  있는 그녀  상관없어 Someday she's  gonna come back to me Empty heart 외로운 밤의 연속 Tell me why 전활 받지 않는 이유 My love 보고 싶은데  2 years apart oh 2 years apart  2 years apart god sake it's too long 못 참겠어 제대 아직 한참 먼 일인데  너의 인내력을 난 아는데 걔는 안 돼 예전부터 너를 노려왔어  22시 후엔 전화 받지 마 It would be hard to stay with me 2 years apart Baby just 2년 만이야 못 참겠어 근무 중에 달에게 말했어  네가 너무나 보고 싶다고  전해주오 멋진 모습으로 나타날게 다음 보름달 전 꼭 휴가 나갈게 It would be hard to stay with me 2 years apart It would be hard to stay with me 2 years apart It would be hard to stay with me 2 years apart Baby 2년 만이야 못 참겠어 제대하고 만나고 싶은데 휴가 때마다 널 꼬시는 걸 기다려줘 그동안은 남자 만나도 돼 대신 24시간 널 사랑해  오직 너를 위한  2 years apart
2014.04.21~04.27,67,4478186,Crush,2NE1,CRUSH,2014.02.27,Electronica,CL,난 모든 여자들의 뜨거운 crush  너의 심장을 뛰게 하는 rush  예쁜 언니들은 날 좋아해  날 좋아하면 예뻐지니까  They love me cuz im hot  They love me cuz im cold  They love me cuz im real  They love me cuz I kill  They love me cuz im hot  They love me cuz im cold  They love me cuz im real  They love me cuz I kill  난 두려울 게 하나 없지  나도 내 자신이  무섭게 느껴져  난 바빠  넌 TV 도 안 보니  지금 나가  말 시키지 마  나처럼 춤 출수 있다고 생각하면   나와  죽여줄게 나 하나로  너를 미치게 하는 이 music  소리 들리니  MINZY they love me  난 싸가지  난 뭘 해도 내 멋대로지  난 싸가지  모두 알잖아 I don't care  난 싸가지  난 조금도 아쉽지 않지  많은 걸 바라지는 마  난 아무도 못 말리는 싸가지  They love me cuz im hot  They love me cuz im cold  They love me cuz im real  They love me cuz I kill  They love me cuz im hot They love me cuz im cold They love me cuz im real They love me cuz I I got 21 big brothers To me you ain't big brother 난 예쁜 입술로 거침없이 말해 날 건들면 바보 너만 손해 Valentines day everyday 큐피트도 나와 사랑에 빠졌지 내 웃는 얼굴에 속지는 마 난 위험하니까 난 싸가지 난 뭘 해도 내 멋대로지 난 싸가지 모두 알잖아 I don't care 난 싸가지 난 조금도 아쉽지 않지 많은 걸 바라지는 마 난 아무도 못 말리는 싸가지 They love me cuz im hot They love me cuz im cold They love me cuz im real They love me cuz I kill They love me cuz im hot They love me cuz im cold They love me cuz im real They love me cuz I kill Come and get it i kill Come and get it i kill Yeah Come and get it i kill Come and get it i kill 놀자 hey hey hey 놀자 놀자 hey hey hey 놀자 놀자 hey hey hey 놀자 놀자 hey hey hey 놀자 hey
2014.04.21~04.27,68,4366156,"Dali, Van, Picasso",빈지노(Beenzino),"Dali, Van, Picasso",2013.12.18,Rap / Hip-hop,"HowardDietz,ArthurSchwartz",salvador dali van gogh 같이  picasso in my body  man i'm fuckin artist  i'm dali van picasso 를 보며 난 자랐어  나도 물감을 짰고  난 여기까지 왔어  and you can't tell me nothing  you know that i'm doing it right  내가 누군진 묻지마  i'm dali van picasso 반 고흐의 달이 보이는 밤  나는 물감을 고르듯 단어를 골라  오늘 밤 어떤 게  나올진 나도 잘 몰라  일단은 시작해 볼게  with a bottle of wine  얼굴은 빨갛고 온몸엔 피가 돌아  술에 취한 내 코의 모양은 피카소가  그린 그림처럼  삐뚤어졌을진 몰라도  결국엔 이런 게 돈이 될지 몰라  똑같은 주제 똑같은 느낌  동양의 2chain  man i'm also different  동양의 dali but i'm 21century  누구든 이걸 듣는다면  놀라겠지 흠칫  절대 훔칠 수 없는 내 identity  예술가들은 이게 뭔지 알겠지  겁이 없고 과감한 어린아이의 feel  난 오늘 밤 마치  salvador dali van gogh 같이  picasso in my body  man i'm fuckin artist  dali van picasso 를 보며 난 자랐어  나도 물감을 짰고  난 여기까지 왔어  and you can't tell me nothing  you know that i'm doing it right  내가 누군진 묻지마  i'm dali van picasso 아마 누군간 나를  미쳤다고 보겠지만  난 그런 걸 상관 안 하는 성격이지  물감 묻은 붓같이 끈적이는  여름 밤 내 목소린 곳곳에 퍼졌지  여름 밤하늘에 부서진 내 목소린  붉은 색 와인처럼 몽롱해  폴 고갱이 화폭에 옮긴  타히티처럼 내 심장도 뜨겁네  are you with me  are you listening  or do you hate me like  you don't feeling this shit  아마도 내가 그렇듯  예술에 미친 애들은  느끼고 있겠지 칼에 찔린 듯이  지금 이 느낌은 심상치 않네  그 누구도 이런 시도를 안 해  분명한 건 지금 내 몸 안엔  내가 아닌 누군가가 함께해  salvador dali van gogh 같이  picasso in my body  man i'm fuckin artist  i'm dali van picasso 를 보며 난 자랐어  나도 물감을 짰고  난 여기까지 왔어  and you can't tell me nothing  you know that i'm doing it right  내가 누군진 묻지마  i'm dali van picasso i'm dali van picasso i'm dali van picasso i'm dali van picasso i'm dali van picasso dali van picasso dali van picasso dali van picasso i'm dali van picasso dali van picasso
2014.04.21~04.27,69,4609566,토닥토닥 (Feat. 아웃사이더),영지,토닥토닥,2014.04.17,Ballad,"휘성(Realslow),아웃사이더",잘사네 Hello Hello Hello 그대 답없네 읽지않아 Hello 그대  확인 따위는 하지 않았어 너가 보낸 문자메시지 텅텅 빈  대화방처럼 쓸쓸한 내 맘을 알리 없는 무심한 너의 표정을  떠올리면서 거리를 맴돌아  내가 왜이러는지 넌 지금  내 속을 모르겠지  단지 너를 뒤로하고 돌아선 그 후로 끊긴 너와 내  모든 게 그저 네게는 무심 하다고 생각될지도 모르겠지만 난 지금 아파 너보다도 훨씬 더 많이 마지막 같아 내 삶의 모든게  병든 것 같아 내 심장에 불이 난 것 같아 뜨거워 불을 끌수  없어 버거워 두 다리를 묶인 듯 무거워 더 이상은 그만하자  억지로 슬픈 척 짓는 표정 따윈 역겨워 있잖아 Hello Hello Hello 아파 알잖아 Hello Hello Hello good bye 시간을 좀 갖자는 말은 떠나란 말이 아냐 그냥 날 토닥토닥 그냥 날 토닥토닥 시간을 좀 갖자는 같잖은 너의 말은 가짜야 각자가 걸어갈 그 길을 가자 난 두 번 다시 널 갖자는 같잖은 결심 따위는 갖지도 하지도 않을게 시간 지나면 상처도 아물 테니까 한숨으로  벌어진 입을 꽉 다물게 이를 꽉 깨물어 낙인 찍힌  죄인처럼 내 등 뒤를 졸졸 쫓아다니는 지울 수 없는 과거  시간이 가도 내 삶을 늘 상 따라다니는 때낼 수 없는 과보 언젠간 결국 사라질 거라고 다지며 말없이 나를 가둬 너와 헤어지던 날 고개를 떨군 내 슬픈 얼굴과 너의 두 뺨을 쓰다듬던 내  친구의 얼굴이 떠오르는 밤 있잖아 Hello Hello Hello 아파 알잖아 Hello Hello Hello Good bye 시간을 좀 갖자는 말은 떠나란 말이 아냐 그냥 날 토닥토닥 그냥 날 토닥토닥 어쩌면 어쩌면 돌아올지 몰라 있잖아 Hello Hello Hello 아파 알잖아 Hello Hello Hello Good bye 시간을 좀 갖자는 말은 떠나란 말이 아냐 그냥 날 토닥토닥 그냥 날 토닥토닥 한 번만 Hello Hello
2014.04.21~04.27,70,4597779,메트로놈 (Metronome) (Feat. Simon Dominic & Gray),박재범,메트로놈 (Metronome),2014.04.11,R&B / Soul,"박재범,사이먼도미닉,GRAY(그레이)",난 미치겠어 서로 맞다고 큰 소리쳐  하지만 무슨 말하는지   서로 듣지도 않아  네가 차가울 때 난 뜨거워  근데 한 명이 또 떠나면   가지 말라고 서로 잡아  한 순간은 서로 죽도록  미워서 말도 안 하지  하지만 키스 한 번 하면   풀리고 다시 사랑하지  Baby it's so crazy crazy  from break up to make up  이랬다가 저랬다가  like a rollercoaster  up and down   내가 원하는 건 안정감  Baby we need a Metronome  네가 빠를 때 난 느리고  템포가 안 맞아 Baby  Metronome 엇갈려 엇갈려   왜 우린 맨날 엇갈려 Baby  지금 당장 필요해  We need a Metronome  We We We need a Metronome  We We We need a Metronome  우린 박자가 안 맞아  Girl we need a Metronome  We We We need a Metronome  We We We need a Metronome  오래도 만났지 너와 나   추한 꼴도 다 본 사이   서로 약점을 알아도 참지  과거의 실수는 kryptonite  불안하기만 한 행복감   언제 어떻게 터질지 몰라  싸우는 이유는 적어도 알지만   문제는 자기 잘못을 잘 못 봐   넌 내게 예전 같지 않대   그래 예전 같을 순 없는 건 사실   남자니까 결국 끝엔 내 탓이다   져주지만 솔직히 좀 가식   끝까지 가자던 약속 결국   이렇게 끝까지 왔지근데 오해 마  내 맘 절대 안 식었다고   몇 번 말해 쉬어가자는 거지  속에 말들을 꺼내놓기엔  우린 많이 지쳤고 인생도 피곤해  미안해서 미안하고 잘못해서   잘못했단 변명도 치졸해  가끔 너무 정열적이지   그런 욕망 땜에 과열되는 관계가   다 타버릴까 봐 좀 겁이 나   이것 땜에 맘 꽤나 쓴 시간들이   아깝고 안타까울 뿐  착하고 아름다운 꿈을 얘기하던   그 입술을 다시 느끼고 파   난 그 마음뿐 둘이   템포를 첨부터 맞춰야 돼   tick tock metronome  빨리 만나서 얘기해   진짜 이별하기 전 며칠 안으로   Baby we need a Metronome  네가 빠를 때 난 느리고  템포가 안 맞아 Baby  Metronome 엇갈려 엇갈려   왜 우린 맨날 엇갈려 Baby  지금 당장 필요해  We need a Metronome  We We We need a Metronome  We We We need a Metronome  우린 박자가 안 맞아  Girl we need a Metronome  We We We need a Metronome  We We We need a Metronome Baby it's so crazy crazy  from break up to make up  이랬다가 저랬다가  like a rollercoaster  up and down   up and down   내가 원하는 건 안정감  Baby it's so crazy crazy  from break up to make up  이랬다가 저랬다가   like a rollercoaster  up and down   up and down   내가 원하는 건   Girl we need  Baby we need a Metronome  네가 빠를 때 난 느리고  템포가 안 맞아 Baby  Metronome 엇갈려 엇갈려   왜 우린 맨날 엇갈려 Baby  지금 당장 필요해  We need a Metronome  We We We need a Metronome  We We We need a Metronome  우린 박자가 안 맞아  Girl we need a Metronome We We We need a Metronome We We We need a Metronome 지금 당장 필요해 We need a Metronome
2014.04.21~04.27,71,3436083,끝사랑,김범수,Solista Part.2,2011.06.16,Ballad,윤사라,내가 이렇게 아픈데  그댄 어떨까요 원래 떠나는 사람이  더 힘든 법인데 아무 말하지 말아요  그대 마음 알아요 간신히 참고 있는 날  울게 하지 마요 이별은 시간을 멈추게 하니까 모든걸 빼앗고 추억만 주니까 아무리 웃어 보려고  안간힘 써 봐도 밥 먹다가도 울겠지만 그대 오직 그대만이 내 첫사랑 내 끝사랑 지금부터 달라질 수 없는  한 가지 그대만이 영원한 내 사랑 그대도 나처럼 잘못했었다면 그 곁에 머물기 수월했을까요 사랑해 떠난다는 말 과분하다는 말 코웃음 치던 나였지만 그대 오직 그대만이 내 첫사랑 내 끝사랑 지금부터 그대  나를 잊고 살아도 그대만이 영원한 내 사랑 나는 다시는 사랑을 못할 것 같아요 그대가 아니면
