time,rank,song_id,title,singers,album,date,genre,creator,lyric
2013.12.02~12.08,1,4342054,이별남녀,"서인국,지아",이별남녀,2013.12.02,Ballad,김지향,반년이 지나고 나서야 난  니 번호를 어렵게 지웠는데   한 달도 채 안돼서 넌  또 다른 사랑을 시작했어  우리는 뜨겁지도   차갑지도 않았어  그런 벼랑 끝에 우린   헤어진게 당연한 얘기  누가 잘못해서가 아냐  낮과 밤이 지나듯  사랑도 변했다고  날 위로해도  공평하지가 않아  우린 같은 사랑을 했었는데  같은 이별을 했는데  왜 나만 아파  친구로 시작했던 우리   친구보다 못한 사이가 됐어  사랑은 뜨겁지도   차갑지도 않았어  슬픈 결말 끝에   우린 마주보며 서있던 거야  누가 잘못해서가 아냐 낮과 밤이 지나듯 사랑도 변했다고 날 위로해도 공평하지가 않아 우린 같은 사랑을 했었는데 같은 이별을 했는데 왜 나만 아파 나쁜 꿈을 꾸고 있어  혼자 사랑하고 이별 했나봐 날 깨워줘  사랑은 악몽일 뿐 내가 잘못한게 맞나봐 모두 내 잘못 같아 네게 못해준 것만 자꾸 떠올라 아직도 눈물이나 우린 정말 사랑을 했었는데 영원할 줄 알았는데 넌 가버렸어 공평하지가 않아 우린 같은 사랑을 했었는데 같은 이별을 했는데 왜 나만 아파 감정이 없는 사람처럼 난 사랑을 못해 두려워 난 이젠
2013.12.02~12.08,2,4328659,그리워해요,2NE1,그리워해요,2013.11.21,Ballad,TEDDY,그렇게 너무 편하게 굴지 마요 아직 너와 난 남남이니까 어린애처럼 보채지 좀 마요 아직 시작도 안 했으니까 아이들의 불장난 같은 사랑은 싫어 조금 움츠려 있을 뿐이야 난 괜찮아 아냐 사실 난 나를 떠나 보낸 그가 아직 너무 미워요 차갑게 식어버린 내 가슴은 아직도 그를 그리워해요 그리워해요 그리워해요 그리워해요 그리워해요 그렇게 너무 밝히지 좀 마요 세상은 원래 어두우니까 어쩜 그렇게 해맑게 웃어요 what 자세히 보니 슬픈 표정이야 I know I’ve been there before 어른들의 계산적인 사랑은 싫어 살짝 지쳐있을 뿐이야 난 괜찮아 아냐 사실 난 나를 떠나 보낸 그가 아직 너무 미워요 차갑게 식어버린 내 가슴은 아직도 그를 그리워해요 그리워해요 그리워해요 그리워해요 그리워해요 나의 젊은 날의 사랑은 이렇게 끝이 나네요 그대 꼭 행복해야 해요 오랜 시간이 지나가도 우리 서로 기억해요 그땐 서로가 있었음을 그땐 서로가 있었음을
2013.12.02~12.08,3,4333566,너 밖에 몰라 (One Way Love),효린,LOVE&HATE,2013.11.26,Dance,용감한형제,Yeah you think I’m selfish That’s what I thought about you You need to get it straight Oh no no so selfish love You’re so selfish boy ye 먹고 싶은 것도 니가 다 정하고 하고 싶은 것도 니 멋대로 하네 다투고 화 풀 때도 니 방식대로 하고 내 의견 그리 별로 중요하지 않아 우린 아직 사랑을 몰라 넌 아직 겪어 봐야 돼 더욱더 아파 봐야 해 우린 아직 이별을 몰라 넌 정말 나쁜 남자야 후회하게 될 거야 너 밖에 몰라 넌 너 밖에 몰라 왜 너 밖에 몰라 왜 니 생각만 해 Boy 너 밖에 몰라 넌 너 밖에 몰라 왜 너 밖에 몰라 나 좀 미치게 하지 마 one way one way 내 사랑 일방통행 no way no way 멋대로 하지 좀 마 one way one way 내 사랑 일방통행 no way no way 내 주위 사람 만나지 못하게 하면서 넌 밤새워 술 마시고 뭐 하러 다녀 내 맘이 썩어가는 줄도 모르면서 니 친구들 챙기기에 넌 정신 없어 우린 아직 사랑을 몰라 넌 아직 겪어 봐야 돼 더욱더 아파 봐야 해 우린 아직 이별을 몰라 넌 정말 나쁜 남자야 후회하게 될 거야 너 밖에 몰라 넌 너 밖에 몰라 왜 너 밖에 몰라 왜 니 생각만 해 Boy 너 밖에 몰라 넌 너 밖에 몰라 왜 너 밖에 몰라 나 좀 미치게 하지 마 one way one way 내 사랑 일방통행 no way no way 멋대로 하지 좀 마 one way one way 내 사랑 일방통행 no way no way 너 지금 말 다했어 뭐를 결정할 때 마다 사랑이나 배려 따윈 없이 주구장창 너만 생각하는 이기적인 남자고 난 피해자 다시 생각해도 계속 후회가 안 봐도 뻔해 니 친구들에게 내 얘기를 어떻게 했을지 왜 몰라 그건 니 얼굴에 침 뱉기 물어봐 니가 하는게 사랑인지 one way one way 내 사랑 일방통행 no way no way 멋대로 하지 좀 마 one way one way 내 사랑 일방통행 no way no way
2013.12.02~12.08,4,4340421,Special Love,"휘성(Realslow),거미",Special Love,2013.11.29,R&B / Soul,휘성(Realslow),Special Love    대화 따위는 필요 없어 서로  눈빛으로 모든 걸 알 수 있어  뭔가 흐름이 좋아 이 만남이 주는  기분에 난 취하고 있어 황홀한 이 느낌 더 깊이  알고 싶은 너 어지러운 느낌 사랑이  아닌가 싶어  You're my special love  너를 본 순간 세상이  다 흔들렸어  이건 완벽한 행운인걸  정말 완벽한 행복인걸 오늘 이전의 날 버렸어  너의 여자로 다시 태어난 날  따뜻하게 껴안아줘   번쩍 널 안아 든 채 어디도  못 가게 잡고 싶은 맘뿐이야 황홀한 이 느낌 더 깊이  알고 싶은 너  어지러운 느낌 사랑이  아닌가 싶어  You're my special love  너를 본 순간 세상이 다 흔들렸어  이건 완벽한 행운인걸  정말 완벽한 행복인걸  My boy My girl We're special love  We're special love special love  그대로의 널 원해 우릴  어쩔 수 없어 떼어 낼 수 없어  special love 황홀한 이 느낌 더 깊이  알고 싶은 너  어지러운 느낌 사랑이  아닌가 싶어  You're my special love  너를 본 순간 세상이 다 흔들렸어  오 미치도록 황홀한 이 느낌  더 깊이 알고 싶은 너  어지러운 느낌 사랑이  아닌가 싶어  You're my special love  너를 본 순간 세상이 다 흔들렸어  이건 완벽한 행운인걸  정말 완벽한 행복인걸  우린 완벽한 만남인걸
2013.12.02~12.08,5,4333791,코끝에 겨울,어반자카파,[03],2013.12.03,Ballad,조현아(어반자카파),점차 나아지겠지 혼자 내렸던  그 모든 결론이  마치 먼지처럼 흩어져  사라져 버리던 날 그저 한숨만 내쉬던 날  도저히 견딜 수 없다  누군가 내게 건네온 계절  코끝에 먼저 와버린 차가운 겨울  내내 오지 않길 기도해도  이젠 무색해져 버린  따뜻한 내 두 손  다시 어디론가 가야 하는 나  길이 있기만을 바라며 두 손으로 훔쳐낸 눈물  어지러운 공기 나 숨이 막혀  가만히 두 눈을 다시 감고  내일이 오길 기도해 본다 냉정한 공기가  다시 겨울을 내게 건넨다 함께 나누던 공기 함께 나누던  그 모든 기억이 마치 먼지처럼 흩어져  사라져 버리던 날 붉어진 눈으로 거릴  헤매던 날  도저히 견딜 수 없다  누군가 내게 건네온 이별 코끝에 먼저 와 버린 차가운 겨울  내내 오지 않길 기도해도  이젠 무색해져 버린  따뜻한 내 두 손  다시 어디론가 가야 하는 나  길이 있기만을 바라며 두 손으로 훔쳐낸 눈물  어지러운 공기 나 숨이 막혀  가만히 두 눈을 다시 감고  내일이 오길 기도해 본다 냉정한 공기가 다시  겨울을 내게 건넨다 슬퍼 눈을 감아 슬퍼 눈을 감아
2013.12.02~12.08,6,4309790,편지,다비치,DAVICHI CODE,2013.11.12,Ballad,전해성,유난히 부은 두 눈이  혹시 밤새 울었는지 전할 것 있다 짧게 끊은 어제 전화  또 불안한 지금  넌 금방 이라도 울어 버릴 것 같아  아무 말 못 걸겠잖아  던지듯 내 손 꼭 쥐어 준 채로  네가 사라진 뒤  미친 듯 써 내려간  한 장의 편질 이제야 읽어봤어 나도 미친 듯이 따라가서  널 불러 보지만  찬바람 싸늘하게  코 끝을 스치며 나에게 말해줘 너는 가고 없다고 보내주라고  낯 설은 이 아침 햇살  네가 없는 하루하루 사랑했지만 사랑만으론 부족한  너와 나 우리  난 금방 이라도 눈물 흘릴 것 같아  그때가 생각 나잖아  던지듯 내 손 꼭 쥐어 준 채로  네가 떠나던 날  미친 듯 써 내려간  한 장의 편질 이제야 읽어봤어 나도 미친 듯이 따라가서  널 불러 보지만 찬바람 싸늘하게 코 끝을 스치며  나에게 말해줘 너는 가고 없다고 보내주라고  보내주라고 미친 듯 써 내려간  한 장의 편질 이제야 읽어봤어 이제야 읽어봤어  나도 미친 듯이 따라가서  널 불러 보지만 찬바람 싸늘하게 코 끝을 스치며  나에게 말해줘 너는 가고 없다고 보내주라고  보내주라고
2013.12.02~12.08,7,4328770,이별식탁 (Feat. 산체스 Of 팬텀),SanE,`Not` Based On The True Story,2013.11.21,Rap / Hip-hop,"SanE,Xepy",밥 한 끼 먹자 안돼 밥 한 끼 먹는 건데 왜 우리 헤어졌잖아 부탁이야 응 한 번만 하그래 나갈게 마지막으로 밥 한 끼 먹자 내가 사줄게 걱정하지 마 손도 잡지 않을게 그냥 전처럼 함께 식탁에 앉아 맛있게 먹는 네 모습 보고 싶은 게 다야 네 문자 좀 늦겠다 차가 막히네 내 답장 천천히 와 오는 길 조심해 네가 염려한 곤란한 자리 듣기 불편할 말 입과 접시에 안 담을 테니 baby I just wanna feed you 배부르게 해주고픈 게 이유 네가 저기 오며 미안해 많이 기다렸지 난 평소와 같이 아냐 배고프지 일단 앉아 나름 신경 쓴 식탁 맘에 들었으면 해 모자란 내 마지막 정성이야 웃자 자꾸 왜 울어 정말 음식 다 식겠어 그만 울고 한 입만 들어 내가 맘대로 주문했어 괜찮지 너 연어 좋아하잖아 우리 꽤 됐지 이런데 온 지 어때 야경 참 좋지 더 많이 좋은 곳 데려갔어야 했는데 여기요 물 좀 더 갖다 줄 수 있어요 자꾸 목이 타네 네 불편한 건 없어요 울지 마 네가 자꾸 우니까 우릴 다 쳐다보잖아 그만 뚝 어서요 good girl 오늘 너 진심 예쁘다 네 새 남자친구 누군지 정말 행운아 그 사람 잘해줘 착해 술 버릇은 혹시 사진 갖고 있 oh sorry hu 음식 진짜 맛있다 예약하느라 고생했어 어디 가 화장 번져 화장실 다녀온다고 아냐 제발 지금 말고 일단 앉아 나름 신경 쓴 식탁 맘에 들었으면 해 모자란 내 마지막 정성이야 웃자 자꾸 왜 울어 정말 음식 다 식겠어 그만 울고 한 입만 들어 음식 다 식겠어 이별 식탁 맛있게 먹자 다 먹고 나면 네가 잊혀질까 그건 아니겠지 하지만  우리의 이별 식탁 이 밤이 가면 다신 네 모습 보지 못하니까 담아두고 싶어 그러니 일단 앉아 나름 신경 쓴 식탁 맘에 들었으면 해 모자란 내 마지막 정성이야 웃자 자꾸 왜 울어 정말 음식 다 식겠어 그만 울고 한 입만 들어 음식 다 식겠어 thank you I can let you go out  of my life now good bye
2013.12.02~12.08,8,4308010,Hush,미쓰에이,Hush,2013.11.06,Dance,"이트라이브,민연재",숨 소리가 들려 yeah   몸이 녹아 내려 yeah   견딜 수가 없어 yeah   참을 수가 없어 yeah   숨이 달아 올라 yeah   자꾸 똑바로 난 yeah   걷 잡을 수 없어   I'm loosing control   내가 왜이러니   Hurry Hurry Boy   너를 원해   Kiss Kiss Kiss baby   Hush Hush Hush baby   좀 더 가까이   날 꼭 안아줘   Give it 2 me   Give it 2 me oh   Come to me   Come to me oh   Give it 2 me   Give it 2 me oh   비밀스런 Party   Kiss Kiss Kiss baby   Hush Hush Hush baby   Hot Hot 뜨겁게   날 꼭 녹여줘   Give it 2 me   Give it 2 me oh   Come to me   Come to me oh   Give it 2 me   Give it 2 me oh   숨 소리가 들려 yeah   몸이 녹아 내려 yeah   견딜 수가 없어 yeah   참을 수가 없어 yeah   숨이 달아 올라 yeah   자꾸 똑바로 난 yeah   걷 잡을 수 없어   I'm loosing control   내가 왜이러니   Hurry Hurry Boy   너를 원해   Kiss Kiss Kiss baby   Hush Hush Hush baby   좀 더 가까이   날 꼭 안아줘   Give it 2 me   Give it 2 me oh   Come to me   Come to me oh   Give it 2 me   Give it 2 me oh   비밀스런 Party   Kiss Kiss Kiss baby   Hush Hush Hush baby   Hot Hot 뜨겁게   날 꼭 녹여줘   Give it 2 me   Give it 2 me oh   Come to me   Come to me oh   Give it 2 me   Give it 2 me oh   Ah ha   힐끔 힐끔 눈치보지마   이미 들켰어   웃지 말고 뒤 돌아서   롤리 롤리 롤리팝보다   니가 맛있어   꽉 깨물어 주고 싶어 너를 원해   Kiss Kiss Kiss baby   Hush Hush Hush baby   좀 더 가까이   날 꼭 안아줘   Give it 2 me   Give it 2 me oh   Come to me   Come to me oh   Give it 2 me   Give it 2 me oh   비밀스런 Party   Kiss Kiss Kiss baby   Hush Hush Hush baby   Hot Hot 뜨겁게  날 꼭 녹여줘   Give it 2 me   Give it 2 me oh   Come to me   Come to me oh   Give it 2 me   Give it 2 me oh   숨 소리가 들려 yeah  몸이 녹아 내려 yeah  견딜 수가 없어 yeah  참을 수가 없어 yeah
2013.12.02~12.08,9,4312933,향기만 남아,허각,Reminisce,2013.11.11,Ballad,라도,멀리서 불어와 날 스쳐 지나는  너를 떠올리게 하는 익숙한 향기 아직까지 널 잊지  못하는 걸 보니 바보 같아 언젠가는 저 바람처럼  흩어지겠지 향기만 남아서 나를 괴롭히는데  무뎌진 기억 너머로 너를 그리다 쓸쓸한 바람에 휘날리는 추억  이렇게 슬플 땐 누가  나를 위로해주나 두 눈을 감으면 또 니가 생각나  난 또 또 혼자 남아  이 거리를 또 헤매이다 아주 작은 떨림에 끌려  문득 고개를 들어보니  우리 같이 함께 불렀던  그 노래가 들려와 향기만 남아서 나를 괴롭히는데  무뎌진 기억 너머로 너를 그리다 쓸쓸한 바람에 휘날리는 추억  이렇게 슬플 땐  누가 나를 위로해주나 멀어지는 널 붙잡고 싶지만  언제나 그랬듯이  너를 잊고 살겠지 아련했던 너의 기억  아름다웠던 그 추억  아직도 널 닮은 향기만 남아 어느새 하루가 저물어 가네  짙은 추억만 남기고 멀어져 가네 혹시라도 니가 또 생각 날까봐  아무렇지 않게 하루를 살아 언젠간 널 다시 만날 수가 있을까  다른 사람으로 널 잊을 수 있을까 누구를 만나도 행복해야만 해  다시는 볼 수 없는 너  향기만 남아
2013.12.02~12.08,10,4336120,잊혀진다는 거,노을,흔적,2013.11.27,Ballad,최규성,우리 처음 헤어지던날 그때는 이별을 몰랐고 며칠쯤인가 지나갔을때 오지않는 너의전화가  참 어색해 텅빈 문자들이 너없는 하루가 우리가 사랑은 했었나 많은곳에 네 모습들이 어느새 점점 잊혀져가고 시간이 지나면  더 잊혀질거란게 그게 더 아파 뭔가 맘이그래 이제 정말 우린 끝난건가봐 너없는게 실감나 우리 사랑했던거  모두다 지워져가 매일같이 함께 했었던 널보며 행복했던 날들도 돌아오라고 너를 찾았던 밤 보고싶다고 밤새워 숨어울던 그 모든게 이제 멀어져만 가는게 난 그게 더아파 하나둘씩 정리를하다 문득 이 생각이 들었어 네게 미안한게 참 많더라 모자랐던 나라  표현하지 못했었던 그때 나에게 아쉬움이 많아 이제 정말 우린 끝난건가봐 너없는게 실감나 널 사랑했었던게  모두다 지워져가 매일같이 함께했었던 널보며 행복했던 날들도 돌아오라고 너를 찾았던 밤 보고싶다고 밤새워 숨어울던 그 모든게 이제 잊혀져만가는게 난 그게 더아파 정말 아프던날 네가 많이 보고싶었어 어렸던 난 네가 너무미워서 너도 힘들기를 바랬어 나 없이 너도 아팠으면 머릿속 선명한 네 번호 습관처럼 변한말투들 너무 따뜻했던 네 온기 그리운 모든것들이 잊혀진다는거 그게 아파
2013.12.02~12.08,11,4294284,내일은 없어,트러블메이커,Chemistry,2013.10.28,Dance,"신사동호랭이,라도,LE(EXID)",우우우우 Tell me now now now 우우우우 Tell me now now now 우우우우 오늘이 끝나기 전에 Tell me now now now now now now 그대로 멈춘 네가 날 또 망설이게 하고 아무 말도 안 하는 넌 그저 어제와 같아 여과 없이 말해 봐 내 눈을 좀  바라봐 봐 이 밤이 가버리기 전에 불빛이  사라지기 전에 이렇게는 떠나가지 말자 망설이는 동안 시간은 또  간다 고고고고 I don't wanna go 이게 마지막 지금이  마지막이라고오오오오 지금 나에게 와 말해 줘 우리에게  내일은 없어 망설이지 마 더 늦기 전에 Now 더 멀리 더 멀리 날 밀어내지 말고 우리 둘이 지금 여기서 사라지기 전에 우우우우 Tell me now now now 우우우우 Tell me now now now 우우우우 오늘이 끝나기 전에 Tell me now now now now now now 더 이상 우리에겐 없어 내일은 내일은 그러니까 불러줘 어 Call my name 내 이름 지금 당장 네 입에서 꺼내 털어놔  이 길에서 나 그냥 네게 기대고만 싶어  기대고 싶어 이렇게 또 멀어지지 말자 망설이는 동안 시간은 또  간다고고고고 I don't wanna go 여기가 마지막 오늘이  마지막이라고오오오오 지금 나에게 와 말해 줘 우리에게  내일은 없어 망설이지 마 더 늦기 전에 Now 더 멀리 더 멀리 날 밀어내지 말고 우리 둘이 지금 여기서 사라지기 전에 우리 같이 있는 이 미로 속에 기댈 수 있는 건 너뿐이야 눈 감아 내게 안겨 내일은 또 없으니까 지금 나에게 와 말해 줘 우리에게  내일은 없어 망설이지 마 더 늦기 전에 Now 더 멀리 더 멀리 날 밀어내지 말고 우리 둘이 지금 여기서 사라지기 전에 우우우우 Tell me now now now 우우우우 Tell me now now now 우우우우 오늘이 끝나기 전에 Tell me now now now now now now
2013.12.02~12.08,12,4312955,거짓말 거짓말 거짓말,이적,고독의 의미,2013.11.15,Ballad,이적,다시 돌아올 거라고 했잖아  잠깐이면 될 거라고 했잖아  여기 서 있으라 말했었잖아  거짓말 거짓말 거짓말  물끄러미 선 채 해가 저물고  웅크리고 앉아 밤이 깊어도  결국 너는 나타나지 않잖아  거짓말 음 거짓말  우우 그대만을  하염없이 기다렸는데  우우 그대 말을  철석같이 믿었었는데  우우우우우  찬 바람에 길은 얼어붙고  우우우우우  나도 새하얗게 얼어버렸네  내겐 잘못이 없다고 했잖아  나는 좋은 사람이라 했잖아  상처까지 안아준다 했잖아  거짓말 거짓말 음  다시 나는 홀로 남겨진 거고  모든 추억들은 버리는 거고  역시 나는 자격이 없는 거지  거짓말 음  우우 그대만을  하염없이 기다렸는데  우우 그대 말을  철석같이 믿었었는데  우우우우우 찬 바람에 길은 얼어붙고  우우우우우  나도 새하얗게 얼어버렸네  철석같이 믿었었는데  거짓말 거짓말 거짓말
2013.12.02~12.08,13,4347674,12월의 기적 (Miracles In December),EXO,겨울 스페셜 앨범 `12월의 기적 (Miracles In December)`,2013.12.09,Ballad,윤사라,보이지 않는 널 찾으려고 애쓰다   들리지 않는 널 들으려 애쓰다   보이지 않던 게 보이고   들리지 않던 게 들려   너 나를 떠난 뒤로 내겐 없던   힘이 생겼어   늘 나밖에 몰랐었던 이기적인   내가 yeah  네 맘도 몰라줬던 무심한 내가   이렇게도 달라졌다는 게 나조차   믿기지 않아   네 사랑은 이렇게 계속 날 움직여  난 생각만 하면 세상을 너로   채울 수 있어 음   눈송이 하나가 네 눈물 한   방울이니까   단 한 가지 못하는 것은 널   내게로 오게 하는 일   이 초라한 초능력 이젠 없었으면   좋겠어 우   늘 나밖에 몰랐었던 이기적인 내가  네 맘도 몰라줬던 무심한 내가   이렇게도 달라졌다는 게 나조차   믿기지 않아   네 사랑은 이렇게 계속 날 움직여   시간을 멈춰 네게 돌아가   추억의 책은 너의 페이지를 열어   난 그 안에 있어 오   너와 함께 있는 걸   아주 조그맣고 약한 사람이   너의 사랑이   이렇게 모든 걸 내 삶을 모두   바꾼 걸 세상을 모두   오 사랑이 고마운 줄 몰랐었던   내가 오   끝나면 그만인 줄 알았던 내가 오   너 원했던 그 모습 그대로 날마다   나를 고쳐 가   내 사랑은 끝없이 계속될 것 같아   시간을 멈춰 오 이제 나  네게 돌아가 네게 돌아가  추억의 책은 오 오늘도  너의 페이지를 열어  난 그 안에 있어 오  그 겨울에 와있는걸 보이지 않는 널 찾으려고 애쓰다  들리지 않는 널 들으려 애쓰다
2013.12.02~12.08,14,4317286,밤이 오는 거리 (Feat. 다이나믹듀오),노을,밤이 오는 거리,2013.11.13,Ballad,"개코,최자,최규성",밤이 오는 이 거리  어느 새 많은 사람들  차가워진 계절에   네가 생각나는 이 밤  차갑게 식은 밤   거리는 내리는 비가 적시고  메마른 내 맘은 몇 잔의 술이 적시고  참 딱하기도 하지 보고 있어 아직  지우지 못한 전화기 속   문자들 네 사진  널 아직도 못 보낸   내 자신이 너무 구차해서 분해  하다가도 갑자기 밀려 와   끝까지 잡지 못한 후회  터진 수도관처럼 그리움이 물이 돼  쏟아져 넘쳐 내 눈에  이젠 익숙해져가   나 없이 보낼 네 모습도  누군가에 안겨서 함께 있을 모습도   내 입에 입 맞추던   널 안고 밤을 새우던   그때처럼 어딘가에서  밤이 오는 거리 어느새 많은 사람들  달라진 계절에 괜히 조금 울적한 밤  어느 샌가  취해져 가면  또 괜히 네 생각이 나는 지금 이 거리  요즘 내 기분처럼   큰 폭으로 움직이는 일교차  분주한 밤에 뒤편에서   독한 Liquor Shot 열정에 사로잡혀 있던  그때 그 날씨에 비해 지금 공기는 많이  날카로운 기분 oh 스웨터를 꺼냈어  몇 계절 전에 입었던 지웠던 잊었던 힘겹게 비웠던 너의 모습과 옷에  묻어있는 너의 체취 떠올라도 웃어 넘기지 못해  무뎌진 재치 거리에 수많은 불빛 담배연기 떠나가는 사람들  남은 잔을 모두 비우고 일어날 때 쯤 내가 많이 취했나 봐 지금 내 머릿속엔 계속  네 얼굴만 생각나 밤이 오는 거리  어느새 많은 사람들 달라진 계절에 괜히 조금 울적한 밤 어느 샌가 취해져 가면 또 괜히 네 생각이 나는 지금 이 거리 공기는 쌀쌀해 날  떠나던 그 날의 네 목소리처럼 나 혼자야 나 버려졌던  그 날의 그 거리처럼 내가 짐처럼 느껴졌다던  마지막 얘기처럼 이 밤은 너무 잔인해  난 울었어 애기처럼 산소가 없는 듯한 거리위에 신경질적인 네온의 깜빡임이  오늘따라 괜히 성가셔 밤이 오는 거리  어느새 많은 사람들 달라진 계절에 괜히 조금 울적한 밤 어느 샌가 취해져 가면 또 괜히 네 생각이 나는 지금 이 거리
