time,rank,song_id,title,singers,album,date,genre,creator,lyric2013.06.10~06.16,69,4108627,헬로,유승우,첫번째 소풍,2013.05.08,Rock,유승우,힘들고 외롭고 지겨운   하루하루가  사랑으로 바뀐 건  그대 마음 때문이죠 내일은 또 뭘 하고  누굴 만나야 하는지  잊을 수 있게 한 건  그대 마음 때문이죠  다가와서 hello  나의 marshmallow oh oh oh   만나요 tomOrrow  사랑을 품에 안고  따뜻한 하늘과 드라이브  하는 건 어때요  시원한 바람 그댈 위한 선물이죠  지나온 날들이  아까울 필요는 없죠  함께할 날이 더 많은 우린걸요  변하지만 않기로  다가와서 hello  나의 marshmallow oh oh oh  만나요 tomOrrow  사랑을 품에 안고  다가와서 hello  나의 marshmallow oh yeah  오 그대와 손을 흔들며 hello  다가와서 hello 나의 marshmallow oh oh oh 만나요 tomOrrow 사랑을 품에 안고 다가와서 hello 그댄 나의 marshmallow oh oh oh 오 그대와 손을 흔들며 오 그대와 손을 흔들며 오 그대와 손을 흔들며 hello
2013.06.10~06.16,70,4105677,이 노래를 듣고 돌아와,2PM,Grown,2013.05.06,Dance,박진영,이 노랠 듣고 돌아와 이 노랠 듣고 돌아와 있을 땐 몰랐어 떠나고서도 몰랐어 하지만 시간이 지난 후에야  깨닫게 되었어 누구를 만나도 계속 니 생각이 나서 점점 두려워 졌어  널 보낸 게 잘못한 일 같아서 어떡해 나 뒤늦게 이제와 널 보낸 걸 후회하고 있잖아 너를 울려 놓고  다시 돌려 세울 자신이 없어  하지만  Give me one more chance 이 노랠 듣고 돌아와 이 노랠 듣고 돌아와 이 노랠 듣고 돌아와 어디에 있든 누구와 있든 잘못했으니 돌아와 후회하니까 돌아와 이 노랠 듣고 돌아와 어디에 있든 누구와 있든지 어디까지 갔니  이미 맘이 돌아섰니 나 때문에 다친 가슴이 딱딱하게 다 굳었니 어떡해 나 뒤늦게 이제와 널 보낸 걸 후회하고 있잖아 너를 울려 놓고  다시 돌려 세울 자신이 없어  하지만  Give me one more chance 이 노랠 듣고 돌아와 이 노랠 듣고 돌아와 이 노랠 듣고 돌아와 어디에 있든 누구와 있든 잘못했으니 돌아와 후회하니까 돌아와 이 노랠 듣고 돌아와 어디에 있든 누구와 있든지 Baby Stop  내게 돌아와  내겐 너 하나 라는 걸  알고 있잖아 잘못한 거 알아 맞아  니가 나를 떠나자 마자  그리움이 자라 감정이 차 올라 이제 난 너 하나밖에 몰라  그 동안 왜 이 말을  못했는지 몰라 미안해 그리고 사랑해 이 노랠 듣고 돌아와 이 노랠 듣고 돌아와 이 노랠 듣고 돌아와 어디에 있든 누구와 있든 잘못했으니 돌아와 후회하니까 돌아와 이 노랠 듣고 돌아와 어디에 있든 누구와 있든지
2013.06.10~06.16,71,3946867,"Officially Missing You, Too","긱스(Geeks),소유(SOYOU)",re;code Episode I,2012.11.01,Ballad,"긱스(Geeks),최재우","애써 너에게 건냈던 말 good bye 이젠 혼자 남게된 이 밤 without you 난 아직도, I'm officially  missing you 널 기다리던 밤처럼 길고 어둡던 우리 사이 공백 이게 끝이 아니길 바래 I wanna go back 너가 원하던 거 다 고친 지금에야 넌 어디로 갔는지 난 홀로 남아 lonely 오늘 따라 부는 바람도 참 시린 것 같은데 넌 왜이리 멀쩡해 보이는 건지 눈치도 없는 너지만 예전처럼만 웃어주면 돼 Ooo can't nobody do it like you Said every little thing you do Hey baby say it stays on my mind And I I'm officially missing you 나에겐 너 하나뿐인 걸 너 땜에 아파하는 걸 널 잊으려고 노력해봐도 잘 안돼 널 미워하는 건 too hard 너무 어려워 날 몰라주는 너도 서러워 I'm officially missing you officially missing you yeah I'm officially missing you, too 내가 아무 말도 하지 못한 이유 우리 사이 공백은 너무 길고 어떤 단어보다 너가 meaningful on another round 더 멀어져 가며 흘러가는 어색했던 오늘 하루가 내겐 아쉽고 어제로 남아있어 이 밤이 지나도 아직도 여기 있어 여전히 내 머릿속 너 때문에 늘 뒤척거리는 매일 밤  내 마음만 더 지쳐가 가로등 불은 거릴 비춰 흔들거리는 속을 변기 위에 비워 어 아무리 속을 비워도 남은 추억으로 취해 어지럽고 girl 난 아직 기댈 곳이 필요해 so 이 노래로 너를 씻어내 습관처럼 그리워해 날 보며 웃는 니 사진을 내 두 눈에 담고 미소를 지으면 다시 할 수 있을까 oh 그날처럼 나에겐 너 하나뿐인 걸 너 땜에 아파하는 걸 널 잊으려고 노력해봐도 잘 안돼 널 미워하는 건 추억 속 너에겐 못된 일이라 난 할 수가 없어 이렇게 널 그리워하는 날 알고 있는지 나에겐 너 하나뿐인 걸 너 땜에 아파하는 걸 널 잊으려고 노력해봐도 잘 안돼 널 미워하는 건 too hard 너무 어려워 날 몰라주는 너도 서러워 I'm officially missing you officially missing you can't nobody do it like you Said every little thing you do Hey baby say it stays on my mind And I I'm officially missing you"
2013.06.10~06.16,72,4011596,눈물샤워 (Feat. 에일리),배치기,4집 Part.2,2013.01.14,Rap / Hip-hop,"탁,무웅",그대 눈에 보였죠 넘실거리는 슬픈 내 눈물이 아직 가슴에 차고 남아 한없이 두볼에 흐르고 있죠 지지리도 궁상이지 애써 짓는 미소조차 이리 울상인지 글썽이는 두눈에 맺힌 내 처량한 모습 이리 불쌍한지 자꾸 멍해져 목젖부터 울컥거리는게 툭치면 눈물이 쏟아질 것 같애 내가 나를 알기에 널 잡지 못했던 후회속에 질질 짜는 못난 놈 왜 난 너에게 좀 더 나은 사람이 될 수 없었는지에 대한 한탄 속에 왜 난 떠나가는 너의 뒷모습을 바라보기만 할 수밖에 없던  자책 속에 마지막엔 알아야 했어 너의 이기적인 가슴은 다른 설레임을 원한 걸 우는 와중에도 밥은 넘기는거 보니 그래도 계속 살고 싶긴 한가보네 그대 눈에 보였죠 넘실거리는 슬픈 내 눈물이 아직 가슴에 차고 남아 한없이 두볼에 흐르고 있죠 아무 일 없는 듯 웃고 싶어요 날 감싸는 추억이 또 날 붙잡죠 이 눈물이 그대의 두눈에도 흐르고 있을까요 처음엔 한방울 한방울 그러다 왈칵 쏟아지며 한참을 쥐뿔도 뭐 없는 내 꼴을 알기에 아쉬움도 갖지 못해 한탄을 아직도 남은 네 존재를 억지로 떨궈낸 내 속이 타는데 냉정히 날 두고 떠나갈만큼 나 형편없는 남자였나 기다려달란 말도 지친다 기약없는 말 더는 널 묶어둘 자신도 모면할 핑계도 댈 수가 없어서 더 감추지 못한 채 모자란 모습만 네게 보이고 마는 내 지지리도 못나고 꼬질한 내 모습 눈물로 씻어내 보낸다 그대 눈에 보였죠 넘실거리는 슬픈 내 눈물이 아직 가슴에 차고 남아 한없이 두볼에 흐르고 있죠 애꿎은 눈물만 흘리는 날 놔줘 네 품이 아닌 곳에 이제 날 놔줘 후회와 지나간 날들의 기억속에 갇혀 가슴 아픈 나 청승맞게 불 꺼놓고 이불을 머리 끝까지 덮어놓고 베개 위에 얼굴 엎어 놓고 샤워해 샤워 눈물샤워 청승맞게 불 꺼놓고 이불을 머리 끝까지 덮어놓고 베개 위에 얼굴 엎어 놓고 샤워해 샤워 눈물샤워 그대 눈에 보였죠 넘실거리는 슬픈 내 눈물이 아직 가슴에 차고 남아 한없이 두볼에 흐르고 있죠
2013.06.10~06.16,73,4084675,웃다 울다,서인국,웃다 울다,2013.04.11,Ballad,"김지향,MELODESIGN",몇 달 만에 차려 입고 내  친구들을 만났어 한 친구 놈이 눈치 없이  또 내게 물었어 몰라보겠다고 다이어트 하냐고 내게 물었어 자꾸 물었어 그대 때문에 난 밥도 못 먹고 그대 때문에 난 잠도 못 자서 매일 난 이렇게  겨우 버티며 산다고  말하고 싶었지만 눈물이  날 것만 같아서 또 웃고 말았어 또 웃고 말았어 내 가족과 친구 모두 다 너의 안부만 물어 식당엘 가도 어딜 가도 왜  혼자만 왔냐고 난 그럴 때마다 자꾸만 실감나  니가 없단 게 내게 없단 게 그대 때문에 난 밥도 못 먹고 그대 때문에 난 잠도 못 자서 매일 난 이렇게  겨우 버티며 산다고  말하고 싶었지만 눈물이  날 것만 같아서 웃고 말았어 누가 물어도 자꾸 물어도 니 이름 하나 꺼내지 못해 그 한 마디에 모든 게 다 쏟아져 나올까 봐 눈물 날까 봐 난 더 크게 웃고 생각 날까 봐 딴 얘기만 해도  그럴수록 니 가 자꾸만 더 그리워 돌아오는 길에 이런 내가  바보 같아서  울고 말았어 그만 참지 못하고 울어 버렸어
2013.06.10~06.16,74,4074795,들었다 놨다 (Love Actually),"써니힐,데이브레이크(DAYBREAK)",re;code Episode III,2013.04.05,Ballad,데이브레이크(DAYBREAK),처음 너를 본 순간 정신  차릴 수 없어 내 마음을 들킬까봐  조심조심해 어떡하면 네 맘을 답답해진  내 맘을 쫄깃해진 심장이 나 어쩌면 좋아 가까워졌다 점점 멀어져가는  이상해 울다가 웃다 나 좀 내버려둬요  언제나  이랬다 저랬다 헷갈려 그대는 내 맘을 들었다 놨다  들었다 놨다 들었다 놨다 hey 내 맘을 들었다 놨다  들었다 놨다 들었다 놨다 hey 내 맘을 들었다 놨다  들었다 놨다 들었다 놨다 hey 내 맘을 들었다 놨다  들었다 놨다 hey 홀로 걷고 있는 이 거리가  오늘따라 유난히 길게만  느껴질까 햇살이 좋은 날 눈치가 없는 말  이럴수록 네가 더 보고싶잖아 어느 박자에 맞춰줘야 될지  감이 안잡혀 또 많이 헷갈려 No 오늘도 셀 수 없이 들었다 놨다해  니 멋대로 내 맘에  들어왔다 갔다해 다시 너를 본 순간 차갑게  대해보려 애써 관심 없는 듯이 외면 했지만 너의 눈빛 하나에 너의  손짓 하나에 바짝바짝 말라버려 나의 입술은 멀어져갔다 다시  다가와주는 오늘도 울다가 웃다 점점  짜증이나요 언제나  이랬다 저랬다 헷갈려 그대는 내 맘을 들었다 놨다 들었다 놨다 들었다 놨다 hey 내 맘을 들었다 놨다 들었다 놨다 들었다 놨다 hey 내 맘을 들었다 놨다 들었다 놨다 들었다 놨다 hey 내 맘을 들었다 놨다 들었다  놨다 hey 그대의 가슴이 그대의 심장이  나는 두근두근 그대만 사랑해 그대만 기억해  난 또 두근두근 내 맘을 들었다 놨다 들었다 놨다 들었다 놨다 hey 내 맘을 들었다 놨다 들었다 놨다 들었다 놨다 hey 내 맘을 들었다 놨다 들었다 놨다 들었다 놨다 hey 내 맘을 들었다 놨다 들었다  놨다 hey 오 어떡하면 그대를 내 맘속에  가둬둘 수 있을까 오 어떡하면 그대를 내 맘속에  가둬둘 수 있을까 들었다 놨다 hey  들었다 놨다 hey  들었다 놨다 hey
2013.06.10~06.16,75,4138609,Summer Time,씨스타,Give It To Me,2013.06.11,Dance,"로빈,iHwak",뜨겁게 비추는 저 태양과 파란  하늘 둘이 놀러 가요  지금 우리 둘이서만 Summer time Summer time  I got a feeling 두근대는 느낌 꼭 잡은 두 손 놓치지 말고  나와 함께 뛰어봐요 Summer Time 하루 종일 고민해서  예쁜 옷을 샀어 오늘만을 생각해서  며칠을 못 잤어 I just make it good day  오늘은 holiday 벌써부터 떨려  내 가슴이 떨려 뭘 해줄까 고민돼서  요리책도 봤어 맘에 들까 걱정돼서  연습도 해봤어 I just make it good day  완벽한 것 같아 벌써부터 떨려 두근두근 떨려 뜨겁게 비추는 저 태양과  파란 하늘 둘이 놀러 가요  지금 우리 둘이서만 Summer time Summer time  I got a feeling 두근대는 느낌  꼭 잡은 두 손 놓치지 말고  나와 함께 뛰어봐요 Summer Time Let's go Let's go baby 하늘 높이 tonight  걱정 따윈 모두 다 버리고  Let's go Let's go baby  하늘 높이 tonight  둘이 놀러 가요 Summer time 넌 절대 모르게 몰래  오늘밤 떠올리면 설레 내 촉을 모두 세워  네 맘 속을 볼래 오늘 나 고백해  취한 척이라도 해  딱 오늘부터 난  Yes I'm your Lady 감췄던 내 진심을  이제 고백할래  도도한 컨셉 따위  오늘만 버릴래 I just make it good day  우리들의 sweet day 벌써부터 떨려 두근두근 떨려 영원히 oh 간직될  추억에 빠져봐요  Oh 둘이 놀러 가요  그래요 단 둘이서만 Summer time Summer time  I got a feeling 두근대는 느낌  꼭 잡은 두 손 놓치지 말고  나와 함께 뛰어봐요 So good time  햇살이 또 한번 비출 때까지 Be the shine  이 밤이 가고 지칠 때까지 you are mine  그냥 다 필요 없고 아침까지  hey wo Summer time Summer time  I got a feeling  두근대는 느낌 꼭 잡은 두 손 놓치지 말고  나와 함께 뛰어봐요  Summer Time Let's go Let's go baby  하늘 높이 tonight 걱정 따윈 모두 다 버리고 Let's go Let's go baby  하늘 높이 tonight 둘이 놀러 가요  summer time
2013.06.10~06.16,76,4138610,일주일 (A Week),씨스타,Give It To Me,2013.06.11,Ballad,"이단옆차기,DavidKim",네 생각나는 Monday  왠지 궁금한 Tuesday 고백해 버릴까 Wednesday  어떻게 기다려 볼까 불안해져 가는 Thursday  네 전화가 울린 Friday 널 만나러 가는 Saturday  너로 가득한 나의 일주일 Beautiful day  나와 그댄  사랑이란 말이  참 어렵나 봐요 매일 매일 잠 못 이루고 일주일 내내 서로 사랑을 써요 하루하루 지날수록 난 불안해  어디론가 사라질까봐 맘에 걸려 걱정 돼 자꾸자꾸 머릿속에 맴도는데  몇 번이나 연습해도  서로 먼저 고백할 용기를 못 내 I know you want me boy and  You know I want you too 나도 모르게 그냥 네가 너무  좋아져 사랑을 속삭여줘  사랑을 보여 줘봐 Tell me that your love don't  stop Tell me that your love  don't stop Beautiful day  나와 그댄  사랑이란 말이  참 어렵나 봐요 매일 매일 잠 못 이루고 일주일 내내 서로 사랑을 써요 라디오나 TV 틀어보면 재밌는  사랑노래 나오면 그게 우리 이야기였으면 허나  맘대로 잘 안 돼 앞에 서면 I like your style boy You so fly  boy so don't be shy boy 입에 쉽게 나오지 않아도 네 가슴  안에 담은 것 좀 열어줘 보라고 네가 날리는 미소  나에게만 보여줄 거라  믿고 있어 어떻게 모든 여자들이  빠져들 것만 같아  Can you be my special man 사랑을 별로 난 해본 적이 없어서  생긴 거에 비해 아직 많이 몰라서 Come and lead me  남자답게 먼저 이끌어 달라고  내게와 어서 I know you want me boy and  You know I want you too 나도 모르게 그냥 네가 너무  좋아져 사랑을 속삭여 줘  사랑을 보여줘 봐 Tell me that your love don't  stop Tell me that your love  don't stop Beautiful day  나와 그댄  사랑이란 말이  참 어렵나 봐요 매일 매일 잠 못 이루고 일주일 내내 서로 사랑을 써요 네 생각나는 Monday  왠지 궁금한 Tuesday 고백해 버릴까 Wednesday  어떻게 기다려 볼까 불안해져 가는 Thursday  네 전화가 울린 Friday 널 만나러 가는 Saturday  너로 가득한 나의 일주일 Beautiful day  나와 그댄  사랑이란 말이  참 어렵나 봐요 매일 매일 잠 못 이루고 일주일 내내 서로 사랑을 써요
2013.06.10~06.16,77,4058544,니 눈 니 코 니 입술 (Feat. 79),2BIC(투빅),Back To Black,2013.03.15,Ballad,79,baby you are my lady  I`m so lonely you make me feeling  you are my lady I`m so lonely  you make me feeling  tell me my baby 처음 너를 봤을 때부터 난  baby 자꾸만 설레었어  가슴이 널 바라봤어 두 눈이  머리부터 발 끝까지 너는  love it  화려하지 않아도 아름다운  너의 미소  너의 눈 코 예쁜 너의 입술  사랑스런 너인걸 you know what  바람결에 날리던 머리결  니가 좋아 maybe I love you baby you 너인걸 너 뿐인걸  사랑해 널 lady  너 없인 you 하루도 1분도 1초도 난 안 돼 너를 처음 봤을 때 부터 난 사진을 찍듯이 내 눈에  찰칵 담아놓은 순간  너는 나를 자꾸 바라바라봐  넌 다가다가와  교회를 다니고 술도 안 마시고  담배도 안 피고  넌 정말 나의 천사  네게 말했지 난 너의 신사  너만의 기사  24시간을 통화해도 call me  언제 넌 하늘에서 왔는지  날갠 어디 숨겼는지 오늘밤도 잠 못 이뤄 나는  don`t sleep  문잘 썼다 지웠다 너에 대한  나의 고백  너의 눈 코 예쁜 너의 입술  눈을 뗄 수 없는 걸 you know what  바람결에 날리던 머리결  눈이 부셔 maybe I love you baby you 너인걸 너 뿐인걸  사랑해 널 lady 너 없인 you 하루도 1분도 1초도 난 안 돼 내가 눈에 차지 않아도  조금만 조금 더 시간을 줘  oh lady  너를 정말 사랑하니까  그것만 믿고 날 기다려 줘  I love you maybe I love you baby you 너만 바라보는 바보가 될래  without you lady 너 없인 you 하루도 1분도 1초도 난 안 돼 너의 두 눈 너의 그 입술  너의 눈썹 너의 그 손가락  하나라도 예쁘지 않은 곳이 없어  니가 없인 살수가 없어  사랑은 정말 얄궂은 놈인가요  너는 아직 나를 몰라요  널 사랑하는 걸
2013.06.10~06.16,78,4103138,차 마실래?,헬로비너스,3rd Mini Album (차 마실래?),2013.05.02,Dance,"이기(오레오),서용배(TENTEN)",Hey listen up  Where you at now  You ready to tell me boy  우리 만난 지   벌써 100일째 아직은   서로 어색하기만 해  오랜만에 너와의 데이트   어떡해 어떡해 해가 벌써 지는데  Everyday Everynight   언제쯤 더 가까워질까  여자라서 말도 못하고  Studpid Boy Silly Boy   더 이상 기다릴 수 없어  오늘은 용기 내서 말할게요  저녁 해가 진 후에   어둠이 내린 후에   나를 집으로 데려다 주세요  벌써 헤어지긴 싫어요   날 좀 더 알고 싶나요  그러면 들어와서 차 마실래요 혼자인 밤은 참 길어요   그댈 더 알고 싶어요  아침이 올 때까지 부탁할게요 Hey boy listen  너와 갔던 그 카페  이제는 우리 집에서 나와 함께  부끄럽지만   내가 용기 내 말해볼게  우리 집에서 차 마실래  이상해 궁금해   나를 사랑하긴 하는 거니  아니면 날 아껴준 거니  아니야 바보야   내가 원한 건 이게 아니야  자존심 버리고서 말할게요  저녁 해가 진 후에   어둠이 내린 후에   나를 집으로 데려다 주세요  벌써 헤어지긴 싫어요   날 좀 더 알고 싶나요  그러면 들어와서 차 마실래요  차 마실래요 들어와요  같이 있고 싶어 너와 나 둘이서   집으로 오는 내내 고민했어   나 바보처럼   서 있지 말고 다가와  먼저 눈치채주면 좋을 텐데 저녁 해가 진 후에  어둠이 내린 후에  나를 집으로 데려다 주세요 벌써 헤어지긴 싫어요  날 좀 더 알고 싶나요 그러면 들어와서 차 마실래요 혼자인 밤은 참 길어요  그댈 더 알고 싶어요 아침이 올 때까지 부탁할게요
2013.06.10~06.16,79,4079025,Somebody,"15&amp;(박지민,백예린)",Somebody,2013.04.07,Dance,심은지,I want somebody body   somebody body   somebody to love yeah  I want somebody body   somebody body   somebody to love yeah  너는 별 감동이 없어 너는 좀   느낌이 안 와   그냥 다른 애들 같아 됐어 됐어   that’ all   뻔한 첫 사랑얘기도 내겐 남의   일일 뿐인걸   슬픈 짝사랑 얘기도 이만하면   된 것 같은데   u 보고도 모르고 왔어도 못 본 채   그렇게 지나갔나   u 매일 난 기다려 u  I want somebody body  somebody body   somebody to love yeah  I want somebody body  somebody body   somebody to love yeah  I want somebody body  somebody body   somebody to love yeah  I want somebody body  somebody body   somebody to love yeah  똑같은 작업 멘트들  시시한 유머 같은 걸  건네 준 니 선물들도  감동이 하나 없는 걸  u 보고도 모르고 왔어도 못 본 채  그렇게 지나갔나  u 매일 난 기다려 yeah  I need you to say 난 모르겠어  잘 모르겠어 힘든 게 사랑이래도  한번쯤 아파 보고 아파도 또  웃어보는  상상해 그 이상의 사랑이  올 수 있다고  this is all I want to say  u know I want to be loved be  loved be loved  be lo lo lo ved baby  somebody for my love  somebody for your love  somebody for my heart somebody for your heart somebody for body for body  for my love somebody for your love  somebody  for your heart yeah  I need you to say 난 모르겠어  잘 모르겠어 힘든 게 사랑이래도  한번 쯤 아파 보고 아파도  또 웃어보는  상상해 그 이상의 사랑이  올 수 있다고  this is all I want to say  u know I want to be loved  I want somebody body somebody body  somebody to love yeah I want somebody body somebody body  somebody to love yeah I want somebody body somebody body  somebody to love yeah I want somebody body somebody body  somebody to love yeah
2013.06.10~06.16,80,4099465,Why So Serious?,SHINee(샤이니),SHINee The 3rd Album Chapter 2. `Why So Serious?,2013.04.26,Dance,kenzie,자정 막 지난 새벽  진흙 속 눈 뜬 무언가  모두 나를 무서워했지 앞으로 뻗은 두 팔 난 살아있는 워킹데드 그 숨은 차가웠지 숨 쉬는 게 지겨워질 쯤 그 때 그대 발견 So shocked Why So Serious 로미오와 줄리엣 슬픈 러브스토리가 아 아니야 다 잘 될 거야 결국 해피 엔딩을 아는 넌 연애소설 매니악 먼지만 풀썩대던 심장 엔진을 Re New 핏기 없던 나의 입술이 다시 붉은 컬러 루즈 Baby 날 어떻게 생각해 Baby 어떻게 생각해 난 무섭지 않아요 So get in get in 이 긴 어둠이 언제부터였는지 기억도 안 나네 대충 백 년 전 그냥 그댈 본 날부터 시작이다 이제부턴 그게 더 중요하니까 이런 좀비 영화 어디서 본 것 같은데 Oh no 이건 특별해 비틀대는 걸음으로 걷자 그게 우리 사랑 방식 Why So Serious 로미오와 줄리엣 슬픈 러브스토리가 아 아니야 다 잘 될 거야 결국 해피 엔딩을 아는 넌 연애소설 매니악 먼지만 풀썩대던 심장 엔진을 Re New 핏기 없던 나의 입술이 다시 붉은 컬러 루즈 Baby 날 어떻게 생각해 Baby 어떻게 생각해 우린 다르지 않아 벌써 닮아가고 있는걸 해 지면 나와 거리를 허우적대며 헤매 뇌 따윈 없이 보이겠지만 다들 고민 있겠지 See 휴머니즘 그런 거 몰라 그냥 널 사랑하게 돼 내 피는 다시 뜨거워져 그 모든 이유는 그대 Come on 다음 씬의 클라이막스 막 시작 돼 이 음악이 더욱 더 커지면 우린 살아있어 Tonight Why So Serious 로미오와 줄리엣 슬픈 러브스토리가 아 아니야 다 잘 될 거야 결국 해피 엔딩을 아는 넌 연애소설 매니악 먼지만 풀썩대던 심장 엔진을 Re New 핏기 없던 나의 입술이 다시 붉은 컬러 루즈 Baby 날 어떻게 생각해 Baby 어떻게 생각해 우린 다르지 않아 벌써 닮아가고 있는걸
2013.06.10~06.16,81,4082947,Officially Missing You,악동뮤지션,SBS K팝 스타 시즌2 Top 2 Special,2013.04.10,Folk,,하나둘 내 곁을 떠나가는 아마도  다른 사람으로 만날 oh please tell me why'd you  have to go cause this pain  I feel it won't go away 하나도 슬프지는 않았을 줄  한가득 남아있는 흔적들 같이 웃고 운 기억에 today  I'm officially missing you Ooh can't nobody do it  like you Say every little thing you do hey baby Say it stays  on my mind And I I'm  officially missing you I'm officially missing you  지나 온 추억 여름에서부터  추워진 오늘까지도 함께 꿈  꾼 하나의 소원 가는 길이 같아 서로 더  깊어지는 맘 일이 잘 안  풀려도 발 뻗고 기뻐 자는 밤 방을 채우던 온기를 몰아낸  외로운 공기 옹기종기 모여  부르던 노래의 향기 yeah I'm officially missing  them I'm officially  missing you Well I thought I could  just get over you 아직  붙어있는 너의 이름표 But I see that's something  I just can't do 연습장에  빼곡히 그린 음표 지금은 아쉬움만 안고 떠났지만  언젠가 한 꿈에 다시 오르길 All I hear is raindrops  falling on the rooftop  Oh baby tell me why'd  you have to go 'Cause this pain I feel  it won't go away And  today Ooh can't nobody do  it like you Say every little thing  you do hey baby Say it stays  on my mind And I'm  officially missing  하나둘 내 곁을 떠나가는  아마도 다른 사람으로 만날
