time,rank,song_id,title,singers,album,date,genre,creator,lyric
2014.04.21~04.27,1,4583482,200%,악동뮤지션,PLAY,2014.04.07,Folk,이찬혁,uh 나를봐 나를봐 나를봐  날 바라봐 바라봐 바라봐  너를 본 내 마음속에 사랑이  내 본능이 고백 빨리 하라 해  네 주위를 둘러싼 수많은 경쟁자  Yes I'm a soldier for you  sweet멘트 장전  발사하기 전에 제군들  입 풀었나 yes 완전  간장콩장콩장장 equals   간 콩장장  Yeah I'm ready  아침이 깨는 소리 Morning   바람들은  makes harmony  저물어가는 달빛은  let it go uh  여물어가는 romance   꿈꾸고 good night  Hey baby it's comin' new day  새로운 느낌이야 이건  Hey 왜 이래  It's common lovesick  아무래도 이거는 이거는  It must be L O V E 200 percent  sure of that  I want you really I mean really 정말이야 널 좋아하는데  빨갛게 익은   내 얼굴이 그걸 증명해  나를 봐 나를 봐 나를 봐  날 바라봐 바라봐 바라봐   난 strawberry처럼   very very  상큼한 사람   don't worry worry  어리바리한 그대   주위 사람들은 모두 다 이기주의  밤낮을 걸으며 널 지켜줄  나와 달리 그들은   차 키를 과시하지만   BAD GUY  자다가 일어나 잠꼬대로도 널 찾네   아침이 깨는 소리 Morning  바람들은  makes harmony  저물어가는 달빛은   let it go   여물어가는  romance 꿈꾸고  Hello 어디 가는 거니   where you  I'll be there  네가 있는 그 거리   that way  아직 우리 사이 서먹해도  그래도 try는 해봐야지 나라도  It must be L O V E 200 percent  sure of that  I want you really I mean really 정말이야 널 좋아하는데  빨갛게 익은 내 얼굴이 그걸 증명해  처음이야 이런 기분  멈추질 못하겠어 막 넘쳐  누가 잠가놓은 듯 내 입은  네 앞에서 오물쪼물 안 열려  내 부름에 뒤를 돌아보는   네 두 눈을 보니  I said see you tomorrow  Oh baby it can't be over like this  someone help me   내 맘을 전할 수 있다면  사실은 나 널 oh please  좋아하는데 I'm sure  모든 걸 담은 이 눈빛이 그걸 증명해  It must be L O V E 200 percent  sure of that  I want you really I mean really 정말이야 널 좋아하는데  빨갛게 익은 내 얼굴이 그걸 증명해  It must be L O V E
2014.04.21~04.27,2,4579468,봄 사랑 벚꽃 말고,"HIGH4(하이포),아이유",봄 사랑 벚꽃 말고,2014.04.08,Ballad,아이유,길었던 겨우내 줄곧 품이 좀 남는 밤색 코트 그 속에 나를 쏙 감추고 걸음을 재촉해 걸었어 그런데 사람들 말이 너만 아직도 왜 그러니 그제서야 둘러보니 어느새 봄이 손 잡고 걸을 사람 하나 없는 내게 달콤한 봄바람이 너무해 나만 빼고 다 사랑에 빠져 봄노래를 부르고 꽃잎이 피어나 눈 앞에 살랑거려도 난 다른 얘기가 듣고 싶어 한바탕 휩쓸고 지나가버릴 오오 봄 사랑 벚꽃 말고 봄 사랑 벚꽃 말고 봄 사랑 벚꽃 말고 봄 사랑 벚꽃 말고 손에 닿지도 않을 말로 날 꿈틀거리게 하지 말어 맘 먹고 밖에 나가도 막상 뭐 별 거 있나 손 잡고 걸을 사람 하나 없는 내게 오 사랑노래들이 너무해 나만 빼고 다 사랑에 빠져 봄노래를 부르고 꽃잎이 피어나 눈 앞에 살랑거려도 난 다른 얘기가 듣고 싶어 한바탕 휩쓸고 지나가버릴 오오 봄 사랑 벚꽃 말고 남들보다 절실한 사랑 노래 가사를 불러 봐 수많은 연인들 가운데 왜 나는 혼자만 똑같은 거리와 어제와 같은 옷차림 난 제자린데 왜 세상은 변한 것만 같지 누군가와 봄길을 거닐고 할 필욘 없지만 누구나 한번쯤은 머물고 싶은 그런 기억을 만들고 싶어 떨어지는 벚꽃잎도 엔딩이 아닌 봄의 시작이듯 사실은 요즘 옛날 생각이 나 걷기만 해도 그리워지니까 다시 느낄 수 있나 궁금해지지만 Then you know what 나만 빼고 다 사랑에 빠져 봄노래를 부르고 꽃잎이 피어나 눈 앞에 살랑거려도 난 다른 얘기가 듣고 싶어 한바탕 휩쓸고 지나가버릴 오오 봄 사랑 벚꽃 말고 봄 사랑 벚꽃 말고 봄 사랑 벚꽃 말고 봄 사랑 벚꽃 말고 봄 사랑 벚꽃 말고
2014.04.21~04.27,3,4562881,Mr. Chu (On Stage),Apink(에이핑크),Pink Blossom,2014.03.31,Dance,"이단옆차기,DavidKim",한번 보면 두 번 더 보고 싶어  두번 세번 보면 너를 더 안고 싶어  너와 커플링 커플링 손에 끼고서  함께 이 길을 걷고 싶어 난   매일 매일 봐도 난 더 좋아져  두번 세번 나의 볼을 꼬집어 봐도   마치 Dreaming Dreaming  꿈을 꾸는 듯  생각만 해도 난 미소가   Mr. Chu  입술 위에 Chu  달콤하게 Chu  온몸에 난 힘이 풀려  내 맘 흔들 흔들어 날 흔들어놔요  I'm falling falling for your love   Hey you 입술 위에 Chu  Everyday with you  널 보면 내 눈이 감겨  몰래 살짝 다가와 또 키스해줄래  내 꿈결 같은 넌 나만의 Mr. Chu 부드러운 감촉 잊을 수 없어  화끈거리는 내 얼굴 빨개지는 걸   It's so lovely lovely  사랑스러워  난 네가 자꾸만 좋아져  Mr. Chu  입술 위에 Chu  달콤하게 Chu  온몸에 난 힘이 풀려  내 맘 흔들 흔들어 날 흔들어놔요  I'm falling falling for your love   Hey you 입술 위에 Chu  Everyday with you  널 보면 내 눈이 감겨  몰래 살짝 다가와 또 키스해줄래  내 꿈결 같은 넌 나만의   내 소원을 들어줘요  영원한 사랑 이뤄주길  짜릿짜릿한 느낌 절대 맘 변하지 않기 평생 나만 바라봐줘 baby  Mr. Chu 입술 위에 Chu 달콤하게 Chu 온몸에 난 힘이 풀려 내 맘 흔들 흔들어 날 흔들어놔요 I'm falling falling for your love Hey you 입술 위에 Chu Everyday with you 널 보면 내 눈이 감겨 몰래 살짝 다가와 또 키스해줄래 내 꿈결 같은 넌 나만의 Mr. Chu
2014.04.21~04.27,4,4543502,야생화,박효신,야생화,2014.03.28,Ballad,"박효신,김지향",하얗게 피어난 얼음 꽃 하나가 달가운 바람에 얼굴을 내밀어 아무 말 못했던 이름도 몰랐던 지나간 날들에 눈물이 흘러 차가운 바람에 숨어 있다 한줄기 햇살에 몸 녹이다 그렇게 너는 또 한번 내게 온다 좋았던 기억만 그리운 마음만 니가 떠나간 그 길 위에 이렇게 남아 서있다  잊혀질 만큼만 괜찮을 만큼만 눈물 머금고  기다린 떨림 끝에  다시 나를 피우리라 사랑은 피고 또 지는  타버리는 불꽃 빗물에 젖을까 두 눈을 감는다 어리고 작았던 나의 맘에 눈부시게 빛나던 추억 속에 그렇게 너를 또 한번 불러본다 좋았던 기억만 그리운 마음만 니가 떠나간 그 길 위에 이렇게 남아 서있다  잊혀질 만큼만 괜찮을 만큼만 눈물 머금고 기다린 떨림 끝에 다시 나는  메말라가는땅 위에 온몸이 타 들어가고 내 손끝에 남은 너의 향기 흩어져 날아가 멀어져 가는 너의 손을 붙잡지 못해 아프다 살아갈 만큼만 미워했던 만큼만 먼 훗날 너를 데려다 줄  그 봄이 오면 그날에 나 피우리라
2014.04.21~04.27,5,4582959,인연,"윤민수,신용재(포맨)",불후의 명곡 - 전설을 노래하다 (이선희 2편),2014.04.05,Ballad,이선희,인연이라고 하죠 거부  할 수가 없죠 이 사랑이 녹슬지 않도록  늘 닦아 비출게요 약속해요 이 순간이 다 지나고 다시 보게 되는 그 날 모든걸 버리고 그대 곁에 서서 남은 길을 가리란 걸 인연이라고 하죠 거부 할 수가 없죠 내 생애 이처럼 아름다운 날 또 다시 올 수 있을까요 우우 우우우 우우우우우 우우우 우우 우 취한 듯 만남은 짧았지만 빗장 열어 자리했죠 맺지 못한대도 후회하진 않죠 영원한건 없으니까 운명이라고 하죠 거부 할 수가 없죠 내 생애 이처럼 아름다운 날 또 다시 올 수 있을까요 고달픈 삶의 길에 당신은 선물인걸 이 사랑이 녹슬지 않도록 늘 닦아 비출게요 고달픈 삶의 길에 당신은 선물인걸 이 사랑이 녹슬지 않도록 늘  닦아 비출게요 나 그대에게 나 그대에게 우워 평생 이곳에서 늘 기다리고 기다릴게요 우워  나 그대여 잊지 말아요 하고픈 말 많지만 당신은  아실테죠 먼 길 돌아 만나게 되는  날 다신 놓지 말아요 이 생애 못다한 사랑 이 생애  못다한 인연 먼 길 돌아 다시 만나는 날 나를 놓지 말아요 나를 놓지  말아요
2014.04.21~04.27,6,4599628,티가 나나봐,"15&amp;(박지민,백예린)",티가 나나봐,2014.04.13,R&B / Soul,박진영,티가 나나 봐 다 보이나 봐  티가 나나 봐 다 보이나 봐 I think I'm in love  아무리 티를 안 내려고 해봐도  하루 종일 미소가 계속 흘러나와  니가 내 맘속에 심어 논  사랑 때문에 사랑해  티가 나나 봐 다 보이나 봐  No 내 눈빛이 내 미소에  모두 다 쓰여있어서  티가 났나 봐 다 보이나 봐  No 아무 말도 안 했는데  사람들이 모두 알아  I'm in love I'm in love  Oh I'm in love  햇살이 왜 이렇게 빛나는지  I'm in love I'm in love  Oh I'm in love  바람이 왜 이렇게 상쾌한지  꿈을 꾸는건지 마법에 빠졌는지  모르겠지만 나를 깨우지 마요  꿈이기엔 너무  사실 같고 사실이기엔  I miss you  너무나 꿈만 같으니 제발  티가 나나 봐 다 보이나 봐   No 내 눈빛에 내 미소에  모두 다 쓰여있어서  티가 났나 봐 도저히 난  다 보이나 봐 감출 수 없어  아무 말도 안 했는데  사람들이 모두 알아  I'm in love I'm in love  Oh I'm in love  햇살이 왜 이렇게 빛나는지  I'm in love I'm in love  Oh I'm in love  바람이 왜 이렇게 상쾌한지  I'm in love I'm in love Oh I'm in love 햇살이 왜 이렇게 빛나는지 I'm in love I'm in love Oh I'm in love 바람이 왜 이렇게 상쾌한지
2014.04.21~04.27,7,4433490,썸 (Feat. 릴보이 Of 긱스),"소유(SOYOU),정기고",썸,2014.02.07,R&B / Soul,"민연재,Xepy,에스나(eSNa),릴보이(긱스),정기고",썸 (Feat. 릴보이 Of 긱스)  가끔씩 나도 모르게 짜증이나  너를 향한 맘은 변하지 않았는데 혹시 내가 이상한 걸까  혼자 힘들게 지내고 있었어 텅 빈 방 혼자 멍하니 뒤척이다  티비에는 어제 본 것 같은 드라마  잠이 들 때까지 한번도  울리지 않는 핸드폰을 들고  요즘 따라 내꺼인 듯  내꺼 아닌 내꺼 같은 너 니꺼인 듯 니꺼 아닌  니꺼 같은 나 이게 무슨 사이인 건지 사실  헷갈려 무뚝뚝하게 굴지마 연인인 듯 연인 아닌 연인 같은 너 나만 볼 듯  애매하게 날 대하는 너  때로는 친구 같다는 말이  괜히 요즘 난 듣기 싫어 졌어 매일 아침 너의 문자에  눈을 뜨고 하루 끝에는  니 목소리에 잠들고 파 주말에는 많은 사람 속에서  보란 듯이 널 끌어 안고 싶어 요즘 따라 내꺼인 듯  내꺼 아닌 내꺼 같은 너 니꺼인 듯 니꺼 아닌  니꺼 같은 나 때로는 친구 같다는 말이  괜히 요즘 난 듣기 싫어 졌어 너 요즘 너 별로야 너 별로야  나 근데 난 너뿐이야  난 너뿐이야 분명하게 내게 선을 그어줘  자꾸 뒤로 빼지 말고  날 사랑한다 고백해 줘 여전히 친구인척 또 연인인척  행동하는 모습을 전부다 돌이켜 생각 할 수록 너의 진심이  더 궁금해지는 걸 girl you’re so ambiguous 난 못해  무엇도 아니 어쩌면  기적을 바라지 lotto 확실한 표현을 원하지만  너의 미소 띈 표정에  잊어버리지 난 요즘 따라 내꺼인 듯  내꺼 아닌 내꺼 같은 너 니꺼인 듯 니꺼 아닌  니꺼 같은 나 순진한 척 웃지만 말고  그만 좀 해  너 솔직하게 좀 굴어봐 니 맘 속에 날 놔두고  한 눈 팔지 마 너야말로  다 알면서 딴청 피우지 마 피곤하게 힘 빼지 말고  어서 말해줘 사랑한단 말이야
2014.04.21~04.27,8,4583481,Give Love,악동뮤지션,PLAY,2014.04.07,Folk,이찬혁,니가 날 싫어해 하는 걸 알아 나는 서운해 그런 날  왜 너는 못 이해해 You don't understand  난 너를 좋아한다고 내가 뭘 잘못했는데  내게 왜 그러는데 그럴수록 난 되게 섭섭해  Oh I'm so sad 그러니까 슬슬  Let me come into your 마음 중요한 건 마음  결코 네 얼굴만 보고  좋아하는 거 아니 아니야 날 미워하는 너의  날이 선 말투까지도  사랑하게 된 거 이게 내 맘이야 너에 대한 건 사소한 것도 기억해 난 마니아 아무리 나삐 굴어도 넌 내게 이 순간 만화야 순정만화야 주인공은 맨날  맨날 이렇게 밤마다 기도해 Give Love 사랑을 좀 주세요 Give Love 사랑이 모자라요 매일매일 자라는 사랑을  그녀에게 주는데도 받질 않으니 Give Love 사랑을 좀 주세요 Give Love 사랑이 모자라요 매일매일 자라는 사랑을  그녀에게 주는데도 받질 않으니 Give Love  Give Love Give Love 잘못한 것도 없는데 왜 무작정 싫어하고 보는 너 Why can't you understand me 난 너를 좋아한다고 네가 날 싫어해 하는 걸 안 후 부터 샘솟던 의욕이 다 시들고 설레던 내 맘도 끝이겠구나 했는데 또다시 슬금슬금  다가가도 될까 바라보는 것조차 싫어할까 봐 난 몰래 뒤에서 긍긍전전해 점점 해가 지면 달빛 정전에 용기가 나 내 맘을 전부 전해 하지만 그녀와 내 사이  거리 너무 멀어 주고 또 주는 사랑이 길바닥에 다 버려져 낙엽처럼 쌓이네 봄이 되면 흙으로 남아  혹시 기대해 싹이 될까 Give Love 사랑을 좀 주세요 Give Love 사랑이 모자라요 매일매일 자라는 사랑을  그녀에게 주는데도 받질 않으니 Give Love 사랑을 좀 주세요 Give Love 사랑이 모자라요 매일매일 자라는 사랑을 그녀에게 주는데도 받질 않으니 Give Love Give Love Give Love Give Love Give Love Give Love
2014.04.21~04.27,9,4579474,견딜만해 (Feat. 효린 Of 씨스타),매드클라운,표독,2014.04.04,Rap / Hip-hop,"매드클라운,김도훈(RBW),에스나(eSNa),민연재",402호 빈집 불 꺼졌네 온몸이 터널 같아 허전해 밤은 낮을 걷어내고 비가 내린 것  같지는 않은데 내 눈가 어 젖었네 똑똑 넌 여기 없는 것 같아  조심스레 현관문 열고 들어간 다음 안쪽에서 문을 잠그네 철컥 너를 떠나 보내는 소리 철컥 니가 나간 추억이란 방 홀로 남아  니 멋대로 어질러놓은 기억들을 난 담아 떠나가는 입장과 떠나 보내는  입장은 항상 달라 둘은 전혀 다른 심장 니가 뭘 알아 너만 편한 거짓말로  날 계속 아프게 하지마 그래 넌 돌아서서 가 사랑했으니까  넌 다치지 않을 만큼만 날 옆에 둔거니까 니가 외롭지  않을 만큼만 견딜만해 지낼만해 어차피 다치지 않을 만큼 사랑했으니까 But I still love you 참을만해 말하지만 자존심 땜에 하지 못한 말 헤어지지 말자 Cuz I still love you 다 거짓말 I'm fine 다 거짓말 I'm fine Even without you Even without you 견딜만해 괜찮아 생각보다  견딜만해 내 삶에 니가 없어도 친절하지 못했던 이별의  방식이었지만 걱정 마 견딜만해 난 보기보다 빨랠 돌리다 티비를 켜 잠시 멍  때리다 책상에 앉아 책을 펴 밥을 먹어 니가 빠져버린 내 일상 별로  달라진 건 없어 사랑했거든 넌 다치지 않을 만큼만 나 이별을 똑바로 마주보는 법  몰라서 슬픔 앞에 고슴도치마냥  웅크렸어 아닌 척 정말로 나 노력하고  있지만 숨을 안 쉬는 것 빼곤 별 짓 다해봐도 아퍼 언젠가 사랑을 잃었을 때 다시는  그러지 않겠다 가슴에 아프게 새긴 노랫말 미련을 추하다 여기지 말 것 또  기꺼이 아파하고 마음껏 울을 것 견딜만해 지낼만해 어차피 다치지 않을 만큼 사랑했으니까 But I still love you 참을만해 말하지만 자존심 땜에 하지 못한 말 헤어지지 말자 Cuz I still love you 서로의 마음 각도기처럼 재곤 했던  우린 결국 딱 그만큼의 사랑 딱 그만큼의 집 쉴 곳도 돼주지 못한 채 서로를  가두기 바빴고 보금자리가 돼주기보다 문을 굳게 닫은 창고 추억은 빈집에 갇히고 우린 여기  다신 안 와 한가지 확실한 건 그런 감정  이제는 다신 안 와 잘 지내 내 모든 맘으로 널 그리워해 사랑은 갇히고 난 바깥에서 문을 잠그네 빈집 너 들리니 더 많이 안아주지 못한 나 이기적이던 나 정말 미안해 이별 앞에서 너 앞에서 자존심 땜에 하지 못한 말 헤어지지 말자 Cuz I still love you 다 거짓말 I'm fine 다 거짓말 I'm fine Even without you Even without you
2014.04.21~04.27,10,4544242,그 중에 그대를 만나,이선희,15집 `SERENDIPITY` 30주년 기념앨범,2014.03.25,Ballad,김이나,그렇게 대단한 운명까진 바란적 없다 생각했는데 그대 하나 떠나간 내 하룬 이제 운명이 아님 채울 수 없소 별처럼 수 많은 사람들 그 중에 그대를 만나 꿈을 꾸듯 서롤 알아보고 주는 것 만으로 벅찼던 내가 또 사랑을 받고 그 모든건 기적이었음을 그렇게 어른이 되었다고 자신한 내가 어제같은데 그대라는 인연을 놓지 못하는 내 모습 어린아이가 됐소 별처럼 수 많은 사람들 그 중에 그대를 만나 꿈을 꾸듯 서롤 알아보고 주는 것 만으로 벅찼던 내가 또 사랑을 받고 그 모든건 기적이었음을 나를 꽃처럼 불러주던 그대 입술에 핀 내 이름 이제 수많은 이름들 그 중에 하나되고 오 그대의 이유였던 나의 모든 것도 그저 그렇게 별처럼 수 많은 사람들 그 중에 서로를 만나 사랑하고 다시 멀어지고 억겁의 시간이 지나도 어쩌면 또다시 만나 우리 사랑 운명이었다면 내가 너의 기적이었다면
2014.04.21~04.27,11,4583483,얼음들,악동뮤지션,PLAY,2014.04.07,Folk,이찬혁,붉은 해가 세수하던  파란 바다 검게 물들고 구름 비바람 오가던  하얀 하늘 회색 빛들고 맘속에 찾아온 어둠을 그대로 두고 밤을 덮은 차가운  그림자마냥 굳어간다 얼음들이 녹아지면 조금 더 따뜻한 노래가 나올텐데 얼음들은 왜 그렇게 차가울까 차가울까요 Why are they so cold Why are they so cold 붉은 해가 세수하던 파란 바다 그 깊이 묻힌 옛 온기를 바라본다 too late get it out 어른들 세상 추위도 풀렸으면 해 얼었던 사랑이 이젠  주위로 흘렀으면 해 맘속에 찾아온 어둠을 그대로 두고 밤을 덮은 차가운  그림자마냥 굳어간다 얼음들이 녹아지면 조금 더 따뜻한 노래가 나올텐데 얼음들은 왜 그렇게 차가울까 차가울까요 얼음들이 녹아지면 조금 더 따뜻한 노래가 나올텐데 얼음들은 왜 그렇게 차가울까 차가울까요 Why are they so cold Why are they so cold
2014.04.21~04.27,12,4535038,그런 남자,Bro,그런 남자,2014.03.21,Ballad,"Bro,Keygen",말하지 않아도 네맘 알아주고 달래주는 그런남자 너무 힘이들어서 지칠때 항상 네 편이 되어주는 그런남자 한번 눈길만 주고갔는데 말없이 원하던 선물을 안겨다 주는 잘생기진 않아도 네가 가끔 기대어 쉴수 있게 넓은 가슴을 가진 남자 그런 남자가 미쳤다고 너를 만나냐 너도 양심이 있을것 아니냐 뭔가 애매한놈들이  자꾸 꼬인다는건 너도 애매하다는 얘기야 훌쩍 떠나고 싶을때 너를 태워 바다로 쏘는 그런 남자 키가 크고 재벌2세는 아니지만 180은 되면서 연봉 6천인 남자 네가 아무리 우스갯소리를 해도 환하게 웃으며 쿨하게 넘기는 남자 내가 만약에 그런  남자가 될수 있다면 한눈에 반해버릴 그런 남자라면 약을 먹었니 미쳤다고 너를 만나냐 나도 인생을 좀 즐겨봐야지 왕자님을 원하신다면  사우디로 가세요 일부다처제인건 함정 네 가슴에 에어백을 달아도  눈밑에다 애벌레를 키워 보아도  숨길수 없는 단하나의 진실  너는 공격적인 얼굴이야 총을 맞았니 미쳤다고 너를 만나냐 너도 양심이 있을것 아니냐 뭔가 애매한놈들이  자꾸 꼬인다는건 네가 운이없는게  기다림이 모자란게 아냐 그냥 넌 별로야
2014.04.21~04.27,13,4503810,까탈레나 (Catallena),오렌지캬라멜,The Third Single Catallena,2014.03.12,Dance,"이기(오레오),서용배(TENTEN)",춤추는 작은 까탈레나 Red Sun  나도 모르게 빠져 들어가  도도한 콧대 까탈레나 Red Sun  Jutti Meri Oye Hoi Hoi 홀려 들어가  어머머머 멋있어 반했어 어쩜 같은   여자끼리 봐도 참 멋있어  까칠까칠 하지만 한 번만 보고파   알고파 함께 춤 추고파  랄라랄라 흔들흔들 손 흔들고  네 목소리가 쉴 때까지 소리 질러  Jutti Meri Oye Hoi Hoi Paula   Mera Oye Hoi Hoi  참 잘했어요 100점 만점 주고파  춤추는 작은 까탈레나 Red Sun  나도 모르게 빠져 들어가  도도한 콧대 까탈레나 Red Sun  Jutti Meri Oye Hoi Hoi 홀려 들어가  스르르르르륵 스르르르르륵 녹 녹 녹 녹아든다 녹 녹 녹 녹아든다 파르르르르륵 파르르르르륵 떨 떨 떨 떨려온다 따라 따라 따라 하고파 시크해서 싫지만 그치만 어쩜 같은  여자끼리 봐도 매력 있어 분하지만 한 시간 두 시간 추고파 놀고파 뼈를 묻고 싶어 랄라랄라 흔들흔들 손 흔들고 네 목소리가 쉴 때까지 소리 질러 Jutti Meri Oye Hoi Hoi Paula  Mera Oye Hoi Hoi 아직 부족해 좀만 더 힘을 내봐 춤추는 작은 까탈레나 Red Sun 나도 모르게 빠져 들어가 도도한 콧대 까탈레나 Red Sun Jutti Meri Oye Hoi Hoi 홀려 들어가 스쳐 가는 두 손이 따듯해 알고 보면 착할래나 까칠한 나의 까탈레나 모두 다 같이 빠져들어 가 도도한 콧대 까탈레나 Red Sun Jutti Meri Oye Hoi Hoi 홀려 들어가 스르르르르륵 스르르르르륵 녹 녹 녹 녹아든다 녹 녹 녹 녹아든다 파르르르르륵 파르르르르륵 떨 떨 떨 떨려온다 따라 따라 따라 하고파
2014.04.21~04.27,14,4512170,흔한 노래,임창정,흔한 노래... 흔한 멜로디...,2014.03.20,Ballad,"임창정,수퍼터치",미뤄놨던 빨래를 개고 다 털어내듯 샤워를 하고 마침 걸려온 친구 놈의 술 한잔 약속에 머릿속을 비우러 간다 온통 네 생각에 걷고 또 걷다 너무 보고 싶어 눈물 흘리다 길거리에 흐르는 어떤 노랫말들이 모두 내 이야기 같아 너와 나의 이야기 이건 가장 흔한 노래야 들어봐 모든 사람들이 부르는 노래 아무리 슬퍼도 울면 안 돼 넌 그 흔한 이별처럼 흘려 보내면 돼 가장 흔한 노래 가사처럼 모두 사랑 앞엔 상처투성이 아픈 가슴 안고 나를 떠난 너 우리 같이 부르던 흥얼거리던 노래 지금 우리 이야기야 너와 나의 이야기 이건 가장 흔한 노래야 들어봐 모든 사람들이 부르는 노래 아무리 슬퍼도 울면 안 돼 넌 그 흔한 이별처럼 흘려 보내면 돼 가장 흔한 노래 가사처럼 잊을 수가 없잖아 널 보낼 수가 없잖아 이 노래를 들어 내게로 돌아와 이건 가장 흔한 노래 이건 가장 흔한 노래야 들어봐 들어봐 모든 사람들이 부르는 노래 아무리 슬퍼도 울면 안 돼 넌 그 흔한 이별처럼 흘려 보내면 돼 가장 흔한 노래 가사처럼
2014.04.21~04.27,15,4478187,Come Back Home,2NE1,CRUSH,2014.02.27,Electronica,TEDDY,One two three 넌 나를 떠났지만 어딘가에서 너의 숨소리가  들려와 또 다시 Four five six 빨간 눈물이 내려와 나를 안던 너의 향기가 그립다 나를 위한 거라 했던 너의 말 거짓말처럼 차갑게 돌아섰던  너는 왜 너는 왜 you’re gone away Come Back Home Can you come back home  차가운 세상 끝에 날 버리지  말고 내 곁으로 Come back home Can you come back home 모든 아픔은 뒤로 해  여전히 널 기다려 이렇게 Now you gotta do what you gotta do COME BACK HOME COME BACK HOME Come baby baby come come baby Come Come baby baby come come 내게 돌아와 Come baby baby come come baby Come Come baby baby come come 아무 대답 없는 니가 너무 밉지만 가끔은 너도 나를 그리워할까 yeah 너 없는 시간 속에 갇혀버린 난 앞을 볼 수가 없어 너무 두려워 아직도 못다 한 많은 날들이 기다리고 있을 것만 같아  너는 어디에 어디에 too far away Come Back Home Can you come back home  차가운 세상 끝에 날 버리지  말고 내 곁으로 Come back home Can you come back home  모든 아픔은 뒤로 해  여전히 널 기다려 이렇게 Now you gotta do what you gotta do Come back home Come back home Come baby baby come come baby Come Come baby baby come come 내게 돌아와 Come baby baby come come baby Come Come baby baby come come Come Back Home Can you come back home 차가운 세상 끝에 날 버리지 말고  내 곁으로 Come back home Can you come back home  모든 아픔은 뒤로 해  여전히 널 기다려 이렇게 Now you gotta do what you gotta do
