time,rank,song_id,title,singers,album,date,genre,creator,lyric2012.11.19~11.25,64,3940593,꿈이었을까,"박명수,정엽",꿈이었을까,2012.10.25,Ballad,"정엽,에코브릿지",꿈이었을까  꿈이었을까 널 만났던건  깨어난 지금 자꾸 눈물이 나  다른 사람과 더 행복할까 봐  혹시 니가 날 기억에서 지웠을까  널 떠나 웃지도 잘 못했어  그런 내가 미워서  널 보내 후회만 하고 있어  내가 너무 못났어 그땐 몰랐어  미안해요 그 말을 못해  사랑해요 한 마딜 못해  이제와서 눈물이 나나봐  꿈속에서라도 널 다시   만나 볼 수 있다면  그 곳에서 너와 영원히 잠들래  술에 취해서 또 눈물이나  니가 없는 난 자꾸 눈물이 나  다른 사람과 더 아파할까봐  혹시 니가 날 추억에서 지웠을까  널 떠나 어디도 나는 못가  니가 다시 올까봐  널 보내 이제야 알게 됐어  하지만 니가 없어   니가 이젠 없어  미안해요 그 말을 못해  사랑해요 한 마딜 못해  이제와서 눈물이 나나봐  꿈속에서라도 널 다시   만나 볼 수 있다면  그 곳에서 너와 영원히 잠들래  꿈속에서라도 널 다시   만나 볼 수 있다면  그 곳에서 너와 영원히  미안해
2012.11.19~11.25,65,3929471,저녁 하늘,에일리,Invitation,2012.10.16,Ballad,김이나,어떤 날에든 저녁 하늘은 못 올려보는 습관이 있어 온 세상이 날 떠나는듯한 이상한 그 기분이 싫어 멀리 떨어지는 저 해는 내일 다시 올텐데 나를 비춰줬던 햇살은 아닐 것 같아 니가 가도 사랑은 다시 오고 소란스런 이별을 겪어봐도 이렇게 너는 너는 너는 자꾸 맘에 걸려 가끔씩은 좋아서 웃긴 하고 더 가끔씩은 행복의 맛을 봐도 아직도 너는 너는 너는 Deep in me 누군가에게 맘을 줄 때면 반을 남기는 습관이 있어 다 줘버리면 떠날 것 같은 이상한 그 예감이 싫어 반쯤 아껴둔 이 맘 누구 줄 수 조차 없는데 반쯤 고장나버린 나를 들키긴 싫어 니가 가도 사랑은 다시 오고 소란스런 이별을 겪어봐도 이렇게 너는 너는 너는 자꾸 맘에 걸려 가끔씩은 좋아서 웃긴 하고 더 가끔씩은 행복의 맛을 봐도 아직도 너는 너는 너는 Deep in me 너의 맘은 어디쯤일까 나를 맴돈 적은 있을까 나처럼 아주 가끔 시간이라는 게 다 지우지는 못 하나봐 아직도 네 이름은 편히 말하질 못해 니가 아닌 누군가 나를 안고 내가 아닌 누군가 너를 안고 이렇게 오래 오래 오래 나날들이 가도 하지 못한 말들이 입에 남아 다 주지 못한 사랑이 맘에 남아 어쩌면 너는 너는 너는 Still in me
2012.11.19~11.25,66,3968839,나에게 초대,이승기,숲,2012.11.22,Ballad,차세정,문득 외로운 마음에  힘이 들어질 땐 어떻게 하니  괜히 서글픈 생각에  마음 약해질 땐 어떻게 하니  아플 때는 언제나 혼자란 생각에 눈물 방울들이 하나 둘 맺힐 때 쯤  힘들었던 하루 끝엔 내가 있을게  조금만 내 곁에  가까이 와주지 않겠니  그대 곁에 그대 조금 더 나의 곁에  달콤한 눈물들도 끌어 안을게 슬퍼했던 오래 전 기억들도  같이 나누자  조금씩 오래오래 두 손을 마주잡고  문득 외로운 마음에  힘이 들어질 땐 어떻게 하니  괜히 서글픈 생각에  마음 약해질 땐 어떻게 하니  아플 때는 언제나 혼자란 생각에  눈물 방울들이 하나 둘 맺힐 때 쯤  힘들었던 하루 끝엔 내가 있을게  조금만 내 곁에  가까이 와주지 않겠니  그대 곁에 그대 조금 더 나의 곁에  달콤한 눈물들도 끌어 안을게  슬퍼했던 오래 전 기억들도  같이 나누자  조금씩 오래오래 두 손을 마주잡고 그대 곁에 그대 조금 더 나의 곁에 달콤한 눈물들도 끌어 안을게 슬퍼했던 오래 전 기억들도 같이 나누자 조금씩 오래 두 손을 마주잡고 조금씩 오래 이 손을 놓지 않고
2012.11.19~11.25,67,3970044,나는 위험해,화요비,I Am,2012.11.23,R&B / Soul,화요비,말도 안되고 해도 안 듣는  그런 얘기 하지마 지금 나라면 죽을 것 같은  그런 얘기 하지마  너는 정말 못됐어 나는  이걸로 됐어  그래도 헤어지고 싶잖아  어쨌든 떠나가고 싶잖아  전부 알아듣겠어 결국  이별이 됐어  내가 몇 번을 말해 매번  흘려 듣던 너  문득 떠들어대던 내가 슬퍼 아끼고 아껴도 쫓기듯 감춰도  불완전은 결국 들켜 그렇게 사는 나는 벌써  이별이 너보다 더 자유로워  누구보다 뜨겁게 누구보다  사랑해  나조차도 모르게 내일은  또 없듯이  그 생각의 끝은 꼭 이별인 걸  말도 안되고 해도 안 듣는  그런 얘기 하지마 지금 나라면 죽을 것 같은  그런 얘기 하지마  너는 정말 못됐어 나는  이걸로 됐어  그래도 헤어지고 싶잖아  어쨌든 떠나가고 싶잖아  전부 알아듣겠어 결국  이별이 됐어  불안한 날 숨겼어 더 멀쩡한  척 지내왔어  그게 다 사랑하는 거라고  사랑 받는 거라고 말 해도  모르는 걸  미쳐있는데 아닌 척 하는  이런 내가 두려워 울고 싶은데 아닌 척 하는  그런 내가 불안해  사실 너를 사랑해 너무너무  사랑해 어쩌다 이런 나를 만나서  왜 하필 나란 여잘 만났어  이젠 떠나도 좋아 전부  잊어도 좋아
2012.11.19~11.25,68,3905489,아프다,허각,아프다,2012.09.14,Ballad,슈퍼창따이,아프다 니가 떠나서 아프다 하루종일 울어도 또 아프다 이렇게 아픈데도 정말로 아파도 바보처럼 오늘도 웃는다 보고 싶지만 참는다 니가 행복하길 난 바래본다 나는 너무 아파도 정말 난 아파도 너는 아프지 않길 바란다 너 정말 너를 사랑했는데 점점 아파와서 그게 겁이 나서 힘들지만 난 너를 보낸다 바라보아도 날 안 본다 불러보아도 대답 없다 니가 너무 미워도 정말로 미워도 너는 아프지 않길 바란다 너 정말 너를 사랑했는데 점점 아파와서 그게 겁이 나서 힘들지만 난 너를 보낸다 너 정말 너를 사랑했는데 점점 아파와서 자꾸만 겁이 나서 힘들지만 난 너를 보낸다 힘들지만 난 너를 보낸다
2012.11.19~11.25,69,3904614,POISON,시크릿,POISON,2012.09.13,Dance,"강지원,김기범",You are my poison  you are my poison  스며들어 내게 파고들어   빠져 나올 수 없어  You are my poison   you are my poison  무너뜨려 나를 쓰러트려   아무것도 할 수가 없어  왜 이러는지 모르겠어   아니란 걸 잘 알면서도  오오오오 오오오  자꾸 니가 생각나  치명적인 너의 매력에   내가 정신이 나갔나봐  오오오오 오오오  상처받을걸 알면서  Crazy crazy crazy love  Listen listen crazy love  미쳐 너에게 미쳐  내 심장이 멎어가 오  Crazy crazy crazy Love  Listen listen crazy Love  Wake up 이제는 wake up  이미 늦어 버렸어  You are my poison   you are my poison  스며들어 내게 파고들어   빠져 나올 수 없어  You are my poison   you are my poison  무너뜨려 나를 쓰러트려 아무것도   할 수가 없어  Gotta be gotta be gotta be   your poison  Gotta be gotta be gotta be   your poison  Hit me 주사위는 던져졌어   이미 조금씩 너에게 중독돼버렸어  왜 니가 날 흔들어놓는지   왜 니가 날 가지고 노는지  벗어나려 발버둥쳐도   니 사랑이 퍼져가는 걸  오오오오 오오오  너에게 갇혀 버렸어  Crazy crazy crazy love  Listen listen crazy love  미쳐 너에게 미쳐  내 심장이 멎어가 오  Crazy crazy crazy love  Listen listen crazy love  Wake up 이제는 wake up  이미 늦어 버렸어  You are my poison   you are my poison  스며들어 내게 파고들어   빠져 나올 수 없어  You are my poison   you are my poison  무너뜨려 나를 쓰러트려   아무것도 할 수가 없어  Gotta be gotta be gotta be  your poison Gotta be gotta be gotta be  your poison 나를 눈뜨게 한 너의 사랑은  irreplaceable 살아 있단 걸 느껴 Huh 자존심 따윈 다 버렸어  우스워 내가 매달리는 모습도 해독제 조차 없는 이사랑 계약조차  성립되지 않는 이사람 You are my poison  you are my poison 스며들어 내게 파고들어  빠져 나올 수 없어 You are my poison  you are my poison 무너뜨려 나를 쓰러트려  아무것도 할 수가 없어
2012.11.19~11.25,70,3913733,I Dream,"15&amp;(박지민,백예린)",I Dream,2012.10.05,Ballad,김은수,상상했었어 무대에  오르는 그 순간을  따뜻한 햇살 마이크를 잡은  내 위로 쏟아질 그 빛을  사람들에게 들려주고 싶은  노래가 나는 너무나 많아 내 마음이 닿기를 너를  볼 수 있기를  꿈만 같아 너의 앞에 선 이 순간  너를 웃게 할 이 노래  Oh I dream 내 목소리를 타고  너를 움직일 이 노래 듣고 있니 그 짙은 어둠 속에 혼자  갇히지 않게 영원히 너를 위해 노래할게 이제 시작해 네 맘으로 가는  긴긴 여행 외로워지면 눈물 날 것 같으면  너의 손을 잡을게 워우어 Oh I dream 내 목소리를 타고  너를 움직일 이 노래 지금 너도  듣고 있는지 그 짙은 어둠 속에 혼자  갇히지 않게 영원히 너를 위해  노래할게 워우어 Oh I dream 내 목소리를 타고  너를 웃게 할 이 노래  Oh I dream 말라버린 네 맘에  비처럼 내릴 이 노래  오래 맘을 적실 비처럼  네 맘속의 사랑이 혼자  시들지 않게 언제나 날 지켜준 첨부터 나를 지켜본 네 앞에서 널 그리고 그리며 꿈꾸던 마음  하나로 난 노래할게
2012.11.19~11.25,71,3938434,하지마 (Stop it),B.A.P,하지마,2012.10.23,Dance,"이단옆차기,방용국",그 이쁜 얼굴로 인상 구기지 말고 화나지 않았다면 날 죽이지마 이해할게 됐다고만 말하지 말고  기분 풀어 니가 웃길 원하지 난 내 앞에선 맘대로 해 여우같이 넌 안 해도 돼 그러니까 제발 내내내게는 아 화 좀 내지마 말해봐 이건 아니잖아 해도 너무 하잖아 baby 화냈다 다시 사랑한다 왔다 갔다 하니 왜 oh baby 속상한 맘에 가끔씩 미울 때도 많지만 너무 쉽게 화만 내는 너에게 이렇게 말할래 화 좀 내지마 하지마 제발 그러지마 짜증나 열이나 널 사랑하잖아 몇 번을 말해야 넌 내 맘을 알까 내 맘을 알까 넌 내 맘을 알까 제발 좀 욱 하지마 사람들 많잖아 작게 좀 말해줘 다 들린다잖아 몇 번을 말해야 넌 내 맘을 알까 난 말야 니가 원하는 건 모든 들어줬잖아 baby 자꾸만 잔소리 같지만 널 위한 걸 모르니 oh baby 너로 인해 항상 바뀌어 매일 팔팔 열차를 타는듯해 매일 화 좀 내지마 뭐라해도 나는 너만의 슈퍼맨 널 위해선 뭐든지 하겠어겠어 널 절대로 놓지 않겠어겠어 아 화 좀 내지마 제발 욱 하지마 화 좀 내지마 하지마 제발 그러지마 짜증나 열이나 널 사랑하잖아 몇 번을 말해야 넌 내 맘을 알까 내 맘을 알까 넌 내 맘을 알까 제발 좀 욱 하지마 사람들 많잖아 작게 좀 말해줘 다 들린다잖아 몇 번을 말해야 넌 내 맘을 알까 눈에 넣어도 안 아픈 그런 너란 걸 알지만 바라는 건 딱 한 가지 한번만 내 말 들어줄래 화 좀 내지마 하지마 제발 그러지마 짜증나 열이나 널 사랑하잖아 몇 번을 말해야 넌 내 맘을 알까 내 맘을 알까 넌 내 맘을 알까 제발 좀 욱 하지마 사람들 많잖아 작게 좀 말해줘 다 들린다잖아 몇 번을 말해야 넌 내 맘을 알까
2012.11.19~11.25,72,3965498,행복해라,"영지,이규훈",The Lyrics - No.2,2012.11.22,Ballad,최갑원,사랑이었을까  아니면 외로워 그랬을까 많아진 기대 적어진 이해  조금 더 견뎌야 했던 걸까 언제부터일까  사이가 어긋났던 그 때가 위험한 울림 불안한 우린  서둘러 이별한 건 아닐까 행복해라 한때 전부였던 사람 나를 다 잊어 깨끗이 지워 새로운 사랑에 당당해라 웃으며 지내라  나 땜에 눈물 알게 된 사람 나와는 다른 너와는 닮은  누군갈 만나서 설레여라 너를 위해서 몇 월 며칠일까  결국에 헤어진 바로 그 날 어느 새 벌써 시간에 덮여  기억이 흐려져 버렸나 봐 행복해라 한때 전부였던 사람 나와는 다른 너와는 닮은  누군갈 만나서 설레여라 너를 위해서 내가 있는 곳엔 니가 없길 내가 가기 전에 자릴 비워주길 너를 보면 흔들리면 안 되잖아 그래 다 잊어 영원히 지워 이름도 얼굴도 추억들도 웃으며 지내라  나 땜에 눈물 알게 된 사람 나와는 다른 너와는 닮은  누군갈 만나서 설레여라 너를 위해서 한강이 보이는 차 안엔  숨죽이던 우리 둘 반대로 내려 그대로 걸어  안녕이란 말도 못 했지만 이제는 안녕
2012.11.19~11.25,73,3946756,청개구리,로이킴,슈퍼스타K4 Top12 Part.3,2012.10.29,Rock,"싸이(PSY),G-DRAGON",나 아주 어렸을 때부터 남 얘기 잘 안들려 어려서 그랬을까 하지만 지금도 잘 안 들려 살면서 가장 많이 들었던 말 너 그러다 뭐 될래 살면서 가장 많이 하고픈 말 내가 알아서 다 할게 그래 나 청개구리 그 누가 제 아무리 뭐라 해도 나는 나야 우물 안의 개구리라도 나 행복하니 그래 그게 바로 나야 그래 그게 바로 바로 청개구리 청개구리 살면서 가장 많이 들었던 말 너 그러다 뭐 될래 살면서 가장 많이 하고픈 말 내가 알아서 다 할게 그래 나 청개구리 그 누가 제 아무리 뭐라 해도 나는 나야 우물 안의 개구리라도 나 행복하니 그래 그게 바로 나야 그래 그게 바로 바로  개굴개굴 개구리가 고래고래 오 소리친다 틀린게 아니라 다른 것 뿐이야 개굴개굴 개구리가 고래고래 오 소리친다 틀린게 아니라 다른 것 뿐이야 개굴개굴 개구리가 고래고래 오 소리친다 틀린게 아니라 다른 것 뿐이야 개굴개굴 개구리가 고래고래 오 소리친다 틀린게 아니라 다른 것 뿐이야 그래 나 청개구리 그 누가 제 아무리 뭐라 해도 나는 나야 우물 안의 개구리라도 나 행복하니 그래 그게 바로 나야 그래 나 청개구리 그 누가 제 아무리 뭐라 해도 나는 나야 우물 안의 개구리라도 나 행복하니 그래 그게 바로 나야 그래 그게 바로 바로 나야 청개구리
2012.11.19~11.25,74,2994360,Hello!,포맨,Sorry,2010.10.28,Ballad,,또 사랑이 오네요 이번이 정말 마지막이야 You're ma love yeah 또 이별이란 없죠 이번엔 정말 내 사람이야 You're ma lover So stop 왜 이제야 왔죠 Shut up 난 느낌이 왔죠 It's alright It's alright 내 사랑입니다 내 사람입니다 보여주고 싶은 You're beautiful girl oh 내 여자입니다 언제까지나 You're ma love You're ma love You're ma love 내 사랑 그대여 Oh baby hello hello hello hello 아주 오랜만이죠 내 가슴을 설레이게 만든 한 사람 그녀는 특별한 Shinee girl You're something special real baby 그저 곁에만 있어줘 lady So stop 왜 이제야 왔죠 Shut up 난 느낌이 왔죠 It's alright It's alright 내 사랑입니다 내 사람입니다 보여주고 싶은 You're beautiful girl oh 내 여자입니다 언제까지나 You're ma love You're ma love You're ma love 내 사랑 그대여 oh baby 내 곁에만 있어줘 oh girl 내 맘을 비추는 또 다른 나 You're ma world You're ma world It's alright baby now 내 사랑입니다 내 사람입니다 자랑하고 싶은 You're beautiful girl oh 내 여자입니다 언제까지나 You're ma love You're ma love You're ma love 내 사랑 내 사랑 내 여자 내 사랑 내 사랑 내 여자
2012.11.19~11.25,75,3948918,"축하해 (Feat. 다이나믹듀오, 박재범)",프라이머리,Primary And The Messengers LP,2012.10.31,Rap / Hip-hop,"개코,최자",어 어려운 결정이었어 가진 거라곤 열정이었어 결혼이란 결론 바로 전 그곳이 너와 나 둘 사이의 절정이었어 결혼은 아직 생각 없다는 말버릇 자리 좀 잡고 생각해보자라고 빙 돌려 말하는 비겁함이 널 무기력하게 했지만 넌 보채지 않았어 갈채를 받을 만한 너의 끈기 제도를 탓하고 빈정거리는 내 회의적인 태도가 밉상에다 비정해 보였는지 이별 전까지 눈물로 가득 채운 혼기 원망스럽고 민망해 내 부족한 용기 결혼은 아직 낯설고 먼 나라 얘기 같아 듬직함과는 거리가 멀어 난 애기 같아 그래서 널 놔준 거야 담담히 무자비한 내 미래는 아직 안개 속에 있어 갚아야 할 돈 유감이지만 아직 빈익빈 속 유복한 너랑 다르게 자주 느끼는 빈속 메신저 니 아이디엔 결혼날짜 웨딩 사진 지금도 무의식적으로 그걸 열어보곤 하지 축하해 Girl 행복해야 해 아이도 낳고 사랑 받으면서 잘 먹고 잘 살아야 해 이젠 안녕 니가 원한 안정 속에서 존중 받으면서 예쁘게 잘 살아야 돼 Sweet 어 어려운 결정이었어 가진 거라곤 열정이었어 결혼이란 결론 바로 전 그곳이 너와 나 둘 사이의 절정이었어 사실은 변명 핑계였는지도 몰라 어린애처럼 겁 먹었던 건지도 몰라 무서운 구속감 무거운 책임이 내게 주는 무력함에 굴복해 널 보낸 건지도 몰라 너 두 번 다시 돌아 올 수 없단 걸 알지만 보낼 만큼 난 변화가 두려웠던 것 같아 결혼이 덫 같아 피한 건지 물으면 아니란 대답은 나 절대 하지 못 할 것 같아 하지만 아쉬워 나 많이 너 하나라도 행복한 게 낫지 라는 가식적인 말로 날 위로해 봤지만 나 불편해 아직 니가 내 곁에 없는 게 때때로 후회 하지 우린 뜨거웠지만 차갑기만 한 현실을 녹이는 건 좀 무리였으니까 그래 잘됐어 한계라는 벽에 자주 부딪혔으니까 그래서 서롤 뿌리쳤으니까 너와 나 축하해 Girl 행복해야 해 아이도 낳고 사랑 받으면서 잘 먹고 잘 살아야 해 이젠 안녕 니가 원한 안정 속에서 존중 받으면서 예쁘게 잘 살아야 돼 Sweet 솔직히 난 널 걱정 안 해 넌 야무지고 똑 부러진 애니까 그 어딜 가도 잘 해내니까 넌 사랑 받고 행복하게 살 걸 알아 그는 나와 달라 너 뿐만 아니라 날 싫어하던 너의 가족과도 잘 어울리잖아 불투명한 미래로 너를 안 울리잖아 난 결혼이란 결론을 내기엔 많이 부족한 놈인 것 같아 넌 날 잘 버린 것 같아 너의 반쪽은 어때 너의 반쪽과 함께 사는 강변은 어때 이 강을 건너기엔 너무 깊고 차가워 보여 근데 부쩍 요즘 아기가 이뻐보여 눅눅해진 아는 형의 독신주의가 나를 일깨워주는 건 매일 신선한 외로움 뿐일까 내 사랑의 정의는 본질에서 멀어진다 도피라는 결론 속에서 술잔을 거머쥔다 축하해 Girl 행복해야 해 아이도 낳고 사랑 받으면서 잘 먹고 잘 살아야 해 이젠 안녕안녕 니가 원한 안정 속에서 존중 받으면서 예쁘게 잘 살아야 돼 Sweet
2012.11.19~11.25,76,3962253,멀어질까봐,C-CLOWN,Young Love,2012.11.15,Dance,"라도,Rome,T.K",멀어질까봐 내가 싫어질까봐 말하고 싶었는데 입이 떨어지지가 않았어 나도 모르게 널 불러 널 보면 내 가슴이 떨려 첨부터 니 눈빛에 끌려 오래 됐어 너를 좋아하게 됐어 솔직히 니가  내겐 너무 과분한 거 알아 너 말고 다른 여자는 필요 없어 Baby 정말 그 사람이 좋니 그 남잔 널 사랑할 줄 몰라 니 옆에 그 사람보다 내가 더 잘 어울릴 텐데 정말 그 사랑이 좋니 니 눈물 내가 대신 닦아줄게 울지 말고 내게로 But I know 멀어질까봐 내가 싫어질까봐 말하고 싶었는데 입이 떨어지지가 않았어 멀어질까봐 나 겁이 나나봐 혹시라도 너와 나의 사이가 정말 어색해져 멀어질까봐 Move now 사라져 보기도 너무 힘들죠 이대로 널 보낸다면 평생 후회하겠죠 그 남자 누가 봐도 널 힘들게 하는 Bad boy 내가 더 잘해줄게 Baby 멀어져 간다는 생각에 멍이 들어가 내 맘에 아직도 너의 눈가에 다른 남자가 보이네 I wanna break down I wanna break down 미안해 정말 그 사랑이 좋니 넌 행복해 보이지가 않아 잠깐이라도 니가 행복했으면 좋겠어 정말 그 사람이 좋니 니 눈물 내가 대신 닦아줄게 울지 말고 내게로 But I know 멀어질까봐 내가 싫어질까봐 말하고 싶었는데 입이 떨어지지가 않았어 멀어질까봐 나 겁이 나나봐 혹시라도 너와 나의 사이가 정말 어색해져 멀어질까봐 I don't know I I don't know 나도 모르겠어 이런 감정 I don't know I I don't know 내가 무슨 짓을 하는 건지 나는 너 하나 밖에 몰라 지금 너 아니면 나 미칠지 몰라 나 정말 오늘은 내게 말하고 싶어 말하고 싶은데 그게 잘 안돼 오늘은 내게 말하고 싶어 I want to just say it But I know I can't do it 정말 답답해 너가 방황되는게 보여 난 너와 단둘이 있다는 상상에 기분 좋아져 실은 놀랐어 내 옆자리엔 너가 곁에 없었단 걸 몰랐어 니 옆에 매일 있고 싶은데 Everyday 니 목소리가 듣고 싶은데 아무도 모르게 다가와서 나의 손을 잡아줘 나의 손을 잡아줘 멀어질까봐 내가 싫어질까봐 말하고 싶었는데 입이 떨어지지가 않았어 멀어질까봐 나 겁이 나나봐 혹시라도 너와 나의 사이가 정말 어색해져 멀어질까봐
2012.11.19~11.25,77,3952370,Muzik,딕펑스,슈퍼스타K4 Top 12 Part.4,2012.11.05,Ballad,"이상호,신사동호랭이",너와 내가 빠져드는  리듬 속에 Move 거침없이 쏟아지는  이 음악에 Move I like the Muzik like like  like that Muzik 지루한 저 beat는 Listen  to my song 더 sexy하게 tasty하게 Like  it Like it Like it Like it 더 groovy하게 stylish하게  Like it Like it Like it 이 시간 동안 다 나와 함께 자 시작해 Party Tonight 두 손을 맘대로 높이  높이 흔들어봐 목소린 누구보다 크게  크게 소리쳐봐 내 손을 잡고 Go Go  Go Go Go 신나게 Let's go Go  Go Go Go Go 이 음악이 끝나도  귓가에 돌고 도는  나의 Toxic Music 내 손끝에서 나오는 Touch 희망의 불빛같이 빠져 들게 해  Da Da Da Da Da Da  Dancing Muzik Se Se Se Se Se Se  Sexy Muzik Fu Fu Fu Fu Fu Fu  Funky Muzik Muzik alive 두 손을 마음대로 높이  높이 흔들어봐 목소린 누구보다 크게  크게 소리쳐봐 내 손을 잡고 Go Go  Go Go Go 신나게 Let's go Go  Go Go Go Go 두 손을 마음대로 높이  높이 흔들어봐 목소린 누구보다 크게  크게 소리쳐봐 내 손을 잡고 Go Go  Go Go Go 신나게 Let's go Go Go  Go Go Go
2012.11.19~11.25,78,3917048,아마추어,이승철,아마추어,2012.09.28,Ballad,"홍진영,No.1",살며 살아 가는 행복  눈을 뜨는 것도 숨이 벅찬것도  고된 하루가 있다는 행복을  나는 왜 몰랐을까  나나 나나 나나 난나나나  아직 모르는게 많아  내세울 것 없는 실수투성이  아직 넘어야 할 산은 많지만  그냥 즐기는거야  아무도 가르쳐 주지 않기에  모두가 처음 서 보기 때문에  우리는 세상이란 무대에선  모두다 같은 아마추어야  나나 나나 나나 나나 나나나  지쳐 걸어갈 수 있고  아이 눈을 보며 웃을 수 있고  조금 늦어져도 상관없잖아  그냥 즐기는거야  아무도 가르쳐 주지 않기에  모두가 처음 서보기 때문에  우리는 세상이란 무대에선  모두다 같은 아마추어야  어디로 가야할지 몰라서  길을 찾아 내 꿈을 찾아서  나의 길을 가면 언젠가  꿈이 나를 기다리겠지  아무도 가르쳐 주지 않기에  모두가 처음 서보기 때문에  우리는 세상이란 무대에선  모두다 같은 아마추어야  아무도 가르쳐 주지 않기에  모두가 처음 서보기 때문에  우리는 세상이란 무대에선  모두다 같은 아마추어야 When I am dreaming   and I have wishes  We will be together   in our lives dreams come true  When I am dreaming   and I have wishes  We will be together   in our lives dreams   dreams come true
