time,rank,song_id,title,singers,album,date,genre,creator,lyric2016.06.06~06.12,67,8213795,일상으로의 초대 (우리 동네 음악대장) (Bonus Track),하현우(국카스텐),복면가왕 62회,2016.06.05,Ballad,신해철,산책을 하고 차를 마시고 책을 보고 생각에 잠길 때 요즘엔 뭔가 텅 빈 것 같아 지금의 난 누군가 필요한 것 같아 친굴 만나고 전화를 하고 밤새도록 깨어있을 때도 문득 자꾸만 네가 생각나 모든 시간 모든 곳에서 난 널 느껴 내게로 와 줘 내 생활 속으로 너와 같이 함께라면 모든 게 새로울 거야 매일 똑같은 일상이지만 너와 같이 함께라면 모든 게 달라질 거야 난 내가 말할 때 귀 기울이는 너의 표정이 좋아 내 말이라면 어떤 거짓 허풍도 믿을 것 같은 그런 진지한 얼굴 네가 날 볼 때마다 난 내 안에서 설명할 수 없는 기운이 느껴져 네가 날 믿는 동안엔 어떤 일도 해낼 수 있을 것 같은 기분이야 이런 날 이해하겠니 내게로 와 줘  내게로 와 줘 내 생활 속으로 너와 같이 함께라면 모든 게 새로울 거야 매일 똑같은 일상이지만 너와 같이 함께라면 모든 게 달라질 거야 내게로 와 줘 내 생활 속으로 너와 같이 함께라면 너와 같이 함께라면 모든 게 새로울 거야 매일 똑같은 매일 똑같은 일상이지만 일상이지만 너와 같이 함께라면 모든 게 달라질 거야 모든 게 달라질 거야 내게로 와 줘 내게로 와 줘 해가 저물면 둘이 나란히 지친 몸을 서로에 기대며 그 날의 일과 주변 일들을 얘기하다 조용히 잠들고 싶어
2016.06.06~06.12,68,8042169,그댄 행복에 살텐데,김범수,투유 프로젝트 - 슈가맨 Part.16,2016.02.03,Ballad,양재선,혼자인 시간이 싫어  시계를 되돌려 봤죠  앞으로 앞으로 그대를 만나게  그러다 또 하루만 갔죠  다시 돌아와 줄거라고  나보다 아파할거라고  내 맘이 내 맘을 눈물이 눈물을  다독이며 보내 온거죠  넌 나를 버렸다는 미안함도 잊고  그댄 행복에 살텐데  왜 또 생각하니  왜 또 전화기를 보니 왜 그 사진은 다시 꺼냈니 왜 또 멍해졌니 닮은 뒷모습을 봤니  왜 나를 버린 사람 잊지 못 한 거니 그대 스쳐갔던 흔적이  그대 할퀴고 간 상처가  너무나 많아서 자꾸만 아파서  눈물도 알아서 흐르죠  넌 나를 버렸다는 미안함도 잊고  그댄 행복에 살텐데  왜 또 생각하니  왜 또 전화기를 보니  왜 그 사진은 다시 꺼냈니  왜 또 멍해졌니 닮은 뒷모습을 봤니  왜 나를 버린 사람 잊지 못한거니 사랑 같은 건  영원 같은 건  내겐 없잖아 워  왜 왜 또 왜 그 사진은 다시 꺼냈니  왜 왜 또  왜 나를 버린 사람 잊지 못한거니
2016.06.06~06.12,69,8153410,예쁘다,세븐틴,SEVENTEEN 1st Album First `LOVE&LETTER`,2016.04.25,Dance,"WOOZI(SEVENTEEN),BUMZU,S.COUPS(SEVENTEEN),Vernon(SEVENTEEN),승관(SEVENTEEN)",할 말이 많은데 정리가 잘 안돼 도와줘 SOS 하나 둘 셋 넷 어떤 표현법을 써야만 내 맘이 전해질까 마음을 꺼내서 너에게 복사해 붙여야 하는 건가 어느 멋진 날에 나에게 짠하고 나타나선 내 맘을 취하고 시선을 빼앗고 넌 욕심쟁이 내가 하고 싶었던 말은 Don't take this the wrong way But 너 말곤 안 보여 You'r so ice ice baby At the same time 넌 날 녹여 Just can't get enough 날 너에게 숨김 없이 보여주고 싶어 우린 서로를 선택했고 나노 단위로 집중해 널 볼 때 난 숨이 체할 것 같아  평소엔 안 그러는데 예쁜 말 모두 모아서 따다 주고 싶은데 너 앞에 서면 자꾸 들어가는 말  새벽에 물을 마시면서 혼자 다짐해 나는 너에게 턱 끝까지 차 올랐던 그 말을 내일 꼭 하겠어 너 예쁘다 감기에는 약 배고프면 밥 너 에는 나 처럼 사전에 널 찾으면 나로 정의됐음 좋겠단 말이야 근데 오늘은 대체 어떻게 해야 돼 인터넷에다 물어볼까 어떤 옷 또 어떤 곳 공부를 이렇게나 해볼 걸 우린 서로를 선택했고 나노 단위로 집중해 널 볼 때 난 숨이 체할 것만 같아 평소엔 안 그러는데 예쁜 말 모두 모아서 따다 주고 싶은데 너 앞에 서면 자꾸 들어가는 말  새벽에 물을 마시면서 혼자 다짐해 나는 너에게 턱 끝까지 차 올랐던 그 말을 내일 꼭 하겠어 너 예쁘다 I can't take it no more 할말은 있는데 I can't take it no more 지금 하려고 해 I can't take it no more 편지를 쓰려다가 I can't take it no more 못 참겠어 Baby you're my lady 너의 마음속을 달려가는 중인데 Baby 이제 거의 다 왔어 하 하 새벽에 물을 마시면서 혼자 다짐해 나는 너에게 영화처럼 달콤하고 예쁜 그 말  몇 날 며칠 밤새 연습했던 그 말  내일은 꼭 두 주먹을 꽉 쥐고 말 해주고 싶어 너 예쁘다 Does she love me Does she love me not 하루 종일 세고 있어 꽃잎만 Does she love me Does she love me not 꽃잎은 내게 어떤 답을 전해 줄까
2016.06.06~06.12,70,8217169,유리어항 (One and Only),EXO,EX`ACT - The 3rd Album,2016.06.09,R&B / Soul,박성희,허락된 공기로 쉬는 숨  헤엄쳐봐도 결국 여긴 너의 품  꿈에서도 너란 꿈을 꾸는  All night All night  팔을 뻗은 순간   손끝에 물결치는 감각   그건 You 모두 You  물빛으로 물드는 시간들   따스한 네 미소는 Beautiful  이대로 행복하니까  나에게 자유를 주지 마   넌 내가 찾은  One and One and Only  닿은 발끝 닿은 손 닿은 공간  모든 게 너인데   날 그려내는 부드러운 손길  너의 액자 안에 멈춰있을 때  가장 편안한 나  난 네 안에 갇혀  Yeah 손이 마치 잡힐듯한  너의 온기로 가득 찬  자유로운 어항 속  투명한 나의 공간  유리 벽 너머로 비친 계절  나와는 아무런 상관 없어  내 피부 위 닿는 계절이  다 너니까 yeah  내 두 눈을 가린 손길  그 틈 실낱 같이 비친  옅은 그 햇빛 속에 난  곤히 단잠을 자  Girl you are my  넌 내가 찾은  One and One and Only  닿은 발끝 닿은 손 닿은 공간  모든 게 너인데 You are  날 그려내는 부드러운 손길  너의 액자 안에 멈춰있을 때  가장 편안한 나  난 네 안에 갇혀  I want you 내 곁에 머물러  Ain't nobody but you  맘의 물안개가 걷혀 너만 선명해져 눈 앞 풍경이 다 멈춰  너만 숨을 쉬어  네 것이 아닌 나를 허락하지 말아  Girl you are my  이곳은 오직 나를 위한 세상  너의 온도 너의 빛 너의 물결  다 내게 맞춰진  수면에 비친 구름 위를 걸어  우린 하늘보다 푸른 이 곳을  헤엄치고 있어  난 네 안에 갇혀  You got me girl I got you  이대로 baby 영원히 in your arms  내 세상의 색은 오직 은빛의  다른 색은 필요 없어 Yeah  Oh 난 네 안에 갇혀  Oh you got me girl  I got you girl I got you girl  이 사랑에 갇혀
2016.06.06~06.12,71,8184027,..IS YOU,XIA(준수),..IS YOU,2016.05.19,Ballad,"선우정아,Realmeee",햇살이 가득한 거릴 걷다가 우리도 모르게 먼 훗날을 말했지 한참이 지나도 오늘처럼 이렇게 손잡고 걸을까 달빛이 비추는 서늘한 밤엔 언제나 니 곁에 춥다고 떨기 전에 한참이 지나도 오늘을 잊지 않게 꼭 안아 줄 거야 같은 세상 태어난 그 이유가 있다면 is you is you is you 그런 맘으로 널 믿음이란 말 너로 인해 반짝이는 그 말 넌 오직 한 사람 유일무이한 사람아 풀 내음 가득한 산책길에서 꽃향기가 난다면 네가 웃고 있겠지 내일에 풍경엔 서로가 가득하고 우리 더 걸어가 볼까 같은 세상 태어난 그 이유가 있다면 is you is you is you 그런 맘으로 널 믿음이란 말 너로 인해 반짝이는 그 말 넌 오직 한 사람 유일무이한 내 사람 여름밤 하늘엔 널 닮은 별들이 쏟아지고  시간이 흘러 또 한참 후의 여름 주름마저 예쁘게 수줍을  너와 나 같은 세상 태어난 그 이유가 있다면 is you is you is you 그런 맘으로 널 믿음이란 말 너로 인해 반짝이는 그 말 넌 오직 한 사람 유일무이한 내 사람 그런 맘으로 널 믿음이란 말 너로 인해 반짝이는 그 말 넌 오직 한 사람 유일무이한 사람아
2016.06.06~06.12,72,8141272,제주도의 푸른 밤,태연(TAEYEON),밴드 고맙삼다,2016.04.12,Rock,최성원,떠나요 둘이서 모든 걸 훌훌 버리고 제주도 푸른 밤 그 별 아래 이제는 더이상 얽매이긴 우리 싫어요 신문에 TV에 월급봉투에  아파트 담벼락보다는 바달 볼수 있는 창문이 좋아요 낑깡밭 일구고 감귤도 우리 둘이 가꿔봐요 정말로 그대가 외롭다고 느껴진다면  떠나요 제주도 푸른 밤 하늘 아래로 떠나요 둘이서 힘들게 별로 없어요 제주도 푸른밤 그 별아래  그동안 우리는 오랫동안 지쳤잖아요 술집에 카페에 많은 사람에  도시의 침묵보다는 바다의 속삭임이 좋아요 신혼부부 밀려와 똑같은 사진 찍기 구경하며 정말로 그대가 재미없다 느껴진다면 떠나요 제주도 푸르메가 살고 있는 곳 도시의 침묵보다는 바다의 속삭임이 좋아요 신혼부부 밀려와 똑같은 사진 찍기 구경하며 정말로 그대가 재미없다 느껴진다면 떠나요 제주도 푸르메가 살고 있는 곳
2016.06.06~06.12,73,8136765,썸타 (Lil` Something),"첸(CHEN),헤이즈(Heize),바이브",썸타 (Lil` Something) - SM STATION,2016.04.08,Dance,"류재현,헤이즈(Heize)",나 요즘 썸타 썸타 썸타  네 맘을 알 듯 말 듯 왠지 애매한  너와 나 썸타 썸타 썸타  네 맘을 줄 듯 말 듯  우린 썸타 썸타 썸타  네가 먼저 내게 말해  아님 내가 먼저 말해  나는 남자답게 원해  그래 사랑한다 말해  밀당 밀당 하지 마 하지 마  나는 사랑하길 원해  너는 사랑받길 원해  애매해 너와 나의 사이가  애매해 우리 둘의 사이가  아직 아리까리해 사랑하기에  아직 아리까리해 사랑하기에  우린 아리까리해 아리까리해  나 요즘 썸타 썸타 썸타  네 맘을 알 듯 말 듯 왠지 애매한  너와 나 썸타 썸타 썸타  네 맘을 줄 듯 말 듯  우린 썸타 썸타 썸타  넌 내가 모르게 또 나를 쳐다봐  내 얼굴에 뭐가 묻었나 봐  솔직히 말하자면  걍 우리 친구 사이지만  좀 가까울 뿐  하지 마 착각  네가 문자를 보낼 때마다  의미 없는 대화들만 하게 되잖아  우리는 썸 그런 거 아니야 착각 마  근데 자기 전에 또 네가 생각나  애매해 너와 나의 사이가  애매해 우리 둘의 사이가  아직 아리까리해 사랑하기에  아직 아리까리해 사랑하기에  우린 아리까리해 아리까리해  나 요즘 썸타 썸타 썸타  네 맘을 알 듯 말 듯 왠지 애매한  너와 나 썸타 썸타 썸타  네 맘을 줄 듯 말 듯  우린 썸타 썸타 썸타  Playing hard to get  네가 다가오면 나는 달아나  Playing hard to get  다른 곳을 보면 나는 안달나  Playing hard to get  네가 다가오면 나는 달아나  Playing hard to get  다른 곳을 보면 나는 안달나  우린 아리까리해 사랑하기에 우린 아리까리해 사랑하기에 우린 아리까리해 아리까리해 근데 이번 주말에 뭐 해 나 요즘 썸타 썸타 썸타 네 맘을 알 듯 말 듯 왠지 애매한 너와 나 썸타 썸타 썸타 네 맘을 줄 듯 말 듯 우린 썸타 썸타 썸타 근데 자기 전에 또 네가 생각나 아침에 눈 뜨면 또 생각나 왜 혼자 걸을 때 네가 생각나 생각나 자꾸 생각나 알 듯 말 듯 알 듯 말 듯 알 듯 말 듯 알 듯 말 듯 우린 아리까리해
2016.06.06~06.12,74,8191202,백만송이 장미 (우리 동네 음악대장),하현우(국카스텐),복면가왕 60회,2016.05.22,Ballad,심수봉,먼 옛날 어느 별에서 내가 세상에 나올 때 사랑을 주고 오라는 작은 음성 하나 들었지 사랑을 할 때만 피는 꽃 백만송이 피워 오라는 진실한 사랑을 할 때만 피어나는 사랑의 장미 미워하는 미워하는 미워하는 마음없이 아낌없이 아낌없이 사랑을 주기만 할 때 수 백만송이 백만송이 백만송이 꽃은 피고 그립고 아름다운 내 별나라로 갈 수 있다네 미워하는 미워하는 미워하는 마음없이 아낌없이 아낌없이 사랑을 주기만 할 때 수 백만송이 백만송이 백만송이 꽃은 피고 그립고 아름다운 내 별나라로 갈 수 있다네 진실한 사랑은 뭔가 괴로운 눈물 흘렸네 헤어져간 사람 많았던 너무나 슬픈 세상 이였기에 수많은 세월 흐른 뒤 자기의 생명까지 모두 다 준 빛처럼 홀연히 나타난 그런 사랑 나를 안았네 미워하는 미워하는 미워하는 마음없이 아낌없이 아낌없이 사랑을 주기만 할 때 수 백만송이 백만송이 백만송이 꽃은 피고 그립고 아름다운 내 별나라로 갈 수 있다네 미워하는 미워하는 미워하는 마음없이 아낌없이 아낌없이 사랑을 주기만 할 때 수 백만송이 백만송이 백만송이 꽃은 피고 그립고 아름다운 내 별나라로 갈 수 있다네 이젠 모두가 떠날지라도 그러나 사랑은 계속 될거야 저 별에서 나를 찾아온 그토록 기다리던 이 있네 미워하는 미워하는 미워하는 마음없이 아낌없이 아낌없이 사랑을 주기만 할 때 수 백만송이 백만송이 백만송이 꽃은 피고 그립고 아름다운 내 별나라로 갈 수 있다네
2016.06.06~06.12,75,81013,커플,젝스키스,Special,1998.10.03,Dance,장대성,예전보다 지금 니가 더욱 괜찮을거야  허전했던 나의 빈 곳을 이젠 채워 줬으니 아름다운 세상에서 많이 외로워 하며 내 반쪽을 찾아 해맨건 모두 옛날 얘긴걸 내 생애 이 시간만을 얼마나 기다렸는지 마치 꿈만 같은걸 이젠 나 혼자가 아닌 너와 함께 하는거야 Oh LOVE 왜 이제서야 많이 외롭던 나를 찾아온거야 Oh LOVE 너를 사랑해 이제 모든 시간들을 나와 함께해  All right all right When I saw you one time I lost my heart to you Oops baby I'll be loving you forever with you now Baby don't go too far I won't let you go Please don't go I want to hold you tight and I need your love 얼마나 수 많은 날을 기다려 왔는줄 아니 이젠 모두 앞에서 너의 손을 꼭 붙잡고 우린 함께 하는거야 Oh LOVE 왜 이제서야 많이 외롭던 나를 찾아온거야 Oh LOVE 너를 사랑해 이제 모든 시간들을 나와 함께해 과거 따윈 모두 잊고 나와 함께 할 많은 시간을 추억으로 만들어 Oh LOVE 왜 이제서야 많이 외롭던 나를 찾아온거야 Oh LOVE 너를 사랑해 이제 모든 시간들을 나와 함께해
2016.06.06~06.12,76,8104430,Yum-Yum (얌얌),7goup,PRODUCE 101 - 35 Girls 5 Concepts,2016.03.19,Dance,서지음,yum yum yum yum yum 묘하게 중독되는 맛일 걸 yum yum yum yum yum 1 2 3 자꾸 끌리겠지 첨엔 나 맘에 없었죠 눈에 반짝 띄지도 않았고 난 신경 안 써요 너 결국엔 날 찾을 걸 지금 너를 봐 모르는 척 하지만 나만 보면 입 꼬리가 씰룩 올라가 네 눈빛이 자꾸만 꼬리치며 따라와 아니라며 내가 있는 상잘 다시 열어봐 한 입 다시 한 입 ah give me that 얌얌 give me give me give me that come on give me give me give me that 모른 척 얌얌 give me that 얌얌 give me give me give me that come on give me give me give me that 그댄 참 얌얌 give me that 1 2 3 자꾸 끌리겠지 이해해 다들 그래요  난 시간이 더 지날수록 당기죠 또 생각날 걸요 때와 장소를 가리지도 않구요 난 단지 한순간 달콤함이 아니야 나는 너의 무의식을 파고드는 그런 맛 그게 너는 얼마나 무서운지 잘 몰라  아니라며 너는 내게 다시 손을 뻗어와 한 입 다시 한 입 아이스크림 ah give me that 얌얌 give me give me give me that come on give me give me give me that 모른 척 얌얌 give me give me that 얌얌 give me give me give me that come on give me give me give me that 그댄 참 얌얌 give me give me that lalalalalalala 그렇게 빠져요 다들 위험해 보여요 요즘 lalalalalalala 심각해질 걸요 차츰 나 없인 안 돼요 더는 1 2 3 자꾸 끌리겠지 yum yum yum yum yum 묘하게 중독되는 맛일 걸 yum yum yum yum yum 묘하게 중독되는 맛일 걸 얌얌  give me give me give me that come on give me give me give me that 모른 척 얌얌 Ahha give me give me that 얌얌  give me give me give me that come on give me give me give me that 그댄 참 얌얌 1 2 3 자꾸 끌리겠지
2016.06.06~06.12,77,8217170,They Never Know,EXO,EX`ACT - The 3rd Album,2016.06.09,R&B / Soul,조윤경,난 그댈 향해  내 모든 걸 다 열어 둔 걸  내 눈빛도 맘 깊은 곳도  작은 틈도 없을 만큼 닫힌 세상 속  널 위해서 열린 유일한 곳  They never know   완벽히 다른 세상은  우리만 느낀 걸  They never know  이렇게 가까워진 이유  이 모든 것이 젖어 든 비에  모두의 시선 따윈 무시해  Oh 내가 먼저 선을 넘어 설게  네가 있는 그곳으로 Cross that  Would you dare to cross the line  Yeah 듣지마 그렇게나   우릴 break down  시키는 얘긴 no oh oh  부러워하는 눈빛   우린 회피 대신 즐기므로  둘만의 메시지 멋대로 상처 낸  타겟으로 그들이 쏘아 댄  화살에 스쳐 간 상처에  입 맞출수록 난  매일 더 네게 빠져들어  They never know  저 달의 푸른 뒤 편을  본 적이 없는 걸  They never know  내가 더 다가가는 이유  이 모든 것이 젖어 든 비에  눈을 가린 비  모두의 시선 따윈 무시해  Love is blind love is blind  Oh 내가 먼저 선을 넘어 설게  너와 같은 세상으로 Cross that  내 사랑은 네 맘에 이미  달이 차듯 가득해 Set free  망설임 너머 넌 그 경곌 넘어  또 그들이 뭐래도 믿지 말고   Let go don't say no   Let go don't say no  Oh 다른 목소린 듣지 마 baby  Let go don't say no   Let go don't say don't say   그들이 생각하는 엔딩에  이대로 우릴 맞춰 주기엔  네가 너무 아름다워  이 모든 것이 젖어 든 비에   모두의 시선 따윈 무시해   Oh 내가 먼저 선을 넘어 설게  네가 있는 그 곳으로  Baby tell me where the line is  Baby tell me where the line is
2016.06.06~06.12,78,8200929,"냉장고 (Feat. 이하이, 버벌진트)",길,냉장고,2016.05.28,Rap / Hip-hop,"길,버벌진트,Tenny(테니)",며칠 째 혼자인 저녁 아무도 없는 텅 빈 내 앞자리 냉장고를 열어보면 네가 내게 해준 설탕 가득 김치 볶음밥 어설펐던 내 요리 네가 사온 fast food 우리 둘을 위한 파티가 열렸지 매주 나는 몰랐네 진짜 우리가 이렇게 될 줄 식어버린 pizza 또 김이 다 샌 맥주 생각보다 예민한 편인가 봐 난 이 작은 box안에서 너의 빈 자리가 느껴지니 묻고 싶어졌어 마지막으로 딱 한 번만 다시 돌아갈 순 없을까 지금 어디니 그래 사랑이란 진짜 미친 짓 인가 봐 너 하나 때문에 밥도 못 먹는 날 보면 이제 네가 있던 곳으로 돌아 갈 거야 너와 함께한 사랑이 담긴 그곳에 냉장고 그래 차가워진 우리 사이 냉장고 그래 얼어붙은 우리 사이 녹을까 네가 사준 치즈 케잌  보고 있으면 자꾸만 화가 나 혹시 나를 잊은 걸까 잠이 오질 않아 너 때문에 대체 이게 뭐야 오 신기하게도 혼자서도 눈은 떠지네 우리가 붙어 지낸 그 날들의 흔적이  내 삶에서 지워졌다 믿었지 난 하지만 시간이 약이란 이야긴 다 거짓말 그날 이후로 얼마만일까 네가 나를 위해 챙겨준 반찬이 다 떨어진 나의 냉장고를 보면서 느꼈지 내가 내 삶 에서 잃어버린 것이 뭔지 그래 사랑이란 진짜 미친 짓 인가 봐 너 하나 때문에 밥도 못 먹는 날 보면 이제 네가 있던 곳으로 돌아 갈 거야 너와 함께한 사랑이 담긴 그곳에 냉장고 그래 차가워진 우리 사이 냉장고 그래 얼어붙은 우리 사이 녹을까
2016.06.06~06.12,79,8173038,끄덕끄덕,남우현,Write..,2016.05.09,Ballad,김이나,사람을 잊지 못해도 울다가 사람을 잊고 싶어도 울다가 결국 욕심이라 전부 내 탓이라서 내 맘속엔 내가 숨을 곳이 없네요 나 하루하루 말이 없어지는 건 겁이 나 이제 와 모든 걸 말하기가 그대만은 이런 날 오해하지 마요 소리 내 말하지 않아도 내 맘을 들어요 내 굳은살 같은 눈물 또 숨이 돼 버린 한숨 난 그래도 또다시 그리워 사랑을 믿느냐고 묻는다면 끄덕 끄덕 끄덕 또 기다린다고 다 지나간 건 잊으라고 하지만 이제 와 왜 내가 모든 걸 잊어야 해 새삼스레 아플 건 내게 있지 않아 설령 나 울고 있더라도 위로하지 마요 내 굳은살 같은 눈물 또 숨이 돼 버린 한숨 난 그래도 또다시 그리워 사랑을 믿느냐고 묻는다면 나 무뎌져도 결코 내 가슴 안에선 결코 그대 하난 지울 수 없어요 이것을 사랑이라 부른다면 허면 끄덕 끄덕 끄덕 끄덕 또 기다린다고
2016.06.06~06.12,80,8184653,열아홉,그리(GREE),열아홉,2016.05.18,Rap / Hip-hop,그리(GREE),불길한 예감은 역시 틀린 적이 없네 만약 복선이었다면 그때는 대체 언제 마냥 좋아 걷다 보니  결국 여기까지 왔네 많은 것을 놓치고 또 많이 잃은 상태 언제부터 잘못된 길을 밟은 걸까 한참 돌아보니 아마 내가 태어난 날 난 아버지의 아들로 김구라 아들로 만약 김현동의 아들이었담  친구들과 같았을까 yeah 걱정은 마  난 보다시피 내꺼 하고 있어 이게 멋있는 걸 알고 있어 요즘 나를 동정하는 사람 많이 봐 그 시선들이 행복해  난 아직 앤가 봐 난 아직 어려  근데 모두 내가 크기만 바래 난 아직 어려  내가 하고 싶은 건데 왜 안돼 난 성공만 성공만 바라면서  매일을 살고 있잖아 성공만 성공만 성공하면  모든게 조용해질까 매번 긍정적인 나도 흔들렸었지 많이 이혼 기사가 발표가 된 뒤에는  그저 잡생각이 심지어 현관 문 앞은  기자가 차지했을때 그때부터 인간은  잔인한 걸 알게 됐네 그래 우리 모두 입고 있어  젖은 코트를 걸쳤네 입고 있어도 춥고 그렇다고 벗기에는 겁이 나 난 내 고통이  더 크다고 생각했지만 색깔만 다를 뿐  누구 것이 더 비싸진 않어 인생은 증명의 연속이란 걸 배워왔듯이 우리는 어리숙하게나마  배워가고만 있지 성공이 과연 뭘까 생각해봐도 어린 나로선 그 정의를 못 내렸어 난 아직 어려  근데 모두 내가 크기만 바래 난 아직 어려  내가 하고 싶은 건데 왜 안돼 난 성공만 성공만 바라면서  매일을 살고 있잖아 성공만 성공만 성공하면  모든게 조용해질까 너희들이 아는 나의 삶은  생각보다 달라 살면서 반 이상을 달리는  차에서 잠 자 누군가 나의 삶에 대해 질탄하고 방관 하는 것은 11살 때쯤 깨달았어 아마 결국 시간이 약이란 게 느껴져 돌을 맞을 때는 가만히 있었네  난 그 어떤 무엇도  나를 증명해줄 수 없으니까 9년간 티비 속 내 모습은 어렸으니까 어둠이 있어야 별을 찾듯이 견디고 이겨내면 만날거야 반드시 그래 나도 이겨내고 있어 당연하듯이 너희도 이겨낼 거라고 믿어  반드시 yeah 오랜 고민 끝에 단어들로 채웠던 밤 내 꿈과 함께 매일 밤 지새웠지 난 성공을 되뇌인 다음 다시 펜을 잡아 나로선 할 수 있는 게  이거 밖에 없으니까 난 성공만 성공만 바라면서  매일을 살고 있잖아 성공만 성공만 성공하면  모든게 조용해질까 난 성공만
