time,rank,song_id,title,singers,album,date,genre,creator,lyric2014.04.21~04.27,72,4616538,뒹굴뒹굴,요조,소소한 이야기 Part.1,2014.04.24,Folk,17HOLIC,폭신한 베개를 배고서 밍기적  거리다 오늘도 일어나 졸린 눈꺼풀이 내려와 조금만 더  자자 피곤해 하는데 너무 귀찮아 뒹굴뒹굴 가기 귀찮아 뒹굴뒹굴 어떻게 하지 오늘이 정말 토요일이라면 좋은데 정말 좋아했을텐데 눈이 감겨져 몸이 나른나른 무거워 쉬고싶은데 하루만 uh 축처진 나의 어깨에 날개를 달아줘 Today Somewhere 구름을 파란 하늘을  맘껏 볼 수 있게 너무 귀찮아 뒹굴뒹굴 가기 귀찮아 뒹굴뒹굴 어떻게 하지 하루만 단지 그저 내 맘대로 지내고 싶어 아무 상관없이 잠시 가끔은 살짝 느릿느릿 생각해  누가 뭐래도 괜찮아 uh 축처진 나의 어깨에 날개를  달아줘 Today Somewhere 구름을 파란 하늘을  맘껏 볼 수 있게 모든게 다급히 변해가 눈 깜짝 할 사이 스치고 지나가 아직 난 익숙치 않나봐 어느새  혼잣말이 자꾸 늘어가 나도 모르게 뒹굴뒹굴 뒹굴뒹굴
2014.04.21~04.27,73,4397969,조금 이따 샤워해 (Feat. Crush),개리,MR.GAE,2014.01.15,Rap / Hip-hop,개리,조금 이따 샤워해 이대로   더 나를 안아줘   이렇게 니 품에서 얘기 하고파  조금 이따 샤워해 이대로   더 나를 안아줘  이렇게 니 품에서 장난 치고파 작지만 귀여운 너의 가슴이   난 좋아   니 머리카락 넘겨줄 때 손에   닿는 이마  내 몸 위에 올라 날 바라보는   그 눈동자  조명 아래 살짝 비친 하얀   살결의 빛깔  날 미치게 하는 이 못된 여자   때론 너와 사랑할 때 난 3년 만에   집에 온 뱃사람 같아  니가 날 거칠게 만드니까  침대는 바다가 되고 우린 헤엄쳐   서로의 상처를 치유하듯   부드럽게 어루만져  세상 가장 깨끗한 너의 품에 안겨  내 더렵혀진 영혼을 다 씻어  이대로 더 있어  격렬하게 사랑하고서 땀에   젖은 채 둘이 누워서  오늘 어땠냐고 묻는 너에게   난 끝내줘 끝내줘 끝내줘  우린 옷 벗고 사랑한 사이   더 이상 숨길 것 없어 세상   가장 친한 사이  학벌 배경 차이 그런 거 따위   신경 안 써 서로 딱 원하는 타입  서두르지마 오늘 밤은 깍지를   끼듯이 너의 허벅질 내   다리에 끼고 살을  다 맞대고 삶을 말하고 싶어  오늘 하루 어땠는지 다른  별일은 없었는지 늘 궁금해 난 니가 지금 이순간  나에겐 너무나 큰 낭만 삶의 난관 나의 방황 선과 악  그 모든 것이 다 두렵지 않아 너와 내가 함께 있는 이순간  오로지 평화 조금 이따 샤워해 이대로 더  나를 안아줘  이렇게 니 품에서 얘기 하고파 조금 이따 샤워해 이대로 더  나를 안아줘 이렇게 니 품에서 장난 치고파 어둠 속에 보일 듯 말듯한 너의  실루엣 너의 실루엣 나를 감고 있는 너의 두 다리는  끝내줘 끝내줘 끝내줘 가끔은 내 앞에서 아직도  부끄러워하는 너  난 니가 절대 안 질려 여전히  끌려 분명 우린 절대적 운명  찬 바람 불면 니 얼굴을 내 가슴에  묻어버리듯 딱 붙어 나도 알어 때론 너도 힘이 들텐데  니 남자 기죽어 보이는 거 싫어 널 허락하는걸 너란 여자 참  아름다워 늘 미안하지만  또 사랑스러워 나 혼자 남겨두지마 모든 게  완벽한 지금 이 순간 하얀 천사가 내 옆에 누워있네 날 바라보는 너의 두 눈에  살며시 키스해 조금 이따 샤워해 이대로 더  나를 안아줘  이렇게 니 품에서 얘기 하고파 조금 이따 샤워해 이대로 더  나를 안아줘 이렇게 니 품에서 장난 치고파 사랑하자 촛불 하나 켜놓고 단  둘이 꽉 껴안고 사랑하자 촛불 하나 켜놓고 단  둘이 꽉 껴안고
2014.04.21~04.27,74,4603933,누나라고 불러,"강민희,칸토",누나라고 불러,2014.04.15,Ballad,"강민희,칸토",어쩜 멍하니 있는 모습도  그리 예쁘니  뭘 먹고 자랐길래  뒤태도 멋지니  걸어가는 여자들  아니 남자들까지도   잠깐 멈춰서 뒤돌아 봐  행동만 봐도  사랑받고 자란 티가 나  넌 말을 예쁘게 해  예쁨받을 줄 알아  아는 형들 그래 누나들도   널 보면 다 웃는 얼굴  옷도 잘 입어 자세도 늘 바르고  인사도 잘해  주변 사람들도 다 널 찾아  부족한 게 뭐니  너 정말 사람 맞니   날개를 어디다 감춰둔 거야  눈치챘겠지만 내 마음은 이래  하지만 묻어둬야 해  잘해주지 마라  넌 너무 치명적이야  이 정도에서 얘기할게 잘 들어  누나라고 불러  왜 자꾸 이름을 넌 불러  얌전히 누나라고 불러  왜 자꾸 발을 맞춰 걸어  우린 이럼 안돼  Boy you're so stupid  제발 떼 좀 쓰지 말고   우리 편하게 지내자 yeah  좋은 꿈꾸고 일어나면 연락해  알았다고 대답하는 나를 발견해  이건 뭔가  연인들이 하는 대화잖아   이럼 안되는데  나도 잘 몰라  내 속마음이 어떤지  하지만 밀어내야 해  내 가슴 안에   너 자리 잡으면 우린 더 힘들어져  이 정도에서 얘기할게 잘 들어  누나라고 불러  왜 자꾸 이름을 넌 불러  얌전히 누나라고 불러  왜 자꾸 발을 맞춰 걸어  우린 이럼 안돼  Boy you're so stupid  제발 떼 좀 쓰지 말고   우리 편하게 지내자 yeah  발을 맞춰 걷는게  뭐 어때 정 그게  싫다면 뒤에서 걸을게  속도는 맞춰   I got you're back  전에 밤에 만났던  그 남자가 누군지 무척 화가 났지만 홍어처럼 삭혀 나한텐 고민 상담이나 하지 내가 보는 건 넌데 누난 페북을 업데이트 뭔 말만 하면 미쳤대 내 첫 싱글이 이건데 난 싫다고 편한 관계 그 전화 받지 말고 나랑 얘기해 그리고 이름이 싫으면 여보 자기 이런 건 어때 누나라고 불러 왜 자꾸 이름을 넌 불러 얌전히 누나라고 불러 왜 자꾸 발을 맞춰 걸어 우린 이럼 안돼 Boy you're so stupid 제발 떼 좀 쓰지 말고  우리 편하게 지내자 yeah
2014.04.21~04.27,75,4607130,Your Love (Feat. LISA),이정,Love Affair,2014.04.16,Electronica,"이정,2Face",feel it feel it 이젠 더 더이상은  curious 나를 향한 너의 마음  어쩌면 좋아  now show me your love  넌 나를 보며 얘기하지  또 알수없는 미소만  백마타고 데려갈 난 너의  영화속 왕자처럼 마냥 멋지고  완벽하진 않아도  12시가 지나면 풀리는  마법이라면  baby just all night long  Give me love  Just give me your love  오직 너만을 위한 내게  이세상 모든걸 다 네게 다 줄게  You and I  생각도 안했던 말  yes you and I  아직은 널 아끼는 말  넌 나를 보며 얘기하지  또 알수없는 눈빛만  너와나 오늘밤 ooh It's like  영화속 왕자처럼 마냥 멋지고  완벽하진 않아도  12시가 지나면 풀리는 마법이라면 baby just all night long Give me love Just give me your love 오직 너만을 위한 내게 이세상 모든걸 다 네게 다 줄게 조금씩 또 천천히 You'll be mine my love is your love 조금씩 또 천천히 내게만 I'll be there you're my love One step two step baby We can go under 네 몸을 내게 맡겨봐 이 음악은 우릴 위한거야 I can hold you in my arms Baby just all night long Give me love Just give me your love 오직 너만을 위한 내게 이세상 모든걸 다 네게 다 줄게 Give me love give me love Give me love give me your love 네 몸을 내게 맡겨봐 Give me love give me love Give me love give me yours my love
2014.04.21~04.27,76,4312933,향기만 남아,허각,Reminisce,2013.11.11,Ballad,라도,멀리서 불어와 날 스쳐 지나는  너를 떠올리게 하는 익숙한 향기 아직까지 널 잊지  못하는 걸 보니 바보 같아 언젠가는 저 바람처럼  흩어지겠지 향기만 남아서 나를 괴롭히는데  무뎌진 기억 너머로 너를 그리다 쓸쓸한 바람에 휘날리는 추억  이렇게 슬플 땐 누가  나를 위로해주나 두 눈을 감으면 또 니가 생각나  난 또 또 혼자 남아  이 거리를 또 헤매이다 아주 작은 떨림에 끌려  문득 고개를 들어보니  우리 같이 함께 불렀던  그 노래가 들려와 향기만 남아서 나를 괴롭히는데  무뎌진 기억 너머로 너를 그리다 쓸쓸한 바람에 휘날리는 추억  이렇게 슬플 땐  누가 나를 위로해주나 멀어지는 널 붙잡고 싶지만  언제나 그랬듯이  너를 잊고 살겠지 아련했던 너의 기억  아름다웠던 그 추억  아직도 널 닮은 향기만 남아 어느새 하루가 저물어 가네  짙은 추억만 남기고 멀어져 가네 혹시라도 니가 또 생각 날까봐  아무렇지 않게 하루를 살아 언젠간 널 다시 만날 수가 있을까  다른 사람으로 널 잊을 수 있을까 누구를 만나도 행복해야만 해  다시는 볼 수 없는 너  향기만 남아
2014.04.21~04.27,77,848567,인연,이선희,사춘기 (四春期),2005.04.14,Ballad,,약속해요 이 순간이 다지나고  다시보게 되는 그날 모든걸 버리고 그대곁에 서서  남은 길을 가리란 걸  인연이라고 하죠 거부할수가 없죠 내 생에 이처럼 아름다운 날 또 다시 올 수있을까요  고달픈 삶의 길에 당신은 선물인걸 이 사랑이 녹슬지 않도록 늘 닦아 비출께요  취한듯 만남은 짧았지만 빗장열어 자리했죠 맺지 못한데도 후회하지 않죠  영원한건 없으니까    운명이라고 하죠 거부할 수 가 없죠 내 생에 이처럼 아름다운 날 또 다시 올 수 있을까요  하고픈 말 많지만 당신은 아실테죠 먼길 돌아 만나게 되는날 다신 놓지 말아요  이 생에 못다한 사랑  이 생에 못다한 인연 먼길 돌아 다시 만나는 날 나를 놓지 말아요 -
2014.04.21~04.27,78,4536624,고마워 내사랑,홍대광,THE SILVER LINING,2014.03.21,Dance,,이른 아침햇살에 눈을 떠 약속된 하루를 시작한다 내 사랑 벌써부터 설레는 걸 혹시 실수한 데는 없을까 머리부터 발끝까지 본다 내 사랑 조금만 기다려줘 두근두근 내 마음 생각만 해도 Beautiful 지금 내가 너에게로 간다 너의 목소리가 듣고 싶어 또 한걸음에 달려가서 너를 내 품에 안고 싶어 오늘도 너의 손을 붙잡고 웃으며 거리를 걷고 싶다 내 사랑 넌 내게 첫사랑 카페에 앉아 널 기다리며 너의 사진을 또 꺼내본다 내 사랑 벌써부터 설레는 걸 오늘은 어떤 영화를 보고 어떤 맛집에서 뭘 먹을까 내 사랑 내게 와줘서 고마워 두근두근 내 마음 생각만 해도  Beautiful 지금 내가 너에게로 간다 너의 목소리가 듣고 싶어 또 한걸음에 달려가서 너를 내 품에 안고 싶어 오늘도 너의 손을 붙잡고 웃으며 거리를 걷고 싶다 내 사랑 넌 내게 첫사랑 좀 더 가까이 널 듣고 싶어 내 심장이 닿을 때까지 너를 내 품에 안고 싶어 지켜봐 네 앞에 서 있는 날 언제나 너에게 하고픈 말 사랑해 고마워 내사랑 사랑해 내 첫사랑 언제나 넌 내 사랑 사랑해 내 첫사랑 언제나 넌 내 사랑
2014.04.21~04.27,79,4438401,So Wonderful,레이디스코드,So Wonderful,2014.02.13,Dance,슈퍼창따이,Woo yeah So Wonderful  so so so so Wonderful 언제나   so so Wonderful Wonderful 너무 멋진 남자 그래 너란 남자   사랑해줬잖아 날 버리고 간 남자  나한테 갑자기 왜 이래요  나 밖에 없다던 사람이 왜 변해요  어쩜 좋아요 아직도 그대 여전히   멋져요 그댄 너무 멋져요  하루 종일 고민이 많아요  참 많아요  밤만 되면 잠들기 전에 꼭 울어요  어지러워요 아직도 나는 여전히   슬퍼요 너무너무 슬퍼요  so so so so Wonderful 언제나   so so Wonderful Wonderful  너무 멋진 남자 그래 너란 남자   사랑해줬잖아 날 버리고 갔잖아 so so so so Wonderful 언제나   so so Wonderful Wonderful  너무 못된 남자 날 버린 그 남자  사랑했었잖아 여전히 멋진 남자 여전히 그댄 너무 멋져요   나 없이도 어디서든 매력 넘쳐요  아직도 그대 잊지 못하죠 난 정말   미쳐요 이러다간 미쳐요  하루에도 수십 번 울어요  또 울어요  밤만 되면 네 생각에 잠도 못 자요  사랑이란 걸 너무 몰라서 아직도   슬퍼요 너무너무 슬퍼요  so so so so Wonderful 언제나   so so Wonderful Wonderful  너무 멋진 남자 그래 너란 남자   사랑해줬잖아 날 버리고 갔잖아  so so so so Wonderful 언제나   so so Wonderful Wonderful  너무 못된 남자 날 버린 그 남자   사랑했었잖아 여전히 멋진 남자  흔들어봐 바 내 맘 떨리도록 막   흔들어놔  Please don't stop the music  이 밤 너를 꽉 안아줄까  Da bi da bi da bi dab  날 버렸던 그 남자  Get up Get up Get up  Shut off Shut off Shut off  so so so so Wonderful 언제나   so so Wonderful Wonderful  너무 멋진 남자 그래 너란 남자   사랑해줬잖아 날 버리고 갔잖아 so so so so Wonderful 언제나   so so Wonderful Wonderful  너무 못된 남자 날 버린 그 남자   사랑했었잖아 여전히 멋진 남자
2014.04.21~04.27,80,4534771,내게기대 (Feat. 박세영),스탠딩에그,The Artist Diary Project Pt.8,2014.03.21,Rock,"김도훈(RBW),지누,고동연",어느덧 오랜 시간 서로에 익숙해져 잊고 있던 처음 기억들이 조금은 어색해져 니 모습 전 보다 더 조금은 어느덧 진지한 너무 많이 조급해 하지는 마 말 안 해도 니 맘을 느껴 하루가 힘들 때면 난 너의 웃는 모습 그려 너도 매일 조금 힘들더라도 여율 갖고 나에게 기대 해질녘 집에 오는 길 오늘 난 너를 기다리다 문득 하고팠던 말로 다독거려 조급해 하지마 여율 갖고 나에게 기대 하루가 힘들 때면 난 너의 웃는 모습 그려 너도 매일 조금 힘들더라도 여율 갖고 나에게 기대 해질녘 집에 오는 길 오늘 난 너를 기다리다 문득 하고팠던 말로 다독거려 조급해 하지마 여율 갖고 나에게 기대 힘든듯한 널 보면 답답해져 내 마음도 믿어 줬으면 해 사랑하는 맘 모두 조금만 더 기다려줘 하루가 힘들 때면 난 너의 웃는 모습 그려 너도 매일 조금 힘들더라도 여율 갖고 나에게 기대 해질녘 집에 오는 길 오늘 난 너를 기다리다 문득 하고팠던 말로 다독거려 조급해 하지마 여율 갖고 나에게 기대
2014.04.21~04.27,81,4559292,살만해졌어,손승연,살만해졌어,2014.04.01,Ballad,물만난물고기,사람들 많은 거리에서  혼자 우는 것도  내 방문을 잠그고 사는 것도  TV를 켜놔야 잠들고  이별 노래 가사도  이제야 견딜 수 있게 됐어  헤어진 그날부터  물 한 모금도 못 넘기던 내가 숨쉬기조차 힘들었던 내가  니가 그리워도 너무 그리워도  미치게 그립진 않아  나를 봐 너 없이도 살만해졌어  넌 어때 내가 못 하게 하던거 게임 술 또 밤 늦게  친구들을 만나 웃으며 잘 사는지 어디 아픈 곳은 없는지 일은 잘하고 있는지 외로움이 많은 여잘 만나서  니 생활이 없던 너 물 한 모금도 못 넘기던 내가 숨쉬기조차 힘들었던 내가  니가 그리워도 너무 그리워도  미치게 그립진 않아  나를 봐 너 없이도 살만해졌어  우연히 너와 마주쳤던  니 옆에 그 사람  나 없이도 행복하게 지내보여  내 걱정은 하지마  나도 다 잊었으니까  너를 돌아서도 아무렇지도  않을 수 있게 됐어 니가 없다고 때만 쓰던 내가  니가 오기만 기다렸던 내가 사랑한다 에서 사랑했다 라고  웃으며 말하게 됐어  나를 봐 너 없이도 살만해졌어 살만해졌어  물 한모금도 못 넘기던 내가 물 한모금도 못 넘기던 내가
2014.04.21~04.27,82,4393161,Lonely (없구나),B1A4,Who Am I,2014.01.13,Dance,"바로,진영",lonely lonely lonely  lonely lonely lonely lonely lonely lonely  lonely lonely lonely lonely lonely lonely  lonely lonely lonely lonely lonely lonely lonely boy lonely lonely lonely  lonely lonely lonely lonely lonely lonely  lonely lonely lonely lonely lonely lonely  lonely lonely lonely lonely lonely lonely lonely boy 네가 사준 넥타이에  화이트셔츠 조금 작은  한 동안 안 입던 팬츠 혼자 입고서 난 랄랄라  혼자 좋아서 난 랄랄라 다시 꺼낸 많이 낡은 스티커 사진  예전 너와 내가 행복해 웃는 사진  혼자 보고서 난 랄랄라  혼자 좋아서 난 랄랄라  아직 난 왜 여전히  왜 여기서 왜 이러는지 내가 다시 전화할게  자기야 no  내가 잘할게 더 나 때문에  울지 않도록 나 너무 그리워  네 눈 네 코 네 입술 함께 밥을 먹으려 해도 네가 없구나 같이  영활 보려고 해도 네가 없구나 우린 아무것도 없구나 정말 아무것도 없구나 every day every say  너와 함께 거리를  걷는다 걷는다  다시 함께 걷는다면  우리 함께 걷는다면 좋겠다 네가 내게 항상  들려줬던 노래  이젠 내가 네게 들려주는 노래 혼자 듣고서 난 랄랄라  혼자 좋아서 난 랄랄라 네가 없는 거리를 걸어보고 네가 없는 차를 타고  달아나고 달아나도  결국 네게 눈이 먼 바보 날 찾는 사람은 없는 듯 해  활짝 빛이 나던 네 맘의  창들도 이미 닫힌 듯 해 hey 함께 밥을 먹으려 해도  네가 없구나 같이 영활  보려고 해도 네가 없구나 우린 아무것도 없구나  정말 아무것도 없구나 every day every say  너와 함께 거리를 걷는다 걷는다 다시 함께 걷는다면  우리 함께 걷는다면 아직 난 왜 여전히  왜 여기서 왜 이러는지  연기처럼 흩날리는 기억 you're right girl  나는 많이 아파  sick my heart 우리에게 절대 없을 거라던 이별 몰래 날 찾아왔다가  이렇게 너무 쉽게  사랑은 소리 없이 나를 떠나 다시 돌아가려고 해도  네가 없구나  아무리 불러 봐도 이제  네가 없구나  우린 아무것도 없구나  정말 아무것도 없구나 every day every say  너와 함께 거리를 걷는다  걷는다 다시 함께 걷는다면  우리 함께 걷는다면 baby I just wanna spend some time with you baby I just wanna spend  some time with you baby I just wanna spend  some time with you baby I just wanna spend  some time with you
2014.04.21~04.27,83,4618061,여행일기,버블시스터즈,여행일기,2014.04.23,Ballad,서지음,주사위를 높이 던져 둘을 더한 숫자만큼 너에게로 갈 수 있다면 I never cry 간단하게 짐을 챙겨 멀어졌던  시간만큼 잃어버린 너를 찾아서 I never cry 지나가는 걸음마다 네 모습이 아른거려서 하나씩 멈춰 인사하고파 여기서 난 hello 너무 보고 싶었어 다시 hello 너를 느끼고 싶어 어쩜 변함없이 그대로일까 저기서 넌 hello 너무 보고 싶었어 다시 hello 너를 만지고 싶어 네게 가는 길 너를 만났어 hello 아주 멀리 있다 해도 지구  반대편이라도 하나도 난 두렵지 않아 I never cry 여행이란 그런 거지 한 치 앞도 모르지만 그래서 더 설레이는 것 I never cry 지나가는 거리마다 기억속의 엽서 같아서 하나씩 멈춰 인사하고파 여기서 난 hello 너무 보고 싶었어 다시 hello 너를 만지고 싶어 어쩜 변함없이 그대로일까 저기서 넌 hello 너무 보고 싶었어 다시 hello 너를 만지고 싶어 네게 가는 길 너를 만났어 hello 아득히 보여도 너를 알아볼 거야 분명히 너도 날 다시 알아볼 거야 가벼운 인사로 모두 느낄 수 있어 그동안 얼마나 서로 간절했는지  hello hello 우린 다시 hello 너무 보고 싶었어 다시 hello 너를 느끼고 싶어 어쩜 변함없이 그대로일까 우린 다시 hello 너무 보고 싶었어 다시 hello 너를 만지고 싶어 네게 오는 길 너를 만났어 hello
2014.04.21~04.27,84,4607139,약한 남자,"주석,스윙스,Dok2,딘딘",듀스 20주년 헌정앨범,2014.04.16,Rap / Hip-hop,"주석,스윙스,Dok2,딘딘",Young Swings take 1 take 2  with D O we make more hits  than Babe Ruth  링겔을 하진 않았지만  가끔 약한 남자  대신 고개를 다시 들지   나는 항상 향상  그런 태도로 올려  다음 level로  pay 받고 돈 세고   또 좋은 곡을 내고요  내 정신 상태 한 마디로 말해 진보  7년 랩 학생 입학식부터  been dope  넘어지면 다시 일어서 날 치유해  이게 모든 rapper가  날 따라하는 이유래  I'm the best of the best  walk around in the street like   there's an S on my chest  아빠 미소를 띄운 건 DO  지도를 접수하는 건 쉬운 것   we own it  1 for 1 Illie Gang  Seoul City's Finest  Brand New Just Music  King Swings behind it  난 이자리를 지켰어  나 약한놈들 제끼고  내 16마디는 지금 서있는   내 위치고   아령만 들고 뻘짓하는   너가 그냥 웃기고   Check ma swag swag  니가 탈레반이면 난 부시고   여자들은 한번쯤   나를 뒤돌아봐봐봐   너같은놈들은 한번쯤   날 훑고 지나가다가   다다 놀라 영혼조차   팔려버린놈들 한국에   발디딜곳도 없게 만들지   이노래 한곡에   That's right  야임마 니가 뭘알아 난 본적없는데   그러니 내 손바닥 안에서 놀아라   강한남자 코스프레 하지마   don't play  강한남자 코스프레 하지마   don't  난 오바마 내 신경 건드림 버럭해   Can't can't control ma sence   딘딘이 더 독해   Yeah im with the d o swings JC   Dok2 force deux we tell'em Leggo  Open up your hood   좀 들어봐 얼굴  빛이 나질 않잖아  필라멘트 끊긴 전구  무리해서 대출 대충 받아   겉치장해봤자  알맹이는 그대로 나머지는 다 가짜  숨을 쉬긴 하는데 넌 워킹데드  계속 정신 못차리면 인생 더 엉킨데  때론 커브도 필요한데 남잔 돌직구  속는 셈 치고 던져 형 말 한번만 믿고  우월의식에 젖은 몇몇 강남 클러버  눈 코 입 모조리 같은   가족 같은 클론녀  니 전두엽 마비시키는   뇌쇄적인 댄스  조심해 그녀가 원하는 건  니가 아닌 벤츠  Take care son   you better wait your turn  바로 진정 강한 남자가 되는 분기점  Check yourself  넌 너무 약했어  이제는 방아쇠를 당겨   You gotta know that son  아무리 강한척 해봤자  현실 앞에선 다 약자  각잡고 욕하며 센척해도 다 가짜  낯짝 두꺼운 듯 행동하는 귀요미  실패를 두려워해  멀리서나 지켜보기만 할뿐  행동은 없지 혀나 깨물고 입닫어 말은 천냥빚을 갚지만  니 말은 딱 이만원 시작은 화려해도 결국 초라한 니 끝 But im good  절대 떨어지지 않는다는 뜻 나는 쭉 뻗어 나가 young hustle for life 실패는 안 두려워  this is hustlers life Hustlers like bust it lets ball til we fall 내가 고 하면 고 아님 노 라면 노 Imma do it wit my nike on  다 하고보잔 식 난 나만 믿어 뭐든  할 수 있다는 걸 알지 its legendary d o wit  illionaire young d o G o n z o just Chuck up the deux
