time,rank,song_id,title,singers,album,date,genre,creator,lyric2011.03.20~03.26,52,3176448,구름을 달아,오종혁,"Run To You, Fly With Cloud",2011.03.14,Rock,더네임,모래성처럼 무너져버릴까 힘에 부쳐서 견딜 수 있을까 두려웠었어 무수히 지난 시간들 이제야 알았어 지금껏 너만을 바래왔단 걸 I don't wanna cry 네게 달려가 구름을 달아 날아가 너에게 가는 길이 멀고 험해도 난 너에게 날아갈 거야 I don't wanna leave 네게 달려가 바람을 타고 오를까 발이 닿는 그곳 내 맘이 전해질까 In your mind  그림자처럼 잊혀져 버릴까 세상에 지쳐 돌아서 버릴까 두려웠었어 혼자서 보낸 시간들 이제야 알았어 이순간 너만을 기다렸단 걸 I don't wanna cry 네게 달려가 구름을 달아 날아가 너에게 가는 길이 멀고 험해도 난 너에게 날아갈 거야 I don't wanna leave 네게 달려가 바람을 타고 오를까 발이 닿는 그곳 내 맘이 전해질까 In your mind  I don't wanna leave 네게 달려가 바람을 타고 오를까 구름을 달아 날아 오르면 니가 닿을까 In your mind In your mind
2011.03.20~03.26,53,3065251,집에 가지마,GD&amp;TOP,GD&TOP 정규앨범 1집,2010.12.24,Rap / Hip-hop,"TEDDY,G-DRAGON,T.O.P,DavidGates,이낙",집에가지마 baby oh 너에게 줄 선물이 여기 있는데 오늘은 집에가지마 baby yeah 나도 실은 익숙하지 않아요 sweet heart A yo turn it up 어색한 분위기는 싫어 시계침 소리가 원래 저리도 컸을까 목에 침 넘어가는 소리만 들려 뭐랄까 Look baby 난 그저 너와 아침을 맞고 싶어 오늘 이 밤이 다 가기 전에 둘만의 secret party 근데 넌 like 신데렐라 12시 땡 치면 집에갈라 hey 혼자인 밤은 길어 calling up 너의 부모님께 hey 센 척하지만 맘에 걸려 sos 진도는 멀었으 오 이런 잠깐 나 왜이러지 취했나 어지러워 잠이 들어 집에가지마 baby oh 너에게 줄 선물이 여기있는데 오늘은 집에가지마 baby yeah 나도 실은 익숙하지 않아요 sweet heart 부드러운 음악 소리에 빨간 장미꽃 가득 한아름 OOH 내일이면 어차피 가잖아 늦었어 위험해져 자기야 아냐 별뜻없이 니 걱정 돼 그래 누가 잡아가면 어떡해 긴긴 이 밤이 밤이 황홀한 별들의 잔치 어떤 무엇도 막을 수 없죠 하나가 된 느낌 그대로 멈춰 Hey i can't let you go 너와 잠시라도 떨어질 수 없어 억지로 참지 말아줘 집에가지마 baby oh 너에게 줄 선물이 여기 있는데 오늘은 집에가지마 baby yeah 나도 실은 익숙하지 않아요 sweet heart baby take my hand don't be afraid me just say together 널만난후로 처음이야 집이 엄해서 겁나지만 excited 휴대폰 진동 안 좋은 징조 초인종 딩동 피하란 신호 빙고 확신을 줘 아직 그녀에게 그럴싸한 말로 둘러대게 이세상 가장 예쁜 fiance 푸른 초원 위 님과 함께 원랜 wild 하지만 soft해 책임 못질 말 아예 못해 girl you know what I mean 이걸 설명하긴 어려워 하긴 필요 없는 얘기 조명을 낮추고 너와 시선을 맞추죠 꽉 잠긴 단추도 살짝 풀고 입이 마르고 문은 잠그고 집에가지마 baby oh 너에게 줄 선물이 여기있는데 오늘은 집에가지마 baby yeah 나도 실은 익숙하지 않아요 sweet heart Ah Ah 모두가 잠 든 이 밤 혼자 웃는 건 싫어 Ah ooh Ah 저 달빛에 숨어서 달콤한 속삭임을 해
2011.03.20~03.26,54,3325189,립스틱 짙게 바르고,김건모,[서바이벌 나는 가수다] 경연1. `80년대 명곡 부르기,2011.03.20,Ballad,양인자,내일이면 잊으리 꼭 잊으리
2011.03.20~03.26,55,3145650,너 말이야,F-veDolls,Charming Five Girls,2011.02.16,Dance,김이나,This is 5dolls
2011.03.20~03.26,56,3116963,기가 차 (Feat. 슈프림팀 ＆ 씨스타),케이윌,기가 차,2011.01.21,Ballad,"디스크브라더스,박장근,사이먼도미닉",이제 그만 좀 해
2011.03.20~03.26,57,3110581,Back It Up,쥬얼리,Back It Up,2011.01.27,Dance,"김이나,크리스",How much you love me How much you love me 부끄러워하지마 right now 날 유혹해봐 날 흔들어봐 네게 빠져들도록 모두 너를 보고 제일이라해도 먼저 와주기만 바란다고 해도 Buy another drink 뻔한 니 style 넌 어딘가 부족해 Back it up Back it up Back it up Back it up Back it up Back it up Back it up Back it up Back it up Back it up Back it up Back it up 자꾸 티내고픈 마음 나도 알아 가끔 뻔뻔해지고픈 맘도 알아 Buy another drink I'll drink it all up 내게 내게 빠져봐 Whenever you get lonely and need someone to hold please Call me up boy I'll be there in a hurry 못이기는 척 손도 나와 잡고 이렇게 서로의 마음을 꽉 사로잡아 네게 가는길 마지막 거울을 보고 dress code와 make up을 Check 가는 길 리듬을 타고 계속 빠지고 싶어 Cuz I'm a back it up back it up back it up man How much you love me How much you love me 빠져버린걸 알아 right now 애원하는건 애걸하는건 질리기만한 뻔한 수법 사실 모두 다가 알고있는 얘기 다들 알면서도 지나가는 얘기 놓치고나서 후회하면서 매일하는 이 얘기 Tell me you love me too call me up boy Back it up Back it up Back it up Back it up Back it up Back it up Back it up Back it up Back it up Back it up Back it up Back it up 자꾸 티내고픈 마음 나도 알아 가끔 뻔뻔해지고픈 맘도 알아 Buy another drink I'll drink it all up 내게 내게 빠져봐 날 가지려면 날 갖고 싶다면 좀 더 서둘러야해 Back it up Back it up Back it up Back it up Back it up Back it up 뻔한 레파토리 이젠 너무 지겨워 이제는 turn it up turn it up turn it up now 다시 생각해 후회하지 말고 back it up back it up back it up now 두근두근 심장이 멎네 여기저기서 나를 원해 그 중 너도 나를 바라네 Bring your friends keep it right 나도 모르게 내 맘을 뺏어 If you want it you can have it 충분히 넌 매력있잖아 Back it up Back it up Back it up Back it up Back it up Back it up Back it up Back it up Back it up Back it up Back it up Back it up 자꾸 티내고픈 마음 나도 알아 가끔 뻔뻔해지고픈 맘도 알아 Buy another drink I'll drink it all up 내게 내게 빠져봐 살짝 네 어깨에 기대어 볼까 Back it up Back it up Back it up 살짝 네게 속삭여볼까 Back it up Back it up Back it up 살짝 네게 윙크를 해볼까 Back it up Back it up Back it up 사랑한다면 날 원한다면 내게 내게 빠져봐
2011.03.20~03.26,58,3107348,어쩌라고,승리,승리 1st Mini Album V.V.I.P,2011.01.20,Dance,"승리,빅톤",VI VI VI like this Come step to this I'm breakin down down down down down Breakin down now breakin breakin down down I'm breakin down down down down down Breakin down now breakin breakin down down 내가 니 남자라는 말 말 믿었는데 데 넌 왜 왜 날 위해서라는 그 말 말 제발 Don't say Don't say So tell me 도대체 왜 내게 이러는지 Baby 나는 아무것도 못해 이렇게 바보처럼 날 내버려두고 넌 떠나가니 왜 난 어쩌라고 이래도 싫고 저래도 싫은 너는 왜 자꾸만 죄도 없는 나를 탓해 그럼 난 어쩌라고 난 어쩌라고 내 모든걸 다 주고 너에게 다 바쳐 이젠 남은 거라곤 내겐 너 뿐야 더 이상 나를 피하지는 마 더는 I'm breakin down down down down down Breakin down now breakin breakin down down I'm breakin down down down down down Breakin down now breakin breakin down down 널 다시 만나줄 생각 난 없었는데 데 또 왜 왜 매일 밤 꿈속에서 넌 넌 웃고 있어 있어 So tell me 도대체 왜 내게 이러는지 Baby 나는 아무것도 못해 이렇게 바보처럼 날 내버려두고 넌 떠나가니 왜 난 어쩌라고 내 모든걸 다 주고 너에게 다 바쳐 이젠 남은 거라곤 내겐 너 뿐야 더 이상 나를 피하지는 마 더는 Let's breakin down  난 어쩌라고 Hey I'm slowly breakin down I'm slowly breakin down 난 어쩌라고 이대로 널 보낼 수는 없어 난 어쩌라고 내 모든걸 다 주고 너에게 다 바쳐 이젠 남은 거라곤 내겐 너 뿐야 더 이상 나를 피하지는 마 더는 I'm breakin down down down down down Breakin down now breakin breakin down down I'm breakin down down down down down Breakin down now breakin breakin down down
2011.03.20~03.26,59,3273444,해바라기 (후쿠야마 마사하루 리메이크),임정희,해바라기 (후쿠야마 마사하루 리메이크),2011.03.15,Ballad,,달콤한 꿈을 꾸고 있죠 그 해 여름 그대와 내 모습 무엇도 대신할 수 없는 행복했었던 계절의 순간들 한결같이 한 곳만 보는 해바라기꽃처럼 감싸준 사람 노을이 지면 그대 무릎을 베고 누워서 바람 소리를 자장가 삼아 잠을 청하고 시간이 가는 줄도 모르고 그대와 나 우리가 함께 있다는 이유로 행복했던 그 시절  우리의 추억이 남겨진 버스 정류장 아직도 있을까요 둘이서 걸었던 바닷가는 아직 그 모습 그대로 있을까요 장난을 치며 나를 웃게 한 반딧불처럼 나를 밝혀준 사람 저녁노을에 서로의 등을 마주대고서 추운 바람에 젖은 머릿결 얼어버려도 둘이라는 게 너무 좋아서 그대 이름 부르고 또 부르며 웃었던 행복했던 그 시절  노을이 지면 그대 무릎을 베고 누워서 바람 소리를 자장가 삼아 잠을 청하고 시간이 가는 줄도 모르고 그대와 나 우리가 함께 있다는 이유로 행복했던 그 시절  달콤한 꿈을 꾸고 있죠 그 해 여름 그대와 내 모습 우리 둘이 살던 그 여름처럼 해바라기가 피어나고 있네요
2011.03.20~03.26,60,3333475,Unbelievable,"미지,김진호(SG워너비)",Unbelievable,2011.03.25,Ballad,,또 어느새 며칠이 지났어요 비록 그대는 없지만
2011.03.20~03.26,61,3319048,Milk Tea (후쿠야마 마사하루 리메이크),지나,Milk Tea (후쿠야마 마사하루 리메이크),2011.03.17,Ballad,,미안해요 왜 그때는 솔직하게 말 못했던 건지 고마워요 언제라도 난 그댈 생각하고 있어 잘웃지 않았던걸 내맘을 감췄던걸 오해하진 않을까 아직도 나를 좋아해 줄까 사랑하고 있어 그댈 만나고 싶어 이제 내 마음속 모든 것은 그대만 찾아요 사랑하고 사랑받는 내일을 꿈꿔 하나뿐인 내사랑은 오직 다 그대만의 것 모두 그대만의 사랑 바보구나 웃으면서 내 얘길 들어주곤 했었죠 힘을 내렴 고마운 그대 내 손을 잡아주었죠 사랑에 아파했던 지나온 잊혀진 추억 그대가 아는 걸까 그래서 이런 내게 잘해준걸까 그래도 사랑해요 정말 만나고 싶어요 이젠 그대없이 이밤을 그냥 보낼수 없어요 그대와의 이야기 그대품에 안겨서 웃고 있는 우리를 꿈에서 만나고 싶어요 이제 나의 꿈에 와요  비가 내린 골목길에 우산을 함께하며 불러줬던 그노래 혹시라도 손이 찰까 손에 건네줬던 밀크티 아직 따스해서 너무 그리워요 사랑하고 있어 그댈 만나고 싶어 이제 내 마음속 모든 것은 그대만 찾아요 사랑하고 사랑받는 내일을 꿈꿔 하나뿐인 내사랑은 오직 다 그대만의 것  모두 그대만의 사랑
2011.03.20~03.26,62,3037051,니까짓게,씨스타,니까짓게,2010.12.03,Dance,용감한형제,Si si sistar brave sound
2011.03.20~03.26,63,3324656,Love Girl,CNBLUE(씨엔블루),FIRST STEP,2011.03.21,Rock,"정용화(CNBLUE),한성호",Tell me Tell me 사랑을 말해줘 Tell me Tell me 네 사랑 전해줘
2011.03.20~03.26,64,3089348,왜 (Keep Your Head Down),동방신기(TVXQ!),왜 (Keep Your Head Down),2011.01.05,Dance,유영진,모두 끝나버렸다 난 시작도 안 해봤는데 헤어져 버렸다 난 이유조차 못 듣고 주변 사람들 모두 하나같이 날보고 너 왜 그래 왜 그래 왜 그래 난 이미 나쁜 놈 죄라면 널 사랑한 게 죄라면 그게 죄라면 진실 했다는게 죄라면 나는 Keep it low 나는 Keep it low 난 참아내고 내 자릴 지켜 Keep your head down 넌 정말 예쁘지만 너무 다른 너의 속이 난 너무 두려워 Keep your head down 사랑했다 하지만 난 이제 널 놓겠다 왜 날 그렇게 쉽게 떠났니 왜 내가 쉬워 보였던 거니 왜 내 가슴은 찢어지잖아 왜 모두 한 순간의 꿈이었다면 왜 바로잡을 시간이 있었다면 왜 제발 네가 행복하길 바랬다 나 언제나 언제나 너를 가진 걸로 충분했고 세상이 뭐래도 같은 꿈을 꿔서 행복했고 지금은 널 보내게 됐지만 어차피 내 길을 갈뿐이고 Now I'm just chillin' Feel like I'm healing 늦어버렸다 넌 다시 돌아갈 수 없단다 네가 없다면 난 무너질 거라 믿겠지 예전부터 넌 그건 착각이라고 내가 왜 그래 왜 그래 왜 그래 널 타일렀잖아 Hey 난 정말 정말 슬펐다 철이 없던 네가 혹시라도 나쁜 사람 만날까 Why baby Keep your head down 넌 정말 예뻐 근데 그뿐이야 네 가슴에 중요한게 없는걸 Keep your head down 사랑의 아픔을 참는 가슴에 못 박고 왜 날 그렇게 쉽게 떠났니 왜 내가 쉬워 보였던 거니 왜 내 가슴은 찢어지잖아 왜 모두 한 순간의 꿈이었다면 왜 바로잡을 시간이 있었다면 왜 제발 네가 행복하길 바랬다 하 그렇게 너 사람 갖고 장난 장난 치지 마라 내 앞에선 요래조래 거짓말만을 늘어놓고 누가 봐도 누가 봐도 넌 정말 이중적이야 왜왜왜 수정 같던 마음들이 언제 그렇게 탁해졌니 사랑을 끝냈다 널 보낸 가슴이 텅 비워졌다 하지만 내 미래는 마치 일어나서 웃으라고 손짓한다 너를 보낸다 정말 행복하게 살아 왜왜왜 먼 훗날에 먼 훗날에 그냥 편하게 웃고 싶다 하하  왜 왜 사랑을 그렇게 쉽게 놔버리는 너를 누군가 걱정할거란 생각은 해봤나 왜 니가 놔 버린 게 너는 뭔지 왜 아직 모르는 것 같아 왜 그대로 머물러 나를 지켜봐 Keep your head down 지워졌다 사라졌다 내 가슴에 니가 죽어 모두 타버렸다 Keep your head down 지워졌다 사라졌다 내 가슴에 니가 죽어 너는 이제 없다
2011.03.20~03.26,65,3156359,언제나 사랑해,제이세라,Endless Love,2011.02.24,Ballad,조영수,둘이 손잡고 걸을때 마주보며 또 웃을때 사랑한다 말하지 않아도 알아 널 만나러 가는길에 내 입가에 늘 환한 미소만이 흐르고 있어 사랑해 너를 사랑해 눈물나도록 사랑해 저기 밤하늘의 별보다 보석보다 니가 더 소중해 얼마나 내가 얼마나 너를 사랑하는지 내 모든걸 너에게 줄께  속상하고 힘이들때 열이나고 아파할때 옆에서 늘 힘이되준 사람 너야 집에 돌아오는 길에 내 귓가엔 늘 너의 음성만이 흐르고 있어 사랑해 너를 사랑해 눈물나도록 사랑해 저기 밤하늘의 별보다 보석보다 니가 더 소중해 얼마나 내가 얼마나 너를 사랑하는지 내 모든걸 너에게 줄께 세월지나 많이 변했을때 미운 나의 손을 잡아줄 사람 먼 훗날 아주 먼 훗날 우리 눈감는 그날에 나를 사랑해준 너에게 고맙다고 후회는 없다고 사랑해 나만의 사랑 다시 태어난대도 내 사랑은 너하나 뿐야 영원히 너를 사랑해
2011.03.20~03.26,66,3152817,다시,엠블랙,BLAQ Style 3D Edition,2011.02.22,Dance,"BlueMagic,태완(Taewan)",Now Game is Over  더이상 다신 나를 막을순 없어  슬픔도 Over  아파할 시간 조차 없어  Baby tell me Why  그 예쁜 미소가 내것이 아닌건지  Why don't you tell me why  널 다시 가질수만 있다면  난 다시  Tryyyy Try 몇번을 부딪혀도  Tryyyy Try 마지막이 된데도  갇힌 내 마음도 숨겨온 사랑도  더는 참을수 없어  Try Try 너를 잊고 잊어도  Try Try 가슴 찢고 찢어도  Bye Bye  But Give me Give me one mo' try  Tryyyy Tryyyy  It's getting closer  시간이 다가오고 있음을 느껴  아픔은 Over 가슴속 검은 고통들도  Baby tell me Why  너무도 원했던 니 작은 입술이  Why don't you tell me why  이별을 말해야만 하는지  But I will  Tryyyy Try 몇번을 부딪혀도  Tryyyy Try 마지막이 된데도  갇힌 내 마음도 숨겨온 사랑도  더는 참을수 없어  Try Try 너를 잊고 잊어도  Try Try 가슴 찢고 찢어도  Bye Bye  But Give me Give me one mo' try  Tryyyy Tryyyy  다시 쓰러진대도  그 끝이 뻔히 보인다해도  니가 뱉은 모든 lie  그 따위것 모두 믿어준대도  날 불태워 내 눈에 분노를 채워  I'll be on the Second round  이건 또 시작된 싸움  난 다시  Tryyyy Try 몇번을 부딪혀도  Tryyyy Try 마지막이 된데도  갇힌 내 마음도 숨겨온 사랑도  더는 참을수 없어  Try Try 너를 잊고 잊어도  Try Try 가슴 찢고 찢어도  Bye Bye  But Give me Give me one mo' try  Tryyyy Tryyyy
2011.03.20~03.26,67,3151428,누구보다 널 사랑해,디셈버,조영수 All Star - 디셈버,2011.02.21,Ballad,조영수,너는 소중한 사람이야 가장 아끼는 사람이야 보석보다 빛나는 너야 그런 널 지켜줄 나야 네가 눈물 흘리면 내가 더 아프잖아 두 눈에 넣어도 아프지 않을 그런 사람이니까 누구보다 널 사랑해 누가 뭐래도 널 사랑해 힘이 들면 나의 어깨에 기대어 너 실컷 한번 울면 돼 뜨거운 저 태양보다 환히 빛나는 저 별보다 내 사랑은 식지 않을 거라고 너에게 약속해  마음껏 자랑하고 싶어 세상에 소리치고 싶어 영원히 넌 내 여자라고 넌 나의 반쪽이라고 너 밖에 모르는 나 그래도 난 행복해 다시 태어나서 사랑한대도 널 사랑하고 싶은데 누구보다 널 사랑해 누가 뭐래도 널 사랑해 힘이 들면 나의 어깨에 기대어 너 실컷 한번 울면 돼 뜨거운 저 태양보다 환히 빛나는 저 별보다 내 사랑은 식지 않을 거라고 너에게 약속해 고마워 날 다시 태어나게 한사람 정말 놀라운 너 내겐 특별한 너 내가 널 지켜줄게 이것 하나만 잊지마 이것 하나만 기억해줘 세상모두 너에게 등을 돌려도 너의 편이 되어줄게 누구보다 널 사랑해 영원히 난 너만 사랑해 내 사랑은 식지 않을 거라고 너에게 약속해 너만을 사랑해
2011.03.20~03.26,68,3324657,상상 (Imagine),CNBLUE(씨엔블루),FIRST STEP,2011.03.21,Rock,"정용화(CNBLUE),한성호",널 처음 본 순간 꿈인 것 같았어 천사처럼 예쁜 네 미소 때문에 그런 네가 나의 사랑이 되면 어떨까 상상만으로도 행복해 지는 걸 한쪽씩 이어폰 사이 좋게 나누고 밝은 햇살 받으며 바라보며 나 웃고 남들 시선 따윈 신경 꺼 나 나만 보기에도 시간 아까워 I I'll let you know 나는 너를 상상해 나를 보며 웃는 너를 상상해 내 손 잡아주는 널 마법을 걸어 내 사랑이 되길 너를 상상해 내 품에서 잠든 너를 상상해 내게 키스하는 널 달콤한 상상을 해 푸른 언덕 위에 하얀 집을 짓고 노란 그네를 타는 우리 둘의 모습 Oh 모닝 커피를 주며 아침을 깨우는 너를 상상만으로도 행복해 지는 걸  나는 너를 상상해 나를 보며 웃는 너를 상상해 내 손 잡아주는 널 마법을 걸어 내 사랑이 되길 너를 상상해 내 품에서 잠든 너를 상상해 내게 키스하는 널 달콤한 상상을 해 달콤한 상상을 해 구름을 걷는다는 유치한 상상과는 달라 내 네 번째 손가락이 내게 말하네 현실이라는게 꿈같아 꿈이 아닌 게 꿈같아 네가 내 사랑이라는 게 난 너무 꿈같아  매일 상상해 너와 함께하는 나를 상상해 너를 안아주는 날 황홀한 상상을 해 매일 우리를 상상해 서로 반쪽 되는 우리를 상상해 서로 닮아가는 걸 나의 꿈들이 이루어지기를 나는 너를 사랑해 내 사랑이 되어줘 너를 사랑해 용기내 고백할게 Oh oh You're my imagine love yeah
2011.03.20~03.26,69,3175948,톡톡 (Original Ver.) (Feat. 김범수),마이티마우스,톡톡 (Original Ver.),2011.03.11,Rap / Hip-hop,라이머,Girl I like the way you talk talk 내 귓가에 쏙쏙 달콤하게 tok tok 말해줄래 love love ma baby boo ma love is true 너와 어디든지 walk walk 내 품 안에 쏙쏙 들어와줘 꼭꼭 말해 줄게 love love ma baby boo come on baby tell me 니 맘을 다 말해줘 처음 너를 본 순간 OMG 그래 넌 딱 내가 바라던 그런 내 스타일 Hey beautiful girl Let's fly all over the World 이미 눌러버린 Start button I I I can't stop loving you 널 향해 빠르게 달려가는 추사인볼트 너만을 지키는 Incredible Hulk So fresh like xylitol So clean like crystal I need you girl 넌 마치 짜릿한 롤러코스터 휴대폰처럼 널 챙길게 어린아이처럼 널 보살필게 이제 넓은 내 어깨에 기대 난 너의 현재와 미래 Girl I like the way you talk talk 내 귓가에 쏙쏙 달콤하게 tok tok 말해줄래 love love ma baby boo ma love is true 너와 어디든지 walk walk 내 품 안에 쏙쏙 들어와줘 꼭꼭 말해 줄게 love love ma baby boo come on baby tell me 니 맘을 다 말해줘 사랑한단 말로 내 맘을 전부 보여주긴 너무 부족해 적고 적어도 세상의 단어는 너무나도 적어 답답할 정도지 적어도 니 아름다움 정돈 돼야지 수백 가지 글과 말 대신 내 품 입술 내 눈빛이 너와 내 사랑의 대화지 이젠 난 항상 그대 곁에 손잡고 같이 갈게 세상 가장 아름답게 let's make our future 모두의 낮보다 빛나는 많은 밤 속에서 넌 내가 꾸는 꿈이야 이 모든 게 너만을 향한 나의 맘 Girl I like the way you talk talk 내 귓가에 쏙쏙 달콤하게 tok tok 말해줄래 love love ma baby boo ma love is true 너와 어디든지 walk walk 내 품 안에 쏙쏙 들어와줘 꼭꼭 말해 줄게 love love ma baby boo come on baby tell me 니 맘을 다 말해줘 보면 볼수록 너 란걸 느껴 말로는 설명할 수 없는 이 느낌 외롭고 힘들 땐 언제나 내 이름을 크게 불러봐 항상 옆에 있다는 걸 잊지마 영원히 함께 할 너와나 Girl I like the way you talk talk 내 귓가에 쏙쏙 달콤하게 tok tok 말해줄래 love love ma baby boo ma love is true 너와 어디든지 walk walk 내 품 안에 쏙쏙 들어와줘 꼭꼭 말해 줄게 love love ma baby boo come on baby tell me 니 맘을 다 말해줘
2011.03.20~03.26,70,3334068,아프다 슬프다,마야,아프다 슬프다 / 너무나...,2011.03.24,Rock,마야,아프다 슬프다 눈물로 토하지 않을게 한번만 돌아와 내곁으로 돌아와 뿌리치는 너를 붙잡고 왜 난 눈물만 흘러 칼날같은 너의 말들이 날 자꾸만 찔러 다른 사람 생긴 거라면 미안해 하지마 가슴아파 울어도 웃어줄게 다시 돌아와 사랑해 사랑해 지겹게 불러도 사랑해 나 너 아니면 살수가 없는걸 알잖니 아프다 슬프다 눈물로 토하지 않을게 한번만 돌아와 내곁으로 돌아와 모래가루처럼 부서진 널 잡으려해도 사라지는 추억보다 더 아픈게 있어 내맘속에 사는널 떼어내도 떼어지지가 않아 사랑해 사랑해 지겹게 불러도 사랑해 나 너 아니면 살수가 없는걸 알잖니 아프다 슬프다 눈물로 토하지 않을게 한번만 돌아와 내곁으로 돌아와  사랑해 사랑해 지겹게 불러도 사랑해 나 너 아니면 살수가 없는걸 알잖니 아프다 슬프다 눈물로 토하지 않을게 너 없는 나 살아갈 이유가 없어  돌아와
2011.03.20~03.26,71,3164162,언제나 사랑해 (DK Ver.),DK,Endless Love,2011.03.03,Ballad,조영수,둘이 손잡고 걸을때 마주보며 또 웃을때 사랑한다 말하지 않아도 알아 널 만나러 가는길에 내 입가에 늘 환한 미소만이 흐르고 있어 사랑해 너를 사랑해 눈물나도록 사랑해 저기 밤하늘의 별보다 보석보다 니가 더 소중해 얼마나 내가 얼마나 너를 사랑하는지 내 모든걸 너에게 줄께  속상하고 힘이들때 열이나고 아파할때 옆에서 늘 힘이되준 사람 너야 집에 돌아오는 길에 내 귓가엔 늘 너의 음성만이 흐르고 있어 사랑해 너를 사랑해 눈물나도록 사랑해 저기 밤하늘의 별보다 보석보다 니가 더 소중해 얼마나 내가 얼마나 너를 사랑하는지 내 모든걸 너에게 줄께 세월지나 많이 변했을때 미운 나의 손을 잡아줄 사람 먼 훗날 아주 먼 훗날 우리 눈감는 그날에 나를 사랑해준 너에게 고맙다고 후회는 없다고 사랑해 나만의 사랑 다시 태어난대도 내 사랑은 너하나 뿐야 영원히 너를 사랑해
