time,rank,song_id,title,singers,album,date,genre,creator,lyric2015.09.21~09.27,72,5721440,LOVE ME RIGHT,EXO,LOVE ME RIGHT - The 2nd Album Repackage,2015.06.03,Dance,"오유원,김동현",Oh Yeah C’mon Take your time 왠지 두근대는 밤이야 Na Na Na Na Na Na Na Na So tonight 달 끝까지 달려가볼까 Yea Yea Yea Yea Yea Yea Yea Yea Just right 시동을 걸어 엑셀에 발을 올려 모든 것이 특별해 너와는 잘 어울려 무엇을 원하던 Imma make it work Yeah Shawty Imma party till the sun down 지금 이 신비로운 느낌은 뭘까 와줘 내게로 어서 Before the sun rise 네가 없는 난 어딜 가도 Nobody Yeah 오 도로 위에 여긴 runway 날 바라보는 눈 속 milky way Just love me right 아하 Baby love me right 아하 오 내게로 와 망설이지마 넌 매혹적인 나의 universe Just love me right 아하 내 우주는 전부 너야 Just love me right Just love me right Just love me right 내 우주는 전부 너야 Shine a light 별빛 속을 달려 은하술 건너 Na Na Na Na 멈출 순 없어 오예 우릴 비추는 달빛은 여전하지 네 궤도 안 헤매고 있어 난 아직 I can do this all night long baby 네가 없는 난 어딜 가도  반쪽짜리니까 달빛 찬란한 밤 펼쳐진 별들의 불꽃놀이 좀 더 높이 날아가볼까 날아가볼까 가슴 터질듯한 이 순간 우리 둘만 떠올라 발 밑에 지구를 두고 love me right 도로 위에 여긴 runway 날 바라보는 눈 속 milky way Just love me right 아하 Baby love me right 아하 So come on baby 눈이 부시게 더 아름다운 너의 universe 아름다운 lady Just love me right 아하 내 우주는 전부 너야 오 Just love me right Just love me right Can you love me right Just love me right I just wanna make you love me 내 우주는 전부 너야 수 없는 밤이 찾아와도 내 하늘엔 오직 너만 빛나 Woo Yeah 속삭여줘 내게만 밤하늘을 너와 내가 물들여가 도로 위에 여긴 runway 날 바라보는 눈 속 milky way Just love me right 아하 Baby love me right 아하 오 내게로 와 망설이지마 넌 매혹적인 나의 universe Just love me right 아하 내 우주는 전부 너야 Just love me right Oh oh oh yeah Just love me right Just love me right 우리만의 시간 내 우주는 전부 너야 Just love me right Just love me right Just love me right I just wanna make you love me Yea Woo You got to love Yea You got to love me Yea 내 우주는 전부 너야 Yea You love me Yea You love me Yea 내 우주는 전부 너야
2015.09.21~09.27,73,7868801,"Me, Myself & I (Prod. by 버벌진트) (Feat. 제시, 휘성)",헤이즈(Heize),언프리티 랩스타 2 Track 2,2015.09.26,Rap / Hip-hop,"제시,헤이즈(Heize),리시,제이켠",Yo it's your girl Jessi Heize It's just me me myself and I That's all I got Come on Me myself and I It's all about me myself me myself Me myself and I It's all about me me me I been feeling myself from the get 거울 속 안의 내 모습에게 말했지 You can do anything 그대로 보여줬지 Jessi 나는 나니까 Yeah I made it now watch me do the nae nae 감사해라 내게 여기는 신세계 열어줬지 내가 Unpretty leader 내가 길을 텄어 Y'all can thank me later Me myself and I Me myself and I Me myself and I Me myself and I me me me me Me myself and I Me myself and I Me me me me me me Me myself and I Me myself and I Me myself and I Me myself and I Me myself and I Me me me me Me myself and I Me myself and I Me me me me me me Me myself and I Me myself and I It's all about me myself me myself 당신과 내겐 각자의 길이 존재하는 법 날 대하는 법 조심해 주길 바래 네가 누구든 간에 내게는 상관이 없어 It's all about me that's what's up 어떤 댓글을 달든 I don't care 어떻게 나를 보든 I don't care 어떤 뒷말을 하든 I don't care I don't give a uh uh uh 어떤 댓글을 달든 I don't care 어떻게 나를 보든 I don't care 어떤 뒷말을 하든 I don't give a uh uh Ay boy I'm a hot chick baby 나는 Club 에 가면 반칙 Baby 처음 봐 이런 몸매 나는 Keith Ape 처럼 Squat Squat Squat 매일 해 근데 무식한 애들과 나를 제발 좀 비교 마라 유식한 게 나의 매력 Point 울 엄마가 말했지 인생은 Marathon 여기저기 다릴 벌려 헤픈 넌 나는 소박하지 않아 쉽게 판단하지 마라 깝치면 너는 잘려 아무도 못 Tyler 내 직업은 Creator Bitches 완 달라 I don't give a fuck about you 네가 남자여도 난 안 져 똥개들 우쭈쭈 앉아 너희 잘하면 내가 상 줘 Me myself and I It's all about me myself me myself 당신과 내겐 각자의 길이 존재하는 법 날 대하는 법 조심해 주길 바래 네가 누구든 간에 내게는 상관이 없어 It's all about me that's what's up 어떤 댓글을 달든 I don't care 어떻게 나를 보든 I don't care 어떤 뒷말을 하든 I don't care I don't give a uh uh uh 어떤 댓글을 달든 I don't care 어떻게 나를 보든 I don't care 어떤 뒷말을 하든 I don't care I don't give a uh uh Me myself and I Me myself and I Me myself and I Me myself and I Me me me me Me myself and I Me myself and I Me me me me me me Me myself and I Me myself and I Me myself and I Me myself and I Me myself and I Me myself and I Me myself and I Me me me me me Me myself and I
2015.09.21~09.27,74,7859962,어차피 잘 될 놈 (루져 날다) (Feat. Koonta),개리,2002,2015.09.21,Rap / Hip-hop,개리,2002년 봄 올림픽대로 노란 개나리 꽃을 잊지 못해 아름답게 핀 아름답게 핀 아름답게 핀 15년 전 내 삶은 늘 피곤했지 어딜 가든 거슬리는 것들이 많았지 내 차에 가격만큼 날 평가해대는 발렛 또 카페 문을 열고 들어가면 일제히 나를 향해 달려 드는 시선들 내가 뭘 입었나 뭘 신었나 꼭 체크하는 것만 같아 온통 피곤한 것들의 반복 이 도시는 갑갑한 감옥 그리고 이 바닥 사람들이 판단하는 것이 겉 모습뿐이라 늘 목엔 가짜 금 목걸이를 걸었던 나 어슬렁거리던 압구정 한복판 죽이는 차들이 지날 갈 때마다 부러워했던 난 그냥 개루져 어차피 잘 될 놈 어차피 잘 될 놈 어차피 잘 될 놈 어차피 잘 될 놈 어차피 잘 될 놈 2002년 봄 올림픽대로 노란 개나리 꽃을 잊지 못해 아름답게 핀 아름답게 핀 아름답게 핀 돈 벌면 괜찮아질까 막연했던 생각 갈아입고 싶었어 어두웠던 옷 색깔 부정적인 생각 공 열 개의 돈과 내 몸값 12기통 차 백 평짜리 빌라 또 심지어 여자까지 다 늘리고 싶었어 내가 갖게 될 모든 것들의 숫자 별거 없었지 성공하고 싶었던 이유 남의 인생에 기웃거리며 기운 빼며 살고 싶지 않았을 뿐이고 그때부터 뭣도 없어도 꿈은 일류 내겐 필요했었지 패배감이 낳은 우울함에 대한 치유 어차피 뭘 해도 잘 될 놈이라 믿었어 내 믿음에 대한 믿음 어차피 잘 될 놈 어차피 잘 될 놈 어차피 잘 될 놈 어차피 잘 될 놈 어차피 잘 될 놈 2002년 봄 올림픽대로 노란 개나리 꽃을 잊지 못해 아름답게 핀 아름답게 핀 아름답게 핀 솔직히 돈보다 필요했던 건 살아가는 자신감 목표 없던 삶이 더 두려웠지 사실 난 음악도 오기로 시작했어 확실한 사상도 없이 색깔도 없이 그냥 만들어갔지 하나 둘씩 같이 랩 하는 친구 하나 없이 매일 봤던 것이라곤 내 방의 하얀 벽지 밤새 지우고 쓰고 또 지우고 일년간의 녹음은 지옥 그렇게 시간은 흘러갔고 2002년 봄 마지막 녹음하러 가는 길 올림픽 대로 노란 개나리 꽃 풍경을 아직도 난 잊지 못해 내 생에 제일 아름다웠던 때 미친 듯이 살아봤던 후회 없던 때
2015.09.21~09.27,75,5785424,일하러 가야 돼,비스트,Ordinary,2015.07.27,Dance,GoodLife,너와 있는 시간이 너무 좋아 모든 걸 잃어버릴 정도로 가끔씩 친구들 연락 I'm sorry ma friends 너와 눈을 마주하고 같은 공기를 들이켜면 세상이 너무나 아름답게 보이는 걸 너무 달콤해서 사실 조금 걱정이야 잠깐이라도 너와 떨어지기가 싫지만 Baby 날 이해해줄래 지금 이 행복을 지키기 위해서 나 이제 그만 일하러 가야 돼 나 너무 바빠 그동안 밀린 일들이 너무 많아 언제나처럼 너에게 맛있는 밥과 좋은 것들만 해주고 싶은 내 맘 알아줘 지금 Sexy한 표정은 나빠 Woo 유혹하지 마 넌 예쁜 악마 I'm sorry baby Gotta go to work Gotta go to work 일하러 가야 돼 널 위해서 자꾸 그런 표정 짓지 마 Baby 마음 약해지니까 Don't do that 더 이상은 막지 마 부탁해 벌써 지각이니까 협조해 뭘 먹고 싶은지 뭘 하고 싶은지 뭘 갖고 싶은지 다 생각해둬 나 금방 다녀올게 Goodbye kiss I'm sorry baby 너무 달콤해서 사실 조금 걱정이야 잠깐이라도 너와 떨어지기가 싫지만 Baby 날 이해해줄래 지금 이 행복을 지키기 위해서 나 이제 그만 일하러 가야 돼 나 너무 바빠 그동안 밀린 일들이 너무 많아 언제나처럼 너에게 맛있는 밥과 좋은 것들만 해주고 싶은 내 맘 알아줘 지금 Sexy한 표정은 나빠 Woo 유혹하지 마 넌 예쁜 악마 I'm sorry baby Gotta go to work Gotta go to work 일하러 가야 돼 널 위해서 하루가 너무 짧아지는 해가 너무 미워 너에게 날 떼어 놓는 게 너무 싫어 조금만 기다려 금방 다녀올게라는 말 할 때마다 나도 마음 아프지만 일하러 가야 돼 나 너무 바빠 그동안 밀린 일들이 너무 많아 언제나처럼 너에게 맛있는 밥과 좋은 것들만 해주고 싶은 내 맘 알아줘 지금 Sexy한 표정은 나빠 Woo 유혹하지 마 넌 예쁜 악마 I'm sorry baby Gotta go to work Gotta go to work 일하러 가야 돼 널 위해서 친구야 미안해 오늘 내가 바쁜 일이 생겼어 엄마 죄송해요 제가 요새 일이 바빠서 Baby 자꾸 보채지 마 지금 너에게 가고 있어 그렇게 보고 싶으면 집 앞 가로등 밑에 따뜻하게 입고 마중 나와 있어
2015.09.21~09.27,76,7860196,밥 한 끼 해요 (Feat. 윤보미 of Apink),윤현상,밥 한 끼 해요,2015.09.24,Folk,윤현상,나와 밥 한 끼 해요  내게 21분 30초만 내어 줘요  커피도 마셔 주면 좋겠지만  그 정도로도 괜찮아요  그대가 좋아하는 음식은  나도 그 날만큼은  전부 좋아할게요  브런치 치즈퐁듀 까르보나라  매일 내가 먹던 거예요  그대가 좋아할 거리도  미리 알아 놨어요  그대가 원한다면  나 계속 노래해 줄게  그러니까  나와 밥 한 끼 해요  내게 21분 30초만 내어 줘요  커피도 마셔 주면 좋겠지만  그 정도로도 괜찮아요  그대가 좋아할 가게도  미리 알아 놨어요  그대가 원한다면  나 계속 노래해 줄게  그러니까  웬만하면 오늘 같이  나와 밥 한 끼 해요  내게 21분 30초만 내어 줘요  커피도 마셔 주면 좋겠지만  그 정도로도 괜찮아요  나와 밥 한 끼 해요  나와 밥 한 끼 해요  나와 밥 한 끼 해요 나와 밥 한 끼 해요 영화도 같이 본다면 좋겠지만 그 정도로도 충분해 나와 함께 밥 한 끼 해요 화창한 날씨도 참 좋아 그대와 함께 먹는 무엇이라도 정말 내 입에 딱이에요 그댈 좀 더 알고 싶어요 나와 밥 한 끼 해요
2015.09.21~09.27,77,7859984,"SHIPAPA (Feat. 정인, 우혜미)",개리,2002,2015.09.21,Rap / Hip-hop,개리,다 귀찮아 사람들의 말말말 내 요즘 관심사는 스트레스의 최소화 다 필요 없어 전부 이기적일뿐 돈이든 여자든 다 내 것 만 챙겨 왜 점술 매겨 쓸데없이 고만고만한 놈들의 분쟁만 생겨 누구 하나 잘 되면 물어 뜯기 바뻐 어차피 물어 뜯길 거 더 멀리 달려 얼마 전에 세워놓은 내 목표는 천억 무조건 번다에 새끼 손가락을 걸어 어차피 뻥카치는 세상 아님 말어 난 그냥 쿨 하게 살어 개 같은 바닥 전부 사재기하더만 몰랐어 나만 난 촌스러워서 그렇게는 안 살아 방송물 먹어도 방송국 똥꼰 안 빨아 스물 셋 세상 물정 모른 체 혼자 올라온 서울 난 눌러 앉은 채 십 년째 노래하며 느낀 건 너나 나나 그냥 똑같아 shipapa 룰라 오늘밖에 몰라 모든 것은 이치대로 다 흘러가기 나름 오 shipapa 룰라 춤을 추는 품바 모든 것은 이치대로 다 흘러가기 나름 오 내 피의 반은 광대 이름은 강갤 카페인에 밤새 찌들다 날새 죽기 전까지 난 잘돼 다시 맘 먹은 상태 개미 굴 속 300 난 잘 하든 못 하든 필대로 가 그래도 여자들은 끊임없이 내 침대로 와 또 수 틀리면 못 참아 그냥 뱉어 이 시밸롬아 이 치열한 세상 구걸하며 살기도 난 싫어 마치 허수아비 방울 소리만한 광기 같은 삶이 그나마 나를 춤 추게 만들어 난 뭘 위해 살아가는가 난 뭘 위해 아파하고 땀 흘리는가 모르겠어 그런 머리 아픈 수많은 질문들 난 그저 이 세상에 잠시 놀러왔을뿐 아차하면 시간은 흘러가 BOOM SHAKIT 붐 쉐킷 흔들어 정답 없는 질문은 묻지마 어떻게든 흘러가겠지 shipapa 룰라 오늘밖에 몰라 모든 것은 이치대로 다 흘러가기 나름 오 shipapa 룰라 춤을 추는 품바 모든 것은 이치대로 다 흘러가기 나름 오 지옥이든 천국이든 미친 듯이 살다 미련 없이 가는 게 내 삶의 주제 내 상처를 더 깊게 파는 이들까지도 다 이해하는 게 내가 짊어진 가장 큰 무게 뭐든 상관없어 웃게 될 거야 결국엔 모든걸 다 운에 맡길 순 없으니 난 매일 출근해 안방에서 옆방 작업실로 열정은 후끈해 지금 내 삶은 고통들이 만든 커다란 파도 좋든 나쁘든 다 품고 살아 그냥 철없이 웃고 살아 아가미가 찢어지도록 입을 크게 벌린 상어처럼 다 삼켜 시간 가면 아물어질 상처 그래 그 시간이란 박자에 맞춰 다시 1 2 3 춤 shipapa 룰라 오늘밖에 몰라 모든 것은 이치대로 다 흘러가기 나름 오 shipapa 룰라 춤을 추는 품바 모든 것은 이치대로 다 흘러가기 나름 오 shipapa 룰라
2015.09.21~09.27,78,7857043,멀리 멀리 멀리 (Feat. 검은띠),디셈버,Like a stranger,2015.09.17,Ballad,검은띠,너무 멀리 멀리 멀리  너무 빨리 빨리 빨리  너무 멀리 멀리 멀리 너무 멀리 멀리 멀리 너무 빨리 빨리 빨리  너무 멀리 멀리 멀리 그녀의 옷깃을 붙잡고 있어요  나는 이것밖에 할 수 있는게 없죠  눈앞에 바람을 잡을 수 없듯이  만질 수도 또 볼 수도 없는거겠죠  죽어도 날 죽어도 날 떠나야만 한다면 어떤 말도 듣지 못할 너라면 보고싶을 때 한 번씩 볼 수가 있게 너무 멀리 멀리 멀리 가진 말아요 그 사람에게 웃으며 보내줄게요 너무 빨리 빨리 빨리 가진 말아요 너무 멀리 멀리 멀리 너무 빨리 빨리 빨리 너무 멀리 멀리 멀리 내게서 멀리 가지마 너 없이 사는 법을 하나씩 배워야겠지 그렇게 살다 보면 언젠간 지워지겠지  지금은 마치 한 조각이 없는 퍼즐 아직도 버리지 못한 너의 사진들  이 모든 것들을 감당하기엔 많은 시간이 필요 널 닮은 사람을 거리에서 볼 때마다 놀라겠지 흠칫 내 심장에 번진 너 때문인건지 왜 아직 너뿐인건지 우연히 날 우연히 날 거리에서 본다면 모르는 사람처럼 지나가도 보고싶을 때 한번씩 볼 수가 있게 너무 멀리 멀리 멀리 가진 말아요 그 사람에게 웃으며 보내줄게요 너무 빨리 빨리 빨리 가진 말아요 You are my everything to me 작은 기대도 없단게 슬프지만 보고싶을 때 한 번씩 볼 수가 있게 너무 멀리 멀리 멀리 가진 말아요 그 사람에게 웃으며 보내줄게요 너무 빨리 빨리 빨리 가진마 너무 멀리 멀리 멀리 너무 빨리 빨리 빨리 너무 멀리 멀리 멀리 If you love me love me love me If you love me love me love me If you love me love me love me 너무 멀리 멀리 멀리
2015.09.21~09.27,79,5644620,CALL ME BABY,EXO,The 2nd Album `EXODUS`,2015.03.30,Dance,"조윤경,1월8일,김동현",CALL ME BABY   Call me baby  이 거리는 완전 난리야  Call me baby  사람들 사이는 남이야  Call me baby  함께하는 매 순간이  Like BOOM BOOM BOOM  BOOM BOOM  What up  Hey Girl 영원 같던 찰나  운명 같은 순간  나를 한 순간 뚫고가  번개처럼 이 세계를  넌 내 이름 불러주며  나에게로 다가와  놀라워 섬광처럼 가득 차  너를 마주한 순간 oh my  편하게 여기 앉아  이제 내 얘기를 들어봐  Oh I don't care  나 멀리멀리 돌아간대도  이렇게 너의 곁에  단 한 남자가 되어줄 테니  메마른 내 입술에  너 스며들어와 나를 깨워  The time's wasting girl  So don't wait don't wait too long  빛나는 것들은 많아  그 안에 진짜를 봐봐  Call me baby Call me baby  Call me baby Call me baby  You know my name girl  널 향해 커져간 마음아  너 말곤 그 문을 닫아  You know I'm here girl  Call me baby Call me baby  Call me baby Call me baby  몇 번이라도 Call me girl  나를 나로 존재하게 해  내 세상은 오직 you're the one  You're the one   Girl you're the one I want  빛나는 것들은 많아  그 안에 진짜를 봐봐  Call me baby Call me baby  Call me baby Call me baby  몇 번이라도 Call me girl  Baby girl 욕심들 속에 날 선  그 어떤 말도 넘어설  그런 믿음을 보여준 너   모두 변해 날 떠나간대도  너는 나만의 lady   내 손을 잡아주는 그거면 돼  빛나는 것들은 많아  그 안에 진짜를 봐봐  Call me baby Call me baby  Call me baby Call me baby  You know my name girl  널 향해 커져간 마음아  너 말곤 그 문을 닫아  You know I'm here girl  Call me baby Call me baby  Call me baby Call me baby  어둔 미로 속에 갇혔던 Oh 나  그 어둠 속에서  날 깨워준 네 목소리 들려와   날 다시 태어나게 해 Yeah  E X O Listen Say my name Louder  혼란스러운 공간 속  날 이끌어줄 빛이 되고  놓치지 않아준 너라면  What up  널 안고 변치 않을게  널 안고 나를 떠나버린  사람들과 마주해   Never don't mind about a thing  내 가슴속 그 거대한 공백에 널 더해   흔들리는 세상 속에서  Whoo Babe  빛이 돼준 오직 한 사람 바로 너  Girl you're the one I want  You're the one I want  빛나는 것들은 많아  그 안에 진짜를 봐봐  Call me baby Call me baby  Call me baby  I'll be your baby yeah  You know my name girl  Ho  나를 나로 존재하게 해  You know I'm here girl  내 세상은 오직 you're the one  You're the one  Girl you're the one I want  빛나는 것들은 많아  그 안에 진짜를 봐봐  Call me baby Call me baby  Call me baby Call me baby  몇 번이라도 Call me girl
2015.09.21~09.27,80,7859986,허해 (Feat. 영준 of Brown Eyed Soul),개리,2002,2015.09.21,Rap / Hip-hop,개리,허허해 허허해 허허허 예 이렇게 비가 오는 날에는 더 더 더 허허해 허허해 허허허 예 이렇게 네가 없는 날에는 더 더 더 오래간만에 날씨 good 미세 먼지는 걷히고 하늘이 꼭 미국 LA 같아 몇 번 안 가봤지만 대충 생각나 구름 없는 파란 하늘의 색깔과 한적한 거리는 지금 붐비는 가로수 길과는 좀 달라 짧은 치마와 스키니 진의 설레는  만남들 짝을 찾는 이들은 서로를 뽐내느라 환장을 하고 화장을 안 해도 빛이 나는 여자의 웃음처럼 기분 좋은 화창한 날 모든걸 멈추고픈 시간 여기저기 들려오는 아쉬운  솔로들의 한탄 일하기 싫은 이들은 다시 꺼내보는 꿈에 대한 갈망 이게 진정 내가 원하는 삶일까 용기 내 모든걸 다시 시작해 볼까 만감이 교차하는 이순간 대체 뭘 해야 재밌을까 사는 게 빠르게 흘러가 매 순간 놓치고 싶지 않은데 일일 연속극처럼 그게 그거 같애 그네 같이 묶여 있는 기분 이런 날 좋은 날엔 더해 맘이 허해 허허해 허허해 허허허 예 이렇게 비가 오는 날에는 더 더 더 허허해 허허해 허허허 예 이렇게 네가 없는 날에는 더 더 더 창 밖엔 추적추적 비가 내리고 내 정신 상태는 정전 별일 없지만 그렇다고 또 땡기는  것도 없어 그냥 볼펜 똥처럼 좀 귀찮아졌을 뿐 근데 가끔 이런 날도 필요한 것 같아 균형의 맞춤 습관처럼 보는 휴대폰 속 세상 다들 잘들 사는 것 같아 이제 서로의 안부는 만남 대신 사진 한 장과 짧은 댓글 좋아요 버튼 툭 누르면 끝 한참을 바라보며 웃다 보면 몰라 시간이 가는 줄 어둠이 오면 잠시 또 시달려 아직 해독 안된 사랑의 상처 언제나 함께 했던 이런 날 함께 소파에 누워 껴안고 영화를 보던 너 모든 게 그리워지네 허허해 허허해 허허허 예 이렇게 비가 오는 날에는 더 더 더 허허해 허허해 허허허 예 이렇게 네가 없는 날에는 더 더 더 허허해 허허해 이렇게 네가 없는 날에는 더
2015.09.21~09.27,81,4800324,100 (Feat. 천재노창),블랙넛(BlackNut),100,2014.08.08,Rap / Hip-hop,"블랙넛(BlackNut),천재노창",엄마한테 말했지 내가 다시 이 집에 돌아올 땐 버스 한 가득 창녀들을 태운 뒤에 정기가 다 빨린 채 폐병 환자같은 몰골을 하고선 돈다발과 함께 돌아올테니 이사 갈 준비해 놔 나 금방 갔다올게 꺼져 랩퍼들 나 우리 엄마 빚 갚아야 해 밥그릇들 치워 너희들을 눕히는 건 주사기 든 간호사보다 더 쉬워 내가 거품이라면 너희 돈은 스푼이지 빨리들 걷어 내 허나 이 바닥을 치는 실력으로 난 딱지치기처럼 다 뒤집었네 넌 내가 자녹게에서 허우적대던 때부터 날 기억해 허나 점차 수면 위로 떠올라갔지 moon swings의 뱃살 꽉 쥐고 yeah 그래 알아 날 띄운 건 내 실력이 아닌 삼행시처럼 그저 운이란 걸 근데 또 없어 지금 나만큼 뚜렷한 작업물 없이 spotlight 받는 놈 난 여성부 장관같은 놈 이 바닥에 대들보지 get it 목욕탕 때밀이처럼 박수를 쳐 줘 그럼 내가 뒤집을테니 fuck hilite fuck grandline fuck aomg fuck illionaire 내 포부는 내 팀마저도 낭떠러지로 싹 다 밀어내지 내가 최고야 다 엿 처먹어 증명해줄게 허풍 0퍼 니가 걷는 길을 다 가시밭길로 만들게 마치 럴커처럼 uh 비속어 양해를 구해야 해 야 개 씨발 찬경하지 않는다면 넌 신의 저주를 받게 돼 진짜 갇뎀 카니예 니 이름 앞에 갇 떼 빈말 안해 모두 다 외치거라 그 분의 존함 갓대웅 갇뎀 갓대웅 찬양 경배해 Black Nut VS DO VJ San E 가리온 Sean2slow PType Drunken Tiger T 리쌍 Dynamic Duo TBNY and Epik High ESens Jtong Simon D Gray Crush Loco Elo ZionT Beenzino Dok2 and The Quiett Mad C Soul Dive Outsider 배치기 취랩 MC Sniper DOC 물론 제외할게 스트리트 파이터는 Paloalto BFree Okasian 화지 긱스 Crucial Star and Takeone Basick Jay Moon Innovator Kid Ash Reddy Huckleberry P JJK Double K Sool J JerryK RhymeA Minos Fana Kim Dead'P Addsp2ch Ignito 깐모 한해 Andup Uglyduck Zico Rimi Kittib Jolly V Tymee Kebee GD DG YDG Illinit Bizzy 주석 Skull Masta Wu 진돗개 Qwala 넉살 New Champ Young Jay Deep Odee Wutan Row Digga Sleeq Don Mills Qim Isle Olltii와 Swings Vasco C Jamm 노창 Giriboy 그 외의 랩퍼들 다 꺼져 내가 이기죠
