time,rank,song_id,title,singers,album,date,genre,creator,lyric2014.03.17~03.23,58,4402769,내 생각날 거야 (Narr. 이시영),거미,The Lyrics - No.4,2014.01.17,Ballad,최갑원,집으로 걷는데 멀다고 느낄 때 그때 그때 오 그때 그때 말을 하려고 하는데 들을 사람이 없을 때 그때 그때 그때 외로운 맘에 뒤척이다 잠드는 밤에 목이 타는 듯이 마를 때마다 내 생각날 거야 그럴 거야 넌 버릇처럼 날 잊었다고 해도 내 생각날 거야 그럴 거야 너를 너무나 사랑했던 나니까 내 생각날 거야 허전한 저녁에 아무 약속이 없을 때 그때 그때 그때 눈물이 뺨에 이유없이 흐르는 날에 가슴 한가운데 아플 때마다 내 생각날 거야 그럴 거야 넌 버릇처럼 날 잊었다고 해도 내 생각날 거야 그럴 거야 너를 너무나 사랑했던 나니까 사랑만 하다가 끝이라는 말로 너도 나도 또 다시 못 만나도 혹시나 언젠가 돌아올 너라면 받아줄 나라서 그리워 그리워 그리워할 거야 그럴 거야 누가 물어보면 넌 아니라고 해도 그리워할 거야 그럴 거야 나를 너무나 사랑했던 너니까 내 생각날 거야 내 생각날 거야 그럴 거야 내 생각날 거야 그럴 거야
2014.03.17~03.23,59,4536624,고마워 내사랑,홍대광,THE SILVER LINING,2014.03.21,Dance,,이른 아침햇살에 눈을 떠 약속된 하루를 시작한다 내 사랑 벌써부터 설레는 걸 혹시 실수한 데는 없을까 머리부터 발끝까지 본다 내 사랑 조금만 기다려줘 두근두근 내 마음 생각만 해도 Beautiful 지금 내가 너에게로 간다 너의 목소리가 듣고 싶어 또 한걸음에 달려가서 너를 내 품에 안고 싶어 오늘도 너의 손을 붙잡고 웃으며 거리를 걷고 싶다 내 사랑 넌 내게 첫사랑 카페에 앉아 널 기다리며 너의 사진을 또 꺼내본다 내 사랑 벌써부터 설레는 걸 오늘은 어떤 영화를 보고 어떤 맛집에서 뭘 먹을까 내 사랑 내게 와줘서 고마워 두근두근 내 마음 생각만 해도  Beautiful 지금 내가 너에게로 간다 너의 목소리가 듣고 싶어 또 한걸음에 달려가서 너를 내 품에 안고 싶어 오늘도 너의 손을 붙잡고 웃으며 거리를 걷고 싶다 내 사랑 넌 내게 첫사랑 좀 더 가까이 널 듣고 싶어 내 심장이 닿을 때까지 너를 내 품에 안고 싶어 지켜봐 네 앞에 서 있는 날 언제나 너에게 하고픈 말 사랑해 고마워 내사랑 사랑해 내 첫사랑 언제나 넌 내 사랑 사랑해 내 첫사랑 언제나 넌 내 사랑
2014.03.17~03.23,60,4500966,그대라는 이유,먼데이키즈(MondayKiz),그대라는 이유,2014.03.11,Ballad,이진성(먼데이키즈),이별은 또 다른 시작일거라는  말 그때는 그 말을 잘 몰랐어 한없이 흐르는 그대 눈물을 보며  조금은 난 알 것 같았어 오랜 시간이 걸릴지도 모른다고  철없는 부탁하지만 너와 나의 맘속에 여전히  살아 숨쉬는 그 추억이 우리를 영원히  지켜 줄 꺼야 따스했던 눈빛 날 보며 울던 너  그 눈물 기억은 영원 할 테니까 제발 그 순간을 잊진 말아줘  함께여서 행복했으니 많은 날이 지나 긴 세월이 흘러  함께한 시간조차 흐릴 때 쯤엔 먼 훗날 그때의 날 살게 하는 건  그대라는 이유 때문 일거야 오랜 시간이 걸릴지도 모른다고  기나긴 아픔 주지만 우리들의 맘속에 여전히 살아  숨쉬는 숨쉬는  그 미소가 미소가 빈자릴 영원히  채워 줄 꺼야 따스했던 눈빛 날 보며 울던 너  그 눈물 기억은 영원 할 테니까 제발 그 순간을 잊진 말아줘  함께여서 행복했으니 많은 날이 지나 긴 세월이 흘러  함께한 시간조차 흐릴 때 쯤엔 먼 훗날 그때의 날 살게 하는 건 그대라는 이유 때문 일거야
2014.03.17~03.23,61,4362019,너에게만,"범키,버벌진트",듀스 20주년 헌정앨범 Part.6,2013.12.16,Ballad,"이현도,버벌진트",Bumkey VJ DEUX time for some slow jam 너는 지금 내게서  너무나 멀리에 다시 내게 올 수 없지만 눈을 감으면 아직도  나의 가슴엔 항상 네가 웃으며 서 있는데 너는 내게서 멀어져가고 나는 혼자 남게 됐지만 너의 기억은 아직도 나를 자꾸 눈물 짓게 하지 내 맘에 내리는 이 비는 너만이 멈출 수 있어  only you 내 눈에 흐르는 눈물은 오직 너만이 멈출 수 있어 너는 지금 내게서  너무나 멀리에 너무나 멀리에 다시 내게 올 수 없지만 눈을 감으면 아직도  나의 가슴엔 아직 내 가슴에 항상 네가 웃으며 서 있는데 우리 헤어진 후에 변했어 많은 것들이 난 새 차를 샀고 조그맣던  작업실이 이젠 네가 수줍게 춤추던  클럽보다 커 하지만 사람들과 일하고  웃으며 돌아서 집에 온 후엔 텅빈 느낌 뿐 다른 여자를 만나보랬지 나의 친한 친군 no way 말도 안 돼 내 마음 한 가운데 네가 있는걸 그래서 이렇게  혼자 남은 밤에 전화기를 붙잡고 망설여 계속 눈을 감으면 내 옆에 꼭 네가 있는 것만 같아 I need you by my side 여기서 여전히 널  이렇게 그리며 서 있어 지나간 날들은 괜찮아 네가 다시 나에게 만약 돌아올 수 있다면 oh 나를 돌아봐 그대 나를 너의 맘 속엔 내가 없는지 I wanna know 너는 지금 내게서  너무나 멀리에 다시 내게 올 수 없지만 눈을 감으면 아직도  나의 가슴엔 널 사랑하는 마음 뿐이야 너 없인 내겐 아픔 뿐이야
2014.03.17~03.23,62,4232200,삐딱하게 (Crooked),G-DRAGON,쿠데타 (COUP D`ETAT),2013.09.05,Rap / Hip-hop,"TEDDY,G-DRAGON",영원한 건 절대 없어 결국에 넌 변했지 이유도 없어 진심이 없어 사랑 같은 소리 따윈 집어 쳐 오늘밤은 삐딱하게 내버려둬 어차피 난 혼자였지 아무도 없어 다 의미 없어 사탕 발린 위로 따윈 집어 쳐 오늘밤은 삐딱하게 버럭버럭 소리쳐 나는 현기증 내 심심풀이 화풀이  상대는 다른 연인들 괜히 시비 걸어 동네 양아치처럼 가끔 난 삐딱하게  다리를 일부러 절어 이 세상이란 영화속  주인공은 너와나 갈 곳을 잃고 헤매는  외로운 저 섬 하나 텅텅 빈 길거리를  가득 채운 기러기들 내 맘과 달리 날씨는  참 더럽게도 좋아 너 하나 믿고 마냥  행복했었던 내가 우습게 남겨졌어 새끼손가락 걸고  맹세했었던 네가 결국엔 영원한 건 절대 없어 결국에 넌 변했지 이유도 없어 진심이 없어 사랑 같은 소리 따윈 집어 쳐 오늘밤은 삐딱하게 내버려둬 어차피 난 혼자였지 아무도 없어 다 의미 없어 사탕 발린 위로 따윈 집어 쳐 오늘밤은 삐딱하게 짙은 아이라인 긋고  스프레이 한 통 다 쓰고 가죽바지 가죽자켓  걸치고 인상 쓰고 아픔을 숨긴 채 앞으로  더 비뚤어질래 네가 미안해지게  하늘에다 침을 칵 투박해진 내 말투와  거칠어진 눈빛이 무서워 너 실은 나 있지 두려워져  돌아가고픈데 갈 데 없고 사랑하고픈데 상대 없고  뭘 어쩌라고 돌이 킬 수 없더라고 너 하나 믿고 마냥  행복했었던 내가 우습게 남겨졌어 새끼손가락 걸고  맹세했었던 네가 결국엔 영원한 건 절대 없어 결국에 넌 변했지 이유도 없어 진심이 없어 사랑 같은 소리 따윈 집어 쳐 오늘밤은 삐딱하게 내버려둬 어차피 난 혼자였지 아무도 없어 다 의미 없어 사탕 발린 위로 따윈 집어 쳐 오늘밤은 삐딱하게 오늘밤은 나를 위해 아무 말 말아줄래요 혼자인 게 나 이렇게  힘들 줄 몰랐는데 그대가 보고 싶어 오늘밤만 나를 위해  친구가 되어줄래요 이 좋은 날 아름다운  날 네가 그리운 날 오늘밤은 삐딱하게
2014.03.17~03.23,63,4535038,그런 남자,Bro,그런 남자,2014.03.21,Ballad,"Bro,Keygen",말하지 않아도 네맘 알아주고 달래주는 그런남자 너무 힘이들어서 지칠때 항상 네 편이 되어주는 그런남자 한번 눈길만 주고갔는데 말없이 원하던 선물을 안겨다 주는 잘생기진 않아도 네가 가끔 기대어 쉴수 있게 넓은 가슴을 가진 남자 그런 남자가 미쳤다고 너를 만나냐 너도 양심이 있을것 아니냐 뭔가 애매한놈들이  자꾸 꼬인다는건 너도 애매하다는 얘기야 훌쩍 떠나고 싶을때 너를 태워 바다로 쏘는 그런 남자 키가 크고 재벌2세는 아니지만 180은 되면서 연봉 6천인 남자 네가 아무리 우스갯소리를 해도 환하게 웃으며 쿨하게 넘기는 남자 내가 만약에 그런  남자가 될수 있다면 한눈에 반해버릴 그런 남자라면 약을 먹었니 미쳤다고 너를 만나냐 나도 인생을 좀 즐겨봐야지 왕자님을 원하신다면  사우디로 가세요 일부다처제인건 함정 네 가슴에 에어백을 달아도  눈밑에다 애벌레를 키워 보아도  숨길수 없는 단하나의 진실  너는 공격적인 얼굴이야 총을 맞았니 미쳤다고 너를 만나냐 너도 양심이 있을것 아니냐 뭔가 애매한놈들이  자꾸 꼬인다는건 네가 운이없는게  기다림이 모자란게 아냐 그냥 넌 별로야
2014.03.17~03.23,64,4454340,뛰뛰빵빵,비투비,뛰뛰빵빵,2014.02.17,Dance,용감한형제,Action action  B to B in the place to be action  Ready set action  어제 너와 헤어졌어  실감이 정말 나질 않아  위로 따윈 필요 없잖아 Oh girl  너를 정말 사랑했어  죽을 만큼 아껴줬는데  그런 네가 날 버렸어  Why ma girl 인사도 없이 흔들렸던 네 맘 알아 두근댔던 시간 가고 맘 아파 나 잠도 안 와 Oh 난 네가 미워 먹고 자고 또 뒤척이다가 네 생각에 눈물이 나요 답답해 운전을 하다가 흘러나오는 음악에 뛰뛰빵빵 뛰뛰빵빵 뛰뛰빵빵 경적 소리 오늘따라 거슬리네요 Babe 암만 짱구 굴려봤자 답답한 맘 알랑가몰라 Uh 식음 전폐에 불면증에 내게 네가 남기고 간 선물 참 고맙다만 더는 사양할게 사실 나 속 터지니까 그래 솔직히 지금 기분도 참 뭐 같으니까 아이고 나보고 뭘 어쩌라고 고마 빵빵대라 안 그래도 나 복잡하니까 Uh 흔들렸던 네 맘 알아 두근댔던 시간 가고 맘 아파 나 잠도 안 와 Oh 난 네가 미워 먹고 자고 또 뒤척이다가 네 생각에 눈물이 나요 답답해 운전을 하다가 흘러나오는 음악에 뛰뛰빵빵 뛰뛰빵빵 뛰뛰빵빵 경적 소리 오늘따라 거슬리네요 Babe Babe 창밖에 Babe 날씨는 오늘따라 또 왜 이리도 좋은지 Babe 네가 앉던 Babe 내 옆자리에 텅 빈 채 우리 추억만 채워가 나는 오늘도 먹고 자고 또 뒤척이다가 네 생각에 눈물이 나요 답답해 운전을 하다가 흘러나오는 음악에 뛰뛰빵빵 뛰뛰빵빵 뛰뛰빵빵 경적 소리 오늘따라 거슬리네요 Babe Ay ay 차가 막히네 반쯤 정신 나간 채로 경적만 울려대 빵빵 예측출발은 기본 고속도로 한가운데 일인시위라도 벌여볼까 에라 모르겠다 칠 테면 쳐봐라 난 그녀를 잃었다 미쳐버리는 척이라도 해야 네가 돌아올까 사태가 심각해 근처 한강다리를 찾아 그래 봤자 소리만 빽 지르고 말겠지 Oh god 뛰뛰빵 뛰뛰빵 오늘따라 거슬리네요 뛰뛰빵 뛰뛰뛰뛰 뛰뛰빵 눈물이 나요 뛰뛰빵 뛰뛰빵 먹고 자고 또 뒤척이다가 뛰뛰빵 뛰뛰뛰뛰 뛰뛰빵 눈물이 나요
2014.03.17~03.23,65,4501245,해도 해도 너무했어,나비,해도 해도 너무했어,2014.03.11,Ballad,이단옆차기,여보세요 너 어디야 나 할 말 있는데 잠깐 나와 봐 오늘도 많이 바빠 오늘도 많이 아파 만나서 할 말이 있어 너무 변한 거 알아 목소리부터 달라 넌 내가 바본 줄 아는지 온 종일 그대만 생각했던 하루 온종일 기다리다 잠들어 겨우 에라이 못된 놈아 잘 들어 이 못된 놈아 사랑이 어떻게 넌 변해 이런 내가 참 불쌍해 매일 바쁘다는 그 말 더는 못 참겠어 그만 자꾸 이러면 곤란해 정말 화내기 전에 제발 불안해하는 내 맘을 꼭 안아줘 해도 해도 너무 했어 너 임마 너무 했어 차라리 나에게서 떠나라고 말을 해 해도 해도 너무 했어 너 임마 너무 했어 차라리 나에게서 떠나라고 말을 해 울리지 않는 전화 줄어든 우리 만남 예전 관 너무 다른 너 딴 여자 생긴 건지 맘이 떠버린 건지 속상한 마음만 더 커져 온 종일 그대만 생각했던 하루 온종일 기다리다 잠들어 겨우 에라이 못된 놈아 잘 들어 이 못된 놈아 사랑이 어떻게 넌 변해 이런 내가 참 불쌍해 매일 바쁘다는 그 말 더는 못 참겠어 그만 자꾸 이러면 곤란해 정말 화내기 전에 제발 불안해하는 내 맘을 꼭 안아줘 금이 가 버린 우리 너무 멀어진 우리 자상하던 니 모습 따스하던 그 말투 어디에 넌 어디에 넌 어딨는 거야 사랑이 어떻게 넌 변해 이런 내가 참 불쌍해 매일 바쁘다는 그 말 더는 못 참겠어 그만 자꾸 이러면 곤란해 정말 화내기 전에 제발 불안해하는 내 맘을 꼭 안아줘 해도 해도 너무 했어 너 임마 너무 했어 차라리 나에게서 떠나라고 말을 해 해도 해도 너무 했어 너 임마 너무 했어 차라리 나에게서 떠나라고 말을 해
2014.03.17~03.23,66,4367874,너를,브라운아이드소울,Thank Your Soul,2013.12.19,R&B / Soul,브라운아이드소울,아득하게 멀어보여  함께 걷던 이 길이 이젠 나즈막히 불러보았지 그 이름  더 차갑게 느껴지는  밤 하늘과 이 공기는 나의 곁에 너 없는 까닭이겠지 별들이 하나 둘 어둠에 잠기면 헛된 기다림도 이 밤을 따라  떠나면 좋을텐데 달아나도 가지못해 미련은  무거운 짐이 되어 한순간도 잊지못해 그리운  니 모습만 내곁을 맴도는데 아직 난 널 이렇게 흰눈이 흩어져 사라지기전에 어리석은 맘도 하늘멀리  떠나면 좋을텐데 달아나도 가지못해 미련은  무거운 짐이 되어 한순간도 잊지못해 그리운  니 모습만 내곁을 맴도는데 아직 난 널 이렇게 빗물처럼 스며들어  언제까지 가슴안에 그대 가지말란 말을 못해 후회는  무거운 짐이되어 한순간도 잊지못해 그리운  니 모습만 내곁을 맴도는데 아직 난 널 놓지못해 미련은  무거운 짐이되어 한순간도 잊지못해 그리운  니 모습만 내곁을 맴도는데 단 하루만 나에게로 단 한번만  나에게로 아직 널 사랑해
2014.03.17~03.23,67,4496046,잊고 있는중 (Ing),DK,CS Numbers Vol.5,2014.03.07,Ballad,물만난물고기,니가 떠난 지 반년이 지났는데  널 아직도 잊고 있는 중  너의 뒷모습이  안 보일 때쯤 알았어   우리가 헤어진 줄   니가 떠난 지  일년이 지났는데   난 아직도 잊고 있는 중   다른 사람이 생겼다는 말을  듣고도 널 기다리는 중  함께했던 너의 모습이 떠올라  또 내 눈물이 차올라   널 많이도 사랑했었나보다  보낼 수가 없잖아  아닐꺼야 다시 너 돌아올꺼야  그래서 난 잊고있는 중  나없이 행복해 보이는 그사람을   난 아직도 잊고있는중  몰랐어 우리가 헤어질 줄  니가 떠난 지 얼마나 지났을까  난 아직도 잊고 있는 중  잘해 주지 못한 기억이  이렇게 오랫동안 아플 줄은  차가웠던 겨울마저도 어느새  봄을 향해만 가는데  난 오늘도 웃지 못하나 보다  눈물이 낫질 않잖아  아닐꺼야 다시 너 돌아올꺼야  그래서 난 잊고있는 중  나없이 행복해 보이는 그사람을   난 아직도 잊고있는중  몰랐어 우리가 헤어질 줄  가슴은 알아 널 잊어야 살아  너 아닌 사랑 할 수 없다는 걸  나도 잘 알아 널 잊어야 한단 걸  하지만 그게 안돼  널 잊을수가 없어서  그래서 난 잊고있는중 날 잊고 곧 결혼한다는 그 사람을 난 아직도 잊고있는중 몰랐어 우리가 헤어 질줄 니가 떠난 지 얼마나 지났을까  널 아직도 잊고 있는 중 너의 뒷모습이 안 보일 때쯤 알았어  우리가 헤어진 줄
2014.03.17~03.23,68,4404589,Cha Cha,레인보우블랙,Rainbow Blaxx Special Album (RB BLAXX),2014.01.20,Dance,김이나,싫습니다 좋습니다  말을 좀 해봐 있습니까  없습니까 내게 올 맘이  후회하지 않을 자신   있나요 Uh Uh  언제까지 기다릴   나일리가 없어  내 조급한 성격을   미리 말해 줄게  You feel I feel we feel   what is coming to us  알면서 Uh 뭐 그래  그 기분 나 뭔지 알아요   이렇게 널 원하는 나를  조금 더 바라보고 싶지  이해할게요  I wanna feel you I wanna love you  이렇게 말하는 게   나는 두렵지 않아요  매번 매번 물어봐도   말할게요 매일 매일   그대를 난 생각해요  I wanna feel you I wanna love you  이렇게 얘기하는   내가 너무 좋으면서  그런 맘을 내가 너무   잘 알아요 그럼 내가   조금 더 보여줄까요  싫습니다 좋습니다  말을 좀 해봐 있습니까  없습니까 내게 올 맘이  후회하지 않을 자신   있나요 Uh Uh  ChaCha 더 미루지도   또 숨기지도 난 그런 거  원래 잘 못해  난 티내 내가 어떤 맘인지   니 어디가 어떻게 좋은 건지  싫습니다 좋습니다  좋아요 좋아요   있습니까 없습니까  말해봐 좀 더 노는 게 좋아  그 기분 나 뭔지 알아요   겁이 많은 그대라는 걸  그대만 모른다는 사실  알려나 몰라   걱정하지 말아요   우린 누구보다 좋을 테니까  그러니 말해요   이 귀한 기분을 놓치지 마요  I wanna feel you I wanna love you  이렇게 말하는 게   나는 두렵지 않아요  매번 매번 물어봐도   말할게요 매일 매일   그대를 난 생각해요  I wanna feel you I wanna love you  이렇게 얘기하는   내가 너무 좋으면서  그런 맘을 내가 너무   잘 알아요 그럼 내가   조금 더 보여줄까요  싫습니다 좋습니다 말을 좀 해봐 있습니까 없습니까 내게 올 맘이 후회하지 않을 자신  있나요 Uh Uh
2014.03.17~03.23,69,4328659,그리워해요,2NE1,그리워해요,2013.11.21,Ballad,TEDDY,그렇게 너무 편하게 굴지 마요 아직 너와 난 남남이니까 어린애처럼 보채지 좀 마요 아직 시작도 안 했으니까 아이들의 불장난 같은 사랑은 싫어 조금 움츠려 있을 뿐이야 난 괜찮아 아냐 사실 난 나를 떠나 보낸 그가 아직 너무 미워요 차갑게 식어버린 내 가슴은 아직도 그를 그리워해요 그리워해요 그리워해요 그리워해요 그리워해요 그렇게 너무 밝히지 좀 마요 세상은 원래 어두우니까 어쩜 그렇게 해맑게 웃어요 what 자세히 보니 슬픈 표정이야 I know I’ve been there before 어른들의 계산적인 사랑은 싫어 살짝 지쳐있을 뿐이야 난 괜찮아 아냐 사실 난 나를 떠나 보낸 그가 아직 너무 미워요 차갑게 식어버린 내 가슴은 아직도 그를 그리워해요 그리워해요 그리워해요 그리워해요 그리워해요 나의 젊은 날의 사랑은 이렇게 끝이 나네요 그대 꼭 행복해야 해요 오랜 시간이 지나가도 우리 서로 기억해요 그땐 서로가 있었음을 그땐 서로가 있었음을
2014.03.17~03.23,70,4517480,24시간이 모자라,권진아,SBS K팝 스타 시즌3 TOP8,2014.03.16,Folk,박진영,24시간 woo 24시간 woo 시간이 너무나 빨리 가  너와의 하루가 일분 같아 난 미칠 것 같아  너에게 갈 때는 달려가  떠나야 할 때는 발이 안가 떨어지질 않아 널 보고 있으면 모든 걸 다 잊어버려  니가 나를 가득 채워 널 안고 있으면 모든 게 완벽해  이대로 영원히 있고 싶어 24시간이 모자라  너와 함께 있으면 너와 눈을 맞추면 24시간이 모자라 내가 너를 만지고 니가 나를 만지면 24시간  24시간 24시간 woo 처음 느껴본 감정이라서  끝없이 빠져 드는 게 무서워 하지만 그게 너라면 니가 나를 잡아주면  난 계속 가고 싶어  woo 24시간 24시간이 모자라  너와 함께 있으면 너와 눈을 맞추면 24시간이 모자라  내가 너를 만지고 니가 나를 만지면 woo 24시간 woo
2014.03.17~03.23,71,4421555,1004 (Angel),B.A.P,First Sensibility,2014.02.03,Dance,"강지원,김기범,방용국",어디론가 나를 떠나버린   천사 같은 너  I need you  어떻게 사는지 난 모르겠어  니가 떠난 이후로 미치겠어  Everyday Everynight  잠도 잘 오질 않아   홀로 남아 술로나마 Cry  So I miss you  널 생각해  and I need you  난 Everyday  아직도 니 목소리가 들려  돌아와줘  난 너밖에  내 곁으로  없다는 게  천사 같은 너  내가 살아가는 이유는 너야  다신 못 볼 것 같아 정말 죽을 것 같아   나를 사랑해줄 사람은 너야  어둠 속에서 나를 비춰줘  Look at me now  Come to me now   다시 내게 돌아와  어떻게 살아가니 난 Look at me now Come to me now  매일 니가 없이 난 어떻게 살아가니 난 니가 정말 날 떠날 줄은 몰랐지 넌 마치 천사 같았어 나 왜 이리 못났지  Oh no  이젠 넌 날 외면하고 난 널 잃어버린 바보 거지같은 꼬라지 너 없인 아무것도 못하지 So I miss you 널 생각해 and I need you 난 Everyday 망가진 내 모습이 초라해 날 안아줘 난 너밖에 날 감싸줘 없다는 게 천사 같은 너 내가 살아가는 이유는 너야 다신 못 볼 것 같아  정말 죽을 것 같아  나를 사랑해줄 사람은 너야 어둠 속에서 나를 비춰줘 정신 나간 듯 해  난 멍 때려 everyday 니가 떠나고 난 망가졌어 돌아와줘 너뿐이었어 어서 날 구해줘 멈춰 제발 내 곁에서 멀어지지마 떨어지지마 Never let you go 너를 찾고 싶어 어디로 어디로 어디로 어디로 가 니가 있는 그 곳 A better day A better day A better day  천사 같은 너 내가 살아가는 이유는 너야 다신 못 볼 것 같아 정말 죽을 것 같아  나를 사랑해줄 사람은 너야 어둠 속에서 나를 비춰줘 Look at me now Come to me now  다시 내게 돌아와  어떻게 살아가니 난 Look at me now Come to me now  매일 니가 없이 난 어떻게 살아가니 난
2014.03.17~03.23,72,4393317,Good Morning Baby,Apink(에이핑크),Good Morning Baby,2014.01.13,Dance,이단옆차기,Good Morning Baby 한순간에 빠져 버린다는 그 말을  믿어요 분명히 운명 같은 사랑  이야기 하루가 너무 멀다 하고 그립다  말하고 싶은 너에게 빠졌나 봐  love is you 새빨간 스웨터도 너무 잘 어울린  남자 그대 손만 잡고 있어도 왠지  모르게 포근해서 나에게는 오직 너야 아니 평생  오직 너야 특별한 넌 season of love good morning baby good morning  너와 아침을 함께 여는 난 매일매일 상상해 잠이 덜 깬  눈에 키스해 크게 말하지 않아도 알아요 I love you 새하얀 길을 걷고 둘이 발자국을  남기고 투명한 하늘 위로 천사가  노랠 해 하늘만 봐도 난 좋아 그냥 너라서  다 좋아 심하게 빠졌나 봐 love is you be be my my love wanna be be be my my love love 그대 손만 잡고 있어도 왠지  모르게 포근해서 나에게는 오직 너야 아니 평생  오직 너야 특별한 넌 season of love good morning baby good morning  너와 아침을 함께 여는 난 매일매일 상상해 잠이 덜 깬  눈에 키스해 크게 말하지 않아도 알아요 I love you 난 포근한 그대 품에서 눈 깜짝할  사이 잠들죠 나와 후 wanna be falling in love  나만의 사랑이 되어줘 good morning baby good morning  너와 아침을 함께 여는 난 매일매일 상상해 잠이 덜 깬  눈에 키스해 크게 말하지 않아도 알아요 I love you
