time,rank,song_id,title,singers,album,date,genre,creator,lyric2014.03.10~03.16,71,4388691,B.B.B (Big Baby Baby),달샤벳,The 7th Mini Album `B.B.B`,2014.01.08,Dance,"신사동호랭이,BEOMxNANG",넌 Big Baby Baby I Need Some Body Body  넌 Big Baby Baby I wanna get your  body tonight big baby  넌 Big Baby Baby  넌 Big Baby Baby  왜 필요할 때 달라 너 Big baby 왜 끝나면 달라 너 Big baby 왜 어제와는 달라 너 Big baby 왜 오늘 더 달라 너 Big Baby Baby 네가 그렇게 날 볼 때마다  느껴지는 식어버린  감정들을 눈치 챘어 이제 어떡하라고  I Gotta go 내가 아프다고 아프다고  아프다고 화를내고  말해봐도 아무 관심 없는 그런 모습에 I Can’t take no more 너무 빨라 너 너무 달라져 혼자 허무해진 마음이 너무 커져서 너무 아팠어  너를 향한 나의 마음을  아프게 하는 너 Hey 너 너 너  come back to me baby 너너너너너너너넌  Big Baby Baby Hey 너 너 너  wanna be my baby 너너너너너너너넌  Big Baby Baby 왜 말끝마다 달라 너 Big baby 왜 눈빛이 달라 너 Big baby 왜 처음이랑 달라 너 Big baby 왜 끝이랑 달라 너 Big Baby Baby 나를 하루종일 바라보고 바라보고 생각해도  그렇게 해도 부족하다 말해줄땐 언제고 Don't you know 이제 너도 몰래 나도 몰래  꺼내어진 다른 너의 모습들이  나를 자꾸만 힘들게 해 I Can’t take no more 너무 빨라 너 너무 달라져  혼자 허무해진 마음이 너무 커져서 너무 아팠어  너를 향한 나의 마음을  아프게 하는 너 Hey 너 너 너  come back to me baby 너너너너너너너넌  Big Baby Baby Hey 너 너 너  wanna be my baby 너너너너너너너넌  Big Baby Baby 빠져든다 빠져든다  빠져든다 너는 내게로  Big Baby Baby Big Baby Baby 돌아온다 돌아온다  돌아온다 처음 그때로  Big Baby Baby Big Baby Baby Big baby 대체 왜이래  이거 참 대책 없네 이것 저것 하나 둘 셋 넷  다 아는 사이인데 다시 돌아와  돌아와 돌아와 다시 내게 돌아와 너무 빨라 너 너무 달라져 혼자 허무해진 마음이 너무 커져서 너무 아팠어  너를 향한 나의 마음을  아프게 하는 너 Hey 너 너 너 come back to me baby 너너너너너너너넌  Big Baby Baby Hey 너 너 너  wanna be my baby 너너너너너너너넌  Big Baby Baby
2014.03.10~03.16,72,4446749,Beep,박지윤,Inner Space,2014.02.17,Dance,"박지윤,윤종신",보고 말았어 그  나의 sensor 울고  왜 이렇게 끌리냐고  나를 바라봤고  내 사람이 됐고  나의 sensor  좋아 울고  Beep Beep Beep Beep Beep  틀린 적 없는 나의 예감은  이렇게나 큰 선물을 하지  그 누구와도 바꿀 수 없는 Oh Sexy my Love Vow Vow Vow Vow Vow  단 한 사람만 바라보겠어  단 한 남자의 여자 되겠어 그 누구와도 비교할 수 없는  Baby Oh my Love  이상했어 요즘  달라졌어 그즈음  다른 Beep 이 생긴 듯해 어쩜 어떻게 내게 Beep Beep 너무 나쁜  Beep Beep  용서할 수 없는  Beep Beep  뭐라고 What  Beep Beep Beep Beep Beep  틀린 적 없는 나의  예감은 이렇게나 큰  Shock Shock Shock Shock Shock  그 누구와도 바꿀 수 없던  Oh Sexy my Love  Vow Vow Vow Vow Vow  단 한 사람을 잊어야겠어  단 한 남자를 지워야겠어 그 누구와도 비교할 수  없던 Baby Oh my  Beep Beep Beep Beep Beep  틀린 적 없는  나의 예감은 이렇게나 큰  Shock Shock Shock Shock Shock 그 누구와도 바꿀 수 없던  Oh Sexy my Love  Vow Vow Vow Vow Vow  단 한 사람을 잊어야겠어  단 한 남자를 지워야겠어 그 누구에게 오늘 밤 넌 또 또  Baby oh my Baby  oh my Baby oh my Love
2014.03.10~03.16,73,4501266,그린라이트 (Feat. 앤드류 최),주석,그린라이트,2014.03.11,Rap / Hip-hop,"earattack,주석",니가 좋은데 너의 맘을 모르네  오늘도 내 옆에 있는데  느낌이 좋은데 oh baby  서로 뭔가 끌려가는 이 밤  Baby green light green light  Baby green light green light  Baby green light green light  Baby green light green light  내가 좋아하는 그녀는 우선 이뻐  겉보기와는 다르게 생각도 깊어  눈썹은 기초 화장만 해도 짙어  메이크업을 해도 After랑   같은 Before  니 마음 속의 다트에 꽂고 싶어   Bull's eye  I gotta crush on you 조금은   불쌍해 보여도  상관없어 얻을 수 있으니까  순간의 쪽팔림보다 더 큰 보상  대충 입은 소박한 외투  핸드백보다 어울리는 투박한 백팩  매주 업데잇되는 웹툰  보다 기다려지는 그녀와 겹치는   교양수업  어떻게 해야 그녀의 마음을   가나다처럼 쉽게 읽을 수가 있을까  내 맘도 모르는 넌 미소만 짓고  한번쯤 용기 내서 던져볼까 직구  니가 좋은데 너의 맘을 모르네  오늘도 내 옆에 있는데  느낌이 좋은데 oh baby  서로 뭔가 끌려가는 이밤  Baby green light green light  나 이거 착각인거 아닐까  Baby green light green light  그녀의 진짜 맘을 빨리 알고싶어  Baby green light green light  밝은 불빛을 밝혀줘 baby  Baby green light green light  I really wanna get to know  그녀는 우리 과 퀸카 소문만 수십 개  매일 보긴 하지만 그렇게 쉽게  알 수가 없네 그녀의 진짜 속마음  오늘도 난 열심히 정보를 수집해  좋아하는 영화 좋아하는 스타  좋아하는 음악 좋아하는 스타일  피곤해 갈라져버린 내 입술에   Lip balm이나 바를까  아님 머리나 자를까  하루에도 몇 번씩이나 울리는   그녀의 좋아요   무슨 의미인지는 몰라도 일단은   웃으며 댓글을 달아둬  친구가 오버하지 말래 그녀에게   난 그리 특별하지 않다고  누구에게나 보이는 관심정도라고  괜찮아 난 이 기분을 즐기고 싶어  고백하기 전까진 행복해 그 정도라도  니가 좋은데 너의 맘을 모르네  오늘도 내 옆에 있는데  느낌이 좋은데 oh baby  서로 뭔가 끌려가는 이밤  I'm not an Aqua man 이것만은  확고한데 시간이 지날 수록 자신이 없어져 난 매일 너를 보면 조마조마해 난 매일 너를 보며 로망을 소망해 I'm not an Aqua man 이것만은  확고한데 시간이 지날 수록 자신이 없어져 난 매일 너를 보면 조마조마해 난 매일 너를 보며 로망을 소망해 니가 좋은데 너의 맘을 모르네 오늘도 내 옆에 있는데 느낌이 좋은데 oh baby 서로 뭔가 끌려가는 이밤 니가 좋은데 너의 맘을 모르네 오늘도 내 옆에 있는데 느낌이 좋은데 oh baby 서로 뭔가 끌려가는 이밤 Baby green light green light 나 이거 착각인거 아닐까 Baby green light green light 그녀의 진짜 맘을 빨리 알고싶어 Baby green light green light 밝은 불빛을 밝혀줘 baby Baby green light green light I really wanna get to know Green light baby
2014.03.10~03.16,74,4454364,어느 소녀의 사랑 이야기,윤민수,불후의 명곡 - 전설을 노래하다 (박건호 편),2014.02.15,Ballad,박건호,우우우우우우우우  우우우우우우우우  우우우우우우우우  내 인생에 반은 그대에게 있어요  그 나머지도 나의 것은 아니죠  그대를 그대를 그리워하며  살아야 하니까  그대를 만날 때면 이렇게 포근한데 이룰 수 없는 사랑을 사랑을 어쩌면 좋아요 내 인생에 반은 그대에게 있어요 그 나머지도 나의 것은 아니죠 그대를 그대를 그리워하며 살아야 하니까 이 마음 다 바쳐서 좋아한 사람인데  이룰 수 없는 사랑을 사랑을 어쩌면 좋아요 내 인생에 반은 그대에게 있어요 그 고마운 마음 고이 간직할게요 그 나머지도 나의 몫은 아니죠 늘 감사하며 잊지 않고 살게요 그대를 그대를 그대를 그대를 그리워 하며 살아야 하니까 내 인생에 반은 그대에게 있어요 그 나머지도 나의 것은 아니죠 그대를 그대를 그리워하며 살아야 하니까 내 인생에 반은 그대에게 있어요 그 나머지도 나의 것은 아니죠 이룰 수 없는 사랑을 사랑을 이룰 수 없는 사랑을 사랑을 이룰 수 없는 사랑을 사랑을 어쩌면 좋아요 내 인생에 반은 그대에게 있어요
2014.03.10~03.16,75,4481273,고백,스탠딩에그,고백,2014.02.28,Rock,스탠딩에그,oh oh oh 너의 손이 스칠 때 oh oh oh 내 어깨에 기댈 때 네 곁에서 걷는 게 싫어  한 번씩 너의 손이 스치잖아 그때마다 잡고 싶은데  하지만 난 그러면 안 되잖아 네 옆에 앉는 것도 싫어  내 어깨에 기대 잠들 거잖아 그렇게 네가 깰 때까지  서로 다른 꿈을 꾸는 거잖아  난 그게 잘 안 돼 내 맘 숨긴 채  네 곁에 있어주는 게 이제 난 안돼 네 맘 편하게 친구로 있어주는 게 oh oh oh 너의 손이 스칠 때 oh oh oh 내 어깨에 기댈 때 내 앞에서 우는 게 싫어  널 보는 내 맘이 더 아프니까 모든 걸 해주고 싶지만  그 사람이 내가 될 순 없잖아 아무렇지 않게 이대로  조금 더 곁에 있고 싶지만 더 이상 내 맘을 숨긴 채  너의 눈을 바라볼 수가 없어 난 그게 잘 안 돼 내 맘 숨긴 채 네 곁에 있어주는 게 이제 난 안돼 네 맘 편하게 친구로 있어주는 게 oh oh oh 너의 손이 스칠 때 oh oh oh 내 어깨에 기댈 때 나 너에게 갈게 이젠 말할게  너의 손을 잡고 싶어 나 너에게 갈게 이젠 말할게  같은 꿈을 꾸고 싶어 난 그게 잘 안 돼 내 맘 숨긴 채  네 곁에 있어주는 게 이제 난 안돼 네 맘 편하게  친구로 있어주는 게 oh oh oh 너의 손이 스칠 때 oh oh oh 내 어깨에 기댈 때 oh oh oh 너의 손이 스칠 때 oh oh oh 내 어깨에 기댈 때
2014.03.10~03.16,76,4490151,L.O.V.E,양파,L.O.V.E,2014.03.05,Ballad,,이 봄눈이 녹는다 니가 내 손을 놓는다 그렇게 그렇게 넌 멀어진다 오오 흐려져 점점 사라져 점점 우리 추억이 흩어진다 wake up 니 목소리에 사랑해 눈으로 말해 널 안을 때마다 나던 비누 냄새 니 입술의 말이니 따듯 한 손이 더는 내 것이 아니다 love love love 날 살게 했던 u u u 이젠 잡을 수 없고  만질 수조차 없는 그때의 너와 나 어디쯤 가고 있니 love love love 난 너를 불러 u u u 늘 어디에 있던 지 가까이 느껴져 l o v e l o v e  바람 나를 스친다 머리카락 흩날리며 널 아주 멀리 보냈나 봐 이제나 점점 웃어져 점점 시간이 널 데려간다 love love love 날 살게 했던 u u u 이젠 잡을 수 없고  만질 수조차 없는 그때의 너와 나 어디쯤 가고 있니 love love love 난 너를 불러 u u u 늘 어디에 있던 지 가까이 느껴져 l o v e l o v e  왠지 너 지금 내 생각하는 걸까 마음이 아파 눈물이 흘러서 다시 제자리 되돌려놔 love love love 숨 쉴 수 없어 u u u 뺨을 닦아주는 너 날  안아주는 너 눈앞에 살아나 이렇게 끝이 없는 love love love 난 너를 불러 u u u 늘 어디에 있던 지 내 목소릴 들어줘 l o v e l o v e
2014.03.10~03.16,77,4476043,이겨낼거야 2 (Feat. GRAY),스윙스,감정기복 II Part.1 : 주요 우울증 (Major Depression),2014.02.26,Rap / Hip-hop,스윙스,내 이름 Swings 이 나라   Rap 장래의 Prince'  대충 7년 전에 썼던 내 가사지  언행일치 했냐고  글쎄 네가 말해 봐봐  답은 수학 같아서   간단해 수수께끼 아냐  까놓고 말해줄게  지하 속에서 보냈던 세월은  오늘을 위한 시간였단 걸  늦게 배웠어  이제야 익었지 아니   새로 태어난 듯  뻔하지만 애벌레가 나비로   다시 깨어난 그  그 단계에 도달했지  이제 beat 위에 날게  아 맞다 모르는 분들 있지   날 다시 소개할래  내 내 내 이름 스윙스   나 야망 진짜 쩔어  감정 기복이 심각하고   목마를 땐 눈물 먹어  난 약은 사람 멀리해 특히 남의 업적에  묻어가는 놈   그래서 날 그렇게 보면 섭섭해  내 적들에게 물어봐  못생긴 새끼 돼지  애미 애비 모르는 애지  혹 또는 sadist  다 맞는 말이겠지 뭐  내 뒤에서 말할 땐  이 바닥의 누구도   내가 가볍다 말은 안 해  난 실력 없는 사람 싫어  그만두길 바라지  연예인 병 사짜 싼마이   취급받는 사람이 될 수 없어  가벼운 척하는 진지병 환자지  아 물론 여잔 좋아해  이성애자 남자니  지금 만나는 분이 있어  이젠 진짜로 노력해  이성애자 얘기 나왔으니 말야   한 땐 homosexual한 사람   또 여자에 대한 학습된 편견을   갖고 살았지만 성찰을 통해  그 불은 껐어  신만이 심판이야   이제 내 game을 할 뿐  진보만이 답  그니까 2절로 가자구  난 이겨낼 거야  모두 이뤄낼 거야  hulk 처럼 앞에 있는 벽을   다 밀어낼 거야  내 뼈를 깎아도   그래 솔직히 아파도  하나씩 다 무너뜨릴 거야  like dominoes  club보단 책을  drama보단 다큐  뱀이 교배한단 걸   난 그렇게 알았고  단체보단 한 둘  또 필요하지 상술  허나 멋있는 사람에게만 치지 박술  스스로 구리다고 생각하는 가수는  featuring 부탁   이제 하지 마   돈 꽤 준다 해도 난 내 음악을  더 존중하기로 했어  fan들이 부하게 해줬으니  이걸로 계속 이어 갈게 나 약속해  울 엄마가 부자가 되는 법  힙합 속에 있다는 걸 다시  신앙처럼 확신해  그럼 힙합이 대체 뭐냐  답변 줄게 확인해  첫 번째 힙합은 시대정신과   유행을 늘 곁에 두지  예시 하나를 줄게  지금 대세 장르 중 하나하면 일렉  힙합과 fusion 하잖아  어때 되게 쉽지  두 번째 이건 약자를 위한 음악  잘 배운 척 우릴 깔볼 거면 사양할게   good bye  이겨내는 멋 강자에게 맞서기  나에게 그 강잔  서울이라는 boxer지  boxer 얘기 나왔네  이건 마치 sports  경쟁력은 절대 뺄 수 없는 요소  꼭 알아둬  폭력과 체계적 격투는 달라  창의적이고 어휘적인  wit 넘치는 가사는  꽤나 공평해  네가 날 치면 난 널 치지  내가 널 치면 당연히 또 너는 날 치지  스윙스는 돌고래 상어라도 발리지  그래서 어떤 상대라도 내겐 날치지  난 이겨낼 거야  모두 이뤄낼 거야  hulk 처럼 앞에 있는 벽을  다 밀어낼 거야  내 뼈를 깎아도 그래 솔직히 아파도  하나씩 다 무너뜨릴 거야  like dominoes  난 이겨낼 거야 난 이뤄낼 거야  hulk처럼 앞에  벽을 밀어낼 거야 내 뼈를 깎아도 너무나 아파도  하나씩 무너뜨릴 거야   like dominoes  난 이겨낼 거야 난 이뤄낼 거야  hulk처럼 앞에  벽을 밀어낼 거야 내 뼈를 깎아도 너무나 아파도  하나씩 무너뜨릴 거야   like dominoes  동생들 알아둬 rap의  정수는 word play  빡세게 연습하면 생겨 예쁜   girl friend  정치도 능력  이용해 봐 모든 매첼  용기를 가져 왜냐면 이젠  hip hop이 대세  동생들 알아둬 rap의 정수는 word play 빡세게 연습하면 생겨 예쁜  girl friend 정치도 능력 이용해 봐 모든 매첼 용기를 가져 왜냐면 이젠 hip hop이 대세 난 이겨낼 거야 모두 이뤄낼 거야 hulk 처럼 앞에 있는 벽을 다 밀어낼 거야 내 뼈를 깎아도  그래 솔직히 아파도 하나씩 다 무너뜨릴 거야 like dominoes
2014.03.10~03.16,78,4498637,너에게 주고 싶은 세 가지 (Feat. 소진 Of 걸스데이),크루셜스타(CrucialStar),너에게 주고 싶은 세 가지 (Remake),2014.03.10,Rap / Hip-hop,강현민,너에게 주고 싶은 세 가지 빛바랜 나의 일기장 작은 나의 얘기까지  말하고 싶은 거야 너에게 주고 싶은 세 가지 바다로 가는 기차표 수줍게 전해 주고픈  너의 생일 첫 키스 이제는 기대 나의 어깨  나의 품 안에 얼마나 많은 상철 받아왔니 baby 그 모든 것이  준비과정이었다 생각해 내가 네 종착역이 되고 싶어 내릴 땐 음 내가 볼 땐  굳게 닫혀있는 너의 맘엔 믿음이 필요한 것 같애  내가 줄게 지켜보기만 해 난 네가 만나왔던  남자들과는 정말 다른 걸 my love 너에게 주고 싶은 세 가지 빛바랜 나의 일기장 작은 나의 얘기까지  말하고 싶은 거야 너에게 주고 싶은 세 가지 바다로 가는 기차표 수줍게 전해 주고픈  너의 생일 첫 키스 현실은 다르지  꿈꿔왔던 모습과는 낭만 같은 건 사치 전부 너의 겉모습만 바라보며 너의 모든 것을 판단해 마음 깊은 곳의  진심은 다 외면당한 채 이제 보여줘 숨겨왔던  진짜 너의 세상을 헝겊으로 덮여있던  진짜 너의 색감을 추상화 같은 너를  난 뚫어지게 볼래 이젠 조금 알 것 같애  너란 작품의 의미를  baby 차가운 내 손을 잡아 잠시만 아주 잠시만 더 안아 나에게 날개를 달게 해준 너에게 주고픈 세 가지는 처음이자 마지막으로  공유하고 싶은 꿈인 걸 너에게 주고 싶은 세 가지 빛바랜 나의 일기장 작은 나의 얘기까지  말하고 싶은 거야 너에게 주고 싶은 세 가지 바다로 가는 기차표 수줍게 전해 주고픈  너의 생일 첫 키스
2014.03.10~03.16,79,4494620,하나둘셋넷,TheOne(더원),"Who Is The One, I Am The One!",2014.03.07,Ballad,TheOne(더원),하나 둘 셋 넷 지난 기억을 꺼내본다 도레미 파 솔라시 우리의 그 노랠 부른다 전하지 못했던 내 맘 너에게 닿도록 불러본다 난 이대로 난 이대로 여기 그 추억에 멈춰  너를 꼽으며 시간을 걸어 넌 그대로 넌 그대로 넌 그대로   사랑한 너야해 행복한 너여야해 우리 마지막 약속처럼 도레미파 솔 라시 우리의 그 노랠 부른다 말하지 못했던 그 말 너에게 닿도록 너에게 닿도록 난 이대로 난 이대로  여기 그 추억에 멈춰 너를 찾으러 시간을 걸어 넌 그대로 넌 그대로 넌 그대로  사랑한 너야해 행복한 너여야해  우리 마지막 약속처럼 미치게 사랑했던 뜨겁게  불태웠던 너를 널 생각해 난 이대로 넌 그대로  여기 같은 길 위에서 한번쯤 우리 서로를 찾아 난 이대로 넌 그대로  우리 이대로 멀리 서 있지만 행복한 너여야 해 사랑해  난 이대로 넌 그대로 여기 우리 둘이 너와 내가 나눴던 많은 말 난 이대로 넌 그대로  우리 이대로 멀리 서 있지만 행복한 너여야해 우리 마지막  도레미파 솔 라시 이 노랠 부른다
2014.03.10~03.16,80,4492324,사랑해요,허공,I Love You,2014.03.06,Ballad,양정승,기다릴 거에요 그대 없는 내 삶은 없는 거죠 너무 그리워질 때면 그댈 생각하면서 웃어 봐요 긴 시간을 사랑 했죠 그대만 바라보며 살아 왔었죠 사랑해요 사랑해요 사랑해요 난 그대뿐이죠 마음이 죽을 만큼 아파서 미치도록 너무 아파서 떠날 수가 없네요 그대가 웃네요 나도 모르게 그댈 따라 웃죠 행복을 줄 수 없어서 사랑 할 수 없어서 미안해요 내 소원은 단 한 사람 그대가 행복하길 바랄 뿐인데 사랑해요 사랑해요 사랑해요 난 그대뿐이죠 마음이 죽을 만큼 아파서 미치도록 너무 아파서 떠날 수가 없네요 내 마음 변하지 않아 그대만 사랑하기 때문에 사랑해요 미안해요 바보처럼 난 그대만 알죠 시간이 우릴 변하게 해도 나는 변할 수가 없어요 사랑하기 때문에 그대를 두고 갈수 없어요
2014.03.10~03.16,81,4511982,그린라이트 (GREEN LIGHT),"트로이(범키,칸토,재웅,창우)",그린라이트 (GREEN LIGHT),2014.03.14,Rap / Hip-hop,"범키,원재웅(WonJaewoong),창우,칸토",Ha Top 열린 자동차를 타고  어디든 나 달려가고 싶어  밀려있는 일 다 미뤄두고  바람 따라 떠나가고 싶어  Radio에 흐르는 노래  나도 몰래 흥얼거리네  쓸데없는 걱정은 버려 No more  너를 놓아줘  퍼즐처럼 틀에 맞춘 스케줄  그런 것들 때문에 넌 늘  시간에 쫓기다 보니까  잊고 살았던 낭만과 일탈  Excuse me 잠깐 시간 좀 있습니까  떠나볼까 Cancun Ibiza  뜸들이지 마 지금이 딱이야  Give me the green light  우 우 우 우  Give me the green light  우 우 우 우  Yeah Get away  Get away Get away Get away  내일의 걱정은 내일 해  왜 매일 해 자꾸 No  뭘 망설이는데  지금 이 순간이 지나가면  어차피 똑같은 내일이 올 텐데  그냥 뭔가에 끌려 올라탄 차   시동을 걸어  클러치를 밟고 쓱 밀어 넣어   1단 기어 쭉  엑셀을 밟아  오늘 너와 나 Drive away 딱 맞아  여기저기 멀리 잘 다녀  왼손은 핸들 오른손은 변속  가끔은 Grab your hands  꽉 조여진 넥타이와 같이 매일  호흡곤란을 일으키며 어제 같은   하루를 Replay  Give me the green light  난 보고 싶어 오늘 밤  시끄러운 네온사인 보다 반짝이는 Star  이 도시의 색깔은 탁해  That's that Thang I don't like  쿵쿵 베이스를 뒤로한 채 춤춰   All night  떠나 볼까 여행 혼자 반대로 행여  걱정 말고 다 할 일은 미뤄두기로  어지러운 이곳을 벗어나자고  Give me the green light  우 우 우 우  Give me the green light  우 우 우 우  Yeah Get away  Get away Get away Get away  내일의 걱정은 내일 해  왜 매일 해 자꾸 No  설레는 맘 어쩔 줄 몰라 여기가 천국  오늘 하루 걱정은 잠시 잊어 이건 선물  같아 받아도 되 어디로 갈까 산   아님 바다도 되  말만으로도 넌 기분 좋은 상상해  Give me the green light  우 우 우 우  Give me the green light  우 우 우 우  Yeah Get away  Get away Get away Get away  내일의 걱정은 내일 해  왜 매일 해 자꾸 No  Give me the green light 우 우 우 우 Give me the green light 우 우 우 우 Yeah Get away Get away Get away Get away 내일의 걱정은 내일 해 왜 매일 해 자꾸 No
2014.03.10~03.16,82,4381725,백야,엠씨더맥스,UNVEILING,2014.01.02,Ballad,이수(엠씨더맥스),하얀 밤을 모두 지새고 네게로 돌아간다 오래 비워둔 내 제자리로 부서지고 날카로웠던 마음들뿐이어서 널 안을 수 없을 때도 나를 놓치지 않으려 스스로 다치던 네게 지금 다시 돌아가며 시간이 흘러가면서 천천히 잊혀져가는 기억은 모두 사라져 내게 멀어진대도 영원한 건 너의 마음뿐 나를 놓치지 않으려 스스로 다치던 네게 지금 다시 돌아가며 시간이 흘러가면서 천천히 잊혀져가는 기억은 모두 사라져 내게 멀어진대도 영원한 건 너의 마음뿐 내게 남아있는 모든 것들이 모두 사라지고 이름뿐일 때 모든 것을 감싸 안으며 따뜻하게 불러준 사람 이제는 웃어주겠니 길었던 방황의 끝에 지난 시간을 등 뒤로 너와 마주 잡은 손을 놓치진 않을 거야 두 눈 가득 담은 그댈 다시 네게서 떠나지 않을 거야 너에게 약속할게
2014.03.10~03.16,83,4446470,마리오네트,스텔라,마리오네트,2014.02.12,Dance,송수윤,지울 수가 없는 너니 왜 이리 미련하니 난  oh 내게 전화하지 마  난 기대하게 돼 올 거 아니잖아 그럼 놔  ah ah woo hoo hoo 습관처럼 찾아와 날 갖고 놀지 마 다 끝났다면서 대체 왜  eh eh woo hoo hoo 넌 참 나빠 난 또 아파  넌 변한 게 없어 난 변한 게 없어 니 변덕에 놀아나고 있어 말해봐 넌 이게 재밌니 날 봐 끈 아래 묶인 슬프고 슬픈 인형을 봐 여전히 네게  이리 저리 끌리고 끌려 나 끊어내지 못한 질긴 미련 아직도 니 손에 난  that that that that  that that that that doll 지울 수가 없는 너니 왜 이리 미련하니 난 oh 지울 수가 없는 너니 아직도 니 손에 난 that that that that that that that that doll 한 번이면 족해  난 두 번은 안돼 넌 내 인생에서 좀 빠져줘  uh uh woo woo woo 잊었는가 싶으면 왜 와서 건드려 가버릴 거면서 찔러봐 uh uh woo woo woo 니가 싫다 내가 밉다  넌 변한 게 없어 난 변한 게 없어 건드리면 받아주고 있어 말해봐 넌 내가 우습니 날 봐 끈 아래 묶인  슬프고 슬픈 인형을 봐 여전히 네게  이리 저리 끌리고 끌려 나 끊어내지 못한 질긴 미련 아직도 니 손에 난 that that that that that that that that doll 다 다 지워야지 왜 벗어나질 못해  익숙해졌니 몸부림치면 칠 때마다 오히려 깊게 엉켜들어 아직도 난 니 손에 난 that that that that that that that that doll 부서진 날 봐 너에게 찢긴 아프고 아픈 인형을 봐 여전히 네게 이리 저리 끌리고 끌려 나 돌이킬 수 없는 깊은 상처 아직도 니 손에 난 that that that that  that that that that doll 지울 수가 없는 너니 왜 이리 미련하니 난 oh 지울 수가 없는 너니 아직도 니 손에 난 that that that that  that that that that doll
