time,rank,song_id,title,singers,album,date,genre,creator,lyric2015.03.16~03.22,48,5442687,내 생애 가장 행복한 시간 (Feat. 허각),MC몽,MISS ME OR DISS ME,2014.11.03,Rap / Hip-hop,MC몽,그땐 그랬어 막 잘 나갈 때라서 돈에 환장해 독이 찰 때라서 없던 놈이 뭐가 생기니까 끝없는 욕심은 더 땡기니까 여자는 더 꼬여 사람이 우습게 보여 자신을 괴물로 만드니까 내가 내 무덤을 파고 파니깐 내 사람들 하나 둘 떠나니까 억짜리 시계 팬트 하우스 스윗 노래 부르는 기계 몇 십 억의 수입 생각 없는 기부 믿음 없던 기도 밤이면 밤마다 덮치는 파도 이상해 그때가 안 그리워 그대가 있음에 하나도 안 두려워 아둥바둥 싸우고 사는 사람같이 이제야 내 모습이 안 더러워 사랑이 없는 인적 없는 홀로 버려진 외딴 섬 바람에 부딪혀 그대 이름마저 지운 난 사랑한단 말에 울컥 다 쏟는다 내 생애 가장 행복한 시간 너와 나는 트러블 스캔들 떠나가는 팬들 요즘 유행은 뭔지 잃어버린 트렌드 아들과 같이 숨어버린 엄마 그 분에겐 간절한 기도만이 평화 몰래 듣지 말아요 내 노래 몰래 울지 말아요 두 볼에 꼬마 점쟁이야 네가 딱 맞췄어 이게 바로 불효 중에 불효자야 뉴스에 나온 횟수만큼이나 내려가는 호감지수 실수가 낳은 가수 사랑 받은 만큼 넌 더 혼나야 해 이상해 그때가 안 그리워 그대가 있음에 하나도 안 두려워 아둥바둥 싸우고 사는 사람같이 이제야 내 모습이 안 더러워 사랑이 없는 인적 없는 홀로 버려진 외딴섬 바람에 부딪혀 그대 이름마저 지운 난 사랑한단 말에 울컥 다 쏟는다 내 생애 가장 행복한 시간 너와 나는 그녀의 몰래 훔친 눈물 보면 다시 살고 싶고 나만 보면 웃어주는 너와 같이 살고 싶고 하늘을 뻗으며 너에게 하는 말 이 길의 끝에서 마지막 사랑을 I'm nothing without you I'm nothing without you 널 사랑해 그녀의 몰래 훔친 눈물 보면 다시 살고 싶고 나만 보면 웃어주는 너와 같이 살고 싶고 하늘을 뻗으며 너에게 하는 말 이 길의 끝에서 마지막 사랑아 하늘에 난 소리쳐요 사랑한단 말에 울컥 다 쏟는다 내 생애 가장 행복한 시간 너와 나는 그땐 그랬어 막 잘 나갈 때라서 그땐 그랬어 막 잘 나갈 때라서 그땐 그랬어 막 잘 나갈 때라서 그땐 그랬어 막 잘 나갈 때라서 이상해 그때가 안 그리워 그대가 있음에 하나도 안 두려워 그대가 있음에 하나도 안 두려워
2015.03.16~03.22,49,5493729,싱숭생숭 (SsSs),"다이나믹듀오,박정현",싱숭생숭 (SsSs),2014.12.05,Rap / Hip-hop,"개코,최자",크리스마스에 연말에  다들 들떠있는데  약속도 없이 외롭고 붕 뜬 기분 탁자 위에 오래된 빵은 퍽퍽해 친구는 하루를 자랑하기 바쁘네 대낮부터 날 안아준 얄미운 이불 롤케익 같애 작은 방안은 답답해 창밖에 선 첫 눈이 내려와요 눈이 내려와 첫 눈이 와 기다린 적도 없었는데 막상 떨어지니 좀 설레 여요 괜히 반가워 첫 눈이 내려와요 눈이 내려와 첫 눈이 와 때마침 나타난 전화 안에 너 우우우우우 틱틱 다운로드 프로필 사진 바뀌었나 또 확대해보고 속는 셈 예뻐진 너에게 전화를 거네 어디 있어 바뻐 별 일 없는 거 알어 점심이나 먹을래 틱틱거리긴 했지만 옷을 꺼내고 급하게 머리를 말리고 벌써 거울 앞에 한 듯 안 한 듯하게 하늘에선 첫 눈이 내려와요 눈이 내려와 첫 눈이 와 기다린 적도 없었는데 막상 떨어지니 좀 설레 여요 괜히 반가워 첫 눈이 내려와요 눈이 내려와 첫 눈이 와 때마침 나타난 내 눈 앞에 너 우우우우우 밍숭맹숭했던 너와 나의 관계 오늘은 이상하게 싱숭생숭 눈 내리는 Good afternoon 맞으며 맞춰보는 너와 나의 눈 눈 내리는 Good afternoon 내리는 눈을 보는 너의 눈을 보는 나의 눈은 취기 아니면 위기 우리 둘이 알아서 엮이는 분위기 소복히 쌓인 눈을 뽀독 밟으며 소곤 찬바람은 내게 널 밀어 붙이지 따끈한 입김은 이불처럼 부드럽고 은밀하게 우리를 덮어 이 눈은 마치 Whip cream 커피처럼 새까만 이 도시 위를 하얗게 덮어 눈 안에서 첫 눈이 내려와요 눈이 내려와 첫 눈이 와 기대한 적도 없었는데 막상 떨어지니 좀 설레 여요 괜히 반가워 첫 눈이 내려와요 눈이 내려와 첫 눈이 와 때마침 나타난 첫눈 아래 너 우우우우우 그 해 겨울엔 재밌었는데 진짜 올해 겨울엔 어떤 일들이 벌어질까
2015.03.16~03.22,50,5622592,잊는다는 게,윤현상,파랑:WAVE,2015.03.13,Ballad,윤현상,잊는다는 게 참 그래요 사랑하다가 이별하게 되면 그때서야 못해줬던 게  생각이 나요 꼭 어제 일처럼  추억이란 게 참 그래요 분명 내 맘속엔 아직 남아있는데  지나가면 없었던 일로 해버리는 게 속 편할 때가 있겠죠 잊는다는 게 왜 이리 힘들죠 함께했었던 그 시간 때문일까요 새로운 사람을 만나서  행복해지면 되는 간단한 일인데 왜 그리 어렵죠  잊는다는 게 이별이란 게 참 그래요 지키지 못한 약속들이 전부 내게 거짓말이 돼 버린단 게  내가 이기적인 게 돼버리니까 잊는다는 게 왜 이리 힘들죠 함께했었던 그 시간 때문일까요 새로운 사람을 만나서  행복해지면 되는 간단한 일인데 왜 그리 어렵죠  잊는다는 게 지금 생각나는 모든 것들이 어쩌면 다시는 또 오지 못할 기억에 묻힌 날들  행복했었던 날들 이젠 잊어야겠지  모두 잊어야겠지 가끔 생각이 날 때가 있겠죠 그댈 만나서 그 동안 행복했어요 새로운 사람을 만나도  그댄 잊지 말아요 이제는 끝인 게 왜 그리 어렵죠  왜 그리 힘들죠 잊는다는 게
2015.03.16~03.22,51,4433490,썸 (Feat. 릴보이 Of 긱스),"소유(SOYOU),정기고",썸,2014.02.07,R&B / Soul,"민연재,Xepy,에스나(eSNa),릴보이(긱스),정기고",썸 (Feat. 릴보이 Of 긱스)  가끔씩 나도 모르게 짜증이나  너를 향한 맘은 변하지 않았는데 혹시 내가 이상한 걸까  혼자 힘들게 지내고 있었어 텅 빈 방 혼자 멍하니 뒤척이다  티비에는 어제 본 것 같은 드라마  잠이 들 때까지 한번도  울리지 않는 핸드폰을 들고  요즘 따라 내꺼인 듯  내꺼 아닌 내꺼 같은 너 니꺼인 듯 니꺼 아닌  니꺼 같은 나 이게 무슨 사이인 건지 사실  헷갈려 무뚝뚝하게 굴지마 연인인 듯 연인 아닌 연인 같은 너 나만 볼 듯  애매하게 날 대하는 너  때로는 친구 같다는 말이  괜히 요즘 난 듣기 싫어 졌어 매일 아침 너의 문자에  눈을 뜨고 하루 끝에는  니 목소리에 잠들고 파 주말에는 많은 사람 속에서  보란 듯이 널 끌어 안고 싶어 요즘 따라 내꺼인 듯  내꺼 아닌 내꺼 같은 너 니꺼인 듯 니꺼 아닌  니꺼 같은 나 때로는 친구 같다는 말이  괜히 요즘 난 듣기 싫어 졌어 너 요즘 너 별로야 너 별로야  나 근데 난 너뿐이야  난 너뿐이야 분명하게 내게 선을 그어줘  자꾸 뒤로 빼지 말고  날 사랑한다 고백해 줘 여전히 친구인척 또 연인인척  행동하는 모습을 전부다 돌이켜 생각 할 수록 너의 진심이  더 궁금해지는 걸 girl you’re so ambiguous 난 못해  무엇도 아니 어쩌면  기적을 바라지 lotto 확실한 표현을 원하지만  너의 미소 띈 표정에  잊어버리지 난 요즘 따라 내꺼인 듯  내꺼 아닌 내꺼 같은 너 니꺼인 듯 니꺼 아닌  니꺼 같은 나 순진한 척 웃지만 말고  그만 좀 해  너 솔직하게 좀 굴어봐 니 맘 속에 날 놔두고  한 눈 팔지 마 너야말로  다 알면서 딴청 피우지 마 피곤하게 힘 빼지 말고  어서 말해줘 사랑한단 말이야
2015.03.16~03.22,52,5612284,안녕 (Hi~),러블리즈,Hi~,2015.03.03,Dance,서지음,처음 너를 만난 건 너의 기억보단 조금 더 빠른 걸 언제나 너의 뒤에서 몰래 널 바라봤지 넌 잘 모를 걸 솔직히 말을 하면 답답한 내 마음이 조금 후련해질까 전부 다 말해버리고 괜히 어색해지면 그땐 어떡하지 거울 보며 하나 세고 둘을 세면 안녕 우리 만날래 내가 지금 할 말이 있어 우리 만나자 물어볼 게 있으니까 용기 내서 하는 말이야 그러니 솔직하게 대답해줘 우리 만날래 오랫동안 기다려왔어 우리 만나자 그냥 이런 친구 말고 저기 말야 내가 있잖아 널 많이 사랑해 수없이 연습해도 어쩔 수가 없나 봐 맘이 떨려오는 건 어쩌죠 자꾸 겁이 나 결국 해야 한다면 빨리 해야겠지 전활 걸어 하나 세고 둘을 세면 안녕 우리 만날래 내가 지금 할 말이 있어 우리 만나자 물어볼 게 있으니까 용기 내서 하는 말이야 그러니 솔직하게 대답해줘 우리 만날래 오랫동안 기다려왔어 우리 만나자 그냥 이런 친구 말고 저기 말야 내가 있잖아 널 많이 사랑해 이 순간 1분 1초가 어제 하루보다 더 긴 것 같아 그렇게 웃고만 있지 말고 말해봐 자꾸 그럴래 대체 뭐가 재밌는 거야 자꾸 그럴래 나는 심각하단 말야 용기 내서 하는 말이야 그러니 솔직하게 대답해줘 우리 만날래 오랫동안 기다려왔어 우리 만나자 그냥 이런 친구 말고 저기 말야 내가 있잖아 널 많이 사랑해
2015.03.16~03.22,53,4646573,너의 의미 (Feat. 김창완),아이유,꽃갈피,2014.05.16,Ballad,김한영,너의 그 한 마디 말도 그 웃음도  나에겐 커다란 의미  너의 그 작은 눈빛도  쓸쓸한 그 뒷모습도 나에겐 힘겨운  약속  너의 모든 것은 내게로 와  풀리지 않는 수수께끼가 되네  슬픔은 간이역의 코스모스로 피고  스쳐 불어온 넌 향긋한 바람  나 이제 뭉게구름 위에 성을 짓고  널 향해 창을 내리 바람 드는 창을  너의 그 한 마디 말도 그 웃음도  나에겐 커다란 의미  너의 그 작은 눈빛도  쓸쓸한 그 뒷모습도 나에겐 힘겨운  약속  너의 모든 것은 내게로 와  풀리지 않는 수수께끼가 되네  슬픔은 간이역의 코스모스로 피고  스쳐 불어온 넌 향긋한 바람  나 이제 뭉게구름 위에 성을 짓고  널 향해 창을 내리 바람 드는 창을  슬픔은 간이역의 코스모스로 피고  스쳐 불어온 넌 향긋한 바람  나 이제 뭉게구름 위에 성을 짓고  널 향해 창을 내리 바람 드는 창을  너의 그 한 마디 말도 그 웃음도  나에겐 커다란 의미 너의 그 작은 눈빛도 쓸쓸한 그 뒷모습도 나에겐 힘겨운 약속
2015.03.16~03.22,54,5413256,12시 30분,비스트,TIME,2014.10.20,Ballad,GoodLife,요란한 소릴 내며  깨지는 유리병 우리 모습일까  낮게 깔린 하늘이 금방이라도  부서질 것 같으니까  왜 이제야 왔냐며  날 기다렸다며  내 사랑 반겼던 너는 이제  어쩌다 마주친 모르는 사람보다  차갑게 얼어있다  환한 네 미소도 환한 미소도  따뜻한 네 품도 네 얼굴도  더 이상 볼 수도  만질 수도 없을 것만 같아 두려워  지금 우린 마치  12시 30분의 시곗바늘처럼  서로 등 돌리고 다른 곳을 보고  모든 걸 버리려고 하잖아  우린 마치  12시 30분의 시곗바늘처럼  다신 돌아올 수 없는 곳으로  걸어가고 있잖아  우릴 따라 흘러가던  시간도 멈췄나 봐  우리라기보단 이젠  너와 내가 됐나 봐  사소하게 지나간 모든 것들이  다 지나가기보단 놓친 것 같아  네 손이 참 따뜻했었나 봐  흔들리는 널 이미 알았어  그래서 더 꽉 잡았어  널 안았어 널 가뒀어  내 사랑이 독해져서  Yeah I know  모두 내 탓인 걸  But 미련이란 거 희망이란 거  놓을 수가 없어  환한 네 미소도 환한 미소도  따뜻한 네 품도 네 얼굴도  더 이상 볼 수도  만질 수도 없을 것만 같아 두려워  지금 우린 마치  12시 30분의 시곗바늘처럼  서로 등 돌리고 다른 곳을 보고  모든 걸 버리려고 하잖아  우린 마치  12시 30분의 시곗바늘처럼  다신 돌아올 수 없는 곳으로  걸어가고 있잖아  언젠가 이별이  내 앞에 무릎 꿇을 때 시간이  다시 우릴 따라 흐르게 될 거라 믿어 그렇게 올 거라 믿어 지금 보내지만 너를 보냈지만 모든 게 다 멈췄지만 고장 나 버린 시계가 다시 움직일 거라고 믿어 지금 우린 마치 12시 30분의 시곗바늘처럼 서로 등 돌리고 다른 곳을 보고 모든 걸 버리려고 하잖아 우린 마치 12시 30분의 시곗바늘처럼 다신 돌아올 수 없는 곳으로 걸어가고 있잖아
2015.03.16~03.22,55,4806686,공허해,WINNER,2014 S/S,2014.08.12,Ballad,"B.I,MINO,BOBBY",거울 속에 내 모습은 텅 빈 것처럼 공허해 혼자 길을 걸어봐도 텅 빈 거리 너무 공허해 Da ra dat dat dat dat dat dat Baby don't worry 너란 꿈에서 깬 현실의 아침은 공허해 아침을 맞이 하면서 다시 자각해 날 깨워주는 건 네가 아닌 알람벨 빌어먹을 침대는 왜 이리 넓적해 허허벌판 같은 맘에 시린 바람만 부네 나는 빈 껍데기 너 없인 겁쟁이 주위 사람들의 동정의 눈빛이 날 죽게 만들어 No what a day 하루 시작 하기 전에 무심코 본 거울 속에 내 모습은 텅 빈 것처럼 공허해 미소가 없어 표정엔 혼자 길을 걸어봐도 텅 빈 거린 너무 공허해 내 마음처럼 조용해 Da ra dat dat dat dat dat dat Baby don't worry Da dat dat dat da ra 너란 꿈에서 깬 현실의 아침은 공허해 내 마음이 너무 공허해 끝이 났네요 나의 그대여 어디 있나요 이제 우린 추억이 됐죠 행복 했어요 날 잊지 말아요 또 다시 만나요 좋았던 날들과 슬펐던 날들 힘들었던 날들과 행복했던 날들  이젠 지나 가버린 시간 속에 추억이 되어 과거에 머물러 있는 그대와 나는 over 현실로 돌아온 것 같아 삶의 이유가 사라져 머리가 복잡해 아침에 눈을 뜨면 가슴이 텅 빈 것 같이 공허함을 느껴 너를 만나기 전과 똑같아 거울 속에 내 모습은 텅 빈 것처럼 공허해 미소가 없어 표정엔 혼자 길을 걸어봐도 텅 빈 거린 너무 공허해 내 맘처럼 조용해 Da ra dat dat dat dat dat dat Baby don't worry Da dat dat dat da ra 너란 꿈에서 깬 현실의 아침은 공허해 내 마음이 너무 공허해 끝이 났네요 나의 그대여 어디 있나요 이제 우린 추억이 됐죠 행복 했어요 날 잊지 말아요 또 다시 만나요 아직 아른거려요 눈을 감으면 점점  무뎌 지겠죠 시간이 지나면 후회하지는 않아요 좀 아쉬울 뿐이죠 보고 싶지는 않아요 그대가 그리울 뿐이죠 예전 같지 않은 내 모습이 점점 두려워 미소가 없어 표정엔 약해져만 가는 내 자신을 보기가 무서워 내 마음처럼 조용해 네가 없는 내 주위는 공기 조차 무거워 Da ra da ra ra ra ra dat 너란 꿈에서 깬 현실의 아침이 끝이 났네요 끝이 났네요 나의 그대여 어디 있나요 어디 있나요 이제 우린 추억이 됐죠 행복했어요 행복했어요 잊지 말아요 잊지 말아요 다시 만나요
2015.03.16~03.22,56,5612295,꽃 (Feat. 타블로 Of 에픽하이),XIA(준수),Flower,2015.03.03,R&B / Soul,"XIA(준수),김태완,Tablo",Take my hand You know I’m here with you Say my name Cuz lies can't kill the truth 타들어가고 있어 거짓 안에 숨겨왔던 진실들을 숨을 죽이고 있어 작은 입술 위에 깨진 많은 꿈들 Nobody can help me 썩어버린 기억 저 편위에 나를 꺼내줘 Come take my hand Come take my hand 말라버린 내 심장을 적셔줘 Come take my hand Till the end 다시 널 위해 살아갈 수 있게 Please take my 무참히 밟혀진 꽃 Looks like love is pain 꺾인 날개처럼 날 구속하는 수많은 그 상처 파고드는 슬픈 가시 같아 Come take my hand Come take my hand 말라버린 내 심장을 적셔줘 Come take my hand Till the end 다시 널 위해 살아갈 수 있게 Please take my hand It's all right Take my hand 이 잘난 세상엔 실수조차 큰 죄가 돼 Don't cry 또 다시 세간의 화제가 된 넌 재가 되고 다 살점 하나 떼 가네 Your life Your soul Your world They cannot kill it 날 봐 죽고 다시 눈 떠 I killed it 날 삼켰던 어둠 이제 내가 너를 삼키네 폭풍의 눈을 찔러 뿌리 깊은 꽃은 피네 이게 진리 다 끝난 것 같지 그간 널 덮친 세상에 문 하나 없지 누구나 다 겪지 I tell you it's okay 작은 빛이라도 어둠이 삼키지는 못해 Come take my hand Just take my hand Come take my hand Uh uh uh 말라버린 내 심장을 적셔줘 Cuz love is pain like a candle  in the rain Come take my hand Take My Hand Till the end Till The End 다시 널 위해 살아갈 수 있게
2015.03.16~03.22,57,5552430,드라마 (DRAMA),나인뮤지스,DRAMA,2015.01.23,Dance,정창욱,순진한 척 모르는 척 나도 몰래 이브의 사과 손을 댔나 입을 댔나 이건 아닌데 절대 아닌데 하면서도 나 빠져들어 Yo Yo This is Drama 어색해진 우리 사이 마의 Triangle 위태로운 우리 사이 법이 없는 Jungle 아슬아슬 줄타기가 시작되려 해  Stop over 맘의 준비 필요해 You and Me 무대 위 둘만이 덩그러니 슬픈 음악 뒤로 흐르고 까만 밤 별들이 조명처럼 비추네 그 빛 아래 엇갈린 우리 Oh 처음부터 네가 좋았었는데 하필 내 가장 친한 친구가 너를 사랑하게 됐대 너랑 잘 되는 거 같대 Drama에서나  나올법한 얘긴데 어떡해 이제 나 이 잔인한 Drama Oh 이미 시작된 Drama 끝을 알 수 없는 나의 Love story 이 아슬한 Feeling Oh 널 갖고픈 맘이 자꾸 멈출 수가 없어  Everyday Only U 두두루두 Only U 두두루두두 Only U 두두루두 Only U 두두루두 Only U 두두루두두  Only U I will never ever give up Only U No way No 엉켜버린 우리 사이 No 꿈속을 헤매고 있어 미로 끝에 서 있는 Boy  가시덤불 저 너머 Boy 거기 있어 도망가지 마 내가 갈 테니 Never mind 다퉜대 너하고 성격이 참 안 맞대 끝낼 거란 친구의 얘기 나쁜 맘 안되지 하면서도 기대해  말도 안 돼 하면서도 나 Oh 하루에 열두 번도 더  너의 소식 체크를 하네 어쩌지도 못하면서 그저 바라보기만 해 머리가 복잡해 얘기할 곳도 없어 어떡해 이제 나 이 잔인한 Drama Oh 이미 시작된 Drama 끝을 알 수 없는 나의 Love story 이 아슬한 Feeling Oh 널 갖고픈 맘이 자꾸 멈출 수가 없어 Everyday Only U 두두루두  Only U 두두루두두 Only U 두두루두 Only U 두두루두 Only U 두두루두두 Only U I will never ever give up Only U
2015.03.16~03.22,58,5582180,밤샜지 (Prod. By ZICO),육지담,언프리티 랩스타 Track 1,2015.02.06,Rap / Hip-hop,"육지담,지코(ZICO)",난 밤샜지 증명하고자 밤샜지 밤샜지 밤샜지 이 가사 암기하려 밤샜지 육지담 사는 거 완전 빡세지 빡세 빡세 빡세 bounce it 넌 날 잘 몰라 baby 조금 날카로운 lady 잘 나가니 친한 척 왜 이래 get your party like pay day 내 앞에선 everybody may day 언니 앞을 가로질러 새치기 넌 재채기 당황한 티나 날 제치길 원한다면 그냥 내걸 갖고 베끼길 I'm back again 이 노랜 turning point 빛나 은 금색 아니어도 2 Chainz and Rollies 최연소 여성 래퍼 I'm Galileo 절대 얽매이지 않지 yes libero oh 입 벌리지 말고 놀래 운세가 좋은 내 올해 내게 끄덕여지는 네 고개 어디 가도 난 존재해 이 곡에 난 밤샜지 증명하고자 밤샜지 밤샜지 밤샜지 이 가사 암기하려 밤샜지 육지담 사는 거 완전 빡세지 빡세 빡세 빡세 bounce it 처음 마음가짐 시작했어 다시 날 믿었기에 두렵지 않고 가득했던 자신 내게 욕할 시간에 잘 둘러봐라 네 자신 니넨 몇 년을 랩 해도  항상 똑같은 아침 말도 안 되는 이센스 배운 거 no 대대로 세습 무시 못 할 내 재능은 A를 넘어서 찍었어 S 날 보고 웃었던 네 표정이 싹 굳어 점점 스케일이 커지니까  솔까 부럽지 걔들은 집에서 내 욕만 해 더 커져 욕심만 쌓인 배들 한계점을 뛰어넘기 위해 매일같이 나와 배틀을 해 16마디로 날 묶어놓을 순 없어 이 작은 verse 안에선 매길 수 없는 성적 oh 입 벌리지 말고 놀래 운세가 좋은 내 올해 내게 끄덕여지는 네 고개 어디 가도 난 존재해 이 곡에 난 밤샜지 증명하고자  밤샜지 밤샜지 밤샜지 이 가사 암기하려 밤샜지 육지담 사는 거 완전 빡세지 빡세 빡세 빡세 bounce it 미친 것처럼 랩을 해 네가 뭔데 나를 판단해 웃기고 앉아있네  나의 노력 네가 알기나 해 미친 것처럼 랩을 해 네가 뭔데 나를 판단해 산이든 바다든 육지든  내 노래 퍼질 때까지 Go gettem Ay 난 밤샜지 증명하고자  밤샜지 밤샜지 밤샜지 이 가사 암기하려 밤샜지  육지담 사는 거 완전 빡세지 빡세 빡세 빡세 bounce it 밤샜지 밤샜지 밤샜지 밤샜지 밤새 밤샜지 밤샜지 밤샜지 밤샜지 밤새 밤샜지 밤샜지 밤샜지 밤샜지 밤새
2015.03.16~03.22,59,4681146,한여름밤의 꿀,"SanE,레이나(Raina)","San E, 레이나 Project Single `한여름밤의 꿀`",2014.06.12,Rap / Hip-hop,SanE,무더운 밤 잠은 오지 않고 이런저런 생각에 불러본 너 나올 줄 몰랐어 간지러운 바람 웃고 있는 우리 밤하늘에 별 취한듯한 너 시원한 beer cheers 바랄게 뭐 더 있어 한여름밤의 꿀 한여름밤의 꿀 so sweet so sweet yum 정말 오랜만이야 어떻게 지냈어 나 똑같지 뭐 그냥 열심히 일했어 넌 어때 그때 그 사람 계속 만나 헤어졌구나 미안 괜한 얘기 꺼내 어쨌든 반가워 시간 진짜 빠르다 벌써 여기까지 왔네 우리도 근데 어쩜 넌 하나 변함없이  여전히 이쁘네 던진 농담 반 진담 반 왜 말  돌리는데 술 때문인 건지 아니면 부끄러운 건지 빨개지는 볼 너 생각나로  피어나는 추억에 화원 색색 아련한 이야기꽃 웃음꽃 I want to tell you something 예전에 나 너 좋아했던 거 알어 and you said I know 나 좀 취했나 봐 헛소리 신경 쓰지 말고 cheers 건배 오늘처럼 무더운 밤 잠은 오지 않고 이런저런 생각에 불러본 너 나올 줄 몰랐어 간지러운 바람 웃고 있는 우리 밤하늘에 별 취한듯한 너 시원한 beer cheers 바랄게 뭐 더 있어 한여름밤의 꿀 이건 마치 한여름밤의 꿀 우린 마치 so sweet so sweet yum Hold up 지금 나오는 노래 뭐지  잠깐 Hold up 알듯한데 제목 기억 안 나는 옛 노래 흥얼거려 멜로디 시원한 밤공기 자리 옮길 겸 걷자 신난다며 폴짝 뛰어가는 뒷모습 참 순수해 너란 여자 그러다 벌레 한 마리에 기겁하더니 가로등 불빛 아래 포개지는 그림자 하나 이 순간 둘 행복해 셋 어느새 쥐고 있는 손가락 넷 한여름밤의 꿈 깨고 싶지 않은 한여름밤의 꿀 바로 오늘 같은 무더운 밤 잠은 오지 않고 이런저런 생각에 불러본 너 나올 줄 몰랐어 간지러운 바람 웃고 있는 우리 밤하늘에 별 취한듯한 너 시원한 beer cheers 바랄게 뭐 더 있어 한여름밤의 꿀 이건 마치 한여름밤의 꿀 우린 마치 so sweet so sweet yum 오늘 너무 즐거웠어 너무 즐거웠어 너무 반가웠어 나도 반가웠어 잘 자 굿나잇 You have a sweet dream 이런 널 보고 있자니 바랄게 없어서 행복했어 So happy 너무 행복했어 Me too 잘 자 굿나잇 You have a sweet dream 이런 널 안고 있자니 바랄게 뭐 더 있어 한여름밤의 꿀 한여름밤의 꿀 so sweet so sweet yum 한여름밤의 꿀 이건 마치 한여름밤의 꿀 우린 마치 so sweet so sweet yum
