time,rank,song_id,title,singers,album,date,genre,creator,lyric2015.03.16~03.22,73,5439395,언제쯤이면 (Duet.아이유),윤현상,피아노포르테 (PIANOFORTE),2014.10.31,Ballad,윤현상,그리워 보고 싶어 잘 지내란 말이 무색해질 만큼 오랜 시간 함께해온 추억들이 한 장의 폴라로이드 사진처럼 가슴 한 켠에 남는다 미안해 잘못했어 용서해 란 말이 그리워질 만큼 너와 있던 시간이 항상 생각 나 항상 후회되고 그리워 어쩌다 너와 마주칠 땐 숨이 탁 막혀와 언제쯤이면 우리 따뜻한 인사와 함께 서로 웃으며 안부를 묻는 그런 사이가 될까 언제쯤이면 언제쯤이면 언제쯤이면 그럴 수 있을까 우리가 자주 걷던 그 거리를 혼자 서성이다 보면 소박하던 우리들의 추억들이 내게 인사를 건네는 것만 같아 울음이 목 끝에 걸려서 숨이 탁 막혀와 언제쯤이면 우리 따뜻한 인사와 함께 서로 웃으며 안부를 묻는 그런 사이가 될까 언제쯤이면 언제쯤이면 언제쯤이면 외롭기만 하는 지금 그리고 행복 했었던 우리 언제쯤이면 네 앞에 서서 아무렇지 않은 척 웃음 보일까 언제쯤이면 인사와 함께 서로 눈이라도 맞추며 웃음 보이게 될까 할 수 있다면 이렇게라도 난 기다리고 싶어
2015.03.16~03.22,74,5459290,쓰담쓰담,10cm,3.0,2014.11.19,Folk,10cm,알고 있지 오늘따라  그대가 왜 이러는지  얼굴은 빨개지고  눈빛도 이상하고 집에 안가고  가만있어 오늘 같은 밤을  내내 기다렸어  투박한 내 두 손에   온몸을 맡겨줘요 할게 있어요  쓰담쓰담쓰담쓰담  쓰담쓰담쓰담다담 해볼까요  토닥토닥토닥토닥  토다닥디다리디독 해드릴까요  쓰잘데 없던 나의 손이   이런 용도일 줄이야  외로워 미칠 때마다 불러줘요  맙소사 그대 그대  나의 귓가에 귓가에  들리는 목소리 난 다 알았어요  tv를 보든 뭘 보든  식사 중이든 뭘 먹든  운전 중이든 언제라도  쓰담쓰담쓰담쓰담  쓰담쓰담쓰담다담 해볼까요  토닥토닥토닥토닥  토다닥디다리디독 해드릴까요  쓰잘 데 없던 나의 손이  이런 용도일 줄이야  외로워 미칠 때마다 불러줘요  쓰담쓰담쓰담쓰담 쓰담쓰담쓰담다담 해볼까요 토닥토닥토닥토닥 토다닥디다리디독 해드릴까요 오갈 데 없던 나에게도 이런 날이 올 줄이야 외로워 미칠 때마다 밤이 외로워 미칠 때마다 그대 두 볼이 빨개질 때마다 불러줘요
2015.03.16~03.22,75,5474213,HAPPY TOGETHER,박효신,HAPPY TOGETHER,2014.11.24,Ballad,박효신,세상을 몰랐었던  마냥 웃기만 했던  푸른 하늘 닮은 꿈을 가진  키 작은 꼬마가 어느새  담을 넘는다  언덕 위로 좁게 트인  그 작은 길 따라  어디로 가는 걸까  작은 돌에 그만 넘어져도  일어나 다시 그 길 따라 걸어보렴  좀 더디면 어때  어디든 좋아  한 걸음씩  so happy together  너의 손을 잡고서  너와 발을 맞추며 가자  we are dancing together  서두르진 마  조금 익숙한 멜로디를 불러봐  루루루 루루루  너를 위한 멜로디  루루루 루루루  누구도 상상 못 할  내일이 또 오겠지  소나기에 자라난 무지개를 빌려다  포켓 속에 가득 꼭 넣어두렴  주문을 외워  it's gonna be alright  한 걸음씩  so happy together  너의 손을 잡고서  너와 발을 맞추며 가자  we are dancing together  서두르진 마  이제 익숙한 멜로디를 불러봐  루루루 루루루  너를 위한 멜로디  루루루 루루루  하늘 아래 누워 잠깐 쉬어가도 돼  눈을 감아도 보이는  너를 닮은 별 찾아  고맙다는 인사를 건넨다 그게 바로 너야  한걸음 더 so happy together 다시 밝아온 아침 머나먼 여행을 떠나자 we belong together 혼자가 아냐 영원히 너를 위해 불러줄 이 멜로디 루루루 루루루 우릴 위한 멜로디 루루루 루루루 지금 내 앞에 있는 내가 찾던 세상
2015.03.16~03.22,76,315872,잠시만 안녕 (Original),엠씨더맥스,M.C The Max!,2002.10.31,Ballad,"Yoshiki,채정은",행복을 줄 수 없었어 그런데 사랑을 했어 니곁에 감히 머무른 내 욕심을 용서치마 방황이 많이 남았어 그 끝은 나도 모르는곳 약하게 태어나서 미안해 그래서 널 보내려고 해 언젠가는 돌아갈께 사랑할 자격 갖춘 나 되어 너의 곁으로 돌아갈께 행복을 줄 수 있을 때 아파도 안녕 잠시만 안녕 언제나 위태로운 나 그런 내가 널 사랑을 했어 외로운 고독이 두려워 빨리 못 보내 미안해 사는게 참 힘들었어 널 보며 난 견뎠어 허나 네겐 보여줄 수 없는 내 삶 이별로 널 지키려해 언젠가는 돌아갈께 흔들리지 않는 나 되어 늦지않게 돌아갈께 널 많이 사랑하니까 아파도 안녕 슬퍼도 안녕 언젠가는 돌아갈께 사랑할 자격 갖춘 나 되어 너의 곁으로 돌아갈께 행복을 줄수 있을 때 아파도 안녕 널 위해 안녕 너와 내가 사랑하면 우리가 정말 사랑한다면 언젠가는 만날꺼야 행복을 줄 수 있을 때 조금만 울자 잠시만 울자 아파도 안녕 널 위해 안녕
2015.03.16~03.22,77,5632934,방뛰기방방,"윤미래,타이거JK,Bizzy(MFBTY)",WondaLand,2015.03.19,Rap / Hip-hop,"윤미래,타이거JK,Bizzy",방방 타러 가자 방방 방뛰고 방방 방방 All right all right OK  방뛰기방방 다 함께 I live my life the way I want 맘대로 하면 돼 All right all right OK  방뛰기방방 다 함께 I live my life the way I want 맘대로 하면 돼 천천 지 하늘 천 땅 지 검을현 누를황 내 핏줄 끝 끝없는 우주의 방식 One love when I do it for my people 몸과 맘이 하나 되면서  몸과 맘이 자다 깨면서  땅 짚고 방방 뛰기 다 방뛰기방방 하늘 천 잡기 땅 끌어 뛰기 뜀 끄덕 끄덕임  땅 짚고 방방 뛰기 뛰기 뜀 땅 잡고 제자리 높이 뛰기 뜀 비바람이 몰아치고 난 비껴간 그 자리에 까닭 없이 나 서정권 끄덕 끄덕 까닭 없이 끄덕이잖아 땅 끌어 뛰기 뜀 끄덕 끄덕임 방 뛰며 뛰기 뜀 뛰기 뛰기 뜀야 Here come the bass that 808 방뛰기방방 all day all right okay  방뛰기방 다 함께 the bass that 808 방뛰기방방 all day all right okay  Bizzy Tiger Yoon mi rae 나 그냥 기나긴 시간이 끝나지 않을지 유통기간이 지나지 않을지 Bizzy lucks on my lefty  가능성을 남겨 지난 힘든 시간이  남겨 준 건 질긴 끈기와 맷집  오르막길 내리막길 곤두박질 후 내 손에 박힌 굳은살 덕에 모든 게 익숙하겠지 Here come the bass that 808 방뛰기방방 all day all right okay  방뛰기방 다 함께 the bass that 808 방뛰기방방 all day all right okay  Bizzy Tiger Yoon mi rae Here come the bass that 808 방뛰기방방 all day all right okay  방뛰기방 다 함께 the bass that 808 방뛰기방방 all day all right okay  Bizzy Tiger Yoon mi rae Bizzy Tiger Yoon mi rae
2015.03.16~03.22,78,5620976,Beautiful Girl (Feat. 권정열 of 10cm),레게강같은평화,Beautiful Girl,2015.03.13,Dance,"JonathanRotem,JordanJr.,Sylvester,BenKing,JerryLeiber,KiseanAnderson,MikeStoller,스컬,Xepy",넌 나의 Beautiful Girl 까지지 않는 사탕 같은 넌 나를 조급하게 열받게 해 달콤하게 날 약올려 넌 나의 Beautiful Girl 다른 어떤 여잘 보아도 내 눈엔 온통 너야 오직 너야 아무것도 할 수 없어  어쩌다 널 보게 되고 또 가까워지고 어느 순간 나 니가 없이는 단 몇 분 조차 참기 힘들어져 내 쓴 하루 속 니가 단맛이 돼 줘 이 커피 속 하얀 설탕처럼 너를 삼키고 마구 휘젓고 싶어 입 좀 가리지 마 고개 숙이지 마 봐도 봐도 다시 또 보고 싶거든 이제 누굴 봐도 너로 보여 넌 나의 Beautiful Girl 까지지 않는 사탕같은 넌 나를 조급하게 열받게 해 달콤하게 날 약올려 넌 나의 Beautiful Girl 다른 어떤 여잘 보아도 내 눈엔 온통 너야 오직 너야 아무것도 할 수 없어  listen 다시는 그 손 놓지 않을게요 no no no 가끔씩 니가 짜증 부릴 때도 no no no 난 너만 바라보는데 너는 다른 곳을 왜 이대로 정말 죽을 것만 같아 no no no Hey gurl 눈을 감아도 눈이 부신 걸 누가 널 이겨 자꾸 다른 남자 찾는 naughty gurl 두근 두근 내게 입 맞춰 주면 아무리 잊으려 해도 하나 둘 셋 하나 다시 처음으로 내 맘이 내 맘대로 되질 않아  그저 all night long yuh deh pon mi mind gurl 입 좀 가리지 마 고개 숙이지 마  봐도 봐도 다시 또 보고 싶거든  이제 누굴 봐도 너로 보여  넌 나의 Beautiful Girl 까지지 않는 사탕 같은 넌 나를 조급하게 열받게 해 달콤하게 날 약올려 넌 나의 Beautiful Girl 다른 어떤 여잘 보아도 내 눈엔 온통 너야 오직 너야 아무것도 할 수 없어  널 갖고 싶은 걸 Hello hello 널 갖고 싶은 걸 넌 나의 Beautiful Girl 까지지 않는 사탕 같은 넌 나를 조급하게 열받게 해 달콤하게 날 약올려 넌 나의 Beautiful Girl 다른 어떤 여잘 보아도 내 눈엔 온통 너야 오직 너야 아무것도 할 수 없어
2015.03.16~03.22,79,5554059,어느 멋진 날,정용화(CNBLUE),어느 멋진 날,2015.01.20,Ballad,정용화(CNBLUE),기억이 또 나네요  자주 거닐던 호숫가  자그마한 얘기로 밤 지새던  그때 참 좋았죠 우린  기억이 또 나네요  발길 드문 집 앞 공원  보고 싶다 수없이 떼를 쓰던  그때 참 좋았죠 그대가 있어서  어느 멋진 날 눈물 나는 날  눈부시도록 아름다워서  가슴 아픈 날  어느 멋진 날 돌아갈 수 없는 날  그날 그날 그날 그날 그날 기억이 또 나네요  아껴둔 수많은 말들  가슴속 깊숙히 묻어둔 채로  그때는 몰랐죠 이별을 몰라서  어느 멋진 날 눈물 나는 날  눈부시도록 아름다워서 가슴 아픈 날  어느 멋진 날 돌아갈 수 없는 날  그날 그날 그날 그날 그날 그대는 날 잊어간대도  하염없이 흘러내려요  눈물 마른 추억들  우리 사랑했던 기억들  우리 소중했던 날들  아직도 나는 잊지 못해요  어느 멋진 날 따뜻했던 날  바람에 실려 지난 그대가 불어오는 날 어느 멋진 날 돌아갈 수 없는 날 그날 그날 그날 그날 그날 Hoo hoo hoo Hoo hoo hoo Hoo hoo hoo woo 어느 멋진 날 돌아갈 수 없는 날 그날 그날 그날 그날 그날
2015.03.16~03.22,80,665226,귀로,나얼,Back To The Soul Flight,2005.01.08,R&B / Soul,예민,화려한 불빛으로 그 뒷모습만 보이며  안녕이란 말도없이 사라진 그대  쉽게 흘려진 눈물 눈가에 가득히 고여  거리는 온통 투명한 유리알속  그대 따뜻한 손이라도 잡아볼수만 있었다면  아직은 그대의 온기 남아있겠지만  비바람이 부는 길가에 홀로 애태우는 이자리  두뺨엔 비바람만 차게 부는데  사랑한단 말은 못해도  안녕이란 말은 해야지  아무말도 없이 떠나간  그대가 정말 미워요    그대 따뜻한 손이라도 잡아볼수만 있었다면  아직은 그대의 온기남아 있겠지만  비바람이 부는 길가에홀로 애태우는 이자리  두뺨엔 비바람만 차게 부는데  사랑한단 말은 못해도  안녕이란 말은 해야지  아무말도 없이 떠나간  그대가 정말 미워요  사랑한단 말은 못해도  안녕이란 말은 해야지  아무말도 없이 떠나간  그대가 정말 미워요
2015.03.16~03.22,81,5632927,Hello Happy (Feat. 유희열),"윤미래,타이거JK,Bizzy(MFBTY)",WondaLand,2015.03.19,Rap / Hip-hop,"윤미래,타이거JK,Bizzy",Goodbye sadness be on your way 눈물을 감추고 Hello my happiness you're here to stay 내 곁에 있어줘  Good bye sadness be on your way 눈물을 감추고 Hello my happiness you're here to stay 내 곁에 있어줘 사람이 어찌 그리 달러 무슨 말을 해도 내 말은 안 들려 넌 귀를 닫고 무슨 다른 사람인듯  나를 밀어내는 행동으로 봐서  딱 지쳐 현실에 무게를 못 이겨  말문을 잠근 너야말로 이기적 눈치 채지 못한 내가 싫은 척 해도  I'm here to stay so talk to me 단 번에 지나간 휙휙 지나간 지나가는 시간 지나가지만 왜 슬픔만 이 자리에 내버려도 Hey 시간아 나도 같이 데려가죠 기쁨에 웃고 힘드니 지금 잘 이겨내 지친 내 가슴도  Hey we made it My fam get all of my loyalty all of my patience  dues we paid dem 슬픔아 이제 그만 내버려도  그냥 지난날에 머물러 날 기억해줘  Good bye 제발 오지마 내일은 Good bye sadness be on your way  눈물을 감추고 Hello my happiness you're here to stay 내 곁에 있어줘  Good bye sadness be on your way  눈물을 감추고 Hello my happiness you're here to stay 내 곁에 있어줘  슬픔아 나 이제 가볼게 용기 내서 나 떠나 볼게 마이 무따 아이가 저리 가줄래 여기 지친 날 제발 좀 놔줄래 비굴하게 비는 나 좀 봐줄래 지난날에 안겨준 이 아픔도 찢긴 내 가슴속에 사진첩에 간직해 담아둘게 약속해  스며드는 비처럼 떨어지는 음악 그럴 때면 니 생각에 잠길게 약속해 잊지 않을게  슬픔아 나 이제 가볼게 Bye bye 슬픔아 나 이제 그만 내버려둬 제발 지난날에 머물던 날 기억해줘 슬픔아 나 이제 그만 내버려둬 제발 지난날에 머물던 날 기억해줘 Bye bye  부디 슬픔 없는 곳에서  Good bye sadness be on your way  눈물을 감추고 Hello my happiness you're here to stay 내 곁에 있어줘  Good bye sadness be on your way  눈물을 감추고 Hello my happiness you're here to stay 내 곁에 있어줘
2015.03.16~03.22,82,3753309,꽃송이가,버스커버스커,버스커 버스커 1집,2012.03.29,Rock,장범준,배드민턴 치자고 꼬셔 커피 한 잔 하자고 불러 동네 한 번 걷자고 꼬셔 넌 한 번도 그래 안 된다는 말이 없었지 꽃송이가 꽃송이가 그래 그래 피었네 꽃송이가 꽃송이가 그 꽃 한 송이가 그래 그래 피었구나 거리에 사람들 수많은 사람들 그 길에 사람들 그래 나는 네게 얼마만큼 특별한 건지 그게 어려운 거야 그게 어려운 거라 그게 어려운 거야 맛있는 거 먹자고 꼬셔 영화 보러 가자고 불러 단대 호수 걷자고 꼬셔 넌 한 번도 그래 안 된다는 말이 없었지 꽃송이가 꽃송이가 그래 그래  피었네 꽃송이가 꽃송이가 그 꽃 한 송이가 그래 그래 피었구나 거리에 사람들 수많은 사람들 그 길에 사람들 그래 나는 네게 얼마만큼 특별한 건지 그게 어려운 거야 그게 어려운 거라 그게 어려운 거야 좋아 좋아 하모니카 솔로 꽃송이가 꽃송이가 꽃송이가 그래 그래 피었네 꽃송이가 꽃송이가 그 꽃 한 송이가 그래 그래 피었구나 거리에 사람들 수많은 사람들 그 길에 사람들 그래 나는 네게 얼마만큼 특별한 건지 그게 어려운 거야 그게 어려운 거라 그게 어려운 거야
2015.03.16~03.22,83,5612384,괜찮아 괜찮아,에릭남(EricNam),괜찮아 괜찮아,2015.03.05,Ballad,"에릭남(EricNam),김보아(스피카)",이별이란 원래 그래   시간 지나 무뎌진대  괜찮아 괜찮아 나는 괜찮아  우연히 들은 네 소식에   너도 잘 지내고 있나 봐  괜찮아 괜찮아   이젠 괜찮아 yeah   첨에 니가 없는 내 생각하면   다들 미쳤다고 했는데  이젠 니 생각에 우는 일은 없어   잠에서 울다 깨는 일도 없어  정말 익숙해 졌나봐 괜찮아  사진 속에 웃고 있는 우리   놀리듯이 장난치는 둘이  왜 그렇게 부러움을 샀었는지   알 것만 같아   우리 참 예뻤다  날 보던 너의 그 눈빛이   아직 날 떠나지를 않아   오지마 저리가 괴롭히지마  돌아서는 낯선 네 모습 보며   죽을 만큼 힘들었는데  이젠 니 생각에 우는 일은 없어  잠에서 울다 깨는 일도 없어  정말 익숙해 졌나봐 괜찮아  사진 속에 웃고 있는 우리   놀리듯이 장난치는 둘이  왜 그렇게 부러움을 샀었는지   난 알 것 같아 사랑했던 날이 많아 헤어지고 나서야  좋았던 기억이 나 다신 니 생각에 우는 일은 없어 널 봐도 이제 아무 느낌 없어 정말 다 괜찮은 가봐 이제는 끝나버린 사람이 됐지만  지나버린 사랑이 됐지만 너무 많은 부러움을 샀던 만큼  그래 그만큼  우리 참 예뻤다
2015.03.16~03.22,84,5627509,성인,기리보이,성인식,2015.03.17,Rap / Hip-hop,기리보이,넌 아직도 그 일을 하고 있니  난 아직도 그 일을 하고 있지  나름대로 잘 돼서   나는 너무 행복한데  생각이 너무 많아   밤에는 못 자고 있지  아무런 상관없는 너가  너무 바빠 다 잊고   생각 안 나던 너가  너에게 말한 바람들을   다 이루고 나서야  내팽개친 순수함을   난 다시 주워 담고 있지  얼마 전 너의 번홀 찾았어  다행이야   나도 번호를 안 바꿔서  혹시 이건 미련일까   한참 생각해봤지만  이건 그냥 생각나서에   조금 더 가까워  이런 날이 올까   상상도 못 했어 난  예전에 우리 치고 박고   난리도 아니었잖아  그래 그땐 그게 정말   최선의 방법이었어  지금은 절대 겪을 수 없는   큰 감동이었어  많은 시간이 흐르고 난 후에   난 달력을 보네  그냥 생각이 나서   그냥 생각이 났어  우린 다른 곳에서   똑같은 아침과 밤을 보네  그냥 생각이 나서   그냥 생각이 났어  I'm fine 너가 없는 도시에서  꿀리면 안 돼   흐르는 눈물 모른 척 했어  다 소용없는 짓 괜찮은 척  메마른 몸의 예쁜 여잘   쟁취하는 것  근데 그것도 별로   오래 못 가더라고  갈 사람은 가고 일만   배신 안 하더라고  그래서 너무 빨리 달린 거야  그래서 지금 너에게   창피를 팔리는 거야  뭐 니가 어떤 여자였건   아무 상관도  돈이 필요하다거나   어떤 바람도  심심해서도 아냐   그냥 생각이 나서  그냥 생각이 났어   갑자기 정신 나가서  지금 생각해보면 우린   잘못한 건 없어  그저 변해가며 고쳐갈 뿐   뭐라 할 건 없어  난 다시 태어났어   많은 경험 후에  널 미워한 게 후회돼   전부 똑같은데  많은 시간이 흐르고 난 후에   난 달력을 보네  그냥 생각이 나서   그냥 생각이 났어  우린 다른 곳에서   똑같은 아침과 밤을 보네  그냥 생각이 나서   그냥 생각이 났어  아무런 이유도 없어  너를 보는 게  아무런 조건도 없어  너를 보는 게  우리 서로 사랑하지 않잖아  우린 이제는 머리를 쓰잖아  생각 없이 웃자  그냥 생각 없이 웃자 생각 없이 웃자 많은 시간이 흐르고 난 후에  난 달력을 보네 그냥 생각이 나서  그냥 생각이 났어 우린 다른 곳에서  똑같은 아침과 밤을 보네 그냥 생각이 나서  그냥 생각이 났어 I'm fine thank you and you
2015.03.16~03.22,85,4671151,"눈, 코, 입",태양,RISE,2014.06.03,R&B / Soul,"TEDDY,태양",미안해 미안해 하지마  내가 초라해지잖아  빨간 예쁜 입술로  어서 나를 죽이고 가  나는 괜찮아  마지막으로 나를 바라봐줘  아무렇지 않은 듯 웃어줘  네가 보고 싶을 때  기억할 수 있게  나의 머릿속에 네 얼굴  그릴 수 있게  널 보낼 수 없는 나의 욕심이  집착이 되어 널 가뒀고  혹시 이런 나 땜에 힘들었니  아무 대답 없는 너  바보처럼 왜   너를 지우지 못해  넌 떠나버렸는데  너의 눈 코 입  날 만지던 네 손길  작은 손톱까지 다  여전히 널 느낄 수 있지만  꺼진 불꽃처럼  타들어가버린  우리 사랑 모두 다  너무 아프지만 이젠 널  추억이라 부를게  사랑해 사랑했지만  내가 부족했었나 봐  혹시 우연이라도  한순간만이라도 널  볼 수 있을까  하루하루가 불안해져  네 모든 게 갈수록 희미해져  사진 속에 너는 왜  해맑게 웃는데  우리에게 다가오는  이별을 모른 채  널 보낼 수 없는 나의 욕심이  집착이 되어 널 가뒀고  혹시 이런 나 땜에 힘들었니  아무 대답 없는 너  바보처럼 왜   너를 지우지 못해  넌 떠나버렸는데  너의 눈 코 입  날 만지던 네 손길  작은 손톱까지 다  여전히 널 느낄 수 있지만  꺼진 불꽃처럼  타들어가버린  우리 사랑 모두 다  너무 아프지만 이젠 널  추억이라 부를게  나만을 바라보던 너의 까만 눈  향기로운 숨을 담은 너의 코  사랑해 사랑해  내게 속삭이던 그 입술을 난  너의 눈 코 입  날 만지던 네 손길  작은 손톱까지 다  모두 다  여전히 널 느낄 수 있지만  널 느낄 수 있지만 꺼진 불꽃처럼 타들어가버린 우리 사랑 모두 다 너무 아프지만 이젠 널 추억이라 부를게
2015.03.16~03.22,86,5526865,악몽 (Feat. 박수진),배치기,악몽,2014.12.31,Rap / Hip-hop,"용감한형제,배치기",모든 게 의미 없어졌어 니가 나를 깨끗하게 지워 버린 후에 둘로 쪼개진 것 지나버린 기억들만 사무치는 하루에 홀로 불 꺼진 방 이 꼴로 남겨진 나 미로 속 헤매이다 숨이 가빠져서 나 악몽 속에 살아 죄책감일까 자책하며 결국 눈을 감아봐도 낯선 곳에 버려진 듯 잠 못 이루는 강제적인 이 각성 현실이든 꿈이든 니가 없이 살아가는 건 마찬가진데 흔적 속에 영원할 듯 깊게 패인 상처는 못 아무네 널 많이 사랑했나 봐 그래서 더 힘든가 봐 시간이 갈수록 밀려오는 고통 뿐 어젯밤 꿈에 그댄 다른 사람과 달콤한 사랑을 나눴죠 슬픈 내 눈에 초라한 내 모습에 서서히 죽어갔죠 이건 아닐거야 정말 아닐거야 이건 니가 아닐거예요 아픈 두 볼에 슬픔이 흘러내려 눈물 바다가 됐죠 oh oh 눈만 꿈뻑대고 있어 난 꿈쩍도 못해 점점 고인 눈물은 넘쳐 흘러 내리고 니 입에 닿지 꿀꺽 삼키곤 다시 꿈 꿔 이 믿지 못 할 악몽 속으로 또 난 들어가 계속돼 가는 반복 속에 얼마나 견뎌야 할지 무뎌지고 나면 편히 잠이 들지 깨어나질 못해 이 깊은 혼돈 속에 갇힌 절망 날 잠식하는 니 기억과 지나친 적막 널 많이 사랑했나 봐 그래서 더 힘든가 봐 시간이 갈수록 밀려오는 고통 뿐 어젯밤 꿈에 그댄 다른 사람과 달콤한 사랑을 나눴죠 슬픈 내 눈에 초라한 내 모습에 서서히 죽어갔죠 이건 아닐거야 정말 아닐거야 이건 니가 아닐거예요 아픈 두 볼에 슬픔이 흘러내려 눈물 바다가 됐죠 oh oh 이건 악몽이야 이건 악몽이야 이건 악몽이야 이건 악몽이야 이건 악몽이야 이건 악몽이야 이건 악몽이야 이건 악몽이야 아픈 꿈이길
