time,rank,song_id,title,singers,album,date,genre,creator,lyric2013.08.12~08.18,72,4184832,Goodbye Summer (f(Amber+Luna+Krystal) (Feat. D.O. Of EXO-K),f(x),`Pink Tape` f(x) The 2nd Album,2013.07.29,Ballad,Young-HuKim,기억해 복도에서 떠들다 같이   혼나던 우리 둘  벌서면서도 왜 그리도 즐거웠는지   알았어  그날 이후로 Yeah Yeah  우린 늘 Yeah Yeah  쌍둥이 별자리처럼  넌 나 나는 너였어  졸업하기 전날 많이 울던 너   남자라고 꾹 참던 너  하고 싶었던 말 못하고  뜨거웠던 그 여름처럼 안녕  친구라는 이름  어느새 미워진 이름  감추던 감정은  지금도 아픈 비밀의 기억일 뿐  우리 사인 정리할 수 없는 사진   보면 가슴 아린 Story I'm sorry   여름아 이젠 Goodbye Yay Yeah  What do I say We didn't   have to play no games  I should've took that chance I   should've asked for u to stay  And it gets me down the unsaid   words that still remain  시작하지도 않고 끝나버린 이야기  축제 마지막 날 너의 노래도   아른한 여름 바다도  함께라서 소중했던 맘 늦어가는 밤   하늘처럼 안녕  친구라는 이름 어느새 미워진  이름 감추던 감정은 지금도 아픈  비밀의 기억일 뿐 우리 사인 정리할 수 없는 사진  보면 가슴 아린 Story I'm sorry  여름아 이젠 Goodbye Baby Oh No Oh Oh 혼잣말이라서  미안해 Oh 사실은 널 사랑해 Yeah 숨기고 있던 오랜 비밀들 차라리  들켰다면 너를 품에 안아줄텐데 친구라는 이름 어느새 미워진 이름 감추던 감정은 지금도 아픈  비밀의 기억일 뿐 우리 사인 정리할 수 없는 사진  보면 가슴 아린 Story I'm sorry  여름아 이젠 Goodbye 친구라는 이름 어느새 미워진 이름  보면 가슴 아린 Story I'm sorry  여름아 이젠 Goodbye Yay Yeah 랄랄랄랄라 랄랄랄랄라랄랄  랄랄랄랄라 랄랄랄랄랄라
2013.08.12~08.18,73,4204703,설마 아닐거야 (With 하동균),UV,설마 아닐거야,2013.08.16,Ballad,"뮤지,유세윤",오랜만에 너를 만난 거였는데  도대체 넌 나를 쳐다보지 않고   너는 핸드폰만 봐  오랜만에 우리 놀러 갔었는데  도대체 넌 뭐지 방안에서  잠만 자고 뒹굴뒹굴 대  우리 둘이 만난 지 오래돼서 그런지  미안해 미안해 내가 너무 재미없지  키스한 게 언젠지 사랑한 게 언젠지  미안해 미안해 예전 같지가 않아  보지마 보지마 보지마 보지 말아요  시계 좀 보지 마요  자지마 자지마 자지마 자지 말아요  오늘 밤 자지 마요  우리 둘이 만난 지 오래돼서 그런지  미안해 미안해 내가 너무 재미없지  키스한 게 언젠지 사랑한 게 언젠지  미안해 미안해 예전 같지가 않아  보지마 보지마 보지마 보지 말아요  시계 좀 보지 마요  자지마 자지마 자지마 자지 말아요  오늘 밤 자지 마요  12시가 되면  네가 일어날 줄 알았지  하지만 넌 아직까지 잠을 자지  그렇게 자고 있는 너를 나는 보지  넌 잠자는 공주지 나는 왕자지  너를 보지 나를 보지 매일 보지   너와 나는 잠을 자지  꿈속에서도 나는 널 보지 그러다 생각해보지 언제부터 우리 둘이 멀어진 건지  동화처럼 되돌릴 순 없는지 넌 공주지 나도 왕자지 보지마 보지마 보지마 보지 말아요 시계 좀 보지 마요 자지마 자지마 자지마 자지 말아요 오늘 밤 자지 마요 보지마 보지마 보지마 보지 말아요 핸드폰 보지 마요 자지마 자지마 자지마 자지 말아요 오늘 밤 날 두고 자지 마요
2013.08.12~08.18,74,4196651,Badman,B.A.P,Badman,2013.08.06,Dance,"강지원,김기범,방용국",어둠 속에서 들리는 절규  공포에 질린 세상을  뒤집어버릴거야 다  미쳐버린 세상  바꿔놓을거야 난  돈과 협박에 눈 감는 자들 GET OUT  뉴스를 봐도 전부 공공의 적이고  싸이코패스들이 미쳐  날뛰는 판이고  이건 범죄와의 전쟁  똑같이 갚아 줄게  이에는 이 눈에는 눈 이 말을 기억해  용서란 없어 우린 절대  I Gotta Feeling  참을 수가 없어 Give It Up  I Gotta Feeling  니가 눈을 감는 날  너는 위험해  잘못 건드렸어 Get Away  Becuz I'm cuz I'm Dangerous  I'm a Badman  어둠 속에 너를 가둬줄게  AH AH AH AH  겁에 질린 모습을 봐  I'm a Badman  니들을 다 쓸어버릴거야  어떤 변명 따위는 내게 하지마  In the end Badman 야 야 Badman 야 야  yeh guyz 감히 누가 우릴 말려  이 도시의 공기는 너무나 숨 막혀  처음부터 잘못된 너희 이리와 간곡해 더러운 싹들을 다 잘라버릴 때까지  안 멈춰 난 독해 똑같이 눈물 흘려봐 you got that I Gotta Feeling 다 불 태워버려 Burn It Up I Gotta Feeling 니가 울부짖는 날 너는 위험해 갈 때까지 갔어 Get Away Becuz I'm cuz I'm Dangerous I'm a Badman 어둠 속에 너를 가둬줄게 AH AH AH AH 겁에 질린 모습을 봐 I'm a Badman 니들을 다 쓸어버릴거야 어떤 변명 따위는 내게 하지마 In the end Badman 야 야 Badman 야 야 왜 자꾸 건드려 자 이리 엎드려 다 맘에 안 들어 널 보면 Lose Control Badman 왜 자꾸 건드려 자 이리 엎드려 다 맘에 안 들어 널 보면 Lose Control Badman 우릴 만나면 제발 저리 도망 가줘 절대로 우린 니들을 가만히 못 놔둬 I'm a Badman 어둠 속에 너를 가둬줄게 AH AH AH AH 겁에 질린 모습을 봐 I'm a Badman 니들을 다 쓸어버릴거야 어떤 변명 따위는 내게 하지마 In the end
2013.08.12~08.18,75,4171463,No No No,에일리,A`s Doll House,2013.07.12,Dance,허성진,너 같은 남자는 No No No 장난 같은 사랑 No No No 착한 척 믿는 척 Oh Oh 이젠 나는 지쳐가 너에 대한 fantasy  깨져버린 마음이 내 앞에서 했던 말들  했던 표정 거짓말 Lonely 가슴이 Lonely 그렇게 내가 쉽게도 속아줬니 I’m so Sorry 가식적인 말은 I’m so Sorry 빌어도 소용없어 이제는 네가 싫어 너 같은 남자는 No No No 장난 같은 사랑 No No No 이해가 안 돼 착한 척 믿는 척 사랑이 뭐 그래  뜨거운 적은 있었니 다른 여잘 만나 짓던 표정 똑같은 얼굴로  사랑한단 얘길 해  너너 너너너 Goodbye Goodbye  이젠 내가 지쳐가 미련한 내 사랑이  속은 게 참 서러워 네 입에서 나온 말에 속고 속아 순진한 Stupid 난 정말 Stupid 언젠가 너도 너 같은 여잘 만나 I’m so Sorry 가식적인 말은 I’m so Sorry 빌어도 소용없어 이제는 네가 싫어 너 같은 남자는 No No No 장난 같은 사랑 No No No 이해가 안돼 착한 척 믿는 척 사랑이 뭐 그래  뜨거운 적은 있었니 다른 여잘 만나 짓던 표정 똑같은 얼굴로  사랑한단 얘길 해  너너 너너너 Goodbye Goodbye  이젠 내가 지쳐가 너를 처음 만난 One day 왜 하필 나였는지 그래 지금인 게 다행이지 더 너를 알기 전에 잘 살아 나를 떠나 너 같은 남자는 No No No 장난 같은 사랑 No No No 이해가 안돼 착한 척 믿는 척 사랑이 뭐 그래  뜨거운 적은 있었니 다른 여잘 만나 짓던 표정 똑같은 얼굴로  사랑한단 얘길 해  너너 너너너 Goodbye Goodbye  이젠 내가 지쳐가
2013.08.12~08.18,76,4082435,오늘 밤 (Feat. 배치기),린,8th #1 유리 심장,2013.04.26,Ballad,"이단옆차기,린,배치기",오늘 밤 그대가 보고 싶은데 오늘 밤 그대랑 놀고 싶은데 요즘엔 지쳤어 많이 그저 가만히 멍하니 홀로 창 밖을 바라보다가 하루를 보내 이 뜻 모를 마가 더 길게 느껴져서 여기 내가 묶여 져서 그대를 그리다 못내 안지 못해 슬퍼져서 쉴 곳이 필요해 난 쉴 곳이 숨 쉴 곳이 필요해 숨 쉴 곳이 그대란 안식처에 머무는 그 청량감이 오늘 밤 내게로 다가와서 속삭여줘 하루가 너무 길어 종일 네 생각했지 빨리 날이 저물길 널 만날 생각만 했지 오늘은 말야 꼭 우리 함께 누워 놀고 싶어 이렇게 또 하루를 끝내고픈데 양손 가득히 먹고 마실 거릴 사들고 돌아가는 발걸음이 왜 이리 가벼운지 밤샘 수다와 내 얼굴 붉히다 은근스레 그대 품에 기대 잠든다   오늘 밤 그대의 매끈한 복근에 얼굴을 부비 부비고 오늘 밤 그대는 부드러운 내 다리를 스르륵 쓸어 올리고 우리 침대 위는 저 어린애들 놀이터처럼 그렇게 즐거우면 돼 오늘 밤 오늘 밤 그대 모습에 난 자꾸자꾸 열이 나고 그대와 오늘 밤 달이 비추면 사랑을 나누고 키스하죠 점점 다가와서 그대와 나 사이 어색한 시간은 건너 띄는 이 타이밍 달빛이 부르는 노래에 맞춰서 움직여줘 그대가 고픈 내가 들어갈 수 있게 Open 해줘 맘이 동했어 오늘 밤은 통했어 쭈뼛거릴 때가 어제인데 우린 변했어 언제 다시 느낄지 모를 순간이 지났지만 이젠 너와 나 비밀이 없는 사이가 오늘 밤 그대의 널따란 어깨를 와라락 끌어당기고 오늘 밤 그대는 찰랑한 내 마음을 천천히 어루만지고 우리 둘만 아는 비밀스러운 이야기처럼 그렇게 서롤 쓰면 돼 오늘 밤 오늘 밤 그대 모습에 난 자꾸자꾸 열이 나고 그대와 오늘 밤 달이 비추면 사랑을 나누고 키스하죠 열두 시 다가와 구두를 흘린 신데렐라도 이런 맘일까 너에게 홀린 나 오늘 보내주기 싫은데 오늘 밤 오늘 밤 그대 모습에 그대 모습에 난 자꾸자꾸 열이 나고 후끈후끈 열이 나고 그대와 오늘 밤 달이 비추면 달이 비추면 사랑을 나누고 키스하죠 키스해요 우리 오늘 밤 오늘 밤 그대 모습에 난 자꾸자꾸 열이 나고 그대와 오늘 밤 달이 비추면 사랑을 나누고 키스하죠
2013.08.12~08.18,77,4181878,Hollywood (Feat. 정준하),KYT(코요태),Hollywood,2013.07.25,Dance,물만난물고기,사랑이 떠나고 난 이제 어디로  난 이제 어디로 어디로  Well come to Hollywood 예예예예 여름하면 누구 뭘 고민 고민해 할아버지도 할머니도  들썩이게 해 시 신이나면 누구 1순위 코요태 큰물에서 놀자 비행기타고 가자  이만하면 뭘 해도 되는  사람이니까 이만하면 스타일도 좀  괜찮으니까 마일리지 쌓일 만큼  쌓였으니까 신경쓰지 말고 떠나자 벼벼벼 별들이 하늘에 넘쳐요 너와나 n MUSIC n  DISCO oh oh 밤낮이 뒤바뀐 곳으로  떠나요 어디로 허 헐리우드 허 헐리우드  허 헐리우드 허 헐리우드  내 발목을 잡네 고소공포증은  아마 불치병인가 내 영어  울렁증은  아이고 허리야 나이가 또 들었나 이리치여 저리치여  더 이상은 갈곳이 없어 예  boom boom 쉐끼루 boom  공항패션은 필수  준비못한 선글라스 내 생애  최대 실수 사랑이 떠나고 난 어디로 난 어디로 가야하나요 잘생긴 남자가 넘치는 곳으로 떠나요 n MUSIC n DISCO  oh oh 밤낮이 뒤바뀐 곳으로  떠나요 어디로  JUST DANCE DANCE DANCE 별들이 넘치는 곳으로 떠나요  밤낮이 뒤바뀐 곳으로 떠나요 we are together 허 헐리우드 허 헐리우드  허 헐리우드 허 헐리우드  이만하면 1위도 많이  해봤으니까 이만하면 스타일도 좀  괜찮으니까 마일리지 쌓일만큼 쌓였으니까 신경쓰지 말고 떠나자 쫌 남았어
2013.08.12~08.18,78,4181739,그대 내 품에,하동균,불후의 명곡 - 전설을 노래하다 (유재하 편),2013.07.20,Ballad,유재하,별 헤는 밤이면 들려오는 그대의 음성 하얗게 부서지는 꽃가루 되어 그대 꽃 위에 앉고 싶어라 밤하늘 보면서 느껴보는 그대의 숨결 두둥실 떠가는 쪽배를 타고 그대 호수에 머물고 싶어라 만일 그대 내 곁을 떠난다면 끝까지 따르리 저 끝까지 따르리 내 사랑 그대 내 품에 안겨 눈을 감아요 그대 내 품에 안겨 사랑의 꿈 나눠요 술잔에 비치는 어여쁜 그대의 미소 사르르 달콤한 와인이 되어 그대 입술에 닿고 싶어라 내 취한 두 눈엔 너무 많은 그대의 모습 살며시 피어나는 아지랑이 되어  그대 곁에서 맴돌고 싶어라 만일 그대 내 곁을 떠난다면 끝까지 따르리 저 끝까지 따르리 내 사랑 그대 내 품에 안겨 눈을 감아요 그대 내 품에 안겨 사랑의 꿈 나눠요 어둠이 찾아들어 마음 가득 기댈 곳이 필요할 때 그대 내 품에 그대 내 품에 안겨 눈을 감아요 그대 내 품에 안겨 사랑의 꿈 사랑의 꿈 사랑의 꿈 나눠요
2013.08.12~08.18,79,4192474,썬글라스,딕펑스,썬글라스,2013.08.01,Rock,딕펑스,못본척 하지마 너의 너의 까만 까만 유리 뒤로 뒤로 나의 마음 속에 속에 빠져 빠지고픈 니맘 알어 알아 내가 눈부시단걸 알아 하지만 너의 눈을 똑바로 보고 싶어 다이렉트로 보고팡  맘에 든다 말을 못하겠어 너무 시크해 벗기고 싶은 너의 색 안경 무거운 까만색은 안녕 맑은 눈빛으로 안겨 준다면 정말 좋겠네 벗기고 싶은 너의 sunglass sunglass sunglass 넌 쫌 그래쓰 벗기려 하지마 나의 나의 까만 까만 유리 뒤로 뒤로 너의 맑은 두눈 속에 빠져 몰래 보는 내맘 알아 몰라 나를 보고 싶은 맘 알아 하지만 나의 눈은 스캔하고 있어 X레이로 보고팡 눈이 부셔 쳐다 볼 수 없어 너무 시크해 벗기고 싶은 너의  색 안경 무거운 까만색은 안녕 맑은 눈빛으로 안겨 준다면 정말 좋겠네 벗기고 싶은 너의 sunglass sunglass sunglass sunglass 나를 보고 싶은 맘 알아 하지만 나의 눈은 스캔하고 있어 X레이로 보고팡 눈이 부셔 쳐다 볼 수 없어 너무 시크해 벗기고 싶은 너의  색 안경 무거운 까만색은 안녕 맑은 눈빛으로 안겨 준다면 정말 좋겠네 벗기고 싶은 너의 색 안경 무거운 까만색은 안녕 맑은 눈빛으로 안겨 준다면 정말 좋겠네 벗기고 싶은 너의 sunglass sunglass sunglass 넌 쫌 그래쓰 벗기고 싶은 너의 벗기고 싶은 너의 sunglass
2013.08.12~08.18,80,4133615,"회복이 급해 (Feat. 하림, 호투)",2BIC(투빅),회복이 급해,2013.06.05,Ballad,안영민,어 여보세요 나 감기 진짜 심하게  걸린것 같애 콜록 나 먼저 잘게 잘자 여보세요 야 자냐 클럽가자 오래된 연인이란 이름의 권태란 벽은 너무 높아 길거리 여자들은 왜 이리 다 예뻐만 보이는지 쓸데없이 바쁜 척만 너의 전화를 또 피하고 내 핸드폰엔 딴 여자와의 문자 너 뭐해 할일 있어 찝적대는 말뿐 너만 있으면 세상 모든 게 다 내 것이던 다른 누구도 눈길 안주던  나 왜 이러니 뭐가 문제니 우리 옛날이 또 그리워 오래된 연인이란 그 의미는 권태  처음의 열정없인 바로 나태 그리고 위태로워진 너와 나의 실패 회복이 급해 그녀의 눈빛이 이제는 익숙해  그녀의 스타일이 이제는 너무 뻔해  그녀는 여전히 다 똑같애 우린 회복이 필요해 클럽에 몰래 가서 마주친 니 친구를 보고 놀랬어 나도 모르게 숨어버렸어 죄짓고는 못사나봐 내 손목의 클럽도장 들킬까봐  긴팔 입었어 눈치 빠른 너 알아챌까 선수쳐 오늘도 난 피곤해 집에 들어갈래 너만 있으면 세상 모든 게 다 내 것이던 다른 누구도 눈길 안주던  나 왜 이러니 뭐가 문제니 우리 옛날이 또 그리워 있잖아 너를 좋아했어 그런데 나란 놈이 변해서 너에게 할말 없어 I can`t live without you I can`t smile without you baby 사랑하는 건 분명한데 나도 내가 답답한데 나도 널 사랑해 곁에 있으니 무심해 오늘만 놀게 진짜 약속해 내일 너에게 돌아갈게 남자들은 식어가고 여자들은  뜨거워 밀고 당기기는 지겨워  힘들어 나는 100미터 달리기를  하고 넌 오래달리기를 해 I say 자꾸 바람이 불어와 내게도 바람이 불어와
2013.08.12~08.18,81,4126905,괜찮겠니,비스트,괜찮겠니,2013.05.29,Ballad,"용준형,김태주",충분히 생각해봤니  지금 네가 뱉은 말은  쉽게 되돌릴 수  없단 것도 알고 있니  Ohh Yeah 미안해하는 네 표정  그런 슬픈 얼굴 싫어  어쩌면 마지막일지도 모르는데  좀 웃어줘  너 없는 나보다 나 없는 네가  혼자선 아무것도 잘 못하는  네가 난 너무나 걱정돼  정말 괜찮겠니  내가 네 옆에 없어도  외로움 많이 타는 네가  혼자가 돼 버려도 넌  정말 괜찮겠니  가끔은 너와 다퉈 줄  실 없는 농담으로 너와 웃어줄  사람 없어도 너만 괜찮다면  Think of it twice  다시 잘 생각해 봐  If you leave me  내가 없어도 정말 괜찮을까 네가  넌 나 없인 모든 게 너무 서투니까  내가 알고 있는 넌 어린애 같으니까 Where are you going Why you wanna go 어딜 가려고 Oh Oh 왜 가려고 그러다 끝내 울음이 터진 너 이런 너 보고 어떻게 널 보낼 수 있겠어 많이 흐트러질 텐데 너 너 없는 나보다 나 없는 네가 혼자선 아무것도 잘 못하는 네가 난 너무나 걱정돼 정말 괜찮겠니 내가 네 옆에 없어도 외로움 많이 타는 네가 혼자가 돼 버려도 넌 정말 괜찮겠니 가끔은 너와 다퉈 줄 실 없는 농담으로 너와 웃어줄 사람 없어도 너만 괜찮다면 조금 이기적이어도 돼 네가 나를 떠나서도 힘들지 않을 수 있을 때까지 더 머물러도 돼 Stay with me baby Stay with me baby Don't go Don't leave me baby Take ma hand Stay with me baby Stay with me baby Don't go Don't leave me baby 정말 괜찮겠니 내가 네 옆에 없어도 외로움 많이 타는 네가 혼자가 돼 버려도 넌 정말 괜찮겠니 가끔은 너와 다퉈 줄 실 없는 농담으로 너와 웃어줄 사람 없어도 너만 괜찮다면
2013.08.12~08.18,82,4101639,YooHoo (유후),시크릿,Letter From Secret,2013.04.30,Dance,"강지원,김기범",친구로만 보이던 니가  귀엽게만 보이던 니가  Don't know why  I don't know why  너에게 끌려 가고 있어  힘든 날 위로해줬을 때  내 얘기를 들어줬을 때  Maybe you  I'm loving you  조금씩 내 마음이 움직여  어떻게 어떻게  어떻게 말을 할까  Do you hear me  that I'm fallin' in love  머리엔 온통 너뿐이야  자꾸만 보고 싶어  너를 사랑하나 봐 YOO HOO  너만 보여 YOO HOO  친구가 아닌 애인으로  너랑 만나고 싶어  나를 좀 바라봐줘 YOO HOO  못 참겠어 YOO HOO  어제보다 오늘보다  내일 더 사랑할게  OH MY LOVE   Yeah Yeah Yeah Yeah  Yeah Yeah Yeah Yeah  I just wanna be your love  너에게 난 잘 보이려고  옷도 사고 다이어트를 하고  Yes I do Oh yes I do   이런 내 맘 알아줄까  혹시 너를 놓쳐버릴까  나를 싫어하진 않을까  Maybe you  I'm loving you   생각이 많아서 잠 못 자  어떻게 어떻게 어떻게 말을 할까 Do you hear me that I'm fallin' in love 머리엔 온통 너뿐이야 자꾸만 보고 싶어 너를 사랑하나 봐 YOO HOO 너만 보여 YOO HOO 친구가 아닌 애인으로 너랑 만나고 싶어 나를 좀 바라봐줘 YOO HOO 못 참겠어 YOO HOO 어제보다 오늘보다 내일 더 사랑할게 OH MY LOVE 니 손을 잡고 우우 우우 이 길을 너와 함께 걷고 싶어 너뿐이야 정말이야 이제는 말하고 싶어 진심이야 정말이야 내 맘을 알아 줄래 항상 너를 지켜주고 싶어 니 곁에서 난 너를 사랑하나 봐 YOO HOO 너만 보여 YOO HOO 친구가 아닌 애인으로 너랑 만나고 싶어 나를 좀 바라봐줘 YOO HOO 못 참겠어 YOO HOO 어제보다 오늘보다 내일 더 사랑할게 OH MY LOVE Yeah Yeah Yeah Yeah Yeah Yeah Yeah Yeah
2013.08.12~08.18,83,4202261,우리둘이 (Duet. 코타 Of SunnyHill),김형준,우리둘이,2013.08.13,Ballad,"장영찬,김태영,이유나",사랑한다는 말도  나를 아껴준다는 말도  나에게는 너무나 힘이 돼   My lover lover  기분 좋은 이 시간   너를 보면 난 행복해져   Dreaming my Dreams   언제 또 이런 행복이 찾아올까  함께하는 동안에  멀리 있을 때에도  서롤 아껴주는 my love   따뜻한 그 모습  때론 오빠처럼 친구처럼   때론 남자처럼 동생처럼   널 이해하고 사랑하는 나  언제나 너를 사랑해  내 마음 변치 않을게  우리의 소중한 시간  지금부터 영원히  날 바라보는 너  그런 널 바라보는 나  늘 지금처럼 함께해 우리둘이  I need you oh no oh 바라보기만 해도 빠져들것 같은 그 미소 세상 누구 보다도 특별해  My lover lover 커져가는 내 맘을 아낌없이 다 주고 싶어 Dreaming  my Dreams  무슨 말로 어떻게 다 표현할까 함께 있을 때도 자꾸만 보고싶은 비교 할수없는 My Love  귀여운 내 사랑 때론 힘들어도 속상해도  이 손 놓지 말고 꼭 안고서  지금처럼 행복하길 바랄게 언제나 너를 사랑해 내 마음 변치 않을게 우리의 소중한 시간 지금부터 영원히 날 바라보는 너 그런 널 바라보는 나 늘 지금처럼 함께해 우리둘이 아주 다른 인연이 만나 서롤 아껴준다는게 어려울 수 있겠지 그땐 서로 생각하며 우리 함께 노력해요  너만을 위한 내 사랑 다주고 싶은 내 마음 언제나 변치 않기를 약속할게 영원히 나 언제까지나  이렇게 언제까지나 늘 지금처럼 함께해 우리둘이 I need you oh no oh
2013.08.12~08.18,84,4054983,기대해,걸스데이,기대,2013.03.14,Dance,"남기상,DanielR.",Ooh Ooh Ooh Ooh Ooh   Ooh Ooh Ooh Ooh Ooh   귀엽게  Ooh Ooh Ooh Ooh Ooh   Ooh Ooh Ooh Ooh Ooh   예쁘게  Oh  하루에도 열번씩   네 전화번호 지워보고  너를 또 지워보고 생각에서   지워보고  너의 번호 뒷자리에 내   가슴은 내려앉아   그렇게 통화하고 다시   또 미소짓고  나는 네가 불안해 그게   불만인데도  자존심 탓 때문에 말도   못해 이렇게  내가 아님 안되는 남자   많고 많은데  네가 숨기고 쓰는 문자가 더   신경쓰여 문자가 신경쓰여  문자가 신경쓰여  Ooh Ooh Ooh Ooh Ooh   Ooh Ooh Ooh Ooh Ooh   귀엽게  Ooh Ooh Ooh Ooh Ooh   Ooh Ooh Ooh Ooh Ooh   예쁘게  널 내게 널 내게 다가오게 만들래   Ooh Ooh Ooh Ooh Ooh   Ooh Ooh Ooh Ooh Ooh   기대해  너땜에  너땜에  미쳐가  Whoa uh uh  너땜에  너땜에  미쳐가  Whoa uh uh  내 앞에서 그 여자랑   다정하게 얘기하고  토라진 나를 보고 별일   없이 미소 짓고  이런 기분 너무 싫어 나   또 다시 널 잊으려  잊으려 애를 쓰고   그렇게 아파하고  너란 남자 왜 그래 너 때문에   난 미쳐  나 하나면 안되니   내 가슴은 찢어져  나만 보는 남자들 많고   많고 많은데  네 전화만 기다리는 바보   같은 나는 뭐니 바보 같은   나는 뭐니  바보 같은 나는 뭐니  Ooh Ooh Ooh Ooh Ooh   Ooh Ooh Ooh Ooh Ooh   귀엽게  Ooh Ooh Ooh Ooh Ooh   Ooh Ooh Ooh Ooh Ooh   예쁘게  널 내게 널 내게 다가오게 만들래   Ooh Ooh Ooh Ooh Ooh   Ooh Ooh Ooh Ooh Ooh   기대해  너땜에  너땜에  미쳐가  Whoa uh uh  너땜에  너땜에  미쳐가  Whoa uh uh  I just want you to come   to me  다가와봐 내가 손짓 하잖니  I just need you to give   your love  어서 내게 네   마음을 보여줘  나 왜이래 내 마음은   고장 났어 난  나 왜이래 내 마음은   너만 찾아 난  네가 미워 미워 미치겠어도 난   너의 웃는   네  네 입꼬리에  네 입꼬리에  네 입꼬리에  네 목소리에  네 목소리에  네 목소리에  난 가슴이 떨려  널 내게 널 내게 다가오게   Ooh Ooh Ooh  널 내게 널 내게 미쳐보게   Yeah eh eh  나 없음 나 없음 안되게   널 만들래  Ooh Ooh Ooh Ooh Ooh   Ooh Ooh Ooh Ooh Ooh   기대해  넌 내게 넌 내게 미쳐가   Wuh Oh Oh 넌 내게 넌 내게 미쳐가  Wuh Oh Oh I’m gonna get to you Ooh Ooh Ooh Ooh Ooh  Ooh Ooh Ooh Ooh Ooh  기대해
