time,rank,song_id,title,singers,album,date,genre,creator,lyric
2015.09.21~09.27,1,7858908,바람이나 좀 쐐 (Feat. 우혜미),개리,2002,2015.09.21,Rap / Hip-hop,개리,나가서 바람이나 좀 쐐 아무도 찾지 않는 곳에 조금 슬퍼 보이면 어때 너만 그런 게 아닐 텐데 때로는 lonely lonely lonely 때로는 lonely lonely lonely 나가서 바람이나 좀 쐐 아무도 찾지 않는 곳에 너와 헤어지고 난 후에 한번에 관계 역시 넌 최고였어 사랑을 할 땐 감동밖에 누가 널 만나게 될진 모르겠지만 그 자식 운이 텄네 그래 슬픈 생각보단 오히려 이렇게 쿨한게 편해 열 편의 영화 열 번의 취함 열 명의 위로와 열 번의 낮과 밤 그걸로 충분하면 좋겠어 지금 이 힘든 이별을 견디는 시간 많은 일들과 작은 웃음들 억지로 만들어가며 적응하는 중 좋은 것만 생각해 그래야 좀 맘이 편해 어차피 사랑도 세월 따라 다 변해 추억 같은 노래 그래 어쩌면 지금 내게 필요한 건 힘이 들 때마다 네가 항상 웃으면서 내게 했던 그 말 나가서 바람이나 좀 쐐 아무도 찾지 않는 곳에 조금 슬퍼 보이면 어때 너만 그런 게 아닐 텐데 때로는 lonely lonely lonely 때로는 lonely lonely lonely 나가서 바람이나 좀 쐐 아무도 찾지 않는 곳에 사랑은 가고 난 그냥 또 혼자 사는 남자 라면 물 맞추기 선수 가끔씩은 혼잣말하며 외로운 소파와 함께 살아 잠이 들기 전엔 TV 드라마 혹은 영화 네가 없이도 시간은 잘도 흘러가고 너의 연락 없는 전화는 그냥 꺼놔 아마 내일도 그러겠지만 알게 뭐야 끝난 거야 이미 우리 사랑은 죽었고 이별은 춥고 가슴 아픈 평화 또 때로는 무서운 밤의 긴 침묵 같은 거야 이별이 그런 거지 뭐 멀쩡하다가도 울컥하는 실컷 미워하다가 눈물 참는 거 밤이 되면 높은 빌딩 깜박거리는 빨간 불빛 그처럼 네가 떠올라 더 지쳐가는 거 이별은 그런 거야 이별은 그런 거야 멀쩡하다가도 울컥 하는 거 이별은 그런 거야 이별은 그런 거야 실컷 미워하다가도 눈물 참는 거 나가서 바람이나 좀 쐐 아무도 찾지 않는 곳에 조금 슬퍼 보이면 어때 너만 그런 게 아닐 텐데 때로는 lonely lonely lonely 때로는 lonely lonely lonely 나가서 바람이나 좀 쐐 이제는 내가 없는 곳에 나가서 바람이나 좀 쐐 조금 슬퍼 보이면 어때 나가서 바람이나 좀 쐐 조금 슬퍼 보이면 어때
2015.09.21~09.27,2,7858989,어깨,"소유(SOYOU),권정열",어깨,2015.09.22,R&B / Soul,브라더수,잘 알죠 모든 게 내 맘 같지 않을 때 아무리 뒤척여도 잠은 오지를 않고 전화 속 사람들 이렇게나 많은데 연락할 누구도 곁에 없을 때 혼자만 있고 싶어도 사실 외로울 때 웃어볼 기운도 없을 때가 있죠 할 일은 쌓여서 산더미에 줄어들질 않고 자꾸 한숨만 나올 땐 기대도 돼 기대도 돼요 내게 with you you 언제든 내게 기대 쉬어도 돼요 그대 with you you 다 이해해 유난히 하루가 길게만 느껴질 때 집으로 가는 길 괜히 멀기만 하고 하고픈 이야기 정말 많았었는데 쓴 웃음 지으며 참아버렸죠 누가 툭 건드리기만 하면 금방이라도 울음이 터질 것 같을 때가 있죠 언젠간 괜찮아 질 거라고 애써 생각해도 자꾸 한숨만 나올 땐 기대도 돼 기대도 돼요 내게 with you you 언제든 내게 기대 쉬어도 돼요 그대 with you you 다 이해해 나만 이런건지 혼자 힘든건지 I know I know 잘 하고 있단 걸 그렇게 속으로만 안고있지 말고 you know you know 내가 곁에 있단 걸 기대도 돼 기대도 돼요 내게 with you you 언제든 내게 기대 쉬어도 돼요 그대 with you you 다 이해해 다 이해해 다 이해해 다 이해해
2015.09.21~09.27,3,7854179,취향저격,iKON,WELCOME BACK,2015.11.16,Rap / Hip-hop,"B.I,BOBBY,KUSH",너는 내 취향저격 내 취향저격 말하지 않아도 느낌이 와 머리부터 발끝까지 다 너는 내 취향저격 난 너를 보면 가지고 싶어서 안달이 나 자기 전까지도 생각이 나 pow 가는 발목 아래 운동화와 청색 스키니진의 완벽한 조화 살짝 큰 듯한 가디건 아래 뚝 떨어진 긴 생머리가 참 고와 수줍은 눈웃음도 멍 때리는 듯한 모습도 예쁘게만 보이고 가슴이 막 떨려 왜 이제야 나타났니 you're my 취향저격 oh oh 너의 가녀린 미소 oh oh 나를 보는 눈빛도 흠잡을 데가 없어 한시도 지루할 틈이 없어 perfect oh oh 애교 섞인 목소리 oh oh 가까워지는 우리 왜 이제야 나타났어 드디어 사랑이 찾아왔어 너는 내 취향저격 내 취향저격 말하지 않아도 느낌이 와 머리부터 발끝까지 다 너는 내 취향저격 난 너를 보면 가지고 싶어서 안달이 나 자기 전까지도 생각이 나 pow A girl 잠시 말 좀 물을게 그 까칠한 말투는 어디서 또 배웠대 you work and walk and spit words like a boss wonder woman 현실판은 너의 여성스러움 Oh 느낌적인 느낌 또 뭔가 매혹적인 눈빛에 매료돼 섬세한 그 손길 또 뭔가 어정쩡한 몸짓 I like it babe oh oh 너의 가녀린 미소 oh oh 나를 보는 눈빛도 흠잡을 데가 없어 한시도 지루할 틈이 없어 perfect oh oh 애교 섞인 목소리 oh oh 가까워지는 우리 왜 이제야 나타났어 드디어 사랑이 찾아왔어 너는 내 취향저격 내 취향저격 말하지 않아도 느낌이 와 머리부터 발끝까지 다 너는 내 취향저격 난 너를 보면 가지고 싶어서 안달이 나 자기 전까지도 생각이 나 pow 난 니가 정말 좋아 또 가끔 하품하는 모습까지도 내 스타일이야 오 마음이 잘 맞아 내 가슴이 벅차올라 니가 날 부를 때마다 입가에 웃음이 끊이질 않아 Oh girl you know that I love you 너는 내 취향저격 내 취향저격 말하지 않아도 느낌이 와 머리부터 발끝까지 다 너는 내 취향저격 난 너를 보면 가지고 싶어서 안달이 나 자기 전까지도 생각이 나 pow 난 니가 정말 좋아 또 가끔 하품하는 모습까지도 내 스타일이야 난 니가 정말 좋아 또 가끔 하품하는 모습까지도 내 스타일이야
2015.09.21~09.27,4,7860122,보통연애 (Feat. 박보람),박경(블락비),보통연애,2015.09.21,Rap / Hip-hop,박경(블락비),새로운 사람 흥미가 생기고 뻔하디 뻔한 말들을 주고받다 서로 눈치채고 있는 타이밍에 용기 내 하는 취중고백 끼워 맞추듯 취미를 공유하고 야라 부르던 네가 자기가 되도 너무나 익숙한 장면 같아 반복되는 Dejavu 너도 느끼잖아 이거 좀 웃기잖아 소설 속의 발단 전개 위기 절정 결말처럼 언제나 같은 Process 딱 그 정도 뜨거웠다 식는 연애의 온도 항상 그래 왔기에 함부로 치지도 못하는 설레발 근데 이상해 좀 잘못된 듯 해 더 설레고 조급해 평소처럼 또 머물다 가는 순간의 감정일까 아님 혹시 이번엔 다를까 Baby I gotta go 나 반복의 반복이더라도 다시 제자리로 온대도 I don’t give a aye 날 들었다 놨다 하는 너 보통이 아닌 걸 Oh boy 너의 행동 말투나 표정 이상형과는 달라도 자꾸 끌리는데 어쩌겠어 baam 날 들었다 놨다 하는 너 보통이 아닌 걸 I can feel it 새로운 사랑 초반의 설렘 뻔하디 뻔한 애칭도 붙여주고 온종일 붙잡고 있는 핸드폰 속엔 끊기지 않는 문자들 끼워 맞췄던 것이 좋아지고 무의식 중 자연스레 널 자기라 부르는 모습들이 어딘가 익숙해 반복되는 Dejavu 저 맞은편에서 보인 너의 모습 so beautiful 나는 분명 네가 좋은데 이상하게 걱정이 돼 내가 걱정이 돼 그러다 사랑이 정이 돼 어떻게 사람 마음이 하루아침에 정의돼 but 이번엔 달라 좀 잘못된 듯해 더 커지고 조급해 평소처럼 또 머물다 가는 순간의 감정일까 아님 혹시 different Baby I gotta go 나 반복의 반복이더라도 다시 제자리로 온대도 I don’t give a aye 날 들었다 놨다 하는 너 보통이 아닌 걸 Oh boy 너의 행동 말투나 표정 이상형관 달라도 자꾸 끌리는데 어쩌겠어 baam 날 들었다 놨다 하는 너 보통이 아닌 걸 I can feel it Yo I’m confused girl Hey I’m confused boy 이런 걱정 바보 같은 거 알아 근데 사실은 말이야 이건 너 변할까 봐 혼자 먼저 하는 자기방어 같은 거야 그러니 나와 같을 거라고 말해줘 어린애같이 유치한 날 달래줘 Baby I gotta go 나 반복의 반복이더라도 다시 제자리로 온대도 I don’t give a aye 날 들었다 놨다 하는 너 보통이 아닌 걸 Oh boy 너의 행동 말투나 표정 이상형관 달라도 자꾸 끌리는데 어쩌겠어 baam 날 들었다 놨다 하는 너 보통이 아닌 걸 I can feel it
2015.09.21~09.27,5,5826461,레옹,"이유갓지(GODG)않은이유(박명수,아이유)",무한도전 영동고속도로 가요제,2015.08.22,Dance,아이유,레레 레레레옹 레레레 레레레옹 레레레옹 레레 레레레 레레 눈에 띄게 흰 피부에 입술은 피빨강 꼿꼿하게 핀 허리에 새침한 똑단발 못된 걸음으로 또 어디를 가나 누굴 찾는 것 같아 이 외로운 마틸다 티키타 리듬에 맞춰 스핀 기타 리프 테마는 스팅의 Shape Of My Heart 난 나잇값을 떼먹은 남자 Call Me 레옹 Call Me 레옹 Call Me 레옹 Call Me Call Call Call Call Call Call Me 시끄러운 사람들 틈에 왜 당신은 조금도 춤을 추지 않나요 나 그대가 궁금해 알 수 없는 표정에 까만 선글라스 Mon Cher Look At Me 춤추고 싶지 않아 Mon Cher Look At Me 이유는 캐묻지 마라  Hey Baby Look At Me 슬픈 눈을 들키고 싶지 않아 더는 다가오지 마라 깜빡  왜 그렇게 무뚝뚝하나요 상냥하게 좀 해줄래요 ma 레옹 나도 어디서 꿀리진 않아 내 Choice는 틀리지 않아 I'm 마 마틸다 I'm 마 마 마틸다 I'm 마 마틸다 I'm 마 I'm I'm 마 I'm 마 잔잔히 잠들은 내 맘에 왜 돌을 던져 날 춤추고 싶게 만들어 흔들리는 눈빛을 감추어주오 나의 까만 선글라스 Ma chere What You Need 나처럼 춤을 춰요 Ma chere What You Need 아 튕기지 좀 마요 Hey Baby What You Need 그래 앞에 나를 봐요 자 이제 춤을 춰요 깜빡 Un Deux Trois Quatre 레레 레레레 레레 레 레레옹 레레 레레레 레레 레 레레옹 Mon Cher Look At Me 춤추고 싶지 않아 Mon Cher Look At Me 이유는 캐묻지 말아 Hey Baby Look At Me 슬픈 눈을 들키고 싶지 않아 더는 다가오지 말아 깜빡 Ma chere What You Need 나처럼 춤을 춰요 Ma chere What You Need 아 튕기지 좀 마요 Hey Baby What You Need 그래 앞에 나를 봐요 자 이제 춤을 춰요 춰요 깜빡
2015.09.21~09.27,6,5826447,겁 (Feat. 태양),MINO,쇼미더머니 4 Episode 5,2015.08.22,Rap / Hip-hop,"지코(ZICO),MINO",뒤돌아 봤을 때 생각보다 멀리 와있었어 난 혼자였고 문득 겁이 났지 내가 날 봤을 때 지쳐있단 사실을 몰랐었어 난 외로웠고 문득 겁이 났지 넌 잘하고 있어 헷갈릴 때면 여태 그랬던 것처럼 그냥 Go 너답게 해 너는 너를 알아 연습했잖아 한 수 천 번은 말야 좌절 한 두 번 이젠 시시해 원래 기회라는 건 인생의 위기에 넌 알잖아 다시 일어나는 법 천국여행 간다며 어서 싸 캐리어 멈추지 마라 아직 할 일 많아 뒷바라지하는 부모님의 사진봐 넌 동생들의 거울이자 가족들의 별 네가 잠을 줄여야만 그들이 편하게 숙면 야 이 병신아 티 좀 내지마 마음 단단히 먹어 알아 외롭지만 견뎌내야 돼 눈물 흘리냐 사내새끼가 뚝 그치고 다시 들어 책임감 eh 아무것도 보기 싫었을 때 억지로 눈을 부릅뜬 건 그냥 겁나서 덜컥 겁이 나서 그래 eh o 아무 말도 하기 싫었을 때 일부러 목소릴 높인 건 There is no other reason 겁이 나 난 겁이 나 입버릇처럼 말했어 언제나 나는 나를 믿어 상대는 없다며 But enemy was in my mirror 계속된 싸움에 이성을 잃었었나봐 내가 나를 죽였어 엄마도 내 눈치를 봐 대중의 관심을 받는 게 eh CCTV 속에 사는 게 eh 한곳만 죽어라 팠는데 그게 내 무덤이 될 수도 있다는 게 무서웠어 아버지 날 보고 있다면 정답을 알려줘 어른이 되기엔 난 어리고 여려 아직도 방법을 모르고 부딪히는 짓만 하기엔 너무 아프다는 걸 이제 알았어 너무 늦었나봐 무식하게 채찍질만 하기엔 아물지 않은 상처가 너무 많아 eh 아무것도 보기 싫었을 때 억지로 눈을 부릅뜬 건 그냥 겁나서 덜컥 겁이 나서 그래 eh o 아무 말도 하기 싫었을 때 일부러 목소릴 높인 건 There is no other reason 겁이 나 난 겁이 나 자꾸 겁이 나 난 모든 게 감사해 내 종교를 떠나서 6년 전부터 이 꼬맹이를 이용하려 했던 악덕 대표님들 조차 날 구원해준 지금의 회사도 이 무대를 내어준 수많은 참가자도 남자의 삶을 알려준 하늘에 계신 큰아빠도 가족 내 어깨들과 형제 같은 멤버들도 딱 오늘까지만 위로를 받고 내일부턴 겁쟁이가 아닌 성숙해진 나로 eh 아무것도 보기 싫었을 때 억지로 눈을 부릅뜬 건 그냥 겁나서 덜컥 겁이 나서 그래 eh o 아무 말도 하기 싫었을 때 일부러 목소릴 높인 건 There is no other reason 겁이 나 난 겁이 나 Can you see me now Anybody save me from this fear oh Can you hear me now woah woo
2015.09.21~09.27,7,7847861,Dumb Dumb,RedVelvet(레드벨벳),The Red - The 1st Album,2015.09.09,Dance,"서지음,김동현",Dumb Dumb Dumb Dumb Dumb Dumb Dumb Dumb Dumb Dumb Dumb Dumb Dumb Dumb Dumb Dumb Dumb Dumb Dumb Dumb Dumb Dumb Dumb Dumb Dumb Dumb Dumb Dumb Dumb Dumb Dumb Dumb Dumb Dumb Dumb Dumb Dumb Dumb Dumb Dumb Dumb Dumb Dumb Dumb Dumb Dumb Dumb Dumb 너 땜에 하루 종일 고민하지만 널 어떡해야 좋을지 잘 모르겠어  난 Oh Baby baby baby baby baby you Play me play me play me play me play me 그 눈빛은 날 아찔하고 헷갈리게 해 내 이성적인 감각들을 흩어지게 해  Oh Baby baby baby baby baby you Crazy crazy crazy crazy crazy 마네킹 인형처럼 하나부터 열까지 다 어색하지 평소같이 하면 되는데 또 너만 보면 시작되는 바보 같은 춤 눈 코 입 표정도 팔 다리 걸음도 내 말을 듣지 않죠 Dumb Dumb Dumb Dumb Dumb Dumb Dumb Dumb 심장의 떨림도 날뛰는 기분도 맘대로 되질 않죠 Dumb Dumb Dumb Dumb Dumb Dumb Dumb Dumb Dumb Dumb Dumb Dumb Dumb Dumb Dumb Dumb Dumb Dumb Dumb Dumb Dumb Dumb Dumb Dumb Dumb Dumb Dumb Dumb Dumb Dumb Dumb Dumb Dumb Dumb Dumb Dumb Dumb Dumb Dumb Dumb Dumb Dumb Dumb Dumb Dumb Dumb Dumb Dumb Dumb Dumb 낭만적인 영화를 난 꿈꿔왔지만 네 사랑은 내 손에 늘 땀을 쥐게 해 Oh Baby baby baby baby baby You make me crazy crazy crazy crazy hey 마네킹 인형처럼 하나부터 열까지 다 어색하지 평소같이 하면 되는데 또 너만 보면 시작되는 바보 같은 춤 Dumb Dumb Dumb Dumb Dumb Dumb Dumb Dumb Dumb Dumb Dumb Dumb Dumb Dumb Dumb Dumb Dumb Dumb Dumb Dumb Dumb Dumb Dumb Dumb Dumb Dumb Dumb Dumb Dumb Dumb Dumb Dumb Dumb Dumb Dumb Dumb Dumb Dumb Dumb Dumb Dumb Dumb Dumb Dumb Dumb Dumb Dumb Dumb You need to Beat It That boy Michael Jackson Bad 난 너의 Billie Jean이 아냐 Don't you Leave Me Alone 하지만 애매한 반응 난 원해 Black Or White 포기 못해 나의 Man In The Mirror Why You Wanna Trip On Me 넌 너무 짓궂지 Boy you make me Scream 너에게 왜 이러지 하긴 너의 Love 정말 Never Felt So Good 그건 아마 짜릿하다 못해 Watching the Thriller 난 너에게서 헤어날 수 없나 봐 미워도 싫지가 않잖아 저 언니처럼 되고 싶은데 넌 자꾸 나를 귀엽다고 하는 걸까 왜 남동생 로봇처럼 하나부터 열까지 다 어색하지 어떡하지 고장 났나 봐 숨을 쉬는 방법도 다 까먹었어 나 눈 코 입 표정도 팔 다리 걸음도 내 말을 듣지 않죠 Dumb Dumb Dumb Dumb Dumb Dumb Dumb Dumb 심장의 떨림도 날뛰는 기분도 맘대로 되질 않죠 Dumb Dumb Dumb Dumb Dumb Dumb Dumb Dumb Dumb Dumb Dumb Dumb Dumb Dumb Dumb Dumb Dumb Dumb Dumb Dumb Dumb Dumb Dumb Dumb Dumb Dumb Dumb Dumb Dumb Dumb Dumb Dumb Dumb Dumb Dumb Dumb Dumb Dumb Dumb Dumb Dumb Dumb Dumb Dumb Dumb Dumb Dumb Dumb Dumb Dumb Dumb Dumb Dumb Dumb Dumb
2015.09.21~09.27,8,7852842,그렇게 됐어,플라이투더스카이,Love & Hate,2015.09.14,R&B / Soul,심은지,그렇게 됐어 한 두달 쯤 됐어 뭐 때문에 헤어졌냐는 친구들 말에 그냥 그렇게 됐어 마치 사랑한 적 없던 것 처럼 술잔을 비워내며 뭐 그렇게 됐어 유난스럽지 않게 이별을 말하고 있는 내 맘은 아직 너로 가득 차있는 걸  왜 이렇게 됐어 우리가 왜 이렇게 벌써 널 떠올릴 자신이 없어 왜 이렇게 됐지 우리가 왜 이렇게 미치도록 아파서 하는말야 그렇게 됐어 그렇게 될까 그런 날이 올까 들려오는 니 소식에 무뎌지는 날이 사실 힘들다는 말 나도 모르게 새어 나올까 봐 니 이름도 편하게 꺼내지 못해 차인거냐 놀리는 농담에 시덥지 않은 위로에 또 하루만큼 멀어진 걸까 왜 이렇게 됐어 우리가 왜 이렇게 벌써 널 떠올릴 자신이 없어 왜 이렇게 됐지 우리가 왜 이렇게 미치도록 아파서 하는말야 그렇게 됐어 정말 뜨거웠다 해도   많이 아팠었다 해도 그저 흔한 이별 얘기 처럼 둘만 아는 얘기들도  혹시 우스워질까봐     말을 아끼고 아끼다 하지 못했어 왜 이렇게 됐어 우리가 왜 이렇게 벌써 널 떠올릴 자신이 없어 왜 이렇게 됐지 우리가 왜 이렇게 미치도록 아파서 하는말야 그렇게 됐어
2015.09.21~09.27,9,5824839,맙소사,"황태지(황광희,태양,지드래곤)",무한도전 영동고속도로 가요제,2015.08.22,Dance,"TEDDY,G-DRAGON",Give Me That Drop That Give Me That 맙소사 I Love It Love It Love It 맙소사 You Love It Love It Love It Yeah I'm Ready 맙소사 Since 88 태어날 때부터 Everyday가 우린 Birthday I Go Hard 신이 날 땐 아무도 날 심판하지 못해 절대 양 옆 앞 뒤 다 줄 맞춰 내가 지휘할 테니까 교양 없이 듣는 예능 Symphony 오늘은 토요일 무한대를 그려봐 Let's Go Boom Boom Boom 무슨 말이 필요해 Shut Up And Drop Drop Drop The Bass Drop Drop Drop The Bass 쿵쿵쿵 내 심장을 뛰게 해 더 크게 That that Boom bo boom That that Boom bo boom 조금 더 조금 더 위로 지금 나를 저 하늘 위로 조금 더 조금 더 위로 맙소사 I Love It Love It Love It 맙소사 You Love It Love It Love It 맙소사 우린 88 세 친구 궁합은 찹쌀떡과 메밀묵 Yeah 팔팔해 Like 이팔청춘 팔색조 또는 팔방미남들 신토불이 불이 얼쑤 Shake That Booty Booty 좋다 Everybody Say 황태지 우리가 누구 황태지 이리와 우리와 노래 하자 맙소사 광희와 지용이 영배 오구오구오구 Whoo Boom Boom Boom 무슨 말이 필요해 Shut Up And Drop Drop Drop The Bass Drop Drop Drop The Bass 쿵쿵쿵 내 심장을 뛰게 해 더 크게 That that Boom bo boom That that Boom bo boom 조금 더 조금 더 위로 지금 나를 저 하늘 위로 조금 더 조금 더 위로 맙소사 Let's Go 여기 있는 사람 모두 위로 흔들어봐 두 손 머리 위로 I Go 어머님 맙소사 맙소사 DJ Let The Bass Drum Go 여기 있는 사람 모두 위로 흔들어봐 두 손 머리 위로 I Go 어머님 맙소사 맙소사 DJ Let The Bass Drum Go Woo Let The Bass Drum Go Woo Let The Bass Drum Go Let The Bass Drum Go Let The Bass Drum Go
2015.09.21~09.27,10,7861392,또 다시 사랑,임창정,또 다시 사랑,2015.09.22,Ballad,임창정,아픔이 좀 더 작아질까 의미 없는 만남을 하다가 어느 날 그대가 흘린 눈물 왠지 나와 같다 느껴서 이렇게 그대를 지키는가 봐요 행복하고 싶었던 그대를 몰랐던 누군갈 또 알아가면서 분명 행복할 걸 알겠지만 내가 그대를 만났다는 건 어쩌면 흘러가는 흔한 인연이란 것 일지 모르지만 오늘도 다시 또 다시 사랑해요 사랑 언제나 이번이 마지막이라며 처음인 듯 찾아오니까 어느 날 그대가 숨긴 눈물 왠지 나와 같다 느껴서 이렇게 그대를 지키는 가 봐요 행복하고 싶었던 그대를 몰랐던 누군갈 또 알아가는 게 혹시 두렵기도 하겠지만 내가 그대를 만났다는 건 어쩌면 흘러가는 흔한 인연이란 것일지 모르지만 오늘도 다시 또 다시 사랑해요 사랑 언제나 이번이 마지막이라며 처음인 듯 찾아오니까 절대 우리 작은 다툼조차 하지 마요 이별 후엔 서운함만 가슴속에 남으니 사소한 그 표현이 그 말들이 언제나 나에겐 참 고마울 거예요 내가 그대를 만났다는 건 어쩌면 흘러가는 흔한 인연이란 것 일지 모르지만 오늘도 다시 또 다시 사랑해요 사랑 언제나 이번이 마지막이라며 처음인 듯 찾아오니까 사랑 언제나 이번이 마지막이라며
2015.09.21~09.27,11,5791706,오늘부터 우리는 (Me Gustas Tu),여자친구(GFRIEND),여자친구 2nd Mini Album `Flower Bud`,2015.07.23,Dance,"이기(오레오),용배(RBW)",널 향한 설레임을 오늘부터 우리는  꿈꾸며 기도하는 오늘부터 우리는 저 바람에 노을 빛 내 맘을 실어 보낼게 그리운 마음이 모여서 내리는 Me gustas tu gustas tu su tu tu ru 좋아해요 gustas tu su tu ru ru 한 발짝 뒤에 섰던 우리는 언제쯤 센치해 질까요 서로 부끄러워서 아무 말도 못하는 너에게로 다가가고 싶은데 바람에 나풀거리는 꽃잎처럼  미래는 알 수가 없잖아 이제는 용기 내서 고백할게요 하나보단 둘이서 서로를 느껴 봐요 내 마음 모아서 너에게 전하고 싶어 설레임을 오늘부터 우리는 꿈꾸며 기도하는 오늘부터 우리는 저 바람에 노을 빛 내 맘을 실어 보낼게 그리운 마음이 모여서 내리는 Me gustas tu gustas tu su tu tu ru 좋아해요 gustas tu su tu ru ru 한 걸음 앞에 서서 두 손을 놓지 말기로 약속해요 소중해질 기억을 꼭 꼭 담아 둘게요  지금보다 더 아껴 주세요 달빛에 아른거리는 구름처럼  아쉬운 시간만 가는데 이제는 용기 내서 고백할게요 둘 보단 하나 되어 서로를 느껴 봐요 내 마음 모아서 너에게 전하고 싶어 설레임을 오늘부터 우리는 꿈꾸며 기도하는 오늘부터 우리는 저 바람에 노을 빛 내 맘을 실어 보낼게 그리운 마음이 모여서 내리는 감싸 줄게요 그대 언제까지나  언제까지나 사랑이란 말 안 해도 느낄 수 있어요 고마운 마음을 모아서 널 향한 설레임을 오늘부터 우리는 꿈꾸며 기도하는 오늘부터 우리는 저 바람에 노을 빛 내 맘을 실어 보낼게 그리운 마음이 모여서 내리는 Me gustas tu gustas tu su tu tu ru 좋아해요 gustas tu su tu ru ru
2015.09.21~09.27,12,5820368,Lion Heart,소녀시대(GIRLS`GENERATION),Lion Heart - The 5th Album,2015.08.18,Dance,"1월8일,최소영,JoyFactory",Oooh 너와 나 첨 만났을 때 Oooh 마치 사자처럼 맴돌다 기회를 노려 내 맘 뺏은 너 Ah 넌 달라진 게 없어 여전해 난 애가 타고 또 타 사냥감 찾아 한 눈 파는 너 수백 번 밀어내야 했는데  수천 번 널 떠나야 했는데 Tell me why 왜 맘이 맘이 자꾸 흔들리니 난 여기 여기 네 옆에 있잖니 정신 차려 Lion heart 난 애가 타 내 맘이 맘이 더는 식지 않게 난 여기저기 뛰노는 너의 맘 길들일래 Lion heart OhOhOh OhOhOhOhOh  OhOhOh OhOhOhOhOh Oooh 넌 자유로운 영혼 여전해 충실해 본능 앞에 지금 네 옆에 난 안 보이니 수백 번 고민 고민해봐도 수천 번 결국 답은 너인데 Tell me why 왜 맘이 맘이 자꾸 흔들리니 난 여기 여기 네 옆에 있잖니 정신 차려 Lion heart 난 애가 타 내 맘이 맘이 더는 식지 않게 난 여기저기 뛰노는 너의 맘 길들일래 Lion heart OhOhOh OhOhOhOhOh  곤히 잠자는 나의 코끝을 Baby  OhOhOh OhOhOhOhOh 네가 건드려 나도 화가 나 Baby  Tell me why 왜 맘이 맘이 자꾸 흔들리니 난 여기 여기 네 옆에 있잖니 정신 차려 Lion heart 난 애가 타 내 맘이 맘이 더는 식지 않게 난 여기저기 뛰노는 너의 맘 길들일래 Lion heart Ladies y’all know  what I’m talking about right Yeah  모두 다 아니라 해도  좋을 때 있지 않아 사실 나만 좋음 됐지 뭐  바람보다 빠른 눈치로  맘은 뜨겁게 햇살처럼 따뜻한 말로  머린 차갑게 길들일래 너의 Lion heart  사자 같은 너의 Lion heart Lalala Lalalalala  여기 와서 앉아  Lalala Lalalalala 내 곁에만 있어 Lalala Lalalalala 한 눈 팔지 말아  Lion heart
