time,rank,song_id,title,singers,album,date,genre,creator,lyric
1996.12.08~12.14,36,68051,니가 떠나간 이유,변진섭,Again,1996.06,Ballad,,그대를 데려간 그가 잘해주는지 늘 걱정했었죠 누구나 이쯤되면은 잊는다는데 그게 잘 안되요 다른 사람을 사랑하려고 나는 지금도 노력해보지만 내안에 있는 그댈 꺼내기가 왜 이리도 힘든걸까요  날 잊지 말아요 쉽진 않겠지만 내 이름이라도 기억해주길 바래요 이 다음 세상도 그대를 보기 위해서 태어나고픈 한 남잘 위해  나에게 돌아오는 길 없을거란걸 잘알고 있어요 그대 한사람이라도 행복하다면 그걸로 된거죠 사는 동안에 다시 그대를 보고싶은건 내 욕심인가요 나완 다르게 이젠 나 없이도 왜 그댄 괜찮은건지  날 잊지 말아요 쉽진 않겠지만 내 이름이라도 기억해주길 바래요 이 다음 세상도 그대를 보기 위해서 태어나고픈 한 남잘 위해  그대를 이토록 사랑한 사람있었음을 내가 눈을 감을 때 기억해만 준다면 이 아픔 괜찮죠  날 잊지 말아요 쉽진 않겠지만 내 이름이라도 기억해주길 바래요 이 다음 세상도 그대를 보기 위해서 태어나고픈 한 남잘 위해
1996.12.08~12.14,37,70491,너에게,포지션,후회없는 사랑,1996.03.10,Ballad,한진우,아무말 않고선 그냥 떠나버린 널 그렇게 쉽게 용서하긴 힘들었었지 하지만 넌 후회하고 있다는 걸 나의 느낌으로 알수가 있어 너에게 내가 힘이 되줄께 더이상 아픔을 혼자 느끼지 말아줘 내가 곁에 있을께 그래 난 울지 않겠어  다시는 누구도 사랑할 수 없어 지금 넌 견딜수가 없잖아 너에게 내가 힘이 되줄께 더이상 아픔을 혼자 느끼지 말아줘 내가 곁에 있을께 그래 난 울지 않겠어 너에게 내가 힘이 되줄께 더이상 아픔을 혼자 느끼지 말아줘 내가 곁에 있을께 그래 난 울지 않겠어
1996.12.08~12.14,38,2277092,Show,김원준,Show,1996.08.20,Dance,김동률,show끝은 없는거야 지금 순간만 있는거야 난 주인공인거야 세상이라는 무대위에 show 룰은 없는거야 내가 만들어가는 거야 난 알수 있을꺼야 언제까지나 내 주위를 스쳐간 그 누군가 말했지 우리네 화려한 인생은 일막의 쑈와 같다고 커튼이 내려진 텅 빈무대 뒤켠에 오늘도 또 하루를 사는 내가 있는거야 날 지켜봐줘 넌 모르는 멋진 내 모습을 늘 가려졌던거야 이젠 너에게 보여줄께 show 끝은 없는거야 지금 순간만 있는거야 난 주인공인거야 세상이라는 무대위에 show 룰은 없는거야 내가 만들어 가는거야 난 알수 있을꺼야 언제까지나 너와 함께 늘 기울여져 너를 위해 부르던 노래는 늘 묻혀왔던거야 이제 너에게 들려줄께 show 끝은 없는거야 지금 순간만 있는거야 난 주인공인거야 세상이라는 무대위에 show 룰은 없는거야 내가 만들어 가는거야 난 알수 있을꺼야 언제까지나 영원히 show 끝은 없는거야 지금 순간만 있는거야 난 주인공인거야 세상이라는 무대위에 show 룰은 없는거야 내가 만들어 가는거야 난 알수 있을꺼야 언제까지나 너와 함께
1996.12.08~12.14,39,68320,제3의시간,성진우,Ac.Dc,1997,Dance,이건우,나 아닌 다른 어떤 사람을 만나고 있는걸 알아 불안해 하는 마음만으로 고통은 이미 충분해 더이상 내안에 머물 수 없다는 걸 이젠알아 니가 가고 싶은 길을 가 내 걱정은 하지 않아도 돼 제발 뒤를 돌아보지마 너를 다음 저 세상에서 만날때 까지  그렇게 되질 않길바라며 일부러 멀리 했었지 하지만 끝이 안보이는 나 현실의 벽은 높았어 조금만 슬프면 되겠지 새로운 시작을 가르쳐줘 니가 가고 싶은 길을 가 내 걱정은 하지 않아도 돼 제발 뒤를 돌아보지마 너를 다음 저 세상에서 만날때 까지 사랑하면 할수록 힘에겨운 나날들 널 다시 볼순 없을거야 내가 죽는날 까지  니가 가고 싶은 길을 가 내 걱정은 하지 않아도 돼 제발 뒤를 돌아보지마 너를 다음 저 세상에서 만날때 까지
1996.12.08~12.14,40,1719746,내가 만일,안치환,너를 사랑한 이유,1999.02.18,Folk,김범수,내가 만일 하늘이라면 그대 얼굴에 물들고 싶어 붉게 물든 저녁 저 노을처럼 나 그대 뺨에 물들고 싶어 내가 만일 시인이라면 그댈 위해 노래하겠어 엄마 품에 안긴 어린아이처럼 나 행복하게 노래하고 싶어 세상에 그 무엇이라도 그대위해 되고 싶어 오늘처럼 우리 함께 있음이 내겐 얼마나 큰 기쁨인지 사랑하는 나의 사람아 너는 아니 워 이런 나의 마음을 내가 만일 구름이라면 그대위해 비가 되겠어 더운 여름날의 소나기처럼 나 시원하게 내리고 싶어 세상에 그 무엇이라도 그대위해 되고싶어 오늘처럼 우리 함께 있음이 내겐 얼마나 큰 기쁨인지 워 세상에 그 무엇이라도 그대위해 되고싶어 오늘처럼 우리 함께 있음이 내겐 얼마나 큰 기쁨인지 사랑하는 나의 사람아 너는 아니 워 이런 나의 마음을 이런 나의 마음을
1996.12.08~12.14,41,1622515,내가 지켜줄께,녹색지대,내가 지켜줄께,1995.01.01,Ballad,강은경,잠든 너의 얼굴 위에 서려있는 그 아픔 이젠 내가 네가 되니 나도 따라 아픈가봐 내가 이제야 사랑을 해 예전엔 없었던 꿈도 갖고 더는 혼자가 아니기에 세상도 견딜만 한거야 내가 지켜줄께 험한 세상에 내가 힘이 될께 부족하지만 우리 잊지는 마 처음 가졌던 마음 우리 더 많은 걸 바라지마 오늘 너에게 내 사랑을 주진 않을꺼야 하지만 내 사랑이 이것뿐이라고 생각하지마 나는 다만 아껴둔 채로 조금씩 보여주고 싶어 내일은 오늘보다 더 많이 사랑해야 하니까  항상 우리 좋은날만 있지 않겠지 그런 날 와도 슬기롭게 넘겨야 해 사랑하기 때문에 이해하기 때문에 워우워 내가 이제야 사랑을 해 예전엔 없었던 꿈도 갖고 더는 혼자가 아니기에 세상도 견딜만 한거야 내가 지켜줄께 험한 세상에 내가 힘이 될께 부족하지만 우리 잊지는 마 처음 가졌던 마음 우리 더 많은 걸 바라지마 내가 지켜줄께 내가 힘이 될께 힘이될께 우리 잊지는 마 우 우리 더 많은 걸 바라지마 내가 지켜줄께 지켜줄께 내가 힘이 될께 워어 우리 잊지는 마 우
1996.12.08~12.14,42,38446,미련,김건모,Exchange kg. M4,1996.05.17,Ballad,최준영,그대가 나를 떠나고
1996.12.08~12.14,43,70765,널 위한 거야,미스미스터,Mis=Mr 1집,1996,Rock,,날 용서하며 살아가줘 넌 그럴꺼야 마음 아파져도 이젠 의미없는 시간 속에 널 기억하며 눈물 흘리겠지 아주 오래전에 잊고 지낸 소중함들을 너를 잃은 후에 느낄수 있는 아직 바보같은 날 넌 이해할 수 있다면 널 위한거야 널 외면할 땐 나의 눈에 흐른 눈물 마를지도 몰라 날 용서해줘 나 떠나가도 멀리서 너를 꼭 지켜봐 줄게  널 기억하며 살아갈게 내 이름조차 잊혀질지라도 이젠 어두워진 거울속에 날 바라보며 눈물 흘리겠지 아주 오래전에 잊고 지낸 소중함들을 너를 잃은 후에 느낄수 있는 아직 바보같은 날 넌 이해할 수 있다면 널 위한거야 널 외면할 땐 나의 눈에 흐른 눈물 마를지도 몰라 날 용서해줘 나 떠나가도 멀리서 너를 꼭 지켜봐 줄게 널 위한거야 널 외면할 땐 나의 눈에 흐른 눈물 마를지도 몰라 날 용서해줘 나 떠나가도 멀리서 너를 꼭 지켜봐 줄게
1996.12.08~12.14,44,68743,귀천도애 (歸天道哀),김민종,귀천도애 (歸天道哀),1996.08.01,Ballad,김민종,난 이대로 떠나 갈께요  그대 더 이상 슬퍼 말아요  내가 떠나가는 건 다시 돌아 올 수 있기에  그대여 날 용서해요   날 사랑하는 마음 알지만  잠시 나를 잊고 살아줘요  다시 또 태어나면 우린 만날 수 있을꺼야  믿어요 나의 그대여   기다리다 다른 사랑을 만나도 괜찮아  그대가 잠시 쉴수 있다면  하늘이여 너도 나를 보며 울고 있구나  난 이렇게도 웃고 있는데   그대가 힘이들어 나를 잊어도  그댈 지켜 줄께요 언제까지나 영원히   날 사랑하는 마음 알지만  잠시 나를 잊고 살아줘요  다시 또 태어나면 우린 만날 수 있을꺼야  믿어요 나의 그대여   기다리다 다른 사랑을 만나도 괜찮아  그대가 잠시 쉴수 있다면  하늘이여 너도 나를 보며 울고 있구나  난 이렇게도 웃고 있는데   그대가 힘이들어 나를 잊어도  그댈 지켜 줄께요 언제까지나 영원히  영원히 영원히 사랑해 -
1996.12.08~12.14,45,2507229,질주,노댄스,골든힛트,1996.10.01,Dance,"신해철,박창학",너를 내 삶의 뒷편에 던져 놓고 난 길을 떠나왔어. 버려. 실낱같은 희망. 우린 이제 어린애가 아니야. 눈앞에 다가와 버린 현실 앞에 난 너무 무력해. 알쟎아. 숨이 막힐 듯한 사람 속을 끝도 없이 달려가는 질주 속에. 돌아보면 아직 너는 기억 속의 그 자리에 손 흔들며 울고 있어. 대체 여기가 어딜까. 돌아보면 꽤 먼길을 왔는데. 너는 견디고 있는지. 하루하루 지옥 같은 고독을. 손끝도 보이지 않는 어둠 속에 모든게 점점 빨라져. 숨이 막힐 듯한 사람 속을 끝도 없이 달려가는 질주 속에. 돌아보면 아직 너는 기억 속의 그 자리에 손 흔들며 울고 있어.
1996.12.08~12.14,46,68799,사자후(獅子喉),이현도,Do It,1996.09,Rap / Hip-hop,이현도,조그맣게 살아 있던 내 가슴속에 불씨를 다시 크게 불태우리라 고뇌의 벽을 부셔 버리고서 다시 그댈 위해 내가 앞에 서리라 절망의 늪에서 빠져만 있기엔 나의 젊은 시간이 너무 짧다 다시 일어서는 내 의지와 함께 손잡을 사람들은 어디 누군가 더 내려갈 수 없는 절망의 끝에 떨어졌다 해도 여전히 태양은 머리위에 타오름을 이제 깨달을 그 시간이 왔다 운명을 피할 수 없다라면 그대여 그 운명에 당당하게 맞서라 소년의 여름에 찾아냈다 여기 영원히 부숴지지않는 다이아몬드 D O likes this D O likes that D to the O D O once again D O likes this D O likes that D to the O with the master plan 그대를 묶고 있는 두꺼운 그 줄을 끊어 그대를 가둬 놓은 두꺼운 그 벽을 넘어 나는 그렇게 하리라 나 나는 그렇게 되리라 나 나나나 나나나 Rock on 견디어 내야 할 내 모든 괴로움 그 괴로움의 크기만큼이나 내 가슴 속에서 타오른 분노가 나에게 그 만큼 용기가 되어가 더 내려갈 수 없는 절망의 끝에 떨어졌다 해도 여전히 태양은 머리위에 타오름을 이제 깨달을 그 시간이 왔다 운명을 피할 수 없다라면 그대여 그 운명에 당당하게 맞서라 소년의 여름에 찾아냈다 여기 영원히 부숴지지않는 다이아몬드 내가 사랑하고 지켜야 할 내 가슴속의 모든건 슬픔의 모습만이 아니라는 걸 모두 깨달을 그 시간이 왔다 운명을 피할 수 없다라면 그대여 그 운명에 당당하게 맞서라 소년의 여름에 찾아냈다 워 영원히 부숴지지않는 다이아몬드 운명을 피할 수 없다라면 그대여 그 운명에 당당하게 맞서라 소년의 여름에 찾아냈다 워 영원히 부숴지지않는 다이아몬드
1996.12.08~12.14,47,69220,그날들,김광석,노래이야기,1996,Folk,,그대를 생각하는 것만으로  그대를 바라볼수 있는 것만으로  그대의 음성을 듣는 것만으로도  기쁨을 느낄수 있었던 그날들  그대는 기억조차 못하겠지만  이렇듯 소식조차 알수 없지만  그대의 이름을 부르는 것만으로도  눈물이 흐르곤 했었던 그날들  잊어야 한다면 잊혀지면 좋겠어  부질없는 아픔과 이별할수 있도록  잊어야 한다면 잊혀지면 좋겠어  다시 돌아올수 없는 그대를  잊어야 한다면 잊혀지면 좋겠어  부질없는 아픔과 이별할수 있도록  잊어야 한다면 잊혀지면 좋겠어  다시 돌아올수 없는 그대를 그대를 생각하는 것만으로  그대를 바라볼수 있는 것만으로  그대의 음성을 듣는것만으로도  눈물이 흐르곤 했었던 그날들  그렇듯 사랑했던 것만으로  그렇듯 아파해야 했던 것만으로  그 추억속에서 침묵해야만 하는  다시 돌아올수 없는 그날들
1996.12.08~12.14,48,69619,위기의 여자,장혜진,Temptation,1996.04.01,Ballad,이승호,그대가 떠나간 어두워진 내방에 남겨진 흔적을 씻어내고 있어 하지만 그 향기 지워질 것 같진 않아  거울에 비춰진 내 모습에 또다시 누군가 낙서를 하기시작했어 이대로 나 혼자 여기 내버려두지마 야윈 내가슴에 흐르고 있는 슬퍼 힘겨운 그대 입맞춤 언제 다시 내게 올지도 모를 그대 기다림 힘겨워 차라리 한번의 사랑을 남김없이 내게 모두 태워버려 까맣게 그을린 나에게 다른 유혹은 없을 테니  거울에 비춰진 내 모습에 또다시 누군가 낙서를 하기시작했어 이대로 나 혼자 여기 내버려두지마 야윈 내가슴에 흐르고 있는 슬퍼 힘겨운 그대 입맞춤 언제 다시 내게 올지도 모를 그대 기다림 힘겨워 차라리 한번의 사랑을 남김없이 내게 모두 태워버려 까맣게 그을린 나에게 다른 유혹은 없을 테니 차라리 한번의 사랑을 남김없이 내게 모두 태워버려 까맣게 그을린 나에게 다른 유혹은 없을 테니
1996.12.08~12.14,49,71234,이기적이야,봄여름가을겨울,Banana Shake,1996.08,Rock,김종진,야 야 야  야 야 야  우리 처음 만난 날부터 이렇게 헤어져있는 날까지 나는 매일 너에게 너는 매일 나에게 자기에게 맞춰 주기만 원했어 나는 너보다 춤을 못춰 너는 나보다 술 못마셔 그래도 난 너에게 그래도 넌 나에게 맞추려 노력한적은 없잖아 이런걸 사랑이라 하지 모두 말하기를 내게 희생하는것이 바로 사랑이란 얘기 이기적이야- 이기적이야-- 이기적이야-- 이기적이야 이기적이야- 너도 그렇고-- 나도 그렇지- 이기적이야  때론 즐거운적도 있었지 때론 슬픈적도 있었지 하지만 난 네 기분에 그리고 넌 내 기분에 서로 맞추려고 한적은 없었어 이런걸 사랑이라 하지 모두 말하기를 내게 희생하는것이 바로 사랑이란 얘기 이기적이야- 이기적이야-- 이기적이야-- 이기적이야 이기적이야- 너도 그렇고-- 나도 그렇지- 이기적이야  이런걸 사랑이라 하지 모두 말하기를 내게 희생하는것이 바로 사랑이란 얘기 이기적이야- 이기적이야-- 이기적이야-- 이기적이야 이기적이야- 이기적이야-- 이기적이야-- 이기적이야 이기적이야- 너도 그렇고-- 나도 그렇지- 이기적이야 이기적이야- 이기적이야-- 이기적이야-- 이기적이야 이기적이야 이기적이야
1996.12.08~12.14,50,106885,아주 가끔은,신해철,정글스토리 OST,1996.05.18,Korean Movie,신해철,"1. 대낮에 길을 걷다보면 썰렁함을 느껴.  왜 그렇게 황당한 표정으로 날 쳐다들 보는지  난 집에 혼자 있을 때는 책도 봐.  내 할 일은 알아서 해왔다고 생각해.  물론 내 치마 길이가 좀 짧긴 짧지만,  내 색채 감각이 좀 대담하긴 하지만  그게 뭔 대수라고, 하늘이 무너지니,  난 그저 나 자신이 소중한 것 뿐이야. 뭘 봐  때로는 미쳐보는 것도 좋아 가끔 아주 가끔은  그렇게 놀란 표정하지 말고 눈을 감아  그댄 자신 안에 갇혀있어.  이젠 문을 열고 세상을 봐.  2. 한 평생 남의 눈치만 보면서 살아오다  아주 그게 뼛속까지 박혀버린 인종들 있잖니.  그 사람들의 공통적인 특징이 뭔지 알아,  남들도 자기처럼 살기를 바라는 거지, 쳇!  그렇게 산다고 누가 상주니,  또 누가 상준다고 그거 받아 어따 쓰니  난 아무 생각 없이 사는 걸로 보이겠지.  그게 너의 편견이고 교만이고 한계야, 잘가.  때로는 미쳐보는 것도 좋아 가끔 아주 가끔은  그렇게 뻣뻣하게 굴지 말고 일어나 봐.  그댄 자신 안에 갇혀있어.  이젠 문을 열고 세상을 봐.  그댄 자신 안에 갇혀있어.  이젠 문을 열고 세상을 봐.  이건 아주 무서운 일이야.  넌 마음 속 깊은 곳까지 세뇌되어 버렸어.  석회처럼 딱딱해진 너의 영혼을 해방시켜줘.  남을 위해 사는 건지 나를 위해 사는 건지  헷갈려 하지마.  평생에 후회하느니 한 번쯤 미친 척 하는 게 나아.    그댄 자신 안에 갇혀있어. 이젠 문을 열고 세상을 봐."
