time,rank,song_id,title,singers,album,date,genre,creator,lyric
1995.03.12~03.18,1,62462,잘못된 만남,김건모,김건모 3집 - 잘못된 만남,1995,Dance,김창환,난 너를 믿었던 만큼  난 내 친구도 믿었기에 난 아무런 부담없이 널  내 친구에게 소개 시켜줬고 그런 만남이 있은 후로 부터  우리는 자주 함께 만나며 즐거운 시간을 보내며  함께 어울렸던 것뿐인데 그런 만남이 어디부터  잘못됐는지 난 알 수 없는 예감에  조금씩 빠져들고 있을때쯤 넌 나보다  내 친구에게 관심을 더 보이며 날 조금씩 멀리하던 그 어느날 너와 내가 심하게 다툰  그날 이후로 너와 내 친구는 연락도 없고  날 피하는 것같아 그제서야 난 느낀거야  모든것이 잘못돼 있는걸 너와 내 친구는  어느새 다정한 연인이 돼있었지 있을 수 없는 일이라며  난 울었어 내 사랑과 우정을 모두  버려야 했기에 또다른 내 친구는 내 어깰  두드리며 잊어버리라 했지만 잊지  못할것 같아 너를 사랑했던 것만큼  난 내 친구도 믿었기에 난 자연스럽게 너와 함께  어울렸던 것뿐인데 어디부터 우리의  믿음이 깨지기 시작했는지 난 알지도 못한채 어색함을  느끼면서 그렇게 함께 만나온  시간이 길어지면 질수록 넌 내게서  조금씩 멀어지는 것을 느끼며 난 예감을 했었지 넌 나보다 내 친구에게 관심이 더 있었다는 걸 그 어느날 너와 내가 심하게 다툰  그날 이후로 너와 내 친구는  연락도 없고 날 피하는 것같아 그제서야 난 느낀거야  모든것이 잘못돼 있는걸 너와 내 친구는  어느새 다정한 연인이 돼있었지 있을 수 없는 일이라며  난 울었어 내 사랑과 우정을 모두 버려야 했기에 또다른 내 친구는 내 어깰  두드리며 잊어버리라 했지만 잊지  못할것 같아
1995.03.12~03.18,2,91487,날 떠나지마,박진영,Blue City,1994.09,Dance,"서윤정,박진영",멀어지는 너의 모습은 나의 눈물속에서 점점 더 번져가고 작아지는 널 느낄 수록 내마음속에서 넌 커져가고 하지만 난 괜찮아 내사랑이 떠나는 널 다시 내게 돌려줄걸 난 알아 난알아 날 떠나지마 가는 널 볼수가 없어 넌 떠나지만 난 뒷모습만 보며 서있어 다시 한번 말하지만 제발 날 떠나지마 내 사랑이 너의 오는 길을 비춰줄거야 oh baby 희미해진 너를 보면서 나의 그리움들은 커져가고 하지만 난 괜찮아 내 사랑이 떠나는 널 다시 내게 돌려줄걸 난 알아 난 알아 날 떠나지마 가는 널 볼수가 없어 넌 떠나지만 난 뒷모습만 보며 서있어 다시 한번 말하지만 제발 날 떠나지마 내 사랑이 너의 오는 길을 비춰줄거야 날 떠나지마 가는 널 볼수가 없어 넌 떠나지만 난 뒷모습만 보며 서있어 다시 한번 말하지만 제발 날 떠나지마 내 사랑이 너의 오는 길을 비춰줄거야 oh baby
1995.03.12~03.18,3,62098,슬픈 인연,015B,015B Big 5,1994,Ballad,정석원,멀어져 가는 저 뒷모습을  바라보면서  난 아직도 이 순간을 이별이라  하지 않겠네  달콤했었지 그 수많았던  추억 속에서  흠뻑 젖은 두 마음을 우린  어떻게 잊을까  아 다시 올거야  너는 외로움을 견딜수 없어  아 나의 곁으로 다시 돌아올거야  그러나 그 시절에 너를 또 만나서  사랑할 수 있을까  흐르는 그 세월에 나는 또 얼마나  많은 눈물을 흘리려나  아 다시 올거야 너는 외로움을  견딜수 없어  아 나의 곁으로 다시 돌아올거야  그러나 그 시절에 너를 또 만나서  사랑할 수 있을까  흐르는 그 세월에 나는 또 얼마나  많은 눈물을 흘리려나
1995.03.12~03.18,4,1698066,영원한 사랑 (With London Metropolitan Orchestra),이문세,Old And New,2002.02.09,Ballad,이영훈,너를 아직 생각해 구름 걷힌 저 하늘 가득히 푸르던 날 우리 지난 추억은 언제나 나를 기쁘게 하네 맺지 못한 슬픔은 나를 비웃지 운명이라고 그렇게도 사랑했던 기억은 언제나 나를 지켜주는데 내가 갈 수 없기에 그대 멀리서 나를 지켜봐 줘 이 세상 힘들 때면 그대의 한숨 어린 바람을 내가 느끼게 해 우린 다시 만나요 슬픈 약속을 모두 기억해 영원히 흘러간 사랑이여 자랑스럽게 너를 기억해  내가 갈 수 없기에 그대 멀리서 나를 지켜봐 줘 이 세상 힘들 때면 그대의 한숨 어린 바람을 내가 느끼게 해 우린 다시 만나요 슬픈 약속을 모두 기억해 영원히 흘러간 사랑이여 자랑스럽게 너를 기억해
1995.03.12~03.18,5,61240,내게로,장혜진,Before The Party,1994.11.01,Ballad,박창학,너무 서두르지마  견디기 힘이들때면 애써 따라오려 하지말고 오히려 더 천천히 그래 그렇게 다가와  내가 여기에서 기다릴게 숨이 찰땐 걸어오렴 힘이들 때 그랬던 것처럼 앞으로도 우린 아주 먼길을 가야만 해  서두르지마  함께 걸어가는 것  그것이 내겐 소중해  조금 늦는것쯤 상관없어  내가 지쳐있을 때 네가 기다려준 것처럼  내가 여기있어 힘을 내 봐 숨이 찰땐 걸어오렴  힘이 들때 그랬던 것처럼 앞으로도 우린 아주 먼길을 가야만 해  서두르지마  걱정마 기다리고 있어  이젠 멀지않아 조금만 더 힘을 내  내가 너의 두팔을 잡아줄 수 있도록  숨이찰 땐 걸어오렴 힘이들 때 그랬던 것처럼 앞으로도 우린 아주 먼길을 가야만 해  서두르지마  숨이찰 땐 걸어오렴 힘이들 때 그랬던 것처럼 앞으로도 우린 아주 먼길을 가야만 해  서두르지마
1995.03.12~03.18,6,171315,Main Title,최경식,모래시계 OST,1998,Drama,최경식,
1995.03.12~03.18,7,104941,끝난 건가요,김현철,네온속으로 노을지다 OST,1994.11.20,Korean Movie,김현철,한참 그대는 내게서 멀리 있군요 이제 우리는 끝난 건가요 더이상 없나요 우리둘은 맨 처음 사랑을 말한 걸 기억하나요 이제 우리는 이게 단가요 여기서 멎나요 우리둘은 힘들게 지내온 시간들이 난 아직도 시작인 것 같은데 아무도 이해할 순 없나요 그대여 내게 대답해줘요 정말 끝난 건가요 우리 우린 늘 같은 데 있어 지루했나요 이젠 우리는 그만인가요 여기서 됐나요 우리둘은 힘들게 지내온 시간들이 난 아직도 시작인 것 같은데 이런 나를 아무도 이해할 순 없나요 그대여 내게 대답해줘요 정말 끝난 건가요 우리 힘들게 지내온 시간들이 난 아직도 시작인 것 같은데 아무도 이해할 순 없겠죠 그대여 내게 대답해줘요 끝난 건가요 워 끝난 건가요 우린
1995.03.12~03.18,8,60807,이유같지 않은 이유,박미경,이유같지 않은 이유,1994.10.14,Dance,김창환,아무것도 필요없어 니가 나를 떠나려한다면  나를 사랑했단 말도 모두 연극처럼 느낄뿐야  마음이 변했다면 이유를 대지마~~예  내가 싫어진걸 난 알고있어  가식적인 말로 나를 위로하려고 하지마  이젠 기대하지않아  너의곁엔 다른 얼굴 다른모습 뿐야  다시는 나도 돌아가지 않아 너를위해 더이상 난  슬퍼지긴 싫어  무슨말을 하는거야 나는 너를 이해할수 없어  이유같지 않은 이유로 나를 설득하려고하지마  이젠 내맘속엔 너의 자린 없어...~~예  모두 버린거야 지금까지  내게 남겨진 슬픈 사랑의 모든 기억들  이젠 기대하지않아 너의곁엔 다른얼굴 다른모습뿐야  다시는 나도 돌아가지 않아 너를 위해 더이상 난  슬퍼지긴 싫어   이젠 기대하지않아  너의곁엔 다른얼굴 다른 모습뿐야  다시는 나도 돌아가지않아  너를 위해 더이상 난 슬퍼지긴싫어   이젠 기대하지않아  너의곁엔 다른얼굴 다른 모습뿐야  다시는 나도 돌아가지않아 너를 위해 더이상 난 슬퍼지긴싫어  빠밤~~~~
1995.03.12~03.18,9,58937,그 후로 오랫동안,신승훈,그 후로 오랫동안...,1994.09.01,Ballad,신승훈,우연인지 몰라도 네가 눈물 흘릴 때마다 하늘에선 비가 내렸어 익숙해져버린 난 그냥 너의 슬픈 눈을 보면서 차가운 한마디 울지마 하지만 이제 나도 그때처럼 비가 내리면 눈물을 흘리고 있어 내게 너무나도 소중한 네가 내 곁에 없다는 이유로 난 비와 함께 울고 있었던 거야 그 후로 오랫동안 비가 왔어 내리는 비만큼 나도 울었어 하지만 더 견딜 수가 없는 건 어디선가 너도 나처럼 울고 있다는 생각에 하늘이여 나를 도와줘 그렇게 울고 있지 말고 내 님이 있는 곳 너는 쉽게 알 수 있잖아 내가 살아있는 동안에 한번만이라도 그대를 우연일지라도 너를 믿을게 너의 눈물 맞으며  그 후로 오랫동안 비가 왔어 내리는 비만큼 나도 울었어 하지만 더 견딜 수가 없는 건 어디선가 너도 나처럼 울고 있다는 생각에 하늘이여 나를 도와줘 그렇게 울고 있지 말고 내 님이 있는 곳 너는 쉽게 알 수 있잖아 내가 살아있는 동안에 한번만이라도 그대를 우연일지라도 너를 믿을게 너의 눈물 맞으며
1995.03.12~03.18,10,1622501,사랑을 할꺼야,녹색지대,사랑을 할거야,1994.01.01,Ballad,이성환,이젠 나도 널 잊겠어  너무 힘이 들잖아 원하는 대로 해줄 순 있지만 난 더 이상 해줄게 없어 그런 나를 욕하지마 후회 할지도 몰라 철없는 생각 시간이 흐르면 그땐 이미 늦은걸 모든 것을 주는 그런  사랑을 해봐 받으려고만 하는 그런  사랑말고 너도 알고 있잖아 끝이 없는 걸 서로  참아야만 하는 걸 사랑을 할거야 사랑을 할거야 아무도 모르게 너만을 위하여 나를 지켜봐줘 나를 지켜봐줘 아무도 모르는 사랑을 모든 것을 주는 그런  사랑을 해봐 받으려고만 하는 그런 사랑말고 너도 알고 있잖아 끝이 없는 걸 서로 참아야만  하는 걸 사랑을 할거야 사랑을 할거야 아무도 모르게 너만을 위하여 나를 지켜봐줘 나를 지켜봐줘 아무도 모르는 사랑을 사랑을 할거야 사랑을 할거야 아무도 모르게 너만을 위하여 나를 지켜봐줘 나를 지켜봐줘 아무도 모르는 사랑을
1995.03.12~03.18,11,607938,너의 곁에 있고 싶어,신효범,5집,1995,Ballad,신효범,그냥 그대로 있어 떠나지 말아 네가 떠나면 나는 혼자인데 떠나는 널 보며 울고싶지는 않아 잠시 너의 곁에 있게 해줘  너를 보내야만 하는 이 깊은 슬픔속에서 돌아서는 너를 위해 이렇게 웃고 있잖아  너는 떠나겠지 아무 일 없는 듯 우리 사랑마저 없던 것처럼  너를 보내야만 하는 이 깊은 슬픔속에서 마지막 이 순간까지 널 위해 웃고 있잖아  너는 떠나겠지 아무 일 없는 듯 우리 사랑마저  잊은 것처럼
1995.03.12~03.18,12,91124,어떤 그리움,이은미,이은미 2,1993.07,Ballad,오승은,그대를 바라보면 포근함을 느꼈지 아직도 나에겐 남아 있는 그대의 모습 나의 마음 고요하게 해 지나간 기억 속에 그대 모습 생각나 견딜 수가 없는 혼자만의 외로움들이 나의 마음 허무하게 해 언젠가 그대는 눈물을 흘리며 내게 말했었지 사랑은 슬픈 이별보다 아픈 거라고 하지만 내 님 떠나고 이젠 나 홀로 남아 그대의 앞길을 비추네  지나간 기억 속에 그대 모습 생각나 견딜수가 없는 혼자만의 외로움들이 나의 마음 허무하게 해 언젠가 그대는 눈물을 흘리며 내게 말했었지 사랑은 슬픈 이별보다 아픈 거라고 하지만 내 님 떠나고 이젠 나 홀로 남아 그대의 앞길을 비추네 언젠가 그대는 눈물을 흘리며 내게 말했었지 사랑이 슬픈 이별보다 아픈거라고 하지만 내 님 떠나고 이젠 나 홀로 남아 그대의 앞길을 비추네
1995.03.12~03.18,13,91484,겨울그림,이승철,The Secret of Color,1994.09.24,Ballad,이승철,겨울오면 내집앞 문틈에 가득 눈이 덮혀와 throw the night 잠들은 아이들 따스하게 해 겨울오면 새벽아침 손길 안개처럼 감싸와 in the morning 잠든척 하는 꼬마아일 깨우려하네 이런 아름다운 풍경속을 거닐고파 때론 외롭기도 우울하기도 할꺼야 이런 아름다운 풍경들을 그리고파 지워지지 않는 겨울그림  겨울은 말없는 나에게 뭔가 속삭여주네 여름오면 날다시 찾아 눈꽃처럼 내게 올꺼냐고  이런 아름다운 풍경속을 거닐고파 때론 외롭기도 우울하기도 할꺼야 이런 아름다운 풍경들을 그리고파 지워지지 않는 겨울그림  겨울은 말없는 나에게 뭔가 속삭여주네 여름오면 날다시 찾아 눈꽃처럼 내게 올꺼냐고 winter is one when never your by my side  winter is one when never your by my side  winter is one when never your by my side  winter is one when never your by my side forever season you be mind
1995.03.12~03.18,14,170430,의미없는 시간,최민수(Flyger),Two Men Story,1994.11,Rock,,난 항상 끝으로 걸어왔지 아픈 기억의 사람들이 나를 만들었어 난 삶의 모든걸 잃었었지 다른 무엇도 내 마음을 위로할 순 없었어 오 난 내 남겨진 시간들을 흘러가는 대로 개의치 않고 싶어서 매일 힘겹게 다가선 하루 이미 죽어있는 가슴에 의민 필요없어 그렇게 살아가다가 마지막 순간에 난 잊었던 너를 찾아 떠나려 했어 늦진 않겠지 랄라라 라라 랄라라 랄라라 라라 랄라라 너의 모든것은 나의 전부가 된거야 랄라라 라라 랄라라 랄라라 라라 랄라라 너를 느끼는 바로 지금 살아있는 나를 느끼지  오 긴 이 시간이 지나간 뒤 다시 처음으로 되돌아 갈 수 있다면 쉽게 마음을 열지는 않아 내게 다가서는 만큼만 나를 보일거야 그렇게 살아가다가 마지막 순간에 난 잊었던 너를 찾아 떠나려 했어 늦진 않겠지 랄라라 라라 랄라라 랄라라 라라 랄라라 너의 모든것은 나의 전부가 된거야 랄라라 라라 랄라라 랄라라 라라 랄라라 너를 느끼는 바로 지금 살아있는 나를 느끼지 너를 이처럼 간절히 원하고 또 바라게 될줄은 몰랐어 너의 모든 것은 나의 전부가 된거야 사랑이 얼마나 사람을 더욱 외롭게 하는지 알지만 너를 느끼는 바로 지금 살아있는 나를 느끼지
1995.03.12~03.18,15,1839375,수퍼맨의 비애 (Feat. Proud Marry),DJDOC,슈퍼맨의 비애,1994.11,Rap / Hip-hop,,슈퍼맨 슈퍼맨 슈퍼맨 헤이 홉  어젯밤 우리 아빠 엄마 부부 싸움에 잠을 잘수가 없네 요리조리 따지시는 우리엄마 아빠에게 뭐라고 쉴새없이 따다다 다다다다 요 변명도 제대로 못한 우리아빠 무슨 잘못하신게 아닐까 걱정이네 무서운 우리엄마 뭐가 불만이실까 엄마가 필요한건 혹시 슈퍼맨 선물을 준 숫자만큼 날 사랑할까 아닐꺼야 난 너에게 지쳐 가고있어  슈퍼맨 슈퍼맨 슈퍼맨  처음 만나 운전면허 없다고 넌 나를 무지하게 구박했지 헤이 홉 노래방에 같이가서 음치라고 비웃던 니가 나는 무지하게 미웠어 넌 나에게 바라는게 왜 그리 많아 무엇을 더 해야하지 지쳐가고있어  슈퍼맨 슈퍼맨 슈퍼맨 헤이 홉  선물을 준 숫자만큼 날 사랑할까 아닐꺼야 난 너에게 지쳐 가고있어 넌 나에게 바라는게 왜 그리 많아 무엇을 더 해야하지 지쳐가고있어
1995.03.12~03.18,16,991976,세상은 나에게,김원준,Live: 나에게 떠나는 여행,1996.09.06,Dance,채정은,내가 웃는 등 뒤엔 고독이 따르겠지만 그건날 오히려 더 강하게 하지 기다리는 이에겐 저절로 돌아오는건 없을껄 일어나 먼져 부딪쳐 보는거야  수많은 질문과 함께 자란 내 꿈에 조그만 날개를 이제는 달아 줄때야 그렇지만 떨어질 꿈이 두려워 세상에 나설 그 준비가 필요해 한때는 내가 만든 어두움 속에 스스로 빠져 울기도 했지만 더이상 나 자신에게 지지만은 않을꺼야 지금부터난 다른 내가 되어야해 내가 웃는 등 뒤엔 고독이 따르겠지만 그건날 오히려 더 강하게 하지 기다리는 이에겐 저절로 돌아오는건 없을껄 일어나 먼져 부디쳐 보는거야  한때는 내가 만든 어두움 속에 스스로 빠져 울기도 했지만 더이상 나 자신에게 지지만은 않을꺼야 지금부터난 다른 내가 되어야해 내가 웃는 등 뒤엔 고독이 따르겠지만 그건날 오히려 더 강하게 하지 기다리는 이에겐 저절로 돌아오는건 없을껄 일어나 먼져 부딪쳐 보는거야 하지만 난 아직 해답과는 또다른 현실에 많이 당황할 나인걸 더구나 세상은 나에게 바로 걸으란 충고뿐 누구도 가르쳐줄 사람은 없어 내가 웃는 등뒤엔 고독이 따르겠지만 그건날 오히려 더 강하게 하지 기다리는 이에겐 저절로 돌아오는건 없을껄 일어나 먼져 부디쳐보는 거야
1995.03.12~03.18,17,1722639,학창시절,이현석,학창시절,1994.08.29,Rock,이현석,무거운 가방을 어깨에 둘러매고 피곤한 눈으로 등교하면 수업은 왜 그렇게 많이 있는지 든든한 아침을 먹고온지 몇시간  지나지 않았는데 왜 그렇게 뱃속이 허전해 지는걸까 가끔은 무거운 눈을 참기가 힘들어 나도 몰래 꿈속으로 가 무서운 선생님의 꾸중으로 힘든 하루 보냈지 그래 그때는 몰랐었지만 너무나 아름다운 추억들 다시 돌아갈수 없는 학창시절을 나는 사랑할거야 너무나 많은걸 배우기에 제대로  이해하지 못하고 있는데도 시험은 왜 그렇게 많이 보는지 특별히 잘못한게 없는데도 왜 그리 선배들 앞으로 지나갈때면 항상 겁이 났을까 흘리던 땀을 식혀주던 책받침엔 예쁜 배우들이 웃지만 밤새워 끝낸 숙제들은 모두 어디 가버린걸까 그래 그때는 몰랐었지만 너무나 아름다운 추억들 다시 돌아갈수없는 학창시절을 나는 사랑할거야  그래 그때는 몰랐었지만 너무나 아름다운 추억들 다시 돌아갈수없는 학창시절을 나는 사랑할거야 그래 그때는 몰랐었지만 너무나 아름다운 추억들 다시 돌아갈수없는 학창시절을 나는 사랑할거야
1995.03.12~03.18,18,59936,눈이 슬픈 그대 -처음 만난 그때로,오태호,"허무, 그 진실한 시작, 그 자유로움",1994.11,Ballad,오태호,나 그대를 알고 사랑은 아님을 알았지만  언제나 그랬듯이 내 외로움은 미련을 만들지  그 누구도 서로 이별을 말하지 않았지만  조금씩 시작됐던 멀어짐을 나는 알고 있었지 사랑은 비단위로 깨어진 유리조각같아 그저 아름답기만 하지는 않은걸 조그만 너의 표정속에서 울고웃던 그때가 문득 기억이나 스산한 바람부는 가을 그 날로 다시 돌아가고 싶어 눈이 슬픈 그대를 처음 만난날 젖은 눈을 감추고 가득 안기며 날 지켜 달라고 하던 그때 그때  사랑은 장미꽃에 숨겨진 가시같은 것을 나를 사랑한다던 너의 그 말처럼 조그만 너의 표정속에서 울고웃던 그때가 문득 기억이나 스산한 바람부는 가을 그 날로 다시 돌아가고 싶어 눈이 슬픈 그대를 처음 만난날 나만의 욕심으로 멀어진 그대 많은걸 바랬던 그때 그때 그때
1995.03.12~03.18,19,1876457,또 다른 시작,서지원,Seo Ji Won,1994.10.10,Ballad,오태호,오랜만이란 어색한 인사 얼마나 너를 다시 보고파했는데 잠시도 그렇게 말을 못하고 커피잔만 매만지고 있네 그리워했어 너의 모든걸 니가 나를 그리워 해왔던 것만큼 잊으려할�� 이미 서로에게 길들여져 있었지 바람속에 깨어나던 추억 추억 서글픈 마음뿐인데 쓸쓸한 마음뿐인데 미안함에 방황하던 그때 그때 여린 너의 가슴 가득한 그 상처 때문에 안녕안녕 인사뒤로 널 떠나갈 때를 아직도 되내이며 울먹이는 널 위해서 누구에게도 준 적없는 내 모든 꿈을 너에게 맡길게  바람속에 깨어나던 추억 추억 서글픈 마음뿐인데 쓸쓸한 마음뿐인데 미안함에 방황하던 그때 그때 여린 너의 가슴 가득한 그 상처 때문에 안녕안녕 인사뒤로 널 떠나갈 때를 아직도 되내이며 울먹이는 널 위해서 누구에게도 준 적없는 나의사랑을 너에게 맡길게
1995.03.12~03.18,20,91129,결론,황세옥,결론/몰래 감춰진 눈물,1994.06.01,Dance,이성재,때로는 가깝게 느껴지고 한편은 멀게도 느껴지고 애인이라 하기엔 내가 너무 손해같고 그냥 친구라 하기엔 우린 너무 친하지만 너에게서 다른 여자 애길듣고 살며시 질투도 느껴지고 며칠전 나의 미팅파트너 얘기하면 넌 못들은 체해도 너의 마음 나도 알아 나는 어쩜 너를 사랑하는 걸까 너도 속맘은 나를 사랑하는걸까 이런 아리송한 너와 나의 사일 이젠 정리해야지 하면(정리안돼) 농담 반 진담 반으로 얘기해 우린 친구와 연인의 중간쯤  주말엔 극장도 같이가고 모르는 척 난 네게 기대지만 애인이라 하기엔 그 느낌이 너무작고 그냥친구라 하기엔 그 느낌이 너무 커 어쩌다 너의 전화 멀어지면 살며시 배신감 느껴지고 내가 먼저 전화하면 넌 담담한 척해도 당황하는 그 목소리 너의 마음 나도 알아 나는 어쩜 너를 사랑하는 걸까 너도 속맘은 나를 사랑하는 걸까 이런 아리송한 너와 나의 사일 이젠 결론 내야지하면(결론없어) 농담 반 진담 반으로 얘기해 우린 친구와 연인의 중간쯤 나는 어쩜 너를 사랑하는 걸까  너도 속맘은 나를 사랑하는 걸까 이런 아리송한 너와 나의 사일 이젠 정리해야지 하면(정리안돼) 농담 반 진담 반으로 얘기해 우린 친구와 연인의 중간쯤 친구와 연인의 중간쯤
1995.03.12~03.18,21,38757,넌 할 수 있어,강산에,나는 사춘기,1994,Rock,"강산에,나비",후회하고 있다면  깨끗이 잊어버려   가위로 오려낸 것처럼  다 지난 일이야   후회하진 않는다면  소중하게 간직해   언젠가 웃으며  말할 수 있을 때까지   너를 둘러싼  그 모든 이유가   견딜수 없이  너무 힘들다해도  너라면 할 수 있을거야  할 수가 있어  그게 바로 너야   굴하지 않는 보석같은  마음 있으니   어려워마 두려워마  아무것도 아니야   천천히 눈을감고  다시 생각해 보는 거야   세상이 너를  무릎 꿇게 하여도   당당히 네 꿈을  펼쳐 보여줘  너라면 할 수 있을꺼야  할수가 있어  그게 바로 너야  굴하지 않는 보석같은  마음있으니  할수 있을꺼야  할수가 있어  그게 바로 너야  굴하지 않는 보석같은  마음있으니  굴하지 않는 보석같은 마음있으니
1995.03.12~03.18,22,66104,미인,봄여름가을겨울,Mystery,1995.02,Rock,신중현,한번 보고 두번 보고 자꾸만 보고싶네  아름다운 그 모습을 자꾸만 보고싶네  그 누구나 한번 보면 자꾸만 보고있네  그 누구의 애인인가 정말로 궁금하네  모두 사랑하네 나도 사랑하네 모두 사랑하네 나도 사랑하네  나도 몰래 그 여인을 자꾸만 보고있네 그 누구도 넋을 잃고 자꾸만 보고있네 그 누구나 한번 보면 자꾸만 보고있네 그 누구의 애인인가 정말로 궁금하네  모두 사랑하네 나도 사랑하네 모두 사랑하네 나도 사랑하네
1995.03.12~03.18,24,1700422,G Cafe,소방차,Again,1994.11.01,Dance,,
1995.03.12~03.18,25,62441,기다릴줄 아는 지혜,이덕진,기다릴줄 아는 지혜,1994.11.25,Rock,한경혜,기다릴줄 아는 지혜를 사람들은 폐배라고 하지 돌릴 수 없는 삶을 연습하듯 살 수 없어 욕망을 이루기 보다는 내 것 하날 선택하고 싶어 다음 기회를 위해서 아쉬움 삼켰던거야 다시 오지 않는 안타까운 많은 기회도 있었지 너를 잃고 살아가는 내 주변에 모든 일 난 자신했어 떠난 뒤에 나를 그리워할 것을 너를 잃고 내 전부를 잃어버린 나였어  기다릴줄 아는 지혜를 사람들은 폐배라고 하지 돌릴 수 없는 삶을 연습하듯 살 수 없어 욕망을 이루기 보다는 내 것 하날 선택하고 싶어 다음 기회를 위해서 아쉬움 삼켰던거야 다시 오지 않는 안타까운 많은 기회도 있었지 너를 잃고 살아가는 내 주변에 모든 일 난 자신했어 떠난 뒤에 나를 그리워할 것을 너를 잃고 내 전부를 잃어버린 나였어 다시 오지 않는 안타까운 많은 기회도 있었지 너를 잃고 살아가는 내 주변에 모든 일 난 자신했어 떠난 뒤에 나를 그리워할 것을 너를 잃고 내 전부를 잃어버린 나였어
