time,rank,song_id,title,singers,album,date,genre,creator,lyric
1998.06.07~06.13,1,78633,나나나,유승준,For Sale,1998.05.01,Dance,이승호,난 그냥 되는 대로   살았었지   간섭받기 싫어 그냥 피했던거지   내일의 두려움도 필요 없어   그런 막막함에 내 시간만   좀먹었었어   그러다 내 어릴 적 꿈을 보았었지   거친 바람속 내 어릴 적   노랠 들었지   그래 이건 아니었어   용서할 수 없어   다시 나를 살린 이 노래를   불렀었지   기억하고 있니 어릴 적   예쁜 꿈들을   모두 다 이룰 수 있을 것   같던 시간들   소망을 꿈꾸며 주문을 외웠지  시간이 지나고 세상에   지쳐 갈 때쯤   꿈은 그저 꿈일 뿐인걸   알게 됐지만   어릴 적 주문을 아직 노래하네  언제나 힘들고 지칠때   날 일으켜주던 꿈이   가득한 이 노랠했어   나나나 나나나   나나나 나나나   나나나 나나나   나나나 나나나   어두워진 가리워진 나의   길을 밝혀주는   이 노래를 함께 해봐   어느 샌가 내게 찾아온   사랑을 위해   그렇게도 나를 애태운   그대를 위해   영원을 꿈꾸며 주문을 외웠지  피해갈수 없는 현실에   지쳐갈때쯤   무거워져 가는 걸음에   힘겨울때면   어릴적 주문을 노래 하곤 했지  언제나 힘들고 지칠때   날 일으켜주던 꿈이 가득한   이 노랠했어   나나나 나나나   나나나 나나나   나나나 나나나   나나나 나나나   어두워진 가리워진 나의 길을   밝혀주는   이 노래를 함께 해봐   자꾸만 어긋나 버리고   퇴색해 버리는 내 꿈을 지키고   싶었어 이기고 싶었어   누구도 가식의 가면을   버리지 않으려   끝끝내 발버둥 칠 때에 또   감추려 할때에   하늘에 새긴 내 어린 꿈들이   내 귓가에 들려준 이 노래 내   순수의 노래   키작은 아이의 함성과   내 사랑이 내게 들려준 이 노래   지켜갈 이 노래   언제나 힘들고 지칠때   날 일으켜주던 꿈이   가득한 이 노랠했어   나나나 나나나   나나나 나나나   나나나 나나나   나나나 나나나   초라하게 변해버린 나의   꿈을 밝혀주는   이 노래를 함께해봐   나나나 나나나  나나나 나나나  나나나 나나나  나나나 나나나  나나나 나나나  나나나 나나나  나나나 나나나  나나나 나나나
1998.06.07~06.13,2,1839686,믿음,이소라,슬픔과 분노에 관한,1998.05.01,Ballad,이소라,힘든가요 내가 짐이 됐나요 마음을 보여줘요 안된대도 아무 상관없어요 내 마음만 알아줘요 다른 사람 친한 그댈 미워하는 나의 사랑이 모자랐나요 늘 생각해요 이것만 기억해요 우리가 헤어지면 다시는 이런 사랑 또 없을테니 내게 힘이 돼 줘요 난 기다려요 그대 난 영원해요 우는 내가 많이 지겨웠나요 그래요 이해해요 많은 밤이 지난 그대 후회되면 다시 내게로 돌아올테
1998.06.07~06.13,3,38388,착한 사랑,김민종,애 (愛),1998,Ballad,김민종,믿어지지 아니 믿을 수 없는 지금 이 순간을 기억해야 하나 사랑하고 있는 그대가  내 곁에서 떠나는 모습을 미안해서 내게 아무 말 없이 나를 버린거라 생각하고 나니 이해할 수 있어 그대를  사랑하니까 내 사랑이니까 울고있는 나는 내게 말했지 편안하게 지내야 한다고 나를 떠난 그대가 행복 할 수 있도록 어려워도 그래야 한다고 그대여 난 오늘도 너무 괴로워 하는 나를 달래보고 있지만 더 이상 견딜 수 없는 아픔에 살아 가는게 너무 힘들지만 하지만 사랑해요 난 그댈 울고있는 나는 내게 말했지 편안하게 지내야 한다고 나를 떠난 그대가 행복 할 수 있도록 어려워도 그래야 한다고 그대여 난 오늘도 너무 괴로워 하는 나를 달래보고 있지만 더 이상 견딜 수 없는 아픔에 살아 가는게 너무 힘들지만 하지만 사랑해요 난  그대여 난 오늘도 너무 괴로워 하는 나를 달래보고 있지만 더 이상 견딜 수 없는 아픔에 살아 가는게 너무 힘들지만 하지만 사랑해요 난 그댈
1998.06.07~06.13,4,78351,왜불러,디바,Snappy Diva`s Second Album,1998.04,Dance,이건우,왜 불러 왜 불러 왜 불러  왜 아픈 날  왜 불러 왜 불러 왜 불러  왜 아픈날  두팔을 벌려 나를 꼬옥 안아줘  저 푸른 바다 밑 파란 물결속에  떠 다니는 외로움  누가 날 불러 여기까지 왔는지  더 이상 나도 날  사랑할 수조차 없다는걸 아는데  뒤에서 나를 부르는건 누구야  다가 오지마 그럴순 없어  날 내버려 둬 다시 생각해  그 누구도 날 진정 사랑해준  사람 없었어  난 꿈이 없어 내 손을 잡아봐  날 잡은건 너의실수야  나보다 더 좋은 여잔 얼마든지  있는데  왜 불러 왜 불러 왜 불러 왜 아픈날  왜 불러 왜 불러 왜 불러 왜 아픈날  순간이 아닌 영원할수 있는  그런 사랑을 원해  왜 불러 왜 불러 왜 불러 왜 아픈날  왜 불러 왜 불러 왜 불러 왜 아픈날  두팔을 벌려 나를 꼬옥 안아줘  다가 오지마 그럴순 없어  날 내버려 둬 다시 생각해  그 누구도 날 진정 사랑해준  사람 없었어  난 꿈이 없어 내 손을 잡아봐  날 잡은건 너의실수야  나보다 더 좋은 여잔  얼마든지 있는데  왜 불러 왜 불러 왜 불러 왜 아픈날  왜 불러 왜 불러 왜 불러 왜 아픈날  순간이 아닌 영원할수 있는  그런 사랑을 원해  왜 불러 왜 불러 왜 불러 왜 아픈날  왜 불러 왜 불러 왜 불러 왜 아픈날  두 팔을 벌려 나를 꼬옥 안아줘  그렇게 우린 시작했고  결혼하기로 했어  저 바다가 너를 내게 보내 준거야
1998.06.07~06.13,5,437146,내 낡은 서랍 속의 바다,패닉,Sea Within,1998.05,Rock,이적,내 바다 속에는 깊은 슬픔과 헛된 고민들 회오리치네 그 바다 위에선 불어닥치는 세상의 추위 맘을 얼게 해 때로 홀로 울기도 지칠 때 두눈 감고 짐짓 잠이 들면 나의 바다 그 고요한 곳에 무겁게 내려가 나를 바라보네 난 이리 어리석은가 한치도 자라지 않았나 그 어린 날의 웃음을 잃어만 갔던가 초라한 나의 세상에 폐허로 남은 추억들도 나 버릴 수는 없었던 내 삶의 일부인가 나 어릴 적 끝도 없이 가다 지쳐버려 무릎 꿇어버린 바다 옛날 너무나도 고운 모래마다 이젠 모래 위에 깊은 상처 하나 행복하고 사랑했던 그대와 나 생각만으로 웃음짓던 꿈도 많아 그런 모든 것들 저 큰 파도에 몸을 맡겨 어딘가 가더니 이젠 돌아오지 않아 바다 앞에 내 자신이 너무 작아 흐르는 눈물 두 손 주먹 쥐고 닦아 많은 꿈을 꾸었는대 이젠 차마 날 보기가 두려워서 그냥 참아 그 때 내가 바라보던 것들 아마 볼 수 없겠지만 그래도 눈을 감아 나의 낡은 서랍 속의 깊은 바다 이젠 두 눈 감고 다시 한 번 닫아 때로 홀로 울기도 지칠 때 두눈 감고 짐짓 잠이 들면 나의 바다 그 고요한 곳에 무겁게 내려가 나를 바라보네 난 이리 어리석은가 한치도 자라지 않았나 그 어린 날의 웃음을 잃어만 갔던가 초라한 나의 세상에 폐허로 남은 추억들도 나 버릴 수는 없었던 내 삶의 일부인가 나 어릴 적 끝도 없이 가다 지쳐버려 무릎 꿇어버린 바다 옛날 너무나도 고운 모래마다 이젠 모래 위에 깊은 상처 하나 행복하고 사랑했던 그대와 나 생각만으로 웃음짓던 꿈도 많아 그런 모든 것들 저 큰 파도에 몸을 맡겨 어딘가 가더니 이젠 돌아오지 않아 바다 앞에 내 자신이 너무 작아 흐르는 눈물 두 손 주먹 쥐고 닦아 많은 꿈을 꾸었는대 이젠 차마 날 보기가 두려워서 그냥 참아 그 때 내가 바라보던 것들 아마 볼 수 없겠지만 그래도 눈을 감아 나의 낡은 서랍 속의 깊은 바다 이젠 두 눈 감고 다시 한 번 닫아
1998.06.07~06.13,6,481565,별이 되어,임창정,Lim Chang Jung 4th (늑대와 함께 춤을),1998,Ballad,이도연,어디에선가 날 보고 있을까  냉정하게 떠나간 너는  변명도 너는 하지 않았어  그런 너를 난 미워 했는데  믿을 수 없는 편지를 받았어  젖어있는 하얀 종이에  난 이미 세상에 없을 거라고  나를 위해 꼭 행복하라고  단 한번 널 사랑했던  내가 걱정돼서 아파하며   너 떠나갔니  용서해 널 몰랐던 날  다신 너를 혼자 보내진 않을께  하늘의 별이 되어 기다려줘  눈을 감을 때 날 생각했었니  널 미워하고 있던 나를  너 없는 아침을 볼 때마다  살아있는 난 아파하겠지  하루가 지나고나면  널 만날 하루가 더 가까워   오는 거겠지  용서해 널 몰랐던 날  다신 너를 혼자 보내진 않을께  하늘의 별이 되어 기다려줘  하루가 지나고나면  널 만날 하루가 더 가까와  오는 거겠지  용서해 널 몰랐던 날  다신 너를 혼자 보내진 않을께  하늘의 별이 되어 기다려줘
1998.06.07~06.13,7,78002,하나의 사랑,박상민,The Road,1998.02,Ballad,조은희,가슴속에 차오르는 그대  이렇게 외면 하지만 나는 이미 알고있잖아  그댈 원하고 있어  날 바라보는 그대 눈빛 속에  영원히 머물고 싶어  함께 할 수 없는 사랑을  이젠 견딜 수가 없어 다가갈수록 멀어지는  그대 뒷모습 바라보고 있어  돌아서서 젖어오는 슬픔을  그댄 알 수 없을꺼야  서로 잠시 멀리 있다해도  이제는 느낄수 있어 오직 내가 꿈꿔왔던건  그대라는 단 하나의 사랑  다가갈수록 멀어지는  그대 뒷모습 바라보고 있어  돌아서서 젖어오는 슬픔을 그댄 알 수 없을꺼야 그댄 알 수 없을 꺼야
1998.06.07~06.13,8,1877126,사랑을 위하여,김종환,사랑을 위하여,1997.06.13,Adult Contemporary,김종환,이른 아침에 잠에서 깨어 너를 바라볼 수 있다면 물안개 피는 강가에 서서 작은 미소로 너를 부르리 하루를 살아도 행복할 수 있다면 나는 그 길을 택하고 싶다 세상이 우리를 힘들게 하여도 우리들은 변하지 않아 너를 사랑하기에 저 하늘 끝에 마지막 남은 진실 하나로 오래 두어도 진정 변하지 않는 사랑으로 남게 해주오 내가 아플 때보다 네가 아파할 때가 내 가슴을 철들게 했고 너의 사랑 앞에 나는 옷을 벗었다 거짓의 옷을 벗어버렸다 너를 사랑하기에 저 하늘 끝에 마지막 남은 진실하나로 오래 두어도 진정 변하지 않는 사랑으로 남게 해주오 너를 사랑하기에 저 하늘 끝에 마지막 남은 진실 하나로 오래 두어도 진정 변하지 않는 사랑으로 남게 해주오 사랑으로 남게 해주오
1998.06.07~06.13,9,78713,Never Ending Story,R.ef,Forever,1998.05.01,Dance,이승호,"여기저기 하루종일 너를 찾아 헤매어 봐도 니 모습 간데없고 추억들만 나를 반겼어 이렇게 언제까지 견딜지는 모르겠지만 자꾸 무거워만 가는 나의 힘든 발걸음 이제는 모든걸 끝내고 싶어 찾을 수 없는 널 찾는 헤매임 막연한 기다림,끝없는 방황을 이제는 지쳤어 끝내 버릴꺼야 너없는 허전함 이젠 괜찮아 모든게 조금씩 익숙해진걸 꿈 속의 니 모습 이제는 더 이상 눈물이 되지는 않을 테니까 비오는 거리도 슬프지 않은 건 추억도 이제 날 떠나나봐 널 향한 그리움도 희미해져 이젠 널 잊을 수 있어 이렇게 사랑은 끝나는 가봐 기억도 추억도 지워지나봐 내 곁에 외로움 그 속에서도 너는 조금씩 흐려지니까  빨리 끝나라 끝나라 끝나버려 너의 모든걸 수월하게 잊고 싶어 널 만나지 않았던 그때로 돌아가 또 다른 사랑도 하고싶어 얼마나 오래 걸릴까 얼마나 힘이 들어야되나 아마 그렇게 쉽진 않을꺼야 시간이 흘러도 그리움은 더하니까 너 아닌 다른걸 채우고 싶어 니 모습 이젠 다 잊었으니까 한번쯤 또 다른 사랑도 꿈꿨어 하지만 거기엔 다시 또 니모습 아직도 미련이 남았었나봐 누구를 만나도 편하지 않아 왜 자꾸 너 하고 비교를 하는지 아무도 널 대신 할 순 없었어 선명한 니 눈빛 모두 다 지워도 차마 나 잊을 수 없는 것은 네 이름 만으로도 눈물이 될 이루지 못한 내 사랑 이대로 사랑은 계속되나봐 혼자도 사랑은 할 수 있나봐 예전의 두려움 이제는 없어 다시 또 이별 없을 테니까 이대로 사랑은 계속 되나봐 혼자도 사랑은 할 수 있나봐 예전의 두려움 이제는 없어 다시 또 이별 없을테니까"
1998.06.07~06.13,10,77694,애상,쿨(COOL),Cool 4,1998.04,Dance,이승호,알잖아 너를 이토록   사랑하며 기다린 나를   뭐가 그리 바쁜지 너무   보기 힘들어   넌 도대체 뭐하고 다니니   그게 아냐 이유는 묻지마   그냥 믿고 기다려 주겠니   내게도 사랑을 위한 시간이   필요해 널 받아들일수 있게   일부러 피하는거니   삐삐쳐도 아무 소식없는 너   싫으면 그냥 싫다고 솔직하게   말해봐   말리지마 내 이런 사랑을   너만 보면 미칠것 같은 이맘을   누가 알겠어 웨딩드레스 입은   네 곁에 다른 사람이   난 두려워 나보다 더 멋진   그런 남자 네가 만날까봐   아니야 그렇지 않아 정말   너 하나뿐야 속는셈 치고   한번 믿어봐   내눈에는 너무 이쁜 그녀를   자랑스레 친구에게 보여줬지   친구 내게 미안하다며   그녀 얘길 싸그리 다했지   그녀 많은 남자중에 친구만도   여러명이야   말도안돼 믿을 수없어 혹시 쌍둥이   우연히 너를 보았지   다른 남자 품안에 너를   한번도 볼수 없었던 너무   행복한 미소   내 사랑은 무너져 버렸어   그게 아냐 변명이 아니라   그 남자는 나완 상관없어   잠시 나 어지러워서 기댄것  뿐이야  날 오해하진 말아줘  나역시 많은 여자들  만났다가 헤어져도 봤지만  한꺼번에 많은 여자를 만난적은  없었어  네가 뭔데 날 아프게 하니  너 때문에 상처 돼버린 내 사랑  이제 다시는 너의 헛된 만남도  나 같은 사람 없을껄  난 두려워 나 역시 다시는  이런 사랑 할 수 없을까봐  믿을수 없겠지만은 네가  첫사랑인데  떠나버리면 어떡하라구  사랑까지는 바라지도않을게  네 곁에 항상 있게만 해줘  제발 제발
1998.06.07~06.13,11,33590,일상으로의 초대 (Radio Mix),신해철,Crom‘s Techno Works,1998.06.01,Rock,신해철,산책을 하고 차를 마시고 책을 보고 생각에 잠길 때 요즘엔 뭔가 텅 빈 것 같아 지금의 난 누군가 필요한 것 같아 친굴 만나고 전화를 하고 밤새도록 깨어있을 때도 문득 자꾸만 네가 생각나 모든 시간 모든 곳에서 난 널 느껴 내게로 와 줘 내 생활 속으로 너와 같이 함께라면 모든게 새로울거야 매일 똑같은 일상이지만 너와 같이 함께라면 모든게 달라질거야 서로에 대해 거의 모든 걸 지켜보며 알게 된다는게 말처럼 그리 쉽지 않겠지 그렇지만 난 준비가 된 것 같아 너의 대답을 나 기다려도 되겠니 난 내가 말할 때 귀 기울이는 너의 표정이 좋아 내 말이라면 어떤 거짓 허풍도 믿을 것 같은 그런 진지한 얼굴 네가 날 볼 때마다 난 내 안에서 설명할 수 없는 기운이 느껴져 네가 날 믿는 동안엔 어떤 일도 해낼 수 있을 것 같은 기분이야 이런 날 이해하겠니 내게로 와 줘 내게로 와 줘 내 생활 속으로 너와 같이 함께라면 모든게 새로울거야 매일 똑같은 일상이지만 너와 같이 함께라면 모든게 달라질거야 I'm spending whole my days for you Cause I am always thinking about you I really like to share my life with you I truely want to be someone for you So It is an invitaion to you Now I am waiting for the answer from you I swear I will do anything for you But sadly I've got nothing to give you All I can do is just say I love you 해가 저물면 둘이 나란히 지친 몸을 서로에 기대며 그 날의 일과 주변 일들을 얘기하다 조용히 잠들고 싶어
1998.06.07~06.13,12,38698,나의 사랑 천상(天上)에서도,김경호,Kyung-Ho Kim 03,1998,Rock,이경,그런 일들은 없을 테지만 만약에 우리들이 떨어져 이 세상을 살아야 할 때 그 때 누군가가 너를 비웃어도 또 어떤 힘든 일이 생겨도 운다거나 마음 상해서 죽고 싶어질 때 나를 생각해 내 뜻으로 할 수 없는 건 사는 것 때론 죽는다는 걸 그 어디에 있든지 우리 약속해 저 하늘이 나를 사랑해 어느 날 먼저 데려간대도 아름다운 세상 고운 너의 두 눈으로 내 몫까지 보아줘 저 하늘이 너를 사랑해 어느 날 너를 데려간다면 가슴속에 너의 사랑을 품고서 우리 사랑 키울게 천상으로 내가 곁에 없다고 너무 슬퍼하지마 우린 살아 있잖아  어느 곳에 있든지 우린 함께 숨을 쉬어 저 하늘이 나를 사랑해 어느 날 먼저 데려간대도 아름다운 세상 고운 너의 두 눈으로 내 몫까지 보아줘 저 하늘이 너를 사랑해 어느 날 너를 데려간다면 가슴 속에 너의 사랑을 품고서 우리 사랑 키울게 저 하늘이 나를 사랑해 어느 날 먼저 데려간대도 아름다운 세상 고운 너의 두 눈으로
1998.06.07~06.13,13,38793,거꾸로 강을 거슬러 오르는 저 힘찬 연어들처럼,강산에,연어,1998.03,Rock,"강산에,나비",흐르는 강물을 거꾸로 거슬러 오르는 연어들의  도무지 알 수 없는 그들만의 신비한 이유처럼  그 언제서부터인가 걸어 걸어 걸어오는 이 길  앞으로 얼마나 더 많이 가야만 하는지  여러 갈래 길 중 만약에 이 길이 내가 걸어가고 있는  돌아서 갈 수밖에 없는 꼬부라진 길일지라도  딱딱해지는 발바닥 걸어 걸어 걸어 가다보면  저 넓은 꽃밭에 누워서 나 쉴 수 있겠지  여러 갈래 길 중 만약에 이 길이  내가 걸어가고 있는  막막한 어둠으로 별빛조차 없는  길일지라도 포기할 순 없는거야  걸어 걸어 걸어 가다보면  뜨겁게 날 위해 부서진 햇살을 보겠지  그래도 나에겐 너무나도 많은 축복이란 걸 알아  수없이 많은 걸어 가야 할 내 앞길이 있지 않나  그래 다시 가다보면 걸어 걸어 걸어 가다보면  어느날 그 모든 일들을 감사해하겠지  보이지도 않는 끝 지친 어깨 떨구고  한숨짓는 그대 두려워 말아요  거꾸로 강을 거슬러 오르는 저 힘찬 연어들처럼  걸어가다보면 걸어가다보면 걸어가다보면
1998.06.07~06.13,14,611303,널 보낸 이유 (Live),이승철,6집 1999 & Live Best,1999.03.21,Ballad,이승철,잊혀질까 널 보낸 이후로  멈취버린 내 미소 찾을까  너를 보냈던 이유는  내 슬픔보단 아껴둔 널 위해  하지만 넌 벌써 잊었겠지  예전부터 준비 했었으니  추억이 아픔을 누르며  행복하라 눈물짓네  애태워 지냈던 세월을 감추며  가슴에 묻어둔 숨가쁜 그리움  더 이상 필요없음을 느끼던 날  서툰 웃음 보이려 했지만  널 사랑하기에 아꼈던 눈물을  보이지 않았을 뿐  애태워 지냈던 세월을 감추며  가슴에 묻어둔 숨가쁜 그리움  더 이상 필요없음을 느끼던 날  서툰 웃음 보이려 했지만  널 사랑하기에 아꼈던 눈물을  보이지 않았을 뿐  내 슬픔보다 아껴둔 널  다시 찾을 순 없는 걸까  널 보낸 이유만으로도  다시 돌아올 수 있을텐데  내 슬픔보다 아껴둔 널  다시 찾을 순 없는 걸까  널 보낸 이유만으로도  다시 돌아올 수 있을까 내 슬픔보다 아껴둔 널 다시 찾을 순 없는 걸까
1998.06.07~06.13,15,1139650,보낼 수 밖에 없는 난,소찬휘,Another,1998.04.28,Ballad,김태훈,떠나는 모습까진 볼수 없어요  꼭 그래야할 필요 없다면  차라리 내가 먼저 돌아서는게  서로를 위해 좋을것 같아   난 준비가 되지 않아서  흐르는 눈물일 뿐이예요  나를 편하게 떠나요  어차피 돌이킬수 없다면   오 보내야겠지  떠나고 싶어 떠나는건 이해해야지  오 하지만 다신 내가 볼수없는  먼곳으로 떠나줬으면 해   날 사랑한다던 그 말도  그대의 따스한 그 숨결도  모두 잊어야 하기에  조금은 힘이들것 같지만   오 보내야겠지  떠나고 싶어 떠나는건 이해해야지  오 하지만 다신 내가 볼수없는  먼곳으로 떠나줬으면 해   마지막 남은 마음으로  그댈 잡아보고 싶지만   보내야겠지 돌아오기엔  너무 멀리 가고있잖아  오 참아야겠지 함께한 시간이  짧기에 그댈 잊을 수 있겠지  하루종일 그대 생각만 하네요  솔직히 너무 두려워져요  함께한 시간이 짧다 믿었는데  이제와 보니 아닌 것 같아 -
1998.06.07~06.13,16,78095,두려움 없는 사랑,포지션,Feel So Good,1998.04.09,Ballad,한진우,너무 감당하기 힘든 고통스런 날들 혼자서 모든 걸 포기하겠어 살아갈 날 아직 내겐 너무 많은데 다행이야 늦지 않아서  애절한 눈빛이 날 흔들리게 해 밤새워 결심했던 생각을 아직 사랑하는 마음 남아있기에 쉽게 헤어지잔 말은 못했어 지친 오늘이 가면 힘든 내일 오겠지 수없이 생각 바꿔 봤지만 시간이 내 자신을 강해질 수 있도록 이미 만들고 있으니 지친 나날들이 내겐 아무렇지 않아 새로운 결심이 생겼으니까 아픔을 겪고 나면 편하겠지만 쉽게 생각한 건 아닌데  헤어진다는 것이 두려운 게 아니야 나 혼자 남게 된다는 것도 이토록 내 마음을 흔들리게 하는 건 남은 미련 때문일까 지친 나날들이 내겐 아무렇지 않아 새로운 결심이 생겼으니까 아픔을 겪고 나면 편하겠지만 쉽게 생각한 건 아닌데 너무 감당하기 힘든 고통스런 날들 혼자서 모든 걸 포기하겠어 살아갈 날 아직 내겐 너무 많은데 다행이야 늦지 않아서
1998.06.07~06.13,17,77363,나와 같다면,김장훈,#1998 Ballads For Tears,1998.02.01,Ballad,박주연,어떤 약속도 없는 그런 날에 너만 혼자 집에 있을때 넌 옛 생각이 나는지 그럴땐 어떡하는지 또 우울한 어떤날 음 비 마저 내리고 늘 우리가 듣던 노래가 라디오에서 나오면 나처럼 울고 싶은지 왜 자꾸만 후회되는지 나의 잘못했던 일과 너의 따뜻한 마음만 더 생각나 너의 방안을 정리하다가 내 사진이 혹시 나오면 넌 그냥 찢고 마는지 한참을 바라보는지 또 우울한 어떤날 음 비 마저 내리고 늘 우리가 듣던 노래가 라디오에서 나오면 나처럼 울고 싶은지 왜 자꾸만 후회되는지 나의 잘못했던 일과 너의 따뜻한 마음만 더욱 생각나 그대여 나와 같다면 내 마음과 똑같다면 그냥 나에게 오면 돼 널 위해 비워둔 내 맘 그 자리로  그대여 나와 같다면 내 마음과 똑같다면 그냥 나에게 오면 돼 널 위해 비워둔 내 맘 그 자리로 나처럼 울고 싶은지 왜 자꾸만 후회되는지
1998.06.07~06.13,18,2274404,사람이 꽃보다 아름다워,안치환,Desire,1997.12.12,Folk,정지원,헤이 헤이  강물같은 노래를 품고 사는   사람은 알게되지 음 알게되지   내내 어두웠던 산들이   저녁이되면 왜 강으로 스미어   꿈을 꾸다 밤이 깊을수록   말없이 서로를 쓰다듬으며   부둥켜안은채 느긋하게   정들어 가는지를 으음 음  지독한 외로움에 쩔쩔매본   사람은 알게되지 음 알게되지   그슬픔에 굴하지 않고   비켜서지 않으며   어느결에 반짝이는 꽃눈을 닫고   우렁우렁 잎들을 키우는   사랑이야말로   짙푸른 숲이되고 산이되어   메아리로 남는다는 것을   누가 뭐래도 사람이   꽃보다 아름다워   이 모든 외로움 이겨낸   바로 그사람   누가 뭐래도 그대는   꽃보다 아름다워   노래의 온기를 품고사는   바로 그대 바로 당신   바로 우리 우린 참사랑   지독한 외로움에 쩔쩔매본   사람은 알게되지 음 알게되지   그슬픔에 굴하지 않고   비켜서지 않으며   어느결에 반짝이는   꽃눈을 닫고   우렁우렁 잎들을 키우는   사랑이야말로   짙푸른 숲이되고 산이되어   메아리로 남는다는 것을   누가 뭐래도 사람이   꽃보다 아름다워   이 모든 외로움 이겨낸   바로 그사람   누가 뭐래도 그대는   꽃보다 아름다워   노래의 온기를 품고사는   바로 그대 바로 당신   바로 우리 우린 참사랑  누가 뭐래도 사람이   꽃보다 아름다워  노래의 온기를 품고사는  바로 그대 바로 당신  바로 우리 우린 참사랑
