time,rank,song_id,title,singers,album,date,genre,creator,lyric
1990.05.27~06.02,1,104134,비오는 날 수채화,"김현식,강인원,권인하",비오는 날 수채화 OST,1989.11.10,"Korean Movie,Rock",강인원,빗방울 떨어지는 그 거리에 서서  그대 숨소리 살아있는 듯  느껴지면  깨끗한 붓 하나를 숨기듯  지니고 나와  거리에 투명하게 색칠을 하지  음악이 흐르는 그 카페엔  초콜렛색 물감으로  빗방울 그려진 그 가로등불  아랜 보라색 물감으로  세상 사람 모두가 도화지  속에 그려진  풍경처럼 행복하면 좋겠네 욕심 많은 사람들 얼굴  찌푸린 사람들  마치 그림처럼 행복하면 좋겠어  음악이 흐르는 그 카페엔  초콜렛색 물감으로  빗방울 그려진 그 가로등불  아랜 보라색 물감으로  세상 사람 모두가 도화지  속에 그려진  풍경처럼 행복하면 좋겠네 욕심 많은 사람들 얼굴  찌푸린 사람들  마치 그림처럼 행복하면 좋겠어  빗방울 떨어지는 그 거리에 서서  그대 숨소리 살아있는 듯  느껴지면  깨끗한 붓 하나를 숨기듯  지니고 나와  거리에 투명하게 색칠을 하지
1990.05.27~06.02,2,53615,사랑일뿐야,김민우,사랑일뿐야,1990.02.10,Ballad,박주연,나를 어떻게 생각하냐고 너는 내게 묻지만 대답하기는 힘들어 너에게 이런 얘길 한다면 너는 어떤 표정 지을까 언젠가 너의 집 앞을 비추던 골목길 외등 바라보며 길었던 나의 외로움의 끝을 비로소 느꼈던 거야 그대를 만나기 위해 많은 이별을 했는지 몰라 그대는 나의 온몸으로 부딪혀 느끼는 사랑일 뿐야 나를 어떻게 생각하냐고 너는 내게 묻지만 대답하기는 힘들어 너에게 이런 얘길 한다면 너는 어떤 표정 지을까 언젠가 너의 집 앞을 비추던 골목길 외등 바라보며 길었던 나의 외로움의 끝을 비로소 느꼈던 거야 그대를 만나기 위해 많은 이별을 했는지 몰라 그대는 나의 온몸으로 부딪혀 느끼는 사랑일 뿐야
1990.05.27~06.02,3,53088,유리창엔 비,햇빛촌,햇빛촌,1989.02.15,Ballad,이정한,낮부터 내린 비는 이 저녁 유리창에 이슬만 뿌려놓고서 밤이 되면 더욱 커지는 시계소리처럼 내 마음을 흔들고 있네 이 밤 빗줄기는 언제나 숨겨놓은 내 맘에 비를 내리네 떠오는 아주 많은 시간들 속을 헤메이던 내 맘은 비에 젖는데 이젠 젖은 우산을 펼 수는 없는 것 낮부터 내린 비는 이 저녁 유리창에 슬픔만 뿌리고 있네 이 밤 마음속엔 언제나 남아있던 기억은 빗줄기처럼 떠오는 기억 스민 순간 사이로 내 마음은 어두운 비를 뿌려요 이젠 젖은 우산을 펼 수는 없는 것 낮부터 내린 비는 이 저녁 유리창에 슬픔만 뿌려 놓고서 밤이 되면 유리창에 내 슬픈 기억들을 이슬로 흩어 놓았네
1990.05.27~06.02,4,53062,사계,노래를찾는사람들,노래를 찾는 사람들 2,1989.10.01,Folk,문승현,빨간 꽃 노란 꽃  꽃밭 가득 피어도   하얀 나비 꽃  나비 담장위에 날아도   따스한 봄바람이 불고 또 불어도   미싱은 잘도 도네 돌아가네   흰 구름 솜구름   탐스러운 애기 구름   짧은 샤쓰 짧은 치마 뜨거운 여름   소금 땀 비지 땀   흐르고 또 흘러도   미싱은 잘도 도네 돌아가네   저 하늘엔 별들이 밤새 빛나고   찬바람 소슬바람   산너머 부는 바람   간밤에 편지 한 장 적어  실어 보내고   낙엽은 떨어지고   쌓이고 또 쌓여도   미싱은 잘도 도네 돌아가네   흰눈이 온 세상에   소복소복 쌓이면   하얀 공장 하얀 불빛   새하얀 얼굴들   우리네 청춘이   저물고 저물도록   미싱은 잘도 도네 돌아가네   공장엔 작업등이 밤새 비추고   빨간 꽃 노란 꽃   꽃밭 가득 피어도   하얀 나비 꽃 나비 담장 위에 날아도  따스한 봄바람이  불고 또 불어도  미싱은 잘도 도네 돌아가네  미싱은 잘도 도네 돌아가네  미싱은 잘도 도네 돌아가네
1990.05.27~06.02,5,2036548,사랑으로,해바라기,89 해바라기 (사랑으로 / 사랑의 진실 / 나는 자유인인가),1989.12.01,Folk,이주호,내가 살아가는 동안에   할 일이 또 하나있지   바람 부는 벌판에 서 있어도   나는 외롭지 않아   그러나 솔잎 하나 떨어지면   눈물 따라 흐르고   우리 타는 가슴 가슴마다   햇살은 다시 떠 오르네   아 영원히 변치않을   우리들의 사랑으로   어두운 곳에 손을 내 밀어   밝혀 주리라  내가 살아가는 동안에   할 일이 또 하나있지   바람 부는 벌판에 서 있어도   나는 외롭지 않아   그러나 솔잎 하나 떨어지면   눈물 따라 흐르고   우리 타는 가슴 가슴마다   햇살은 다시 떠 오르네   아 영원히 변치않을   우리들의 사랑으로   어두운 곳에 손을 내 밀어   밝혀 주리라  아 영원히 변치않을   우리들의 사랑으로   어두운 곳에 손을 내밀어  밝혀 주리라 아 영원히 변치않을   우리들에 사랑으로   어두운 곳에 손을 내 밀어   밝혀 주리라  아 라라라라라 라라라라라라  우리들의 사랑으로   어두운 곳에 손을 내 밀어   밝혀 주리라
1990.05.27~06.02,6,53159,넋두리,김현식,넋두리,1990.03,Ballad,김현식,쓸쓸한 거리에 나 홀로 앉아서 바람의 떨리는 소리를 들었지  어디서 왔다가 어디로 가는지 설레이는 이 내 마음이여 꺼질 듯 타오는 거리의 네온을 내 품에 안고서 헤매고 있었지 멀리로 떠나는 내 님의 뒷모습 깨어진 꿈이었나 힘 없는 내 발길에 다가선 님의 모습 인생을 몰랐던 나의 길고 긴 세월 갈 테면 가라지 그렇게 힘이 들면 가다가 지치면 또 일어나겠지  쓸쓸한 거리에 나 홀로 앉아 바람의 떨리는 소리를 들었지 어디서 왔다가 어디로 가는지 설레이는 이 내 마음이여 꺼질 듯 타오는 거리의 네온을 내 품에 안고서 헤매고 있었지 멀리로 떠나는 내 님의 뒷모습 깨어진 꿈이었나 힘 없는 내 발길에 다가선 님의 모습 인생을 몰랐던 나의 길고 긴 세월 갈 테면 가라지 그렇게 힘이 들면 가다가 지치면 또 일어나겠지
1990.05.27~06.02,7,58160,마지막 콘서트,이승철,이승철 Part 2,1989.12.10,Ballad,김태원,지금 슬픈 내 모습은 무대뒤 한 소녀  애써 눈물 참으며 바라보고 있네  무대 뒤에 그 소녀는 작은 의자에 앉아  두 손 곱게 모으고 바라 보며 듣네  나의 얘기를 워 소녀는 나를 알기에 더더욱 슬퍼지네  노래는 점점흐르고 소녀는 울음 참지 못해  밖으로 나가버리고  노랜 끝이 났지만 이젠 부르지 않으리 에 이 슬픈 노래  밖으로 나가 버리고 노랜 끝이났지만 이젠 부르지 않으리 에 이 슬픈 노래
1990.05.27~06.02,8,52451,희망사항,변진섭,너에게로 또 다시,1989.10.25,Ballad,노영심,청바지가 잘 어울리는 여자   밥을 많이 먹어도  배 안나오는 여자   내 얘기가 재미 없어도  웃어주는 여자   난 그런 여자가 좋더라   머리에 무스를 바르지 않아도  윤기가 흐르는 여자  내 고요한 눈빛을 보면서  시력을 맞추는 여자  김치 볶음밥을 잘 만드는 여자  웃을때 목젖이 보이는 여자  내가 돈이 없을 때에도  마음 편하게 만날 수 있는 여자  멋내지 않아도 멋이 나는 여자  껌을 씹어도 소리가 안나는 여자  뚱뚱해도 다리가 예뻐서  짧은 치마가 어울리는 여자   내가 울적하고 속이 상할때   그저 바라만 봐도  위로가 되는 여자   나를 만난 이후로 미팅을   한번도 한번도 안한 여자   라라라라라라라라라라라  라라라라라라라라라라라라  라라라라라라라라  라라라라라라라라라라라  라라라라라라라라라라라 라라라라라라라라라라라라 라라라라라라라라 라라라라라라라라라라라 난 그런 여자가 좋더라  난 그런 여자가 좋더라  여보세요 날 좀 잠깐 보세요  희망사항이 정말 거창하군요  그런 여자한테 너무 잘 어울리는  난 그런 남자가 좋더라
1990.05.27~06.02,9,1839142,나그네의 옛 이야기 (엄인호),신촌블루스,신촌블루스 3집,1990.03.25,Folk,박동율,오솔길을 거닐며  옛생각에 잠겨보네 하늘 떠다니는 구름 내마음 같아   종일토록 헤매이나 좁은 신작로길 멀리 달려가는  시외버스 먼지속에 옛날 철모르던 아이들시적   꿈처럼 떠오르네    이젠 다시 못 올 아름다운 무지개시절  풀밭 언덕 위로 바람 불어가고 내마음 근심걱정 하나 없던 행복한 시절 언제나 다시 오려나 흘러가는 강물을 바라보면서   옛노래를 불러보네 텅빈 머리속을 돌아 맴도는  나그네의 옛이야기    이젠 다시 못 올 아름다운 무지개시절  풀밭 언덕 위로 바람 불어가고 내마음 근심걱정 하나 없던 행복한 시절 언제나 다시 오려나 흘러가는 강물을 바라보면서   옛노래를 불러보네 텅빈 머리속을 돌아 맴도는  나그네의 옛이야기
1990.05.27~06.02,10,53426,내일일기,오석준,우리들의 시대,1990.03.12,Ballad,김성호,노을지는 하늘보며 잡지 못한 추억을 우리는 그리워하지만 세상 누구라도 하나쯤은 말 못할 슬픔을 안고 살아가죠 정신없이 걷다가 발을 멈춰 돌아보면 우린 어느새 더욱 소중한 것들을 잊고 사는 것은 아닌지 다시 펼쳐진 하늘 너머로 지나가버린 어제보다도 언젠가는 날아가고픈 내일얘기를 써가요  정신없이 걷다가 발을 멈춰 돌아보면 우린 어느새 더욱 소중한것들을 잊고 사는 것은 아닌지 다시 펼쳐진 하늘 너머로 지나가버린 어제보다도 언젠가는 날아가고픈 내일얘기를 써가요 다시 펼쳐진 하늘 너머로 지나가버린 어제보다도 언젠가는 날아가고픈 내일얘기를 써가요 내일얘기를 써가요 내일얘기를 써가요
1990.05.27~06.02,11,67911,마음에 쓰는 편지,임백천,임백천 노래 모음집,1989.10.20,Ballad,노영심,밤이 아름다워 잠이 오질 않아 창을 열고 가만히 벽에 기대어 창가에 흐르는 별들을 바라보며 갈 수없는 내 사랑을 노래합니다  그대 생각하면 잠이 오질 않아 불을 끄고 가만히 창가에 앉아 마음에 접어놓은 수많은 얘기속에 그대에게 하고픈 말 사랑합니다 사랑하는 사람아 귀를 기울여 봐요 이 밤은 이렇게 당신을 부르는데 사랑하는 사람아 마음을 열어봐요 그리움이 가득한 이 밤을 받아주세요  사랑하는 사람아 귀를 기울여 봐요 이 밤은 이렇게 당신을 부르는데 사랑하는 사람아 마음을 열어봐요 그리움이 가득한 이 밤을 받아주세요
1990.05.27~06.02,12,53530,난 그대만을 사랑했나봐,박정운,오석준/장필순/박정운,1990.05.15,Ballad,김성휘,어젯밤에 걸려 왔던 그 전화속에 떨리는 목소리로 울먹이던 너~~ 더 이상 기다리지 않겠다고 잊어 달라고 한 마디 던져 놓고 끊어버린 너 아직도 내 귓가에 남아 있는 그 목소리에 지나버린 얘기라고 마음 달래봐도 웬지~ 나도 몰래 떠 오르는 너의 모습을 지우려고 외면하듯 돌아 섰을때 사랑했나봐 그대는 나를 정말 사랑하고 있었나봐 사랑했나봐 난 아직 그대만을 사랑하고 있었나봐 사랑했나봐 날 사랑했나봐 아 눈앞에 어둠이 밀려 오네  멍하게 홀로 서서 수화기만 바라보다가 지나버린 얘기라고 마음 달래봐도 왠~지 나도 몰래 떠오르는 너의 모습을 지우려고 외면하듯 돌아섰을때 사랑했나봐 그대는 나를 정말 사랑하고 있었나봐 사랑했나봐 난 아직 그대만을 사랑하고 있었나봐 사랑했나봐 날 사랑했나봐 아 눈앞에 어둠이 밀려 오네 눈앞에 어둠이 밀려 오네
1990.05.27~06.02,13,1017150,그 아픔까지 사랑한거야,조정현,그 아픔까지 사랑한거야,1989.06.15,Ballad,이지영,너를 처음 만난 날 소리없이  밤새 눈은 내리고  끝도 없이 찾아드는 기다림  사랑의 시작이었어  길모퉁에 서서 눈을 맞으며  너를 기다리다가  돌아서는 아쉬움에 그리움만 쌓여도  난 슬프지 않아  눈내리고 외롭던 밤이 지나면  멀리서 들려오는 새벽종소리  혼자만의 사랑은 슬퍼지는거라  말하지 말아요  그대 향한 그리움은 나만의 것인데  외로움에 가슴 아파도  그 아픔까지 사랑한거야   눈내리고 외롭던 밤이 지나면  멀리서 들려오는 새벽종소리  혼자만의 사랑은 슬퍼지는거라  말하지 말아요  그대 향한 그리움은 나만의 것인데  외로움에 가슴 아파도  그 아픔까지 사랑한거야  그 아픔까지 사랑한거야
1990.05.27~06.02,14,520770,어느새,장필순,Forever Best 004,1990.03,Rock,김현철,어느새 내 나이도 희미해져 버리고 이제는 그리움도 지워져 버려 어느새 목마른 가슴 모두 잃어버린 무뎌진 그런 사람이 나는 되어만 가네 어느새 시간은 사랑하는 사람마저 빼앗아 나를 상심하게 만들었지만 어느새 이제는 가슴시린 그런 기억 조차도 모두 개끗하게 잊어버린 무뎌진 사람이 돼가네 어느새  시간은 사랑하는 사람마저 빼앗아 나를 상심하게 만들었지만 어느새 이제는 가슴시린 그런 기억 조차도 모두 개끗하게 잊어버린 무뎌진 사람이 돼가네 어느새 어느새 내 나이도 희미해져 버리고 이제는 그리움도 지워져 버려 어느새 목마른 가슴 모두 잃어버린 무뎌진 그런 사람이 나는 되어만 가네 어느새 어느새 어느새 어느새 어느새 어느새
1990.05.27~06.02,15,1874936,인디안 인형처럼,나미,Nami Best `My Story And... 45`,2008.05.21,Adult Contemporary,김순곤,다시 어둠이 내리면 혼자라는게 나는 싫어 불빛거리를 헤매다 지쳐버리면 잠이드네 그댄 그렇게 내게 남겨둔 인형처럼 쉽게 웃으며 떠나갔지만 나의 마음은 인디안 인형처럼 워워워워워워워워 까만외로움에 타버렸나봐 oh my baby  비가 내리는 날이면 아픈 추억이 너무 많아 지난 일들은 잊으려 비를 맞으며 걸어가네 그댄 그렇게 내게 남겨둔 인형처럼 쉽게 웃으며 떠나 갔지만 나의 마음은 인디안 인형처럼 워워워워워워워워 까만 외로움에 타버렸나봐 oh my baby  혼자 울고있는 이 안타까운 밤이 깊어 가네 그댄 그렇게 내게 남겨둔 인형처럼 쉽게 웃으며 떠나 갔지만 나의 마음은 인디안 인형처럼 워워워워워워워워 까만 외로움에 타버렸나봐 oh my baby
1990.05.27~06.02,16,2522463,늦지 않았어요,이지연,이지연,1990.01.30,Ballad,,
1990.05.27~06.02,17,53018,향기로운 추억 (응답하라 1988 삽입곡),박학기,박학기,1989.05.10,Ballad,조동익,한줌 젖은 바람은 이젠 희미해진 옛 추억 어느 거리로 날 데리고 가네 향기로운 우리의 얘기로 흠뻑 젖은 세상 시간이 천천히 흐르고 있던 한줌 아름다운 연기 잡아 보려 했던 우리의 그리운 시절 가끔 돌이켜보지만 입가에 쓴웃음 남기고 가네 생각해봐요 눈이 많던 어느 겨울 그대 웃음처럼 온 세상 하얗던 귀 기울여봐요 지난 여름 파도 소리 그대 얘기처럼 가만히 속삭이던 이제 다시 갈 수 없나 향기롭던 우리의 지난 추억 그곳으로 생각해봐요 눈이 많던 어느 겨울 그대 웃음처럼 온 세상 하얗던 귀 기울여봐요 지난 여름 파도 소리 그대 얘기처럼 가만히 속삭이던 생각해봐요 눈이 많던 어느 겨울 그대 웃음처럼 온 세상 하얗던 귀 기울여봐요 지난 여름 파도 소리
1990.05.27~06.02,18,68931,추억속의 재회,조용필,90-Vol.1 Sailng Sound,1990.01,Ballad,최은정,지나치는 어둠속에서  긴머리 낯선 그 모습  파도처럼 일렁이며  창가를 스쳐가는  젖은눈의 그댈 보았네  입맞추면 고운 그 입술  울먹이는 슬픈 그대여  바람속에 지는 그대의 만남  순간에 머물렀을 뿐  떠나버린 날들을 이제는  사랑이라 부르지 않으리 영원히   기약없는 이별뒤에 찾아와  추억의 서러움만 남기네  미워할수 없는 그댈 지우며  눈감은 내가슴엔 눈물이 Hey   멀어지는 그대의 모습  부드러운 꽃향기처럼  가까이 다가와서  아프도록 마주보며  사랑으로 나를 부르네  이 시간이 지나면 이제는  잊혀져간 꿈으로 남으리 영원히   기약없는 이별뒤에 찾아와  추억의 서러움만 남기네  미워할수 없는 그댈 지우며  눈감은 내가슴엔 눈물이 Hey   기약없는 이별뒤에 찾아와  추억의 서러움만 남기네  미워할수 없는 그댈 지우며  눈감은 내가슴엔 눈물이  기약없는 이별뒤에 찾아와  추억의 서러움만 남기네
1990.05.27~06.02,19,1859404,잊지 말아요,최성수,The Best History,2008.04.30,Adult Contemporary,이두헌,이젠 모두 지나버린 일이야 사랑했던 그 추억 마저도 하지만 멀리서 그대 모습 그리며 여기 서 있네 흘러가는 세월속에 다가와 아픈 상처만 주고 떠나간 그대가 나에게 남겨준 그 사랑이 너무 무거워 하지만 우리 잊지 말고 살기로 해요 아름답던 지난 날을 잊지 말아요 아직도 그대를 사랑하고 있어요 잊지 말아요 지난 세월속에서 우리가 나눈 모든 것들을 다 거짓이라고 하지 말아요 사랑은 늘 아픈거라고 나에게 말해준 단 한 사람 그대  흘러가는 세월속에 다가와 아픈 상처만 주고 떠나간 그대가 나에게 남겨준 그 사랑이 너무 무거워 하지만 우리 잊지 말고 살기로 해요 아름답던 지난 날을 잊지 말아요 아직도 그대를 사랑하고 있어요 잊지 말아요 지난 세월속에서 우리가 나눈 모든 것들을 다 거짓이라고 하지 말아요 사랑은 늘 아픈거라고 나에게 말해준 단 한 사람 그대 하지만 우리 잊지말고 살기로 해요 아름답던 지난 날을 잊지 말아요 아직도 그대를 사랑하고 있어요 잊지 말아요 지난 세월속에서 우리가 나눈 모든 것들을 다 거짓이라고 하지 말아요 사랑은 늘 아픈거라고 나에게 말해준 단 한 사람 사랑은 늘 아픈거라고 나에게 말해준 단 한 사람 그대
1990.05.27~06.02,20,52156,채워지지 않는 빈자리,이상우,이상우 1집,1989.03,Ballad,김성란,이젠 그리워 할수 없어요 나의 사랑을 믿을수 없어요 떠나 가버린 그대의 빈자리 다시 채워 질수 없기에 슬픈 이별도 하지 못하고 아픈 눈물도 흘리지 못하고 무심히 그대 보내야만 했던 그 순간이 미워요 너무나 사랑했기에 말없이 보고 말았던 마지막 그대의 모습 정말로 이별이었나 이제와 후회할수 없지만 차라리 울어나 볼것을 세월이 갈수록 안타까워지는 아쉬움이 싫어요  너무나 사랑했기에 말없이 보고 말았던 마지막 그대의 모습 정말로 이별이었나 이제와 후회할수 없지만 차라리 울어나 볼것을 세월이 갈수록 안타까워지는 아쉬움이 싫어요
1990.05.27~06.02,21,91135,사랑할꺼야,이상은,이상은 2집,1989.12.01,Ballad,최봉,우리 이제는 좋아하게 될거야 지나버린 시간들이 다시 되돌아오면 우리 이제는 사랑하게 될거야 달콤했던 추억들이 영원히 아름답도록 소중했던 그 날들은 지나도 아름다운 사랑을 할거야  우리 이제는 좋아하게 될거야 지나버린 시간들이 다시 되돌아오면 우리 이제는 사랑하게 될거야 달콤했던 추억들이 영원히 아름답도록 소중했던 그 날들은 지나도 아름다운 사랑을 할거야  소중했던 그 날들은 지나도 아름다운 사랑을 할거야 소중했던 그 날들은 지나도 아름다운 사랑을 할거야
1990.05.27~06.02,22,1839723,솔직할 수 있도록,최성원,최성원 2,1990.11.01,Ballad,최성원,세상에 많은 사람들 모두 알고 싶은 사람들 해도 해도 끝없는 사람여행  제각기 숨긴 비밀 하나 둘 얘기 할 때 난 알았지 솔직할 수 없었을 뿐 아름다운 사람들인걸 어릴 적 부터 다 큰 지금까지 솔직하면 왠지 손해를 봤나봐 예쁜 거짓말은 내겐 매력 없어 솔직하면 우린 뭔가 통할 텐데  세상에 많은 사람들 모두 아름다운 사람들 도와줘요 솔직할 수 있도록  어릴 적 부터 다 큰 지금까지 솔직하면 왠지 손해를 봤나봐 예쁜 거짓말은 내겐 매력 없어 솔직하면 우린 뭔가 통할 텐데 세상에 많은 아이들 모두 사랑스런 아이들 도와줘요 솔직할 수 있도록 세상에 많은 어른들 모두 자랑스런 어른들 도와줘요 솔직할 수 있도록 세상에 많은 사람들 모두 아름다운 사람들 도와줘요 솔직할 수 있도록
1990.05.27~06.02,23,2508790,무지개,조규찬,달에서 온 편지,2009.12.15,Ballad,조규찬,창백한 아침 햇살이 동산을 맴돌 때 나무 위에 새들도 구름마다 흐르네  집앞에 친구들이 내 이름을 부를 때 나도 모르는 기쁨이 내 몸을 감싸네  한 여름날 소나기를 흠뻑 맞은 아이들의 모습에 살며시 미소를 띄워 보내고 뒷산 위에 무지개가 가득히 떠오를 때면 가도 가도 잡히지 않는 무지개를 따라갔었죠  한 여름날 소나기를 흠뻑 맞은 아이들의 모습에 살며시 미소를 띄워 보내고 뒷산 위에 무지개가 가득히 떠오를 때면 가도 가도 잡히지 않는 무지개를 따라갔었죠
1990.05.27~06.02,24,1126987,침묵,위일청,위일청 리메이크 댄스 2 - 트롯디스코,-,Ballad,,아무말도 하지마 나는 너무 지쳤어 자꾸 나를 부르지마 이젠 사랑 하기 싫어 지금 나는 웃지만 그건 내가 아니야 그냥 나를 쉬게해줘 내게 다가오지마 모두 떠나가도 나는 서럽지 않아 아무 말없이 그저 혼자있고 싶어 슬픔도 기쁨도 느껴지질 않아 낯선 침묵속에서 이대로 있고싶어  모두 떠나가도 나는 서럽지 않아 아무 말없이 그저 혼자있고 싶어 슬픔도 기쁨도 느껴지질 않아 낯선 침묵속에서 이대로 있고싶어
1990.05.27~06.02,25,987763,떠나고 싶어라,백영규,백영규 8,1991,Folk,나영애,떠나가고 싶어라 아무도 볼 수 없는 곳 바람이 되어 날아갈까 새처럼 날아갈까 웃음도 눈물도 없는 얼굴이 되어버렸네 우우우 님이여 그대가 떠나더니 세상엔 온통 잿빛구름 떠있고 내 가슴엔 언제나 소낙비만 쏟아지네 우우 우우 우우우 님이여  그대가 떠나더니 세상엔 온통 잿빛구름 떠있고 내 가슴엔 언제나 소낙비만 쏟아지네 우우 우우 우우우 님이여 혹시나 돌아올까 떠나지도 못하고 기다린 어리석음은 잃어버린 시간들만 우우  잃어버린 시간들만 보낸답니다
1990.05.27~06.02,26,52841,얄미운 사람,김지애,김지애,1988.03,Adult Contemporary,전영록,사랑만 남겨놓고 떠나가느냐 얄미운 사람 슬픈 음악처럼 이마음 울려놓고 저 멀리 떠나간 사람 미련만 남겨놓고 돌아가느냐 얄미운 사람 미련때문인가 멍들은 이 내가슴 아픔만 주고 간 사람 정주고 마음주고 사랑도 줬지만 지금은 남이 되어 떠나가느냐 이별의 아픔일랑 가져가다오 얄미운 사람 사랑만 남겨놓고 떠나가느냐 얄미운 사람 슬픈 음악처럼 이마음 울려놓고 저 멀리 떠나간 사람 정주고 마음주고 사랑도 줬지만 지금은 남이 되어 떠나가느냐 이별의 아픔일랑 가져가다오 얄미운 사람 미련만 남겨놓고 돌아가느냐 얄미운 사람 미련때문인가 멍들은 이 내가슴 아픔만 주고 간 사람 미련때문인가 멍들은 이 내가슴 아픔만 주고 간 사람
1990.05.27~06.02,27,881851,모두가 잊혀질때면,지근식,혼자 남은 밤,1989.06.24,Ballad,송홍섭,밤새도록 가고싶은 나의 마음을  그대 따라 먼길을 찾아헤매네  나만 홀로 이 거리에 남아 있는데  그대 향한 그리움 지울 수 없어  잊을 수 없어 잊을 수 없어  모두가 사라져 가도  하늘 저편에 붉은 노을이 내려와  내 몸을 감싸안네  나만 홀로  이 거리에 남아 있는데  그대 향한 그리움 지울 수 없어  잊을 수 없어 잊을 수 없어  모두가 사라져 가도  하늘 저편에 붉은 노을이 내려와  내 몸을 감싸안네
