time,rank,song_id,title,singers,album,date,genre,creator,lyric
1998.06.07~06.13,43,77659,그대야! 미안해,오피피에이,Deathless Love,1998.01.01,Dance,,볼수 없었어 듣진 못했어  너무 어두웠기에  아무도 없는 나의 마음을  보여줄수도 없기에  포기도 했지 앉아버렸어 이젠 생각 않기에  이상해졌어 나도 모른 행동을 해  알았지 눈이 커져버린 이유  그대 내게 왔어요 날 일으켜 줬어요  너무도 작아졌던 나는 그댈 볼수 없었죠  (바보 바보 나는 정말) (죽어야만 할것 같아)  너무 창피했었죠 도망가려 했어요  너무나도 큰 그대  나는 정말 볼수 없어 어떡해 그대야 미안해  항상 지쳐울던 나에게  너의 마음에 담아주었고  눈물에 아픔 또 슬픔 상처  모두 지워준다며 더더더 크게 울던  내눈에 눈물임에 모두 같았어 눈안에 세상  보이는 것 없기에  이상해졌어 나도 모른 행동을 해  알았지 눈이 커져버린 이유  그대 내게 왔어요 날 일으켜 줬어요  너무도 작아졌던 나는 그댈 볼수 없었죠  (바보 바보 나는 정말) (죽어야만 할것 같아)  너무 창피했었죠 도망가려 했어요  너무나도 큰 그대  나는 정말 볼수 없어  어떡해 그대야 미안해  항상 지쳐울던 나에게  너의 마음에 담아주었고  눈물에 아픔 또 슬픔 상처 모두  지워준다며 더더더 크게 울던  내눈에 눈물임에   항상 지쳐울던 나에게  너의 마음에 담아주었고  눈물에 아픔 또 슬픔 상처  모두 지워준다며 더더더 크게 울던  항상 지쳐울던 나에게 너의 마음에 담아주었고  눈물에 아픔 또 슬픔 상처  모두 지워준다며 더더더 크게 울던  이젠 할수 있어  네눈에 흐르는 눈물 내가 닦을게  감추려하진 또 숨기진 않아도 돼  나 널 위해 여기에 서 있을게  내눈에 눈물임에 예 예예예예예
1998.06.07~06.13,44,91268,행복한 나를,에코,Voice Of Eco,1997.08,Ballad,,몇 번인가 이별을 경험하고서  널 만났지  그래서 더 시작이 두려웠는지 몰라  하지만 누군가 알게되고  사랑하게 되는건  네가 마지막이라면 얼마나좋을까  우 나처럼  바쁜 하루중에도  잠시 네 목소리 들으면  함께있는 것처럼 너도 느껴지는지  매일 밤 집으로 돌아갈 때  그 곳에 네가 있다면  힘든하루 지친 네 마음이  내 품에 안겨 쉴텐데  지금처럼만 날 사랑해줘  난 너만 변하지 않는다면  내 모든걸 가질 사람은 너뿐이야 난 흔들리지 않아  넌 가끔은 자신이 없는  미래를 미안해 하지만 잊지 말아줘  사랑해 너와 함께라면 이젠 행복한 나를  바쁜 하루중에도  잠시 네 목소리 들으면  함께있는 것처럼 너도 느껴지는지  매일 밤 집으로 돌아갈 때 그 곳에 네가 있다면  힘든하루 지친 네 마음이  내 품에 안겨 쉴텐데  지금처럼만 날 사랑해줘  난 너만 변하지 않는다면  내 모든걸 가질 사람은 너뿐이야  난 흔들리지 않아  넌 가끔은 자신이 없는  미래를 미안해 하지만 잊지말아줘  사랑해 너와 함께라면 이젠  행복한 나를  난 많은 기대들로  세상이 정해놓은 사랑을 버리고  네 마음처럼 난 늘 같은 자리에  또 하나의 네가 되고싶어  소중한 널 위해  지금처럼만 사랑해줘 항상  너만 변하지 않으면  내 전부를 가질 사람은 너뿐이야  난 흔들리지 않아  자신없는 미래  넌 미안해 하고 있니  넌 이제 혼자가 아니야 이젠  잊지마 너와 함께라면  언제나 행복한 나를
1998.06.07~06.13,45,76947,소유,양파,양파 2nd,1998.01.01,Ballad,김경화,살아선 볼 수 없어 어둠을 헤매는 사랑 아침 하늘에 비친 너의 미소가 슬퍼 내 곁에 있도록 기도했지만 이제는 긴 외로움에 널 닮은 누군가 초대하고파 널 가질수 없기에 너인듯 기대어 느끼고 싶어 홀로 지켜가야 할 힘겨운 우리의 사랑  한번만 너의 품에 날 맡길 수 있다면 남겨진 삶을 버릴수 있게 이제는 긴 외로움에 널 닮은 누군가 초대하고파 널 가질수 없기에 너인듯 기대어 느끼고싶어 이제는 긴 외로움에 널 닮은 누군가 초대하고파 널 가질수 없기에 너인 듯 기대어 느끼고 싶어
1998.06.07~06.13,46,38461,사랑이 떠나가네,김건모,Myself,1997.12,Dance,한경혜,사랑이 떠나가네 또다시 내 곁에서
1998.06.07~06.13,47,46389,애인 발견!!!,자우림,Purple Heart,1997,Rock,김윤아,바보같다 생각했어 너를 한 번 봤을 땐  멍청한 눈 헝클어진 머리 마른 몸 착하다고 생각했어 너를 두 번 봤을 땐  상냥한 눈 귀여운 머리 날씬한 몸 사람들은 너를 몰라  안경너머 진실을 봐  어리숙한 모습뒤에 천사같은  네 영혼을  나 밖에는 아무도 모를거야 바보같다 생각했어 너를 한 번 봤을 땐  어눌한 말 촌스러운 표정 어색했지 착하다고 생각했어 너를 두 번 봤을 땐  솔직한 말 신선한 표정 좋았지 사람들은 나를 몰라  안경너머 진실을 봐 웃고 있는 얼굴 뒤에 기댈 곳 없는 내 어깨를 너 밖에는 아무도 모를거야 사람들은 우릴 몰라 안경너머 진실을 봐 이 세상엔 아름다운 사람들이 이렇게도 가득가득 많고 많은데 너는 너무 착해 내가 널 지켜줄거야 지금 이대로 좋은 사람 그대로 나는 너무 약해 네가 날 지켜줘야해 지금 이대로 좋은 사람 그대로
1998.06.07~06.13,48,37845,해에게서 소년에게,넥스트,Lazenca (A Space Rock Opera),1997.11.30,Rock,신해철,눈을 감으면 태양의 저편에서 들려오는 멜로디 내게 속삭였지 이제 그만 일어나 어른이 될 시간이야 너 자신을 시험해 봐 길을 떠나야 해 니가 흘릴 눈물이 마법의 주문이 되어 너의 여린 마음을 자라나게 할꺼야 남들이 뭐래도 니가 믿는 것들을 포기하려하거나 움추려 들지마 힘이 들땐 절대 뒤를 돌아보지마 앞만 보면 날아가야해 너의 꿈을 비웃는 자를 애써 상대하지마 변명하려 입을 열지마 그저 웃어버리는거야 아직 시간이 남아있어 너의 날개는 펴질꺼야 Now we are Flying to the universe 맘 이끄는곳 높은 곳으로 날아가 절대 뒤를 돌아보지마 앞만 보면 날아가야해 너의 꿈을 비웃는자를 애써 상대하지마 변명하려 입을 열지마 그저 웃어버리는거야 아직 시간이 남아있어 너의 날개는 펴질꺼야 더 높이 더 멀리 너의 별을 찾아 날아라 소년아 저 모든 별들은 너보다 먼저 떠난 사람들이 흘린 눈물이란다 세상을 알게 된 두려움에 흘린 저 눈물이 이 다음에 올 사람들을 인도하고 있는것이지
1998.06.07~06.13,49,38244,풍경,구본승장동건,Bon Seung & Dong Gun,1998.02.12,Ballad,이승호,사랑 상쾌한 숨결로 날 잠들게 하던 사랑 그건 내게 지상의 웅장한 음악이었고 은밀한 축복이었다 하지만 이제 그 혼미한 상념을 피해 영원히 잠을 자려 한다 바다 및 고요속으로  찬란한 내 사랑의 빛을 간직한 채로 먼 훗날 날 슬퍼할 이유들이  사라진 날 노래하리라 눈물없는 그리움으로 여전할 나의 사랑을 나 아직도 나없는 그댈 걱정해 그대가 없는 나를 한번도 생각해 본 적 없으니 나 아직 그대와 사랑으로 함께 했었던 그때처럼 그대 여전히 내게 있으니까 떠나갔지만 나는 아무렇지 않아 추억만으로도 내겐 너무나도 아름답던 사랑 항상 푸를테니까  나 여전히 내 남은 사랑을 믿지만 흐르는 세월이 그대를 하얗게 지울까 두려워 차마 나 그렇게 그댈 잃고 싶지 않지만 혹시 그릴까봐 두려워 나를 지우려해 아직 선명한 그대 목소리와 향기 모두 간직한 채 떠나가기 전에 머물 수 있다면 그댈 잃지 않겠지 영원히 그댈 사랑해
1998.06.07~06.13,50,78378,유리구두,유리상자,유리상자,1997.06.01,Ballad,이은혜,갖고 싶던 예쁜 유리 구두
