time,rank,song_id,title,singers,album,date,genre,creator,lyric
1993.05.16~05.22,1,56288,널 사랑하니까,신승훈,신승훈 3집,1993.04,Ballad,신승훈,난 너를 잊을수가 없어 이제는 나를 잊기로 했나 내 이름까지 내게 가르쳐준건 사랑뿐 이별은 어떻게 해야 하는지 그냥 이렇게 울면 되는지 너를 미워해야 하는지 흐르는 눈물 닦지 않았지 내가 울면 언제라도 나의 눈물 닦아주면서 슬퍼했던 너였기에 내가 싫어 이별을 했는지 다른 사랑이 있는지 이별을 준비해야 하는 날 슬프게 해 왜 나만 슬퍼해야 하는지 나만큼 너도 슬픈지 널 슬프게 했다면 용서해 이해할께 널 사랑하니까  흐르는 눈물 닦지 않았지 내가 울면 언제라도 나의 눈물 닦아주면서 슬퍼했던 너였기에 내가 싫어 이별을 했는지 다른 사랑이 있는지 이별을 준비해야 하는 날 슬프게 해 왜 나만 슬퍼해야 하는지 나만큼 너도 슬픈지 널 슬프게 했다면 용서해 이해할께 널 사랑하니까
1993.05.16~05.22,2,91408,사는게 뭔지,이무송,인연(因緣),1992,Ballad,,사랑이 무엇인지 아픔이 무엇인지 아직 알 순 없지만 인연이 끝난후에 후회하지는 않겠지 알수 없는 거잖아 사랑한 사람들은 이렇게 얘길하지 후회하는 거라고 하지만 사랑않고 혼자서 살아간다면 더욱 후회한다고 사랑을 하면서도 후회해도 한평생을 살 사람아 정주고 사는 인생 힘들어도 당신만을 사랑하리라  결혼이 무엇인지 사는게 무엇인지 아직 알순 없지만 몇년이 지난후에 후회하지는 않겠지 알 수 없는거잖아 살아본 사람들은 이렇게 얘길하지 후회하는 거라고 하지만 둘이아닌 혼자서 살아간다면 더욱 후회한다고 사랑을 하면서도 후회해도 한평생을 살 사람아 정주고 사는 인생 힘들어도 당신만을 사랑하리라  사랑을 하면서도 후회해도 한평생을 살 사람아 정주고 사는 인생 힘들어도 당신만을 사랑하리라 사랑을 하면서 후회는 왜하나 정들어 사는 인생 힘들어도 당신만을 사랑하리라
1993.05.16~05.22,3,54227,너에게 원한건,노이즈,Sound Shock,1992.11,Dance,홍종구,오늘도 우린 함께 했지 흠  난 또 한 번 느꼈어  너도 날 사랑하고 있다는 걸  항상 난 너만을 이해하려고 하지만  너는 언제나 너의 뜻대로만 움직였지  너에게 원한 건 (너에게 원한 건)  어려운 고백은 아냐 (아니야)  날 사랑하는 것만큼 표현해주는 것  (내가) 느낄 수 있도록  - 연 주 중 - 너는 진실한 마음을 깊이 감추고  그냥 장난스런 겉모습으로 날 대하지만  난 아무 상관 없어 그렇게 날 대하는 너  또한 어색한 걸  난 알 수 있어  너에게 원한 건 (너에게 원한 건)  어려운 부탁은 아냐 (아니야)  서로 관심을 조금씩만 가져주는 것  서로 느낄 수 있도록   오늘도 우린 함께 했지 흠  난 또 한 번 느꼈어  너도 날 사랑하고 있다는 걸  이젠 내게서 달아나려고 하지마  너의 맘을 내게 모두 다 들켜버렸으니까  너에게 원한 건 (너에게 원한 건)  어려운 고백은 아냐 (아니야)  날 사랑하는 것만큼 표현해주는 것  너에게 원한 건 (너에게 원한 건)  어려운 부탁은 아냐 (아니야)  서로 관심을 조금씩만 가져주는 것  서로 느낄 수 있도록
1993.05.16~05.22,4,54414,난 멈추지 않는다,잼,Zam,1992,Dance,조진호,이제 모든걸 다시 시작해 내겐 아직도 시간이 있어 때론 상처가 좌절로 남아 돌이킬수 없는 후회도 하고  그러나 우리 잊어선 안돼 지금의 나는 내가 아닌걸 신문에 실려온 얘기들 헝클어진 우리들을 탓할순 없어  이제 모든걸 다시 시작해 이렇게 여기서 끝낼순 없어 내겐 아직도 시간이 있어 지금 이렇게 지금 멈출수는 없어  신문에 실려온 얘기들 헝클어진 우리들을 탓할순 없어  이제 모든걸 다시 시작해 이렇게 여기서 끝낼순 없어 내겐 아직도 시간이 있어 지금 이렇게 지금  나는 여기서 멈출순 없어 이제 모든걸 다시 시작해  나는 여기서 멈출순 없어 이제 모든걸 다시 시작해
1993.05.16~05.22,5,54376,언젠가는,이상은,Darkness - 언젠가는,1993.01.01,Ballad,이상은,젊은 날엔 젊음을 모르고  사랑할땐 사랑이 보이지 않았네  하지만 이제 뒤돌아 보니  우리 젊고 서로 사랑을 했구나  눈물같은 시간의 강위에  떠내려가는건 한다발의 추억  그렇게 이제 뒤돌아 보니  젊음도 사랑도 아주 소중했구나  언젠가는 우리 다시 만나리  어디로 가는지 아무도 모르지만  언젠가는 우리 다시 만나리  헤어진 모습 이대로   젊은날엔 젊음을 잊었고  사랑할땐 사랑이 흔해만 보였네  하지만 이제 생각해 보니  우린 젊고 서로 사랑을 했구나  언젠가는 우리 다시 만나리  어디로 가는지 아무도 모르지만  언젠가는 우리 다시 만나리  헤어진 모습 이대로  언젠가는 우리 다시 만나리  어디로 가는지 아무도 모르지만  언젠가는 우리 다시 만나리  헤어진 모습 이대로
1993.05.16~05.22,6,3622706,아라비안 나이트,김준선,`90 KBS 대학가요축제,1995.11.15,Ballad,김준선,이토록 뛰는 가슴 그때는 몰랐었네 내 마음에 꿈을 심은 환상의 아라비안 나이트 어제는 잊어버려 오늘을 사랑하네 내 마음에 꿈을 심은 환상의 아라비안 나이트 어느덧 세월은 흘러 한동안 꿈을 잃어 버렸네 그러나 이제는 돌아와 행복한 옛날로 또 또 히야오와 히야오와 히야오와 예 히야오와 히야오와 히야오와 예 그건 언제나 나의 꿈 그건 언제나 나의 꿈 불타는 태양 밑에 울부짖는 사하라 내 마음에 꿈을 펼친 그것은 아라비안 나이트 아라비아 음악에 젖어서 이리 저리 춤도 추어보고 나는 또 바이킹이 되어서 푸른 바다에 나가 히야오와 히야오와 히야오와 예 히야오와 히야오와 히야오와 예 그건 언제나 나의 꿈 그건 언제나 나의 꿈 불타는 태양 밑에 울부짖는 사하라 내 마음에 꿈을 펼친 그것은 아라비안 나이트 내 마음에 꿈을 펼친 그것은 아라비안 나이트
1993.05.16~05.22,7,91407,그래도 이제는,김종서,2nd Step (PETSDN2),1993.04.01,Rock,채정은,그 모든건 어린 내가 꿈꾸던 그대로 되지는 않았어 내가 너무 쉽게 생각했었나 아니면 약해서인가 사람도 무섭고 사랑은 더 힘들고 가끔씩은 많지 않은 나이가 오히려 부담이됐지 작은일도 책임져야한다는 의무도 숨막히게해 걷지도 못할만큼 고민도 쌓이지만 그래도 이제는 앞만 보며 가는 거야 날 기다릴 세상이 있으니  걷지도 못할만큼 고민도 쌓이지만 그래도 이제는 앞만 보며 가는 거야 날 기다릴 세상이 있으니 그래도 이제는 앞만 보며 가는 거야 날 기다릴 세상이 있으니  그래도 이제는 앞만 보며 가는 거야 날 기다릴 세상이 있으니 그래도 이제는 앞만 보며 가는 거야 날 기다릴 세상이 있으니
1993.05.16~05.22,8,91406,너의 결혼식,윤종신,Sorrow (1st Edition),1992,Ballad,박주연,몰랐었어 네가 그렇게 예쁜지 웨딩드레스 하얀 네 손엔 서글픈 부케 수줍은 듯한 네 미소 이해할게 너의 부모님 말씀을 지금 보니 네 옆의 그 사람은 널 아마 행복하게 해 줄 꺼야 하지만 넌 잊을 수 있니 그 맹세 마지막을 함께 하자던 울었잖아 촛불을 켜고 무엇도 우릴 갈라 놀 순 없다고 세상 그 누구보다 난 널 알잖아 순결한 너의 비밀 너의 꿈을 나를 보지만 지금 니 모습에 우는 날 난 지키고 있을게 촛불의 약속 괜찮아 너는 잠시 잊어도 돼 널 맡긴거야 이 세상은 잠시 뿐인걸  하지만 넌 잊을 수 있니 그 맹세 마지막을 함께 하자던 울었잖아 촛불을 켜고 무엇도 우릴 갈라 놀 순 없다고 세상 그 누구보다 난 널 알잖아 순결한 너의 비밀 너의 꿈을 나를 보지만 지금 니 모습에 우는 날 난 지키고 있을게 촛불의 약속 괜찮아 너는 잠시 잊어도 돼 널 맡긴거야 이 세상은 잠시 뿐인걸 세상 그 누구보다 난 널 알잖아 순결한 너의 비밀 너의 꿈을 나를 보지만 지금 니 모습에 우는 날 난 지키고 있을게 촛불의 약속 괜찮아 너는 잠시 잊어도 돼
1993.05.16~05.22,9,91403,방황,이승철,이승철,1992.11.01,Ballad,이승철,매일 신문에 나고 있는 건 골치 아픈 사연들일 뿐 지금이라도 늦진 않았어 이 거리로 뛰어 나가 보면 술에 취해 거릴 보면 어지러운 깜깜한 밤 유혹하듯 날 쳐다 보는 초점 없는 시선 시선 어딜 가야 찾을 수 있을까  어딜 가야 찾을 수 있을까  파란 넥타이 줄 무늬 팬티 그것 만이 전부는 아냐 까만 내 방을 밝게 비춰 줄 사랑을 찾아 또 나 떠나 가네  어딜 가야 찾을 수 있을까  어딜 가야 찾을 수 있을까  파란 넥타이 줄 무늬 팬티 그것 만이 전부는 아냐 까만 내 방을 밝게 비춰 줄 사랑을 찾아 또 나 떠나 가네  어딜 가야 찾을 수 있을까  어딜 가야 찾을 수 있을까  파란 넥타이 줄 무늬 팬티 그것 만이 전부는 아냐 까만 내 방을 밝게 비춰 줄 사랑을 찾아 또 나 떠나 가네 파란 넥타이 줄 무늬 팬티 그것 만이 전부는 아냐 까만 내 방을 밝게 비춰 줄 사랑을 찾아 또 나 떠나 가네
1993.05.16~05.22,10,106047,걸어서 하늘까지,장현철,걸어서 하늘까지 OST,1993.01.18,"Drama,Rock",,눈 내리는 밤은 언제나 참기 힘든 지난 추억이  가슴 깊은 곳에 숨겨둔 너를 생각하게 하는데  어둔 미로 속을 헤매던 과거에는  내가 살아가는 그 이유 몰랐지만  하루를 살 수 있었던 건 네가 있다는 그 것  너에게 모두 주고 싶어 너를 위하여  마지막 그 하나까지  말이 없이 살아가라고 아주 쉽게 충고하지만  세상사는 어떤 사람도 강요하지 못해 나에게  어둔 미로 속을 헤매던 과거에는  내가 살아가는 그 이유 몰랐지만  하루를 살 수 있었던 건 네가 있다는 그 것  너에게 모두 주고 싶어 너를 위하여  걸어서 저 하늘까지
1993.05.16~05.22,11,193014,먼 훗날,박정운,추억만들기 4,1999.03.01,Ballad,박정운,잊으려 잊으려 해도  잊을 수 없는 그 얼굴 지우려 지우려 해도  지울 수 없는 그 이름  이별을 아쉬워하며  나의 품에 안겨 고개 숙인 너 가슴 속 깊이 간직한  네게 하고 싶었던  그 한마디 남겨둔 채  돌아서는 슬픈 내 모습 뒤로 울먹이는 너를 느끼며 먼 훗날에 너를 다시 만나면 사랑했다 말을 할거야   때로는 외로움 속에 때로는 아쉬움 속에 세월이 흐른 어느 날 난 홀로 울고 말았지  이별을 아쉬워하며 나의 품에 안겨 흐느끼는 너 마음속 깊이 간직한  네게 하고 싶었던  그 한마디 말 못하고  돌아서는 슬픈 내 모습 뒤로 울먹이는 너를 느끼며 먼 훗날에 너를 다시 만나면 사랑했다 말을 할거야   돌아서는 슬픈 내 모습 뒤로 울먹이는 너를 느끼며 너는 나의 마음 알고 있을까 너를 진정 사랑했다고  먼 훗날에 너를 다시 만나면 사랑했다 말을 할거야 -
1993.05.16~05.22,12,1003900,각자의 길,EOS,E.O.S Live,1993.11.01,Dance,신해철,우연히 찾아갔던 친구의 생일파티에서 난 너를 보았네 그렇게 웃음띤 얼굴로 너는 내 친구곁에 있었지 창백해진 얼굴의 나에게 친구들은 걱정스런 눈빛으로 이유를 자꾸 내게 묻지만 아무말도 할 수가 없었어 당황한 내 모습 보이고 싶지는 않았지만 하필 많고 많은 사람중에 내 친구를 택했는가 너와 나의 눈빛이 마주 친 그때 난 잊지못해 너는 그렇게도 태연하게 미소를 띄고 앉아있다 이제 너와나는 서로가 영원히 다시 올수없는 각자의 길을가네 이제 너와나는 서로가 영원히 아무 느낌없는 타인이 되어가는가  창백해진 얼굴의 나에게 친구들은 걱정스런 눈빛으로 이유를 자꾸 내게 묻지만 아무말도 할 수가 없었어 내가 생각 할 수 있는 최대의 모욕적인 말을 너의 눈앞에서 하고싶다 수많은 사람들 앞에서 아마 오래가지 않을꺼야 곧 너에 대해 알게될꺼야 예쁜 얼굴 뒤에 감추어진 너의 본 모습을 이제 너와나는 서로가 영원히 다시올 수 없는 각자의 길을 가네 이제 너와나는 서로가 영원히 아무 느낌없는 타인이 되어가는가
1993.05.16~05.22,13,54974,햄,김승기,Chanel No.25,1992.09.01,Ballad,김승기,네가 떠나는 날 난 생각했지 비 바람이 몰아쳐 비행기가 못 뜨기를 그건 슬픈 기대였어 미래의 꿈을 따라 넌 떠나 버렸으니 지금 내게 남은 건 불 확실한 미래와 널 향한 그리움 뿐 내안에 있는 그대 내 곁엔 없어 늘 내게 꿈과 사랑함을 준 그대 하늘 위 저 바다로 구름배 타고 내 시린 빈 손 따뜻하게 잡던 그대 우리 만남에서 헤어짐은 그리 멀지 않더니 헤어진 후 만남까진 왜 이다지 먼건지 하늘은 알고 있겠지 이 땅 위의 슬픔을 또 지금의 우리에게 다가오는 내일을 언젠가 내 품에 안길 그 날을 난 매일 꿈꾸며 잠시라도 그댈 잊고 지내지 않아요 그대를 부름과 기다림 내 생활의 일부가 되어 보이지 않는 사랑의 끈을 난 오늘도 그대에게로  너는 내게 늘 기다려진 사람으로 남는데 나는 네게 잊혀진 얼굴이 되어있는건 아닐까 우리 만남에서 헤어짐은 그리 멀지 않더니 헤어진 후 만남까진 왜 이다지 먼건지 하늘은 알고 있겠지 이 땅 위의 슬픔을 또 지금의 우리에게 다가오는 내일을 언젠가 내 품에 안길 그 날을 난 매일 꿈 꾸며 잠시라도 그댈 잊고 지내지 않아요 그대를 부름과 기다림 내 생활의 일부가 되어 보이지 않는 사랑의 끈을 난 오늘도 그대에게로  너를 그리는 나의 마음도 붉은 노을이 되어 묻혀가고 너를 찾는 나의 외로움이 하늘을 가득 채우고 또 채우고 있네
1993.05.16~05.22,14,108031,사랑하지 않을 거야,나현희,사랑을 위하여 OST,1993.03,Drama,,어딘가에 있는줄 알면서도  만날수 없는 현실이 싫어  왜 자꾸 눈물이 나는걸까  이제는 소용이 없는데  이렇게 끝날줄을 알았다면  시작도 하지 않았을텐데  이미 늦어버린 지금에  후회는 의미없는걸  앞으로 보내야할 시간이 두려워  견딜수 없이 길게만 느껴져  어떤 아픔이와도 참아야지  고통은 지나가는 순간일뿐  한번쯤 만나고 싶다는   생각들겠지  깊이 사랑하니까  하지만 혼자남는 법을 알때까지  다시 사랑하지 않을꺼야  앞으로 보내야할 시간이 두려워  견딜수 없이 길게만 느껴져  어떤 아픔이와도 참아야지  고통은 지나가는 순간일뿐  한번쯤 만나고 싶다는   생각들겠지  깊이 사랑하니까  하지만 혼자남는 법을 알때까지  다시 사랑하지 않을꺼야  한번쯤 만나고 싶다는  생각들겠지 깊이 사랑하니까 하지만 혼자남는 법을 알때까지 다시 사랑하지 않을꺼야
1993.05.16~05.22,15,54517,가을편지,김민기,Past Life Of Kim MinGi,2004.10.19,Folk,고은,가을엔 편지를 하겠어요 누구라도 그대가 되어 받아 주세요 낙엽이 쌓이는 날 외로운 여자가 아름다워요 가을엔 편지를 하겠어요 누구라도 그대가 되어 받아 주세요 낙엽이 흩어진 날 헤매인 여자가 아름다워요 가을엔 편지를 하겠어요 모든 것을 헤매인 마음 보내드려요 낙엽이 사라진 날 모르는 여자가 아름다워요 아름다워요
1993.05.16~05.22,16,2981575,나의 노래,김광석,나의 노래,1992.03.20,Folk,한동헌,아무 것도 가진 것 없는 이에게  시와 노래는 애달픈 양식  아무도 뵈지 않는 암흑속에서  조그만 읊조림은 커다린 빛  나의 노래는 나의 힘  나의 노래는 나의 삶  자그맣고 메마른 씨앗속에서 내일의 결실을 바라보듯이  자그만 아이의 읊음 속에서  마음의 열매가 맺혔으면  나의 노래는 나의 힘  나의 노래는 나의 삶   거미줄처럼 얽힌 세상속에서  바람에 나부끼는 나무가지처럼  흔들리고 넘어져도  이세상속에는 마지막 한방울의 물이 있는 한  나는 마시고 노래하리 나는 마시고 노래하리  수많은 진리와 양심의 금문자  찬란한 그빛에는 멀지 않으리  이웃과 벗들의 웃음속에는  조그만 가락이 울려 나오면 나는 부르리 나의 노래를  나는 부르리 가난한 마음을  그러나 그대 모두 귀기울일 때  노래는 멀리 멀리 날아가리  노래는 멀리 멀리 날아가리
1993.05.16~05.22,17,91396,모두 잠든 후에,김원준,눈에 띄고 싶어 1집,1992.10.20,Dance,김원준,가냘픈 네 모습에 할 말을 잊었던 것 같아 이젠 언제까지나 숨 죽여 널 지키고 바라보려 해 내가 여기 서 있는 이유 하루에 한순간 조차 너의 존재를 잊지 못해 반쪽이 되어 버렸지 남겨진채 부서지는 내 마음 모두 잠든 후에 사랑 할거야 아무도 모르게 마음으로 모두 잠든 후에 기억하는 건 많아도 내 놓쳐버린 순간들의 한숨 뿐 내가 여기 서 있는 이유 하루에 한순간 조차 너의 존재를 잊지못해 반쪽이 되어 버렸지 남겨진채 부서지는 내 마음 모두 잠든 후에 사랑할거야 아무도 모르게 마음으로 모두 잠든 후에 기억하는 건 많아도 내 놓쳐버린 순간들의 한숨 뿐 모두 잠든 후에 사랑할거야 아무도 모르게 마음으로 모두 잠든 후에 기억하는 건 많아도 내 모두 잠든 후에 사랑 할거야 모두 잠든 후에 사랑 할거야
1993.05.16~05.22,18,57339,너를 사랑해,한동준,처음 받은 느낌으로,1993.01,Ballad,한동준,아침이 오는 소리에 문득  잠에서 깨어 내 품안에 잠든 너에게  워우우워 우워워 너를 사랑해  내가 힘겨울때마다 너는  항상 내 곁에  따스하게 어깨 감싸며  워우우워 우워워 너를 사랑해 영원히 우리에겐 서글픈  이별은 없어 때로는 슬픔에 눈물도 흘리지만 언제나 너와 함께 새하얀  꿈을 꾸면서 하늘이 우리를 갈라놓을 때까지 워우우워 우워워 너를 사랑해 내가 힘겨울때마다 너는  항상 내 곁에 따스하게 어깨 감싸며  워우우워 우워워 너를 사랑해 영원히 우리에겐 서글픈  이별은 없어 때로는 슬픔에 눈물도 흘리지만 언제나 너와 함께 새하얀  꿈을 꾸면서 하늘이 우리를 갈라놓을 때까지 워우우워 우워워 너를  사랑해 너를 사랑해
1993.05.16~05.22,19,111572,그대안의 블루,"김현철,이소라",그대안의 블루 OST,1992,Korean Movie,이현승,난 난 눈을 감아요 빛과 그대 모습 사라져 이제 어둠이 밀려오네 저 파란 어둠 속에서 그대 왜 잠들어 가나 세상은 아직 그대 곁에 있는데 사랑은 아니지만 우리의 만남 어둠은 사라지네 워 시간은 빛으로 물들어 또 다시 흐르네 내 눈빛속 그대 난 난 꿈을 꾸어요 그대 와의 시간은 멈춰지고  이제 어둠이 밀려오네 빛 바랜 사랑 속에서 그대 왜 잠들려 하나 시간은 오 아직 그대  곁에 있는데 사랑은 아니지만 우리의 만남 어둠은 사라지네 워 시간은 빛으로 물들어 또 다시 흐르네 그대 눈빛 속에 나 내 눈빛 속 그대
1993.05.16~05.22,20,57519,잠 못 드는 밤 비는 내리고,김건모,김건모1집 - 잠못드는 밤 비는 내리고,1992,Dance,김창환,슬픈 노래는 듣고 싶지않아  내 마음 속에 잠들어있는 네가  다시 나를 찾아와 나는 긴긴  밤을 잠 못들것 같아  창밖에 비가 내리면 우두커니  창가에 기대어 앉아  기타를 퉁기며 노래를 불렀지  네가 즐겨듣던 그 노래  창밖을 보면 비는 오는데 괜시리  마음만 울적해  울적한 마음을 달랠 수가 없네  잠도 오지 않는 밤에  이젠 나의 희미한 기억 속에 너는  점점 더 멀어져가고  너의 슬픈 미소만이 나의  마음속에 가득 남아 흐르고 있어  이렇게 비가 오는 밤이면 너는  나를 더욱 슬퍼지게해  언제나 즐겨듣던 그 노래가  내 귓가에 아직 남아있는데  이렇게 비가오는 밤이면  내 지친 그리움으로 널 만나고  이 비가 그치고 나면 난 너를  찾아 떠나갈거야 슬픈 노래는 듣고 싶지않아  내 마음 속에 잠들어있는 네가  다시 나를 찾아와 나는 긴긴  밤을 잠 못들것 같아  창밖에 비가 내리면 우두커니  창가에 기대어 앉아  기타를 퉁기며 노래를 불렀지  네가 즐겨듣던 그 노래  두눈을 감고 잠을 청해도 비오는  소리만 처량해  비오는 소리에 내 마음 젖었네  잠도 오지 않는 밤에  이젠 나의 희미한 기억 속에  너는 점점 더 멀어져가고  너의 슬픈 미소만이 나의  마음속에 가득 남아 흐르고 있어  이렇게 비가 오는 밤이면 너는  나를 더욱 슬퍼지게해  언제나 즐겨듣던 그 노래가  내 귓가에 아직 남아있는데  이렇게 비가오는 밤이면 내 지친  그리움으로 널 만나고  이 비가 그치고 나면 난 너를  찾아 떠나갈거야 이렇게 비가오는 밤이면 내 지친  그리움으로 널 만나고  이 비가 그치고 나면 난 너를  찾아 떠나갈거야
1993.05.16~05.22,21,2118213,알려지지 않은 아라비안 나이트,김태우,Mutant,1993.01.01,Dance,최리라,밤하늘 향해 튀어오른 불빛들
1993.05.16~05.22,23,1517671,천년학 (대금 타이틀),VariousArtists,서편제 OST,1993.04.01,Korean Movie,,
1993.05.16~05.22,24,54182,다시만난 너에게,피노키오,다시만난 너에게,1992.11.30,Rock,,내가 처음 보았던 기억속에 파란 하늘빛 미소 여전한 넌 지난 시간 세월을 얘기하듯 야윈 모습으로 손을 내밀고 나 역시 서툰 웃음과 어색한 시간이 흐른 뒤 나의 맘 속에 맘으로 널 그리워 해왔었다 말했지  이젠 다시 사랑을 가슴에 묻고 나누어지는 슬픔은 없을꺼야  내안에 있는 소중한 것을 모두다 너에게 주고 싶어  나 역시 서툰 웃음과 어색한 시간이 흐른 뒤 나의 맘 속에 맘으로 널 그리워 해왔었다 말했지  이젠 다시 사랑을 가슴에 묻고 나누어지는 슬픔은 없을꺼야  내안에 있는 소중한 것을 모두다 너에게 주고 싶어  그리움에 보낸 날들은 너의 절실함을 일깨워주고  어떤 어려움에도 견딜 수 있는 널 향한 사랑에게 보여주었어  그리움에 보낸 날들은 너의 절실함을 일깨워주고
1993.05.16~05.22,25,54041,아껴둔 사랑을 위해,이주원,For Our Love Sake,1992,Ballad,박주연,기다려 내 몸을 둘러싼 안개 헤치고 투명한 모습으로 니 앞에 설때까지 기다려 막연했던 나의 덧없는 외출 헤매임 딛고 널 지켜줄때까지 찾지 못했어 내가 가야 할 길을 이 세상에 나만 홀로 던져진 것 같아 주저앉고 싶은 유혹도 많지만 알수없는 나의 미래가 너무 두려워 기다려줘 제발 난 니가 필요해 힘겨워도 꿈을 꾸는 건 너 때문인걸 아껴둔 우리 사랑을 위해 기다려 막연했던 나의 덧없는 외출 헤매임 딛고 널 지켜줄때까지 찾지 못했어 내가 가야 할 길을 이 세상에 나만 홀로 던져진 것 같아 주저앉고 싶은 유혹도 많지만 알수없는 나의 미래가 너무 두려워 기다려줘 제발 난 니가 필요해 힘겨워도 꿈을 꾸는 건 너 때문인걸 아껴둔 우리 사랑을 위해
